Rating,Review Title,Review,Cleaned Review Title,Cleaned Review,Subjectivity,Polarity,Sentiment,Emotion Scale
10.0,"In space, nobody can hear you s**t your pants","57 years ago Ellen Ripley (Sigourney Weaver) was part of the Nostromo spaceship's crew that encountered a terrifying alien, as the last remaining member of the crew she has drifted through space in hyper sleep. Awake and alive nobody believes her, so she is asked upon to support a Colonial Marine outfit as they go back to Moon LV-426 - a now colonized moon where the original Alien came from. They have recently gone dark and potentially abandoned the moon, and the authorities want to know why. The Colonial Marines are outfitted with state of the art warfare machinery and an arsenal to potentially deal with any threat.This is an amazing film - on par, if not better than the first in the series. It takes concepts from the first film, and then changes the approach and dynamic of the plot - expanding the universe in which the story unfolds. Some sequels just re-hash what came before them; this takes the original and does an A-Team transformation on it, attaching guns, lasers, nitro, bells and whistles. The end result is a genre bending action horror sci-fi chase war thriller masterpiece. There are explosions, special effects, gorgeous cinematography and mise-en-scene, great plot, thrilling story, top actors delivering excellent performances, scares, frights, fights, character development - oh believe me, I could go on singing the praises of this film. When James Cameron was given the reigns to this after Ridley Scott's seminal ""Alien"" film a lot of film-goes where dubious - but given the proof of the ""Terminator"" movie, Cameron had the pedigree to be successful and boy did he deliver! Not just a tour-de-force of a visual spectacle, but also a film lecturers dream as the material further promotes lots of themes and discussions - none more than the heroine who is the vehicle for plot. If the first film made people look at Sigourney Weaver differently, this film went a long way to elevating her star power as she totally flipped action hero conventions on their head - to this day her performance is still synonymous with being a major player in the change from masculine dominated cinema. The matriarchal bond shown between Ripley and Newt is great, the character development goes some way to showing an attempt to fix the fragility of the broken bond exemplified at the start of the film when it becomes clear that Ripley's own biological daughter is resentful of the unjustified absence of a mother. Another well documented discussion this film birthed deals with the parallels to war films, and in particularly Vietnam themed war film - however rather than shoehorning academic thesis' into this review I'll just say that the film did more than just entertained, it became an icon in cinema.I seriously cannot give this film less than 10 out of 10. It scared, thrilled and entertained me as a child when I watched it (admittedly under the legal age), and it still keeps a smile on my face as I watch it as an adult.",space nobody can hear you s t your pants,57 years ago ellen ripley sigourney weaver was part nostromo spaceships crew that encountered terrifying alien as last remaining member crew she has drifted through space hyper sleep awake alive nobody believes her so she is asked upon support colonial marine outfit as they go back moon lv 426 now colonized moon where original alien came they have recently gone dark potentially abandoned moon authorities want know why colonial marines are outfitted with state art warfare machinery arsenal potentially deal with any threat this is amazing film par if not better than first series it takes concepts first film then changes approach dynamic plot expanding universe which story unfolds some sequels just re hash what came before them this takes original does team transformation it attaching guns lasers nitro bells whistles end result is genre bending action horror sci fi chase war thriller masterpiece there are explosions special effects gorgeous cinematography mise en scene great plot thrilling story top actors delivering excellent performances scares frights fights character development oh believe me i could go singing praises this film when james cameron was given reigns this after ridley scotts seminal alien film lot film goes where dubious but given proof terminator movie cameron had pedigree be successful boy did he deliver not just tour de force visual spectacle but also film lecturers dream as material further promotes lots themes discussions none more than heroine who is vehicle plot if first film made people look at sigourney weaver differently this film went long way elevating her star power as she totally flipped action hero conventions their head this day her performance is still synonymous with being major player change masculine dominated cinema matriarchal bond shown between ripley newt is great character development goes some way showing attempt fix fragility broken bond exemplified at start film when it becomes clear that ripleys own biological daughter is resentful unjustified absence mother another well documented discussion this film birthed deals with parallels war films particularly vietnam themed war film however rather than shoehorning academic thesis into this review ill just say that film did more than just entertained it became icon cinema i seriously cannot give this film less than 10 out 10 it scared thrilled entertained me as child when i watched it admittedly under legal age it still keeps smile my face as i watch it as adult,0.5147992530345472,0.14066293183940237,Positive,"{'Happy': 0.11, 'Angry': 0.07, 'Surprise': 0.32, 'Sad': 0.14, 'Fear': 0.36}"
10.0,Hands down one of the best sequels ever!,"Back in 1986, sequels had become very common (Superman, Star Wars, Indiana Jones), yet people were suspicious when they heard of a follow-up to Alien, Ridley Scott's acclaimed sci-fi horror from 1979. Most of the criticism was aimed at the fact that Scott had nothing to do with the new movie, which had been entrusted to an unknown (at the time) named James Cameron. Fortunately, Cameron had shown he knew the genre two years earlier with The Terminator, and by perfecting the skills he had developed on that film he delivered Aliens, which still stands out as one of the greatest science fiction flicks of all time.Given how the first film ended (all characters but one died), Cameron wisely decided to radically separate his movie from the original, and he does so from the very beginning by having Ripley (Sigourney Weaver) wake up from her cryogenic sleep and make a shocking discovery: although she hasn't aged at all, 57 years have passed since she left the Nostromo, meaning everyone she knew is either dead or very old (in a particularly heartbreaking scene, she talks on the phone with her grown-up daughter, who is full of resentment for her ""unjustified"" absence). In addition, no one believes her story regarding the alien since, as she's told by scientist Carter Burke (Paul Reiser), the planet where these creatures allegedly lived has been successfully colonized. Suddenly, though, all communications with LV-426 are inexplicably interrupted. Thinking there might be some truth to Ripley's tale, Burke asks her to join him and a group of soldiers on a mission to uncover the mystery. And while most of the participants are in it just for the money, our heroine realizes this is her only chance of confronting her worst nightmare and overcoming it for good.The main problem with Alien, some have said, was that, as great as it can be, the characterizations were reduced to the minimum (not that it really mattered, with Ridley Scott ensuring the film retained the right pace and suspense throughout). With Aliens, character development is the last thing fans should worry about, Cameron being fully aware of each individual's potential and exploiting it as much as he can. Ripley, who was just part of an ensemble in the original, is now allowed to carry the whole film, and boy, does she carry it: rarely has there been a more solid, compelling female role in a genre movie like this (the fact that Sigourney Weaver is the only actress, thus far, to have received an Oscar nomination for a science-fiction film is further testament to Aliens' immortality). The supporting cast is equally good, with a multitude of different characters ranging from funny (regular Cameron collaborators Michael Biehn and Bill Paxton) to weird (Lance Henriksen's android Bishop) and bringing something extra to the movie's unique atmosphere.Ah, the film's mood: that's the other aspect Cameron deserves all the credit in the world for. On a superficial level, it could be said Alien was a horror movie, while the follow-up is more action-oriented; that may be true, but one should also notice that every single spectacular battle scene actually oozes tension, never leaving the audience with a pause to breathe or relax. In fact, Cameron has succeeded where many other directors would have failed: he stayed faithful to the original's tone, but managed nonetheless to make the film undeniably his own.Relentlessly creepy, occasionally very violent and consistently compelling, Aliens is a pitch-perfect piece of adult science-fiction. Watch it on a double bill with Scott's version and you will get four hours of genre film-making at its finest.",hands down one best sequels ever,back 1986 sequels had become very common superman star wars indiana jones yet people were suspicious when they heard follow up alien ridley scotts acclaimed sci fi horror 1979 most criticism was aimed at fact that scott had nothing do with new movie which had been entrusted unknown at time named james cameron fortunately cameron had shown he knew genre two years earlier with terminator by perfecting skills he had developed that film he delivered aliens which still stands out as one greatest science fiction flicks all time given how first film ended all characters but one died cameron wisely decided radically separate his movie original he does so very beginning by having ripley sigourney weaver wake up her cryogenic sleep make shocking discovery although she hasnt aged at all 57 years have passed since she left nostromo meaning everyone she knew is either dead or very old particularly heartbreaking scene she talks phone with her grown up daughter who is full resentment her unjustified absence addition no one believes her story regarding alien since as shes told by scientist carter burke paul reiser planet where these creatures allegedly lived has been successfully colonized suddenly though all communications with lv 426 are inexplicably interrupted thinking there might be some truth ripleys tale burke asks her join him group soldiers mission uncover mystery while most participants are it just money our heroine realizes this is her only chance confronting her worst nightmare overcoming it good main problem with alien some have said was that as great as it can be characterizations were reduced minimum not that it really mattered with ridley scott ensuring film retained right pace suspense throughout with aliens character development is last thing fans should worry about cameron being fully aware each individuals potential exploiting it as much as he can ripley who was just part ensemble original is now allowed carry whole film boy does she carry it rarely has there been more solid compelling female role genre movie like this fact that sigourney weaver is only actress thus far have received oscar nomination science fiction film is further testament aliens immortality supporting cast is equally good with multitude different characters ranging funny regular cameron collaborators michael biehn bill paxton weird lance henriksens android bishop bringing something extra movies unique atmosphere ah films mood thats other aspect cameron deserves all credit world superficial level it could be said alien was horror movie while follow up is more action oriented that may be true but one should also notice that every single spectacular battle scene actually oozes tension never leaving audience with pause breathe or relax fact cameron has succeeded where many other directors would have failed he stayed faithful originals tone but managed nonetheless make film undeniably his own relentlessly creepy occasionally very violent consistently compelling aliens is pitch perfect piece adult science fiction watch it double bill with scotts version you will get four hours genre film making at its finest,0.5379960353037276,0.11385804010804008,Positive,"{'Happy': 0.08, 'Angry': 0.03, 'Surprise': 0.2, 'Sad': 0.24, 'Fear': 0.45}"
10.0,This ain't a film.,"THE sci-fi movie. It's nearly perfect in every way: storyline, characters, menacing threat, suspense, action, direction, music, emotion, etc... It's always been a favorite of mine and still is. To me this is not just a film, it is an experience. The adrenaline pumps like in no other film and rarely have we had the chance to see a heroine as compelling as Sigourney Weaver. She can kick anyone's ass and still keep a heart and soul. (Why she didn't win the Oscar back in 1986 is beyond me.) When the action starts, you're in for the ride of your life. Truly a milestone in movie making. Now if they could only release it on DVD...",this aint film,sci fi movie its nearly perfect every way storyline characters menacing threat suspense action direction music emotion etc its always been favorite mine still is me this is not just film it is experience adrenaline pumps like no other film rarely have we had chance see heroine as compelling as sigourney weaver she can kick anyones ass still keep heart soul why she didnt win oscar back 1986 is beyond me when action starts youre ride your life truly milestone movie making now if they could only release it dvd,0.5886363636363636,0.1965909090909091,Positive,"{'Happy': 0.06, 'Angry': 0.06, 'Surprise': 0.11, 'Sad': 0.33, 'Fear': 0.44}"
9.0,ALIENS IS THE SCI-FI GENRE,"""Aliens"" is the best trapped-with-a-monster-right-behind-you movie of all time. The weird part is that it's not the first of its kind. Usually, the first of a genre is always the best but these kinds of movies were made decades-and-decades before 1986's ""Aliens."" Still, through its strong story and characters, it elbows its way to the head of the class.Ripley is a heroine like no other. She thrills you. Her powerful presence and unstoppable soul will always live on in the minds of movie-goers. She and Newt form a surrogate mother-daughter relationship that is more touching than anything I've seen before in this kind of a movie. In this movie more than any other in the ""Alien"" series, Ripley's a woman who does what she can (and then some) to protect herself and the ones around her. She's the perfect action hero.On top of that, the pulsing music that plays while Bishop is speeding them away from the exploding compound and while Ripley is booting the Queen Alien out into space is beyond comparison.Note: If you LOVED this movie, it's probably best you don't see Alien 3. It, for some reason, turns the triumph of this film's conclusion into a depression deeper than the vastness of a hundred black holes.",aliens is sci fi genre,aliens is best trapped with monster right behind you movie all time weird part is that its not first its kind usually first genre is always best but these kinds movies were made decades decades before 1986s aliens still through its strong story characters it elbows its way head class ripley is heroine like no other she thrills you her powerful presence unstoppable soul will always live minds movie goers she newt form surrogate mother daughter relationship that is more touching than anything ive seen before this kind movie this movie more than any other alien series ripleys woman who does what she can then some protect herself ones around her shes perfect action hero top that pulsing music that plays while bishop is speeding them away exploding compound while ripley is booting queen alien out into space is beyond comparison note if you loved this movie its probably best you dont see alien 3 it some reason turns triumph this films conclusion into depression deeper than vastness hundred black holes,0.5618165784832452,0.2667127625460959,Positive,"{'Happy': 0.16, 'Angry': 0.02, 'Surprise': 0.28, 'Sad': 0.21, 'Fear': 0.33}"
9.0,Could Hardly Be Improved.,"Rarely does a sequel do greater justice to an idea than the original. But 'Aliens' manages it in spades.The music and sound score alone are absolutely mesmerising. If you haven't got a good system, you're missing-out big time. Here's a simple thing; just listen to the 3 latches locking into place when Ripley's 'lifeboat' is recovered by the deep-space explorer. You can't see them, but you can hear them, ker-k-link, each in succession, right around your sound stage. The noise tells you that they haven't just latched, but latched and locked. Listen with you eyes shut, if you don't believe me. It's that meticulous attention to detail both aural and visual that makes this movie a true work of art. There really is no need for the sounds to be there at all. But they are, and they convey complete fidelity to a scene that lasts just seconds. Here's another. When the marines are crossing the rain-swept depot to the airlock, its windy and wild. When they get inside, the ambiance completely changes. it's still noisy, the wind continues, faint but audible and there is lots of dripping water, but now there's also a strange, claustrophobic intimacy, and I'm quite at a loss as to how that has been accomplished. Yet the mood-change is hair-raisingly palpable. These set pieces are completely seamless throughout the movie. Strange, gloomy, suggestive, broken; the ghost of dead technology appears to haunt them as much as any alien demons. A thin, whining, electronic note does the work of tense music, it suits the circumstances perfectly, as well as providing a foil to any ambient sounds that the engineers and director thought appropriate. The sound and sets earned it two well-deserved Oscars.Tension builds and builds again. It's a fairly well-worn formula of gradual attrition. Ripley's valliant rescue of the ambushed and trapped space-marines must have any viewer at the edge of their seat. And on it goes, tighter and tighter, until finally we are squeezing through air-ducts. Acting is pretty formulaic but entirely believable. People we've quickly grown to like get killed suddenly and nastily, smug Apone, and macho Drake. The alien queen brings the movie to a perfect climax. Correct me if I'm wrong, but there was absolutely no CGI in this. Proof enough that it isn't actually needed, and is never as good as the real McCoy. And the script, by the way, is excellent.As a comment upon sexuality and survival it is a very telling one. The female is deadlier than the male. It draws from a simple Darwinian premise, that she makes a greater investment in the production of the young, and will therefore go to more determined and ruthless lengths to ensure their survival. She knows her genes are in the offspring: momma's baby, poppa's maybe. Males are simply expendable seed-carriers of convenience. I've docked a point for what strikes me as technological incongruity. The continued use of old-fashioned 'querty' keyboards for example, and CRT/VDU. The latter have all but gone to the scrap-heap now, never mind hundreds of years hence. Check-out the roll-up screens in 'Red Planet'; now that's more like it. Also, a sophisticated android like 'Bishop' surely suggests the probability of 'mechanised' marines. Or at least, a self-propelled remote for entering the alien hive. Bomb disposal squads already have those today. Bishop himself should have been able to simply plug-in and interface with the uplink. Or even communicate by WiFi. Though these things would compromise drama, their absence compromises its science-fiction credentials. And I am certainly no purist. But, golly-gosh! - nit-picking aside; this is an absolute crackerjack of entertainment.I believe it has only one other challenger for the crown of greatest sci-fi horror movie - Carpenter's 'The Thing'. You split 'em; I can't.It's 22 and 26 years since their creation, and no-one has managed to raise the bar. What does that tell you?",could hardly be improved,rarely does sequel do greater justice idea than original but aliens manages it spades music sound score alone are absolutely mesmerising if you havent got good system youre missing out big time heres simple thing just listen 3 latches locking into place when ripleys lifeboat is recovered by deep space explorer you cant see them but you can hear them ker k link each succession right around your sound stage noise tells you that they havent just latched but latched locked listen with you eyes shut if you dont believe me its that meticulous attention detail both aural visual that makes this movie true work art there really is no need sounds be there at all but they are they convey complete fidelity scene that lasts just seconds heres another when marines are crossing rain swept depot airlock its windy wild when they get inside ambiance completely changes its still noisy wind continues faint but audible there is lots dripping water but now theres also strange claustrophobic intimacy im quite at loss as how that has been accomplished yet mood change is hair raisingly palpable these set pieces are completely seamless throughout movie strange gloomy suggestive broken ghost dead technology appears haunt them as much as any alien demons thin whining electronic note does work tense music it suits circumstances perfectly as well as providing foil any ambient sounds that engineers director thought appropriate sound sets earned it two well deserved oscars tension builds builds again its fairly well worn formula gradual attrition ripleys valliant rescue ambushed trapped space marines must have any viewer at edge their seat it goes tighter tighter until finally we are squeezing through air ducts acting is pretty formulaic but entirely believable people weve quickly grown like get killed suddenly nastily smug apone macho drake alien queen brings movie perfect climax correct me if im wrong but there was absolutely no cgi this proof enough that it isnt actually needed is never as good as real mccoy script by way is excellent as comment upon sexuality survival it is very telling one female is deadlier than male it draws simple darwinian premise that she makes greater investment production young will therefore go more determined ruthless lengths ensure their survival she knows her genes are offspring mommas baby poppas maybe males are simply expendable seed carriers convenience ive docked point what strikes me as technological incongruity continued use old fashioned querty keyboards example crt vdu latter have all but gone scrap heap now never mind hundreds years hence check out roll up screens red planet now thats more like it also sophisticated android like bishop surely suggests probability mechanised marines or at least self propelled remote entering alien hive bomb disposal squads already have those today bishop himself should have been able simply plug interface with uplink or even communicate by wifi though these things would compromise drama their absence compromises its science fiction credentials i am certainly no purist but golly gosh nit picking aside this is absolute crackerjack entertainment i believe it has only one other challenger crown greatest sci fi horror movie carpenters thing you split em i cant its 22 26 years since their creation no one has managed raise bar what does that tell you,0.5004117063492063,0.09780505952380952,Positive,"{'Happy': 0.08, 'Angry': 0.06, 'Surprise': 0.21, 'Sad': 0.22, 'Fear': 0.43}"
10.0,The best Sci Fi action flick ever made,"What can I say that hasn't already been said? Every aspect of this movie is spot on, which I can only put down to James Cameron's obsessive attention to detail. The characters are distinct, memorable and believable. The plot builds slowly into the most tense, suspenseful roller-coaster ride I've ever experienced in the cinema. The special effects are good even by today's standards, and the sets are simply second to none. This is one of my top 10 favourite movies of all time.If you like this kind of movie and haven't seen this yet, what are you waiting for? Twenty years on and the only other Sci Fi action movie in the same league is James Cameron's Terminator 2. I can only hope he returns to this genre in the future, he is the master.Oh, and try to see the special extended edition if possible, the extra scenes make an amazing movie even better.",best sci fi action flick ever made,what can i say that hasnt already been said every aspect this movie is spot which i can only put down james camerons obsessive attention detail characters are distinct memorable believable plot builds slowly into most tense suspenseful roller coaster ride ive ever experienced cinema special effects are good even by todays standards sets are simply second none this is one my top 10 favourite movies all time if you like this kind movie havent seen this yet what are you waiting twenty years only other sci fi action movie same league is james camerons terminator 2 i can only hope he returns this genre future he is master oh try see special extended edition if possible extra scenes make amazing movie even better,0.541312358276644,0.23215702947845804,Positive,"{'Happy': 0.12, 'Angry': 0.0, 'Surprise': 0.5, 'Sad': 0.12, 'Fear': 0.27}"
