Rating,Review Title,Review,Cleaned Review Title,Cleaned Review,Subjectivity,Polarity,Sentiment,Emotion Scale
8.0,"Action, horror n science fiction combined in an amazing way.","I first saw this in the late 80s on a vhs.Revisited all the four parts in the early 2k on dvds which i own.Revisited this part (154 mins special edition version) few days back as i am on Alien movie marathon n very impatient to check out Prometheus n Covenant.This movie has some amazing star cast, lots of fireworks, intense action n claustrophobic horror.",action horror n science fiction combined amazing way,i first saw this late 80s vhs revisited all four parts early 2k dvds which i own revisited this part 154 mins special edition version few days back as i am alien movie marathon n very impatient check out prometheus n covenant this movie has some amazing star cast lots fireworks intense action n claustrophobic horror,0.5603174603174603,0.0764761904761905,Positive,"{'Happy': 0.07, 'Angry': 0.07, 'Surprise': 0.43, 'Sad': 0.21, 'Fear': 0.21}"
10.0,A masterpiece - one of the best epic-action films of all time my personal favorite,"Aliens (1986) is the best Epic Sci-Fi Classic Action Movie of all time and one of my personal favorite best action sci-fi flicks that I love to death. Just like I love The Terminator and T2, I love this movie to death. James Cameron's classic masterpiece. The now classic science fiction film was only the third feature directed by James Cameron (following Piranha Part Two, The Terminator). It is the sequel to the 1979 film Alien and Alien is a masterpiece I love that film, but I love this movie more sorry this is my personal opinion this is my movie. I am not saying it is better than the original movie but it is right up there with Alien a real classic. Ellen Ripley (Sigourney Weaver), the sole survivor from the original ""Alien"", returns to Earth after drifting trough space in hyper sleep for 57 years. Although her story about the Alien encounter is met with skepticism, she agrees to accompany a team of high-tech marines back to LV-426 and this time it's war! It has great cast I love the marines fighting aliens in this movie. The movie stars: Sigourney Weaver, Michael Biehn, Carrie Henn, Paul Reiser, Lance Henriksen, Bill Paxton, William Hope, Jenette Goldstein, Al Matthews, Mark Rolston , Ricco Ross, Colette Hiller, Daniel Kash ,Cynthia Dale Scott and Tip Tipping and they are all believable enough.I love the characters beside Ellen Ripley, Newt, Corporal Hicks, Bishop, Private Hudson, Private Vasquez, Sergeant Apone, Private Drake, Private Frost, Corporal Ferro, Private Spunkmeyer, Corporal Dietrich, Private Crowe I love those platoon of US Colonial Marines I know I haven't mentioned Burke because he was the bad guy and I don't like him. But most of the characters in this movie I love. I know it is a sci-fi action film but it also does a have a horror mixed together people just don't see that. There's plenty of horror in it. The nightmare sequence in the beginning, the creepy atmosphere of the LV-426 colony, and the heart pounding face hugger on the loose scene in the medical bay. You see mother of those aliens who cocooned all the humans and killed them you see Ripley finding the nest and fight the Alien queen on the end. Ripley faces her fear and gets over her PTSD by going in by herself to rescue the Girl/Fight the Aliens/and Destroy the Entire Nest...Battles One on One with an Alien Queen and Whips its' Ass...and, by the end, now both her and Newt can dream without the worry of any more Nightmares (which plagued Ripley at the beginning of the film).This is the finest action movie of all time. And, yet, believe it or not, it's not the action in the film itself that makes this be the case. This is especially odd in a movie with a $100 million budget (in 1986!), with multiple huge explosions, with thousands of bullets fired, and scores from James Horner of stuntmen used.10/10 I have the Blu-ray disc which it also have a special edition version on it I used to had this film on DVD but I throw it away because I bought the Blu-ray which I am very happy about it. I love this film to death it is my personal favorite sci-fi action film even Lance Henriksen from Hard Target and The Terminator is in here and he is the good guy.",masterpiece one best epic action films all time my personal favorite,aliens 1986 is best epic sci fi classic action movie all time one my personal favorite best action sci fi flicks that i love death just like i love terminator t2 i love this movie death james camerons classic masterpiece now classic science fiction film was only third feature directed by james cameron following piranha part two terminator it is sequel 1979 film alien alien is masterpiece i love that film but i love this movie more sorry this is my personal opinion this is my movie i am not saying it is better than original movie but it is right up there with alien real classic ellen ripley sigourney weaver sole survivor original alien returns earth after drifting trough space hyper sleep 57 years although her story about alien encounter is met with skepticism she agrees accompany team high tech marines back lv 426 this time its war it has great cast i love marines fighting aliens this movie movie stars sigourney weaver michael biehn carrie henn paul reiser lance henriksen bill paxton william hope jenette goldstein al matthews mark rolston ricco ross colette hiller daniel kash cynthia dale scott tip tipping they are all believable enough i love characters beside ellen ripley newt corporal hicks bishop private hudson private vasquez sergeant apone private drake private frost corporal ferro private spunkmeyer corporal dietrich private crowe i love those platoon us colonial marines i know i havent mentioned burke because he was bad guy i dont like him but most characters this movie i love i know it is sci fi action film but it also does have horror mixed together people just dont see that theres plenty horror it nightmare sequence beginning creepy atmosphere lv 426 colony heart pounding face hugger loose scene medical bay you see mother those aliens who cocooned all humans killed them you see ripley finding nest fight alien queen end ripley faces her fear gets over her ptsd by going by herself rescue girl fight aliens destroy entire nest battles one one with alien queen whips its ass by end now both her newt can dream without worry any more nightmares which plagued ripley at beginning film this is finest action movie all time yet believe it or not its not action film itself that makes this be case this is especially odd movie with 100 million budget 1986 with multiple huge explosions with thousands bullets fired scores james horner stuntmen used 10 10 i have blu ray disc which it also have special edition version it i used had this film dvd but i throw it away because i bought blu ray which i am very happy about it i love this film death it is my personal favorite sci fi action film even lance henriksen hard target terminator is here he is good guy,0.4673039353808585,0.17180684699915472,Positive,"{'Happy': 0.2, 'Angry': 0.05, 'Surprise': 0.15, 'Sad': 0.14, 'Fear': 0.45}"
10.0,Excellent sequel--matches the brilliance of the first film,"Series note: It is strongly advised that you watch this film only after seeing Alien (1979). This is a direct continuation of that story.57 years after the events of the first film, Ellen Ripley (Sigourney Weaver) is found and awakened from hyper sleep to discover that a terraforming colony has been set up on LV-426, the planet wherein she and her fellow crew of the mining cargo spaceship Nostromo first encountered the titular aliens. When Earth-based communications loses contact with LV-426, a band of marines are sent to investigate, taking Ripley and a representative from the company that financed the colony, Carter Burke (Paul Reiser) along for the ride.For the difficult job of following up Ridley Scott's excellent Alien, director James Cameron decided to go a completely different route--to make a fast moving, slightly tongue-in-cheek, boisterous action extravaganza. Remarkably, he was able to do that while still maintaining a stylistic and literary continuity that melds Aliens seamlessly with the first film.Ripley is much more fully developed in this film, although unfortunately, some of the most significant scenes were deleted from the theatrical release (if at all possible, watch the 2-hour and 37-minute director's cut instead). Cameron fashioned Aliens into a grand arc where Ripley's actions at the end of the film have much more meaning as she's not only fighting monsters, but also fighting to retain a semblance of something she lost due to her 57-year hyper sleep. As in the first film, she is still the most intelligent, courageous and resourceful member of the crew, but she has much more colorful company.The marines accompanying Ripley back to LV-426 may be too cartoonish for some tastes (as for viewers of that opinion, most of the action and the film overall is likely to be too cartoonish), but for anyone more agreeable to that kind of caricatured exaggeration, it's a joy to watch. I'm a big fan of both Bill Paxton and Lance Henriksen, and both turn in wonderfully over-the-top performances, at their diametrically opposed ends of the emotional spectrum--Paxton as the spastic surfer/redneck and Henriksen as the intense, moody sage, with a surprising reality and an even more surprising conscience to go along with it. We also get a cigar-chomping Sergeant, a crazy, butch Private, and a complex, pensive Corporal as main characters, and a mysterious, bright young girl (played in a terrific performance by Carrie Henn). Much of the center section of the film hinges on the interrelationships of these characters, despite the action trappings going on around them.Cameron carries over the crypt/labyrinth motif of the first film, and adds a metaphorical descent into the bowels of hell in the climax. The action throughout is suspenseful. Aliens contains one of my favorite ""cat fights"" in any film. It's also worth noting the influence this film may have had on Paul Verhoeven's Starship Troopers (1997)--although admittedly, we could say that Cameron was influenced a bit by the Robert A. Heinlein book, as well. Throughout all of the varied action sequences, as well as the important early scenes of colonists on LV-426, Cameron is able to clearly convey the logistics of very complex sets, so that viewers remain on the edges of their seats.Part of what makes the monsters so effective is that we're not told too much about them. We only get glimpses into their physiology's, their behavioral patterns and their intelligence. Cameron gives us just enough to become wrapped up in the film, but not so much that we become overly familiar with the aliens, or start to question the logic behind the film. He also smartly carries over some devices from the first film that were abandoned to an extent, such as the acidic blood of the aliens, and he supplies answers to the few questions that the first film raised, such as why the blood doesn't corrode instruments and objects when a dead alien is examined.Aliens is yet another example of a sequel that is just as good as an original film in a series. Just make sure you watch both in order, and try to watch the director's cuts.",excellent sequel matches brilliance first film,series note it is strongly advised that you watch this film only after seeing alien 1979 this is direct continuation that story 57 years after events first film ellen ripley sigourney weaver is found awakened hyper sleep discover that terraforming colony has been set up lv 426 planet wherein she her fellow crew mining cargo spaceship nostromo first encountered titular aliens when earth based communications loses contact with lv 426 band marines are sent investigate taking ripley representative company that financed colony carter burke paul reiser along ride difficult job following up ridley scotts excellent alien director james cameron decided go completely different route make fast moving slightly tongue cheek boisterous action extravaganza remarkably he was able do that while still maintaining stylistic literary continuity that melds aliens seamlessly with first film ripley is much more fully developed this film although unfortunately some most significant scenes were deleted theatrical release if at all possible watch 2 hour 37 minute directors cut instead cameron fashioned aliens into grand arc where ripleys actions at end film have much more meaning as shes not only fighting monsters but also fighting retain semblance something she lost due her 57 year hyper sleep as first film she is still most intelligent courageous resourceful member crew but she has much more colorful company marines accompanying ripley back lv 426 may be too cartoonish some tastes as viewers that opinion most action film overall is likely be too cartoonish but anyone more agreeable that kind caricatured exaggeration its joy watch im big fan both bill paxton lance henriksen both turn wonderfully over top performances at their diametrically opposed ends emotional spectrum paxton as spastic surfer redneck henriksen as intense moody sage with surprising reality even more surprising conscience go along with it we also get cigar chomping sergeant crazy butch private complex pensive corporal as main characters mysterious bright young girl played terrific performance by carrie henn much center section film hinges interrelationships these characters despite action trappings going around them cameron carries over crypt labyrinth motif first film adds metaphorical descent into bowels hell climax action throughout is suspenseful aliens contains one my favorite cat fights any film its also worth noting influence this film may have had paul verhoevens starship troopers 1997 although admittedly we could say that cameron was influenced bit by robert heinlein book as well throughout all varied action sequences as well as important early scenes colonists lv 426 cameron is able clearly convey logistics very complex sets so that viewers remain edges their seats part what makes monsters so effective is that were not told too much about them we only get glimpses into their physiologys their behavioral patterns their intelligence cameron gives us just enough become wrapped up film but not so much that we become overly familiar with aliens or start question logic behind film he also smartly carries over some devices first film that were abandoned extent such as acidic blood aliens he supplies answers few questions that first film raised such as why blood doesnt corrode instruments objects when dead alien is examined aliens is yet another example sequel that is just as good as original film series just make sure you watch both order try watch directors cuts,0.5271883267195768,0.20268353174603174,Positive,"{'Happy': 0.11, 'Angry': 0.02, 'Surprise': 0.28, 'Sad': 0.15, 'Fear': 0.45}"
10.0,One of the best films ever made.,"So often when you think of sequels you imagine cynical attempts to cash in on successful movies, efforts to bring in the coins with any old rubbish, when you think of the likes of Police Academy, Halloween and Jaws you can understand why, and then there is Aliens......Not often is a follow up as good as the original (and better in some ways,) but Aliens is, I would class it as one of the best movies of all time, a cinematic Masterpiece which seems to improve with age. It's a space horror, which is dramatic, action packed and funny at times.Aliens changed the genre, sci fi would never quite be the same again. This film will have you gripped, glued and on the edge of your seat, truly an adrenaline fuelled thrill ride, with amazing visuals, wonderful acting, and terrific music. Film makers of today watch and see how it should be done.A masterpiece. 10/10",one best films ever made,so often when you think sequels you imagine cynical attempts cash successful movies efforts bring coins with any old rubbish when you think likes police academy halloween jaws you can understand why then there is aliens not often is follow up as good as original better some ways but aliens is i would class it as one best movies all time cinematic masterpiece which seems improve with age its space horror which is dramatic action packed funny at times aliens changed genre sci fi would never quite be same again this film will have you gripped glued edge your seat truly adrenaline fuelled thrill ride with amazing visuals wonderful acting terrific music film makers today watch see how it should be done masterpiece 10 10,0.5602941176470588,0.3142156862745098,Positive,"{'Happy': 0.03, 'Angry': 0.06, 'Surprise': 0.56, 'Sad': 0.12, 'Fear': 0.22}"
10.0,James Cameron and Bill Paxton at their finest,"There are really good movies and then there's that select few that change your life. For me movies like Jaws, Raiders of the Lost Ark, JFK, Titanic and Star Wars did that. By viewing a movie you see life in a different light. Aliens also did that to me. I didn't think a movie could scare me as much as Halloween did but this one certainly did that and more. The atmosphere in this movie, and the lighting and cinematography and of course the direction are top notch, and some of the scenes are some of the scariest I've seen in my life time. But what puts this movie over the top as one of the all time greatest films ever made is the casting.Sigourney Weaver is terrific but it is her supporting cast that shines and makes you feel like you know the crew that is heading to that desolate planet.Paul Reiser is perfect as Burke,the slimy corporate kiss ass that cares about profit before human lives. Lance Henriksen shines as Bishop, the cyborg with a heart. Jeanette Goldstein is the rough around the edges female marine that more than holds her own with all the testosterone floating around and Michael Biehn ( another Cameron favourite )is the perfect quiet leader that leads by example and not so much a loud demonstrative voice. But the show stopper in this flick ( just as he always is in any movie that he is in ) is Bill Paxton.Paxton and Cameron have worked on Terminator 1, True Lies, Titanic and Aliens and Bill is one of those actors that steals scenes from every actor and was always a recognizable face even before Titanic. Here, his Hudson character is the comic relief but he is also perhaps one of the true characters that we can all identify with. His tough exterior is nothing more than camouflage for his frightened fragile interior. He realizes the dire situation that they are all in and he can't hide his fear. When he finds out that they won't be rescued for at least seventeen days, his response is "" Hey man, we're not going to survive 17 hours man! Those things are going to come in here and they're going to get us and..... "" ( Ripley ) This little girl survived longer than that with no weapons and no military training. "" ( Hudson ) "" Why don't ya put her in charge!!! ""Paxton is a gift to any and every movie that he is in and this is his finest work. He should have won a best supporting actor that year. And if you haven't seen this movie, rush to see it if only for Bill Paxton. He steals the show. But if a tightly wound, brilliantly technical and unbelievably scary movie is your thing, then you can't go wrong here. This is easily a ten out of ten, and one of the best ever made. If Spielberg is the king is Hollywood, then Cameron is his heir apparent. Oh, and one more thing, Paxton will win an Oscar one day.",james cameron bill paxton at their finest,there are really good movies then theres that select few that change your life me movies like jaws raiders lost ark jfk titanic star wars did that by viewing movie you see life different light aliens also did that me i didnt think movie could scare me as much as halloween did but this one certainly did that more atmosphere this movie lighting cinematography course direction are top notch some scenes are some scariest ive seen my life time but what puts this movie over top as one all time greatest films ever made is casting sigourney weaver is terrific but it is her supporting cast that shines makes you feel like you know crew that is heading that desolate planet paul reiser is perfect as burke slimy corporate kiss ass that cares about profit before human lives lance henriksen shines as bishop cyborg with heart jeanette goldstein is rough around edges female marine that more than holds her own with all testosterone floating around michael biehn another cameron favourite is perfect quiet leader that leads by example not so much loud demonstrative voice but show stopper this flick just as he always is any movie that he is is bill paxton paxton cameron have worked terminator 1 true lies titanic aliens bill is one those actors that steals scenes every actor was always recognizable face even before titanic here his hudson character is comic relief but he is also perhaps one true characters that we can all identify with his tough exterior is nothing more than camouflage his frightened fragile interior he realizes dire situation that they are all he cant hide his fear when he finds out that they wont be rescued at least seventeen days his response is hey man were not going survive 17 hours man those things are going come here theyre going get us ripley this little girl survived longer than that with no weapons no military training hudson why dont ya put her charge paxton is gift any every movie that he is this is his finest work he should have won best supporting actor that year if you havent seen this movie rush see it if only bill paxton he steals show but if tightly wound brilliantly technical unbelievably scary movie is your thing then you cant go wrong here this is easily ten out ten one best ever made if spielberg is king is hollywood then cameron is his heir apparent oh one more thing paxton will win oscar one day,0.49089947089947095,0.23242945326278658,Positive,"{'Happy': 0.11, 'Angry': 0.02, 'Surprise': 0.25, 'Sad': 0.29, 'Fear': 0.33}"
