Rating,Review Title,Review,Cleaned Review Title,Cleaned Review,Subjectivity,Polarity,Sentiment,Emotion Scale
10.0,One of the most thrilling films ever- special edition highly recommended,"James Cameron is an extremely talented action director because not only does he know great action, but he always backs the action up with a great story and interesting characters. Aliens is his finest achievement, as far as I'm concerned. Of course, I should specify: Aliens Special Edition is his finest achievement.In 1986 several scenes were cut to keep the movie's run-time reasonable but there was one scene that was incredibly foolish to leave out. The scene I refer to is near the beginning where Ripley learns that her daughter has died while she was away in 'hypersleep' for 57 years. ""I promised her I'd be home for her 11th birthday,"" cries Ripley. This is a very moving scene that adds a great deal the character's depth and makes more sense to why she cares for a little girl named Newt later in the film. She's seeking penance through Newt with her love and determination to keep her alive at all costs. The theatrical edition obviously doesn't elude to any of this, and even cheapens the relationship between Ripley and Newt- just a little bit. James Cameron has said that all of his movies are love stories, and Aliens is a story of parental love. He has also said that the special edition is his intended (if not definitive) version of the film. For about five years or so the Special Edition was the only version of Aliens you could get on DVD. It should have stayed that way.Aliens is a unique film experience: it's genuinely thrilling and exciting, unlike a lot of movies where people shoot the evil monsters and there's disgusting blood and rapid gunfire, and it's really meaningless. In Aliens' case, the aliens are very threatening and more than just target practice. We don't see any aliens for over an hour, but once we do, it's a huge payoff. By that time, we get to know some interesting characters: Hicks (Michael Beihn), a take-charge marine who also turns out to be sweet and sincere, Hudson (Bill Paxton), a braggart who turns out to be a coward and complains most of the time, Vasquez (Jeanette Goldstein), the iron-willed woman soldier who proves to be one of the bravest characters in the film, Bishop (Lance Henrikson), a robot that is very helpful for everyone's survival, Burke (Paul Rieser), the slimy company man who the audience loves to hate, and of course, the adorable little Newt (Carrie Henn), a girl who has survived unspeakable horror. Holding the whole film together is Ripley, played by Sigourney Weaver in her surprise-Oscar-nominated performance. I think the only reason why the audience cared for her in the first film is because she was the only person left and we wanted her to live. But for this film, James Cameron added so much to her. With all this investment in characters, we're really concerned for their well-being. We don't want those aliens to get them. Some die, and I'm always truly bummed out when it happens.Filled with amazing performances and an abundance of thrills, Aliens is one of the greatest of any genre it attempts: whether it's action, sci-fi, horror, or even drama. I personally liked it better than the first film, but it's really like comparing apples and oranges. I prefer the special edition and don't see why anyone should view the other version instead.My rating: 10/10",one most thrilling films ever special edition highly recommended,james cameron is extremely talented action director because not only does he know great action but he always backs action up with great story interesting characters aliens is his finest achievement as far as im concerned course i should specify aliens special edition is his finest achievement 1986 several scenes were cut keep movies run time reasonable but there was one scene that was incredibly foolish leave out scene i refer is near beginning where ripley learns that her daughter has died while she was away hypersleep 57 years i promised her id be home her 11th birthday cries ripley this is very moving scene that adds great deal characters depth makes more sense why she cares little girl named newt later film shes seeking penance through newt with her love determination keep her alive at all costs theatrical edition obviously doesnt elude any this even cheapens relationship between ripley newt just little bit james cameron has said that all his movies are love stories aliens is story parental love he has also said that special edition is his intended if not definitive version film about five years or so special edition was only version aliens you could get dvd it should have stayed that way aliens is unique film experience its genuinely thrilling exciting unlike lot movies where people shoot evil monsters theres disgusting blood rapid gunfire its really meaningless aliens case aliens are very threatening more than just target practice we dont see any aliens over hour but once we do its huge payoff by that time we get know some interesting characters hicks michael beihn take charge marine who also turns out be sweet sincere hudson bill paxton braggart who turns out be coward complains most time vasquez jeanette goldstein iron willed woman soldier who proves be one bravest characters film bishop lance henrikson robot that is very helpful everyones survival burke paul rieser slimy company man who audience loves hate course adorable little newt carrie henn girl who has survived unspeakable horror holding whole film together is ripley played by sigourney weaver her surprise oscar nominated performance i think only reason why audience cared her first film is because she was only person left we wanted her live but this film james cameron added so much her with all this investment characters were really concerned their well being we dont want those aliens get them some die im always truly bummed out when it happens filled with amazing performances abundance thrills aliens is one greatest any genre it attempts whether its action sci fi horror or even drama i personally liked it better than first film but its really like comparing apples oranges i prefer special edition dont see why anyone should view other version instead my rating 10 10,0.5701276742581092,0.22781996988518724,Positive,"{'Happy': 0.14, 'Angry': 0.02, 'Surprise': 0.29, 'Sad': 0.2, 'Fear': 0.35}"
9.0,"This is how it's done, you morons","Welcome to 1986, where they had diverse AND well-written characters in what has to be one of the best Sci-Fi Action films of all time: ALIENS.Even in 1979, Ellen Ripley was what those wannabes today want to recreate: a strong, yet believable female character with a real challenge and a highly competent movie around her. Now, imagine being tasked to do a sequel to ALIEN. You'd be right to directly spray your pants, go throw up, have a heart attack and then politely decline. But not James Cameron. He went on and made one of the most valuable and memorable sequels in film history, despite having a lot of nay-sayers in his own team who didn't believe he could pull it off. Oh, the balls this guy had.Well, what can I tell you about this film that you don't already know? If you really haven't seen it, go watch it. Immediately. It basically is the American version of the suspenseful, British original, but it does get to expand on the world-building quite a lot, as well as on Ripley herself. Add Michael Biehn, Bill Paxton and a ton of Xenomorphs, paranoia, action, quite a bit of horror, Paul Reiser and Lance Henriksen and a badass called Vasquez, and you will have a cocktail that you won't forget, I promise. Then just realize that I didn't even mention Sigourney Weaver and holy cow, why are you still reading this?Go watch this movie!",this is how its done you morons,welcome 1986 where they had diverse well written characters what has be one best sci fi action films all time aliens even 1979 ellen ripley was what those wannabes today want recreate strong yet believable female character with real challenge highly competent movie around her now imagine being tasked do sequel alien youd be right directly spray your pants go throw up have heart attack then politely decline but not james cameron he went made one most valuable memorable sequels film history despite having lot nay sayers his own team who didnt believe he could pull it off oh balls this guy had well what can i tell you about this film that you dont already know if you really havent seen it go watch it immediately it basically is american version suspenseful british original but it does get expand world building quite lot as well as ripley herself add michael biehn bill paxton ton xenomorphs paranoia action quite bit horror paul reiser lance henriksen badass called vasquez you will have cocktail that you wont forget i promise then just realize that i didnt even mention sigourney weaver holy cow why are you still reading this go watch this movie,0.5031385281385281,0.22775974025974025,Positive,"{'Happy': 0.09, 'Angry': 0.06, 'Surprise': 0.2, 'Sad': 0.26, 'Fear': 0.4}"
10.0,Gets better every time I see it,"I am just going to add my voice to the chorus of praise for this movie. It is as near to being perfect as any I have ever seen. I will not say that it is much better than Alien - which is just about near to being perfect also. But I do love all the characters in this movie. I have rarely seen a movie where all the characters were so well developed. Even most serious dramas seldom develops each character so completely. None of these characters are stereotypes even Paul Reiser as Burke, although the slimy company/government man villain is a prerequisite in disaster type movies. I would almost say that my favorite is Michael Beihn as Hicks, just because I like his work & consider him to be underrated. But I also like Lance Henriksen as Bishop, William Hope as Lt. Gorman, Bill Paxton as Hudson, and of course, Jenette Goldstein as Vasquez. I liked all of these characters. I cared about their lives & deaths. The final scene for Gorman & Vasquez still chokes me up after seeing it many times. I am not ignoring Sigourney Weaver or Carrie Henn. Ripley is the template for the modern action heroine. In the 24 years since Alien, few have been able to measure up to Sigourney Weaver's Ripley. Even in Alien 3 & 4, Ripley was still powerful, despite the 3ed rate quality of the movies. As for Carrie Henn as Newt, she was the emotional heart of Aliens. Cameron's ability to develop well rounded characters does not detract from his ability to create great action scenes or to scare the audience out of a several years of growth.",gets better every time i see it,i am just going add my voice chorus praise this movie it is as near being perfect as any i have ever seen i will not say that it is much better than alien which is just about near being perfect also but i do love all characters this movie i have rarely seen movie where all characters were so well developed even most serious dramas seldom develops each character so completely none these characters are stereotypes even paul reiser as burke although slimy company government man villain is prerequisite disaster type movies i would almost say that my favorite is michael beihn as hicks just because i like his work consider him be underrated but i also like lance henriksen as bishop william hope as lt gorman bill paxton as hudson course jenette goldstein as vasquez i liked all these characters i cared about their lives deaths final scene gorman vasquez still chokes me up after seeing it many times i am not ignoring sigourney weaver or carrie henn ripley is template modern action heroine 24 years since alien few have been able measure up sigourney weavers ripley even alien 3 4 ripley was still powerful despite 3ed rate quality movies as carrie henn as newt she was emotional heart aliens camerons ability develop well rounded characters does not detract his ability create great action scenes or scare audience out several years growth,0.5836309523809524,0.25059523809523804,Positive,"{'Happy': 0.07, 'Angry': 0.02, 'Surprise': 0.14, 'Sad': 0.19, 'Fear': 0.58}"
10.0,All-time classic; one of the greatest films ever made,"What more can be said that hasn't been said before about one of the greatest movies of our time? One of Jim Cameron's top three films, this is by far the best of the ALIEN saga, an endlessly rewatchable piece of classic action cinema which can best be described as ""Vietnam in space"". The alien is back and has multiplied, so now we have the now-classic action premise of ""group of marines vs. invincible enemy"".From start to finish this is perfectly made entertainment with every frame minutely conceived to be the best. The music is eerily gripping and there are dozens of one-liners to be had from Bill Paxton, excelling in his first big role as the comic relief. The horror and gore quotient hasn't been reduced at all, this is definitely not a film for the kids. But oodles of gripping suspense and guns-blazing action violence is the main thing this sequel offers and it still remains one of the best action classics of our time. Even now, when some of the special effects are starting to look a little ropey (most remain fantastic, however, especially the Queen) and when you begin to realise there are no more than six aliens on screen at one time, this is still pulse-pounding entertainment, packed with horror, suspense, tension and plenty of thrills.The cast is efficient, an ensemble outfit that pays off nicely. Sigourney Weaver puts in her best performance in her best role that she can never hope to better success-wise. Michael Biehn is the hard-but-human soldier who befriends her, Lance Henriksen has his mainstream breakthrough role as the likable android Bishop. Paul Reiser's Burke is one of the greatest portrayals of corporate evil I've seen, a fantastic show of strength, corruption, evil and cowardice from Reiser. The rest of the marines are great and, most importantly, believable and likable. The action never lets up and the extended version has to be seen to get the full story. Although it runs for two and a half hours this is a film that never runs out of steam; instead it will just age gracefully like the finest wines, sitting in its place in history as a classic of the '80s.",all time classic one greatest films ever made,what more can be said that hasnt been said before about one greatest movies our time one jim camerons top three films this is by far best alien saga endlessly rewatchable piece classic action cinema which can best be described as vietnam space alien is back has multiplied so now we have now classic action premise group marines vs invincible enemy start finish this is perfectly made entertainment with every frame minutely conceived be best music is eerily gripping there are dozens one liners be had bill paxton excelling his first big role as comic relief horror gore quotient hasnt been reduced at all this is definitely not film kids but oodles gripping suspense guns blazing action violence is main thing this sequel offers it still remains one best action classics our time even now when some special effects are starting look little ropey most remain fantastic however especially queen when you begin realise there are no more than six aliens screen at one time this is still pulse pounding entertainment packed with horror suspense tension plenty thrills cast is efficient ensemble outfit that pays off nicely sigourney weaver puts her best performance her best role that she can never hope better success wise michael biehn is hard but human soldier who befriends her lance henriksen has his mainstream breakthrough role as likable android bishop paul reisers burke is one greatest portrayals corporate evil ive seen fantastic show strength corruption evil cowardice reiser rest marines are great most importantly believable likable action never lets up extended version has be seen get full story although it runs two half hours this is film that never runs out steam instead it will just age gracefully like finest wines sitting its place history as classic 80s,0.49074302134646974,0.300338669950739,Positive,"{'Happy': 0.11, 'Angry': 0.05, 'Surprise': 0.39, 'Sad': 0.12, 'Fear': 0.32}"
10.0,Who could believe that a sequel could top an already modern classic?,"While Ridley Scott did not return as director, they got someone to take the reins that seems to have proven in teeny tiny ways that he was capable of the job, a man named James Cameron. This film is better (which isn't an easy task considering how good ""Alien"" was) simply because more care is put into the creation of the characters. Sigourney Weaver returns as Ripley, and this time, she gets more dialogue to express who she is underneath the rather sheltered heroin from the first film. She has not given dialog just to hear Sigourney Weaver speak, because this dialogue really expresses the lessons that she has learned through the events of the first film, and how secrets of her personal life impacted the way she was as a human.Sigourney's recipient of an Oscar nomination for this film is no joke, even if it is the first for a woman in a science fiction film. She truly is magnificent, and in moving up the ranks after a couple of films in the late 70's, she truly proved the notion that she wasn't just a fluke. When seen at the beginning of the film, she is having a nightmare of being back in space and the victim of the alien utilizing her through inserting another monster inside her. It takes a lot of convincing for her to go back into space, but once she is there and settled in, she is willing and determine under every circumstance to destroy the evil force that could bring around the destruction of the universe.This is a heroin that the women can look up to and men are comfortable with her because she feels like someone you could pal around with. Her interactions with the other members of the crew (which includes a very tough younger woman, Jenette Goldstein, who basically ridicules her at the beginning) vary from person to person because she is someone who obviously judges on strength of character. Bill Paxton and Michael Biehn have very unique personality is quite different from each other that have different types of relationships with Weaver's character.A little bit of tenderness is added through the presence of a nine-year-old girl (Carrie Henn) they find as the only survivor on a space vehicle, and if they were looking for a nine-year-old who could scream loudly non-stop, they accomplished what they set out to do. It gets to be a bit piercing at times, but if the viewer just thinks of how they would react in a similar situation, then they may be able to tolerate it more. Like the first one, this is non-stop action, but scores higher simply because they put more effort into making it more than just Another Science Fiction / space monster movie. This really has great themes and ideas, and 35 years later, is it true classic, with the leading lady who has become one of the great movie heroines of all time.",who could believe that sequel could top already modern classic,while ridley scott did not return as director they got someone take reins that seems have proven teeny tiny ways that he was capable job man named james cameron this film is better which isnt easy task considering how good alien was simply because more care is put into creation characters sigourney weaver returns as ripley this time she gets more dialogue express who she is underneath rather sheltered heroin first film she has not given dialog just hear sigourney weaver speak because this dialogue really expresses lessons that she has learned through events first film how secrets her personal life impacted way she was as human sigourneys recipient oscar nomination this film is no joke even if it is first woman science fiction film she truly is magnificent moving up ranks after couple films late 70s she truly proved notion that she wasnt just fluke when seen at beginning film she is having nightmare being back space victim alien utilizing her through inserting another monster inside her it takes lot convincing her go back into space but once she is there settled she is willing determine under every circumstance destroy evil force that could bring around destruction universe this is heroin that women can look up men are comfortable with her because she feels like someone you could pal around with her interactions with other members crew which includes very tough younger woman jenette goldstein who basically ridicules her at beginning vary person person because she is someone who obviously judges strength character bill paxton michael biehn have very unique personality is quite different each other that have different types relationships with weavers character little bit tenderness is added through presence nine year old girl carrie henn they find as only survivor space vehicle if they were looking nine year old who could scream loudly non stop they accomplished what they set out do it gets be bit piercing at times but if viewer just thinks how they would react similar situation then they may be able tolerate it more like first one this is non stop action but scores higher simply because they put more effort into making it more than just another science fiction space monster movie this really has great themes ideas 35 years later is it true classic with leading lady who has become one great movie heroines all time,0.4730911330049261,0.16700191570881223,Positive,"{'Happy': 0.1, 'Angry': 0.05, 'Surprise': 0.24, 'Sad': 0.18, 'Fear': 0.44}"
9.0,Great follow up,"It's 57 years after the first movie. Ellen Ripley (Sigourney Weaver) has been lost in cryogenic sleep until she's discovered by a deep salvage team. She's asked to return to the planet to investigate why the colony there has lost all communication. She and a team of space marines must battle the aliens in an all out fight.James Cameron has taken this franchise from its horror origins to a great big action adventure. The change in style is seamless. The action is perfect, and it's a non-stop roller coaster ride. Ripley has transformed herself from the feminist icon into a powerful mother figure. There isn't a false note in this movie. The characters are all well drawn from the humanist robot Lance Henriksen to the comic relief Bill Paxton. They all work to create one of the most thrilling rides of all times.",great follow up,its 57 years after first movie ellen ripley sigourney weaver has been lost cryogenic sleep until shes discovered by deep salvage team shes asked return planet investigate why colony there has lost all communication she team space marines must battle aliens all out fight james cameron has taken this franchise its horror origins great big action adventure change style is seamless action is perfect its non stop roller coaster ride ripley has transformed herself feminist icon into powerful mother figure there isnt false note this movie characters are all well drawn humanist robot lance henriksen comic relief bill paxton they all work create one most thrilling rides all times,0.5166666666666667,0.2892857142857143,Positive,"{'Happy': 0.09, 'Angry': 0.0, 'Surprise': 0.22, 'Sad': 0.17, 'Fear': 0.52}"
