Rating,Review Title,Review,Cleaned Review Title,Cleaned Review,Subjectivity,Polarity,Sentiment,Emotion Scale
10.0,Every bit as good as Alien,"Alien is a sci-fi classic, so when I saw Aliens I was expecting great things. Which is exactly what I got. Aliens I have often seen and heard being described as one of the best sequels ever made, and I have to heartily concur. Aliens is every bit as good as Alien, and just a brilliant film. The production design once again is immaculate with the spectacle surpassing Alien(to me), while the script is credible, the story interesting and well-constructed and James Cameron's direction brilliant. As with Alien, there are also some very genuine shocks and scares, and if there was something I marginally preferred here it was the suspense which was particularly nail-biting. The acting once again is top notch, all the supporting cast do great work but Sigourney Weaver is simply terrific and it helps that Ellen Ripley is expanded upon here. Overall, just like Alien, a sci-fi classic. 10/10 Bethany Cox",every bit as good as alien,alien is sci fi classic so when i saw aliens i was expecting great things which is exactly what i got aliens i have often seen heard being described as one best sequels ever made i have heartily concur aliens is every bit as good as alien just brilliant film production design once again is immaculate with spectacle surpassing alien me while script is credible story interesting well constructed james camerons direction brilliant as with alien there are also some very genuine shocks scares if there was something i marginally preferred here it was suspense which was particularly nail biting acting once again is top notch all supporting cast do great work but sigourney weaver is simply terrific it helps that ellen ripley is expanded upon here overall just like alien sci fi classic 10 10 bethany cox,0.5606666666666666,0.2888,Positive,"{'Happy': 0.3, 'Angry': 0.0, 'Surprise': 0.27, 'Sad': 0.07, 'Fear': 0.37}"
10.0,A Masterpiece of Suspense,"This is a fantastic film in every respect. While the original was outstanding, this takes it to new heights. Everything is set up so well. The bad guys in the futuristic corporate world are at it again. They know of the horrors but see people as cannon fodder for the the venomous aliens. Ripley's character is mature and smart. Throw in the little colonist and a group of overzealous (and frightened) Marines and you have the ingredients for one of the best. The story is extremely well plotted. Every single thing that is put in front of us serves a purpose later in the film. The byplay among characters and the actions of the shortsighted bureaucrat all work. The combat scenes with the aliens are intense and frightening. The work in the first movie is drawn on to create this second one. It isn't the slipshod sequel, made to make a few bucks on a previously successful movie. The aliens have now become a silly franchise. This was the real thing. Don't bother with the other stuff.",masterpiece suspense,this is fantastic film every respect while original was outstanding this takes it new heights everything is set up so well bad guys futuristic corporate world are at it again they know horrors but see people as cannon fodder venomous aliens ripleys character is mature smart throw little colonist group overzealous frightened marines you have ingredients one best story is extremely well plotted every single thing that is put front us serves purpose later film byplay among characters actions shortsighted bureaucrat all work combat scenes with aliens are intense frightening work first movie is drawn create this second one it isnt slipshod sequel made make few bucks previously successful movie aliens have now become silly franchise this was real thing dont bother with other stuff,0.5153040141676506,0.07803276269185358,Positive,"{'Happy': 0.09, 'Angry': 0.06, 'Surprise': 0.25, 'Sad': 0.19, 'Fear': 0.41}"
,"Outstanding blend of sci-fi, action, and humour.","I rate Aliens a perfect 10. This second installment in the Alien series evolves the original movie's horror/sci-fi genre into action-adventure/sci-fi, setting a standard which has not yet been matched. I like this movie because it paints a picture of the future which is realistic enough to suck you in during the beginning of the film and then quickly introduces you to interesting characters who you become concerned with; some you love and others you hate.....but none of them bore you. By the time the action starts it's possible to forget you're watching a movie (at least the first couple of times). The plot is filled with tension that is occasionally broken by some of the most memorable one-liners in history (especially by Private Hudson). The special effects are remarkable, considering the fact that they were accomplished the ""old fashioned way"" prior to digital manipulation. I can report that I now own the Director's Cut and rate this version a 10 also. The extra footage will be extremely interesting to fans of the 1986 release. Either version gives you great characters, suspense, action, firepower, sarcasm, and wit. Aliens is an outstanding show!",outstanding blend sci fi action humour,i rate aliens perfect 10 this second installment alien series evolves original movies horror sci fi genre into action adventure sci fi setting standard which has not yet been matched i like this movie because it paints picture future which is realistic enough suck you during beginning film then quickly introduces you interesting characters who you become concerned with some you love others you hate but none them bore you by time action starts its possible forget youre watching movie at least first couple times plot is filled with tension that is occasionally broken by some most memorable one liners history especially by private hudson special effects are remarkable considering fact that they were accomplished old fashioned way prior digital manipulation i can report that i now own directors cut rate this version 10 also extra footage will be extremely interesting fans 1986 release either version gives you great characters suspense action firepower sarcasm wit aliens is outstanding show,0.49341931216931223,0.20783730158730157,Positive,"{'Happy': 0.17, 'Angry': 0.02, 'Surprise': 0.2, 'Sad': 0.17, 'Fear': 0.44}"
10.0,"""I knew you'd come...""","ALIENS really does have it all. Perfect direction. Beautiful cinematography. Intense characters. Big guns. Action. Heroism. Courage. Battles. Friendship. Bravery. It is certainly the BEST sequel ever made in movie history, and one of the GREATEST MOVIES EVER MADE.At its core is Lt. Ellen Ripley (played by the badass Sigourney Weaver), a warrant officer, and tough as nails. Her character is one of the greatest heroines of all time. Sigourney really does pull it off. No one else could have done it like her. Ripley's maternal connection with the young girl Newt is amazing to watch...but the ultimate scene is her final battle with the galaxy's most deadly creature - set to a pulsing military score (James Horner delivers in a big way!). Quite possibly my favorite fight scene of all time.There's not really much else to say - just go watch the movie on DVD, and you will not be let down. You're in for a wild ride!!!ALIENS: THIS TIME, IT'S WAR",i knew youd come,aliens really does have it all perfect direction beautiful cinematography intense characters big guns action heroism courage battles friendship bravery it is certainly best sequel ever made movie history one greatest movies ever made at its core is lt ellen ripley played by badass sigourney weaver warrant officer tough as nails her character is one greatest heroines all time sigourney really does pull it off no one else could have done it like her ripleys maternal connection with young girl newt is amazing watch but ultimate scene is her final battle with galaxys most deadly creature set pulsing military score james horner delivers big way quite possibly my favorite fight scene all time theres not really much else say just go watch movie dvd you will not be let down youre wild ride aliens this time its war,0.5661835748792271,0.27850241545893717,Positive,"{'Happy': 0.06, 'Angry': 0.03, 'Surprise': 0.33, 'Sad': 0.21, 'Fear': 0.36}"
10.0,A milestone in movie making....,"Just recently, I have purchased the new Alien Legacy box set on DVD, and each one is excellent. Aliens is the second chapter in the Alien saga and is probably the most remembered by today's generation. Let's face it; it changed the way sci-fi movies were made forever,and it hasn't been for the best(I'm not saying Aliens is a bad film). Aliens set such a high standard in action sci-fi(basically the new genre the James Cameron has created) that none of the copycats can compete. Take the recent movies Soldier and Event Horizon(both directed by Paul Anderson). They both try to be Alien movies but do not succeed. My advice to Mr. Anderson is to stop trying to copy what has already been done. Enough said.As for Aliens, it is a perfect sci-fi action movie. Great casting(although ALL are stereotypes), great music(James Horner is the man), great use of technology and a well written script are all present. Weaver's performance is outstanding; one of the best action heroes of all time just happens to be a woman. If you have a chance to watch the director' cut of Aliens, I suggest you take it(it's available in the new Alien Legacy box set or alone on DVD and VHS as well as on laserdisc). It expands on Ripley's maternal persona which makes Weaver's performance all the better.James Cameron came off making The Terminator and made Aliens. He used his expertise in the sci-fi genre and created an engrossing story that does not let up until the final reel of the film. For all the young folk out there that have not seen this film, watch it and see perfection in action movie making. A must see.",milestone movie making,just recently i have purchased new alien legacy box set dvd each one is excellent aliens is second chapter alien saga is probably most remembered by todays generation lets face it it changed way sci fi movies were made forever it hasnt been best im not saying aliens is bad film aliens set such high standard action sci fi basically new genre james cameron has created that none copycats can compete take recent movies soldier event horizon both directed by paul anderson they both try be alien movies but do not succeed my advice mr anderson is stop trying copy what has already been done enough said as aliens it is perfect sci fi action movie great casting although all are stereotypes great music james horner is man great use technology well written script are all present weavers performance is outstanding one best action heroes all time just happens be woman if you have chance watch director cut aliens i suggest you take it its available new alien legacy box set or alone dvd vhs as well as laserdisc it expands ripleys maternal persona which makes weavers performance all better james cameron came off making terminator made aliens he used his expertise sci fi genre created engrossing story that does not let up until final reel film all young folk out there that have not seen this film watch it see perfection action movie making must see,0.49103832442067735,0.24320855614973264,Positive,"{'Happy': 0.1, 'Angry': 0.0, 'Surprise': 0.18, 'Sad': 0.22, 'Fear': 0.49}"
10.0,Best of Sci-Fi Action,"Aliens is one of many movies from my adolescent years that is just as good today as it was back then. It is an adrenaline filled ride filled with creepy locations, intense action, thrills, much circumstantial humor and one-liners that will never grow old (mostly thanks to Bill Paxton). It is, unapologetically, a man's movie, filled with everything except nudity (which it did not need).All movies in the Alien series have a claustrophobic feel to them, and involve a relatively small cast of players. Aliens is no exception and really capitalizes on the fear potential of the locale. Cameron is not exactly known for injecting horror into his films, but provides enough here to satisfy.The characters are very well cast and the actors have great chemistry. I especially grooved to the fact that, even though the soldiers are supposed to be tough marines, not all of them were completely gung-ho about their adventures. In fact, a few were downright cowardly and indecisive in the face of combat - something I'm certain would happen to many in such a situation. Bill Paxton stole the show as the wisecracking space marine. With all the likable characters involved, the stakes were very high. When they start dropping, we feel the loss.Movies like this just don't come around very often. The pacing is very tight, even when the action is absent. The characters and situations are interesting enough - when the action hits, it just serves to suck us in deeper. I have nothing bad to say about Aliens. It is simply an awesome movie with a well deserved reputation for being such. See for yourself.",best sci fi action,aliens is one many movies my adolescent years that is just as good today as it was back then it is adrenaline filled ride filled with creepy locations intense action thrills much circumstantial humor one liners that will never grow old mostly thanks bill paxton it is unapologetically mans movie filled with everything except nudity which it did not need all movies alien series have claustrophobic feel them involve relatively small cast players aliens is no exception really capitalizes fear potential locale cameron is not exactly known injecting horror into his films but provides enough here satisfy characters are very well cast actors have great chemistry i especially grooved fact that even though soldiers are supposed be tough marines not all them were completely gung ho about their adventures fact few were downright cowardly indecisive face combat something im certain would happen many such situation bill paxton stole show as wisecracking space marine with all likable characters involved stakes were very high when they start dropping we feel loss movies like this just dont come around very often pacing is very tight even when action is absent characters situations are interesting enough when action hits it just serves suck us deeper i have nothing bad say about aliens it is simply awesome movie with well deserved reputation being such see yourself,0.5108501742160281,0.13478668215253584,Positive,"{'Happy': 0.08, 'Angry': 0.06, 'Surprise': 0.19, 'Sad': 0.13, 'Fear': 0.54}"
10.0,"There will never be the same ""ALIENS"" again...","Greetings from Lithuania.What can i say about this movie that wasn't told hundreds time before. Excellent. This is the only word that can describe this movie. Excellent direction. Excellent acting. Excellent camera work, editing. Breathtaking (still!) special visual, sound effects. Unforgettable hero! The best of the decade. The best in its genre. Every time you watch it gets better and better. The atmosphere and suspension will never be the same again. EVERYTHING in this movie works brilliant! My favorite director J. Cameron created the timeless masterpiece. Bill Paxton really deserved an Oscar nomination that year. One of my favorite five motion pictures ever. And it will stay there forever...Overwhelming masterpiece.",there will never be same aliens again,greetings lithuania what can i say about this movie that wasnt told hundreds time before excellent this is only word that can describe this movie excellent direction excellent acting excellent camera work editing breathtaking still special visual sound effects unforgettable hero best decade best its genre every time you watch it gets better better atmosphere suspension will never be same again everything this movie works brilliant my favorite director j cameron created timeless masterpiece bill paxton really deserved oscar nomination that year one my favorite five motion pictures ever it will stay there forever overwhelming masterpiece,0.6373376623376624,0.5525974025974025,Positive,"{'Happy': 0.26, 'Angry': 0.07, 'Surprise': 0.48, 'Sad': 0.07, 'Fear': 0.11}"
10.0,Masterpiece,"There are only a few sequels superior to the first instalment and Aliens it's one of them with Terminator 2 and The Godfather 2. Aliens is also on my top 3 favorite movies of all time. And trust me, probably I've watched a thousand or more. The movie is fantastic, includes the suspenseful atmosphere from the first one but adding raw brutal action and great interpretation from Ripley again. Also, the new DC version that I've watched today is far better than the old one. Hopefully, one day someone can invent something as great as Aliens. But today, I've watched and enjoyed again. It never gets old.",masterpiece,there are only few sequels superior first instalment aliens its one them with terminator 2 godfather 2 aliens is also my top 3 favorite movies all time trust me probably ive watched thousand or more movie is fantastic includes suspenseful atmosphere first one but adding raw brutal action great interpretation ripley again also new dc version that ive watched today is far better than old one hopefully one day someone can invent something as great as aliens but today ive watched enjoyed again it never gets old,0.6039405039405039,0.2347902097902098,Positive,"{'Happy': 0.26, 'Angry': 0.04, 'Surprise': 0.35, 'Sad': 0.04, 'Fear': 0.3}"
