Rating,Review Title,Review,Cleaned Review Title,Cleaned Review,Subjectivity,Polarity,Sentiment,Emotion Scale
10.0,A thriller that India will always be proud of !,"Though I don't categorize movies on the basis of their region or country, I had mentioned this title regarding India being proud of this movie. This is because I have heard people yelling in social media and in public about the low standards of Indian movies specially thrillers which either lack thrill or are copied from Hollywood. I agree to them o most occasions but this one. And I would strongly recommend people who complain about the lack of good movies in Bollywood to go and watch it. Or else stop complaining these craps.Coming on to the movie, it describes the biggest agenda world is facing right now, i.e, Terrorism, in best way it could. The story comprises of many small incidents which are bound together so slickly that we feel the smooth flow of script. We are lost in the hustle going on in front of us and are keen to know what is coming next. First half makes the plot for the movie and the second half unleashes the execution. Each and every scenes complements its predecessor and we are biting our nails without even noticing it. Last hour is full of thrilling actions and grueling proceedings.Talking about the acting , I must say Akshay Kumar has delivered a role of his life very convincingly. He lives his character and puts that extra amount of thrill via his superb action. Danny plays his role quite brilliantly. Anupam, Tapsee, Kay Kay and other supporting casts act life to their characters and make this movie a combo of power packed performances.Director Neeraj Pandey has already made a Wednesday and Sp 26 in past and thats why there was a very little scope for improvement for him. But I would be lying if i don't say that this is a notch higher that his earlier masterpieces. Editing is quite crisp. Screenplay is the soul of this movie while BM is equally engaging. Cinematography is grand and deserve applause. Dialogues are apt and support the movie a lot. Music is average and rightly so. Choreography is nil while action is breathtaking.It has a few flaws here and there in a few scenes but those are hardly noticed due to the fast paced drama and screenplay.Overall, a standing ovation for Neeraj and Akshay to give us Indians a movie to feel proud of. It can easily go into books as one of the best Hindi movies.A movie of Hollywood standard and execution. And who knows Akshay might get a shot at his dream of wining a National Award. I won't be surprised if he gets one along with Neeraj Pandey. It also has a potential to be India's official Oscar entry next year.I have rated this movie comparing it to other Indian movies...otherwise I would universally give it a 9 or 9.5.",thriller that india will always be proud,though i dont categorize movies basis their region or country i had mentioned this title regarding india being proud this movie this is because i have heard people yelling social media public about low standards indian movies specially thrillers which either lack thrill or are copied hollywood i agree them o most occasions but this one i would strongly recommend people who complain about lack good movies bollywood go watch it or else stop complaining these craps coming movie it describes biggest agenda world is facing right now i e terrorism best way it could story comprises many small incidents which are bound together so slickly that we feel smooth flow script we are lost hustle going front us are keen know what is coming next first half makes plot movie second half unleashes execution each every scenes complements its predecessor we are biting our nails without even noticing it last hour is full thrilling actions grueling proceedings talking about acting i must say akshay kumar has delivered role his life very convincingly he lives his character puts that extra amount thrill via his superb action danny plays his role quite brilliantly anupam tapsee kay kay other supporting casts act life their characters make this movie combo power packed performances director neeraj pandey has already made wednesday sp 26 past thats why there was very little scope improvement him but i would be lying if i dont say that this is notch higher that his earlier masterpieces editing is quite crisp screenplay is soul this movie while bm is equally engaging cinematography is grand deserve applause dialogues are apt support movie lot music is average rightly so choreography is nil while action is breathtaking it has few flaws here there few scenes but those are hardly noticed due fast paced drama screenplay overall standing ovation neeraj akshay give us indians movie feel proud it can easily go into books as one best hindi movies movie hollywood standard execution who knows akshay might get shot at his dream wining national award i wont be surprised if he gets one along with neeraj pandey it also has potential be indias official oscar entry next year i have rated this movie comparing it other indian movies otherwise i would universally give it 9 or 9 5,0.460940065681445,0.22301416256157636,Positive,"{'Happy': 0.1, 'Angry': 0.04, 'Surprise': 0.28, 'Sad': 0.18, 'Fear': 0.39}"
9.0,"Finally, Bollywood did a perfect Hollywood this time.. !!!!","First of all, hats off to Neeraj Pandey for raising the standard of Bollywood. Throughout, i never felt that i was watching a bollywood movie. Its one of the epic thriller made in Bollywood. Every scene of movie is executed in an efficient manner and once again Akshay Kumar's acting won millions of hearts and also i would like to add about Anupam Kher's acting...it will remind you of Neeraj Pandey's last movie ""Special 26"". Here 'BABY' refers to a mission started by some agents including Akshay kumar in order to grasp some powerful terrorists and one among them was Bilal Khan (Kay Kay Menon).I would recommend this film to each and everyone as it is one of the best movies of Indian Cinema which are made against terrorists. My rating 9/10.",finally bollywood did perfect hollywood this time,first all hats off neeraj pandey raising standard bollywood throughout i never felt that i was watching bollywood movie its one epic thriller made bollywood every scene movie is executed efficient manner once again akshay kumars acting won millions hearts also i would like add about anupam khers acting it will remind you neeraj pandeys last movie special 26 here baby refers mission started by some agents including akshay kumar order grasp some powerful terrorists one among them was bilal khan kay kay menon i would recommend this film each everyone as it is one best movies indian cinema which are made against terrorists my rating 9 10,0.4246753246753247,0.2733766233766234,Positive,"{'Happy': 0.0, 'Angry': 0.06, 'Surprise': 0.24, 'Sad': 0.41, 'Fear': 0.29}"
10.0,Excellent,"Really well directed and excellent movie. Different approach and most important is the gripping story line and narration. A ""MUST WATCH"" movie in theater. The cinematography is good and is a delight to watch and synchronizes well with the movie. And needless to say, one of plus points of the movie is Akshay Kumar's acting as an authentic security officer. Taapsee is a delight to watch. Rana Daggubati's acting is also very good and has done a very good job as another security officer. The storyline and the plot are new and refreshing which highly complements the movie. The songs are good and matches well with the movie without boring or torturing the audience. If you liked the songs in Neeraj Pandey's previous movie ""Special 26"", then you are sure to like this too, actually the songs are even more good in Baby. And, needless to tell about ""Neeraj Pandey"", the director who has given us epics like ""A Wednesday"" and ""Special 26"". He has just proved his mettle yet again.",excellent,really well directed excellent movie different approach most important is gripping story line narration must watch movie theater cinematography is good is delight watch synchronizes well with movie needless say one plus points movie is akshay kumars acting as authentic security officer taapsee is delight watch rana daggubatis acting is also very good has done very good job as another security officer storyline plot are new refreshing which highly complements movie songs are good matches well with movie without boring or torturing audience if you liked songs neeraj pandeys previous movie special 26 then you are sure like this too actually songs are even more good baby needless tell about neeraj pandey director who has given us epics like wednesday special 26 he has just proved his mettle yet again,0.6429627911770769,0.32014223871366726,Positive,"{'Happy': 0.3, 'Angry': 0.06, 'Surprise': 0.3, 'Sad': 0.06, 'Fear': 0.27}"
9.0,Perhaps the best spy action thriller in Bollywood,"Baby is Bollywood's answer to Argo!!!!!!!!! The entire plot has been amazingly crafted. The performance of the entire cast was amazing. Bollywood rarely produces movies nowadays that are watchable, and in between comes this gem of a movie. The first half of the movie is good. However the real plot comes into play in the second half. The last 45-50 minutes of the the movie were so engaging that I could not remove my eyes from the theater screen. And the biggest merit of the film is the fact that there are no songs in the movie, only background music is there.Akshay Kumar has played a superb role. Its time that he should realize the fact that he looks really amazing doing films like holiday, baby and Special 26, and that he should stop doing mindless commercial movies. Danny and Anupam Kher are great at their roles. The action scenes are amazing, and cinematography is good. The best part of the movie is its direction. Neeraj Pandey has made two awesome movies earlier, and with this film he sets the standards even higher. Why cant Bollywood have more of Neeraj Pandeys and Hiranis and Anurag Kashyaps? Why cant Bollywood churn even two quality films every month?Kudos to Neeraj Pandey, Akshay Kumar and co.....",perhaps best spy action thriller bollywood,baby is bollywoods answer argo entire plot has been amazingly crafted performance entire cast was amazing bollywood rarely produces movies nowadays that are watchable between comes this gem movie first half movie is good however real plot comes into play second half last 45 50 minutes movie were so engaging that i could not remove my eyes theater screen biggest merit film is fact that there are no songs movie only background music is there akshay kumar has played superb role its time that he should realize fact that he looks really amazing doing films like holiday baby special 26 that he should stop doing mindless commercial movies danny anupam kher are great at their roles action scenes are amazing cinematography is good best part movie is its direction neeraj pandey has made two awesome movies earlier with this film he sets standards even higher why cant bollywood have more neeraj pandeys hiranis anurag kashyaps why cant bollywood churn even two quality films every month kudos neeraj pandey akshay kumar co,0.5401587301587302,0.3507936507936508,Positive,"{'Happy': 0.15, 'Angry': 0.0, 'Surprise': 0.44, 'Sad': 0.07, 'Fear': 0.33}"
9.0,Best film by Akshay Kumar till date,This is one of the best movies ever made in thriller category. Akshay has done brilliant stunts in this movie. The dialogues were incredible. This is a movie that you can watch with your family and get a message out of it too. I totally recommend you to watch this movie. It will impress you as much as Special 26 did. This movie will be a blockbuster. That's all i have to say! REPEAT*** Don't read this******* This is one of the best movies ever made in thriller category. Akshay has done brilliant stunts in this movie. The dialogues were incredible. This is a movie that you can watch with your family and get a message out of it too. I totally recommend you to watch this movie. It will impress you as much as Special 26 did. This movie will be a blockbuster. That's all i have to say!,best film by akshay kumar till date,this is one best movies ever made thriller category akshay has done brilliant stunts this movie dialogues were incredible this is movie that you can watch with your family get message out it too i totally recommend you watch this movie it will impress you as much as special 26 did this movie will be blockbuster thats all i have say repeat dont read this this is one best movies ever made thriller category akshay has done brilliant stunts this movie dialogues were incredible this is movie that you can watch with your family get message out it too i totally recommend you watch this movie it will impress you as much as special 26 did this movie will be blockbuster thats all i have say,0.6675324675324675,0.6649350649350649,Positive,"{'Happy': 0.16, 'Angry': 0.0, 'Surprise': 0.68, 'Sad': 0.08, 'Fear': 0.08}"
10.0,Baby- Akshay Kumar,One of the best masterpieces of bollywood.The best in thriller.Story is amazing.Akshay Kumar bounds you with the film.Other actors also did well.Most important is its villain whose acting make you to hate him.,baby akshay kumar,one best masterpieces bollywood best thriller story is amazing akshay kumar bounds you with film other actors also did well most important is its villain whose acting make you hate him,0.534375,0.321875,Positive,"{'Happy': 0.14, 'Angry': 0.0, 'Surprise': 0.57, 'Sad': 0.29, 'Fear': 0.0}"
8.0,BABY is a daring attempt which should be lauded and appreciated,"Move over commercial masala potboilers with item songs, hero smashing 10 guys with a single blow and typical song-dance routine -Neeraj Pandey's BABY will give you goosebumps with fast-paced gritting thrills and excitementAn elite covert operation group BABY learns about bomb implanted in various cities in India. They must investigate and unravel the terrorist plan before time flies killing thousand of innocent citizen.Directed by Neeraj Panday, whose previous work included A Wednesday and Special Chabbis, BABY will consume you right from the opening as Akshay Kumar gets involved into the investigation and the cat-mouse begins. From here onward there is no turning back as the movie gives you nice twist-n-turns with well- choreographed action scenes. The scene where Akshay interrogates a suspect by stuffing him in a plastic bag is one of the best scene I have seen in recent time. The scene where Akshay Kumar's partner officer fights with another suspect before he comes for the rescue is simply mindblowing. Icing on the cake is the climax scenes which has been well executed. On the flip side, length of the movie could have been reduced little further. But brilliant screenplay, Art direction and cinematography is spellbinding. Background score gels well with the mood of the film. Dialogues are fine. It is Akshay Kumar's show all the way. A thumbs up to him for doing something different from his usual masala potboilers. Other actors do justice to their roleOverall , BABY is nail-biting , reality-based action thriller that is going to give you goose bumps. Brilliant 4.5/5",baby is daring attempt which should be lauded appreciated,move over commercial masala potboilers with item songs hero smashing 10 guys with single blow typical song dance routine neeraj pandeys baby will give you goosebumps with fast paced gritting thrills excitementan elite covert operation group baby learns about bomb implanted various cities india they must investigate unravel terrorist plan before time flies killing thousand innocent citizen directed by neeraj panday whose previous work included wednesday special chabbis baby will consume you right opening as akshay kumar gets involved into investigation cat mouse begins here onward there is no turning back as movie gives you nice twist n turns with well choreographed action scenes scene where akshay interrogates suspect by stuffing him plastic bag is one best scene i have seen recent time scene where akshay kumars partner officer fights with another suspect before he comes rescue is simply mindblowing icing cake is climax scenes which has been well executed flip side length movie could have been reduced little further but brilliant screenplay art direction cinematography is spellbinding background score gels well with mood film dialogues are fine it is akshay kumars show all way thumbs up him doing something different his usual masala potboilers other actors do justice their roleoverall baby is nail biting reality based action thriller that is going give you goose bumps brilliant 4 5 5,0.42880952380952375,0.1836904761904762,Positive,"{'Happy': 0.11, 'Angry': 0.09, 'Surprise': 0.26, 'Sad': 0.09, 'Fear': 0.46}"
10.0,Neeraj and Akshay's Terrific baby's Day out at silver screen,"Neeraj Pandey has splendid Baby's Day out with Akshay(Tarzan),Rana(Hulk),Kher (Shuklaji) and Tapsi(Honeytrap). Terrific performances and brilliant script along with awesome execution. This is the best counter terrorism cinema ever made in Bollywood. What is awesome about Baby??? Neeraj has utilize each and every actor in effective manner. Except Akshay all actor has very small window for showcase but they have given their best. Anupam Kher, Rana, Sushant Singh, KK Menon, Tapsi,Rasheed and Madhurima have glittered in small timespan. Another good thing was Dialogues: like we write religion in Bold and in Caps, Conference me hoon, Tarzan aur Hulk etc.There was no scope for Songs and dance.Baby's another important element was Cinematography. Locations from Istanbul and Arab 's desert were truly awesome. Baby is the superlative form of Madras Cafe, Vishwaroopam and A Wednesday! Neeraj and Akshay deserve a Grand Salute for Terrific cinema. #Baby'sDayout",neeraj akshays terrific babys day out at silver screen,neeraj pandey has splendid babys day out with akshay tarzan rana hulk kher shuklaji tapsi honeytrap terrific performances brilliant script along with awesome execution this is best counter terrorism cinema ever made bollywood what is awesome about baby neeraj has utilize each every actor effective manner except akshay all actor has very small window showcase but they have given their best anupam kher rana sushant singh kk menon tapsi rasheed madhurima have glittered small timespan another good thing was dialogues like we write religion bold caps conference me hoon tarzan aur hulk etc there was no scope songs dance babys another important element was cinematography locations istanbul arab s desert were truly awesome baby is superlative form madras cafe vishwaroopam wednesday neeraj akshay deserve grand salute terrific cinema,0.7992156862745097,0.5112745098039215,Positive,"{'Happy': 0.24, 'Angry': 0.04, 'Surprise': 0.48, 'Sad': 0.08, 'Fear': 0.16}"
9.0,Edge of the seat action thriller,"Baby is a superb espionage thriller with good storytelling, engaging script and patriotism with ample dose. Barring rana(he is a great actor but was not given much to perform), all the actors have given terrific performances. Akshay Kumar is perfect as Ajay, Danny denzongpa was classy and standard, taapsee was badass in her action scene, kk Menon shines in his typical style. But the show stealer is Anupam kher who despite coming in the last 30 minutes takes the limelight. Only drawback is the length and it gets dragged towards end. The walking scenes could have been edited. On the whole baby is another masterpiece from Neeraj Pandey.",edge seat action thriller,baby is superb espionage thriller with good storytelling engaging script patriotism with ample dose barring rana he is great actor but was not given much perform all actors have given terrific performances akshay kumar is perfect as ajay danny denzongpa was classy standard taapsee was badass her action scene kk menon shines his typical style but show stealer is anupam kher who despite coming last 30 minutes takes limelight only drawback is length it gets dragged towards end walking scenes could have been edited whole baby is another masterpiece neeraj pandey,0.5544444444444444,0.2955555555555555,Positive,"{'Happy': 0.19, 'Angry': 0.06, 'Surprise': 0.25, 'Sad': 0.12, 'Fear': 0.38}"
10.0,BEST SPY THRILLER EVER MADE IN INDIA,Film BABY will keep you thrilled till the end of movie...Realistic action sequences....realistic plot....great storyline....I am really glad that India is progressing,best spy thriller ever made india,film baby will keep you thrilled till end movie realistic action sequences realistic plot great storyline i am really glad that india is progressing,0.5023809523809524,0.4761904761904763,Positive,"{'Happy': 0.25, 'Angry': 0.0, 'Surprise': 0.5, 'Sad': 0.12, 'Fear': 0.12}"
10.0,Gem of Indian cinema( Neeraj ka kamaal),This is one of the best thriller I watched in my life. After watching lot of junk Bolly films this gave me different feeling. This film make you engage throughout and it will don't make bore at any moment. After special 26 Akshay and kher pair rocks in this film. Finally a must watch film can't be missed.,gem indian cinema neeraj ka kamaal,this is one best thriller i watched my life after watching lot junk bolly films this gave me different feeling this film make you engage throughout it will dont make bore at any moment after special 26 akshay kher pair rocks this film finally must watch film cant be missed,0.6178571428571429,0.3392857142857143,Positive,"{'Happy': 0.0, 'Angry': 0.0, 'Surprise': 0.33, 'Sad': 0.33, 'Fear': 0.33}"
10.0,Actually Right Act,"If the bad guys have to be punished and good people are trying to correct, catch, tame with the right approach. It approach is incorrect.. wrong approach for the wrong guys is the 'right approach'.Instead of seeing this as an Entertainment movie, learning is needed to act with actions. So system needs to understand the practicality and implement solutions demonstrated in this movie with proper measures and support to eradicate bad guys from the world.. there is no end for such thoughts, these acts by the thoughts will keep originating and should be punished.The movie is really good and actions are performed really good by Daring and really an actor Akshay Kumar !",actually right act,if bad guys have be punished good people are trying correct catch tame with right approach it approach is incorrect wrong approach wrong guys is right approach instead seeing this as entertainment movie learning is needed act with actions so system needs understand practicality implement solutions demonstrated this movie with proper measures support eradicate bad guys world there is no end such thoughts these acts by thoughts will keep originating should be punished movie is really good actions are performed really good by daring really actor akshay kumar,0.5397959183673469,0.03860544217687075,Positive,"{'Happy': 0.17, 'Angry': 0.0, 'Surprise': 0.22, 'Sad': 0.09, 'Fear': 0.52}"
10.0,One of the Finest Film of Bollywood and Akshay Kumar,"Rarely you come across an Indian movie that doesn't hit a single false note. BABY is one such film. Writer-Director Neeraj Pandey has made a brilliant film that is not only technically at par with the best in the world, but it's also a dispassionate non- judgmental take on terrorism that's completely devoid of jingoism and is extremely gripping. Full marks to Producer Bhushan Kumar for believing in such a landmark film, backed by exceptional marketing especially when it's devoid of songs. BABY is one of the finest films ever made in the history of Indian cinema. Not only because of its excellent cinematic credentials but also because of the balanced 'Thought' behind the film. Neeraj Pandey once again proves that he's a genius. This time he proves, it's possible to better Perfection. We say, hey baby, don't think, just go for BABY.A Must Watch!!!!!",one finest film bollywood akshay kumar,rarely you come across indian movie that doesnt hit single false note baby is one such film writer director neeraj pandey has made brilliant film that is not only technically at par with best world but its also dispassionate non judgmental take terrorism thats completely devoid jingoism is extremely gripping full marks producer bhushan kumar believing such landmark film backed by exceptional marketing especially when its devoid songs baby is one finest films ever made history indian cinema not only because its excellent cinematic credentials but also because balanced thought behind film neeraj pandey once again proves that hes genius this time he proves its possible better perfection we say hey baby dont think just go baby must watch,0.5854037267080744,0.20631469979296066,Positive,"{'Happy': 0.08, 'Angry': 0.04, 'Surprise': 0.4, 'Sad': 0.2, 'Fear': 0.28}"
10.0,Thriller and Nationalism at its best,"Why is it this movie does not make 200cr and salman""s rubbish makes 200cr easily is beyond belief. There is a missing jigsaw which does not make sense. Just compare it with Tiger Zinda Hai, BABY is by far a superior product and yet the public goes for salman",thriller nationalism at its best,why is it this movie does not make 200cr salman s rubbish makes 200cr easily is beyond belief there is missing jigsaw which does not make sense just compare it with tiger zinda hai baby is by far superior product yet public goes salman,0.525,0.33888888888888885,Positive,"{'Happy': 0.0, 'Angry': 0.0, 'Surprise': 0.1, 'Sad': 0.4, 'Fear': 0.5}"
10.0,Masterpiece,As everyone says its a masterpiece. Strongly recommended. Best thriller movie ever made in India.,masterpiece,as everyone says its masterpiece strongly recommended best thriller movie ever made india,0.5166666666666666,0.7166666666666667,Positive,"{'Happy': 0.0, 'Angry': 0.0, 'Surprise': 0.83, 'Sad': 0.17, 'Fear': 0.0}"
