Rating,Review Title,Review,Cleaned Review Title,Cleaned Review,Subjectivity,Polarity,Sentiment,Emotion Scale
10.0,Such a Belle after All These Years,"You know, two of the best aspects of Disney's version of Beauty & the Beast, seemed small and insignificant to most, but have stuck with me since I saw this in 1991. #1 They freely admit that this is a ""tale as old as time"" – they're not hiding that fact and #2 they're also completely up front with stating ""she's the one"" to break the curse, i.e. they don't make us wait until the end (LIKE MOVIES DO ALL THE TIME) to reveal what we've known from minute one. I respect that.Those are just two things of, I dunno, 50 great things about this near-masterpiece of filmmaking. A beautiful score, fantastic and timeless songs, gorgeous cinematography, hilarious dialogue and ""sidekicks"" and secondary characters, a story very moving, strong leads, adventure, suspense, love, funthis movie is all of those plus so much more.Watching it (for the 20th+ time but) now in the usual-Disney ""We Want Even More of Your Dollars"" way, the re-release, of course in 3D, it still held up for me. My friend and I in the theatre were rocking back and forth with the wonderful musical segments while mouthing the words – trying desperately, albeit probably failing, not to disturb other movie-goers.I will say this, despite my 10/10 Star ratingthe movie did look 21 years old, unfortunately. Some of the background characters did not move while the foreground was in motion. This was, sadly, unintentionally humorous. That said, I am a huge supporter of hand-drawn animation, or, movies people put their heart, soul, sweat & tears in VS clicking the mouse. This was old-school animation and I am fine with that. I just think this was better served, in 2012, at home to appreciate.Sure, I love re-watching classics or even movies I just like a lot, on the silver screen, but this wasn't one of those. Anyone that knows me knows I do like 3D, but I have NOT seen a single Disney 3D movie that impressed me. Especially converted ones. The ONLY good 3D imagery here was the rain & snow, and I said the same thing about The Nightmare Before Christmas's re-release in 3D. Sad, there were a lot more 3D to choose from, but I ONLY liked the rain & snow which, to me, was the only 3D that had depth.So I will NOT recommend this to be seen in theatres. I will NOT go see another Disney Classic on the big screen converted to 3D and I am no longer upset I missed The Lion King's same 3D re-issue last year. I will, however see Finding Nemo's 3D re-release later this year for several reasons: I DO NOT consider that Disney, it's my favorite Pixar film – though I haven't seen it since the original release in 2003 and the less than 2 minute preview before Beauty & the Beast looked far better in 3D than ALL of Beauty & the Beast. (On a side note, it's absolutely easier to convert that – it was 100% digital and computerized.)Stick with this classic on BluRay. I just hope they put that fantastically hilarious Tangled Ever After short (shown before this movie in the theatre.) It was a lot of fun and had us cracking up.For the movie itself: 10/10 Stars. For the 3D conversion: 2/10 Stars.",such belle after all these years,you know two best aspects disneys version beauty beast seemed small insignificant most but have stuck with me since i saw this 1991 they freely admit that this is tale as old as time theyre not hiding that fact theyre also completely up front with stating shes one break curse i e they dont make us wait until end like movies do all time reveal what weve known minute one i respect that those are just two things i dunno 50 great things about this near masterpiece filmmaking beautiful score fantastic timeless songs gorgeous cinematography hilarious dialogue sidekicks secondary characters story very moving strong leads adventure suspense love fun this movie is all those plus so much more watching it 20th time but now usual disney we want even more your dollars way re release course 3d it still held up me my friend i theatre were rocking back forth with wonderful musical segments while mouthing words trying desperately albeit probably failing not disturb other movie goers i will say this despite my 10 10 star rating movie did look 21 years old unfortunately some background characters did not move while foreground was motion this was sadly unintentionally humorous that said i am huge supporter hand drawn animation or movies people put their heart soul sweat tears vs clicking mouse this was old school animation i am fine with that i just think this was better served 2012 at home appreciate sure i love re watching classics or even movies i just like lot silver screen but this wasnt one those anyone that knows me knows i do like 3d but i have not seen single disney 3d movie that impressed me especially converted ones only good 3d imagery here was rain snow i said same thing about nightmare before christmass re release 3d sad there were lot more 3d choose but i only liked rain snow which me was only 3d that had depth so i will not recommend this be seen theatres i will not go see another disney classic big screen converted 3d i am no longer upset i missed lion kings same 3d re issue last year i will however see finding nemos 3d re release later this year several reasons i do not consider that disney its my favorite pixar film though i havent seen it since original release 2003 less than 2 minute preview before beauty beast looked far better 3d than all beauty beast side note its absolutely easier convert that it was 100 digital computerized stick with this classic bluray i just hope they put that fantastically hilarious tangled ever after short shown before this movie theatre it was lot fun had us cracking up movie itself 10 10 stars 3d conversion 2 10 stars,0.5412026862026862,0.21915750915750917,Positive,"{'Happy': 0.26, 'Angry': 0.06, 'Surprise': 0.24, 'Sad': 0.25, 'Fear': 0.2}"
10.0,Tale as old as time...,"This animated masterpiece is and will always stay one of the best romantic movies ever created.This is one of those rare movies in which everything comes perfectly together. The characters, the music, the humor, the pace, the story everything in this movie is just perfect. It's a highly memorable movie that everyone should watch at least once in their lifetime.The movie is beautifully animated and it features some of the best Disney characters. Mrs. Potts, Cogsworth, Lumiere and of course Belle and the Beast are highly memorable and very well constructed characters. Also the villain role Gaston which is always one of the most important elements of a Disney movie is a good one. However the villain isn't as prominent to the story as in most other Disney animated movies is the case. This movie truly is about love and the beauty inside. The movie its love story is nicely supported by the very good songs composed by Alan Menken and with lyrics by Howard Ashman. Unfortunately this was Howard Ashman's last project and he died before he could receive his well deserved Oscar for this movie. Unique fact is that this movie was also even nominated for the 'Best Picture' Oscar. Something that was really well deserved by the way. The story is quite 'mature' but also there is still plenty to enjoy for the little one's here. The movie is filled with lots of humor and imaginative characters. The movie is told in very good quick pace and features some of the best editing I have ever seen in an animated movie.The voice cast consists out of some good actors; Angela Lansbury and Jerry Orbach are especially perfect for their roles.The movie features some unforgettable classic moments and is a milestone in animated movie making. An highly recommendable animated romantic movie that shall always remain one of the best romantic movies ever made. This movie is recommendable to everyone, even those who normally don't like romantic stories and movies, thrust me, you'll love this movie.10/10http://bobafett1138.blogspot.com/",tale as old as time,this animated masterpiece is will always stay one best romantic movies ever created this is one those rare movies which everything comes perfectly together characters music humor pace story everything this movie is just perfect its highly memorable movie that everyone should watch at least once their lifetime movie is beautifully animated it features some best disney characters mrs potts cogsworth lumiere course belle beast are highly memorable very well constructed characters also villain role gaston which is always one most important elements disney movie is good one however villain isnt as prominent story as most other disney animated movies is case this movie truly is about love beauty inside movie its love story is nicely supported by very good songs composed by alan menken with lyrics by howard ashman unfortunately this was howard ashmans last project he died before he could receive his well deserved oscar this movie unique fact is that this movie was also even nominated best picture oscar something that was really well deserved by way story is quite mature but also there is still plenty enjoy little ones here movie is filled with lots humor imaginative characters movie is told very good quick pace features some best editing i have ever seen animated movie voice cast consists out some good actors angela lansbury jerry orbach are especially perfect their roles movie features some unforgettable classic moments is milestone animated movie making highly recommendable animated romantic movie that shall always remain one best romantic movies ever made this movie is recommendable everyone even those who normally dont like romantic stories movies thrust me youll love this movie 10 10,0.6099637681159421,0.44005434782608693,Positive,"{'Happy': 0.26, 'Angry': 0.04, 'Surprise': 0.3, 'Sad': 0.23, 'Fear': 0.18}"
10.0,"""The Perfect Animated Movie""","In the opening of Beauty and The Beast, we find out more about the characters in the first five minutes, then many movies tell us in half an hour. Taking a risk, and opening an animated film with a long musical number was a risky move, but as it turns out, a perfectly wonderful idea. From the opening to the end, we are totally captivated by this wonderful achievement in music and animation as we have never been before.Unlike many animated Disney movies where a song may be thrown in here and there, and do little to move the story along, each song here is directly related to the story line, moves the movie along, and leaves us anticipating the next big number. Alan Menken and Howard Ashman deserve every bit of the praise they received for this film, and then some.All the characters in this film are so well animated and voiced, you never once think about the fact that you are watching an animated movie, as is often the case. From the town that Belle lives in, to the Beast castle, the backgrounds are beautifully rendered in detail, and vibrant alive colors. In 1991, this was a ground breaking, animated film, and over ten years later, as much as I enjoy many of the new computer animated movies such as Shrek and Toy Story, none has come close to the accomplishments of Beauty and the Beast, which mixes romance, music, comedy and drama, in a perfect blend that may never be seen again.",perfect animated movie,opening beauty beast we find out more about characters first five minutes then many movies tell us half hour taking risk opening animated film with long musical number was risky move but as it turns out perfectly wonderful idea opening end we are totally captivated by this wonderful achievement music animation as we have never been before unlike many animated disney movies where song may be thrown here there do little move story along each song here is directly related story line moves movie along leaves us anticipating next big number alan menken howard ashman deserve every bit praise they received this film then some all characters this film are so well animated voiced you never once think about fact that you are watching animated movie as is often case town that belle lives beast castle backgrounds are beautifully rendered detail vibrant alive colors 1991 this was ground breaking animated film over ten years later as much as i enjoy many new computer animated movies such as shrek toy story none has come close accomplishments beauty beast which mixes romance music comedy drama perfect blend that may never be seen again,0.4735151515151515,0.2999545454545455,Positive,"{'Happy': 0.18, 'Angry': 0.0, 'Surprise': 0.29, 'Sad': 0.15, 'Fear': 0.38}"
10.0,"This film, to me, is one of the finest Disney films ever made!","This film, from it's opening narration, to the end credits, is a beautifully animated adaptation of a well known classic.When I first saw this, I was captivated by both the animation and the story. It's a nice tale, and as always, has something to teach us. The songs are really great too. Every one in this movie, is beautifully sung and well orchestrated. Everyone knows the song ""Be our guest"" and it brings a smile to my face every time I hear/see it.The villain of the piece is of course Mr Universe with his bulging biceps and pearly white teeth, and we as an audience can't wait for the inevitable confrontation between him and the Beast.But to me, the real star of this film is Mrs Potts (Angela Lansbury). She sings THAT song wonderfully, and sends a shiver down my back, and brings a tear to my eye every time!!This is, I must say, Disney at their best, they don't make them like this anymore, and it shows that when people care about something that they make, it'll all work out, and everyone will be happy ever after.10/10Enjoy!",this film me is one finest disney films ever made,this film its opening narration end credits is beautifully animated adaptation well known classic when i first saw this i was captivated by both animation story its nice tale as always has something teach us songs are really great too every one this movie is beautifully sung well orchestrated everyone knows song be our guest it brings smile my face every time i hear see it villain piece is course mr universe with his bulging biceps pearly white teeth we as audience cant wait inevitable confrontation between him beast but me real star this film is mrs potts angela lansbury she sings that song wonderfully sends shiver down my back brings tear my eye every time this is i must say disney at their best they dont make them like this anymore it shows that when people care about something that they make itll all work out everyone will be happy ever after 10 10enjoy,0.5492592592592591,0.444074074074074,Positive,"{'Happy': 0.18, 'Angry': 0.0, 'Surprise': 0.29, 'Sad': 0.32, 'Fear': 0.21}"
10.0,"One of Disney's best, and my favorite.","This is what I think one of Disney's best animated features, either cartoon short or full-length animated feature film. It is also my favorite Disney movie, about a Beast (an enchanted prince) who has been losing hope to learn to love and be loved in return in order to break the enchanted spell, until he meets Belle. Belle offers to stay in the castle with the Beast in exchange for her imprisoned father to be set free. What follows is a beautiful love story in how Belle attempts to tame the Beast as he learns the proper manners to be a gentleman from her, and attempting to learn to love and be loved in return.Gary Trousdale and Kirk Wise did a marvelous job directing this movie, providing a solid plot that offered a captivating, exciting and heartwarming story of adventure, courage and love. The chemistry between Belle and the Beast will capture your heart and probably put a lump in your throat; it is captured in a way that sent a strong message of changing one's way for the better, humility and acts of selflessness.The characters, especially the enchanted objects, are very lovable and extraordinary, each one giving his/her own unique charm, including: Lumiere, a lovestruck, suave-talking candelabra; Cogsworth, a pompous and prim table clock; Mrs. Potts, the kind-hearted and warm teapot; and Chip, Mrs. Potts' son and an inquisitive teacup. I love the constant competition between Lumiere and Cogsworth as they try to win Belle's liking and command of the castle's duties. All the objects provided the right touch of humor and comedy for a dramatic love story.Alan Menken did a great job on the music score - very spirited, lively and moving. And, my hat is off to some of the greatest songs, by Menken and Howard Ashman, in cinema history: Be Our Guest and Beauty and the Beast. Lumiere and Mrs. Potts (Jerry Orbach and Angela Lansbury) sang ""Be Our Guest"" during a grand dinner for Belle. As the enchanted objects performed dances and acrobats to the song, it gave what I think are some of the best pieces of animation work in history. Just the unveiling of the chandelier and the Eiffel Tower forming under a bevy of wineglasses are breathtaking. And, the song ""Beauty and the Beast,"" sung by Mrs. Potts (Lansbury), is a beautiful and stirring song that basically summarizes the entire movie - ""tale as old as time,"" ""sweet and strength,"" ""finding you can change,"" ""Beauty and the Beast."" Other memorable characters I like to mention are the conceited and villainous Gaston (Richard White), the slapstick and somewhat clueless LeFou (Jesse Corti) and the brilliant and bold inventor Maurice (Rex Everhart).There is never a slow or dull moment in this movie - it is thoroughly entertaining and exciting from start to finish. This movie definitely has that ""Disney touch,"" which makes it that much more special. It is the perfect one for audiences of all ages, one to watch again and again and, for myself, will remain my favorite Disney film, animated feature in general and one of my favorite movies of all time.Grade A+",one disneys best my favorite,this is what i think one disneys best animated features either cartoon short or full length animated feature film it is also my favorite disney movie about beast enchanted prince who has been losing hope learn love be loved return order break enchanted spell until he meets belle belle offers stay castle with beast exchange her imprisoned father be set free what follows is beautiful love story how belle attempts tame beast as he learns proper manners be gentleman her attempting learn love be loved return gary trousdale kirk wise did marvelous job directing this movie providing solid plot that offered captivating exciting heartwarming story adventure courage love chemistry between belle beast will capture your heart probably put lump your throat it is captured way that sent strong message changing ones way better humility acts selflessness characters especially enchanted objects are very lovable extraordinary each one giving his her own unique charm including lumiere lovestruck suave talking candelabra cogsworth pompous prim table clock mrs potts kind hearted warm teapot chip mrs potts son inquisitive teacup i love constant competition between lumiere cogsworth as they try win belles liking command castles duties all objects provided right touch humor comedy dramatic love story alan menken did great job music score very spirited lively moving my hat is off some greatest songs by menken howard ashman cinema history be our guest beauty beast lumiere mrs potts jerry orbach angela lansbury sang be our guest during grand dinner belle as enchanted objects performed dances acrobats song it gave what i think are some best pieces animation work history just unveiling chandelier eiffel tower forming under bevy wineglasses are breathtaking song beauty beast sung by mrs potts lansbury is beautiful stirring song that basically summarizes entire movie tale as old as time sweet strength finding you can change beauty beast other memorable characters i like mention are conceited villainous gaston richard white slapstick somewhat clueless lefou jesse corti brilliant bold inventor maurice rex everhart there is never slow or dull moment this movie it is thoroughly entertaining exciting start finish this movie definitely has that disney touch which makes it that much more special it is perfect one audiences all ages one watch again again myself will remain my favorite disney film animated feature general one my favorite movies all time grade,0.661830357142857,0.43261803300865803,Positive,"{'Happy': 0.32, 'Angry': 0.04, 'Surprise': 0.15, 'Sad': 0.17, 'Fear': 0.32}"
10.0,Beauty and the Beast,"One of the best Disney movies, Belle is the best Disney princess. The message of the film was excellent. The characters of the servants in the palace were very interesting. Evil wasn't the movie very well, but it fulfilled the purpose, the songs in the movie. The pictures were great in the movie, so beautiful. I love the old style of drawing",beauty beast,one best disney movies belle is best disney princess message film was excellent characters servants palace were very interesting evil wasnt movie very well but it fulfilled purpose songs movie pictures were great movie so beautiful i love old style drawing,0.61,0.51,Positive,"{'Happy': 0.64, 'Angry': 0.0, 'Surprise': 0.18, 'Sad': 0.0, 'Fear': 0.18}"
