Rating,Review Title,Review,Cleaned Review Title,Cleaned Review,Subjectivity,Polarity,Sentiment,Emotion Scale
10.0,Romantic Masterpiece: Disney's Greatest Film,"Beauty and the Beast (1991): Paige O'Hara, Robby Benson, Richard White, Rex Everhart, Jerry Orbach, David Ogden Stiers, Angela Lansbury, Jesse Corti, Bradley Pierce, Jo Anne Worley, Mary Kay Bergman, Kath Soucie Kimmy Robertson, Brian Cummings, Tony Jay, Alvin Epstein, Frank Welker, Scott Barnes, Bruce Adler, Jack Angel, Vanna Bonta....Disney entered the 1990's with ""Beauty and the Beast"", by far their most unabashedly romantic film and for many viewers, their all-time greatest achievement. There is so much to admire and love about this terrific film which was adored by the critics and hailed as an instant classic at the time of its release in 1991. It was so loved that it became the first animated film ever to be nominated for Best Picture at the Oscars. The 18th century French fairy-tale is given a twist to cater to a more modern audience A selfish and heartless prince (Robby Benson) falls victim to an enchantress' curse and is transformed into a beast. His castle is bewitched and even his domestics are turned into household objects such as candelabras, clocks, feather dusters, teacups and kitchen utensils. Only the love of a woman can redeem the prince and only when she sees past the monster and into his humanity can he become human again. Enter Belle (Paige 0'Hara)the beautiful single daughter of an old and eccentric inventor Maurice (Rex Everhart) who lives in a small town in rural France. Belle stands out from the other townsfolk in her fondness for books, her individuality and her intellect. Bored of provincial life, she longs for ""adventure in the great wide somewhere"". She's pursued by Gaston (Richard White) a hunky but vain, self-absorbed and wicked hunter who wants to marry Belle and make her his ""trophy wife"". When Maurice sets off to sell his new invention to a fair, he becomes lost in the woods and stumbles into the Beast's castle. Before long he becomes his prisoner. Belle comes to the rescue but in order to save her father she must replace him as the Beast's prisoner. What ensues is a ""tale as old as time"". Despite his monstrousness, Belle learns to see past all that and in time tames the Beast herself. Their relationship is based on respect for one another as human beings, exemplified when Beast saves Belle's life and she in turn saves his. But it's not long before the villagers discover the Beast's existence and Gaston leads a murderous mob to attack the castle. The late Broadway singer Jerry Orbach provides comic relief as Lumiere, an amorous French candelabra and David Ogden Stiers portrays the stuffy British clock Cogsworth. Broadway icon and British actress Angela Lansbury portrays the kindly voice of reason, Mrs. Potts and young Bradley Pierce portrays her son Chip. Jesse Corti plays Lefou, Gaston's awkward and goofy sidekick. These minor characters, purely there for comic relief and cuteness, not only entertains younger audiences but they are so wonderfully portrayed by the actor's voices that even adults can enjoy them. It is through voices that can act as well as sing (Paige O'Hara, Richard White, Jerry Orbach and Angela Lansbury are all Broadway singers) in harmony with a solid plot and superior animation that this film truly shines. Beauty and the Beast still ranks as Disney's all-time greatest after 16 years. In fact, Disney does not make films like this anymore, owing to the excess use of computer graphics which can often dominate the story itself. Shortly after the success of the film, a Broadway musical was made, one that is still enjoyed to this date. And this film contains many wonderful song numbers: ""Belle"" - a gossip song as the villagers follow Belle on her way to the bookstore, ""Gaston"" sung by Gaston and his drinking buddies in his honor, ""Be Our Guest"" as the enchanted castle's staff entertains Belle for dinner, ""Something There"" a duet sung by the leads as they begin to fall in love and the title song ""Beauty and the Beast"" sung by Mrs. Potts as the newfound friends waltz beneath an opulent chandelier. This romantic song was popularized when a young Celine Dion, not yet a major star, sang a duet with Peabo Bryson for the soundtrack. With its theme of beauty found within, a woman's courage and virtue rewarded, the movie is also a sort of women's empowerment film for girls. Belle, the first Disney princess of the 90's, is strong, resourceful and dares to be different. Far from being a damsel in distress, it is she who rescues the Beast from doom and fights the villain Gaston by firmly renouncing him as a lover. Brilliant music and songs by Alan Menken and a splendid cinematography that used stunning computer-graphic art for such scenes as the ballroom waltz, this film was ahead of its time and marked the beginning of the great Disney films of the 90's - Aladdin, Lion King, Pocahontas, Hunchback of Notre Dame and others, all which used special effects made of computer graphic art. For this film, animators drew inspiration from Romantic 19th century art(Fragonard and Bouche) and from Loire Valley castles. Animators also drew from Cocteau's 1946 live-action version. The look of this film, the attention to detail, is a real winner and it's a pity that Disney does not return to pure animation. For me, this is the zenith of Disney animation and a representation of classic Disney at its best in the 1990's. This is a wonderful film for both young and old and looks as great as it ever did, thanks to restorations as seen on the new DVD version, where you can enjoy seeing how the film was made and scenes that were never part of the original theatrical release. Enjoy this romantic classic today with a date or with the whole family.",romantic masterpiece disneys greatest film,beauty beast 1991 paige ohara robby benson richard white rex everhart jerry orbach david ogden stiers angela lansbury jesse corti bradley pierce jo anne worley mary kay bergman kath soucie kimmy robertson brian cummings tony jay alvin epstein frank welker scott barnes bruce adler jack angel vanna bonta disney entered 1990s with beauty beast by far their most unabashedly romantic film many viewers their all time greatest achievement there is so much admire love about this terrific film which was adored by critics hailed as instant classic at time its release 1991 it was so loved that it became first animated film ever be nominated best picture at oscars 18th century french fairy tale is given twist cater more modern audience selfish heartless prince robby benson falls victim enchantress curse is transformed into beast his castle is bewitched even his domestics are turned into household objects such as candelabras clocks feather dusters teacups kitchen utensils only love woman can redeem prince only when she sees past monster into his humanity can he become human again enter belle paige 0hara beautiful single daughter old eccentric inventor maurice rex everhart who lives small town rural france belle stands out other townsfolk her fondness books her individuality her intellect bored provincial life she longs adventure great wide somewhere shes pursued by gaston richard white hunky but vain self absorbed wicked hunter who wants marry belle make her his trophy wife when maurice sets off sell his new invention fair he becomes lost woods stumbles into beasts castle before long he becomes his prisoner belle comes rescue but order save her father she must replace him as beasts prisoner what ensues is tale as old as time despite his monstrousness belle learns see past all that time tames beast herself their relationship is based respect one another as human beings exemplified when beast saves belles life she turn saves his but its not long before villagers discover beasts existence gaston leads murderous mob attack castle late broadway singer jerry orbach provides comic relief as lumiere amorous french candelabra david ogden stiers portrays stuffy british clock cogsworth broadway icon british actress angela lansbury portrays kindly voice reason mrs potts young bradley pierce portrays her son chip jesse corti plays lefou gastons awkward goofy sidekick these minor characters purely there comic relief cuteness not only entertains younger audiences but they are so wonderfully portrayed by actors voices that even adults can enjoy them it is through voices that can act as well as sing paige ohara richard white jerry orbach angela lansbury are all broadway singers harmony with solid plot superior animation that this film truly shines beauty beast still ranks as disneys all time greatest after 16 years fact disney does not make films like this anymore owing excess use computer graphics which can often dominate story itself shortly after success film broadway musical was made one that is still enjoyed this date this film contains many wonderful song numbers belle gossip song as villagers follow belle her way bookstore gaston sung by gaston his drinking buddies his honor be our guest as enchanted castles staff entertains belle dinner something there duet sung by leads as they begin fall love title song beauty beast sung by mrs potts as newfound friends waltz beneath opulent chandelier this romantic song was popularized when young celine dion not yet major star sang duet with peabo bryson soundtrack with its theme beauty found within womans courage virtue rewarded movie is also sort womens empowerment film girls belle first disney princess 90s is strong resourceful dares be different far being damsel distress it is she who rescues beast doom fights villain gaston by firmly renouncing him as lover brilliant music songs by alan menken splendid cinematography that used stunning computer graphic art such scenes as ballroom waltz this film was ahead its time marked beginning great disney films 90s aladdin lion king pocahontas hunchback notre dame others all which used special effects made computer graphic art this film animators drew inspiration romantic 19th century art fragonard bouche loire valley castles animators also drew cocteaus 1946 live action version look this film attention detail is real winner its pity that disney does not return pure animation me this is zenith disney animation representation classic disney at its best 1990s this is wonderful film both young old looks as great as it ever did thanks restorations as seen new dvd version where you can enjoy seeing how film was made scenes that were never part original theatrical release enjoy this romantic classic today with date or with whole family,0.4963404589510783,0.22524374592958668,Positive,"{'Happy': 0.26, 'Angry': 0.04, 'Surprise': 0.19, 'Sad': 0.2, 'Fear': 0.31}"
,Magical,"Who can resist this beautiful story? I love the fact that even though Belle hated Beast at first, she saw underneath that he was a kind and gentle soul, and didn't care what he looked like on the outside! And what girl hasn't known a Gaston in their lives? I thought it was so great how he was put in his place! All the voiceovers are amazing, especially Robby Benson as Beast. Another Disney masterpiece.",magical,who can resist this beautiful story i love fact that even though belle hated beast at first she saw underneath that he was kind gentle soul didnt care what he looked like outside what girl hasnt known gaston their lives i thought it was so great how he was put his place all voiceovers are amazing especially robby benson as beast another disney masterpiece,0.7303030303030303,0.30909090909090914,Positive,"{'Happy': 0.29, 'Angry': 0.0, 'Surprise': 0.43, 'Sad': 0.21, 'Fear': 0.07}"
10.0,"Life Before and After ""Beauty and the Beast""","To date, my favorite animated Disney film.In 1938, Walt Disney received a special Academy Award for producing ""Snow White and the Seven Dwarfs"" and bringing a new standard to motion picture cartoons. Then in 1941, the Academy gave ""Fantasia"" a couple of special awards as another watermark animated film. ""Beauty and the Beast"" deserves to stand along side both of those films as one that changed animated films forever. For me, there are animated films before ""Beauty"" and after. Not since Disney's very first animated films (""Snow White,"" ""Pinnochio"") had one blended music and story so masterfully. But what sets ""Beauty"" apart from others is, strangely enough, the acting. The voice work is so perfectly matched with the way the characters are drawn that it's almost possible to forget you're watching two-dimensional creations.An enchanting film.Grade: A+",life before after beauty beast,date my favorite animated disney film 1938 walt disney received special academy award producing snow white seven dwarfs bringing new standard motion picture cartoons then 1941 academy gave fantasia couple special awards as another watermark animated film beauty beast deserves stand along side both those films as one that changed animated films forever me there are animated films before beauty after not since disneys very first animated films snow white pinnochio had one blended music story so masterfully but what sets beauty apart others is strangely enough acting voice work is so perfectly matched with way characters are drawn that its almost possible forget youre watching two dimensional creations enchanting film grade,0.5023643023643024,0.2827422577422577,Positive,"{'Happy': 0.25, 'Angry': 0.04, 'Surprise': 0.25, 'Sad': 0.04, 'Fear': 0.42}"
8.0,Be a Guest...,"... and be entertained with 90 minutes of mesmerising fairy tale telling at its very best. Feel as enchanted as the castle and its occupants as your spirits and emotions rise and fall then rise again. Rejoice in the spectacular finale, while relishing the craft of these incredible animators, musicians, writers, their genius and imagination but, above all, let the meaning and the message distil within you - avoid the shallowness of appearance, don't judge a book by its cover, we're all so much more than what we present.",be guest,be entertained with 90 minutes mesmerising fairy tale telling at its very best feel as enchanted as castle its occupants as your spirits emotions rise fall then rise again rejoice spectacular finale while relishing craft these incredible animators musicians writers their genius imagination but above all let meaning message distil within you avoid shallowness appearance dont judge book by its cover were all so much more than what we present,0.465,0.5,Positive,"{'Happy': 0.25, 'Angry': 0.0, 'Surprise': 0.25, 'Sad': 0.33, 'Fear': 0.17}"
10.0,Breathtaking,"When I saw the first advertising for Beauty and the Beast -- a cardboard stand-up in a movie theater -- I nearly burst into tears. Just the ADVERTISEMENT was hauntingly beautiful, tapping into some deep human reality. Hasn't everyone, at some time, felt like a hideous beast hungry for someone to love us as we are and in doing so, transform us into something beautiful?The film itself more than delivered. Belle was the first Disney heroine who wasn't either boy-crazy or a doormat/victim. She has brains, heart, and above all, character. The Beast's transformation from monster to hero is believable and poignant. In a world where possessiveness has become the norm (witness the selfish custody battles of birth parents tearing children from the only homes they've ever known), the Beast's heart-wrenching insistence that he had to let Belle leave because he loves her is a breath of fresh air.The music is perfection, the animation astonishing. Together they raise filmmaking of any kind to new challenges. The ballroom scene is heartbreakingly beautiful.If you've been in a coma for ten years or have some other excuse for never having seen this gem of a movie, correct that omission as soon as possible. And have a hankie nearby.",breathtaking,when i saw first advertising beauty beast cardboard stand up movie theater i nearly burst into tears just advertisement was hauntingly beautiful tapping into some deep human reality hasnt everyone at some time felt like hideous beast hungry someone love us as we are doing so transform us into something beautiful film itself more than delivered belle was first disney heroine who wasnt either boy crazy or doormat victim she has brains heart above all character beasts transformation monster hero is believable poignant world where possessiveness has become norm witness selfish custody battles birth parents tearing children only homes theyve ever known beasts heart wrenching insistence that he had let belle leave because he loves her is breath fresh air music is perfection animation astonishing together they raise filmmaking any kind new challenges ballroom scene is heartbreakingly beautiful if youve been coma ten years or have some other excuse never having seen this gem movie correct that omission as soon as possible have hankie nearby,0.5554152637485972,0.21245791245791246,Positive,"{'Happy': 0.23, 'Angry': 0.03, 'Surprise': 0.17, 'Sad': 0.37, 'Fear': 0.2}"
