Rating,Review Title,Review,Cleaned Review Title,Cleaned Review,Subjectivity,Polarity,Sentiment,Emotion Scale
,Classy piece of animation,"When an arrogant Prince turns away an old woman looking for shelter with only a rose for a gift, she warns him not to just take the surface appearance as being the all of a person; however he rejects her a second time  only for her to reveal herself as a beautiful enchantress. She casts a spell on him, turning him into a beast with the only hope of return being to fall in love with a woman and have her fall in love with him before the rose wilts and dies. Resembling a carpet stuffed with walnuts, the prince figures he has no chance and withdraws into his castle. When an elderly man wanders into the castle, the Beast holds him prisoner and only lets him go when his daughter, Belle, offers to replace him in the Beast's castle. With time running out, the Beast's staff hope that Belle will be the one to break the curse but the Beast cannot remember how.Being quite a cynical, acerbic person I must admit that I prefer modern animated films that deliver lots of adult humour along with a good emotional story and often I struggle to enjoy films that take the more traditional Disney route. However with this film I was quite taken by how classy the whole affair was, with great effort being shown in every area from the animation, to the songs through to the emotionally involving story whose telling is touched with a nice sense of wonder throughout. The story doesn't really hit many bum notes (I thought Gaston's sidekick was a bit too obvious and half cooked) and it is interesting and enjoyable for the vast majority of the time. The story and comedy is aimed at both adults and children  but the stuff for kids is not basic pratfalls, nor is the adult material just a load of references or suggestive jokes. Instead the two are quite well blended with good physical comedy and plenty of wit. Again, it is the sense of spectacle and wonder that came through that I really appreciated.The animation feels more impressive for the reliance on mostly traditional animation rather than computer effects  in fact the computer effects look a bit dated now, even if they do still produce the goods in some key scenes. Mainly it is the feeling that every frame has had a lot of effort and love put into it that makes the whole affair feel classy. The songs are also great and feature quite a few memorable songs that stick in the mind; meanwhile the choreography of these scenes is generally very imaginative (Be Our Guest was my favourite). The cast don't feature many big stars and perhaps this is good because the real people don't distract from their characters. That said, I thought that Benson, O'Hara, White and a few others were quite unremarkable even if they were good enough for the film. Orbach, Stiers, Lansbury and others provided comic work in the support characters and everything worked well.Overall this is a really classy animated film that shows the effort and care put into it in many different regards. It does suffer a bit from cuteness and sentimentality but I didn't think this was a massive problem or something that was not to be expected from Disney and generally I really enjoyed the film and see it as one of the films that define Disney for people of my generation.",classy piece animation,when arrogant prince turns away old woman looking shelter with only rose gift she warns him not just take surface appearance as being all person however he rejects her second time only her reveal herself as beautiful enchantress she casts spell him turning him into beast with only hope return being fall love with woman have her fall love with him before rose wilts dies resembling carpet stuffed with walnuts prince figures he has no chance withdraws into his castle when elderly man wanders into castle beast holds him prisoner only lets him go when his daughter belle offers replace him beasts castle with time running out beasts staff hope that belle will be one break curse but beast cannot remember how being quite cynical acerbic person i must admit that i prefer modern animated films that deliver lots adult humour along with good emotional story often i struggle enjoy films that take more traditional disney route however with this film i was quite taken by how classy whole affair was with great effort being shown every area animation songs through emotionally involving story whose telling is touched with nice sense wonder throughout story doesnt really hit many bum notes i thought gastons sidekick was bit too obvious half cooked it is interesting enjoyable vast majority time story comedy is aimed at both adults children but stuff kids is not basic pratfalls nor is adult material just load references or suggestive jokes instead two are quite well blended with good physical comedy plenty wit again it is sense spectacle wonder that came through that i really appreciated animation feels more impressive reliance mostly traditional animation rather than computer effects fact computer effects look bit dated now even if they do still produce goods some key scenes mainly it is feeling that every frame has had lot effort love put into it that makes whole affair feel classy songs are also great feature quite few memorable songs that stick mind meanwhile choreography these scenes is generally very imaginative be our guest was my favourite cast dont feature many big stars perhaps this is good because real people dont distract their characters that said i thought that benson ohara white few others were quite unremarkable even if they were good enough film orbach stiers lansbury others provided comic work support characters everything worked well overall this is really classy animated film that shows effort care put into it many different regards it does suffer bit cuteness sentimentality but i didnt think this was massive problem or something that was not be expected disney generally i really enjoyed film see it as one films that define disney people my generation,0.5723917748917751,0.24818181818181811,Positive,"{'Happy': 0.28, 'Angry': 0.04, 'Surprise': 0.26, 'Sad': 0.19, 'Fear': 0.23}"
9.0,One of Disney's Best!,"Beauty and the Beast is an engaging movie with so much care and beauty fused into its core. Beauty is much more than just an influential animated classic. It is a grand and powerful fable, sugar coated with the best animation effort in a time where CGI was becoming a movie mainstay. In its finest moments, Beauty is a rousing musical, making your head move and getting caught up right in the mix. The score is unforgettable and the characters are so easy to get into. A movie that children and adults alike will love, Disney deserved its Academy Award nominations for creating such a joy.Small town Belle longs for more than a local life, maintaining her imagination through books and taking care of her kind, yet eccentric father. But when their horse returns without papa, Belle sets out to find the awful truth in an enchanted castle.You can see that so much time and care was spent in drawing this masterpiece. I cannot think of many other movies that show such meticulous background and animation. That such effort is woven effortlessly into its songs that make Beauty and the Beast the timeless classic Disney rightfully lauds itself over. 'Be Our Guest,' 'Beauty and the Beast,' 'Gaston,' you will be humming these songs at one point in your your life! Kudos to Disney for creating a charismatic, attractive villain in Gaston. He would not be a villain if he was not such a jerk. You must watch this movie at least once in your life, in a comfortable sofa and with the sound turned right up for the Broadway scores. You will enjoy it!",one disneys best,beauty beast is engaging movie with so much care beauty fused into its core beauty is much more than just influential animated classic it is grand powerful fable sugar coated with best animation effort time where cgi was becoming movie mainstay its finest moments beauty is rousing musical making your head move getting caught up right mix score is unforgettable characters are so easy get into movie that children adults alike will love disney deserved its academy award nominations creating such joy small town belle longs more than local life maintaining her imagination through books taking care her kind yet eccentric father but when their horse returns without papa belle sets out find awful truth enchanted castle you can see that so much time care was spent drawing this masterpiece i cannot think many other movies that show such meticulous background animation that such effort is woven effortlessly into its songs that make beauty beast timeless classic disney rightfully lauds itself over be our guest beauty beast gaston you will be humming these songs at one point your your life kudos disney creating charismatic attractive villain gaston he would not be villain if he was not such jerk you must watch this movie at least once your life comfortable sofa with sound turned right up broadway scores you will enjoy it,0.5260296010296008,0.2787323037323038,Positive,"{'Happy': 0.29, 'Angry': 0.07, 'Surprise': 0.19, 'Sad': 0.07, 'Fear': 0.38}"
10.0,Perfection.,"This is, without a doubt, the best film Disney ever made. Now that's saying a lot, as the studio also made ""Bambi"", ""Little Mermaid"" and many other great films. ""Beauty and the Beast"" represents everything they could do right in a movie. The music is fantastic and couldn't be better (mostly because many of the songs had a great sense of humor), the characters wonderful and the story promoted some of the most wonderful values you could want. Belle is a completely admirable young lady--and I was thrilled that my own daughters could watch her and learn about her strength and integrity. And, the film is fun--yet will also bring a tear to the eye of even the most jaded viewer. Not surprisingly the film was nominated for Best Picture--it's just a shame that an animated film will probably never take home this Oscar. Well worth seeing and owning--a truly great film.",perfection,this is without doubt best film disney ever made now thats saying lot as studio also made bambi little mermaid many other great films beauty beast represents everything they could do right movie music is fantastic couldnt be better mostly because many songs had great sense humor characters wonderful story promoted some most wonderful values you could want belle is completely admirable young lady i was thrilled that my own daughters could watch her learn about her strength integrity film is fun yet will also bring tear eye even most jaded viewer not surprisingly film was nominated best picture its just shame that animated film will probably never take home this oscar well worth seeing owning truly great film,0.5608630952380952,0.47596726190476196,Positive,"{'Happy': 0.24, 'Angry': 0.0, 'Surprise': 0.31, 'Sad': 0.28, 'Fear': 0.17}"
10.0,Great animation,"Truly one of the greatest animated films ever put on the big screen. This film is extremely emotional, romantic, and magical. The incredible characters are so lovely to be around. Has a FEW all time great musical numbers that will stick with you forever. A message that will forever be important and truly a tale as old as time!",great animation,truly one greatest animated films ever put big screen this film is extremely emotional romantic magical incredible characters are so lovely be around has few all time great musical numbers that will stick with you forever message that will forever be important truly tale as old as time,0.5923076923076923,0.3692307692307692,Positive,"{'Happy': 0.42, 'Angry': 0.0, 'Surprise': 0.17, 'Sad': 0.17, 'Fear': 0.25}"
10.0,One word=F-L-A-W-L-E-S-S!,"This movie is without doubt the best animated movie of all time. The artistry was perfect. I was spellbound at the animated sequences to the songs ""Be Our Guest"" and ""Beauty and the Beast"" especially. The characters were very well drawn, and because of the dark and colourful backgrounds, the film looked beautiful. The songs are fantastic. Another movie with great songs is ""The Hunchback of Notre Dame""(which has the best beginning to a Disney movie). In fact, all the Alan Menken scores are brilliant, with the exception of Home On The Range, which is one of the weaker Disney efforts. My personal favourites, were the songs I just mentioned, and ""Gaston"" was great fun too. The incidental music was the best in any Disney movie, and that is the same with the other Menken scores. The music in the transformation of the Beast was phenomenal, as well as the animation, and reminded me of the last movement of Berlioz's Symphonie Fantastique, which is really frightening. Another Disney with great incidental music is ""The Lion King"". The story is quite simply one of the best love stories ever, and the characters are wonderful. Belle was voiced beautifully by Paige O'Hara, who has a beautiful singing voice. I love Belle, she is beautiful, clever and strong, and is one of the best Disney characters for those reasons. Gaston was made into a complex villain, and quite narcissistic(great idea Disney). When he was nasty he was quite frightening, and Richard White can really sing. Jerry Orbach and David Ogden Stiers were really entertaining as Lumiere and Cogsworth,(I just love how witty, elegant and debonair Lumiere is) and Angela Lansbury gives a brilliant rendition of the title song. The best voice over was that of the Beast, who was very frightening, and there were some parts that were truly sensitive. Why are some people fussed about him as a human? Remember, true beauty comes from within. In conclusion, an essential to your Disney collection with a very poignant ending. 10/10. Bethany Cox",one word f l w l e s s,this movie is without doubt best animated movie all time artistry was perfect i was spellbound at animated sequences songs be our guest beauty beast especially characters were very well drawn because dark colourful backgrounds film looked beautiful songs are fantastic another movie with great songs is hunchback notre dame which has best beginning disney movie fact all alan menken scores are brilliant with exception home range which is one weaker disney efforts my personal favourites were songs i just mentioned gaston was great fun too incidental music was best any disney movie that is same with other menken scores music transformation beast was phenomenal as well as animation reminded me last movement berliozs symphonie fantastique which is really frightening another disney with great incidental music is lion king story is quite simply one best love stories ever characters are wonderful belle was voiced beautifully by paige ohara who has beautiful singing voice i love belle she is beautiful clever strong is one best disney characters those reasons gaston was made into complex villain quite narcissistic great idea disney when he was nasty he was quite frightening richard white can really sing jerry orbach david ogden stiers were really entertaining as lumiere cogsworth i just love how witty elegant debonair lumiere is angela lansbury gives brilliant rendition title song best voice over was that beast who was very frightening there were some parts that were truly sensitive why are some people fussed about him as human remember true beauty comes within conclusion essential your disney collection with very poignant ending 10 10 bethany cox,0.6242954324586977,0.3841836734693878,Positive,"{'Happy': 0.33, 'Angry': 0.05, 'Surprise': 0.21, 'Sad': 0.1, 'Fear': 0.31}"
9.0,The most beautiful love story ever told.,"'' The Beauty and The Beast'' is one of the greatest stories ever told and one of the best movies from Disney that I watched in my life. I always identified myself with Belle, the girl who does not belong the place where she is lives and also with a big taste of reading lots of books. Our story takes part in France in 18 century, and our main character Belle is the prettiest girl in the city she lives, being the object of the affection and interest of Gaston, an arrogant man that has the sympathy of the people of the region.(And also considered a big catch for the girls of the city)But Belle is not interested in him and always imagined her life different from the domestic life people always imagine for her.One day, Belle's father, an inventor, was going to sell one of his inventions and lost his ways, being attacked by wild animals and entering in a big dark mansion apparently without a owner. He stays there for a time, but soon the Beast comes up and attacks him,making him a prisoner in his castle.Belle stays worried and goes after her father in the mansion and there she sees the violent and awful beast who locked her father. She then makes a deal: Belle agrees to stay in the dark castle with the horrible beast in return to her father's freedom. But with the time, Belle is going to discover all the magic that is beyond the castle, including the talking objects and even a nice side that the Beast has.This story is very inspiring and very beautiful! =)",most beautiful love story ever told,beauty beast is one greatest stories ever told one best movies disney that i watched my life i always identified myself with belle girl who does not belong place where she is lives also with big taste reading lots books our story takes part france 18 century our main character belle is prettiest girl city she lives being object affection interest gaston arrogant man that has sympathy people region also considered big catch girls city but belle is not interested him always imagined her life different domestic life people always imagine her one day belles father inventor was going sell one his inventions lost his ways being attacked by wild animals entering big dark mansion apparently without owner he stays there time but soon beast comes up attacks him making him prisoner his castle belle stays worried goes after her father mansion there she sees violent awful beast who locked her father she then makes deal belle agrees stay dark castle with horrible beast return her fathers freedom but with time belle is going discover all magic that is beyond castle including talking objects even nice side that beast has this story is very inspiring very beautiful,0.5992753623188406,0.1605072463768116,Positive,"{'Happy': 0.24, 'Angry': 0.05, 'Surprise': 0.24, 'Sad': 0.24, 'Fear': 0.22}"
