Rating,Review Title,Review,Cleaned Review Title,Cleaned Review,Subjectivity,Polarity,Sentiment,Emotion Scale
10.0,Be our guest,"Beauty and the Beast is without a doubt one of Disney's finest classics. The first animated film to ever be nominated for best picture and after you see it, you could understand and agree with it's nomination. Beauty and the Beast is going to be one of those films that will always be remembered, I know that it's a movie that I will show my children one day. It has unbelievably terrific animation, a beautiful story, lovable characters, and is just over all a perfect movie. I really love this film so much, I don't think anyone couldn't fall in love with it.Bell is just a simple girl in her town in France, she reads books constantly and her father is an inventor. They are sort of the outcasts of their town due to their ""oddness"". But Bell is being pursued by the town hunk, Gueston, simply because she's the one girl he cannot have. One day when her father's inventions are about to be displayed at the fair, he gets lost in the woods and stumbles across a castle and is held prisoner. Bell goes after him and comes to the castle; it turns out that her father is being held by a beast who is cursed with this hideousness unless he finds a true love before a rose he has welts. Bell trades places with her father; the house also has living objects, a candle holder, a clock, a tea pot, all who are also cursed until the curse is broken. They look at Bell as the perfect opportunity for the beast to find a true love, but he must learn to be a gentleman, but Bell brings out the best in him and it turns out that this might be a happy ending after all.This was actually the first movie that I ever cried in, the ending was just so beautiful and heart felt, you'll have to see what I mean. The songs are just so lovely and perfect for the scenes that they are performed for. Beauty and the Beast, the song, was just one of the most touching songs ever. This films is a major recommendation for me, it's one of my favorite Disney films of all time, it's a timeless classic that is just perfect and reached a new level of great animation.10/10",be our guest,beauty beast is without doubt one disneys finest classics first animated film ever be nominated best picture after you see it you could understand agree with its nomination beauty beast is going be one those films that will always be remembered i know that its movie that i will show my children one day it has unbelievably terrific animation beautiful story lovable characters is just over all perfect movie i really love this film so much i dont think anyone couldnt fall love with it bell is just simple girl her town france she reads books constantly her father is inventor they are sort outcasts their town due their oddness but bell is being pursued by town hunk gueston simply because shes one girl he cannot have one day when her fathers inventions are about be displayed at fair he gets lost woods stumbles across castle is held prisoner bell goes after him comes castle it turns out that her father is being held by beast who is cursed with this hideousness unless he finds true love before rose he has welts bell trades places with her father house also has living objects candle holder clock tea pot all who are also cursed until curse is broken they look at bell as perfect opportunity beast find true love but he must learn be gentleman but bell brings out best him it turns out that this might be happy ending after all this was actually first movie that i ever cried ending was just so beautiful heart felt youll have see what i mean songs are just so lovely perfect scenes that they are performed beauty beast song was just one most touching songs ever this films is major recommendation me its one my favorite disney films all time its timeless classic that is just perfect reached new level great animation 10 10,0.629111050986051,0.44522306397306394,Positive,"{'Happy': 0.27, 'Angry': 0.02, 'Surprise': 0.31, 'Sad': 0.22, 'Fear': 0.19}"
10.0,One of my all-time favourite movies.,"The only animated movie to receive a Best Picture Oscar nomination, and it deserved it.Magic from the opening prologue to the final credit, ""Beauty and the Beast"" is the last real classic to come from the Disney crew before John Lasseter came along. This was one of the few movies I happily paid to see twice in the cinema, and sitting in a sparsely-populated Friday night audience (I was living in Barbados at the time, and it was hardly the most artistic place on Earth... it was a crying shame that there was hardly anyone there while ""Home Alone 2"" went through the roof) the second time, the magic remained.You all know the story, so apart from pointing out the movie's one flaw (the prince's spell had to be broken before he turned 21 or he would remain a beast forever; so if it was cast ten years before the events of the movie, wouldn't that mean he was 11 when the spell was cast...?), let's look at how well the movie works. You have a monster who's more human than the movie's medallion-man villain; you have a heroine who's PC but engaging with it; you have a supporting cast of magic utensils who wisely never upstage the couple at the centre of this love story (and despite the Disney animated trappings, it IS a love story); and you have a captivating story, beautifully told.The movie's also got wonderful design of its French setting and characters, with the ballroom scene a standout (the tiny but appreciative audience were impressed by the sight of the Beast and Belle in their evening wear - the only time I've ever seen cartoon characters get wolf-whistled in a cinema); and Alan Menken's score is his finest work for the Mouse, with matchless lyrics from the late and much lamented Howard Ashman - how many musicals can you name where ALL the songs are brilliant? But ultimately it's the movie's very real heart that makes it a keeper; the cliche ""You'll laugh, you'll cry"" is all too true in this case. A lot of movies called 'classic' don't deserve that appellation, but this one does.I'll be slaughtered by anime fans, but what the hell... one ""Beauty and the Beast"" is worth a thousand ""Akira""s. And ""Shrek""s. And, I'm willing to bet, ""Treasure Planet""s. This is a truly adult animated feature that's also one for the entire family. Forget ""The Silence of the Lambs"" - this is the real best picture of 1991.",one my all time favourite movies,only animated movie receive best picture oscar nomination it deserved it magic opening prologue final credit beauty beast is last real classic come disney crew before john lasseter came along this was one few movies i happily paid see twice cinema sitting sparsely populated friday night audience i was living barbados at time it was hardly most artistic place earth it was crying shame that there was hardly anyone there while home alone 2 went through roof second time magic remained you all know story so apart pointing out movies one flaw princes spell had be broken before he turned 21 or he would remain beast forever so if it was cast ten years before events movie wouldnt that mean he was 11 when spell was cast lets look at how well movie works you have monster whos more human than movies medallion man villain you have heroine whos pc but engaging with it you have supporting cast magic utensils who wisely never upstage couple at centre this love story despite disney animated trappings it is love story you have captivating story beautifully told movies also got wonderful design its french setting characters with ballroom scene standout tiny but appreciative audience were impressed by sight beast belle their evening wear only time ive ever seen cartoon characters get wolf whistled cinema alan menkens score is his finest work mouse with matchless lyrics late much lamented howard ashman how many musicals can you name where all songs are brilliant but ultimately its movies very real heart that makes it keeper cliche youll laugh youll cry is all too true this case lot movies called classic dont deserve that appellation but this one does ill be slaughtered by anime fans but what hell one beauty beast is worth thousand akira s shrek s im willing bet treasure planet s this is truly adult animated feature thats also one entire family forget silence lambs this is real best picture 1991,0.59015625,0.25532986111111106,Positive,"{'Happy': 0.16, 'Angry': 0.05, 'Surprise': 0.3, 'Sad': 0.2, 'Fear': 0.29}"
,Perfect mix of music and animation...a solid achievement...,"I've not seen the newly added song sequence (Human Again) featured in the latest IMAX version so my comments are based entirely on the original theatrical and VHS release.BEAUTY AND THE BEAST is Disney at its peak. From the stained glass window at the opening and the beautiful narration, the viewer is drawn into the story by the appealing music and clever lyrics (""Belle's Song"") which gets the picture off to a bouncy start. The opening sequence showing Belle and the townspeople in song is masterfully handled and choreographed for maximum effect, setting the tone for the entire story.The plot becomes thicker once Belle's father enters the castle grounds where the Beast resides. The castle interiors are brilliantly Baroque and the odd characters inhabiting the grounds are delightfully rendered by a perfect blending of art and voice talent. Cogsworth, Lumiere and Mrs. Potts are delightful creations, each with strong, consistent personalities. David Ogden Stiers, Jerry Orbach and Angela Lansbury cannot be praised enough for their contributions. Two of the musical highlights are Orbach's dazzling job on ""Be My Guest"" (with French accent) and Angela's tender rendering of the title song, ""Beauty and the Beast"". Unforgettable movie moments. As Gaston, Richard White's robust baritone voice adds greatly to the effectiveness of his villainy.It's no wonder the film was the first to receive recognition by the Academy with a Best Picture nomination. Outstanding in every department, including the end title song sung by Celine Dion and Peabo Bryson in a more ""modern"" style. Along with SNOW WHITE and SLEEPING BEAUTY, a top-notch fairy tale with its appeal evenly divided between adults and children--as well as the child in all of us.",perfect mix music animation solid achievement,ive not seen newly added song sequence human again featured latest imax version so my comments are based entirely original theatrical vhs release beauty beast is disney at its peak stained glass window at opening beautiful narration viewer is drawn into story by appealing music clever lyrics belles song which gets picture off bouncy start opening sequence showing belle townspeople song is masterfully handled choreographed maximum effect setting tone entire story plot becomes thicker once belles father enters castle grounds where beast resides castle interiors are brilliantly baroque odd characters inhabiting grounds are delightfully rendered by perfect blending art voice talent cogsworth lumiere mrs potts are delightful creations each with strong consistent personalities david ogden stiers jerry orbach angela lansbury cannot be praised enough their contributions two musical highlights are orbachs dazzling job be my guest with french accent angelas tender rendering title song beauty beast unforgettable movie moments as gaston richard whites robust baritone voice adds greatly effectiveness his villainy its no wonder film was first receive recognition by academy with best picture nomination outstanding every department including end title song sung by celine dion peabo bryson more modern style along with snow white sleeping beauty top notch fairy tale with its appeal evenly divided between adults children as well as child all us,0.5798295454545455,0.44514678030303034,Positive,"{'Happy': 0.2, 'Angry': 0.0, 'Surprise': 0.24, 'Sad': 0.11, 'Fear': 0.44}"
9.0,A Transporting Experience,"Indeed, it's a tale as old as time, with a complex message that is as ageless as it is universal; but beneath all the layers it can be summed up very simply: love one another, and refrain from judging others who `seem' to be `different.' And leave it to Disney to present it in such a way that it can be embraced and understood by young and old alike as they have here, in one of their best animated features ever, `Beauty and the Beast,' directed by Gary Trousdale. When a young Prince fails the test of an enchantress disguised as an old hag, she transforms him into a hideous beast, as he is destined to remain until he opens his heart and learns how to love and be loved in return. And so that he'll know where he stands as time goes by, she gives him an enchanted rose, which will bloom until his twenty-first birthday, and he has only until the last petal falls from the flower to effect the change within himself that will be his salvation. 	The beast, however, seems doomed, as he shuts himself away, alone in his castle, taking up a reclusive existence far from everyone and everything. Until, one day, a beautiful young woman named Belle shows up at his doorstep. Belle is searching for her inventor father, Maurice, who disappeared while taking one of his latest inventions to the fair; and his trail leads Belle to the castle of the Beast, where she discovers he is being held prisoner, having run afoul of the Beast by trespassing while lost during the night of his journey. Repulsed by the appearance of the Beast, Belle nevertheless strikes a bargain with him: If he will release her father, she will stay in his place. The Beast agrees, with the stipulation that she must remain with him forever. And as the Beast casts Belle's father from the castle and sends him on his way, Belle's fate seems sealed. The only hope now for either Belle or the Beast lies in the remote possibility that true love may somehow prevail before the last petal of the enchanted rose falls.	With the help of a richly textured screenplay (by Linda Woolverton) that invests the characters with a depth of humanity that is often lacking even in `non' animated films, and an Oscar winning score by Alan Menken, director Trousdale provides some real insights into human nature in this retelling of the familiar story of how true love can change even the darkest and coldest of hearts. There's magic in this film, which holds an enchantment of it's own, and the message is presented ever so subtly and with a sensitivity that draws you in gradually until you are so caught up in the story that you become immersed and totally involved without being consciously aware of it. It's a film that enfolds you and takes you where it will, and you go willingly. A beautifully rendered and realized film that successfully transcends it's genre, it is the first animated feature ever to be recognized and rewarded with an Oscar nomination for Best Movie (quite a feat in itself, as it received the nod over such films as `The Fisher King,' `Fried Green Tomatoes,' `Thelma and Louise' and John Singleton's `Boyz N the Hood' that year). 	The talented cast supplying the voices of the characters includes Paige O'Hara (Belle), Robby Benson (The Beast), Richard White (Gaston), Jerry Orbach (Lumiere), David Ogden Stiers (Cogsworth), Angela Lansbury (Mrs. Potts), Bradley Pierce (Chip), Rex Everhart (Maurice), Jesse Corti (LeFou), Hal Smith (Phillipe), Jo Ann Worley (Wardrobe), Brian Cummings (Stove), Alvin Epstein (Bookseller) and Kimmy Robertson (Featherduster). There's a scene in this film that is so entrancing and so emotionally involving that it stands up against the best from any drama ever made: As Angela Lansbury (as Mrs. Potts) sings the Oscar winning title song, Belle begins to perceive the true nature of the man within the Beast; and it's no longer the cold-hearted Prince upon whom the enchantress cast her spell, because he has changed. And as they come together and the Beast takes Belle in his arms, sweeping her in dance across the elegant ballroom floor, it becomes one of those rare cinematic `moments' that are entirely transporting, and it does, indeed, take you away. It's a memorable scene that exemplifies the quality and craftsmanship of this film, as does the scene in which the Beast is at last transformed; that such emotion can be captured and expressed in an animated film is an exemplary accomplishment, and it's all a part of why `Beauty and the Beast' is one of Disney's all time greatest films. 	One final note: Stay for the credits to hear Alan Menken and Howard Ashman's title song once again, this time performed by Celine Dion and Peabo Bryson. Hypnotically beautiful, this version has a magic all it's own and makes the perfect ending to an enchanting experience. It's all a part of the magic of the movies. I rate this one 9/10.",transporting experience,indeed its tale as old as time with complex message that is as ageless as it is universal but beneath all layers it can be summed up very simply love one another refrain judging others who seem be different leave it disney present it such way that it can be embraced understood by young old alike as they have here one their best animated features ever beauty beast directed by gary trousdale when young prince fails test enchantress disguised as old hag she transforms him into hideous beast as he is destined remain until he opens his heart learns how love be loved return so that hell know where he stands as time goes by she gives him enchanted rose which will bloom until his twenty first birthday he has only until last petal falls flower effect change within himself that will be his salvation beast however seems doomed as he shuts himself away alone his castle taking up reclusive existence far everyone everything until one day beautiful young woman named belle shows up at his doorstep belle is searching her inventor father maurice who disappeared while taking one his latest inventions fair his trail leads belle castle beast where she discovers he is being held prisoner having run afoul beast by trespassing while lost during night his journey repulsed by appearance beast belle nevertheless strikes bargain with him if he will release her father she will stay his place beast agrees with stipulation that she must remain with him forever as beast casts belles father castle sends him his way belles fate seems sealed only hope now either belle or beast lies remote possibility that true love may somehow prevail before last petal enchanted rose falls with help richly textured screenplay by linda woolverton that invests characters with depth humanity that is often lacking even non animated films oscar winning score by alan menken director trousdale provides some real insights into human nature this retelling familiar story how true love can change even darkest coldest hearts theres magic this film which holds enchantment its own message is presented ever so subtly with sensitivity that draws you gradually until you are so caught up story that you become immersed totally involved without being consciously aware it its film that enfolds you takes you where it will you go willingly beautifully rendered realized film that successfully transcends its genre it is first animated feature ever be recognized rewarded with oscar nomination best movie quite feat itself as it received nod over such films as fisher king fried green tomatoes thelma louise john singletons boyz n hood that year talented cast supplying voices characters includes paige ohara belle robby benson beast richard white gaston jerry orbach lumiere david ogden stiers cogsworth angela lansbury mrs potts bradley pierce chip rex everhart maurice jesse corti lefou hal smith phillipe jo ann worley wardrobe brian cummings stove alvin epstein bookseller kimmy robertson featherduster theres scene this film that is so entrancing so emotionally involving that it stands up against best any drama ever made as angela lansbury as mrs potts sings oscar winning title song belle begins perceive true nature man within beast its no longer cold hearted prince upon whom enchantress cast her spell because he has changed as they come together beast takes belle his arms sweeping her dance across elegant ballroom floor it becomes one those rare cinematic moments that are entirely transporting it does indeed take you away its memorable scene that exemplifies quality craftsmanship this film as does scene which beast is at last transformed that such emotion can be captured expressed animated film is exemplary accomplishment its all part why beauty beast is one disneys all time greatest films one final note stay credits hear alan menken howard ashmans title song once again this time performed by celine dion peabo bryson hypnotically beautiful this version has magic all its own makes perfect ending enchanting experience its all part magic movies i rate this one 9 10,0.6027777777777779,0.29734299516908214,Positive,"{'Happy': 0.16, 'Angry': 0.08, 'Surprise': 0.25, 'Sad': 0.19, 'Fear': 0.33}"
