Rating,Review Title,Review,Cleaned Review Title,Cleaned Review,Subjectivity,Polarity,Sentiment,Emotion Scale
,Quiet Desperation---Italian Style.,"In post-World War II Italy poverty is a dire reality for a large portion of the population. Work is scarce and the opportunities for employment are few and far between. ""Ladri Di Biciclette"" (translated ""The Bicycle Thief"") is quietly one of the finest films ever produced. It follows one economically distraught man (Lamberto Maggiorani) who is heading down a desperate path fast. Things look up when he gets a job putting posters on walls in town, but he must sell what few meager possessions he and his family have to buy a bicycle to uphold his end of the business bargain. Naturally tragedy strikes immediately as the title character shows up the very first day Maggiorani is on the job. The police are little help, believing the bicycle is not as important as it really is. Thus Maggiorani and young son Enzo Staiola take it upon themselves to look all over town to try and find the bicycle and bring the thief to justice. ""The Bicycle Thief"" was originally released in 1948 and won an Honorary Academy Award for Best Foreign Language film the following year (the movie was not released in the U.S. until 1949). It is still a production that strikes deep even today. The lengths and desperate measures that some go through is very evident here. Director Vittorio De Sica crafts a film that is much deeper than it appears on the surface. It examines the human condition and questions society, family, law enforcement, alliances and mental anguish perfectly. ""The Bicycle Thief"" is an excellent production that has aged well and allows the viewer to think about many subjects that go beyond ordinary cinematic depths. 5 stars out of 5.",quiet desperation italian style,post world war ii italy poverty is dire reality large portion population work is scarce opportunities employment are few far between ladri di biciclette translated bicycle thief is quietly one finest films ever produced it follows one economically distraught man lamberto maggiorani who is heading down desperate path fast things look up when he gets job putting posters walls town but he must sell what few meager possessions he his family have buy bicycle uphold his end business bargain naturally tragedy strikes immediately as title character shows up very first day maggiorani is job police are little help believing bicycle is not as important as it really is thus maggiorani young son enzo staiola take it upon themselves look all over town try find bicycle bring thief justice bicycle thief was originally released 1948 won honorary academy award best foreign language film following year movie was not released u s until 1949 it is still production that strikes deep even today lengths desperate measures that some go through is very evident here director vittorio de sica crafts film that is much deeper than it appears surface it examines human condition questions society family law enforcement alliances mental anguish perfectly bicycle thief is excellent production that has aged well allows viewer think about many subjects that go beyond ordinary cinematic depths 5 stars out 5,0.4769841269841269,0.06827147525676937,Positive,"{'Happy': 0.1, 'Angry': 0.05, 'Surprise': 0.34, 'Sad': 0.17, 'Fear': 0.34}"
,No small thing.,"This movie changed my life. It changed it in the sense that after seeing it I developed a life-long passion for Italian films after first seeing it in 1955 when it appeared at a local movie theatre in a revival five years or so after its original appearance. I was only 13 at the time and somewhat of a precocious chooser of what films to go see. I have seen THE BICYCLE THIEF (""Bicycle Thieves"" in England and plural as well in its original Italian title) hundreds of times since and never tire of it. The fact that the film has almost never been out of circulation since its making and is constantly shown in revivals, festivals and film classes attests to its endurance. Martin Scorsese does a glorious appreciation of it in his documentary on the Italian cinema, IL MIO VIAGGIO IN ITALIA. What makes it so enduring? What is so damn great about the movie? It is not its trenchant portrayal of post-war Italian poverty and misery. Lots of films did that even better. It is not in any sense of real drama, which is very schematic. Nor even the unforgettably truthful acting, that iconic face of pint-sized Enzo Staiola. We get truthful acting and iconic faces all over the place. It is, I believe, its sense of compassion, its sense of poetry. Those are rarer qualities. The movie is compassionate poetry. I don't know if writer Cesare Zavattini or director Vittorio De Sica would have appreciated that phrase. I feel they might have. I feel it is exactly the truth they were after. To be sure, the film is a story of father and little-boy in search of what is lost, a necessity yes, but also a lost dream. The endangered hope for a better life to come challenges this paternal/filial relationship. In that sense, this is a film-poem, God help me, about Everyfather and Everylittleboy. The most chilling moment in the poem occurs when little Bruno sees his father steal, and a tearful horror glazes his face as a god seems to collapse. The most redemptive moment comes shortly thereafter when the boy slips his hand into his father's. That forgiveness is not cheap or facile. It is unassailable and all-comforting. It is a forgiving embrace of Virgilian dignity. For a magnificent instant the father, Antonio, has become the son; Bruno, the son, has become the father. At the end, when they walk off into the Roman crowd, they are as one. I have written many thoughts about this film over the years, including an extended exegesis for a local newspaper. I have programmed it in film series, shown it to film classes, Italian classes. I know the movie. Friends, the movie is not about stolen bicycles, indifferent police, bicycle chop-shop gargoyles, mouth-foaming lowlife, desperate actions by the desperate, or mere journalistic human interest that is gone with tomorrow's edition. Its worth resides in its lyric portrayal of the eternal curative power of love. No small thing.Two addenda: the song being rehearsed at the workers' club Antonio visits to see his friend is called ""Ciccio Formaggio."" The song being sung and played by the restaurant musicians when Antonio and his son eat together is ""Tummuriata nera,"" about the mulatto offspring of an Italian woman and a black soldier. The lyrics for both songs, in Neapolitan dialect, can be found by Googling the titles. Recordings by Roberto Murolo of both songs are available.",no small thing,this movie changed my life it changed it sense that after seeing it i developed life long passion italian films after first seeing it 1955 when it appeared at local movie theatre revival five years or so after its original appearance i was only 13 at time somewhat precocious chooser what films go see i have seen bicycle thief bicycle thieves england plural as well its original italian title hundreds times since never tire it fact that film has almost never been out circulation since its making is constantly shown revivals festivals film classes attests its endurance martin scorsese does glorious appreciation it his documentary italian cinema il mio viaggio italia what makes it so enduring what is so damn great about movie it is not its trenchant portrayal post war italian poverty misery lots films did that even better it is not any sense real drama which is very schematic nor even unforgettably truthful acting that iconic face pint sized enzo staiola we get truthful acting iconic faces all over place it is i believe its sense compassion its sense poetry those are rarer qualities movie is compassionate poetry i dont know if writer cesare zavattini or director vittorio de sica would have appreciated that phrase i feel they might have i feel it is exactly truth they were after be sure film is story father little boy search what is lost necessity yes but also lost dream endangered hope better life come challenges this paternal filial relationship that sense this is film poem god help me about everyfather everylittleboy most chilling moment poem occurs when little bruno sees his father steal tearful horror glazes his face as god seems collapse most redemptive moment comes shortly thereafter when boy slips his hand into his fathers that forgiveness is not cheap or facile it is unassailable all comforting it is forgiving embrace virgilian dignity magnificent instant father antonio has become son bruno son has become father at end when they walk off into roman crowd they are as one i have written many thoughts about this film over years including extended exegesis local newspaper i have programmed it film series shown it film classes italian classes i know movie friends movie is not about stolen bicycles indifferent police bicycle chop shop gargoyles mouth foaming lowlife desperate actions by desperate or mere journalistic human interest that is gone with tomorrows edition its worth resides its lyric portrayal eternal curative power love no small thing two addenda song being rehearsed at workers club antonio visits see his friend is called ciccio formaggio song being sung played by restaurant musicians when antonio his son eat together is tummuriata nera about mulatto offspring italian woman black soldier lyrics both songs neapolitan dialect can be found by googling titles recordings by roberto murolo both songs are available,0.4138344226579521,0.14624183006535948,Positive,"{'Happy': 0.11, 'Angry': 0.09, 'Surprise': 0.24, 'Sad': 0.21, 'Fear': 0.34}"
10.0,Another one to add to my top 50- a delicate study of desperation in post war Italy,"Vittorio De Sica's ground/heartbreaking motion picture, The Bicycle Thief, is based on a very simple ideal for a story- man against the elements. In this case the elements are of a society that is often cruel and unforgiving, and that a job in post-war Rome is looked on as the luckiest of good luck charms.Such a man as presented by De Sica is Maggiorani (an actor who really is the type of actor right off the street), a father of a little boy who gets a job putting up movie posters along some walls in Rome. To do this he needs a bicycle, or the job will be lost, and he gets one following a pawning of linen sheets. Very soon though, the bicycle is stolen, and from there a sad downward spiral unravels for the man and his son as they scour the streets for the bicycle. While the score adds basic dramatic tension, everything else on the screen is done to such a pitch of neo-realism it's at times shattering, joyful (scene in the pizzeria the most note-worthy), and with a feeling of day-to-day resonance to those who may have not even felt at or below the poverty level in their lives. Credit due to all parties involved, though I don't think the boy Bruno, played by Staiola, gets nearly enough considering his role as a minor coming of age (that moment after the father and son leave the church nearly brought tears to my eyes). A++",another one add my top 50 delicate study desperation post war italy,vittorio de sicas ground heartbreaking motion picture bicycle thief is based very simple ideal story man against elements this case elements are society that is often cruel unforgiving that job post war rome is looked as luckiest good luck charms such man as presented by de sica is maggiorani actor who really is type actor right off street father little boy who gets job putting up movie posters along some walls rome do this he needs bicycle or job will be lost he gets one following pawning linen sheets very soon though bicycle is stolen there sad downward spiral unravels man his son as they scour streets bicycle while score adds basic dramatic tension everything else screen is done such pitch neo realism its at times shattering joyful scene pizzeria most note worthy with feeling day day resonance those who may have not even felt at or below poverty level their lives credit due all parties involved though i dont think boy bruno played by staiola gets nearly enough considering his role as minor coming age that moment after father son leave church nearly brought tears my eyes,0.5363636363636363,0.0510551948051948,Positive,"{'Happy': 0.12, 'Angry': 0.06, 'Surprise': 0.16, 'Sad': 0.41, 'Fear': 0.24}"
8.0,Powerful and dramatic,"It is post-war Rome and much of the city's residents are impoverished and desperate for work. One man named Ricci who haunts the job lines day after day to provide for his wife and two children, when suddenly his name is called for a well-paying city job. The only catch is that he needs a bicycle for the job, and he has just pawned his bicycle in order to feed his family. Thus begins `The Bicycle Thief', Vittorio de Sica's gritty study in realism. Ricci and his wife sell the sheets off of their beds to get the bicycle back, only to have the bicycle stolen on his first day on the job. In order to keep the job, he and his young son walk around Rome, desperate to find the thief, and more importantly, the bicycle before his next day of work. de Sica chose non-actors to portray the characters in the film, favoring a further realistic vision by casting amateurs. The result is remarkable, because the pain and emotions conveyed are so true. The relationship between father and son is also compelling and endearing, in that for the most part, Ricci treats his son as an equal, letting him in on his innermost thoughts and fears, until the end, when a particular event causes him to be ashamed, and the roles become defined once again. `The Bicycle Thief' personifies the refreshing fact that European cinema was more daring and also true in their reaction to post-war life. While America was trying to paint a heavy coat of rosy paint on the times by churning out the saccharine MGM musicals by the dozen, Europe was showing that the effects of a war fought on their home turf did not inspire moments of spontaneously breaking into song, or a choreographed dance number, rather life pretty much sucked, but survival, as difficult and ugly as it can be, is most important. `The Bicycle Thief' has been a critical favorite for decades, and for good reason. It is a must-see film for any cinephile.--Shelly",powerful dramatic,it is post war rome much citys residents are impoverished desperate work one man named ricci who haunts job lines day after day provide his wife two children when suddenly his name is called well paying city job only catch is that he needs bicycle job he has just pawned his bicycle order feed his family thus begins bicycle thief vittorio de sicas gritty study realism ricci his wife sell sheets off their beds get bicycle back only have bicycle stolen his first day job order keep job he his young son walk around rome desperate find thief more importantly bicycle before his next day work de sica chose non actors portray characters film favoring further realistic vision by casting amateurs result is remarkable because pain emotions conveyed are so true relationship between father son is also compelling endearing that most part ricci treats his son as equal letting him his innermost thoughts fears until end when particular event causes him be ashamed roles become defined once again bicycle thief personifies refreshing fact that european cinema was more daring also true their reaction post war life while america was trying paint heavy coat rosy paint times by churning out saccharine mgm musicals by dozen europe was showing that effects war fought their home turf did not inspire moments spontaneously breaking into song or choreographed dance number rather life pretty much sucked but survival as difficult ugly as it can be is most important bicycle thief has been critical favorite decades good reason it is must see film any cinephile shelly,0.63125,0.13625,Positive,"{'Happy': 0.24, 'Angry': 0.0, 'Surprise': 0.14, 'Sad': 0.22, 'Fear': 0.4}"
10.0,A Heartbreaking Masterpiece of the Italian Neo-Realism,"In the post-war Rome, after more than two-year unemployment, the family man Antonio Ricci (Lamberto Maggiorani) finally finds a disputed job position putting up posters that requires having a bicycle. However, he needs to retrieve his bicycle in the pawn shop but he does not have money. His wife Maria (Lianella Carell) pawns their bed sheets and uses the money to recover the precious bicycle. Antonio envisions a better life for his family with his salary, overtime and benefits. Unfortunately, his bicycle is stolen on the first working day. Antonio and his son Bruno (Enzo Staiola) spend the Sunday chasing the bicycle and the thief on the streets of Rome.""Ladri di Biciclette"" is a heartbreaking masterpiece of the Italian Neo- Realism and one of the best movies of cinema history ever. This is the third time that I watch this unforgettable film that makes me sad with the desperation of Antonio and his lack of perspective in the end. There are memorable touching scenes, like Bruno eating pizza in the restaurant wearing a torn coat and contrasting with the wealthy family; or the happiness of the clumsy Antonio putting up the poster of Rita Hayworth in ""Gilda""; or the indecision of Bruno between a dish of soup in the church or chasing the old man with his father; or the shame of Antonio in the end. The DVD released in Brazil by Spectra Nova has good quality of image, subtitles in yellow but no Extras. The DVD released by Versátil uses the same matrix of Spectra Nova but with subtitles in white, and it is difficult the reading by the viewer. However, there are many Extras. My vote is ten.Title (Brazil): ""Ladrões de Bicicleta"" (""Thieves of Bicycle"")",heartbreaking masterpiece italian neo realism,post war rome after more than two year unemployment family man antonio ricci lamberto maggiorani finally finds disputed job position putting up posters that requires having bicycle however he needs retrieve his bicycle pawn shop but he does not have money his wife maria lianella carell pawns their bed sheets uses money recover precious bicycle antonio envisions better life his family with his salary overtime benefits unfortunately his bicycle is stolen first working day antonio his son bruno enzo staiola spend sunday chasing bicycle thief streets rome ladri di biciclette is heartbreaking masterpiece italian neo realism one best movies cinema history ever this is third time that i watch this unforgettable film that makes me sad with desperation antonio his lack perspective end there are memorable touching scenes like bruno eating pizza restaurant wearing torn coat contrasting with wealthy family or happiness clumsy antonio putting up poster rita hayworth gilda or indecision bruno between dish soup church or chasing old man with his father or shame antonio end dvd released brazil by spectra nova has good quality image subtitles yellow but no extras dvd released by vers til uses same matrix spectra nova but with subtitles white it is difficult reading by viewer however there are many extras my vote is ten title brazil ladr es de bicicleta thieves bicycle,0.4863333333333333,0.21,Positive,"{'Happy': 0.09, 'Angry': 0.02, 'Surprise': 0.33, 'Sad': 0.24, 'Fear': 0.31}"
8.0,Heartfelt Drama of Post WWII Poverty a Must-See...,"The Italian neo-realist film movement began around the end of WWII with Roberto Rossellini's OPEN CITY in 1946. It is defined and encapsulated by this striking film directed by Vittorio De Sica. THE BICYCLE THIEF is the best of a group of films that depicted the hardship and despair that Europeans, specifically Italians, went through after the death and destruction of the war. The economy was horrible, and the towns and cities were half-destroyed and decaying. Rome is the location for THE BICYCLE THIEF and De Sica shoots the city in grainy black and white with non-professional actors to get a simple, yet unbearingly emotional point across. A simple thing such as a bike can be someone's entire world at that time and losing it means doing something irrational or perhaps necessary.The lead in the film is played by Lamberto Maggiorani who seems to be a very good actor. He is not an actor, however, and maybe this is why the film hits its mark so well and comes across so realistically. Maggiorani is of this difficult world and his brooding face is a clear indication of this. His job is to plaster film posters up on the walls of buildings all over Rome. He even hangs a picture that symbolizes the absolute opposite of the misery surrounding him. Rita Hayworth from GILDA is on the walls all over the city, a sign of joy to some, a representation of their own lowly status to others.When the bicycle is actually stolen, the ""title"" character is sought after by Maggiorani and his young son (Enzo Staiola), a little kid with so much acting ability, you swear this must be a documentary. A grueling search throughout Rome has the essential parts of the movie, because we see up close the actual people and places the neo-realist film movement came to represent. It is a small, sad world they live in and the bike has to be found so that they can live. The father is put to the ultimate test in front of his son. Will he do the honorable thing or will he do what his mind and heart know is only possible? These are the tense moments of the film's climax.There is a lot of THE BICYCLE THIEF in Benigni's LIFE IS BEAUTIFUL and some obvious comparisons have been drawn because of the father-son relationship. They are worthy of comparison and have equal artistic prowess. What is different about THIEF is the level of intensity maintained throughout. I felt the key element was the music by Alessandro Cicognini, a simple horn that plays so tragically that it is a main character in the picture. What De Sica does here, as well as other neo-realist directors (Rossellini, Fellini), is create for American audiences a powerful counterpoint to what we are used to. An honest, non-corporate portrait of the struggle for life and self-respect. THE BICYCLE THIEF is one of the finest films ever made.RATING: 10 of 10",heartfelt drama post wwii poverty must see,italian neo realist film movement began around end wwii with roberto rossellinis open city 1946 it is defined encapsulated by this striking film directed by vittorio de sica bicycle thief is best group films that depicted hardship despair that europeans specifically italians went through after death destruction war economy was horrible towns cities were half destroyed decaying rome is location bicycle thief de sica shoots city grainy black white with non professional actors get simple yet unbearingly emotional point across simple thing such as bike can be someones entire world at that time losing it means doing something irrational or perhaps necessary lead film is played by lamberto maggiorani who seems be very good actor he is not actor however maybe this is why film hits its mark so well comes across so realistically maggiorani is this difficult world his brooding face is clear indication this his job is plaster film posters up walls buildings all over rome he even hangs picture that symbolizes absolute opposite misery surrounding him rita hayworth gilda is walls all over city sign joy some representation their own lowly status others when bicycle is actually stolen title character is sought after by maggiorani his young son enzo staiola little kid with so much acting ability you swear this must be documentary grueling search throughout rome has essential parts movie because we see up close actual people places neo realist film movement came represent it is small sad world they live bike has be found so that they can live father is put ultimate test front his son will he do honorable thing or will he do what his mind heart know is only possible these are tense moments films climax there is lot bicycle thief benignis life is beautiful some obvious comparisons have been drawn because father son relationship they are worthy comparison have equal artistic prowess what is different about thief is level intensity maintained throughout i felt key element was music by alessandro cicognini simple horn that plays so tragically that it is main character picture what de sica does here as well as other neo realist directors rossellini fellini is create american audiences powerful counterpoint what we are used honest non corporate portrait struggle life self respect bicycle thief is one finest films ever made rating 10 10,0.5314734950584007,0.07428101772441395,Positive,"{'Happy': 0.07, 'Angry': 0.06, 'Surprise': 0.23, 'Sad': 0.21, 'Fear': 0.43}"
