Rating,Review Title,Review,Cleaned Review Title,Cleaned Review,Subjectivity,Polarity,Sentiment,Emotion Scale
,Real,"Even if you are merely a moderate fan of cinema you will have at least heard of this film. It has been hailed as a masterpiece for just short of sixty years and has been routinely studied in film classes everywhere. In a sense, it is one of the recognized masterpieces of cinema. And yet, this is not a film in which to pick up obviously great shots like the 360 degree shot in the hotel room in ""Vertigo"" or cuts as good as the jump cut in ""2001: A Space Odyssey"" with which Kubrick transports you from prehistoric ages to an age in which space travel is common in barely a second. This is a subtle, realistic film, and though it looks terrific, it is not flashy. It exists not to excel technically or tell the story of humanity, but simply to tell a story. A simple story which may say more about human nature than any other film in existence.""Bicycle Thieves"" is about a man in economically depressed post-World War II Italy who is lucky enough to find a job which requires him to use a bicycle as transportation while putting up posters around the city. It's relatively well-paying and almost too good to believe for his family. While on the job his bicycle is stolen, and the rest of the movie tells the story of him and his son attempting to recover the bicycle. In the magnificent final scene Antonio Ricci (the lead character) finds himself tempted to steal a bicycle in order to be able to perform his job. Here we have our 'hero' thinking about doing to someone else what was done to him. There is no black and white in the world, no good and evil. This film does a great job of stating that fact without moralizing and preaching like so many modern films do. This film does not insult your intelligence and I pity those who wanted a third act, or those who wanted more explanation. This film is beautiful and brilliant because it is completely understated. It's realistic. We feel Ricci's desperation and are transported into 1940's Rome as he makes his way through the city's crowded streets, alleyways, churches and brothels.I have no idea how much this film cost to make, but I would be surprised if it was made on a low budget. The location shooting throughout the city is impressive, as is the (again) understated cinematography. De Sica cast non-actors in the lead roles, and I find their performances to be among the most realistic and effective I've ever seen. Alessandro Cigognini's score is a highlight of the film, and I consider the melancholy main theme one of the greatest musical cues I've heard in any film.I enjoy theatricality as much as anyone and I certainly don't dislike Hollywood gloss, but ""Bicycle Thieves"" serves as a jarring reminder of how great a medium film can be. The jarring effect the film had on audiences upon its release (in particular American audiences) is easy to understand viewing the film in 2007 and it escapes my comprehension how anyone can't be completely captivated and enthralled by this masterwork.****/4",real,even if you are merely moderate fan cinema you will have at least heard this film it has been hailed as masterpiece just short sixty years has been routinely studied film classes everywhere sense it is one recognized masterpieces cinema yet this is not film which pick up obviously great shots like 360 degree shot hotel room vertigo or cuts as good as jump cut 2001 space odyssey with which kubrick transports you prehistoric ages age which space travel is common barely second this is subtle realistic film though it looks terrific it is not flashy it exists not excel technically or tell story humanity but simply tell story simple story which may say more about human nature than any other film existence bicycle thieves is about man economically depressed post world war ii italy who is lucky enough find job which requires him use bicycle as transportation while putting up posters around city its relatively well paying almost too good believe his family while job his bicycle is stolen rest movie tells story him his son attempting recover bicycle magnificent final scene antonio ricci lead character finds himself tempted steal bicycle order be able perform his job here we have our hero thinking about doing someone else what was done him there is no black white world no good evil this film does great job stating that fact without moralizing preaching like so many modern films do this film does not insult your intelligence i pity those who wanted third act or those who wanted more explanation this film is beautiful brilliant because it is completely understated its realistic we feel riccis desperation are transported into 1940s rome as he makes his way through citys crowded streets alleyways churches brothels i have no idea how much this film cost make but i would be surprised if it was made low budget location shooting throughout city is impressive as is again understated cinematography de sica cast non actors lead roles i find their performances be among most realistic effective ive ever seen alessandro cigogninis score is highlight film i consider melancholy main theme one greatest musical cues ive heard any film i enjoy theatricality as much as anyone i certainly dont dislike hollywood gloss but bicycle thieves serves as jarring reminder how great medium film can be jarring effect film had audiences upon its release particular american audiences is easy understand viewing film 2007 it escapes my comprehension how anyone cant be completely captivated enthralled by this masterwork 4,0.5000403551251007,0.21676755447941887,Positive,"{'Happy': 0.19, 'Angry': 0.08, 'Surprise': 0.23, 'Sad': 0.22, 'Fear': 0.28}"
9.0,A revolutionary film,"A film of real life, real emotions, real people. Bicycle Thieves was a film like no other because it was made like no other. With non actors, natural light, filmed on locations, the film captured the truth of Neorealism. The film is made up of a series of ""small moments."" The fact is, the entire movie is made up of pureness. It tackles issues of class, politics, and post war activities. Overall, the film is about life and hope. The unhappy ending only makes the film more real. If you are a son who loved his father and understood who he was and why he was the way he was........watch this movie.",revolutionary film,film real life real emotions real people bicycle thieves was film like no other because it was made like no other with non actors natural light filmed locations film captured truth neorealism film is made up series small moments fact is entire movie is made up pureness it tackles issues class politics post war activities overall film is about life hope unhappy ending only makes film more real if you are son who loved his father understood who he was why he was way he was watch this movie,0.485,0.11833333333333335,Positive,"{'Happy': 0.09, 'Angry': 0.0, 'Surprise': 0.09, 'Sad': 0.5, 'Fear': 0.32}"
10.0,"Simple, Powerful Film Survives","There's not much that can be said about ""The Bicycle Thief"" that hasn't already been expressed. It is considered a great work of the Italian cinema, and looking at it in its 1999 release version, one can see why. Structurally, it's a theme and variations, with such a simple, clearly stated main motif that one can identify and follow its mutations with no effort. DeSica is clearly the fine craftsman here, directing every scene with a beautiful sense of control and balance. His work with young Enzo Staiola (as Bruno) is especially commendable, and he allows then nonprofessionals Lamberto Maggiorani (as Antonio) and Lianella Carell (as Marie) to act in a model of naturalism. Carlo Montuori's photography is brilliant, and Antonio Traverso's production design is pungent and atmospheric. Like most ""masterpieces,"" a film-classic score provides emotional depth in a subliminal way: here it's a romantic, Italianesque original composition by Aessandro Cicognini wraps up the entire production.DeSica's career is most impressive, being involved in nealy 200 films, 165 of them as an actor. This film remains one of his greatest achievements. It seems to be standing the test of time very nicely, too. It's been criticized, sometimes quite severely, and just continues to bounce back, winning new admirers with each reissue. The public just won't let ""The Bicycle Thief"" fade away. That alone tends to override any negative factors. It looks like this film is going to be around for quite a while. ###",simple powerful film survives,theres not much that can be said about bicycle thief that hasnt already been expressed it is considered great work italian cinema looking at it its 1999 release version one can see why structurally its theme variations with such simple clearly stated main motif that one can identify follow its mutations with no effort desica is clearly fine craftsman here directing every scene with beautiful sense control balance his work with young enzo staiola as bruno is especially commendable he allows then nonprofessionals lamberto maggiorani as antonio lianella carell as marie act model naturalism carlo montuoris photography is brilliant antonio traversos production design is pungent atmospheric like most masterpieces film classic score provides emotional depth subliminal way here its romantic italianesque original composition by aessandro cicognini wraps up entire production desicas career is most impressive being involved nealy 200 films 165 them as actor this film remains one his greatest achievements it seems be standing test time very nicely too its been criticized sometimes quite severely just continues bounce back winning new admirers with each reissue public just wont let bicycle thief fade away that alone tends override any negative factors it looks like this film is going be around quite while,0.5381277056277056,0.27304545454545454,Positive,"{'Happy': 0.22, 'Angry': 0.05, 'Surprise': 0.14, 'Sad': 0.19, 'Fear': 0.41}"
8.0,Vintage Neorrealist film about a working-class man whose bicycle is robbed and he and his child set out in pursuit the thief,"This is a mercilessly bleak studio about poorness and miserable life in post WWII Italy . Set in post war Italy , this is a Classy Italian movie of great importance in the developing of the Neorrealist movement . The film deals with a father , Lamberto Maggiorani , and his child , Enzo Staiola. Then , being robbed his bicycle, and both of them set out to find the robber . Along the way they encounter various egoistic characters , stealers , religious people , but also good people .The picture is well paced , focusing on the relation between the desperado dad and his son , as the despair they suffer along the way , while attempt to discover the true thief who took his bicycle. It is a heart-rending and heart-breaking studio of poverty in postwar Italy which won special Academy Awards , before the foreign film category was officially established .The film is like a documentary , with a great crowd as extras , untrained people , old neighborhoods , a lot of street vendors , passengers and priests waiting for bus and many other things . It shows an evocative post war Rome , ruined and with depressed economy , ba great deal of working class men , unemployed people looking for work and a destroyed city , too. Here De Sica reveals unsuspected depths , and an extraordinary sensitive with actors , especially the little boy . Two main actors are frankly well , Lamberto Maggiorani as the ill-fated father and Enzo Staiola as the agreeable son with sweet laughter. Both of whom are pretty good , though all players are amateurs , as filmmaker De Sica and screenwriter Zavattini decided not to use professional actors . The motion picture was stunningly directed by Vittorio de Sica , and including Sergio Leone as director assistant . De Sica was a famous actor and director .He turned to filmmaking in 1940 , making light comedies. His fifth movie collaborated with writer Cesare Zavattini , I Bambi ni ci guardano ,in which showed great sensitivity and nice fIl making . It was also the first movie he made with writer Zavattini with whom he would subsequently shoot ""Shoeshine"" , and Bicycle thief .After the boxoffice disaster ""Umberto D"" , he abandoned the Neorrealist genre to make more commercial films than previous . Subsequently , he he made ""Yesterday , Today and Tomorrow"" with Marcelo Mastroiani and Sofia Loren in which he won another Oscar . His two final films were Garden of Finzi Contini and A brief vacation that had limited success .Rating 8/10 . Worthwhile watching . Above average . Essential and indispensable seeing for Italian films buffs .",vintage neorrealist film about working class man whose bicycle is robbed he his child set out pursuit thief,this is mercilessly bleak studio about poorness miserable life post wwii italy set post war italy this is classy italian movie great importance developing neorrealist movement film deals with father lamberto maggiorani his child enzo staiola then being robbed his bicycle both them set out find robber along way they encounter various egoistic characters stealers religious people but also good people picture is well paced focusing relation between desperado dad his son as despair they suffer along way while attempt discover true thief who took his bicycle it is heart rending heart breaking studio poverty postwar italy which won special academy awards before foreign film category was officially established film is like documentary with great crowd as extras untrained people old neighborhoods lot street vendors passengers priests waiting bus many other things it shows evocative post war rome ruined with depressed economy ba great deal working class men unemployed people looking work destroyed city too here de sica reveals unsuspected depths extraordinary sensitive with actors especially little boy two main actors are frankly well lamberto maggiorani as ill fated father enzo staiola as agreeable son with sweet laughter both whom are pretty good though all players are amateurs as filmmaker de sica screenwriter zavattini decided not use professional actors motion picture was stunningly directed by vittorio de sica including sergio leone as director assistant de sica was famous actor director he turned filmmaking 1940 making light comedies his fifth movie collaborated with writer cesare zavattini i bambi ni ci guardano which showed great sensitivity nice fil making it was also first movie he made with writer zavattini with whom he would subsequently shoot shoeshine bicycle thief after boxoffice disaster umberto d he abandoned neorrealist genre make more commercial films than previous subsequently he he made yesterday today tomorrow with marcelo mastroiani sofia loren which he won another oscar his two final films were garden finzi contini brief vacation that had limited success rating 8 10 worthwhile watching above average essential indispensable seeing italian films buffs,0.536061507936508,0.14466765873015872,Positive,"{'Happy': 0.14, 'Angry': 0.02, 'Surprise': 0.24, 'Sad': 0.29, 'Fear': 0.32}"
10.0,Powerful.,"Some films try to explain multiple aspects of a story or a character by showing several episodes from the character's life. Vittorio De Sica's masterful The Bicycle Thief relies on the power of simplicity to drive home its point. It is a very simple film, relying on film making at its basics. There are no professional actors for us to identify with, but there are plot lines, emotions, and thoughts that no one can help but relate to. Antonio Ricci (Lamberto Maggiorani) has been waiting for a job, but when one finally arrives, he must obtain a bicycle in order to be able to accept the position. His loving and caring wife, Maria (Lianella Carell), hocks the bed sheets in order to be able to afford a bicycle for Antonio. He reports to work as a poster hanger, but while on the job for only a short time, the bike is stolen by a young thief (Vittorio Antonucci). Desperate to get the vehicle back, Antonio seeks the aid of his friend, Baiocco (Gino Saltamerenda), and also receives the help of his devoted son, Bruno (Enzo Staiola). Bruno stays by Antonio's side, no matter what, determined to help his father get back the stolen property. It is a frustrating journey for the father and son, as they receive no help, except that of Baiocco. It seems that no matter what they do, Antonio is left with a fateful decision (shown in one of the most brutally honest scenes in any movie I've ever seen). He must ask himself just how far would he go to put food on the table for his family that he loves so much? There has been controversy over the ending of the film, which I am not going to go into, because it would be cheating you out of a brilliant ending to an extraordinary picture. However, I will say this much - When viewing The Bicycle Thief, ask yourself what you would do in Antonio's situation. What choices would you make? Some of the questions that rise from this film are some of the questions that help us to define ourselves as people, and the fact that this film provides such a clear and honest representation of so many facts of life is what makes it an undeniable masterpiece! This is a film to be cherished!",powerful,some films try explain multiple aspects story or character by showing several episodes characters life vittorio de sicas masterful bicycle thief relies power simplicity drive home its point it is very simple film relying film making at its basics there are no professional actors us identify with but there are plot lines emotions thoughts that no one can help but relate antonio ricci lamberto maggiorani has been waiting job but when one finally arrives he must obtain bicycle order be able accept position his loving caring wife maria lianella carell hocks bed sheets order be able afford bicycle antonio he reports work as poster hanger but while job only short time bike is stolen by young thief vittorio antonucci desperate get vehicle back antonio seeks aid his friend baiocco gino saltamerenda also receives help his devoted son bruno enzo staiola bruno stays by antonios side no matter what determined help his father get back stolen property it is frustrating journey father son as they receive no help except that baiocco it seems that no matter what they do antonio is left with fateful decision shown one most brutally honest scenes any movie ive ever seen he must ask himself just how far would he go put food table his family that he loves so much there has been controversy over ending film which i am not going go into because it would be cheating you out brilliant ending extraordinary picture however i will say this much when viewing bicycle thief ask yourself what you would do antonios situation what choices would you make some questions that rise this film are some questions that help us define ourselves as people fact that this film provides such clear honest representation so many facts life is what makes it undeniable masterpiece this is film be cherished,0.5671592775041051,0.20632183908045978,Positive,"{'Happy': 0.09, 'Angry': 0.07, 'Surprise': 0.25, 'Sad': 0.14, 'Fear': 0.45}"
9.0,The greatest neorealism film ever made,"The Bicycle Thief is without a doubt De Sica's masterpiece of Italian neorealism filmmaking. It is a true landmark in cinema history.A man who has been unemployed for months is finally given a chance at a job putting up posters. He and his family have been living in poverty for months, and are very exited to hear the news. The only requirement for the job is a bicycle. His wife pawns the sheets off of their own bed in order to buy the bicycle. And, as you can tell from the title, it is stolen on his first day of work. Now, without it, he and his son search the crowded streets of Rome for the only thing that can give him back his dignity as a man.This is a simple, but very powerful film and I found the relationship between Bruno and his father especially touching. The final scene is a true captivating moment as Bruno witnesses the true nature of man and the world we have created for ourselves.Don't miss this film, to call it a classic would be an understatement.",greatest neorealism film ever made,bicycle thief is without doubt de sicas masterpiece italian neorealism filmmaking it is true landmark cinema history man who has been unemployed months is finally given chance at job putting up posters he his family have been living poverty months are very exited hear news only requirement job is bicycle his wife pawns sheets off their own bed order buy bicycle as you can tell title it is stolen his first day work now without it he his son search crowded streets rome only thing that can give him back his dignity as man this is simple but very powerful film i found relationship between bruno his father especially touching final scene is true captivating moment as bruno witnesses true nature man world we have created ourselves dont miss this film call it classic would be understatement,0.6726190476190476,0.28648148148148145,Positive,"{'Happy': 0.06, 'Angry': 0.0, 'Surprise': 0.19, 'Sad': 0.23, 'Fear': 0.52}"
9.0,Lord of the Rings fanatics should all watch this movie,"Don't get me wrong, I have nothing against Lord of the Rings and I respect people's right to obsess over whatever they wish. Nonetheless, it does often irritate the cynic in me that we're teaching a generation of kids that there is a distinct borderline between 'good' and 'evil', between 'justice' and 'injustice', that there exists such a thing as a 'hero', when in reality there is actually nothing of the sort.Ladri di Biciclette is a shining example of a film that demonstrates this fact. There is no distinction between the 'good guys' and the 'bad guys'. At times we support one character, or the others. But there is never a line drawn between one side or the other because in reality, the only people we see here are simply human - flawed, corruptible and in this case, all suffering the same tragic fate. Our central character Antonio is obviously the protagonist, and he is obviously portrayed in such a way that our sympathies lie with him, but he is far from being a hero. He is simply used as the representation of the tragic misfortune that can befall mankind. This misfortune, also, is not depicted in any black-and-white sense. Antonio and his family's plight is not the only, or even necessarily the most desperate, in this film. In fact, with the exception of the family in the restaurant scene, practically every single character, major or minor, is portrayed as suffering in some way at the hands of capitalism.Therefore, as obviously tragic as Antonio's story is, the only real reason we side with him is because his particular tragedy is centrally focused. But, as has been discussed so often previously, he is an Everyman character. The bicycle in the film is simply used as an analogy for the loss, or lack of any essential element of life that leads to poverty and suffering. In very simple terms, the film's message is essentially that at some stage in life, we are all shouting ""Give me back my bicycle!"" But I digress. This simplistic and amateurish film is far more real and far more true-to-life than practically anything that Hollywood has churned out in the past fifty years. For that reason, the realist in me believes that all those dreamers, people who believe in a happy ending or ideal status quo, could do with the sort of down-to-earth lesson that this film represents.Yes, it's a distressing and bleak vision. But nevertheless, an utterly profound one.",lord rings fanatics should all watch this movie,dont get me wrong i have nothing against lord rings i respect peoples right obsess over whatever they wish nonetheless it does often irritate cynic me that were teaching generation kids that there is distinct borderline between good evil between justice injustice that there exists such thing as hero when reality there is actually nothing sort ladri di biciclette is shining example film that demonstrates this fact there is no distinction between good guys bad guys at times we support one character or others but there is never line drawn between one side or other because reality only people we see here are simply human flawed corruptible this case all suffering same tragic fate our central character antonio is obviously protagonist he is obviously portrayed such way that our sympathies lie with him but he is far being hero he is simply used as representation tragic misfortune that can befall mankind this misfortune also is not depicted any black white sense antonio his familys plight is not only or even necessarily most desperate this film fact with exception family restaurant scene practically every single character major or minor is portrayed as suffering some way at hands capitalism therefore as obviously tragic as antonios story is only real reason we side with him is because his particular tragedy is centrally focused but as has been discussed so often previously he is everyman character bicycle film is simply used as analogy loss or lack any essential element life that leads poverty suffering very simple terms films message is essentially that at some stage life we are all shouting give me back my bicycle but i digress this simplistic amateurish film is far more real far more true life than practically anything that hollywood has churned out past fifty years that reason realist me believes that all those dreamers people who believe happy ending or ideal status quo could do with sort down earth lesson that this film represents yes its distressing bleak vision but nevertheless utterly profound one,0.5521356421356421,-0.047947330447330454,Negative,"{'Happy': 0.09, 'Angry': 0.02, 'Surprise': 0.16, 'Sad': 0.32, 'Fear': 0.41}"
