Rating,Review Title,Review,Cleaned Review Title,Cleaned Review,Subjectivity,Polarity,Sentiment,Emotion Scale
6.0,To Catch a Bicycle,"Many films that were made more than 40-50 years ago are difficult to watch at times. Not because they are low-quality, but because the storytelling techniques were different, and in this case, the subject matter was just an overall downer. Now, I have adapted to watching foreign films. There was a time when I didn't like the subtitles side to those films, but I've seen so many now that I don't really even think about it. So my opinions on the film reflect nothing to do with the fact that it's a foreign film, or old for that matter. But I have to say, I didn't really think Bicycle Thieves was as good as the critics have rated it, or good enough to be on one of the all-time greatest films list.There's nothing bad about the film though, it's a unique story about a family in war-time Italy and the struggles that everyone went through in finding a job at that time. These people had no choice but to work, and they had to work jobs that they may not have been pleased with. I liked that part of the movie. They did a great job at making believe that this was a place where a bicycle could get stolen just like that. But to be honest I never found the full story to be all that interesting. The kid tries to throw in some comedic relief and dramatic depth to the role but some of it falls pretty flat. But I did get a little bit of that Life is Beautiful vibe from their relationship at times, that much I liked.The problem with the film is that I didn't care enough about the characters to feel something when the going got rough. For the most part, our lead character is pretty unlikable and doesn't do enough to make himself appealing anyway. The acting is fine, the film looks fine, and the directing is fine, but that's not good enough. I found too many things in the film to just be average.+Set up the world nicely +Acting is fine -Kid's performance is iffy-Didn't feel special 6.5/10",catch bicycle,many films that were made more than 40 50 years ago are difficult watch at times not because they are low quality but because storytelling techniques were different this case subject matter was just overall downer now i have adapted watching foreign films there was time when i didnt like subtitles side those films but ive seen so many now that i dont really even think about it so my opinions film reflect nothing do with fact that its foreign film or old that matter but i have say i didnt really think bicycle thieves was as good as critics have rated it or good enough be one all time greatest films list theres nothing bad about film though its unique story about family war time italy struggles that everyone went through finding job at that time these people had no choice but work they had work jobs that they may not have been pleased with i liked that part movie they did great job at making believe that this was place where bicycle could get stolen just like that but be honest i never found full story be all that interesting kid tries throw some comedic relief dramatic depth role but some it falls pretty flat but i did get little bit that life is beautiful vibe their relationship at times that much i liked problem with film is that i didnt care enough about characters feel something when going got rough most part our lead character is pretty unlikable doesnt do enough make himself appealing anyway acting is fine film looks fine directing is fine but thats not good enough i found too many things film just be average set up world nicely acting is fine kids performance is iffy didnt feel special 6 5 10,0.5274781341107873,0.21706754130223513,Positive,"{'Happy': 0.22, 'Angry': 0.02, 'Surprise': 0.19, 'Sad': 0.21, 'Fear': 0.36}"
10.0,A Potpourri of Vestiges Review: The path to eternal salvation becomes obvious only through true understanding of human emotions,"Semantically speaking, self-realization is a probable prelude to catharsis, but at a much higher echelon of cognition the two become virtually inseparable as attaining the former would automatically yield the latter. At this threshold of enlightenment, human spirit attains a sense of ephemeral divinity that would either drive the human crazy or would lead him to salvation. This enlightenment can seldom be attained through vicarious means. Even cinema, with its unparalleled potential to stimulate and satiate, mostly falls short of being cathartic, and only in the rarest of the rare cases does it manage to accomplish the incredible and the extraordinary. Undoubtedly, Bicycle Thieves is one such rare moment of triumph, wherein cinema becomes not only the tool but also the medium for the viewer to attain eternal salvation. Bicycle Thieves is an Italian neo-realist film by Vittorio De Sica. Neo- realism, a naturalistic movement in Italian cinema of the 1940s, aimed at giving cinema a new degree of realism, which promoted the use of an amateur cast vis-à-vis a professionally trained one and advocated shooting at real locations instead of the custom-built sets & studios. Keeping up with the spirit of the movement, Vittorio De Sica chose a factory fitter who had brought his son along for an audition as his male lead. His lead actress was a journalist who had approached him for an interview, while the young boy was filled by a child spotted in the crowd watching the filming. Bicycle Thieves tells the story of a poor worker searching the streets of Rome for his stolen bicycle, which he needs to keep his job intact. The movie is an amalgam of contrasting human feelings of hope & despair, sacrifice & gratification, euphoria & melancholy, love & detestation, and malice & benevolence. Bicycle Thieves performs the central function of art, which is to discover the meaning of life. The movie brilliantly handles with utmost care and precision the tender and often painful relationship that universally exists between a father and a son. The later half of the movie presents cinema at its most vivid, vituperative and volatile culminating in one of the most impactful, melancholic and brutally humanistic finales ever filmed in cinematic history, the agony of which would keep the viewer contemplating for weeks, months, or even years. The screenplay is simplistic, thought-provoking and at times nakedly brutal, while the cinematography is so effortless and magnificently beautiful that it appears as though a soul of a man has been filmed, and its true essence has been captured and preserved. The poignancy of the background score casts such a sustained spell that the movie experience is enhanced beyond imagination. American playwright Arthur Miller called it a lyrical masterpiece as it examines openly the destructive and draconian world man has made for himself. Marlon Brando once said, ""Bicycle Thieves is the perfect example of what can be done in front of the motion picture camera and is so rarely done"". Academy winner, Henry Fonda was so moved by the movie that he was tempted to write Vittorio De Sica a fan letter. The film is frequently on critics' and directors' lists of the best films ever made. It has captured every honor that the world of film can bestow including an Academy Honorary Award in 1950.All these accolades and the ubiquitous acclaim cannot describe the actual experience of seeing this film and becoming a part of its emotional impact. It makes the viewer laugh, cry and experience a rainbow of emotions. Bicycle Thieves has withstood the test of time for over six decades, and is a film for anyone and everyone.PS. It is a cinematic magnum opus, which accentuates the true might of cinema, and is a must for everyone, irrespective of cast, color, creed or gender. It's an ageless cinema for people of all age groups. 10/10http://www.apotpourriofvestiges.com/",potpourri vestiges review path eternal salvation becomes obvious only through true understanding human emotions,semantically speaking self realization is probable prelude catharsis but at much higher echelon cognition two become virtually inseparable as attaining former would automatically yield latter at this threshold enlightenment human spirit attains sense ephemeral divinity that would either drive human crazy or would lead him salvation this enlightenment can seldom be attained through vicarious means even cinema with its unparalleled potential stimulate satiate mostly falls short being cathartic only rarest rare cases does it manage accomplish incredible extraordinary undoubtedly bicycle thieves is one such rare moment triumph wherein cinema becomes not only tool but also medium viewer attain eternal salvation bicycle thieves is italian neo realist film by vittorio de sica neo realism naturalistic movement italian cinema 1940s aimed at giving cinema new degree realism which promoted use amateur cast vis vis professionally trained one advocated shooting at real locations instead custom built sets studios keeping up with spirit movement vittorio de sica chose factory fitter who had brought his son along audition as his male lead his lead actress was journalist who had approached him interview while young boy was filled by child spotted crowd watching filming bicycle thieves tells story poor worker searching streets rome his stolen bicycle which he needs keep his job intact movie is amalgam contrasting human feelings hope despair sacrifice gratification euphoria melancholy love detestation malice benevolence bicycle thieves performs central function art which is discover meaning life movie brilliantly handles with utmost care precision tender often painful relationship that universally exists between father son later half movie presents cinema at its most vivid vituperative volatile culminating one most impactful melancholic brutally humanistic finales ever filmed cinematic history agony which would keep viewer contemplating weeks months or even years screenplay is simplistic thought provoking at times nakedly brutal while cinematography is so effortless magnificently beautiful that it appears as though soul man has been filmed its true essence has been captured preserved poignancy background score casts such sustained spell that movie experience is enhanced beyond imagination american playwright arthur miller called it lyrical masterpiece as it examines openly destructive draconian world man has made himself marlon brando once said bicycle thieves is perfect example what can be done front motion picture camera is so rarely done academy winner henry fonda was so moved by movie that he was tempted write vittorio de sica fan letter film is frequently critics directors lists best films ever made it has captured every honor that world film can bestow including academy honorary award 1950 all these accolades ubiquitous acclaim cannot describe actual experience seeing this film becoming part its emotional impact it makes viewer laugh cry experience rainbow emotions bicycle thieves has withstood test time over six decades is film anyone everyone ps it is cinematic magnum opus which accentuates true might cinema is must everyone irrespective cast color creed or gender its ageless cinema people all age groups 10 10,0.5052657724788873,0.1070168902136115,Positive,"{'Happy': 0.1, 'Angry': 0.08, 'Surprise': 0.18, 'Sad': 0.24, 'Fear': 0.39}"
9.0,Brilliant and haunting,"The grim reality of post-war Italian life is immediately apparent in this film, as a group of unemployed men all crowd around in the morning, desperate to have their name called out for possible job opportunities. One man is lucky enough to get one putting up advertising posters, but his fortunes are soon reversed when his bike is stolen, thus setting off a desperate search around Rome with his son.So much of this man's pain - the humiliation of the situation he's in and the fear for his family's future - is amplified because of the presence of his son, which was a brilliant part of the story. He's needed to pawn items to feed his family. The police give him an apathetic, helpless response when he reports the crime. As he searches he gets help from friends, but it's like trying to find a needle in a haystack, despite seeing the machinations of a stolen bicycle racket on open display in a market. As he frantically runs around, a creepy guy talks to his son, and appears to be preying on him. Later he splurges on wine and mozzarella sandwiches, but his son can't help but notice what affluent kids are eating. Most dangerously, we feel the threat of an angry mob when he thinks he's found the culprit. What we see again and again is a harsh, unjust world, and all of this is being reflected in the boy's eyes.In the film's most gripping scene, the man faces the question, to what lengths should he go for his family? I felt great empathy for him, despite what seemed like a little carelessness on his part for his bike (and son!), considering how important they are to him. The feeling is magnified when director Vittorio De Sica shows us a huge rack of pawned items early on, and later in that brilliant crowd scene at the end, both of which made me think that this is just one story of many, that there is so much suffering in tough times, and most of it we're completely unaware of. There seems to be allegory here, as his bicycle has been stolen, so the future appeared to have been stolen for Italians in the 1940's. It's a small moment when the man gets a little break from a stranger, but this forgiving gesture carries tremendous meaning for the film, as does the moment the son takes his hand to move forward, together. Brilliant and haunting.",brilliant haunting,grim reality post war italian life is immediately apparent this film as group unemployed men all crowd around morning desperate have their name called out possible job opportunities one man is lucky enough get one putting up advertising posters but his fortunes are soon reversed when his bike is stolen thus setting off desperate search around rome with his son so much this mans pain humiliation situation hes fear his familys future is amplified because presence his son which was brilliant part story hes needed pawn items feed his family police give him apathetic helpless response when he reports crime as he searches he gets help friends but its like trying find needle haystack despite seeing machinations stolen bicycle racket open display market as he frantically runs around creepy guy talks his son appears be preying him later he splurges wine mozzarella sandwiches but his son cant help but notice what affluent kids are eating most dangerously we feel threat angry mob when he thinks hes found culprit what we see again again is harsh unjust world all this is being reflected boys eyes films most gripping scene man faces question what lengths should he go his family i felt great empathy him despite what seemed like little carelessness his part his bike son considering how important they are him feeling is magnified when director vittorio de sica shows us huge rack pawned items early later that brilliant crowd scene at end both which made me think that this is just one story many that there is so much suffering tough times most it were completely unaware there seems be allegory here as his bicycle has been stolen so future appeared have been stolen italians 1940s its small moment when man gets little break stranger but this forgiving gesture carries tremendous meaning film as does moment son takes his hand move forward together brilliant haunting,0.6427350427350426,0.11673789173789174,Positive,"{'Happy': 0.17, 'Angry': 0.1, 'Surprise': 0.24, 'Sad': 0.21, 'Fear': 0.28}"
10.0,Exceptional film which should be honored and treasured,"Italian Neorealism has always been one of my favorite film movements, and The Bicycle Thief appears to be one the finest examples of this medium. While people today might not understand the power in the story, one has to understand the nature state of Italy after World War II. The country was in ruins, and finding a good job was difficult. Desperation took over more often than reason, and this leads to the eventual climax of self pity and remorse. Quite a powerful film, for it is the only foreign film I have on my personal Top 25 list.",exceptional film which should be honored treasured,italian neorealism has always been one my favorite film movements bicycle thief appears be one finest examples this medium while people today might not understand power story one has understand nature state italy after world war ii country was ruins finding good job was difficult desperation took over more often than reason this leads eventual climax self pity remorse quite powerful film it is only foreign film i have my personal top 25 list,0.5711538461538462,0.17628205128205127,Positive,"{'Happy': 0.11, 'Angry': 0.11, 'Surprise': 0.11, 'Sad': 0.44, 'Fear': 0.22}"
8.0,"Despite its reputation, it's still not DeSica's best!","THE BICYCLE THIEVES is an Italian ""Neo-realist"" film--so called because it used real people in rather ordinary situations. Some see these as anti-Hollywood but the actual reason for them was that after the war, the Italian film industry was in ruin and they were practically broke, so making these simple films about simple people was a natural outgrowth, though some of the groundwork for this style began during the war.The story itself is about a poor man who is out of work but is finally able to secure a job using his bicycle. The problem is that soon after starting back to work, the bike is stolen so he spends the rest of the film searching for the bike (sort of like PEEWEE'S GREAT ADVENTURE, but not a comedy). Later in the film, the focus is not just on the bike but on the relationship between the man and his young son. There really is nothing more to this very simple plot, but it is a fascinating time capsule into the desperate state of Italy until its rebirth in the mid-1950s.The fact that THE BICYCLE THIEVES is so well known and respected is a testament to the fact that many ""in the know"" aren't really that smart after all. What they actually didn't realize is that the director (DeSica) did several other films that were at least as good, if not better. I have heard and read much fawning praise for this film while at the same time wondering how these critics can discuss THE BICYCLE THIEVES without mentioning his other great works. It wasn't like THE BICYCLE THIEVES was his one crowning achievement as director--it's just that this one was discovered abroad and by the Oscar people (AMPAS). I challenge you to watch MIRACLE IN MILAN, UMBERTO D or especially THE CHILDREN ARE WATCHING US and then tell me that THE BICYCLE THIEVES is THE great masterpiece. These films (particularly THE CHILDREN ARE WATCHING US) have a great depth of emotion that THE BICYCLE THIEVES lacks and the connection to the audience is greater (provided you ever see these other films).I am not cursing THE BICYCLE THIEVES--it is a very good and simple film. But as far as its being a ""masterpiece"", I just think it's a bit overrated. Before marking this review ""not helpful"", please first have integrity and see these other films to see what I mean--they are indeed great films and DeSica was an amazing director.",despite its reputation its still not desicas best,bicycle thieves is italian neo realist film so called because it used real people rather ordinary situations some see these as anti hollywood but actual reason them was that after war italian film industry was ruin they were practically broke so making these simple films about simple people was natural outgrowth though some groundwork this style began during war story itself is about poor man who is out work but is finally able secure job using his bicycle problem is that soon after starting back work bike is stolen so he spends rest film searching bike sort like peewees great adventure but not comedy later film focus is not just bike but relationship between man his young son there really is nothing more this very simple plot but it is fascinating time capsule into desperate state italy until its rebirth mid 1950s fact that bicycle thieves is so well known respected is testament fact that many know arent really that smart after all what they actually didnt realize is that director desica did several other films that were at least as good if not better i have heard read much fawning praise this film while at same time wondering how these critics can discuss bicycle thieves without mentioning his other great works it wasnt like bicycle thieves was his one crowning achievement as director its just that this one was discovered abroad by oscar people ampas i challenge you watch miracle milan umberto d or especially children are watching us then tell me that bicycle thieves is great masterpiece these films particularly children are watching us have great depth emotion that bicycle thieves lacks connection audience is greater provided you ever see these other films i am not cursing bicycle thieves it is very good simple film but as far as its being masterpiece i just think its bit overrated before marking this review not helpful please first have integrity see these other films see what i mean they are indeed great films desica was amazing director,0.44125476190476187,0.1885690476190476,Positive,"{'Happy': 0.15, 'Angry': 0.02, 'Surprise': 0.37, 'Sad': 0.15, 'Fear': 0.31}"
7.0,Touching but Overpraised,"A poor man relies on his bicycle to do his job, but it is stolen, leading to much angst. This landmark film of the Italian neo-realism movement has some fine moments and is ultimately touching. However, its historical significance should not be confused with its artistic merit. The simple plot is drawn out too much, and for a film made in 1948, it looks rather primitive, as if it were made two decades earlier. The acting by a cast of first-time actors is nothing more than average, although the little boy is adorable. Maggiorani looks like a cross between Humphrey Bogart and Clint Eastwood! It's a decent film, but falls far short of its reputation as one of the all-time greats.",touching but overpraised,poor man relies his bicycle do his job but it is stolen leading much angst this landmark film italian neo realism movement has some fine moments is ultimately touching however its historical significance should not be confused with its artistic merit simple plot is drawn out too much film made 1948 it looks rather primitive as if it were made two decades earlier acting by cast first time actors is nothing more than average although little boy is adorable maggiorani looks like cross between humphrey bogart clint eastwood its decent film but falls far short its reputation as one all time greats,0.44350649350649357,0.11496212121212122,Positive,"{'Happy': 0.14, 'Angry': 0.09, 'Surprise': 0.18, 'Sad': 0.18, 'Fear': 0.41}"
,The true point of the film,"....is the relationship of the father and son. Watch the film with your focus on the son, not the father. Watch what happens to the boy, what he sees, how he is influenced, his point of view. The father is so preoccupied with the bicycle he fails to see what is happening to his son. This is the strength of the film. Watch the boy.",true point film,is relationship father son watch film with your focus son not father watch what happens boy what he sees how he is influenced his point view father is so preoccupied with bicycle he fails see what is happening his son this is strength film watch boy,0.475,-0.07500000000000001,Negative,"{'Happy': 0.0, 'Angry': 0.0, 'Surprise': 1.0, 'Sad': 0.0, 'Fear': 0.0}"
,Stolen,"Spoilers herein.This is a film about child, one who is both IN the film and watches it.Hard as it is to imagine today, the world of film once had ideas on the surface, and lively controversies. Men took risks and sometimes survived to be celebrated.Here is a case: an experiment in urban photography, naturalistic acting (rather, naturalism) and investment in a narrative based on unromantic caprice. It is on many `best of' lists. But as with many projects (`On Golden Pond' comes to mind) the IDEA of the film is far superior to the film itself. This film is mawkishly sentimental while advertising that it isn't. It is crisply crafted while claiming otherwise. It is highly stylized - especially the confrontations - where it claims verity.The ideas explored have long ago been replaced by others more vital. As a result, the more you see this the more tired it seems. Except. Except for a couple shots of the kid, like when he is interrupted when peeing. Ted's Evaluation -- 2 of 4: Has some interesting elements.",stolen,spoilers herein this is film about child one who is both film watches it hard as it is imagine today world film once had ideas surface lively controversies men took risks sometimes survived be celebrated here is case experiment urban photography naturalistic acting rather naturalism investment narrative based unromantic caprice it is many best lists but as with many projects golden pond comes mind idea film is far superior film itself this film is mawkishly sentimental while advertising that it isnt it is crisply crafted while claiming otherwise it is highly stylized especially confrontations where it claims verity ideas explored have long ago been replaced by others more vital as result more you see this more tired it seems except except couple shots kid like when he is interrupted when peeing teds evaluation 2 4 has some interesting elements,0.5455797101449276,0.23933465085638997,Positive,"{'Happy': 0.13, 'Angry': 0.04, 'Surprise': 0.48, 'Sad': 0.13, 'Fear': 0.22}"
