Rating,Review Title,Review,Cleaned Review Title,Cleaned Review,Subjectivity,Polarity,Sentiment,Emotion Scale
8.0,As close to 'real' as possible.,"'Capernaum (2019)' is social-realism at its finest, so palpably 'real' that it almost seems a documentary. It somehow depicts a bleak and difficult-to-stomach world with sparks of hope and fun. Of course, a lot of what happens is devastating, too. Apparently, writer-director Labaki amalgamated the story only from real-life events she witnessed first-hand during her research. It certainly shows and, for me, this information makes everything that much more heart-breaking. It's precisely because it's so real that it hurts so much. This emotional connection is only possible because of a fantastically subdued screenplay, some brilliant direction and typically phenomenal performances from all members of the cast. Indeed, the child actors are remarkably good here, ranging in age from pre-teen to barely out-of-the-womb. It's impressive stuff that solidifies the film as one of the most believable in recent years. The whole thing is just effortlessly engaging, wrapping you up in a relatively small story that usually wouldn't get the time of day it deserves. It may be fiction, but it highlights a plethora of issues that truly plague our world every single day. It's all so domestic and, even, mundane, too. It's just a slice of life that we usually don't see. It's great. 8/10",as close real as possible,capernaum 2019 is social realism at its finest so palpably real that it almost seems documentary it somehow depicts bleak difficult stomach world with sparks hope fun course lot what happens is devastating too apparently writer director labaki amalgamated story only real life events she witnessed first hand during her research it certainly shows me this information makes everything that much more heart breaking its precisely because its so real that it hurts so much this emotional connection is only possible because fantastically subdued screenplay some brilliant direction typically phenomenal performances all members cast indeed child actors are remarkably good here ranging age pre teen barely out womb its impressive stuff that solidifies film as one most believable recent years whole thing is just effortlessly engaging wrapping you up relatively small story that usually wouldnt get time day it deserves it may be fiction but it highlights plethora issues that truly plague our world every single day its all so domestic even mundane too its just slice life that we usually dont see its great 8 10,0.5066416040100251,0.12130325814536343,Positive,"{'Happy': 0.21, 'Angry': 0.08, 'Surprise': 0.16, 'Sad': 0.32, 'Fear': 0.24}"
10.0,Carefully handcrafted movie with deeply touching story!,"Labaki excels in creating a masterpiece that should harvest as many awards as it can, and hopefully the Oscar. It is a heart breaking story with amazing protagonists performance. No one can expects an amazing acting coming from a child and a toddler of such ages! Will Zein be nominated for an Oscar? No one can deny that he deserves it. Labaki directed a marvelous film revealing a great pure talent.Seeing this many fake reviews here with 1 star rating reveals that these ""reviewers"" are manipulating the overall rating of the movie with an unfair score. Anyone who actually watched the movie will give it an above than average rating no matter his taste.",carefully handcrafted movie with deeply touching story,labaki excels creating masterpiece that should harvest as many awards as it can hopefully oscar it is heart breaking story with amazing protagonists performance no one can expects amazing acting coming child toddler such ages will zein be nominated oscar no one can deny that he deserves it labaki directed marvelous film revealing great pure talent seeing this many fake reviews here with 1 star rating reveals that these reviewers are manipulating overall rating movie with unfair score anyone who actually watched movie will give it above than average rating no matter his taste,0.5676470588235294,0.20378151260504204,Positive,"{'Happy': 0.12, 'Angry': 0.08, 'Surprise': 0.44, 'Sad': 0.2, 'Fear': 0.16}"
10.0,Moving touching human film,"It's almost like documentary, real honest raw emotions of unfortunate forgotten children in the world in any country with homeless or refugee kids",moving touching human film,its almost like documentary real honest raw emotions unfortunate forgotten children world any country with homeless or refugee kids,0.5102564102564103,0.11153846153846152,Positive,"{'Happy': 0.17, 'Angry': 0.17, 'Surprise': 0.0, 'Sad': 0.67, 'Fear': 0.0}"
10.0,Very powerful movie !,"This movie shows a lot of issues that we can find in Lebanon but also in a lot of other countries , it raises awareness of how bad life can get specially to young children . I hope that after watching this movie every single one of us will start to act in order to make this world a better place . Nadine Labaki did an amazing job because she showed the truth in a strong and realistic way . I also want to add that the kid is very talented he played his caracter in such a powerful way we could see pain in his eyes and it touched our heart and soul ! I recommend this movie it's a roller coaster of emotions !!",very powerful movie,this movie shows lot issues that we can find lebanon but also lot other countries it raises awareness how bad life can get specially young children i hope that after watching this movie every single one us will start act order make this world better place nadine labaki did amazing job because she showed truth strong realistic way i also want add that kid is very talented he played his caracter such powerful way we could see pain his eyes it touched our heart soul i recommend this movie its roller coaster emotions,0.6352182539682539,0.2086309523809524,Positive,"{'Happy': 0.11, 'Angry': 0.0, 'Surprise': 0.21, 'Sad': 0.42, 'Fear': 0.26}"
10.0,Touching Masterpiece,"A beautiful decent important movie that sheds light on many social issues in a moving heartbreaking painful way. Although it's so sad and makes you cry a lot, it also makes you laugh at some points. Just typical Nadine Labaki style. Everyone needs to see this masterpiece.",touching masterpiece,beautiful decent important movie that sheds light many social issues moving heartbreaking painful way although its so sad makes you cry lot it also makes you laugh at some points just typical nadine labaki style everyone needs see this masterpiece,0.6303030303030303,0.16212121212121214,Positive,"{'Happy': 0.15, 'Angry': 0.0, 'Surprise': 0.31, 'Sad': 0.46, 'Fear': 0.08}"
10.0,"IMPOSSIBLE TO OVERPRAISE, LAST YEAR'S BEST (IN ANY LANGUAGE!)","Two minutes into this movie you start worrying about this little boy, and two hours later you realize it hasn't let up one bit in intensity. The camera explores a city most of us are thankful we do not have to deal with - and by forcing us to do exactly that: deal with it - if only cinematically, it opens us up to great sympathy and understanding of so many people living on the brink of total hopelessness. It must be something like the effect Rosellini's Italian neo-realism films had on European audiences after WW2, this feeling that we are seeing something filmed on the actual streets and in the actual homes of citizens under the great stress of living in a world of deprivation, where everything is broken, and deliverance is nowhere in sight. Much has been written about most of the cast being drawn from the city's streets, and if this is true of the young man who has the lead role of Zain, then we see here the debut of a naturally gifted actor who seems, as they say, destined for stardom. The movie's overt plea for people not to have children until they can provide them with the simplest necessities is perhaps a controversial issue, but it's easy to see the logic behind it. There are many indelible moments in this powerhouse of a movie, the most riveting sequence being the few days Zain spends taking care of a child who is barely 2 yrs. old and needs care much more than the 12 yr. old Zain himself does. How he can dredge up such compassion and care for the baby is a marvel to behold. The camera picks up his generous, selfless nature, reminding us it is his goodness that ends up carrying us to the end, where we finally see a long-awaited hopeful smile brighten his face. Hunt this one down, search high and low, a stunning achievement in world cinema.",impossible overpraise last years best any language,two minutes into this movie you start worrying about this little boy two hours later you realize it hasnt let up one bit intensity camera explores city most us are thankful we do not have deal with by forcing us do exactly that deal with it if only cinematically it opens us up great sympathy understanding so many people living brink total hopelessness it must be something like effect rosellinis italian neo realism films had european audiences after ww2 this feeling that we are seeing something filmed actual streets actual homes citizens under great stress living world deprivation where everything is broken deliverance is nowhere sight much has been written about most cast being drawn citys streets if this is true young man who has lead role zain then we see here debut naturally gifted actor who seems as they say destined stardom movies overt plea people not have children until they can provide them with simplest necessities is perhaps controversial issue but its easy see logic behind it there are many indelible moments this powerhouse movie most riveting sequence being few days zain spends taking care child who is barely 2 yrs old needs care much more than 12 yr old zain himself does how he can dredge up such compassion care baby is marvel behold camera picks up his generous selfless nature reminding us it is his goodness that ends up carrying us end where we finally see long awaited hopeful smile brighten his face hunt this one down search high low stunning achievement world cinema,0.47387533875338744,0.18618563685636852,Positive,"{'Happy': 0.14, 'Angry': 0.0, 'Surprise': 0.29, 'Sad': 0.33, 'Fear': 0.24}"
8.0,"unrelenting, raw","In Beirut, Zain El Hajj is a 12 year old boy, or 13 at the most. No one knows for sure. He has been sentence to a 5 year prison term for a stabbing. He hates his life and wishes to sue his parents for being born. The movie follows Zain in the months before his arrest. He's a hustler, making money any way possible, for the family. Life is hard and he runs away.This movie is visceral giving a sense of life from the street level or from the gutter. It is unrelenting which can get tough. Some viewers can break under the deluge of indignities. It is a hammer that does not stop. It is raw and unforgiving. It can be tiring but worth the watch.",unrelenting raw,beirut zain el hajj is 12 year old boy or 13 at most no one knows sure he has been sentence 5 year prison term stabbing he hates his life wishes sue his parents being born movie follows zain months before his arrest hes hustler making money any way possible family life is hard he runs away this movie is visceral giving sense life street level or gutter it is unrelenting which can get tough some viewers can break under deluge indignities it is hammer that does not stop it is raw unforgiving it can be tiring but worth watch,0.5260878010878011,-0.03564491064491065,Negative,"{'Happy': 0.05, 'Angry': 0.1, 'Surprise': 0.15, 'Sad': 0.25, 'Fear': 0.45}"
10.0,Destroying,The movie will destroy you and will change your look toward street beggers refugees and foreign house keepers,destroying,movie will destroy you will change your look toward street beggers refugees foreign house keepers,0.041666666666666664,-0.17500000000000002,Negative,"{'Happy': 0.0, 'Angry': 0.0, 'Surprise': 0.0, 'Sad': 0.33, 'Fear': 0.67}"
9.0,WTF is poverty porn? Was Oliver Twist poverty porn?,"A moving epic film with a cute precocious kid? Check! A film designed to make me cry?- Check! Parents as the protagonists? Check! A film that entertained me and moved me? Yes? That's all I ask of this film. Why all the 1/10 reviews from do gooder film reviewers- ""I work in Syria, blah blah blah"" well a film about your life probably isn't entertaining. Stop questioning the political and economic motives and enjoy an entertaining and engrossing film with a fabulous cast- isnt that why we go to the theatre?",wtf is poverty porn was oliver twist poverty porn,moving epic film with cute precocious kid check film designed make me cry check parents as protagonists check film that entertained me moved me yes thats all i ask this film why all 1 10 reviews do gooder film reviewers i work syria blah blah blah well film about your life probably isnt entertaining stop questioning political economic motives enjoy entertaining engrossing film with fabulous cast isnt that why we go theatre,0.63,0.27,Positive,"{'Happy': 0.25, 'Angry': 0.0, 'Surprise': 0.19, 'Sad': 0.19, 'Fear': 0.38}"
