Rating,Review Title,Review,Cleaned Review Title,Cleaned Review,Subjectivity,Polarity,Sentiment,Emotion Scale
10,The soul of Indian cinema shines through C/o Kancharapalem!,"C/O Kancharapalem is a beautifully told tale about the highs and lows of love in a small remote Indian village. From the very first frame, you cannot help but be drawn into this charming world and fall in love with the characters with all their endearing quirks and frailties. It is even more surprising to learn that none of the lead characters in the film were trained actors. This is truly a testament to up and coming director Maha Venkatesh who has masterfully directed this ode to love with a poetic elegance. The music of the film stays with you long after the final credits roll. This is Indian cinema at its simplest and finest.",soul indian cinema shines through c o kancharapalem,c o kancharapalem is beautifully told tale about highs lows love small remote indian village very first frame you cannot help but be drawn into this charming world fall love with characters with all their endearing quirks frailties it is even more surprising learn that none lead characters film were trained actors this is truly testament up coming director maha venkatesh who has masterfully directed this ode love with poetic elegance music film stays with you long after final credits roll this is indian cinema at its simplest finest,0.6322222222222221,0.4033333333333333,Positive,"{'Happy': 0.23, 'Angry': 0.04, 'Surprise': 0.27, 'Sad': 0.12, 'Fear': 0.35}"
10,Overwhelming experience.A Gem of telugu cinema.,"I was having a lot of positive thoughts and expectations on this film, since it looked fresh and with rana backing it up and also my short film friend did a small role in this. I was excited, staying in mumbai it's hard for telugu films to release or release in wide scale , had a person who was willing to come , so it became easy and watching movie , the first 10 min itself i was mesmerized by the naturality and realistic way of taking.Movie is fully emotional, it makes you laugh and cry and finally leave you astonished at the end. You'll remember the characters all along the way back home, even now Iam not able to get through the movie's hangover. It has been 2 days , but it will be long before it to fade away. My final word is , this is a never before and never again kind of movie, so don't miss out in theatres. Proud time for telugu Cinema.",overwhelming experience gem telugu cinema,i was having lot positive thoughts expectations this film since it looked fresh with rana backing it up also my short film friend did small role this i was excited staying mumbai its hard telugu films release or release wide scale had person who was willing come so it became easy watching movie first 10 min itself i was mesmerized by naturality realistic way taking movie is fully emotional it makes you laugh cry finally leave you astonished at end youll remember characters all along way back home even now iam not able get through movies hangover it has been 2 days but it will be long before it fade away my final word is this is never before never again kind movie so dont miss out theatres proud time telugu cinema,0.5886724386724387,0.15526695526695528,Positive,"{'Happy': 0.14, 'Angry': 0.18, 'Surprise': 0.21, 'Sad': 0.25, 'Fear': 0.21}"
10,A movie larger that life.,Hinduism killed his father Christianity killed his love Islam killed his lover Humanity found his soul partner.,movie larger that life,hinduism killed his father christianity killed his love islam killed his lover humanity found his soul partner,0.22000000000000003,-0.020000000000000007,Negative,"{'Happy': 0.14, 'Angry': 0.0, 'Surprise': 0.57, 'Sad': 0.0, 'Fear': 0.29}"
10,Beautiful story crafted even more beautiful,"I should start this review with ""go watch it in the theatre. It's well worth your time and money.""It leaves such a wonderful after-taste even after you come out of a theatre. The way religion, love, sex and humanism are dealt with are commendable. The best part is getting everything together without hurting any communal sentiments. 2018 has been a golden year in telugu cinema and ths just proves the excellent transformation TFi is going through.",beautiful story crafted even more beautiful,i should start this review with go watch it theatre its well worth your time money it leaves such wonderful after taste even after you come out theatre way religion love sex humanism are dealt with are commendable best part is getting everything together without hurting any communal sentiments 2018 has been golden year telugu cinema ths just proves excellent transformation tfi is going through,0.5909090909090908,0.6,Positive,"{'Happy': 0.4, 'Angry': 0.0, 'Surprise': 0.2, 'Sad': 0.2, 'Fear': 0.2}"
9,Refreshingly New and Entertaining Story,"#C/OKancherapalem is a refreshing new take on life and Telugu cinema in general. Almost all commercially hit Telugu movies today are predictable when it comes to the story, the fight scenes and comedy. C/O Kancharapalem is a no non-sense, realistic portrayal of life in a village, and its characters are relatable to viewers of all ages and regions. The creativity of the story, its captivating depiction and its raw and natural humor sets it apart from everything else I've seen recently. Hoping this film will set new standards for authenticity and originality in cinema.",refreshingly new entertaining story,okancherapalem is refreshing new take life telugu cinema general almost all commercially hit telugu movies today are predictable when it comes story fight scenes comedy c o kancharapalem is no non sense realistic portrayal life village its characters are relatable viewers all ages regions creativity story its captivating depiction its raw natural humor sets it apart everything else ive seen recently hoping this film will set new standards authenticity originality cinema,0.5006544737313968,0.138076026537565,Positive,"{'Happy': 0.09, 'Angry': 0.18, 'Surprise': 0.09, 'Sad': 0.18, 'Fear': 0.45}"
8,A well crafted film with raw emotions enacted by newbies,C/o kancharapalem is a well crafted movie by debut director Maha ventatesh with nuance emotions in its exposition set under realistic environment .Music is simply plain and as the movie proceeds with situations you can feel it. Dialogs are written in simple and crispy language to suit the tone of local language of kacharpalem with all fresh untrained actors doing a fine job. Story/plot is something which you guys have to experience yourself before someone reveals.First 10 to 15 minutes into the movie you get connected with characters and there are humor scenes (lol) associated with it throughout the film. A film never to be missed for itzz honest making efforts by all newbies like all cast and crew. Kudos to suresh production for bringing the movie to theatres. Final a word of advice watch it in theatres for experiencing a soulful film.,well crafted film with raw emotions enacted by newbies,c o kancharapalem is well crafted movie by debut director maha ventatesh with nuance emotions its exposition set under realistic environment music is simply plain as movie proceeds with situations you can feel it dialogs are written simple crispy language suit tone local language kacharpalem with all fresh untrained actors doing fine job story plot is something which you guys have experience yourself before someone reveals first 10 15 minutes into movie you get connected with characters there are humor scenes lol associated with it throughout film film never be missed itzz honest making efforts by all newbies like all cast crew kudos suresh production bringing movie theatres final word advice watch it theatres experiencing soulful film,0.4947718947718948,0.18984348984348987,Positive,"{'Happy': 0.05, 'Angry': 0.05, 'Surprise': 0.27, 'Sad': 0.27, 'Fear': 0.36}"
8,Instant Classic,"#COKancharapalem is one of the most stunningly original film that Telugu Cinema has ever produced. Ten minutes in to the film I knew that I was watching a classic and by the end of the film, there were just no words to describe and this film will be the most talked about film in not just Telugu film industry but also across India in 2018. There is so much to talk about this film, but I guess, it will speak for itself in the future.",instant classic,is one most stunningly original film that telugu cinema has ever produced ten minutes film i knew that i was watching classic by end film there were just no words describe this film will be most talked about film not just telugu film industry but also across india 2018 there is so much talk about this film but i guess it will speak itself future,0.3416666666666666,0.21203703703703702,Positive,"{'Happy': 0.0, 'Angry': 0.2, 'Surprise': 0.6, 'Sad': 0.0, 'Fear': 0.2}"
9,"It's not a movie, it's life.","Must watch, one of the best movies I've seen. A path breaking movie.",its not movie its life,must watch one best movies ive seen path breaking movie,0.3,1.0,Positive,"{'Happy': 0.0, 'Angry': 0.0, 'Surprise': 0.75, 'Sad': 0.0, 'Fear': 0.25}"
10,One of the best movies I have ever seen,"I have seen about 4000 movies in my life. And this is one of the best that I have ever seen. It is one of the most satisfying endings. Probably in the top 10 or 20 of all time. What a phenomenal love story. I saw it in Telugu with English subtitles. I don't speak Telugu. Have never been to Andhra or Telangana. But I connected with every single character in this movie. Their fate and their tragedies really affected me. But the ending had my crying tears of joy. No, more than that - tears of humanity. One of the best films ever. This should be seen by the world.",one best movies i have ever seen,i have seen about 4000 movies my life this is one best that i have ever seen it is one most satisfying endings probably top 10 or 20 all time what phenomenal love story i saw it telugu with english subtitles i dont speak telugu have never been andhra or telangana but i connected with every single character this movie their fate their tragedies really affected me but ending had my crying tears joy no more than that tears humanity one best films ever this should be seen by world,0.40816326530612246,0.4270408163265306,Positive,"{'Happy': 0.05, 'Angry': 0.0, 'Surprise': 0.47, 'Sad': 0.16, 'Fear': 0.32}"
9,Worth watching!,"A directors' kind of movie. The screenplay and narration amplified my attention throughout which is usually not the case with me and telugumovies of late! Finally heard some fresh lines and saw some cute faces! Acting was a spot on with a majority of them. LoveXSociety storyline happened in some outskirts of an emerging city was given and projected onto a new dimension. A great effort must have been put in to keep the costumes and accessories in coherence with the time. Although I wished a little more effort in sinking the dialect with the time should have been a great plus. Also the outragious demolition and the deaths for the two major belief-systems whereas a smooth weep-over for the third, might lose points in the fair lens of some. All in all a worth watching movie.",worth watching,directors kind movie screenplay narration amplified my attention throughout which is usually not case with me telugumovies late finally heard some fresh lines saw some cute faces acting was spot with majority them lovexsociety storyline happened some outskirts emerging city was given projected onto new dimension great effort must have been put keep costumes accessories coherence with time although i wished little more effort sinking dialect with time should have been great plus also outragious demolition deaths two major belief systems whereas smooth weep over third might lose points fair lens some all all worth watching movie,0.5169191919191919,0.27979797979797977,Positive,"{'Happy': 0.17, 'Angry': 0.09, 'Surprise': 0.17, 'Sad': 0.17, 'Fear': 0.39}"
9,The ghost of Satyajit Ray hovers over this marvellous Telugu film.,"I'm sure the ghost of Sayajit Ray is looking down from whatever heaven he is in and smiling since his legacy is alive and well here on Earth. ""C/o Kancharapalem"" is a film Ray could have made in the blink of an eye. By that I mean it oozes Ray's humanity as well as a great deal of the skill he brought to everyone of his projects. Using non-professional actors Venkatesh Maha's marvellous film spins four separate love stories through four different generations in the Indian village of Kancharapalem and it's a charming and heart-breaking film, funny and touching in equal measure. It's also remarkably frank in its portrayal of the way in which women are treated in Indian society.If the performances don't always hit the mark remember that few of these people are professional actors and yet they handle the intricacies of Maha's multi-layered script with considerable aplomb. It also eschews Bollywood gloss for a much rawer, more naturalistic, feel and is a very hard film to dislike. This is an intimate epic that unfolds like a great novel and confirms its writer and director as a major player. It's also got one of the best codas I've seen in a movie in years.",ghost satyajit ray hovers over this marvellous telugu film,im sure ghost sayajit ray is looking down whatever heaven he is smiling since his legacy is alive well here earth c o kancharapalem is film ray could have made blink eye by that i mean it oozes rays humanity as well as great deal skill he brought everyone his projects using non professional actors venkatesh mahas marvellous film spins four separate love stories through four different generations indian village kancharapalem its charming heart breaking film funny touching equal measure its also remarkably frank its portrayal way which women are treated indian society if performances dont always hit mark remember that few these people are professional actors yet they handle intricacies mahas multi layered script with considerable aplomb it also eschews bollywood gloss much rawer more naturalistic feel is very hard film dislike this is intimate epic that unfolds like great novel confirms its writer director as major player its also got one best codas ive seen movie years,0.5084401709401709,0.246741452991453,Positive,"{'Happy': 0.19, 'Angry': 0.09, 'Surprise': 0.31, 'Sad': 0.16, 'Fear': 0.25}"
9,Simply Beautiful!!,"A feel good romantic drama narrating 4 love stories across 4 stages of the protagonist's life. Though the narrative lacks pace initially, the drama keeps you hooked as the movie progresses. The theme of the story extends to the belief in God (or) Gods, one has after setbacks in life. The casting looks real and never cinematic. The narrative moves swiftly across the 4 love stories finally converging to theme of God and care of people of Kancharapalem,",simply beautiful,feel good romantic drama narrating 4 love stories across 4 stages protagonists life though narrative lacks pace initially drama keeps you hooked as movie progresses theme story extends belief god or gods one has after setbacks life casting looks real never cinematic narrative moves swiftly across 4 love stories finally converging theme god care people kancharapalem,0.5333333333333334,0.3055555555555556,Positive,"{'Happy': 0.36, 'Angry': 0.0, 'Surprise': 0.29, 'Sad': 0.14, 'Fear': 0.21}"
10,Beautiful & MUST WATCH.,"Some has given their best in their first film. Same goes for director Venkatesh Maha, although he has directed only 2 films till now.FF : The film features a cast of over 80 non-actors, most of them native to Kancharapalem.A Beautiful Anthology of Love & A MUST WATCH.Available on Netflix, Amazon Prime Video & JioCinema.© MandalBros.",beautiful must watch,some has given their best their first film same goes director venkatesh maha although he has directed only 2 films till now ff film features cast over 80 non actors most them native kancharapalem beautiful anthology love must watch available netflix amazon prime video jiocinema mandalbros,0.5842592592592593,0.4833333333333334,Positive,"{'Happy': 0.25, 'Angry': 0.0, 'Surprise': 0.42, 'Sad': 0.0, 'Fear': 0.33}"
7,Breaking the stereotypes,"C/O Kancharapalem is about four love stories of people with different age groups set in a single town. Kacharapalem is name of that town.Is is the sweetest film ever made. Never at any point in the film, any of the lovebirds exchange smiles, they talk to each other normally, they never suggest from their expressions that they are in love. All they do is doing little things to show that they care for each other. One of the love stories is that of a prostitute and and man in 30's, but unlike other films, they never talk about her leaving the job or improving her life. It's the only film in which we never see proper fancy proposal(except one), yet we know it's a about love. Among all four stories, the story of Radha and Raju stands out, which is also the most 'silent' love story. Also, in the whole film, no one was going to die/kill for his/her lover, everyone knew their limitations.There is a scene in which the school boy did something that can't be justified after his break-up. That is the only only dramatic segment, and I kind of don't like it. All the memorable scenes are in the first half, second half has only tragedies.The realistic stories have some realistic problems, with religion playing a common part .There are talks of one's philosophy of god, women empowerment, sex and religion among other subjects, but it's not preachy.I feel the ending was a bit unnecessary, though it was there to explain the theme. But the director could have left the audience to understand without explaining it himself.I must mention that it was made on a shoestring budget . Even the biggest budget films in India have poor vfx. But this film is good in technical departments, cinematography, sound editing. Sountrack was good. You never feel like it's made by a first time director, you never feel like the actors are not professionals.C/O Kancharapalem is one of best the experiments in the history of Indian cinema(In all languages).",breaking stereotypes,c o kancharapalem is about four love stories people with different age groups set single town kacharapalem is name that town is is sweetest film ever made never at any point film any lovebirds exchange smiles they talk each other normally they never suggest their expressions that they are love all they do is doing little things show that they care each other one love stories is that prostitute man 30s but unlike other films they never talk about her leaving job or improving her life its only film which we never see proper fancy proposal except one yet we know its about love among all four stories story radha raju stands out which is also most silent love story also whole film no one was going die kill his her lover everyone knew their limitations there is scene which school boy did something that cant be justified after his break up that is only only dramatic segment i kind dont like it all memorable scenes are first half second half has only tragedies realistic stories have some realistic problems with religion playing common part there are talks ones philosophy god women empowerment sex religion among other subjects but its not preachy i feel ending was bit unnecessary though it was there explain theme but director could have left audience understand without explaining it himself i must mention that it was made shoestring budget even biggest budget films india have poor vfx but this film is good technical departments cinematography sound editing sountrack was good you never feel like its made by first time director you never feel like actors are not professionals c o kancharapalem is one best experiments history indian cinema all languages,0.49835600907029487,0.1418509070294785,Positive,"{'Happy': 0.2, 'Angry': 0.02, 'Surprise': 0.31, 'Sad': 0.14, 'Fear': 0.33}"
10,Its a mind bending story of a middle aged attender of a office.,"Raju sudaram is a middle aged i.e. 49 yrs old ,person asked for marriage by his office head Radha. The journey of life of Raju is reavealed at different stages from 1982 to 2017 . Like a boy at school, as a supporter of village goon and as a alchohol seller . The sentences that reveal plot before the ending were "" I HAVE LEARNED SOME HINDI FROM SOME MUSLIM SAHEBS, I BELIEVE IN PEOPLE NOT GODS by RAJU, "" IM A CONVERTED CHRISTIAN by Joseph"" , ""MY FATHER DIED WHILE I WAS KID and MEERU THURAKOLLA?( are u a muslim girl?) by Geddam as has some attachment with hinduism and christianity previously in his life ."" These the are plot techniques used by Direcror Venkatesh Maha. Its a humanist's movie leaving caste stigma by the belivers aside that was more dominant in indian society.",its mind bending story middle aged attender office,raju sudaram is middle aged i e 49 yrs old person asked marriage by his office head radha journey life raju is reavealed at different stages 1982 2017 like boy at school as supporter village goon as alchohol seller sentences that reveal plot before ending were i have learned some hindi some muslim sahebs i believe people not gods by raju im converted christian by joseph my father died while i was kid meeru thurakolla are u muslim girl by geddam as has some attachment with hinduism christianity previously his life these are plot techniques used by direcror venkatesh maha its humanists movie leaving caste stigma by belivers aside that was more dominant indian society,0.2518518518518518,0.025925925925925925,Positive,"{'Happy': 0.12, 'Angry': 0.19, 'Surprise': 0.25, 'Sad': 0.0, 'Fear': 0.44}"
10,Larger than Life Movie..,Its not just the movie.. its a life which is to be learned..,larger than life movie,its not just movie its life which is be learned,0.5,0.0,Neutral,"{'Happy': 0.0, 'Angry': 0.0, 'Surprise': 0.0, 'Sad': 0.0, 'Fear': 1.0}"
