Rating,Review Title,Review,Cleaned Review Title,Cleaned Review,Subjectivity,Polarity,Sentiment,Emotion Scale
1.0,Walked out after 30 Minutes,"This movie was really really bad. Forgive the pun, but it was epically bad. I went to the movie to fill time between some business I was conducting in New York and my flight that was leaving at 7pm.. I had several hours to kill.There are no good scenes in this movie. I think I laughed at one joke within the first 5 or 10 minutes. The plot (if you could actually say there was one) was so stupid that it borders on the criminal. Anyone (actor, writer, director, or producer) should be jailed for 1 year for participating in the production of this film.I would provide spoilers for this movie, but that would mean there is something worth spoiling.I actually felt embarrassed for the actors. I had to leave after 30 minutes. For the first 20 minutes I thought to myself.. ""this just can't be.. a movie that looks like it was filmed using one camera in a decorated high school auditorium"".. ""there's got to be a joke somewhere"".. but alas, at the 30th minute, I could no longer justify wasting my life. The movie just never happened.I want my $11.00 back Hollywood! Stop defrauding the public!!",walked out after 30 minutes,this movie was really really bad forgive pun but it was epically bad i went movie fill time between some business i was conducting new york my flight that was leaving at 7pm i had several hours kill there are no good scenes this movie i think i laughed at one joke within first 5 or 10 minutes plot if you could actually say there was one was so stupid that it borders criminal anyone actor writer director or producer should be jailed 1 year participating production this film i would provide spoilers this movie but that would mean there is something worth spoiling i actually felt embarrassed actors i had leave after 30 minutes first 20 minutes i thought myself this just cant be movie that looks like it was filmed using one camera decorated high school auditorium theres got be joke somewhere but alas at 30th minute i could no longer justify wasting my life movie just never happened i want my 11 00 back hollywood stop defrauding public,0.41103956228956223,-0.1036742424242424,Negative,"{'Happy': 0.1, 'Angry': 0.0, 'Surprise': 0.4, 'Sad': 0.13, 'Fear': 0.37}"
7.0,A Parody I enjoyed,"I can understand why people did not like the movie, it was over the top crude and not very funny. But what do you expect? All parodies are over the top and not very funny. I liked it because for once I finally understood all the jokes. All of the movies they were making fun of are very well known good movies, so it was easy to see where they were making fun of it. Perhaps someone could find it offensive if one of the movies they are joking about is your favorite. But this is the main purpose of a parody, to cut up other films. I really enjoyed how they tied in so many different movies into the one. It was cooling seeing the doubles they picked to act as famous actors, in all honesty they did a great job with portraying who they were pretending to be. I personal enjoy parodies for what they are, over the top silliness that makes no sense other then to cut up other films.",parody i enjoyed,i can understand why people did not like movie it was over top crude not very funny but what do you expect all parodies are over top not very funny i liked it because once i finally understood all jokes all movies they were making fun are very well known good movies so it was easy see where they were making fun it perhaps someone could find it offensive if one movies they are joking about is your favorite but this is main purpose parody cut up other films i really enjoyed how they tied so many different movies into one it was cooling seeing doubles they picked act as famous actors all honesty they did great job with portraying who they were pretending be i personal enjoy parodies what they are over top silliness that makes no sense other then cut up other films,0.5953895463510848,0.255103550295858,Positive,"{'Happy': 0.44, 'Angry': 0.04, 'Surprise': 0.22, 'Sad': 0.15, 'Fear': 0.15}"
1.0,Totally crap!,"Save your money! Save your eyes and ears the indignity of watching or hearing this film. Any jokes they thought up were one-liners, which were promptly turned into entire scenes or musical numbers, thereby killing both ideas stone dead.The sound cut out at the showing I saw. Strangely, this made the experience less appalling for about ten minutes as we didn't have to hear the awful dialogue - the audience were coming up with better jokes themselves.The studio would be best advised to release a single DVD of this, and microwave it.",totally crap,save your money save your eyes ears indignity watching or hearing this film any jokes they thought up were one liners which were promptly turned into entire scenes or musical numbers thereby killing both ideas stone dead sound cut out at showing i saw strangely this made experience less appalling about ten minutes as we didnt have hear awful dialogue audience were coming up with better jokes themselves studio would be best advised release single dvd this microwave it,0.411996336996337,-0.05677655677655676,Negative,"{'Happy': 0.11, 'Angry': 0.0, 'Surprise': 0.61, 'Sad': 0.06, 'Fear': 0.22}"
1.0,Please refer to reviews on Date Movie,"Some movies are funny, some are not. This movie may be funny to you, if you liked Date Movie, since both films are pretty much the same in cast and script quality.Epic Movie is a loosely strung together collection of slap-stick comedy sketches based on various epic movies (Pirates of the Caribbean, Nacho Libre, Chronicles of Narnia, X-Men, Superman, etc...) so it's probably helpful if you have seen a few of the epics this movie takes off at, to understand the jokes used. (If you've seen the clips during MTV video awards, you get the idea on the kind of jokes I'm referring to). Epic Movie tries to cash in on the Scary Movie, Date Movie, ""Movie"" Movie franchise, but doesn't measure up to the originality shown in the Scary Movie series.It doesn't take a genius to recommend that you save your box-office ticket money, and if you're interested, wait for the DVD, since this isn't an essential big screen movie.",please refer reviews date movie,some movies are funny some are not this movie may be funny you if you liked date movie since both films are pretty much same cast script quality epic movie is loosely strung together collection slap stick comedy sketches based various epic movies pirates caribbean nacho libre chronicles narnia x men superman etc so its probably helpful if you have seen few epics this movie takes off at understand jokes used if youve seen clips during mtv video awards you get idea kind jokes im referring epic movie tries cash scary movie date movie movie movie franchise but doesnt measure up originality shown scary movie series it doesnt take genius recommend that you save your box office ticket money if youre interested wait dvd since this isnt essential big screen movie,0.5663461538461539,0.06239316239316242,Positive,"{'Happy': 0.33, 'Angry': 0.0, 'Surprise': 0.28, 'Sad': 0.11, 'Fear': 0.28}"
1.0,Who the hell rated this movie a 10?,"Seriously people, i wasn't expecting much from this and i didn't get much. I at least expected a few laughs from it but i never got it. I think they let five year olds write the script for this crap. Very, very cliché spoof film, you could tell what was coming the whole way through (with a few stupid exceptions). They seriously need to stop spoof movies, i thought you couldn't get any worse than Scary Movie 4 but i was wrong. Writing a spoof takes no talent what so ever, just copy everyones ideas and ""try"" to make them funny. Now i could go on all day about how bad this movie is but I'm afraid i must go, everyone do yourself a favour, do not see this rubbish.",who hell rated this movie 10,seriously people i wasnt expecting much this i didnt get much i at least expected few laughs it but i never got it i think they let five year olds write script this crap very very clich spoof film you could tell what was coming whole way through with few stupid exceptions they seriously need stop spoof movies i thought you couldnt get any worse than scary movie 4 but i was wrong writing spoof takes no talent what so ever just copy everyones ideas try make them funny now i could go all day about how bad this movie is but im afraid i must go everyone do yourself favour do not see this rubbish,0.5395,-0.2578333333333333,Negative,"{'Happy': 0.21, 'Angry': 0.0, 'Surprise': 0.37, 'Sad': 0.26, 'Fear': 0.16}"
1.0,Not actually a movie...,"...but rather just a list of movies that the filmmakers wanted to parody, strung together by the weakest plot in film history and a lot of unfunny jokes.You would think that the team responsible for the mess of a movie that was Date Movie would at least have learned something from their last film to help them avoid the same mistakes, but they didn't. It would appear they spent more time making parodies as visually accurate as they could and spent almost no time trying to make the film entertaining. Some of the parodies seem completely out of place and don't even fit into what little plot there is.I couldn't recommend this film to anyone, not even those I hated.",not actually movie,but rather just list movies that filmmakers wanted parody strung together by weakest plot film history lot unfunny jokes you would think that team responsible mess movie that was date movie would at least have learned something their last film help them avoid same mistakes but they didnt it would appear they spent more time making parodies as visually accurate as they could spent almost no time trying make film entertaining some parodies seem completely out place dont even fit into what little plot there is i couldnt recommend this film anyone not even those i hated,0.36333333333333334,0.022500000000000017,Positive,"{'Happy': 0.11, 'Angry': 0.05, 'Surprise': 0.16, 'Sad': 0.32, 'Fear': 0.37}"
1.0,"It's horrible but at least it's not ""Disaster Movie""!","""Disaster Movie"" was a horribly unfunny and pathetic film. Likewise, ""Epic Movie"" is also horribly unfunny and pathetic...but at least it was slightly better! Unlike ""Disaster Movie"", this one actually had two or three laughs--very small laughs, but laughs nonetheless.Like ""Meet the Spartans"", ""Disaster Movie"" and 174 other recent movies, this one is a rapid-fire parody of many recent movies. And, like all these other films, it's mostly crappy--with very few laughs. The jokes are rapid-fire but unlike the original film of this type, ""Airplane"", the jokes never worked. They would have been better off in hindsight to just stop making these sort of terrible films a lot time ago but they have continued for one reason alone--many teenagers are so stupid and sheep-like that they'll go see anything!!! Nothing else could explain the proliferation of these crap-tastic films.Some of the parodied films include ""The Lion, The Witch and The Wardrobe"", ""Harry Potter"", ""X-Men"", ""Snakes on a Plane"" and ""The DaVinci Code"" and it could have been funny. The problem, however, is that the writing was absolutely pathetic and it truly appears as if no one cared. After all, not giving a darn is the only way that would explain how a Harry Potter parody has not a single laugh! Overall, a bore-fest with lousy writing, acting and direction that appears as if the director was just punching a time clock--hoping the unfunny mess would just finish itself quickly so they could go on to the next slap-dash production.",its horrible but at least its not disaster movie,disaster movie was horribly unfunny pathetic film likewise epic movie is also horribly unfunny pathetic but at least it was slightly better unlike disaster movie this one actually had two or three laughs very small laughs but laughs nonetheless like meet spartans disaster movie 174 other recent movies this one is rapid fire parody many recent movies like all these other films its mostly crappy with very few laughs jokes are rapid fire but unlike original film this type airplane jokes never worked they would have been better off hindsight just stop making these sort terrible films lot time ago but they have continued one reason alone many teenagers are so stupid sheep like that theyll go see anything nothing else could explain proliferation these crap tastic films some parodied films include lion witch wardrobe harry potter x men snakes plane davinci code it could have been funny problem however is that writing was absolutely pathetic it truly appears as if no one cared after all not giving darn is only way that would explain how harry potter parody has not single laugh overall bore fest with lousy writing acting direction that appears as if director was just punching time clock hoping unfunny mess would just finish itself quickly so they could go next slap dash production,0.5354081632653062,-0.19474149659863943,Negative,"{'Happy': 0.05, 'Angry': 0.05, 'Surprise': 0.16, 'Sad': 0.42, 'Fear': 0.33}"
2.0,Epic Movie is a Disaster of Epic Proportions,"Alright, it wasn't that bad, but it was close. Sure the Scary Movie series as well as Date Movie were stupid and juvenile, but this is dumber than all the rest. There were a few chuckles, but overall it was mostly me groaning. Nearly every joke was tired and lame. They gave away all the ""good"" jokes in the trailer. Why Fred Willard and Jennifer Coolidge would be in this I have no idea. But Crispin Glover? The oddball actor who was so great in films like Back to the Future, River's Edge What's Eating Gilbert Grape and more? Yeah that's him all right, as Willy Wonka dancing around to crappy songs. So maybe my title was accurate.",epic movie is disaster epic proportions,alright it wasnt that bad but it was close sure scary movie series as well as date movie were stupid juvenile but this is dumber than all rest there were few chuckles but overall it was mostly me groaning nearly every joke was tired lame they gave away all good jokes trailer why fred willard jennifer coolidge would be this i have no idea but crispin glover oddball actor who was so great films like back future rivers edge whats eating gilbert grape more yeah thats him all right as willy wonka dancing around crappy songs so maybe my title was accurate,0.5099801587301588,0.03178571428571429,Positive,"{'Happy': 0.26, 'Angry': 0.05, 'Surprise': 0.0, 'Sad': 0.26, 'Fear': 0.42}"
1.0,An Epic is an epic,"An epic is an epic. An awful movie is an awful movie. When I heard they were going to make an Epic Movie, I was like if it's called Epic Movie then it might be an epic. It's an epic horror but not an epic comedy. I timed it, it went for 60 minutes but after 15 minutes the theater was empty. I didn't leave. If I wanted to watch something that went for 60 minutes, I would've watched 60 minutes. If I wanted to watch an Epic Movie. I would've watched The Lord of the Rings. If I wanted to watch an awful movie I would've watched Plan 9 From Outer Space.I won't be surprised if Aaron Seltzer becomes the next Uwe Boll, as he also directed Date Movie. By next year, he will have a trophy case full of Razzies. So if they make another movie like this next year. It would also get in the bottom 100. 2007 is starting off bad but there are better movies coming out. An epic is an epic. An awful movie is an awful movie.",epic is epic,epic is epic awful movie is awful movie when i heard they were going make epic movie i was like if its called epic movie then it might be epic its epic horror but not epic comedy i timed it it went 60 minutes but after 15 minutes theater was empty i didnt leave if i wanted watch something that went 60 minutes i wouldve watched 60 minutes if i wanted watch epic movie i wouldve watched lord rings if i wanted watch awful movie i wouldve watched plan 9 outer space i wont be surprised if aaron seltzer becomes next uwe boll as he also directed date movie by next year he will have trophy case full razzies so if they make another movie like this next year it would also get bottom 100 2007 is starting off bad but there are better movies coming out epic is epic awful movie is awful movie,0.5006410256410257,-0.14615384615384613,Negative,"{'Happy': 0.0, 'Angry': 0.05, 'Surprise': 0.53, 'Sad': 0.16, 'Fear': 0.26}"
