Rating,Review Title,Review,Cleaned Review Title,Cleaned Review,Subjectivity,Polarity,Sentiment,Emotion Scale
8.0,Two Pals Make Good in Hollywood,"Matt Damon and Ben Affleck scored quite a success with their interesting and entertaining script. The introduction and exposition sections are enormously engrossing, after which script peaks and rather coasts along the rest of the way. Yet, the casting is so well done, and the acting at such good level, that interest is nicely maintained.What ""Hunting"" essentially consists of is some two dozen conversational scenes, bridged together with short transitions of physical activity. What is rather remarkable is that one isn't aware of the dramatic limitations comprising the structure. This is a real tribute to the cast, director, and of course, the script. While the basic situation is really quite far-fetched, it is made to seem plausible--again, the mark of good, convincing writing. The story behind getting the script sold and produced on the terms of the writers' preferences is fascinating. Still, one can't really call it luck, for both Damon and Affleck ""paid their dues"" -- and success did not just fall into their laps. These are two talented young men, with perseverance; and how wonderful for them to have achieved such success while still youthful and full of vitality. ""Good Will Hunting"" is a good production, with solid craftsmanship in all departments -- thanks to the creativity of Damon and Affleck.",two pals make good hollywood,matt damon ben affleck scored quite success with their interesting entertaining script introduction exposition sections are enormously engrossing after which script peaks rather coasts along rest way yet casting is so well done acting at such good level that interest is nicely maintained what hunting essentially consists is some two dozen conversational scenes bridged together with short transitions physical activity what is rather remarkable is that one isnt aware dramatic limitations comprising structure this is real tribute cast director course script while basic situation is really quite far fetched it is made seem plausible again mark good convincing writing story behind getting script sold produced terms writers preferences is fascinating still one cant really call it luck both damon affleck paid their dues success did not just fall into their laps these are two talented young men with perseverance how wonderful them have achieved such success while still youthful full vitality good will hunting is good production with solid craftsmanship all departments thanks creativity damon affleck,0.4796626984126985,0.3199074074074073,Positive,"{'Happy': 0.28, 'Angry': 0.08, 'Surprise': 0.17, 'Sad': 0.28, 'Fear': 0.19}"
10.0,Worth Seeing,"This is a screenplay, whose script was written by Ben Affleck and Matt Damon and sold for $ 600,000. (They split the proceeds)I love this movie. I have seen it several times, and I still want more at the end (Isn't that what good movies do to you?) The subplots make for mini-movies of their own, especially the interplay between Robin Williams' character and Stellan Skarsgard's character.Damon's real life buddy Affleck plays that same buddy role in GWH, and provides the definition for true friendship.Minnie Driver is compelling, and I just love a couple of scenes when she and Damon are in a novelty store, and another where she is telling a joke in a bar with Damon, Affleck and friends. The love story which develops with Driver is very convincing, and it's ""under the surface"" portrayal plus input from one of our favorite characters makes for one of the best definitions of intimacy I have ever seen on film.When I see some of the movies in IDB's top 250, I am sad that this movie isn't in there, but that is my opinion. Torn between GWH and Rounders as Damon's best movie, though I think GWD plays to a wider audience.",worth seeing,this is screenplay whose script was written by ben affleck matt damon sold 600 000 they split proceeds i love this movie i have seen it several times i still want more at end isnt that what good movies do you subplots make mini movies their own especially interplay between robin williams character stellan skarsgards character damons real life buddy affleck plays that same buddy role gwh provides definition true friendship minnie driver is compelling i just love couple scenes when she damon are novelty store another where she is telling joke bar with damon affleck friends love story which develops with driver is very convincing its under surface portrayal plus input one our favorite characters makes one best definitions intimacy i have ever seen film when i see some movies idbs top 250 i am sad that this movie isnt there but that is my opinion torn between gwh rounders as damons best movie though i think gwd plays wider audience,0.5671052631578948,0.4,Positive,"{'Happy': 0.25, 'Angry': 0.0, 'Surprise': 0.22, 'Sad': 0.28, 'Fear': 0.25}"
8.0,Good but overrated and overhyped,"It's a good movie; the premise is its best point, as well as the human connection between friends and relationships, but so many reviews on here calling this a masterpiece or one of the best movies ever made are way unwarranted and over the top. It's a good low budget movie with some depth and a famous role for Robin WIlliams, who won the best supporting actor Oscar. The script is good, but not great, the directing is slightly above average, it drags at times, and some little aspects of it are unrealistic. It's definitely good and worth a watch, but it's not one of the greats of all time.8/10",good but overrated overhyped,its good movie premise is its best point as well as human connection between friends relationships but so many reviews here calling this masterpiece or one best movies ever made are way unwarranted over top its good low budget movie with some depth famous role robin williams who won best supporting actor oscar script is good but not great directing is slightly above average it drags at times some little aspects it are unrealistic its definitely good worth watch but its not one greats all time 8 10,0.47000000000000003,0.365625,Positive,"{'Happy': 0.35, 'Angry': 0.0, 'Surprise': 0.35, 'Sad': 0.09, 'Fear': 0.22}"
,Good doesn't describe it!,"I am totally dumbfounded by some of the reactions to this film. I'm imagining that the people who call this film boring are of the frame of mind, that unless a film has at least three explosions then it's not worth the price of a cinema ticket. Then there are the people calling it unrealistic. Now forgive me but I come from a similar background to the central character Will and I believe myself to be intelligent, but I didn't use my intelligence until very recently. Instead I took to taking drugs and drinking and swearing! Only a few years ago I was working as a cleaner, but now I'm studying programming and media technology at the best technical University in the UK. Now if I can identify with this film's realism (and I live in England) why can't so many others? This film is a veritable jewel. The script is one of the best I've ever seen. The way it mixes thought provoking ideas and witticisms with the kind of colloquial dialogue which we have read in things like The Catcher in the Rye'. Now I agree with the sentiment that some people have put across, get in touch with your inner Robin Williams'. But thankfully the script or Gus Van Sant or whatever prevented it from going over board. Look at the final scene where they're hugging and saying their farewells. Now this could have overlapped into a typical slushy moment, but no the lines `Doesn't this contravene the Doctor, patient relationship?' `Only if you grab my ass' were uttered so as to diffuse it. Then bear in mind that you never actually see the reunion between Skylar and Will! I could go on forever arguing against people's criticisms. But what's the point if certain viewers can't appreciate the subtly evocative direction of Van Sant, the quick fire script and the superb performances by the cast.  It's these same viewers who shall, until the end of their days sit and watch the vacuous outpourings of Hollywood mainstream. Let them watch this chewing gum for the mind' and we discerning few will lap up the droplets of quality cinema. I think a quote is in order here directed to all you viewers who deemed this film boring or unrealistic `If ignorance is bliss, there should be more happy people.'",good doesnt describe it,i am totally dumbfounded by some reactions this film im imagining that people who call this film boring are frame mind that unless film has at least three explosions then its not worth price cinema ticket then there are people calling it unrealistic now forgive me but i come similar background central character will i believe myself be intelligent but i didnt use my intelligence until very recently instead i took taking drugs drinking swearing only few years ago i was working as cleaner but now im studying programming media technology at best technical university uk now if i can identify with this films realism i live england why cant so many others this film is veritable jewel script is one best ive ever seen way it mixes thought provoking ideas witticisms with kind colloquial dialogue which we have read things like catcher rye now i agree with sentiment that some people have put across get touch with your inner robin williams but thankfully script or gus van sant or whatever prevented it going over board look at final scene where theyre hugging saying their farewells now this could have overlapped into typical slushy moment but no lines doesnt this contravene doctor patient relationship only if you grab my ass were uttered so as diffuse it then bear mind that you never actually see reunion between skylar will i could go forever arguing against peoples criticisms but whats point if certain viewers cant appreciate subtly evocative direction van sant quick fire script superb performances by cast its these same viewers who shall until end their days sit watch vacuous outpourings hollywood mainstream let them watch this chewing gum mind we discerning few will lap up droplets quality cinema i think quote is order here directed all you viewers who deemed this film boring or unrealistic if ignorance is bliss there should be more happy people,0.5602453102453102,0.09799947527220254,Positive,"{'Happy': 0.14, 'Angry': 0.06, 'Surprise': 0.36, 'Sad': 0.18, 'Fear': 0.26}"
10.0,"Incredible, moving movie.","A lot of things have been said about this fantastic movie, and I only hope to add a few more praises.The fact that it was written by Ben and Matt was a shock to me, I did not expect any strong writing and a solid script, but boy was I wrong. The movie lasts for 2 hours, and every minute of it I couldn't even focus on anything beside the incredible world of Will Hunting.Matt plays Will Hunting, who is a brilliant young man who denies his unreal intellect. Will has had a very abusive childhood which hurt him mentally to a point where he can no longer let anyone close to him aside from his best friend who is played by Ben. That is until a professor at one of the top colleges finds Will's talent and helps him out of trouble with the law. Robin Williams later comes in as a therapist to Will, he is the only one who can really stand up to Will's intellect and manages to break the layer of distrust that Will has developed over years of solitude, and the two develop a bond beyond friendship.Yes there is a girl, but this is not a romantic movie. There is more to life then what we are taught and what we have to show for it.The writing is witty, brilliant and hilarious at times, both Matt and Robin Williams preform wonderfully from both a comedic and theatrical prospective. Matt's best work since Dogma and Williams best along side Dead Poet's Society.If your looking for a typical Hollywood movie with a Hollywood ending, then do not bother spending two hours on this movie. This movie is ahead of it's time, and lands an easy 10 out of 10.This one is a keeper in my movie library.",incredible moving movie,lot things have been said about this fantastic movie i only hope add few more praises fact that it was written by ben matt was shock me i did not expect any strong writing solid script but boy was i wrong movie lasts 2 hours every minute it i couldnt even focus anything beside incredible world will hunting matt plays will hunting who is brilliant young man who denies his unreal intellect will has had very abusive childhood which hurt him mentally point where he can no longer let anyone close him aside his best friend who is played by ben that is until professor at one top colleges finds wills talent helps him out trouble with law robin williams later comes as therapist will he is only one who can really stand up wills intellect manages break layer distrust that will has developed over years solitude two develop bond beyond friendship yes there is girl but this is not romantic movie there is more life then what we are taught what we have show it writing is witty brilliant hilarious at times both matt robin williams preform wonderfully both comedic theatrical prospective matts best work since dogma williams best along side dead poets society if your looking typical hollywood movie with hollywood ending then do not bother spending two hours this movie this movie is ahead its time lands easy 10 out 10 this one is keeper my movie library,0.5552083333333333,0.33125000000000004,Positive,"{'Happy': 0.15, 'Angry': 0.04, 'Surprise': 0.35, 'Sad': 0.16, 'Fear': 0.31}"
10.0,"A Sensitive, Remarkable Look at Genius","Matt Damon's Will Hunting couldn't be more complex. He is an utter genius. Unfortunately, he has enough baggage to send him around the world. Will is a brilliant mathematician, smarter than many of the professors at MIT. However, he is depressed and self destructive. He gives up the minute things get hard. He can't relate to others, especially women. After many failures to help him, he hooks up with a man who respects him (but who also fears his insights) played by Robin Williams in one of his finer dramatic roles. He pushes Will and Will pushes back. The interaction between two imperfect, but brilliant, human beings is the core of this movie. Created by Damon and Ben Affleck, this was probably the best movie of the year. Will Hunting is searching for happiness, as are we all, but others have decided what that happiness looks like. He is indeed ""hunting"" for joy in his life. Excellent performances all around.",sensitive remarkable look at genius,matt damons will hunting couldnt be more complex he is utter genius unfortunately he has enough baggage send him around world will is brilliant mathematician smarter than many professors at mit however he is depressed self destructive he gives up minute things get hard he cant relate others especially women after many failures help him he hooks up with man who respects him but who also fears his insights played by robin williams one his finer dramatic roles he pushes will will pushes back interaction between two imperfect but brilliant human beings is core this movie created by damon ben affleck this was probably best movie year will hunting is searching happiness as are we all but others have decided what that happiness looks like he is indeed hunting joy his life excellent performances all around,0.5814393939393938,0.28295454545454546,Positive,"{'Happy': 0.22, 'Angry': 0.03, 'Surprise': 0.28, 'Sad': 0.12, 'Fear': 0.34}"
,exceptional,"A film growing up in yourself. It is so simple to say about it be great, admirable, profound touching or remarkable. But ,in obvious manner, it is more than a film. The reasons are many and few from them are only emotions. A beautiful script as the impressive job of two young actors, A magnificent Robin Williams and a seductive end. At the first sigh, a film in which you recognize yourself. But it is more, nuanced, precise and inspired portrait of potential, help, life meaning , love and the most profound truth defining yourself and your world.",exceptional,film growing up yourself it is so simple say about it be great admirable profound touching or remarkable but obvious manner it is more than film reasons are many few them are only emotions beautiful script as impressive job two young actors magnificent robin williams seductive end at first sigh film which you recognize yourself but it is more nuanced precise inspired portrait potential help life meaning love most profound truth defining yourself your world,0.685930735930736,0.39924242424242423,Positive,"{'Happy': 0.42, 'Angry': 0.0, 'Surprise': 0.16, 'Sad': 0.26, 'Fear': 0.16}"
10.0,"""Whatever blows your hair back"" - This movie does it for me!","This is the best movie I have seen since the Godfather. Matt Damon and Ben Affleck make a great team...not only as actors, but more impressively as co-writers. Add Robin Williams in perhaps his best role ever (too close to Good Morning Vietnam for me to make the call), and you have a wonderfully entertaining movie.Ben Affleck is convincing as the best friend to a genius, able to effectively play the joker and the friend who would ""lay down in traffic for you"". Matt Damon's portrayal of that genius realizing that life has something more to offer than batting cages and bars is equally stunning. And Robin Williams certainly leaves nothing to be desired (except maybe a beard trimmer...).The most amazing thing about this movie is the writing. Even if the acting were not terrific, this movie still would have made my top ten list. I was captivated from beginning to end.If you've not seen it, Good Will Hunting is without doubt a ""renter"", and I think after seeing it, it's one you'll want to own to watch again and again.",whatever blows your hair back this movie does it me,this is best movie i have seen since godfather matt damon ben affleck make great team not only as actors but more impressively as co writers add robin williams perhaps his best role ever too close good morning vietnam me make call you have wonderfully entertaining movie ben affleck is convincing as best friend genius able effectively play joker friend who would lay down traffic you matt damons portrayal that genius realizing that life has something more offer than batting cages bars is equally stunning robin williams certainly leaves nothing be desired except maybe beard trimmer most amazing thing about this movie is writing even if acting were not terrific this movie still would have made my top ten list i was captivated beginning end if youve not seen it good will hunting is without doubt renter i think after seeing it its one youll want own watch again again,0.5894126984126984,0.4823492063492062,Positive,"{'Happy': 0.18, 'Angry': 0.03, 'Surprise': 0.47, 'Sad': 0.16, 'Fear': 0.16}"
8.0,Thoughtful Warm Film,"For the longest period of time I never understood the title of this film. Was it about someone on some Diogenes style quest? Or was was it about someone who scowers thrift stores? Well, it has nothing to do with good will or Goodwill, it's about a young man called Will Hunting. He's a(somewhat unrealistic)genius who can solve math problems that baffle the world's greatest minds and knows twice as much on any subject covered in a Harvard class...yet he works as a janitor. A professor at MIT stumbles across and sets him up with a therapist, who tries to counsel Will while drilling to the core of his problems.The film might be centered around Matt Damon, who gives a deep performance, but Robin Williams claims every scene he's in and is the most memorable thing from this film. As you probably know, the picture also features Ben Affleck in a limited role, through which he still makes his talent evident. But while Damon, Affleck and William's may have been good choices Minnie Driver certainly wasn't. Who thought of her for the role or what they saw I'll never know.The backstory behind the script is so well known that I won't bother going over it; all I will add is that Affleck and Damon didn't do to bad a job for a first time and recieved a merited Oscar for it.Good Will Hunting is a thought provoking film and that's why so many enjoy it. It's a film that actually tried to be more than cheap entertainment and it succeeded.",thoughtful warm film,longest period time i never understood title this film was it about someone some diogenes style quest or was was it about someone who scowers thrift stores well it has nothing do with good will or goodwill its about young man called will hunting hes somewhat unrealistic genius who can solve math problems that baffle worlds greatest minds knows twice as much any subject covered harvard class yet he works as janitor professor at mit stumbles across sets him up with therapist who tries counsel will while drilling core his problems film might be centered around matt damon who gives deep performance but robin williams claims every scene hes is most memorable thing this film as you probably know picture also features ben affleck limited role through which he still makes his talent evident but while damon affleck williams may have been good choices minnie driver certainly wasnt who thought her role or what they saw ill never know backstory behind script is so well known that i wont bother going over it all i will add is that affleck damon didnt do bad job first time recieved merited oscar it good will hunting is thought provoking film thats why so many enjoy it its film that actually tried be more than cheap entertainment it succeeded,0.5422161172161172,0.21062271062271065,Positive,"{'Happy': 0.13, 'Angry': 0.08, 'Surprise': 0.33, 'Sad': 0.13, 'Fear': 0.33}"
9.0,terrific characters,"Will Hunting (Matt Damon) and Chuckie Sullivan (Ben Affleck) are best friends and ruffians from south Boston. MIT Prof. Gerald Lambeau (Stellan Skarsgård) always puts a challenging problem outside his class for his students. Will is on parole, given a janitorial job and solves the problem. Lambeau is surprised that nobody claims the solution and puts another problem up. He catches the janitor doing the solution and helps him in his trial for hitting a cop. Will is a mess. He's an orphan who suffered as a foster child. He meets Skylar (Minnie Driver) but can't quite open up to her until he starts seeing Dr. Sean Maguire (Robin Williams). Maguire is Lambeau's last resort. They were college roommates and he is suffering from the lost of his wife.These are great characters. The first meeting between Will and Dr. Maguire is electric. It is a couple of powerful performances. Will gets a twinkle in his eye when he finds Maguire's weak spot. Gus Van Sant does a good job mostly getting the great performances. Will has four relationships in this movie. Each one is fascinating and each one is given great material.",terrific characters,will hunting matt damon chuckie sullivan ben affleck are best friends ruffians south boston mit prof gerald lambeau stellan skarsg rd always puts challenging problem outside his class his students will is parole given janitorial job solves problem lambeau is surprised that nobody claims solution puts another problem up he catches janitor doing solution helps him his trial hitting cop will is mess hes orphan who suffered as foster child he meets skylar minnie driver but cant quite open up her until he starts seeing dr sean maguire robin williams maguire is lambeaus last resort they were college roommates he is suffering lost his wife these are great characters first meeting between will dr maguire is electric it is couple powerful performances will gets twinkle his eye when he finds maguires weak spot gus van sant does good job mostly getting great performances will has four relationships this movie each one is fascinating each one is given great material,0.5970588235294116,0.34705882352941175,Positive,"{'Happy': 0.13, 'Angry': 0.05, 'Surprise': 0.24, 'Sad': 0.16, 'Fear': 0.42}"
8.0,GOOD WILL,"In the film, Will is afraid that his girlfriend Will see his family situation and say to his beloved, ""I don't love you. "" To protect ourselves, we hurt the people closest to us, and to disguise ourselves, what can't we do? But it all started with something that wasn't my fault. We may not have the same luck as Will, meeting someone who can help us face our fears and move on. At this time should learn to distinguish which is the inherent weakness, which is acquired shortcomings, and then throw away the former caused by the psychological burden, easy to go, change their can change, become their spiritual catcher. To quote a line from the Film Three Idiots: ""the heart is fragile. You have to Cajole it. """,good will,film will is afraid that his girlfriend will see his family situation say his beloved i dont love you protect ourselves we hurt people closest us disguise ourselves what cant we do but it all started with something that wasnt my fault we may not have same luck as will meeting someone who can help us face our fears move at this time should learn distinguish which is inherent weakness which is acquired shortcomings then throw away former caused by psychological burden easy go change their can change become their spiritual catcher quote line film three idiots heart is fragile you have cajole it,0.5083333333333333,0.08484848484848483,Positive,"{'Happy': 0.26, 'Angry': 0.05, 'Surprise': 0.16, 'Sad': 0.26, 'Fear': 0.26}"
