Rating,Review Title,Review,Cleaned Review Title,Cleaned Review,Subjectivity,Polarity,Sentiment,Emotion Scale
10.0,Other mafia films struggle to hit same heights,Trouble with goodfellas is it sets the bar so high for mafia organised crime style movie. Outside of godfather and scarface this is the holy grail in its genre.,other mafia films struggle hit same heights,trouble with goodfellas is it sets bar so high mafia organised crime style movie outside godfather scarface this is holy grail its genre,0.25799999999999995,-0.033,Negative,"{'Happy': 0.0, 'Angry': 0.2, 'Surprise': 0.0, 'Sad': 0.4, 'Fear': 0.4}"
8.0,A classic mobster film.,"This is one hell of a film about the mobsters, based on a true story and coming from one of the great directors of all time. This is about Henry Hill, the narrator of the story, an Irish simple person who gets involved with the Mafia at a very young age and continues his life through it. There is no major plot in this film, just isolated incidents one of which was the turning point of Hill's life. Scorsese, as brilliant as he ever was, shows violence, sex and drugs etc in his own trademark style. And his actors helps him to make this film one of the classics.Robert DeNiro is not present in much of the film, nor his acting leaves too much impression. The three actors who really did their best job here are Ray Liotta, Joe Pesci and Lorraine Bracco. I hate to say that most youngsters today don't know too much about Liotta or how talented he was. I asked my younger brother about him and he said, ""The man who did the voice on GTA: Vice City?"". This is partly because Liotta did not get too many big roles after that, especially in recent years. But here he is just brilliant as Hill. It's Pesci's one of the best too. Playing a mad mobster with dark sense of humor wasn't his usual type. And Lorraine Bracco becomes the perfect lead female in such type of films.The film's got smart screenplay and excellent cinematography. And I don't know how many times Scorsese will be denied his Academy recognition. I hate to see a lifetime achievement award as his first Oscar. But things are going like that.",classic mobster film,this is one hell film about mobsters based true story coming one great directors all time this is about henry hill narrator story irish simple person who gets involved with mafia at very young age continues his life through it there is no major plot this film just isolated incidents one which was turning point hills life scorsese as brilliant as he ever was shows violence sex drugs etc his own trademark style his actors helps him make this film one classics robert deniro is not present much film nor his acting leaves too much impression three actors who really did their best job here are ray liotta joe pesci lorraine bracco i hate say that most youngsters today dont know too much about liotta or how talented he was i asked my younger brother about him he said man who did voice gta vice city this is partly because liotta did not get too many big roles after that especially recent years but here he is just brilliant as hill its pescis one best too playing mad mobster with dark sense humor wasnt his usual type lorraine bracco becomes perfect lead female such type films films got smart screenplay excellent cinematography i dont know how many times scorsese will be denied his academy recognition i hate see lifetime achievement award as his first oscar but things are going like that,0.48435185185185176,0.24040839947089948,Positive,"{'Happy': 0.1, 'Angry': 0.05, 'Surprise': 0.36, 'Sad': 0.18, 'Fear': 0.31}"
10.0,Scorsese's masterpiece stands the test of time,"Martin Scorsese's unflinching portrayal of life in the mafia is a rightly acclaimed epic, at times funny, depressing but most of all frightening, all the more so because it's based on a true story. Basically it's the story of Ray Liotta's character's rise and fall in the mafia, and the way his relationships change with the various figures there as times come and go.The acting is what makes this film so engaging, and Ray Liotta excels as the bright young man who eventually becomes a drug addict. His transformation is brilliant as he ages thirty years and the acting choice couldn't have been better. Robert De Niro is on hand to deliver some real class to the proceedings too, and he's as good as he ever was as the seemingly nice but deadly Jimmy. However Joe Pesci steals the overacting awards with his portrayal of the foul-mouthed psychotic Tommy, who spends the film shooting and beating those who offend him. Pesci is both funny and frightening as a maniac who doesn't think twice about killing people, and his kinetic performance bursts off the screen in a blaze of fury. The rest of the cast, including Liotta's wife and Paul Sorvino, also put in well-judged and realistic performances.While some people may be put off by the long running length, this is engrossing viewing, as the film charts the various gruesome demises of unfortunate characters (the opening body in the boot being a standout in sheer brutality), Liotta's growing paranoia (the helicopter scenes are memorable) and eventual capture, and the characters' changing loyalties. GOODFELLAS was really the final word about gangster life, at least until CASINO came along.",scorseses masterpiece stands test time,martin scorseses unflinching portrayal life mafia is rightly acclaimed epic at times funny depressing but most all frightening all more so because its based true story basically its story ray liottas characters rise fall mafia way his relationships change with various figures there as times come go acting is what makes this film so engaging ray liotta excels as bright young man who eventually becomes drug addict his transformation is brilliant as he ages thirty years acting choice couldnt have been better robert de niro is hand deliver some real class proceedings too hes as good as he ever was as seemingly nice but deadly jimmy however joe pesci steals overacting awards with his portrayal foul mouthed psychotic tommy who spends film shooting beating those who offend him pesci is both funny frightening as maniac who doesnt think twice about killing people his kinetic performance bursts off screen blaze fury rest cast including liottas wife paul sorvino also put well judged realistic performances while some people may be put off by long running length this is engrossing viewing as film charts various gruesome demises unfortunate characters opening body boot being standout sheer brutality liottas growing paranoia helicopter scenes are memorable eventual capture characters changing loyalties goodfellas was really final word about gangster life at least until casino came along,0.6596681096681096,0.10461760461760462,Positive,"{'Happy': 0.12, 'Angry': 0.08, 'Surprise': 0.29, 'Sad': 0.15, 'Fear': 0.37}"
6.0,As good as those fellas are...I just don't get it,"I have nothing against gangster films and I love Deniro, and Liotta and Pesci...in moderation...The Godfather were brilliant films and I finally made my way around to seeing the infamously talked about 'Goodfellas.' I don't get it. I'll take the heat from any fans and I know there are scores of them...Goodfellas was average at best and simply a trashy look at a mobster from childhood to his end in the mob with some decent but over the top performance, brutally gratuitous language and violence. I suppose in some circles that equivalents to a great film but I need far more. I mean even the story has little depth to it and it's more or less an extended episode of The Sopranos without the character depth. I suppose after having the film hyped for years and hearing about the 'classic' I had high expectations but for me it was run of the mill, annoyingly loud and abrasive but with some good direction. Scorsese knows how to make an epic from beginning to end starting the film in the 50's and 60's and taking it all the way to the mid 80's is a challenge and he does it flawlessly. The gritty underworld, the dark lighting, the facial expressions all very good but put to a pointless story and sub par characters unfortunately.I finally know now why Ray Liotta is still around and still gets parts because I always found him a little obnoxious in roles and I never realized he single handedly headlined Goodfellas and is great at it. His character might be the only one in the film given any depth considering he is the narrator and focus of the film. Disgustingly Liotta got no nomination that year which is absurd because if this film deserved anything (which I don't think it did) Liotta's role was it. Robert Deniro commonly gets credit for the film as being the headliner which is also a bit absurd. He might be the big name for the film but his role was small. He didn't make a significant part in the film until a good hour into it and his role was small but he still certainly brought his Deniro class and style to the ensemble. I think they would have done better to focus more on his character and his relationship with Liotta's character. They had good chemistry but just when you wanted to see more...they moved on to something else. Joe Pesci was over the top insane, downright disturbed Tommy Devito. His performance in this film is legendary ""Oh you think I'm a clown?"" but to be perfectly honest he was ridiculous. His performance wasn't sincere or believable and he was downright annoying. He was loud and abrasive and his barrage of gratuitous language actually made the film less watchable and I am not against the use of four letter words in film but his was too much. Lorraine Bracco was quite good in her pre-Soprano role as Liotta's wife Karen who sticks with him through pretty much everything and has some powerfully emotional swings throughout the film. Paul Sorvino is good as the head of the mob family, Paulie, but he doesn't make an impact. You don't really believe anyone would respect him. He's quiet and laid back and basically hiding throughout most of the film. At least with Brando's Godfather he was an image, an icon, something you just were in awe of. The cast all work well together but their characters are so thinly written you just don't give a damn about a single one of them except maybe a little for Liotta's Jimmy Conway.I get that I'm in a severe minority speaking this way about this film and that director Martin Scorsese is like a god to some but I just didn't seem the talent in this film. Scorsese showed talent in The Departed and the cast was a million times better than Goodfellas and deserved all of it's acclaim but I personally think Goodfellas is more of a non-thinking man's mob movie where bloody brutal kills and 1000 times hearing the 'F' word would prompt a dull chuckle as though the audience were 10. No I am not trying to insult anyone I was just severely disappointed by this film after having expected a brilliant classic which I will say hands down is not the case. I suppose if you like the crime genre or moreso the gangster drama than you must see Goodfellas anyways but I can promise you there is FAR better out there than this average, poorly written film. 6/10",as good as those fellas are i just dont get it,i have nothing against gangster films i love deniro liotta pesci moderation godfather were brilliant films i finally made my way around seeing infamously talked about goodfellas i dont get it ill take heat any fans i know there are scores them goodfellas was average at best simply trashy look at mobster childhood his end mob with some decent but over top performance brutally gratuitous language violence i suppose some circles that equivalents great film but i need far more i mean even story has little depth it its more or less extended episode sopranos without character depth i suppose after having film hyped years hearing about classic i had high expectations but me it was run mill annoyingly loud abrasive but with some good direction scorsese knows how make epic beginning end starting film 50s 60s taking it all way mid 80s is challenge he does it flawlessly gritty underworld dark lighting facial expressions all very good but put pointless story sub par characters unfortunately i finally know now why ray liotta is still around still gets parts because i always found him little obnoxious roles i never realized he single handedly headlined goodfellas is great at it his character might be only one film given any depth considering he is narrator focus film disgustingly liotta got no nomination that year which is absurd because if this film deserved anything which i dont think it did liottas role was it robert deniro commonly gets credit film as being headliner which is also bit absurd he might be big name film but his role was small he didnt make significant part film until good hour into it his role was small but he still certainly brought his deniro class style ensemble i think they would have done better focus more his character his relationship with liottas character they had good chemistry but just when you wanted see more they moved something else joe pesci was over top insane downright disturbed tommy devito his performance this film is legendary oh you think im clown but be perfectly honest he was ridiculous his performance wasnt sincere or believable he was downright annoying he was loud abrasive his barrage gratuitous language actually made film less watchable i am not against use four letter words film but his was too much lorraine bracco was quite good her pre soprano role as liottas wife karen who sticks with him through pretty much everything has some powerfully emotional swings throughout film paul sorvino is good as head mob family paulie but he doesnt make impact you dont really believe anyone would respect him hes quiet laid back basically hiding throughout most film at least with brandos godfather he was image icon something you just were awe cast all work well together but their characters are so thinly written you just dont give damn about single one them except maybe little liottas jimmy conway i get that im severe minority speaking this way about this film that director martin scorsese is like god some but i just didnt seem talent this film scorsese showed talent departed cast was million times better than goodfellas deserved all its acclaim but i personally think goodfellas is more non thinking mans mob movie where bloody brutal kills 1000 times hearing f word would prompt dull chuckle as though audience were 10 no i am not trying insult anyone i was just severely disappointed by this film after having expected brilliant classic which i will say hands down is not case i suppose if you like crime genre or moreso gangster drama than you must see goodfellas anyways but i can promise you there is far better out there than this average poorly written film 6 10,0.576504011861155,0.0840938426652712,Positive,"{'Happy': 0.14, 'Angry': 0.11, 'Surprise': 0.24, 'Sad': 0.2, 'Fear': 0.3}"
,Italian Storytelling,"Spoilers herein.Competent filmmakers are rare -- there is no doubt that Scorsese is competent and should be celebrated on that score alone.But his films are empty. They take you into a gangsterland (even `Temptation,' even `Innocence') and snap along until they end and then you leave. But you leave with nothing, and I expect more from a competent filmmaker.The problem -- I speculate -- is the degree to which Scorsese is locked in the Italian tradition of storytelling and its 60's incarnation in neo-realistic films. This is a matter of performance, where the force of the story is all in the force of the storyteller. The performer here is Scorsese. His screen persona is epitomized in the Pesci character: driving, driving the group by pressing on. By speaking over others. By showing the threat of violence.There's power here. It grabs your attention like Pesci grabs that of the fellas. I can see Scorsese constantly saying to himself that he'd be nuts to live any other way. But aside from some storytelling mechanics, there are no ideas here, no ambiguities, no interesting characters, no plot maturity, no symmetries, nothing to wonder about and discuss on your way home.But we should salute some of the decisions. Scorsese chooses to frame the film as a story told by the Liotta character. (He plays an Irishman, but looks and acts Italian.) Narrative voiceovers. A clever framing device with us locked in the car at midway through and mirrored in the beginning. The end with Liotta looking directly and speaking into the camera and shooting us.And the camera. Much has been said of the camera. The long, tracking shots, especially the much-copied entrance through the kitchen. The pullback-zoom toward the end when Liotta and DeNiro meet. The occasional corner ceiling shot. Normally I would love this, especially since it is in the framework of a consistent notion of the eye. What bothers me is what that eye is: it is dependent on the characters. The characters drive this movie and pull the camera. Consider the kitchen entry scene: the camera is on a string behind Liotta. We follow, always follow, just as the fellas at Pesci's table have to follow his prattling. Compare that to dePalma's similar long tracking shot of Bruce Willis at the start of `Bonfire of the Vanities.' DePalma's camera isn't dragged along behind by the force of Willis. It floats to the front, the side, swooping around, independently curious. We the viewers are masters of the story. It's the difference between the northern and southern European storytelling traditions.Seeing how little deference the camera gives us really grates when the payoff is so slight. It makes DeNiro pretty hard to take. Yes, we all get impressed by the power of his performance. But it is always clear that it is a performance: we are not seeing a character but a `serious actor,' employed as a tractor to pull us along.Is this a great film? Well, it did not change my life, give my dreams new form, or provide the basis for any meaningful discussion with my wife. It didn't help me define myself or my world. It provided no new perspectives on the things I struggle with. (And many, many films do one or more of these things.) So for me no.What a waste.",italian storytelling,spoilers herein competent filmmakers are rare there is no doubt that scorsese is competent should be celebrated that score alone but his films are empty they take you into gangsterland even temptation even innocence snap along until they end then you leave but you leave with nothing i expect more competent filmmaker problem i speculate is degree which scorsese is locked italian tradition storytelling its 60s incarnation neo realistic films this is matter performance where force story is all force storyteller performer here is scorsese his screen persona is epitomized pesci character driving driving group by pressing by speaking over others by showing threat violence theres power here it grabs your attention like pesci grabs that fellas i can see scorsese constantly saying himself that hed be nuts live any other way but aside some storytelling mechanics there are no ideas here no ambiguities no interesting characters no plot maturity no symmetries nothing wonder about discuss your way home but we should salute some decisions scorsese chooses frame film as story told by liotta character he plays irishman but looks acts italian narrative voiceovers clever framing device with us locked car at midway through mirrored beginning end with liotta looking directly speaking into camera shooting us camera much has been said camera long tracking shots especially much copied entrance through kitchen pullback zoom toward end when liotta deniro meet occasional corner ceiling shot normally i would love this especially since it is framework consistent notion eye what bothers me is what that eye is it is dependent characters characters drive this movie pull camera consider kitchen entry scene camera is string behind liotta we follow always follow just as fellas at pescis table have follow his prattling compare that depalmas similar long tracking shot bruce willis at start bonfire vanities depalmas camera isnt dragged along behind by force willis it floats front side swooping around independently curious we viewers are masters story its difference between northern southern european storytelling traditions seeing how little deference camera gives us really grates when payoff is so slight it makes deniro pretty hard take yes we all get impressed by power his performance but it is always clear that it is performance we are not seeing character but serious actor employed as tractor pull us along is this great film well it did not change my life give my dreams new form or provide basis any meaningful discussion with my wife it didnt help me define myself or my world it provided no new perspectives things i struggle with many many films do one or more these things so me no what waste,0.4764046717171717,0.13507733585858586,Positive,"{'Happy': 0.1, 'Angry': 0.08, 'Surprise': 0.15, 'Sad': 0.18, 'Fear': 0.48}"
