Rating,Review Title,Review,Cleaned Review Title,Cleaned Review,Subjectivity,Polarity,Sentiment,Emotion Scale
,One of the finest films ever made.,"Occasionally there's a film that literally changes one's perceptions of the world. 'Grave of the Fireflies' is one of those films. No movie ever made generates such an intense and powerful emotional response as this one.It's an animated film set in Japan during the closing days of World War II. Two children; a boy named Seita and his much younger sister Setsuko; must quickly learn to cope with life after their mother is killed during a fire-bombing raid by American B-29's. The film starts with the children and their mother preparing for the attack, then follows the children as they attempt to survive the death of their mother, and the possible death of their father, a naval officer serving aboard the Japanese heavy cruiser 'Maya.' (A US submarine torpedoed the 'Maya' in late October of 1944 during the battle of Leyte Gulf.)The story of two orphans trying to survive in war-ravaged Japan is not the subject of your typical light-hearted animated film. In fact it may be much too serious for anyone under the age of 14. The first five minutes of the film hits one like a sledgehammer - by far the most emotional opening scene I've ever come across. I found myself already reaching for the tissues, and trying to choke back the tears.Yet there's more than just tragedy in 'Grave of the Fireflies.' It is the most awesome love story one is ever likely to see. But it's far from the typical Hollywood idea of a love story. Instead of the usual highly attractive Hollywood actors of the opposite sex pining for one another in front of the camera, we have an animated Japanese brother and his much younger little sister. It's not a tale of romantic love, but one of 'brotherly' love.Seita loves his little sister, and once he discovers that his mother has been killed in the bombing, he does everything he can to keep his sister from finding out about her horrible death. Then, with typical Japanese seriousness, he begins to immediately provide for and comfort Setsuko; she being the only member of his immediate family he has left. Though not stated in the film, it seems obvious that part of Seita's motivation for looking so carefully after his sister has to do with avoiding his own pain and despair having been left with NOTHING after the bombing attack. No mother, no father, no home. The war Japan is waging against the rest of the world takes its toll on these two little ones, without regard for their feelings or emotions.That which truly broke my heart into ten thousand tiny pieces was the selfless way Seita looked after his younger sister, and shielded her from the horrors all around, especially the lack of food. Films show us many things, some good, some evil, but rarely has any film shown how one person so unselfishly puts another ahead of them self. Seita does makes some mistakes in the way he goes about taking care of his sister, but I can't fault him for his love and his devotion. Who of us have always chosen the best path, the most perfect way of doing things? Surely not I! Seita's obvious love and devotion to Setsuko is the most moving and convicting thing I've ever come across on film.I use the word 'convicting' because this movie convicted me of my own very selfish nature. 'Grave of the Fireflies' caused me sadness not just because of Seita's brave attempts to take care of his little sister; but because he gave of himself so totally and completely, even though his sister was a liability to his own survival. I could not help to be convicted concerning all the many times there have been family and friends who have needed my help or understanding, but I ignored them in favor of 'doing my own thing.' How sad I am for all those times I've ignored the suffering of others and their cries for help. This film showed the evil in my own heart - something that I would not have noticed on my own. But now that the blinders have been removed, I can repent of my selfishness, and look for ways to help others, instead of avoiding them.Some Japanese anime I've seen are very much anti-American. But even though it's the Americans dropping the bombs in this film, there is no overt anti-American message. In many ways, the Japanese civilians are shown in as bad a light as is the American air and naval forces! Their hard hearts and stubborn ways are displayed on the screen without apology; and one can see how the plight of the two children is made even worst by the selfishness of the adults that they have come to rely upon.It would be easy for someone from 'the West' (i.e. The USA, Canada, Western Europe, Australia, etc.) to think that the two children depicted in this animated marvel were the exception, rather than the rule. They lived in very trying times, and surely children in this day and age do not have to go through experiences similar to Seita's and Setsuko's. Unfortunately, that's not the case. There are still major problems with orphans and unwanted children in the former communist block countries of Eastern Europe and Russia itself. There are also large numbers of unwanted children roaming the streets of China, India, Mongolia, and various other Asian nations. We may not here about it on the news, or hear our friends talk about it; but I assure you that there are literally millions of children around the world whose situation is no better, if not much worst than that of Seita and Setsuko.I am very thankful I had the honor of watching this film. I'm also very thankful for the people who put it together. But most of all, I'm very thankful for the positive impact it has had on my life.",one finest films ever made,occasionally theres film that literally changes ones perceptions world grave fireflies is one those films no movie ever made generates such intense powerful emotional response as this one its animated film set japan during closing days world war ii two children boy named seita his much younger sister setsuko must quickly learn cope with life after their mother is killed during fire bombing raid by american b 29s film starts with children their mother preparing attack then follows children as they attempt survive death their mother possible death their father naval officer serving aboard japanese heavy cruiser maya us submarine torpedoed maya late october 1944 during battle leyte gulf story two orphans trying survive war ravaged japan is not subject your typical light hearted animated film fact it may be much too serious anyone under age 14 first five minutes film hits one like sledgehammer by far most emotional opening scene ive ever come across i found myself already reaching tissues trying choke back tears yet theres more than just tragedy grave fireflies it is most awesome love story one is ever likely see but its far typical hollywood idea love story instead usual highly attractive hollywood actors opposite sex pining one another front camera we have animated japanese brother his much younger little sister its not tale romantic love but one brotherly love seita loves his little sister once he discovers that his mother has been killed bombing he does everything he can keep his sister finding out about her horrible death then with typical japanese seriousness he begins immediately provide comfort setsuko she being only member his immediate family he has left though not stated film it seems obvious that part seitas motivation looking so carefully after his sister has do with avoiding his own pain despair having been left with nothing after bombing attack no mother no father no home war japan is waging against rest world takes its toll these two little ones without regard their feelings or emotions that which truly broke my heart into ten thousand tiny pieces was selfless way seita looked after his younger sister shielded her horrors all around especially lack food films show us many things some good some evil but rarely has any film shown how one person so unselfishly puts another ahead them self seita does makes some mistakes way he goes about taking care his sister but i cant fault him his love his devotion who us have always chosen best path most perfect way doing things surely not i seitas obvious love devotion setsuko is most moving convicting thing ive ever come across film i use word convicting because this movie convicted me my own very selfish nature grave fireflies caused me sadness not just because seitas brave attempts take care his little sister but because he gave himself so totally completely even though his sister was liability his own survival i could not help be convicted concerning all many times there have been family friends who have needed my help or understanding but i ignored them favor doing my own thing how sad i am all those times ive ignored suffering others their cries help this film showed evil my own heart something that i would not have noticed my own but now that blinders have been removed i can repent my selfishness look ways help others instead avoiding them some japanese anime ive seen are very much anti american but even though its americans dropping bombs this film there is no overt anti american message many ways japanese civilians are shown as bad light as is american air naval forces their hard hearts stubborn ways are displayed screen without apology one can see how plight two children is made even worst by selfishness adults that they have come rely upon it would be easy someone west i e usa canada western europe australia etc think that two children depicted this animated marvel were exception rather than rule they lived very trying times surely children this day age do not have go through experiences similar seitas setsukos unfortunately thats not case there are still major problems with orphans unwanted children former communist block countries eastern europe russia itself there are also large numbers unwanted children roaming streets china india mongolia various other asian nations we may not here about it news or hear our friends talk about it but i assure you that there are literally millions children around world whose situation is no better if not much worst than that seita setsuko i am very thankful i had honor watching this film im also very thankful people who put it together but most all im very thankful positive impact it has had my life,0.5276073068345795,0.10967325855962214,Positive,"{'Happy': 0.17, 'Angry': 0.04, 'Surprise': 0.24, 'Sad': 0.29, 'Fear': 0.26}"
10.0,Soul Breaking,"This is a film about the sad reality of war. When war is waged, we often think of it as this army against that army. Lost in the mix are the civilians who die horrible deaths--not just from the weapons of war but from disease and starvation. We give great power to the power structure that makes the decision to wage conflict. Often their words sound good and we embrace those words. This film shows what happens to a small, seemingly insignificant pair of children, trying to get a roof over their heads and have a bit to eat. Their mother has been killed in a fire bombing and their father is in the Japanese navy. It shows the efforts to maintain dignity and the cruelty of those who could help but don't. Japan paid a huge price for trying to expand the Empire. The leadership convinced the populace that they were driven by a higher power that wanted them to crush their enemies at whatever cost. But here we see the price. Fire bombings, air raids, and, of course, eventually Hiroshima and Nagasaki. This is the saddest of stories, shown in spotless animation. It is a story of hope and hopelessness. Outstanding.",soul breaking,this is film about sad reality war when war is waged we often think it as this army against that army lost mix are civilians who die horrible deaths not just weapons war but disease starvation we give great power power structure that makes decision wage conflict often their words sound good we embrace those words this film shows what happens small seemingly insignificant pair children trying get roof over their heads have bit eat their mother has been killed fire bombing their father is japanese navy it shows efforts maintain dignity cruelty those who could help but dont japan paid huge price trying expand empire leadership convinced populace that they were driven by higher power that wanted them crush their enemies at whatever cost but here we see price fire bombings air raids course eventually hiroshima nagasaki this is saddest stories shown spotless animation it is story hope hopelessness outstanding,0.5840909090909091,0.1,Positive,"{'Happy': 0.09, 'Angry': 0.15, 'Surprise': 0.21, 'Sad': 0.24, 'Fear': 0.32}"
8.0,A magnificent piece of work and one of the most heartbreaking tales ever told,"Animation is often seen as a childish medium, and for good reason as kid's films often are animated. However, every now and then an animated film comes along that extends it's boundaries and manages to deliver a very adult story, and Grave of the Fireflies is one of those films. Through it's well observed and very real characters, Grave of the Fireflies portrays a story of loss, heartbreak and the effect of war on civilians in a manner that is more effective and more firmly based in reality than many live action films about the same subject are. We follow Seita and Setsuko, a brother and sister that have lost their parents in the war and are now forced to fend for themselves in the war torn country. How the two go about doing that and the boy's development from a child to a (somewhat) responsible adult due to the change in the surroundings makes up the spine of the movie.I'm not a big fan of animation, but there are some films that are so great that a person's personal preferences are irrelevant, and this is one of those films. The animation is beautiful and certain scenes, including the air raids and anything with the fireflies are amazing works of art. The way the music blends with the images on screen is haunting and beautiful, and helps add to the tragedy of the story. Because we are able to care for the characters, the tragedy is increased ten fold and the story on the whole is a sad one, but few movies have ever matched up to this film's ending in terms of pure despair. The conclusion is absolutely gut wrenching to an extent that few movies have ever matched, let alone animated pictures. The fact that it's so plain and blatant, with no attempt to console the audience takes the tragedy to a whole new level and I don't doubt that many audience members will be holding back tears upon the film's conclusion.This film is a must see.",magnificent piece work one most heartbreaking tales ever told,animation is often seen as childish medium good reason as kids films often are animated however every now then animated film comes along that extends its boundaries manages deliver very adult story grave fireflies is one those films through its well observed very real characters grave fireflies portrays story loss heartbreak effect war civilians manner that is more effective more firmly based reality than many live action films about same subject are we follow seita setsuko brother sister that have lost their parents war are now forced fend themselves war torn country how two go about doing that boys development child somewhat responsible adult due change surroundings makes up spine movie im not big fan animation but there are some films that are so great that persons personal preferences are irrelevant this is one those films animation is beautiful certain scenes including air raids anything with fireflies are amazing works art way music blends with images screen is haunting beautiful helps add tragedy story because we are able care characters tragedy is increased ten fold story whole is sad one but few movies have ever matched up this films ending terms pure despair conclusion is absolutely gut wrenching extent that few movies have ever matched let alone animated pictures fact that its so plain blatant with no attempt console audience takes tragedy whole new level i dont doubt that many audience members will be holding back tears upon films conclusion this film is must see,0.4956451272304931,0.1801303980572273,Positive,"{'Happy': 0.14, 'Angry': 0.0, 'Surprise': 0.21, 'Sad': 0.29, 'Fear': 0.36}"
9.0,"Depressing, but a must see","One of the great animated films of all time Grave of Fireflies tells the story of a couple of kids as the try to survive in war time Japan. What happens to them should be seen by anyone thinking of starting a war since it tells very graphically what happens to those often forgotten, the children.Like its companion piece, Barefoot Gen, which tells the story of survivors of atomic bombing and the horrors that were experienced by those unlucky enough not to have been killed out right, this film proves that war is hell for everyone, especially the children.Its very hard to send anyone out to see this unhappy little film (The previously mentioned Barefoot Gen spawned sequels, this has not) but at the same time you owe it to yourself to experience, however distantly what sort of monster we unleash upon the world every time we go to war. It helps that however depressing this is, its also a damn good and incredibly compelling story.9 out of 10",depressing but must see,one great animated films all time grave fireflies tells story couple kids as try survive war time japan what happens them should be seen by anyone thinking starting war since it tells very graphically what happens those often forgotten children like its companion piece barefoot gen which tells story survivors atomic bombing horrors that were experienced by those unlucky enough not have been killed out right this film proves that war is hell everyone especially children its very hard send anyone out see this unhappy little film previously mentioned barefoot gen spawned sequels this has not but at same time you owe it yourself experience however distantly what sort monster we unleash upon world every time we go war it helps that however depressing this is its also damn good incredibly compelling story 9 out 10,0.5174498746867168,0.029072681704260677,Positive,"{'Happy': 0.12, 'Angry': 0.08, 'Surprise': 0.25, 'Sad': 0.38, 'Fear': 0.17}"
10.0,The best movie you'll never want to see again,"I had the fortune of being able to see Hotaru no Haka on the big-screen in Seattle a couple of years ago. It was truly the high-point of my film festival excursions. At the end of the movie, there was silence, absolute and total silence in the theater - and then, only an occasional sniffle until the end credits had finished rolling and the house lights came up. It would've seemed almost disrespectful to profane the silence with words.Seeing a movie like this really changes attitudes about war - about who really suffers, and that the honor and glory is shallow comfort when you contemplate what has been lost in the struggle.I've made the comment to my friends that if you ever see someone who isn't moved (usually to tears) by this movie, you've found someone without a soul. As difficult as it is to watch, turn off the phone, dim the lights, and immerse yourself in the film with ones you love - you will be a better person for it in the end.There are many other reviews of this movie, and most of them are probably far more comprehensive than my own - I'll conclude by saying that this movie should required viewing at some point (as should the peace museums at Hiroshima and Nagasaki) for everyone.When you see war and conflict in the news or read about it in the paper, think back to this movie - your perspective will probably be broadened, and your eyes opened a bit more.I've only watched this movie about 4 times - it usually takes a year or so to ""decompress"" after watching it. To see it too often would lessen the impact, and that would be the worst possible thing to do to this movie.",best movie youll never want see again,i had fortune being able see hotaru no haka big screen seattle couple years ago it was truly high point my film festival excursions at end movie there was silence absolute total silence theater then only occasional sniffle until end credits had finished rolling house lights came up it wouldve seemed almost disrespectful profane silence with words seeing movie like this really changes attitudes about war about who really suffers that honor glory is shallow comfort when you contemplate what has been lost struggle ive made comment my friends that if you ever see someone who isnt moved usually tears by this movie youve found someone without soul as difficult as it is watch turn off phone dim lights immerse yourself film with ones you love you will be better person it end there are many other reviews this movie most them are probably far more comprehensive than my own ill conclude by saying that this movie should required viewing at some point as should peace museums at hiroshima nagasaki everyone when you see war conflict news or read about it paper think back this movie your perspective will probably be broadened your eyes opened bit more ive only watched this movie about 4 times it usually takes year or so decompress after watching it see it too often would lessen impact that would be worst possible thing do this movie,0.5936206896551725,0.07936781609195402,Positive,"{'Happy': 0.07, 'Angry': 0.04, 'Surprise': 0.47, 'Sad': 0.16, 'Fear': 0.27}"
10.0,Utterly devastating,"It's better not to learn too much about this film before watching it, for fear of spoiling it. I'd heard it described as the saddest film of all time, but even that didn't prepare me for what I saw.Speaking from the point of view of somebody who avoids animation as much as possible, I found this to be a piece of exceptional film-making. Use as many superlatives as you like: amazing, engrossing, compelling, outstanding, it all boils down to one important thing - this film tells a story that grips us with its exploration of the human condition. I imagine virtually everybody who watches it will be able to identify with it in some way or other.So forget this one's a cartoon and just go into it expecting a tale packed with emotion and feeling. And if you have to go back and watch the beginning again after you've seen it all the way through, that's fine too.",utterly devastating,its better not learn too much about this film before watching it fear spoiling it id heard it described as saddest film all time but even that didnt prepare me what i saw speaking point view somebody who avoids animation as much as possible i found this be piece exceptional film making use as many superlatives as you like amazing engrossing compelling outstanding it all boils down one important thing this film tells story that grips us with its exploration human condition i imagine virtually everybody who watches it will be able identify with it some way or other so forget this ones cartoon just go into it expecting tale packed with emotion feeling if you have go back watch beginning again after youve seen it all way through thats fine too,0.5978758169934641,0.2295751633986928,Positive,"{'Happy': 0.22, 'Angry': 0.09, 'Surprise': 0.35, 'Sad': 0.26, 'Fear': 0.09}"
8.0,Greatest War Film?,"A tragic film covering a young boy and his little sister's struggle to survive in Japan during World War II.Apparently people, including Roger Ebert, consider this one of the greatest -- or perhaps the greatest -- war film ever made. Now, that is interesting because it is a cartoon. You never expect that, and this might not be something you want to show kids. It is pretty bold, with wounded people, maggots, and anyone can die.Even more interesting is how it takes place from the point of view of a Japanese youth during World War II. He is not nationalistic, he is not anti-American, he is just a kid. And is that not the truth of war? No matter who is right or wrong, millions of kids become the victims.",greatest war film,tragic film covering young boy his little sisters struggle survive japan during world war ii apparently people including roger ebert consider this one greatest or perhaps greatest war film ever made now that is interesting because it is cartoon you never expect that this might not be something you want show kids it is pretty bold with wounded people maggots anyone can die even more interesting is how it takes place point view japanese youth during world war ii he is not nationalistic he is not anti american he is just kid is that not truth war no matter who is right or wrong millions kids become victims,0.6001488095238097,0.2550967261904762,Positive,"{'Happy': 0.37, 'Angry': 0.05, 'Surprise': 0.16, 'Sad': 0.16, 'Fear': 0.26}"
