Rating,Review Title,Review,Cleaned Review Title,Cleaned Review,Subjectivity,Polarity,Sentiment,Emotion Scale
10.0,Brutally honest and heartbreaking,"Being my first Anime review I thought I'd start off with my one of my favourite pieces of work from who else but Studio Ghibli. Ghibli have rarely produced anime that doesn't fall short of great but Graveyard is something different indeed.Set in the aftermath of World War II, Graveyard is focused on the lives of a caring brother and his young sister (Setsuko and Seita) and how they struggle against both the elements of wartime and a depreciating Japanese empire. The most striking thing about Graveyard is probably how real everything seems. The animation is very unconventional to the likes of say Spirited Away or Laputa but in a good way. The horror of war is beautifully realised through the animation, whether it be the American destruction being shown or the bleak outlook on peoples lives, namely the two main characters. Thankfully it earns every shred of emotion it conveys through these two sympathetic characters that only the coldest of hearts wouldn't warm up to. Avoiding any Hollywood sentimentality, it is often a bleak and depressing perspective depicted but all the more brutally powerful in the process. With my eyes welling up through the duration of the film, it occured to me just how well the Director understands what raw heartfelt emotion is and how to play the audiences heart strings. Nevertheless nothing is shown in a heavy handed approach, no empthasis is put on the Americans nor is there any special attention taken to the war details. If anything the citizens of Japan are shown in the coldest light often giving little help to the plight of others, but demonstrating furthermore what desperate situation everyone is in.Takahata instead decides to focus on the plight of it's title characters against the background of war. With the empire of Japan in crisis and food shortages everywhere it is heart breaking to see a brother struggle to meet ends meet for his sister. Due to the approach taken it borders on being horrifying but fortunately the tone is changed with the spirit put into Setsuko's character. Much like 'The Pianist' the issue is not the war but the struggle and will to survive in it. This is clearly displayed in a plot that revolves around the downward spiral Setsuko trying to feed himself and more importantly the younger and more vulnerable sister Seita. The animation though detailed and indeed beautiful in some sequences (namely relating to the title), is not by any means flashy but captures emotions and interactions between the characters perfectly. It's the perfect mixture of such animation, realistic and highly likeable characters that makes the whole film one tearful experience. Dealing with such difficult issues it's very hard to imagine this being a film and if it was I don't think it would of been done as well.Part of the brilliance also comes from symbology and the association to many different worlds in such a understanding depiction. The child, Seita, is nothing short of perfection in child like behaviour happily oblivious to the desperate situation, amusing herself with simplicity and the quirks of nature and the outdoors. The older brother Setsuko who must carry the burdon of everything is also perfectly portrayed and to watch there decent is painful to say the least. To struggle is one thing but to have shock, shattered dreams and be depended on is something anyone can empthasise with. There may be some people who will shy away from Anime, disregarding it as a mere cartoon. To those people and everyone else I recommend Graveyard as the tonic, which can be appreciated by anyone with a heart and soul. Among the finest pieces of Anime created and one of the most touching war films ever made.",brutally honest heartbreaking,being my first anime review i thought id start off with my one my favourite pieces work who else but studio ghibli ghibli have rarely produced anime that doesnt fall short great but graveyard is something different indeed set aftermath world war ii graveyard is focused lives caring brother his young sister setsuko seita how they struggle against both elements wartime depreciating japanese empire most striking thing about graveyard is probably how real everything seems animation is very unconventional likes say spirited away or laputa but good way horror war is beautifully realised through animation whether it be american destruction being shown or bleak outlook peoples lives namely two main characters thankfully it earns every shred emotion it conveys through these two sympathetic characters that only coldest hearts wouldnt warm up avoiding any hollywood sentimentality it is often bleak depressing perspective depicted but all more brutally powerful process with my eyes welling up through duration film it occured me just how well director understands what raw heartfelt emotion is how play audiences heart strings nevertheless nothing is shown heavy handed approach no empthasis is put americans nor is there any special attention taken war details if anything citizens japan are shown coldest light often giving little help plight others but demonstrating furthermore what desperate situation everyone is takahata instead decides focus plight its title characters against background war with empire japan crisis food shortages everywhere it is heart breaking see brother struggle meet ends meet his sister due approach taken it borders being horrifying but fortunately tone is changed with spirit put into setsukos character much like pianist issue is not war but struggle will survive it this is clearly displayed plot that revolves around downward spiral setsuko trying feed himself more importantly younger more vulnerable sister seita animation though detailed indeed beautiful some sequences namely relating title is not by any means flashy but captures emotions interactions between characters perfectly its perfect mixture such animation realistic highly likeable characters that makes whole film one tearful experience dealing with such difficult issues its very hard imagine this being film if it was i dont think it would been done as well part brilliance also comes symbology association many different worlds such understanding depiction child seita is nothing short perfection child like behaviour happily oblivious desperate situation amusing herself with simplicity quirks nature outdoors older brother setsuko who must carry burdon everything is also perfectly portrayed watch there decent is painful say least struggle is one thing but have shock shattered dreams be depended is something anyone can empthasise with there may be some people who will shy away anime disregarding it as mere cartoon those people everyone else i recommend graveyard as tonic which can be appreciated by anyone with heart soul among finest pieces anime created one most touching war films ever made,0.6233638147566718,0.12730533751962325,Positive,"{'Happy': 0.1, 'Angry': 0.05, 'Surprise': 0.26, 'Sad': 0.3, 'Fear': 0.3}"
10.0,"Heartrendering, moving masterpiece from Isao Takahata, and a triumph for animation.","Truly one of Studio Ghibli's greatest crowning achievements, GRAVE OF THE FIREFLIES is a brilliant masterpiece fully deserving of a place in any of the best movies ever made. Not just an astonishingly great (and, at the risk of coming off as clich, perfect) work of art, this is a moving, thought-provoking, and ultimately heartbreaking tale about the loss of innocence and the tragedies of war.Based on an autobiography by Akiyuki Nosaka, the film, set during the bombing of Japan in --of all times-- World War II, centers on Seita, a loving, headstrong Navy soldier's son and his innocent little sister, Setsuko. Their fatal struggle for survival begins right at the start, when both are bombed out of house and home by American B-29s. Mom is seriously wounded and found wrapped in bandages at a hospital, where she dies shortly after. The children move to Nishinomiya to stay with their aunt. Auntie, a cold, bitter, self-serving woman, has no patience with Seita or Setsuko, especially when they would rather chase after fireflies at moonlight, play by the beach, or lounge around the house instead of helping out. After butting heads with Auntie long enough, the children decide to run away, setting up home in an abandoned cave by the lake. Both try by all means to live off of vegetables or whatever food they can afford to trade and/or steal, to no avail....The outcome of the story is actually showcased at the opening of the movie, where we see a ghostly specter of Seita watching a more malnourished version of himself die a painful, lonely death at a train station. Indeed, as we see how these events came to pass, we find ourselves rooting for Seita and Setsuko to find a way to stay alive, but alas, it is not to be, given Seita's stubborn pride. The overall tone of the movie is of a very tragic nature--even such lighthearted moments as the aforementioned sequences involving Seita and Setsuko playing around the house or gathering fireflies as lights for their cave are all tainted with a touch of sadness, for we know that these brief scenes of happiness will not last.Who is to blame for the plight of these children? The movie never addresses this question to the audience, nor does it really care to. It would be easy for director Isao Takahata to make this an anti-American movie, but he does better than that. Instead, he aptly conveys that war can spell serious--and deadly--consequences for victims. He also eschews casting any character as a hero or villain, and instead makes this a very human story, with no clear-cut ""good"" or ""bad"" characters. The aunt, for example, is not evil; she is merely an angry, desperate woman who is only struggling to survive just as much as Seita and Setsuko are. Atrocious as her treatment of the children is, we somehow never see her as a true baddie, but a very flawed, multi-faceted human being.Normally one would think of this kind of story as suitable for live-action, but GRAVE OF THE FIREFLIES proves that it can be told through the art of animation as well. This is no mindless showcase of gorgeous visuals--although the artistic merits of the movie are, as with Ghibli productions, sumptuous and at times breathtaking--but a display of real characters struggling with very tangible emotions. And the most amazing accomplishment about this movie is how much we grow to care for Seita and Setsuko--their inseparable bond of love and companionship is the heart and soul behind the movie.There are long stretches of silence on the soundtrack, with music used very sparingly, yet the movie is all the more powerful for it. The most effective moment is where we hear a scratchy rendition of ""Home, Sweet Home"" over a montage of Setsuko playing by the shelter. It's a simplistic, sweet, yet very saddening moment that not only works in the context of the movie, but on its own as well.I don't normally say this in my reviews, but I would definitely recommend watching this movie in its native language of Japanese for a truly powerful and memorable experience. That's not to imply, however, that the English dub, produced by New York-based Central Park Media, is inferior; on the contrary. It is, in fact, surprisingly good, with an effective lead in J. Robert Spencer and noteworthy cameo appearances by Anime voice-over actors Veronica Taylor, Crispin Freeman, and Dan Green. Rhoda Chrosite's Setsuko is the one voice that doesn't fare so well; she sounds more like an adult pretending to be a young girl, and comes across as strained during most scenes (save for when she is sick from diarrhea). Still, for those who can't read subtitles, the dub is more than adequate (although not as high-profile as others that I've heard).Even in a genre as multi-faceted as Japanese Anime, there are few films that literally everyone really MUST see. GRAVE OF THE FIREFLIES is one such movie.",heartrendering moving masterpiece isao takahata triumph animation,truly one studio ghiblis greatest crowning achievements grave fireflies is brilliant masterpiece fully deserving place any best movies ever made not just astonishingly great at risk coming off as clich perfect work art this is moving thought provoking ultimately heartbreaking tale about loss innocence tragedies war based autobiography by akiyuki nosaka film set during bombing japan all times world war ii centers seita loving headstrong navy soldiers son his innocent little sister setsuko their fatal struggle survival begins right at start when both are bombed out house home by american b 29s mom is seriously wounded found wrapped bandages at hospital where she dies shortly after children move nishinomiya stay with their aunt auntie cold bitter self serving woman has no patience with seita or setsuko especially when they would rather chase after fireflies at moonlight play by beach or lounge around house instead helping out after butting heads with auntie long enough children decide run away setting up home abandoned cave by lake both try by all means live off vegetables or whatever food they can afford trade or steal no avail outcome story is actually showcased at opening movie where we see ghostly specter seita watching more malnourished version himself die painful lonely death at train station indeed as we see how these events came pass we find ourselves rooting seita setsuko find way stay alive but alas it is not be given seitas stubborn pride overall tone movie is very tragic nature even such lighthearted moments as aforementioned sequences involving seita setsuko playing around house or gathering fireflies as lights their cave are all tainted with touch sadness we know that these brief scenes happiness will not last who is blame plight these children movie never addresses this question audience nor does it really care it would be easy director isao takahata make this anti american movie but he does better than that instead he aptly conveys that war can spell serious deadly consequences victims he also eschews casting any character as hero or villain instead makes this very human story with no clear cut good or bad characters aunt example is not evil she is merely angry desperate woman who is only struggling survive just as much as seita setsuko are atrocious as her treatment children is we somehow never see her as true baddie but very flawed multi faceted human being normally one would think this kind story as suitable live action but grave fireflies proves that it can be told through art animation as well this is no mindless showcase gorgeous visuals although artistic merits movie are as with ghibli productions sumptuous at times breathtaking but display real characters struggling with very tangible emotions most amazing accomplishment about this movie is how much we grow care seita setsuko their inseparable bond love companionship is heart soul behind movie there are long stretches silence soundtrack with music used very sparingly yet movie is all more powerful it most effective moment is where we hear scratchy rendition home sweet home over montage setsuko playing by shelter its simplistic sweet yet very saddening moment that not only works context movie but its own as well i dont normally say this my reviews but i would definitely recommend watching this movie its native language japanese truly powerful memorable experience thats not imply however that english dub produced by new york based central park media is inferior contrary it is fact surprisingly good with effective lead j robert spencer noteworthy cameo appearances by anime voice over actors veronica taylor crispin freeman dan green rhoda chrosites setsuko is one voice that doesnt fare so well she sounds more like adult pretending be young girl comes across as strained during most scenes save when she is sick diarrhea still those who cant read subtitles dub is more than adequate although not as high profile as others that ive heard even genre as multi faceted as japanese anime there are few films that literally everyone really must see grave fireflies is one such movie,0.5632609771181197,0.16106050298907437,Positive,"{'Happy': 0.09, 'Angry': 0.05, 'Surprise': 0.22, 'Sad': 0.19, 'Fear': 0.43}"
10.0,Haunting,"I was warned this movie would be emotional, but I had no idea just how understated that was. By the end, my friend and I were huddled together, pouring out tears I've never shed for any movie before. It was a mix of horror, empathy, sadness, and so many more emotions I can't even begin to list.Visions of this film have haunted me since first watching it, and I would find it hard to watch again, simply from it being so heart-wrenching. Only one movie has ever hit me hard enough to keep me from subjecting myself to it's strong emotions again (The thief, the cook, his wife and her lover).I strongly urge all to watch this, as it rises well about any films I've seen, anime or not.",haunting,i was warned this movie would be emotional but i had no idea just how understated that was by end my friend i were huddled together pouring out tears ive never shed any movie before it was mix horror empathy sadness so many more emotions i cant even begin list visions this film have haunted me since first watching it i would find it hard watch again simply it being so heart wrenching only one movie has ever hit me hard enough keep me subjecting myself its strong emotions again thief cook his wife her lover i strongly urge all watch this as it rises well about any films ive seen anime or not,0.580952380952381,0.13939393939393938,Positive,"{'Happy': 0.17, 'Angry': 0.13, 'Surprise': 0.26, 'Sad': 0.26, 'Fear': 0.17}"
10.0,One for the unknown victims.,"Just marvellous! This hearty masterpiece of Japanese animation is incredibly moving, sincere, haunting and captivating in detailing the special bond between brother and sister caught up in the horrifying and unforgiving face of war. It guides us on one really tragic, but rewarding trip where it truly has an impact. Never does it get overwrought or push itself onto the viewer, but still it manages to leave a lump in your throat and have you emotionally drained when the credits begin to roll. This one is not afraid to stay gloomy, and because you know the outcome at the beginning, this makes the significance of the story's journey more potentate in its increasing pain and devastation. By that alone, the wonderfully textured plot doesn't take the easy way out and the reality of the situation is never lost because it's animated.Staying simple and focused, kept it rather flawless in its in-depth story telling of emotional pride and lasting effects. Slow it might be, but there's too much subtle richness within its characters, premise and visuals to really bother about the loose pacing and lack of action. Isao Takahata adapts the novel of Akiyuki Nosaka, and gets us deeply involved with the civilians, and the mere war stays in the background. A contrast between two different worlds, one being the war itself and secondly the one the two children find themselves in to forget it. Namely those scenes where they're experiencing the beauty and freeness of nature (at if they might never get that chance again) and those sequences with the fireflies admirably paint the feelings of what's to come. The budding relationship between Seita and Setsuko is tremendously done, innocent and full of colour. Even capturing the Japanese citizens and families in this cold plight is believability achieved, as it throws questions, issues and metaphorical messages. These people (including our two central characters) are doing it hard, but their wills won't collapse after what they've been through, but things do take their toll when everything you ever care for can suddenly vanish and the heartache turns to utter numbness. Because what kept you living, is no longer there to hold you.Breathing heavily on the mood is the soft, lovely musical score that certainly weeps with its melodic tone. The vivid animation is gorgeously crisp and enchanting, and the background scenery is profoundly vivid and convincing. Many beautiful, striking illustrations are framed with a sincere touch, where darkness treads neatly together with the lighter moments. What a delightfully effective and soulful meditation piece of sublime art by director/writer Isao Takahata. This one has plenty to say on the topic at hand, and it gets even more relevant everyday.Magnificently heart-wrenching and sensitive war-time story on the people who find themselves dealing with the unbearable consequences of war.",one unknown victims,just marvellous this hearty masterpiece japanese animation is incredibly moving sincere haunting captivating detailing special bond between brother sister caught up horrifying unforgiving face war it guides us one really tragic but rewarding trip where it truly has impact never does it get overwrought or push itself onto viewer but still it manages leave lump your throat have you emotionally drained when credits begin roll this one is not afraid stay gloomy because you know outcome at beginning this makes significance storys journey more potentate its increasing pain devastation by that alone wonderfully textured plot doesnt take easy way out reality situation is never lost because its animated staying simple focused kept it rather flawless its depth story telling emotional pride lasting effects slow it might be but theres too much subtle richness within its characters premise visuals really bother about loose pacing lack action isao takahata adapts novel akiyuki nosaka gets us deeply involved with civilians mere war stays background contrast between two different worlds one being war itself secondly one two children find themselves forget it namely those scenes where theyre experiencing beauty freeness nature at if they might never get that chance again those sequences with fireflies admirably paint feelings whats come budding relationship between seita setsuko is tremendously done innocent full colour even capturing japanese citizens families this cold plight is believability achieved as it throws questions issues metaphorical messages these people including our two central characters are doing it hard but their wills wont collapse after what theyve been through but things do take their toll when everything you ever care can suddenly vanish heartache turns utter numbness because what kept you living is no longer there hold you breathing heavily mood is soft lovely musical score that certainly weeps with its melodic tone vivid animation is gorgeously crisp enchanting background scenery is profoundly vivid convincing many beautiful striking illustrations are framed with sincere touch where darkness treads neatly together with lighter moments what delightfully effective soulful meditation piece sublime art by director writer isao takahata this one has plenty say topic at hand it gets even more relevant everyday magnificently heart wrenching sensitive war time story people who find themselves dealing with unbearable consequences war,0.5949280251911832,0.17695038879249406,Positive,"{'Happy': 0.1, 'Angry': 0.12, 'Surprise': 0.24, 'Sad': 0.26, 'Fear': 0.28}"
10.0,More moving than you could ever expect,"This film is utterly emotionally draining whilst being rewarding at the same time.The animation is both realistic and stylized but that's not the point, the main focus of this film is the character development of the brother and sister protagonists. Their relationship is nothing short of beautiful and touching.And without spoiling anything I have to say that this film touched me in a way no other film has ever touched me in my adult life. One or two films have upset me and reduced me to watery eyes but Grave of the Fireflies had me in fits of sobbing despair. I was a mess! I'm talking total emotional breakdown. Couldn't talk without sobbing! One of the best films I have EVER seen, animated or not.",more moving than you could ever expect,this film is utterly emotionally draining whilst being rewarding at same time animation is both realistic stylized but thats not point main focus this film is character development brother sister protagonists their relationship is nothing short beautiful touching without spoiling anything i have say that this film touched me way no other film has ever touched me my adult life one or two films have upset me reduced me watery eyes but grave fireflies had me fits sobbing despair i was mess im talking total emotional breakdown couldnt talk without sobbing one best films i have ever seen animated or not,0.4861111111111111,0.24472222222222226,Positive,"{'Happy': 0.13, 'Angry': 0.09, 'Surprise': 0.3, 'Sad': 0.3, 'Fear': 0.17}"
