Rating,Review Title,Review,Cleaned Review Title,Cleaned Review,Subjectivity,Polarity,Sentiment,Emotion Scale
10.0,Heartbreaking...,"This film proves without any doubt that animation isn't just suited to tales of fantasy, sci-fi or cartoon comedy and violence. This absolutely heartbreaking Japanese anime tells the story of a young boy, Seito and his younger sister, Setsuko, as they attempt to survive the American bombings on Japan in the last year of World War II.The story itself, based on a true story, is powerful enough but the decision to animate the film truly elevates this film to a higher level. This would have been a powerful enough live action drama, along the lines of Spielberg's Empire of the Sun or even Schindler's List. However, the Studio Ghibli team, have brought an extraordinary amount of life to all the characters, but especially the young siblings. Now we're not talking realism as such here - the characters are in no way photo-realistic, they do have the usual characteristics of Japanese anime humans, large eyes and exaggerated expressions. What this achieves however is a heightened level of subtle nuances in expression which are arguably more powerful and provocative than anything a real-life actor may achieve. Some may claim this is overly manipulative or sentimental, but coupled with the characters movements and actions, it gives the characters such a strong, and very human, presence. You truly care for these kids, which is an astonishing achievement. The voice cast (original Japanese) contributes significantly here also.It is the tiny moments which give this film so much power and emotional depth - from subtle expressions to brief scenes showing Seito playing with his sister at bath time, attempting, unsuccessfully, to cheer her up when she misses her mother. The painted backgrounds are works of art in themselves, just beautiful. And of course the scenes with the fireflies bring a touch of pure magic - a heightened innocent reality to contrast the horrific realities of the war.The greatest achievement of this film is that, apart from a couple of obviously sentimental scenes, such as Setsuko's sobbing or illness, it doesn't force any false emotion on the viewer. It really comes from your involvement with the characters. It's completely honest to it's own story and even cuts off scenes abruptly, which could potentially have been milked for cheap sentiment. It often seems to say - This is what happened, you don't need to see anymore. Another of it's strengths is that it really doesn't comment on the politics of the war in any way, just the effects on innocent people.This is an intensely moving film and a masterpiece of animation. If you aren't moved by these characters, you really need to check your pulse. 10/10",heartbreaking,this film proves without any doubt that animation isnt just suited tales fantasy sci fi or cartoon comedy violence this absolutely heartbreaking japanese anime tells story young boy seito his younger sister setsuko as they attempt survive american bombings japan last year world war ii story itself based true story is powerful enough but decision animate film truly elevates this film higher level this would have been powerful enough live action drama along lines spielbergs empire sun or even schindlers list however studio ghibli team have brought extraordinary amount life all characters but especially young siblings now were not talking realism as such here characters are no way photo realistic they do have usual characteristics japanese anime humans large eyes exaggerated expressions what this achieves however is heightened level subtle nuances expression which are arguably more powerful provocative than anything real life actor may achieve some may claim this is overly manipulative or sentimental but coupled with characters movements actions it gives characters such strong very human presence you truly care these kids which is astonishing achievement voice cast original japanese contributes significantly here also it is tiny moments which give this film so much power emotional depth subtle expressions brief scenes showing seito playing with his sister at bath time attempting unsuccessfully cheer her up when she misses her mother painted backgrounds are works art themselves just beautiful course scenes with fireflies bring touch pure magic heightened innocent reality contrast horrific realities war greatest achievement this film is that apart couple obviously sentimental scenes such as setsukos sobbing or illness it doesnt force any false emotion viewer it really comes your involvement with characters its completely honest its own story even cuts off scenes abruptly which could potentially have been milked cheap sentiment it often seems say this is what happened you dont need see anymore another its strengths is that it really doesnt comment politics war any way just effects innocent people this is intensely moving film masterpiece animation if you arent moved by these characters you really need check your pulse 10 10,0.5779701372074255,0.14163731748477512,Positive,"{'Happy': 0.07, 'Angry': 0.01, 'Surprise': 0.2, 'Sad': 0.31, 'Fear': 0.41}"
10.0,"Beautiful, haunting and emotionally devastating","What an amazing film! Very rarely have I been moved this much by an animated film. Watership Down yes, Bambi yes, Secret of NIMH yes, Beauty and the Beast yes, Land Before Time yes, but Grave of the Fireflies is in a different league. A film that is once seen and never forgotten, a film that is beautiful, haunting and emotionally devastating. It is slow moving perhaps and ""depressing"" but it is very poignant as well. I find it very difficult to fight back tears at the film's end. The animation is amazingly detailed, the backgrounds and characters are drawn with such care and you just marvel at the detail that goes into it. The music is both haunting and melancholic and one of the main reasons why the film is as it is. The story is harrowing, as it details Seita and Setsuko's hopelessness. The characters are easy to relate, Setsuko isn't precocious or obnoxious, instead she is quite cute, and Seita shows real love for his sister as well as being a strong protagonist. There are many memorable sequences, but one that springs to mind is the one with the nocturnal fireflies, which is something of true melancholic beauty. Overall, a masterpiece, pure and simple. 10/10 Bethany Cox",beautiful haunting emotionally devastating,what amazing film very rarely have i been moved this much by animated film watership down yes bambi yes secret nimh yes beauty beast yes land before time yes but grave fireflies is different league film that is once seen never forgotten film that is beautiful haunting emotionally devastating it is slow moving perhaps depressing but it is very poignant as well i find it very difficult fight back tears at films end animation is amazingly detailed backgrounds characters are drawn with such care you just marvel at detail that goes into it music is both haunting melancholic one main reasons why film is as it is story is harrowing as it details seita setsukos hopelessness characters are easy relate setsuko isnt precocious or obnoxious instead she is quite cute seita shows real love his sister as well as being strong protagonist there are many memorable sequences but one that springs mind is one with nocturnal fireflies which is something true melancholic beauty overall masterpiece pure simple 10 10 bethany cox,0.6677154195011338,0.10828798185941044,Positive,"{'Happy': 0.21, 'Angry': 0.03, 'Surprise': 0.18, 'Sad': 0.33, 'Fear': 0.24}"
8.0,Heart breaking animation,"This animated movie starts with young boy Seita dying on the floor of a train station after Japan surrenders in WWII. His spirit leads the audience to his story with his little sister Setsuko. During an air raid on their home town, they lose their mother. Their father is away with the Navy. The siblings go to live with their unsympathetic aunt. Seita clash with her, and the siblings go live by themselves in the bomb shelter next to the waters. It doesn't go well as their lives deteriorate to the point where Seita dies alone on the floor.It is the saddest of tragedy. The animation is the perfect foil to the subject matter. The animation style is children's story but the movie is all too realistic. The characters are not cartoons. It is ripped from the pages of history. The children animation style draws the audience in, and it hits the viewer in the heart.",heart breaking animation,this animated movie starts with young boy seita dying floor train station after japan surrenders wwii his spirit leads audience his story with his little sister setsuko during air raid their home town they lose their mother their father is away with navy siblings go live with their unsympathetic aunt seita clash with her siblings go live by themselves bomb shelter next waters it doesnt go well as their lives deteriorate point where seita dies alone floor it is saddest tragedy animation is perfect foil subject matter animation style is childrens story but movie is all too realistic characters are not cartoons it is ripped pages history children animation style draws audience it hits viewer heart,0.44583333333333336,0.1481534090909091,Positive,"{'Happy': 0.0, 'Angry': 0.08, 'Surprise': 0.25, 'Sad': 0.42, 'Fear': 0.25}"
10.0,Heartbreakingly Beautiful,"I'd heard that this film was very sad before I saw it and knew how it ended but that didn't prepare me for just how harrowing this film was.Instead of focusing on the military this war film focuses on two children, Seita a boy in his early teens and Setsuko his four year old sister. The action is not fast paced as we follow the children's lives from the death of their mother in a fire-bombing raid through a stay with an unpleasant aunt and trying to live on their own in an abandoned air raid shelter to their inevitable end. By taking it slowing and showing the mundane aspects of their lives the viewer grows to care about the characters, especially the delightful Setsuko to such an extent that that I was smiling during flash backs showing her playing while simultaneously sobbing at her loss.This is not a film to be watched if one is depressed but it should certainly be seen by as many people as possible at least once, it may show two children in war torn Japan but it could easily be set in any war zone at any time in history.",heartbreakingly beautiful,id heard that this film was very sad before i saw it knew how it ended but that didnt prepare me just how harrowing this film was instead focusing military this war film focuses two children seita boy his early teens setsuko his four year old sister action is not fast paced as we follow childrens lives death their mother fire bombing raid through stay with unpleasant aunt trying live their own abandoned air raid shelter their inevitable end by taking it slowing showing mundane aspects their lives viewer grows care about characters especially delightful setsuko such extent that that i was smiling during flash backs showing her playing while simultaneously sobbing at her loss this is not film be watched if one is depressed but it should certainly be seen by as many people as possible at least once it may show two children war torn japan but it could easily be set any war zone at any time history,0.6169172932330828,0.10880610617452721,Positive,"{'Happy': 0.11, 'Angry': 0.07, 'Surprise': 0.21, 'Sad': 0.21, 'Fear': 0.39}"
10.0,Heartbreaking,"During my searches on Anime on the net one day I came across this title. This was 2 years ago.Then last week I went to an Anime convention and at the DVD stand I saw it. I bought it immediately.When I got home 3 days later I popped it in. I was warned about it being tragic but nothing could have prepared me for the wave of emotion that hit me while watching it. I was depressed for a whole day. Even thinking about it made me cry..This is the power of Grave Of The Fireflies..This is not your typical Dragonball Z/Sailormoon/Pokemon style anime. While I love Sailormoon and some Dragonball Z, Grave Of The Fireflies surpasses it by lightyears. I bought it expecting an epic movie like Ghost In The Shell or Akira but even those paled compared to this.We have here a story of a 14 year old boy(Seita) who loses his mother in a firebombing during World War 2. He then has to take care of his 4 year old sister(Setsuko). While at first they're taken in by his aunt the relationship between him and his aunt takes a turn for the worst. He then ends up on the street and the struggle begins... It doesn't take a genious to figure out that things get really depressing, yet I won't spoil the ending..All I have left to say is that you have to see this movie.. It's the most powerful movie I've ever seen... It's painful to watch but still you have to see it...",heartbreaking,during my searches anime net one day i came across this title this was 2 years ago then last week i went anime convention at dvd stand i saw it i bought it immediately when i got home 3 days later i popped it i was warned about it being tragic but nothing could have prepared me wave emotion that hit me while watching it i was depressed whole day even thinking about it made me cry this is power grave fireflies this is not your typical dragonball z sailormoon pokemon style anime while i love sailormoon some dragonball z grave fireflies surpasses it by lightyears i bought it expecting epic movie like ghost shell or akira but even those paled compared this we have here story 14 year old boy seita who loses his mother firebombing during world war 2 he then has take care his 4 year old sister setsuko while at first theyre taken by his aunt relationship between him his aunt takes turn worst he then ends up street struggle begins it doesnt take genious figure out that things get really depressing yet i wont spoil ending all i have left say is that you have see this movie its most powerful movie ive ever seen its painful watch but still you have see it,0.43611111111111117,-0.08148148148148147,Negative,"{'Happy': 0.12, 'Angry': 0.05, 'Surprise': 0.34, 'Sad': 0.27, 'Fear': 0.22}"
10.0,"a combination of Rome Open City and Wiesel's Night (and like both, an extreme, personally felt story)","In 1988 Grave of the Fireflies was placed on a double-bill alongside My Neighbor Totoro. Two of the most endearing films ever created- animated of otherwise- were paired alongside one another, more than likely to balance each other out; after being submersed in a pure tale of innocence and delight like Miyazaki's great film, there could be accepted such a bleak, heartbreaking story of survival. And both films, incidentally, were based on true experiences, and while Miyazaki's story wasn't without some sadness in real life (his mother was really sick with TB in the hospital), Akiyuki Nosaka's story is one drenched in the worst horrors imaginable for a child. It's basically about two siblings, an older brother and younger sister, who are left practically orphans in a Japan completely devastated by the constant barrage of bombs falling all around, and with very little hope in sight. This lays the groundwork for their relationship, a bond very fragile and incredibly endearing.Not since Rossellini and De Sica had a filmmaker, in this case Isao Takahata, touched a nerve so deeply etched out in deconstructing the horrors of wartime. By leaving us with these two characters, who piece by piece are stripped of their innocence in just the simple task of fending for themselves in a shelter (they at first stay with an aunt who considers them freeloaders) and scrounging for food any way possible, we're left with nothing else but their struggle, essentially. The backdrop itself almost becomes abstract, something so huge that we don't even know that it's Americans dropping the bombs, as it's already too much to grasp that a child's parent is no longer with them. Like Elie Wiesel's book Night, the backdrop and horror is used to pit these people in an untenable situation, and it can only end, honestly, without compromise.So, indeed, Grave of the Fireflies is bleak as hell, but compelling because it doesn't stray from its path with these characters, and that in many scenes we're connected to them without the overbearing heart-tugs of a common Disney feature (though, ironically, as Ebert points out on an interview with the DVD, the big eyes in most anime is based upon those in early Disney films). The animation is exceptionally refined without being excessive in violence; images are visceral for just what is briefly revealed, without the extraneous shots that one might see in a work not meant in a G-rated film (i.e. when Seita sees her mother, dead and wrapped in bandages with the maggots and bugs crawling all over), and at the same time there's a sense of wonderment as the two children watch the fireflies in the shelter. The voice-work, too, doesn't strain credulity- these sound like, if it were a regular live-action feature, the kids who would play these parts (and, speaking of neo-realism, the two credited for Seita and Setsuko never worked before or again).Most often, the film is heart-rending because of how things build with the situation. It's tragic enough to see the loss of the mother on the son, but then to hide it from the little girl becomes a greater challenge. Each time a layer of emotional defense is peeled back, it becomes harder not to connect strongly with these characters, such as when Seiko casually says she knows her mother is dead as she buries the fireflies and Seita finally cries out for the first time, or when Seita is left broken and humiliated after being beat up by the farmer for stealing food for sick Setsuko. And, finally, there's the last ten or so minutes, which I won't mention here. Suffice to say it's one of those times in movies where the opening of the film- Seiko dying homeless and famished- is explained to a perfect degree by film's end. It's a harrowing experience, and one of the very best animated films.",combination rome open city wiesels night like both extreme personally felt story,1988 grave fireflies was placed double bill alongside my neighbor totoro two most endearing films ever created animated otherwise were paired alongside one another more than likely balance each other out after being submersed pure tale innocence delight like miyazakis great film there could be accepted such bleak heartbreaking story survival both films incidentally were based true experiences while miyazakis story wasnt without some sadness real life his mother was really sick with tb hospital akiyuki nosakas story is one drenched worst horrors imaginable child its basically about two siblings older brother younger sister who are left practically orphans japan completely devastated by constant barrage bombs falling all around with very little hope sight this lays groundwork their relationship bond very fragile incredibly endearing not since rossellini de sica had filmmaker this case isao takahata touched nerve so deeply etched out deconstructing horrors wartime by leaving us with these two characters who piece by piece are stripped their innocence just simple task fending themselves shelter they at first stay with aunt who considers them freeloaders scrounging food any way possible were left with nothing else but their struggle essentially backdrop itself almost becomes abstract something so huge that we dont even know that its americans dropping bombs as its already too much grasp that childs parent is no longer with them like elie wiesels book night backdrop horror is used pit these people untenable situation it can only end honestly without compromise so indeed grave fireflies is bleak as hell but compelling because it doesnt stray its path with these characters that many scenes were connected them without overbearing heart tugs common disney feature though ironically as ebert points out interview with dvd big eyes most anime is based upon those early disney films animation is exceptionally refined without being excessive violence images are visceral just what is briefly revealed without extraneous shots that one might see work not meant g rated film i e when seita sees her mother dead wrapped bandages with maggots bugs crawling all over at same time theres sense wonderment as two children watch fireflies shelter voice work too doesnt strain credulity these sound like if it were regular live action feature kids who would play these parts speaking neo realism two credited seita setsuko never worked before or again most often film is heart rending because how things build with situation its tragic enough see loss mother son but then hide it little girl becomes greater challenge each time layer emotional defense is peeled back it becomes harder not connect strongly with these characters such as when seiko casually says she knows her mother is dead as she buries fireflies seita finally cries out first time or when seita is left broken humiliated after being beat up by farmer stealing food sick setsuko finally theres last ten or so minutes which i wont mention here suffice say its one those times movies where opening film seiko dying homeless famished is explained perfect degree by films end its harrowing experience one very best animated films,0.5050915750915751,0.05284239162663819,Positive,"{'Happy': 0.05, 'Angry': 0.05, 'Surprise': 0.23, 'Sad': 0.24, 'Fear': 0.42}"
8.0,"""Why do fireflies have to die so soon?""","The movie took on an added poignancy for me as I kept thinking of my own granddaughter, who's age approaches that of the young Setsuko in the movie. How horrifying a prospect to be left homeless under any conditions, let alone to deal with the death of a mother with no place to turn. The plight of Setsuko and her older brother Seita is dealt perhaps an even more severe blow by the indifference and even hostility of their countrymen and fellow citizens. I was probably more disturbed by the idea that so little compassion was offered to these two troubled wanderers. I rarely watch animated films, and this is actually the very first anime feature I've ever seen, recommended by it's standing in the IMDb top film rankings. The picture is gorgeously rendered, and there's a lyrical quality to the quieter moments when the siblings take comfort in each other's presence against a backdrop of war and devastation. Be prepared for an emotional response to the heartbreak of loss and separation, exemplified by a brother and sister who mean the world to each other.",why do fireflies have die so soon,movie took added poignancy me as i kept thinking my own granddaughter whos age approaches that young setsuko movie how horrifying prospect be left homeless under any conditions let alone deal with death mother with no place turn plight setsuko her older brother seita is dealt perhaps even more severe blow by indifference even hostility their countrymen fellow citizens i was probably more disturbed by idea that so little compassion was offered these two troubled wanderers i rarely watch animated films this is actually very first anime feature ive ever seen recommended by its standing imdb top film rankings picture is gorgeously rendered theres lyrical quality quieter moments when siblings take comfort each others presence against backdrop war devastation be prepared emotional response heartbreak loss separation exemplified by brother sister who mean world each other,0.6049479166666667,0.10416666666666666,Positive,"{'Happy': 0.0, 'Angry': 0.04, 'Surprise': 0.44, 'Sad': 0.3, 'Fear': 0.22}"
