Rating,Review Title,Review,Cleaned Review Title,Cleaned Review,Subjectivity,Polarity,Sentiment,Emotion Scale
10.0,A powerful film that shows the true cost of war,"""Grave of the Fireflies"" is one of the most ambitious, depressing, and quite frankly, best films that I've ever seen. I was nearly moved to tears by this film's brave treatment of such critical subject matter. Yes, it's an Anime' piece, but surprisingly, it came out in 1988, during a time where most Japanese animation films were either relentless bloodbaths, borderline pornography, or both.As a fan of the Anime' genre of film-making, many great pieces have achieved some sort of cult status here in America, yet none have really reached mainstream success. Some have broken through the barrier and have gained acceptance with American critics, like Katsuhiro Otomo's ""Akira,"" or ""Princess Mononoke,"" or ""Spirited Away"" (both films directed by Hayao Miyazaki). One that I've seen and has been barely mentioned by most critics is ""Grave of the Fireflies.""What we have with ""Grave of the Fireflies,"" is a story of innocence lost and two children who ultimately face a losing battle with trying to survive in a small Japanese village in the closing days of World War II. WWII was the costliest conflict in world history, with millions dead and thousands left to pick up the pieces.In the center of it, are the aforementioned two children, who are pretty much left to fend for themselves after their mother is killed in a bombing raid. Because their father is off fighting in the war and they have no way of contacting any other family, they're sent to live with their aunt, who is at first warm and welcoming to them, but eventually becomes very cruel and the children are forced to live in a nearby bomb shelter. From that point on, the two children embark on a journey that is every bit as unpleasant and difficult as the grim realities of the world around them.Very easily one of the best Anime' films that I've ever seen (or any animated film for that matter), I find it difficult to believe just how truly overlooked ""Grave of the Fireflies"" is. The animation is beautiful, though certainly not dated by any means (even though Japanese animation has progressed well since this film was made).We get a sense of the dread of the two lead characters, who watch as the world around them crumbles into heaps of ashes, and aircraft loom ominously overhead, dropping their deadly, incendiary cargo on unsuspecting Japanese villagers.The director, Isao Takahata, obviously has a special resentment of the war, but manages to avoid condemning it outright. The director instead lets us focus in on the conflict as seen through the eyes of the two children, who watch unflinchingly as the realities of their world begin to falter before them.""Grave of the Fireflies"" is a bold statement on the condition of the human soul during conflict. I probably shouldn't say this but I am anyways, but this film has to be the ""Schindler's List"" of animated pieces. It's brave, it's not overly sentimental, but it is relentless in its dramatization of a dangerous reality. It should be required viewing in any high school world history class.A beautiful film; not to be missed by anyone.",powerful film that shows true cost war,grave fireflies is one most ambitious depressing quite frankly best films that ive ever seen i was nearly moved tears by this films brave treatment such critical subject matter yes its anime piece but surprisingly it came out 1988 during time where most japanese animation films were either relentless bloodbaths borderline pornography or both as fan anime genre film making many great pieces have achieved some sort cult status here america yet none have really reached mainstream success some have broken through barrier have gained acceptance with american critics like katsuhiro otomos akira or princess mononoke or spirited away both films directed by hayao miyazaki one that ive seen has been barely mentioned by most critics is grave fireflies what we have with grave fireflies is story innocence lost two children who ultimately face losing battle with trying survive small japanese village closing days world war ii wwii was costliest conflict world history with millions dead thousands left pick up pieces center it are aforementioned two children who are pretty much left fend themselves after their mother is killed bombing raid because their father is off fighting war they have no way contacting any other family theyre sent live with their aunt who is at first warm welcoming them but eventually becomes very cruel children are forced live nearby bomb shelter that point two children embark journey that is every bit as unpleasant difficult as grim realities world around them very easily one best anime films that ive ever seen or any animated film that matter i find it difficult believe just how truly overlooked grave fireflies is animation is beautiful though certainly not dated by any means even though japanese animation has progressed well since this film was made we get sense dread two lead characters who watch as world around them crumbles into heaps ashes aircraft loom ominously overhead dropping their deadly incendiary cargo unsuspecting japanese villagers director isao takahata obviously has special resentment war but manages avoid condemning it outright director instead lets us focus conflict as seen through eyes two children who watch unflinchingly as realities their world begin falter before them grave fireflies is bold statement condition human soul during conflict i probably shouldnt say this but i am anyways but this film has be schindlers list animated pieces its brave its not overly sentimental but it is relentless its dramatization dangerous reality it should be required viewing any high school world history class beautiful film not be missed by anyone,0.5248531746031746,0.10812878787878785,Positive,"{'Happy': 0.09, 'Angry': 0.03, 'Surprise': 0.3, 'Sad': 0.3, 'Fear': 0.28}"
10.0,"A masterpiece, whose beauty is often overlooked","When I watched this movie, I steeled myself for a traumatic experience, based on every review I'd ever read of it, which usually include phrases like ""don't watch this if you're suicidal."" Instead, if I had to pick a single word to sum up the movie I saw, it would probably be 'beautiful'.Certainly it was sad, and arguably depressing, but I've read this movie compared with 'Saving Private Ryan'. That's ridiculous. 'Grave of the Fireflies' is gentle and poetic more often than it's violent, and it's remarkably restrained in its anti-war message. It simply tells a story : there's very little at all in the way of moralizing or polemics. Why would a story like this need such heavy-handed tactics?I've also read it argued that the movie is robbed of any suspense or impact when it's revealed in the opening scene that the main characters are dead. I have a quite different view of that device.Firstly. the beginning of 'Fireflies' is, for all intents and purposes, a 'happy ending'. This is such a non-linear plot development that you could fail to notice it, and thereby only see the movie's gloom. The moment where the ghostly Seita takes the ghostly Setsuko's hand and nods to her is not only a happy moment, it signifies that the suffering - which is yet to come, as far as the viewer is concerned - is over, and they are together again (albeit still without parents).As for a character revealing that he is dead in the first line of the movie, this is a device which has been used in centuries if not Milena. The crucial thing here is that 'Fireflies' isn't _about_ tension. It tells a story whose ultimate conclusion you already know (a legitimate narrative approach), and everything which happens during that story is emotionally infused with a foreknowledge of its ending. You find yourself hoping that things will go right now for Setsuko and Seita, and then the knowledge that ultimately it won't undercuts you with real emotional power. You know the characters are going to die, but you hope things won't be so bad in the meantime. It doesn't take much of an effort to make that an analogy for our own lives, which makes us all fireflies.Perhaps what might make someone feel disappointed or cheated by this film is simply that it's so damn honest. I mean that: it's one of the most honest, artifice-free movies I've ever seen. It doesn't even really try to ram an anti-war message down your throat there is very little overt violence, and if there are some scenes of corpses and suffering, it's never gratuitous, and it's over quickly. Compare this with 'Private Ryan', where you have to suffer through 40 minutes of the most horrific blood and guts, only to reach a conclusion which, after much blood and thunder, signifies very little.'Fireflies', OTOH, has far more beauty than gore. This is what really surprised me about it. Probably two thirds of the movie takes place in gorgeously drawn, tranquil rural or urban settings, with an almost pleasant dreamlike quality - even when the American bombers are flying overhead at one point there is a surreal, almost serene sense to it - and there are plenty of moments of happiness to offset the undeniably sadness and frustration of other scenes.Perhaps best of all, Setsuko is one of the very, very few (if not the only) animated 4 year-old I've ever seen who actually _behaves_ like a four year old. I'm so sick of seeing preternaturally smart, sassy, sophisticated and precocious children in Hollywood movies. Setsuko's emotion and behaviors are _exactly_ right for a completely normal four year-old, and recognizing this lends many scenes incredible poignancy. Similarly, Seita is a teenage boy who behaves with the sort of mixture of pride, compassion and hubris which you'd expect of someone his age. He still believes that Japan will win the war he thinks it's up to him to take care of his sister with their mother gone and father who knows where. This leads him to make mistakes: possibly the most obvious one being where he fails to take the farmer's advice, swallow his pride and ask his nasty aunt to take them back in again. You would probably have to say his decision not to even try - to go it alone instead, was a very bad one, but - hello, people - here is a character who makes mistakes because he's actually human: a believable teenage boy in an extraordinary situation, who doesn't miraculously save the day, because his best judgment just isn't good enough.Of course, his aunt may well have knocked them back anyway. Who knows?Don't go into the film expecting tension, drama or even a tirade against war. It's a movie about the beauty and fragility of life and youth. If you think Japanese animation is all giant robots and superhuman schoolgirls, this could be the film which changes your mind. It's slow, poetic, beautiful and sad, and extraordinarily honest.I must be the only person who didn't cry during this film (and I mean, I get choked up during some Disney movies). Yes, it is sad, but its beauty and honesty is what I'll remember.NB: this review refers to the subtitled version of the film.",masterpiece whose beauty is often overlooked,when i watched this movie i steeled myself traumatic experience based every review id ever read it which usually include phrases like dont watch this if youre suicidal instead if i had pick single word sum up movie i saw it would probably be beautiful certainly it was sad arguably depressing but ive read this movie compared with saving private ryan thats ridiculous grave fireflies is gentle poetic more often than its violent its remarkably restrained its anti war message it simply tells story theres very little at all way moralizing or polemics why would story like this need such heavy handed tactics ive also read it argued that movie is robbed any suspense or impact when its revealed opening scene that main characters are dead i have quite different view that device firstly beginning fireflies is all intents purposes happy ending this is such non linear plot development that you could fail notice it thereby only see movies gloom moment where ghostly seita takes ghostly setsukos hand nods her is not only happy moment it signifies that suffering which is yet come as far as viewer is concerned is over they are together again albeit still without parents as character revealing that he is dead first line movie this is device which has been used centuries if not milena crucial thing here is that fireflies isnt about tension it tells story whose ultimate conclusion you already know legitimate narrative approach everything which happens during that story is emotionally infused with foreknowledge its ending you find yourself hoping that things will go right now setsuko seita then knowledge that ultimately it wont undercuts you with real emotional power you know characters are going die but you hope things wont be so bad meantime it doesnt take much effort make that analogy our own lives which makes us all fireflies perhaps what might make someone feel disappointed or cheated by this film is simply that its so damn honest i mean that its one most honest artifice free movies ive ever seen it doesnt even really try ram anti war message down your throat there is very little overt violence if there are some scenes corpses suffering its never gratuitous its over quickly compare this with private ryan where you have suffer through 40 minutes most horrific blood guts only reach conclusion which after much blood thunder signifies very little fireflies otoh has far more beauty than gore this is what really surprised me about it probably two thirds movie takes place gorgeously drawn tranquil rural or urban settings with almost pleasant dreamlike quality even when american bombers are flying overhead at one point there is surreal almost serene sense it there are plenty moments happiness offset undeniably sadness frustration other scenes perhaps best all setsuko is one very very few if not only animated 4 year old ive ever seen who actually behaves like four year old im so sick seeing preternaturally smart sassy sophisticated precocious children hollywood movies setsukos emotion behaviors are exactly right completely normal four year old recognizing this lends many scenes incredible poignancy similarly seita is teenage boy who behaves with sort mixture pride compassion hubris which youd expect someone his age he still believes that japan will win war he thinks its up him take care his sister with their mother gone father who knows where this leads him make mistakes possibly most obvious one being where he fails take farmers advice swallow his pride ask his nasty aunt take them back again you would probably have say his decision not even try go it alone instead was very bad one but hello people here is character who makes mistakes because hes actually human believable teenage boy extraordinary situation who doesnt miraculously save day because his best judgment just isnt good enough course his aunt may well have knocked them back anyway who knows dont go into film expecting tension drama or even tirade against war its movie about beauty fragility life youth if you think japanese animation is all giant robots superhuman schoolgirls this could be film which changes your mind its slow poetic beautiful sad extraordinarily honest i must be only person who didnt cry during this film i mean i get choked up during some disney movies yes it is sad but its beauty honesty is what ill remember nb this review refers subtitled version film,0.5958212868480725,0.08176321570294783,Positive,"{'Happy': 0.16, 'Angry': 0.04, 'Surprise': 0.27, 'Sad': 0.23, 'Fear': 0.31}"
,Powerful and Heartbreaking,"""September 21, 1945...That was the night I died.""-- SeitaReading war statistics and even seeing bloody images on television does not fully communicate the horror of war as well as the heartbreaking Grave of the Fireflies, an anime feature directed by Isao Takahata, a long-time colleague of Hayao Miyazaki. The film tells the story of two children, Seita, a 14-year old boy and Setsuko, his 4-year old sister and their uphill struggle to survive the effects of American firebombing in Kobe near the end of World War II. Based on the semi-autobiographical novel of Akiyuki Nosaka, Grave is a powerful experience that powerfully communicates the strength of the human spirit to carry on against overwhelming odds. Though despairing, the film does not resort to cheap melodrama to achieve its effect but delineates simple and direct images that are not watered-down to appeal to the children's market. It would indeed be too sad for most children under 13. In an interview with Cedric Littardi, AnimeLand magazine from 1992, Takahata said that he did not set out to depress the audience but to show a natural death, as opposed to a ""scientific"" death, the way most of us view it -- behind closed curtains in a sanitized hospital. Takahata in some ways softens the impact of the tragedy at the outset by showing Seita dying outside a subway station and his spirit reunited with his little sister Setsuko. The story is told by flashback as the two children are left alone to fend for themselves when their mother is killed in the bombing campaign. When their father is also killed in the Navy, they must struggle against starvation, the cruelty of an aunt they trusted, people's general indifference, and their own pride. Though both children eventually succumb to malnutrition (or radiation poisoning), the animation is so lyrical that it creates a magical, dream-like effect. This does not mask the tragedy but makes it all the more poignant. Nothing sums up the message of this film better than the beautiful poem, ""I Come and Stand at Every Door"" by Nazim Hikmat, one of the most important and influential figures in 20th-century Turkish literature. I come and stand at every door. But no one hears my silent tread. I knock and yet remain unseen. For I am dead, for I am dead.I'm only seven although I died. In Hiroshima long ago. I'm seven now as I was then. When children die they do not grow.My hair was scorched by swirling flame. My eyes grew dim, my eyes grew blind. Death came and turned my bones to dust. And that was scattered by the wind.I need no fruit, I need no rice. I need no sweet, nor even bread. I ask for nothing for myself. For I am dead, for I am dead.All that I ask is that for peace. You fight today, you fight today. So that the children of this world. May live and grow and laugh and play.	-- Nazim HikmetIn our day where our leaders are busily preparing for another war, it is important to remember the human cost of these plans and the untold suffering they will inevitably bring. Grave of the Fireflies should be required viewing in the Oval office.",powerful heartbreaking,september 21 1945 that was night i died seitareading war statistics even seeing bloody images television does not fully communicate horror war as well as heartbreaking grave fireflies anime feature directed by isao takahata long time colleague hayao miyazaki film tells story two children seita 14 year old boy setsuko his 4 year old sister their uphill struggle survive effects american firebombing kobe near end world war ii based semi autobiographical novel akiyuki nosaka grave is powerful experience that powerfully communicates strength human spirit carry against overwhelming odds though despairing film does not resort cheap melodrama achieve its effect but delineates simple direct images that are not watered down appeal childrens market it would indeed be too sad most children under 13 interview with cedric littardi animeland magazine 1992 takahata said that he did not set out depress audience but show natural death as opposed scientific death way most us view it behind closed curtains sanitized hospital takahata some ways softens impact tragedy at outset by showing seita dying outside subway station his spirit reunited with his little sister setsuko story is told by flashback as two children are left alone fend themselves when their mother is killed bombing campaign when their father is also killed navy they must struggle against starvation cruelty aunt they trusted peoples general indifference their own pride though both children eventually succumb malnutrition or radiation poisoning animation is so lyrical that it creates magical dream like effect this does not mask tragedy but makes it all more poignant nothing sums up message this film better than beautiful poem i come stand at every door by nazim hikmat one most important influential figures 20th century turkish literature i come stand at every door but no one hears my silent tread i knock yet remain unseen i am dead i am dead im only seven although i died hiroshima long ago im seven now as i was then when children die they do not grow my hair was scorched by swirling flame my eyes grew dim my eyes grew blind death came turned my bones dust that was scattered by wind i need no fruit i need no rice i need no sweet nor even bread i ask nothing myself i am dead i am dead all that i ask is that peace you fight today you fight today so that children this world may live grow laugh play nazim hikmetin our day where our leaders are busily preparing another war it is important remember human cost these plans untold suffering they will inevitably bring grave fireflies should be required viewing oval office,0.47901875901875896,0.06821166207529843,Positive,"{'Happy': 0.09, 'Angry': 0.05, 'Surprise': 0.2, 'Sad': 0.3, 'Fear': 0.36}"
10.0,A Beautiful Unforgettable Masterpiece that shows the true cost of war.,"I decided to watch Grave of the Fireflies yesterday. My friends told me it was extremely moving and sad. I hesitated at first, but then I said ""Oh well, I'll give it a try."" At the end of the film, I was crying my eyes out. This was the best animated film, I've ever seen.This is a moving depiction of the fates of cast-off children who become casualties of war.This movie isn't your regular Animated Film. Pixar and Disney put films out there with happy endings. I'm not saying there bad films at all. They are also great pieces of work. But Grave of the Fireflies tells you the truth. This movie isn't trying to entertain you. It wants to inform you about how war is really like. There were many moments in the movie, that just brought me to tears.I am kind of upset, that this movie didn't get many awards as it should. In that regards, it is VERY underrated and it is kind of thrown apart. When it should really be respected and praise it. If this movie was made in our time period right now. I would be 100% sure this would of Won an Oscar for Best Animated Film. This is Studio Ghilbi's best movie they have ever released.I truly advice you to bring a handkerchief, cause chances are that you will cry.An Emotional Epic Animated Film, that I recommend everyone to watch.Quite Simply 10/10",beautiful unforgettable masterpiece that shows true cost war,i decided watch grave fireflies yesterday my friends told me it was extremely moving sad i hesitated at first but then i said oh well ill give it try at end film i was crying my eyes out this was best animated film ive ever seen this is moving depiction fates cast off children who become casualties war this movie isnt your regular animated film pixar disney put films out there with happy endings im not saying there bad films at all they are also great pieces work but grave fireflies tells you truth this movie isnt trying entertain you it wants inform you about how war is really like there were many moments movie that just brought me tears i am kind upset that this movie didnt get many awards as it should that regards it is very underrated it is kind thrown apart when it should really be respected praise it if this movie was made our time period right now i would be 100 sure this would won oscar best animated film this is studio ghilbis best movie they have ever released i truly advice you bring handkerchief cause chances are that you will cry emotional epic animated film that i recommend everyone watch quite simply 10 10,0.5860238967381824,0.3110969387755102,Positive,"{'Happy': 0.18, 'Angry': 0.0, 'Surprise': 0.31, 'Sad': 0.24, 'Fear': 0.27}"
