Rating,Review Title,Review,Cleaned Review Title,Cleaned Review,Subjectivity,Polarity,Sentiment,Emotion Scale
2.0,Hercules in New York was a pretty bad movie though the actual Schwarzenegger's voice-dubbed version was the most interesting of the two,"With today the day Maria Shriver officially files for divorce from Arnold Schwarzenegger (serves him right too since he betrayed her by cheating on her with the maid and had a baby with her, to boot!), I thought I'd watch the former Governator's first movie that he made way back in 1969-Hercules in New York. I saw two versions: the first that I watched on Hulu had no music score and Arnold's voice was badly dubbed by another though compared to his real one, you could hear each word clearly and the second one I saw on YouTube which had his accented voice not always easy to understand (which made his confused mix-up on ""bucks"" and ""dough"" with ""bucs"" and ""doe"" not as funny) though it had a good Greek-like score. The rating for the first version is above while the other take gets a 4 from me. Arnold is credited as Arnold Strong since, I guess, his co-star happens to be Arnold Stang. Stang is such a one-of-a-kind presence that he brightens most scenes he's in. The only other player I recognized was James Karen who I knew from Poltergeist as well from a guest spot on ""The Golden Girls"". By the way, when Stang died in December '09, I couldn't help but think of his other roles like the voice of Herman the mouse in those Herman and Katnip cartoons, his role as Frank Sinatra's friend in The Man with the Golden Arm, and his recent roles in ""The Cosby Show"" and Dennis the Menace. Oh, and while I knew one player couldn't be John Candy since this guy was much older but Abe Holiday on that dock sure looked like him. So on that note, Hercules in New York is interesting for the early role of Mr. Schwarzenegger, not to mention his thick accent, and not much else though one can't completely hate a movie where Hercules fights an obviously bear-suited man. P.S. It was disappointing to hear that dubbed actor again instead of Arnold on the radio at the end of the second version especially since it was much softer this time around.",hercules new york was pretty bad movie though actual schwarzeneggers voice dubbed version was most interesting two,with today day maria shriver officially files divorce arnold schwarzenegger serves him right too since he betrayed her by cheating her with maid had baby with her boot i thought id watch former governators first movie that he made way back 1969 hercules new york i saw two versions first that i watched hulu had no music score arnolds voice was badly dubbed by another though compared his real one you could hear each word clearly second one i saw youtube which had his accented voice not always easy understand which made his confused mix up bucks dough with bucs doe not as funny though it had good greek like score rating first version is above while other take gets 4 me arnold is credited as arnold strong since i guess his co star happens be arnold stang stang is such one kind presence that he brightens most scenes hes only other player i recognized was james karen who i knew poltergeist as well guest spot golden girls by way when stang died december 09 i couldnt help but think his other roles like voice herman mouse those herman katnip cartoons his role as frank sinatras friend man with golden arm his recent roles cosby show dennis menace oh while i knew one player couldnt be john candy since this guy was much older but abe holiday that dock sure looked like him so that note hercules new york is interesting early role mr schwarzenegger not mention his thick accent not much else though one cant completely hate movie where hercules fights obviously bear suited man p s it was disappointing hear that dubbed actor again instead arnold radio at end second version especially since it was much softer this time around,0.47546897546897543,0.08485083756822889,Positive,"{'Happy': 0.15, 'Angry': 0.06, 'Surprise': 0.23, 'Sad': 0.29, 'Fear': 0.27}"
10.0,Sporty,I like the bit when he throws the javelin really far,sporty,i like bit when he throws javelin really far,1.0,0.1,Positive,"{'Happy': 0.0, 'Angry': 0.0, 'Surprise': 0.5, 'Sad': 0.0, 'Fear': 0.5}"
1.0,Herc and Pretzie Forever,This film is God-awful and as goofy as they get. Be glad that Arnie's career survived it! It's one of those rare movies that are so bad that they gain something from it. I love the ridiculous scenes where Hercules picks fights for no reason which adds to any campy fun that might be had. And Pretzie has to be the weakest lamest film buddy/costar ever put on film. Everyone has to see this movie at least once. I found the DVD in a bargain bin and now own it. For a few bucks its worth helping to complete an Arnold fan's collection. One warning: hopefully you won't get the movie's soundtrack stuck in your head because it can drive you insane. Enjoy!,herc pretzie forever,this film is god awful as goofy as they get be glad that arnies career survived it its one those rare movies that are so bad that they gain something it i love ridiculous scenes where hercules picks fights no reason which adds any campy fun that might be had pretzie has be weakest lamest film buddy costar ever put film everyone has see this movie at least once i found dvd bargain bin now own it few bucks its worth helping complete arnold fans collection one warning hopefully you wont get movies soundtrack stuck your head because it can drive you insane enjoy,0.6577777777777777,-0.0022222222222222144,Negative,"{'Happy': 0.21, 'Angry': 0.05, 'Surprise': 0.21, 'Sad': 0.26, 'Fear': 0.26}"
5.0,An Awkward Children's Movie,"As a child, I have seen movies that really grab the viewer's attention and have lovable characters that make a lasting impression. Children's movies like Gumby: The Movie (1995), Thomas and the Magic Railroad (2000), and Space Jam (1996) all have the things a child could ask for. As for Hercules in New York, the film definitely made a lasting impression but on the weird side of things. Sponsored by the Tooniversal Company, this piece of cinema is fun to watch for nostalgia purposes only.This is Arnold Schwarzenegger's first film debut as the man who is part god, and part human. The story starts off when he is up in Olympus where he wants to be sent down to Earth because he is tired of hanging around with the Gods. So he argues with his father Zeus, who gets so livid that he sends him down to New York. Wait a minute, Zeus didn't want Hercules mingling with humans, so why was he sent down to New York in the first place? Why was there even an argument? Whatever.Along with Schwarzenegger is Arnold Stang, who plays a character called Pretzie, a wimpy man who carries a basket of pretzels in the first part of the film that he's seen. From there, he no longer holds a bag of pretzels, what a surprise. I will say, the actors picked for the roles of each character were picked accurately, but I'm not saying their acting is good. Stang plays as good wimpy character, and is funny to see his eyes bulge. Even Schwarzenegger is good as Hercules, but that's because of his physique and I assume that's really all he needed. That is one of the nostalgic points in this movie; Schwarzenegger's muscles. It's amazing to see how big he really was in the 70s. The other part that is nostalgic about this film is to see what SOME of New York looked like back then, but that's about all the viewer will get.What makes this movie so awkward are how the scenes are done. There are moments where Hercules is supposed to be doing something extraordinary. Instead what he does looks cheaply done and the sound effects don't help. Hercules knocks (more like love-taps) a man into a bay, and the splashing water makes it sound like a pebble was tossed. What? Who would have thought these brutes were made of confetti? There's even a scene where Hercules fights a bear. Yes a bear, and it doesn't even look like a bear. The viewer will be able to tell that this is not a bear, but a person inside a bear suit. To make matters worse, Hercules attacks the bear by slapping it; yes slapping it. Schwarzenegger slapping? It's really ridiculous to see The Terminator (1984) beat up a bear so poorly. As for the damsel in distress, Deborah Loomis, I have never heard so much screaming, almost as much as Kirsten Dunst in Spiderman (2002), if not more. My ears were ringing after hearing her. She even faints in once scene, and it didn't even look real. As for the music, which was composed by John Balamos, is not a whole lot better. I can't even tell what kind of instrument is used but it's not an orchestra I'll say that much. A lot of the music is the same and it sounds really corny. I'm really surprised Schwarzenegger has become such a box office hit by starting from this movie. This film obviously did not get him famous but if he had not auditioned for the role, we may not have any of the Terminator movies or Total Recall (1990), whatever. When the film finished, I was barely entertained and shocked to how bad the film was compared to its trailer. What shocks me even more is that the director of this film is still making movies today!Hercules in New York is a very silly kid's movie that may not even entertain the smallest of ages. Much of the scenes in this film are stupid and the only thing that may catch the viewer's attention is Arnold Schwarzenegger's bulging biceps.",awkward childrens movie,as child i have seen movies that really grab viewers attention have lovable characters that make lasting impression childrens movies like gumby movie 1995 thomas magic railroad 2000 space jam 1996 all have things child could ask as hercules new york film definitely made lasting impression but weird side things sponsored by tooniversal company this piece cinema is fun watch nostalgia purposes only this is arnold schwarzeneggers first film debut as man who is part god part human story starts off when he is up olympus where he wants be sent down earth because he is tired hanging around with gods so he argues with his father zeus who gets so livid that he sends him down new york wait minute zeus didnt want hercules mingling with humans so why was he sent down new york first place why was there even argument whatever along with schwarzenegger is arnold stang who plays character called pretzie wimpy man who carries basket pretzels first part film that hes seen there he no longer holds bag pretzels what surprise i will say actors picked roles each character were picked accurately but im not saying their acting is good stang plays as good wimpy character is funny see his eyes bulge even schwarzenegger is good as hercules but thats because his physique i assume thats really all he needed that is one nostalgic points this movie schwarzeneggers muscles its amazing see how big he really was 70s other part that is nostalgic about this film is see what some new york looked like back then but thats about all viewer will get what makes this movie so awkward are how scenes are done there are moments where hercules is supposed be doing something extraordinary instead what he does looks cheaply done sound effects dont help hercules knocks more like love taps man into bay splashing water makes it sound like pebble was tossed what who would have thought these brutes were made confetti theres even scene where hercules fights bear yes bear it doesnt even look like bear viewer will be able tell that this is not bear but person inside bear suit make matters worse hercules attacks bear by slapping it yes slapping it schwarzenegger slapping its really ridiculous see terminator 1984 beat up bear so poorly as damsel distress deborah loomis i have never heard so much screaming almost as much as kirsten dunst spiderman 2002 if not more my ears were ringing after hearing her she even faints once scene it didnt even look real as music which was composed by john balamos is not whole lot better i cant even tell what kind instrument is used but its not orchestra ill say that much lot music is same it sounds really corny im really surprised schwarzenegger has become such box office hit by starting this movie this film obviously did not get him famous but if he had not auditioned role we may not have any terminator movies or total recall 1990 whatever when film finished i was barely entertained shocked how bad film was compared its trailer what shocks me even more is that director this film is still making movies today hercules new york is very silly kids movie that may not even entertain smallest ages much scenes this film are stupid only thing that may catch viewers attention is arnold schwarzeneggers bulging biceps,0.5218161343161342,0.06540745290745291,Positive,"{'Happy': 0.08, 'Angry': 0.04, 'Surprise': 0.33, 'Sad': 0.33, 'Fear': 0.22}"
2.0,Hercules has massive cleavage,"I've only seen a shoddy German dub of this prize pony but I guess the idea remains the same. Hercules is tired of laying around in Greece all the time speaking German and takes a trip to New York. A guy that vaguely looks like Woody Allen takes him under his wings and they get into oh so lighthearted adventures. To be frank I expected more ass-kicking from Ahnuld. He barely ever gets into fights and when he does he really just pushes the bad guys around a little, probably because the production values are low and they couldn't get those cool sound effects you get after punches(that go ""doosh"" and stuff). To give you an idea of the massive thought put into this movie,the script called for a bear and the director had a brilliant idea, putting some hobo in a bear suit bought from some guy's trunk. Luckily our hero Hercules is on the spot real quick to not punch the,ah well I'm in a good mood,bear. Meanwhile the not so pretty love interest is screaming her lungs out dead afraid of this short, skinny bear that has been standing on two legs for ages. Another action scene breaks out when Hercules joins a contest that should determine who the strongest man in the world is. And of all the ways that can pop up in your head, they go for the very lame idea of just lifting three different weights. I was at least expecting some wrestling or so but no, just lifting stupid weights. And if his opponent can lift 1000 pounds, why the hell did it already take the guy so much effort to lift 500? All these comical misadventures (there's more,but I can't work up the courage) are constantly interrupted by scenes of Zeus sitting in the director's back yard, I mean uhm, Greece. Yeah that's what I meant. This movie is even too stupid for my taste.",hercules has massive cleavage,ive only seen shoddy german dub this prize pony but i guess idea remains same hercules is tired laying around greece all time speaking german takes trip new york guy that vaguely looks like woody allen takes him under his wings they get into oh so lighthearted adventures be frank i expected more ass kicking ahnuld he barely ever gets into fights when he does he really just pushes bad guys around little probably because production values are low they couldnt get those cool sound effects you get after punches that go doosh stuff give you idea massive thought put into this movie script called bear director had brilliant idea putting some hobo bear suit bought some guys trunk luckily our hero hercules is spot real quick not punch ah well im good mood bear meanwhile not so pretty love interest is screaming her lungs out dead afraid this short skinny bear that has been standing two legs ages another action scene breaks out when hercules joins contest that should determine who strongest man world is all ways that can pop up your head they go very lame idea just lifting three different weights i was at least expecting some wrestling or so but no just lifting stupid weights if his opponent can lift 1000 pounds why hell did it already take guy so much effort lift 500 all these comical misadventures theres more but i cant work up courage are constantly interrupted by scenes zeus sitting directors back yard i mean uhm greece yeah thats what i meant this movie is even too stupid my taste,0.5543844696969698,0.006742424242424258,Positive,"{'Happy': 0.19, 'Angry': 0.07, 'Surprise': 0.19, 'Sad': 0.25, 'Fear': 0.3}"
10.0,"Magnificently bad, a work of art","The tag 'it's so bad, it's good' is banded around too much but this is one film which truly embodies that sentiment. From a serious cinematic view it's appalling in every category, but at the same time it may be the funniest film ever made because of it. I watched it on recommendation recently and it had me stitches. There's so much to laugh at and so many hilariously stupid sequences that this is required and essential viewing for anyone. Regardless of whether the comedy is intentional or not, it's one of the most entertaining films ever.p.s If you thought Arnie was bad in the 80's and 90's you should see him here. He's clearly trying his hardest, but he's so bad it makes you wonder if it's deliberate. I've seen slabs of concrete with better acting skills than this.",magnificently bad work art,tag its so bad its good is banded around too much but this is one film which truly embodies that sentiment serious cinematic view its appalling every category but at same time it may be funniest film ever made because it i watched it recommendation recently it had me stitches theres so much laugh at so many hilariously stupid sequences that this is required essential viewing anyone regardless whether comedy is intentional or not its one most entertaining films ever p s if you thought arnie was bad 80s 90s you should see him here hes clearly trying his hardest but hes so bad it makes you wonder if its deliberate ive seen slabs concrete with better acting skills than this,0.4541666666666666,-0.037878787878787866,Negative,"{'Happy': 0.1, 'Angry': 0.0, 'Surprise': 0.35, 'Sad': 0.35, 'Fear': 0.2}"
5.0,So Bad...It's Spaghetti!,"Having met his mother while on vacation, Zeus fathered the mighty Hercules (played here by Arnold Schwartzenegger as Arnold Strong aka Mr Universe, though, with a more tolerable voiceover for American audiences), who gives him nothing but trouble up on Mount Olympus.So he smites him into the sea on Earth, where he is picked up by a ship from America.They bring him into New York, where they try to force him to work in the port...but all they get are knuckle sandwhiches.After fighting his way to freedom, he tries to steal a chariot (in the form of a forklift), before being whisked away by, Pretzy, a local bagel and pretzel hustler.He takes Hercules to Central Park, where he exhibits a number of feats of strength- showing up anyone who dare challenge him.A college recruiter has his eye on Hercules, and invites him over for drinks, where he becomes infatuated with his daughter.Inevitably, he gets into a fight with her boyfriend, and wins himself a chance to take her out.They go for a carriage ride in Cenral Park, just as a grizzly bear escapes from the zoo.So, of course, he fights and subdues the beast...which is actually just a dude in a poorly designed bear costume.The newspapers pick up on the story, so to exploit his newfound fame...they throw him into the (American) wrestling ring.The mafia sees this and strongarms their way in to ""sign him"" so that they can cash in off his back.Zeus, however, feels this brings him shame, and thus seeks to punish him further.But the Goddesses of Olympus intervene in his favour.So Mercury is sent to bring him back to the realm of the Gods.Hercules, meanwhile, is living the tourist life...checking out the sights, sounds and tastes of the big apple.Thus, when Mercury comes to fetch him, he refuses to return, as he's become accustomed to his new life on Earth.Now, he risks the almighty wrath of Zeus' rage.Zeus plans to send Hercules to hell with Pluto for 100 years as punishment, but Juno overrules him and tells his interlopers to leave Hercules down on Earth- where she plans to render him fully mortal...while sending Pluto to murder him.But Pluto doesn't like to murder, so he concocts a scheme instead.Knowing Hercules is set to face off against Monstro the Magnificent in a weightlifting competition on a tv variety show, while backed by the mafia, Pluto sets him up to take the fall, after placing a large bet against him.Cue the chariot chase...and let hilarity ensue...No divine intervation required (ok, well...maybe a little).An absolute cheesefest from start to finish.So bad...it's spaghetti!!!5.5 out of 10.",so bad its spaghetti,having met his mother while vacation zeus fathered mighty hercules played here by arnold schwartzenegger as arnold strong aka mr universe though with more tolerable voiceover american audiences who gives him nothing but trouble up mount olympus so he smites him into sea earth where he is picked up by ship america they bring him into new york where they try force him work port but all they get are knuckle sandwhiches after fighting his way freedom he tries steal chariot form forklift before being whisked away by pretzy local bagel pretzel hustler he takes hercules central park where he exhibits number feats strength showing up anyone who dare challenge him college recruiter has his eye hercules invites him over drinks where he becomes infatuated with his daughter inevitably he gets into fight with her boyfriend wins himself chance take her out they go carriage ride cenral park just as grizzly bear escapes zoo so course he fights subdues beast which is actually just dude poorly designed bear costume newspapers pick up story so exploit his newfound fame they throw him into american wrestling ring mafia sees this strongarms their way sign him so that they can cash off his back zeus however feels this brings him shame thus seeks punish him further but goddesses olympus intervene his favour so mercury is sent bring him back realm gods hercules meanwhile is living tourist life checking out sights sounds tastes big apple thus when mercury comes fetch him he refuses return as hes become accustomed his new life earth now he risks almighty wrath zeus rage zeus plans send hercules hell with pluto 100 years as punishment but juno overrules him tells his interlopers leave hercules down earth where she plans render him fully mortal while sending pluto murder him but pluto doesnt like murder so he concocts scheme instead knowing hercules is set face off against monstro magnificent weightlifting competition tv variety show while backed by mafia pluto sets him up take fall after placing large bet against him cue chariot chase let hilarity ensue no divine intervation required ok well maybe little absolute cheesefest start finish so bad its spaghetti 5 5 out 10,0.41225778190063894,0.04204609874252731,Positive,"{'Happy': 0.08, 'Angry': 0.02, 'Surprise': 0.2, 'Sad': 0.25, 'Fear': 0.45}"
2.0,"Good Idea, Bad Movie","There ought to be a very good movie available out of the gods being alive in the Twentieth Century (And not just those of the Greeks, but ALL of them), but this ain't it. This one is played out like a high school play with bad dialogue and some bad interpretations of the myths. Arnold could be a fair Hercules, but not then, and obviously not now. The actors playing the gods have no idea of the characters they are trying to play; I would have thought the Olympians to have kept up with the times. The music is also lousy and the plot is quite ridiculous as it goes no where. It merely circles Hercules confusion and disenchantment with modern civilization. Lets face it, Vanna White in ""Goddess of Love"" looks like Emmy material compared to this.",good idea bad movie,there ought be very good movie available out gods being alive twentieth century not just those greeks but all them but this aint it this one is played out like high school play with bad dialogue some bad interpretations myths arnold could be fair hercules but not then obviously not now actors playing gods have no idea characters they are trying play i would have thought olympians have kept up with times music is also lousy plot is quite ridiculous as it goes no where it merely circles hercules confusion disenchantment with modern civilization lets face it vanna white goddess love looks like emmy material compared this,0.5637500000000001,0.014791666666666689,Positive,"{'Happy': 0.13, 'Angry': 0.04, 'Surprise': 0.17, 'Sad': 0.17, 'Fear': 0.48}"
