Rating,Review Title,Review,Cleaned Review Title,Cleaned Review,Subjectivity,Polarity,Sentiment,Emotion Scale
10.0,The funniest movie of all time!,"Arnold Schwarzenegger. Way before he was Governor of California. Way before he was the Terminator. Before Conan. And yes, even before Pumping Iron. As a matter of fact, this was even before Arnold won a single Mr. Olympia, and was still only Mr. Universe. Arnold, age 23, is Hercules. In fact, he isn't credited as Arnold Schwarzenegger, but as ""Arnold Strong"". This movie, intentional or not, is one of the funniest, if not THE funniest movie of all time. The movie is extremely low budget, has horrendous acting, mind-blowingly sub-par special effects (even by the standards of 1970), and an overly-redundant soundtrack. Let's take a closer look.Hercules is bored with life on Mt. Olympus. The movie starts off with Hercules complaining to Zeus, and telling him that he wants to leave. After a few minutes of back and forth arguing, Zeus gets angry enough at Hercules to throw one of his lightning bolts (which look like they were welded together in a junk-yard) at him, and in a puff of smoke (cheap special effects) he disappears. Turns out he has fallen to earth, somewhere in the middle of the ocean. On his way down, he passes by an airplane, on which an extremely crazy lady with a funny voice and an even funnier hat sees him as she looks out the window, and has a fit.Here, he is picked up by a freighter, and tells the captain that ""no man is superior to Hercules"". He spends the rest of the voyage picking fights with the crew for no apparent reason. It is during this scene that John Candy makes his first ever (uncredited) appearance in his movie career. When the ship reaches New York, Hercules goes ashore, and is attacked by a group of hobos, who he takes care of with a wooden plank. This is where he meets ""Pretzi"", played by Arnold Stang. They hitch a cab ride, only to find out that Hercules has no money, because ""Hercules needs no money"". The cabbie tries to beat up Herc, who yells the hilarious line of ""HOW DARE YOU TOUCH HERCULES!"", throws him in the bushes, and flips over his taxi.Herc and Pretzi run off, and somehow end up in a playing field with college students training in discus, javelin, and far jump. Herc says ""Zoze men don't ssrow it faaar enuff"" and proceeds to humiliate the college students in all events. One hilarious part is when he takes his shirt off and does a titty-dance before throwing the javelin.After this, Herc and Pretzi are invited to a college professor's house and are sitting in the living room with his smoking-hot daughter (Deborah Loomis). At this point, her friend comes in, and after an exchange of words, he punches Herc in the gut, to which he replies ""YOU have strucked Hercules!"" and hoists the young man into the air.Hercules and the hottie end up dating. It is during their first date that they encounter an ""escaped bear from the zoo"", which is actually (quite conspicuously) a man in a bear costume. Herc pounds the bear into submission, with his girlfriend screaming in the background. This scene has to be one of the funniest in cinematic history. During one of their outings, Herc sees a poster of a Hercules movie, and in his outrage rips off his shirt in the middle of the street, starts posing, and demands to know ""who gave zees imperzonator permission to imitate Herkooles!"" Before long, Herc becomes a wrestler. Long story short, Pretzi is threatened by the mob to sign Herc over to them, and he does as he is told. Eventually, Herc goes up against ""Monstro the Magnificent"" in a weightlifting match, which he loses because Juno took away his powers. He gets jumped by the mob, and then its Atlas and Samson (yes, the biblical Samson) to the rescue. In the end, Herc goes back to Mt. Olympus.For one to fully appreciate this movie, it must be watched with Arnold's real voice, although the dubbed version is great for laughs too. This movie is an absolute jewel. It is so horrible that it's great. It has an innocent charm to it as well, and one can't help but love it. Arnold's acting is virtually nonexistent, and he exhibits less emotion than when he played the Terminator. This is balanced out by Arnold Stang's constant over-acting. Deborah Loomis is smoking-hot, but her acting skills are below average. Hell, everyone's acting in this movie is below-average. This movie contains literally dozens of hilarious one-liners by Arnold. The Mt. Olympus scenes are all filmed in Central Park, and traffic can be heard in the background. You know what? I'm just going to stop here. There are too many hilarious things to list. Go watch it!",funniest movie all time,arnold schwarzenegger way before he was governor california way before he was terminator before conan yes even before pumping iron as matter fact this was even before arnold won single mr olympia was still only mr universe arnold age 23 is hercules fact he isnt credited as arnold schwarzenegger but as arnold strong this movie intentional or not is one funniest if not funniest movie all time movie is extremely low budget has horrendous acting mind blowingly sub par special effects even by standards 1970 overly redundant soundtrack lets take closer look hercules is bored with life mt olympus movie starts off with hercules complaining zeus telling him that he wants leave after few minutes back forth arguing zeus gets angry enough at hercules throw one his lightning bolts which look like they were welded together junk yard at him puff smoke cheap special effects he disappears turns out he has fallen earth somewhere middle ocean his way down he passes by airplane which extremely crazy lady with funny voice even funnier hat sees him as she looks out window has fit here he is picked up by freighter tells captain that no man is superior hercules he spends rest voyage picking fights with crew no apparent reason it is during this scene that john candy makes his first ever uncredited appearance his movie career when ship reaches new york hercules goes ashore is attacked by group hobos who he takes care with wooden plank this is where he meets pretzi played by arnold stang they hitch cab ride only find out that hercules has no money because hercules needs no money cabbie tries beat up herc who yells hilarious line how dare you touch hercules throws him bushes flips over his taxi herc pretzi run off somehow end up playing field with college students training discus javelin far jump herc says zoze men dont ssrow it faaar enuff proceeds humiliate college students all events one hilarious part is when he takes his shirt off does titty dance before throwing javelin after this herc pretzi are invited college professors house are sitting living room with his smoking hot daughter deborah loomis at this point her friend comes after exchange words he punches herc gut which he replies you have strucked hercules hoists young man into air hercules hottie end up dating it is during their first date that they encounter escaped bear zoo which is actually quite conspicuously man bear costume herc pounds bear into submission with his girlfriend screaming background this scene has be one funniest cinematic history during one their outings herc sees poster hercules movie his outrage rips off his shirt middle street starts posing demands know who gave zees imperzonator permission imitate herkooles before long herc becomes wrestler long story short pretzi is threatened by mob sign herc over them he does as he is told eventually herc goes up against monstro magnificent weightlifting match which he loses because juno took away his powers he gets jumped by mob then its atlas samson yes biblical samson rescue end herc goes back mt olympus one fully appreciate this movie it must be watched with arnolds real voice although dubbed version is great laughs too this movie is absolute jewel it is so horrible that its great it has innocent charm it as well one cant help but love it arnolds acting is virtually nonexistent he exhibits less emotion than when he played terminator this is balanced out by arnold stangs constant over acting deborah loomis is smoking hot but her acting skills are below average hell everyones acting this movie is below average this movie contains literally dozens hilarious one liners by arnold mt olympus scenes are all filmed central park traffic can be heard background you know what im just going stop here there are too many hilarious things list go watch it,0.48226737420285803,0.10831180468277242,Positive,"{'Happy': 0.11, 'Angry': 0.12, 'Surprise': 0.24, 'Sad': 0.21, 'Fear': 0.32}"
1.0,"""How dare you strike Hercules""","If I feel down, all I need to do is think of Arnie fighting the grizzly bear in Hercules in New York and it cracks me up. The grizzly bear is actually just some big guy wearing a Halloween costume, he even moves like a human. But thats not the silliest scene. Arnold also fights a group of sailors with a plank and throws them in the sea, the sound effects and horrible choreography in that scene is hilarious. I've got the version of this movie with Arnies real voice, and just hearing that makes this movie worth getting. But Arnold is not the worst actor in this movie, his partner, Arnold Stang is much worse. The Mafia is even this movie, well, three guys...played by actors who probably auditioned for The Godfather but didn't make it. Yeeeaaahhhh....The ""brilliant"" theme song in this movie is played about 500 times.I would give this movie a one, but it made me laugh...so I guess it deserves a 2. Hoo-Ya.",how dare you strike hercules,if i feel down all i need do is think arnie fighting grizzly bear hercules new york it cracks me up grizzly bear is actually just some big guy wearing halloween costume he even moves like human but thats not silliest scene arnold also fights group sailors with plank throws them sea sound effects horrible choreography that scene is hilarious ive got version this movie with arnies real voice just hearing that makes this movie worth getting but arnold is not worst actor this movie his partner arnold stang is much worse mafia is even this movie well three guys played by actors who probably auditioned godfather but didnt make it yeeeaaahhhh brilliant theme song this movie is played about 500 times i would give this movie one but it made me laugh so i guess it deserves 2 hoo ya,0.4673881673881674,0.12005772005772006,Positive,"{'Happy': 0.07, 'Angry': 0.0, 'Surprise': 0.24, 'Sad': 0.34, 'Fear': 0.34}"
1.0,The horror...,"This is one of the worst movies of all time. The four-hundred-and-something witless souls who awarded this a 10 should be permanently banned from voting.Forget that it was made on a shoe-string budget, and that at one point Arnold fights the worst bear costume in movie history; forget that he takes his shirt off in every other scene, often with zero motivation; forget that the Mount Olympus scenes are obviously shot in New York; forget even that the acting is of such monumental ineptitude that James Karen (one of the worst actors in ""Return of the Living Dead"") is far and away the finest thespian in sight. The fact that anybody invested as much as a nickel in a script that one monkey working for one hour could easily have done better is what really blows my mind. The premise is painfully stupid, and the execution of it is as heavy-handed and amateurish as anything you're likely to see. Most porn movies are produced with more consideration for plot.I recommend ""Hercules in New York"" to anyone who likes to go to the dentist or enjoys a hard punch in the nose. This is an hour and a half of pure agony.",horror,this is one worst movies all time four hundred something witless souls who awarded this 10 should be permanently banned voting forget that it was made shoe string budget that at one point arnold fights worst bear costume movie history forget that he takes his shirt off every other scene often with zero motivation forget that mount olympus scenes are obviously shot new york forget even that acting is such monumental ineptitude that james karen one worst actors return living dead is far away finest thespian sight fact that anybody invested as much as nickel script that one monkey working one hour could easily have done better is what really blows my mind premise is painfully stupid execution it is as heavy handed amateurish as anything youre likely see most porn movies are produced with more consideration plot i recommend hercules new york anyone who likes go dentist or enjoys hard punch nose this is hour half pure agony,0.5570303030303031,-0.0925194805194805,Negative,"{'Happy': 0.03, 'Angry': 0.17, 'Surprise': 0.29, 'Sad': 0.31, 'Fear': 0.2}"
10.0,What a pumped up movie!,"I love it! Hercules in New York was the best laugh I've had in a long time! Reminds me of something my sister and I would have done with our old video camera. If you're in the mood for 100% cheese, this is your movie. Who directed this? Ed Wood?",what pumped up movie,i love it hercules new york was best laugh ive had long time reminds me something my sister i would have done with our old video camera if youre mood 100 cheese this is your movie who directed this ed wood,0.34242424242424246,0.33106060606060606,Positive,"{'Happy': 0.14, 'Angry': 0.0, 'Surprise': 0.14, 'Sad': 0.14, 'Fear': 0.57}"
8.0,A hilariously horrendous hoot and a half,"Legendary petulant strongman Hercules (an uproariously atrocious performance by Arnold Schwarzenneger in his first lead role) gets bored with Mount Olympus, so the cranky Zeus (essayed with eye-rolling hammy gusto by Ernest Graves) sends the powerful demi-god to Earth where he winds up in New York City. While in the Big Apple Hercules befriends excitable squirt Pretzie (a lively and funny portrayal by Arnold Stang, who's the best actor in the whole flick), becomes both a wrestler and a body builder, and mixes it up with a stereotypical bunch of no-count Italian Mafia types. Director Arthur Seidelman, working from a blithely inane script Aubrey Wisberg, relates the gloriously ludicrous story at a zippy pace and pitches all the dopey humor at an appropriately broad level. Gut-busting campy highlights include Arnold beating folks up as often as possible, Hercules overturning a cab because he has no money to pay the fare, Hercules duking it out with a bear that's obviously some poor zhlub in an unconvincing moth-eaten suit, a televised weightlifting competition with the boom mic constantly dipping into the frame, Hercules commandeering a chariot, and the priceless ending with Zeus coming to Earth as a Hasidic Jew (!). Arnold's extremely poor and frequently borderline incomprehensible elocution, the chintzy (far from) special effects (Zeus' thunder bolts look like they are made out of plastic), John Balamos' infectiously goofy'n'giddy Italian music score, and the sequences on Mount Olympus that were clearly shot in Central Park (you can even hear traffic noises in the background!) all further enhance the considerable hilarity of this absolutely sidesplitting cruddy riot.",hilariously horrendous hoot half,legendary petulant strongman hercules uproariously atrocious performance by arnold schwarzenneger his first lead role gets bored with mount olympus so cranky zeus essayed with eye rolling hammy gusto by ernest graves sends powerful demi god earth where he winds up new york city while big apple hercules befriends excitable squirt pretzie lively funny portrayal by arnold stang whos best actor whole flick becomes both wrestler body builder mixes it up with stereotypical bunch no count italian mafia types director arthur seidelman working blithely inane script aubrey wisberg relates gloriously ludicrous story at zippy pace pitches all dopey humor at appropriately broad level gut busting campy highlights include arnold beating folks up as often as possible hercules overturning cab because he has no money pay fare hercules duking it out with bear thats obviously some poor zhlub unconvincing moth eaten suit televised weightlifting competition with boom mic constantly dipping into frame hercules commandeering chariot priceless ending with zeus coming earth as hasidic jew arnolds extremely poor frequently borderline incomprehensible elocution chintzy far special effects zeus thunder bolts look like they are made out plastic john balamos infectiously goofyngiddy italian music score sequences mount olympus that were clearly shot central park you can even hear traffic noises background all further enhance considerable hilarity this absolutely sidesplitting cruddy riot,0.5921013126658287,0.06739805893031703,Positive,"{'Happy': 0.16, 'Angry': 0.04, 'Surprise': 0.33, 'Sad': 0.16, 'Fear': 0.31}"
10.0,HAhahahaa...,"If you think this movie isn't worth watching, then you obviously have no sense of humor. Stop taking life so seriously and go watch ""Hercules Goes to New York."" If you can't laugh at this movie and appreciate it for the horrible piece of seventies anti-porn money at work that it is, then perhaps something along the lines of, oh, we'll say that Mariah Carey movie put out a number of years ago, or perhaps a documentary on the Exxon Valdez disaster would be more up your alley. Either way, when you die, you'll be glad you saw it at least, or more likely, at most, once. It beats being mean to people. You also get to witness firsthand the glorious age before dubbing was perfected, and hear Arnold as you've never heard him before.",hahahahaa,if you think this movie isnt worth watching then you obviously have no sense humor stop taking life so seriously go watch hercules goes new york if you cant laugh at this movie appreciate it horrible piece seventies anti porn money at work that it is then perhaps something along lines oh well say that mariah carey movie put out number years ago or perhaps documentary exxon valdez disaster would be more up your alley either way when you die youll be glad you saw it at least or more likely at most once it beats being mean people you also get witness firsthand glorious age before dubbing was perfected hear arnold as youve never heard him before,0.529193722943723,0.05646645021645021,Positive,"{'Happy': 0.09, 'Angry': 0.05, 'Surprise': 0.32, 'Sad': 0.14, 'Fear': 0.41}"
10.0,A film of staggering genius,"Don't let the awfulness of this film fool you. Arnold's first and greatest film is, in fact, one of the greatest of all time. Just as financial firms regularly turn losses into gains by multiplying their balance sheets by -1, this film uses awfulness as a deus ex machina to capture the profound depths of our mortal fallibility. Pretzie is the ultimate everyman, selling pretzels by the water and figuring out ways to nickel and dime everyone and pocket the loose book every now and then. But he gets into trouble and has moments of revelation and regret. Hercules' simplicity and god-like physique, as well as Monstro the Magnificent's lopsided hair cut, symbolize the yin and yang of life and death, bigness and smallness, truth and the GOP.The frequent unfocusing of the shot shows that mankind's mind is frequently unfocused and Arnold's partially literate accent represents the garbled marbles we often use to express the inner desires of our hearts. On a daily basis we are tempted by god-like greatness but frequently fall short of the world's expectations for our bulbous necks and mountainous pecs. Hubris is a 1000lb barbell and it kills. So we are frail, so we must crawl.Don't be a long shot plunger. We can not temporize the mighty Zeus. This film must be cherished.",film staggering genius,dont let awfulness this film fool you arnolds first greatest film is fact one greatest all time just as financial firms regularly turn losses into gains by multiplying their balance sheets by 1 this film uses awfulness as deus ex machina capture profound depths our mortal fallibility pretzie is ultimate everyman selling pretzels by water figuring out ways nickel dime everyone pocket loose book every now then but he gets into trouble has moments revelation regret hercules simplicity god like physique as well as monstro magnificents lopsided hair cut symbolize yin yang life death bigness smallness truth gop frequent unfocusing shot shows that mankinds mind is frequently unfocused arnolds partially literate accent represents garbled marbles we often use express inner desires our hearts daily basis we are tempted by god like greatness but frequently fall short worlds expectations our bulbous necks mountainous pecs hubris is 1000lb barbell it kills so we are frail so we must crawl dont be long shot plunger we can not temporize mighty zeus this film must be cherished,0.4636752136752137,0.11702279202279203,Positive,"{'Happy': 0.03, 'Angry': 0.03, 'Surprise': 0.38, 'Sad': 0.16, 'Fear': 0.41}"
2.0,We all have to start somewhere I suppose.,"Screwball comedy Hercules in New York sees a 22-year-old Arnold Schwarzenegger (billed here as Arnold Strong) making his screen debut as demigod Hercules, who visits Earth against the wishes of his father Zeus. Falling from the sky into the sea, Hercules is picked up by a ship travelling to New York, where he meets friendly pretzel salesman Pretzie (played by Arnold Stang, the voice of Hanna-Barbera's Top Cat), falls in love with professor's daughter Helen (Deborah Loomis), enters a strongman competition against bodybuilder Monstro (Tony Carroll), and upsets local mobsters in the process.Arnold Schwarzenegger's screen debut is shoddy nonsense that will test the patience of all but the most dedicated Arnie fan. The star's thick Austrian accent renders his dialogue laughable, the movie's intentional humour falls flat, and the plot is a meandering mess that feels like it was thrown together on the fly. Production values are incredibly low, most notably in the scenes set on the supposedly tranquil paradise of Mount Olympus (actually filmed in Central Park), where the props are cheap and nasty and the action is frequently interrupted by the sound of New York traffic and car horns.That said, Hercules in New York is almost worth seeing just for the hilarious sight of the future governor of California wrestling a grizzly bear (actually a man in a very unconvincing moth-eaten bear costume).Also look out for a guy who looks a lot like John Candy (the jury is still out on whether the bloke in question is actually the portly Canadian comedian in an uncredited role, but I wouldn't have blamed Candy one bit for not owning up if it was him).",we all have start somewhere i suppose,screwball comedy hercules new york sees 22 year old arnold schwarzenegger billed here as arnold strong making his screen debut as demigod hercules who visits earth against wishes his father zeus falling sky into sea hercules is picked up by ship travelling new york where he meets friendly pretzel salesman pretzie played by arnold stang voice hanna barberas top cat falls love with professors daughter helen deborah loomis enters strongman competition against bodybuilder monstro tony carroll upsets local mobsters process arnold schwarzeneggers screen debut is shoddy nonsense that will test patience all but most dedicated arnie fan stars thick austrian accent renders his dialogue laughable movies intentional humour falls flat plot is meandering mess that feels like it was thrown together fly production values are incredibly low most notably scenes set supposedly tranquil paradise mount olympus actually filmed central park where props are cheap nasty action is frequently interrupted by sound new york traffic car horns that said hercules new york is almost worth seeing just hilarious sight future governor california wrestling grizzly bear actually man very unconvincing moth eaten bear costume also look out guy who looks lot like john candy jury is still out whether bloke question is actually portly canadian comedian uncredited role but i wouldnt have blamed candy one bit not owning up if it was him,0.42125803489439856,0.13496326905417816,Positive,"{'Happy': 0.14, 'Angry': 0.03, 'Surprise': 0.22, 'Sad': 0.25, 'Fear': 0.36}"
