Rating,Review Title,Review,Cleaned Review Title,Cleaned Review,Subjectivity,Polarity,Sentiment,Emotion Scale
10.0,Every child is special,"Anyone who has rated Tare Zameen Par lower than 8 out of 10 (especially those who have given it a 1 out of 10 rating) either has not seen the movie or has a heart of stone because this was an absolute beautiful and heart touching film about a relationship between a teacher and a student. I felt really sorry for the boy Eshaan and his main problem was that he has a learning disability and is always lost in his fantasy world. The film gave a terrific insight to his fantasy world by showing spinning objects around his head and by an animated sequence. The best scene was the first appearance of Aamir Khan. I have always liked Aamir Khan's films and I would put Tare Zameen Par number 2 on his top 5 best movies & number 1 would be Lagaan. The story was very uplifting, which shows that even the worst student can become the best. It was already on the IMDb top 250 when it came out and was on about 180 place but sadly not anymore and I'm disappointed. There is a huge list of crappy films that are on the top 250 but not a single Bollywood movie and this gem is original.",every child is special,anyone who has rated tare zameen par lower than 8 out 10 especially those who have given it 1 out 10 rating either has not seen movie or has heart stone because this was absolute beautiful heart touching film about relationship between teacher student i felt really sorry boy eshaan his main problem was that he has learning disability is always lost his fantasy world film gave terrific insight his fantasy world by showing spinning objects around his head by animated sequence best scene was first appearance aamir khan i have always liked aamir khans films i would put tare zameen par number 2 his top 5 best movies number 1 would be lagaan story was very uplifting which shows that even worst student can become best it was already imdb top 250 when it came out was about 180 place but sadly not anymore im disappointed there is huge list crappy films that are top 250 but not single bollywood movie this gem is original,0.641407867494824,0.27976190476190477,Positive,"{'Happy': 0.05, 'Angry': 0.0, 'Surprise': 0.31, 'Sad': 0.31, 'Fear': 0.33}"
,Every child is special!!! (Our answer to 400 Blows),"(I notice that there are many spoilers here already,therefore I wont go much into the plot detail)There seems to be an implied understanding that Aamir Khan represents the last word on intellectual mainstream cinema.It was many years back when he decided to curtail the number of projects he takes up in an year which was considered suicidal then but now is the norm for most of the top stars.For last 14 years this man has pushed the envelope for mainstream by taking some unprecedented risks with young directors and pulling it off time and time again.For some of us who have followed his career choices,there was a feeling that he would make a great director.His choices of films are a testimony to his understanding of the medium and the audience within the mainstream perspective.""Taare Zameen Par"" is his first directorial venture,less by design and more by circumstances.Based on the brilliant script by Amol Gupte who is one of the innovative painters and theater personalities,the story dwells into the life of boy struggling to find himself in this ruthless world.Briefly,the boy ""Ishan"" who suffers from dyslexia comes from a middle class Indian family who is unable to read/learn or identify letters.Constantly bombarded with unrelenting taunts for his poor academics and being labeled as a ""duffer"",he is isolated into his world of colors which is the only place he can seek solace in.But Ishan reaches a new low when he is packed off to boarding school by his father.The hard regimen and discipline of the school frustrates the boy out of his wits and he is finding drastic ways to put an end to his misery.He no longer feels th need to communicate .Just when things seem irrevocable,comes the art teacher,Aamir Khan,who being a dyslexic himself and working with the ""less privileged"" children identifies Ishan's troubles and can read through his silence,is sanitized by the apathy towards him.Then starts the process of resurrecting the boy's dying self belief and charting out a way for him to read and learn.The boy starts to slowly but surely come out of his shell and become a ""child"" again.One of the many aspects of a perfect film is that nothing seems to stand out,every aspect whether it be the performances,the camera work,the sound mixing,the lighting,the editing etc everything seems in sync.Same can be said about this movie.But the thing that I found overwhelming as a viewer is the music by ""Shankar""-Ehsaan-Loy"" and the lyrics by ""Prasoon Joshi"".Watch out for ""taare zameen par"",""Meri Maa"",these will definitely break you down.The cinematography by Setu is flawless and Aamir does not fall into the trap of being slick or showing off in his debut effort.(Watch how the camera is usually at Ishan's height to show his perspective,watch how slowly the camera pans into Ishan's space and how still and focused it is on his face when he is about to bare his emotions) The performances are top draw.Darsheel who plays Ishan is the crux of the film.Being the main protagonist his performance was critical to the film.I dare say,we have found a new star.The boy is brilliant in his joy,in his enthusiasm,in his loneliness as he allows us to enter his world.I feel he represents children all over the world and more critically the ""child"" within all of us.Of the support cast Tisca Chopra and Aamir Khan are brilliant as his mother and teacher respectively.Because the movie revolves around a middle class family in suburban Mumbai,I guess these characters and their emotions are something I can relate to.Finally(on the movie),kudos to Amol Gupte and Aamir Khan.Let us not forget this was Amol's baby and he had worked with children and done research for 7 years.What he came with was a near perfect script and it is only fair that he was credited as a creative director.What can I say about Aamir Khan that hasn't been said before?I think with every movie he is setting new yardsticks for Indian cinema.His movies clearly have elaborated that our movies can have all the commercial trappings yet need not be ""dumbed down"".They can be as intellectually stimulating.All I can say is that it is privilege to be in an era where this champion actor is at the absolute peak of his powers.With this movie he goes into the elite list of actors who happen to be great story tellers.But is this movie about dyslexia?Is this movie about the failure of our education system in not nurturing the individual talent but creating assembly line products?Are we as a society so obsessed with the ""idea"" of security through academics that creativity is of no accord to us?Are we preparing our children for a rat race or we preparing them for life?Are parents right in imposing their ambitions on the life they bring to this earth ?Some question that I have asked of myself before and some that I ask now.I guess the main motive of the film is as the tag line says ""every child is special"" for the talent he has.Our job is to nurture it,not mold it.p.s. I have been a frequent movie goer for last 7-8 years.But haven't seen a response like I did for this one.Everyone in the theater was in tears and simultaneous applause and is not because it was a sad film but it was ""overwhelming"".I guess there some part of Ishan in all of our lives.The second aspect that I have never witnessed in theaters before was that nobody moved till the credits were over.There is documentary on children at the end(do not miss it for anything,it is as moving as the film).",every child is special our answer 400 blows,i notice that there are many spoilers here already therefore i wont go much into plot detail there seems be implied understanding that aamir khan represents last word intellectual mainstream cinema it was many years back when he decided curtail number projects he takes up year which was considered suicidal then but now is norm most top stars last 14 years this man has pushed envelope mainstream by taking some unprecedented risks with young directors pulling it off time time again some us who have followed his career choices there was feeling that he would make great director his choices films are testimony his understanding medium audience within mainstream perspective taare zameen par is his first directorial venture less by design more by circumstances based brilliant script by amol gupte who is one innovative painters theater personalities story dwells into life boy struggling find himself this ruthless world briefly boy ishan who suffers dyslexia comes middle class indian family who is unable read learn or identify letters constantly bombarded with unrelenting taunts his poor academics being labeled as duffer he is isolated into his world colors which is only place he can seek solace but ishan reaches new low when he is packed off boarding school by his father hard regimen discipline school frustrates boy out his wits he is finding drastic ways put end his misery he no longer feels th need communicate just when things seem irrevocable comes art teacher aamir khan who being dyslexic himself working with less privileged children identifies ishans troubles can read through his silence is sanitized by apathy towards him then starts process resurrecting boys dying self belief charting out way him read learn boy starts slowly but surely come out his shell become child again one many aspects perfect film is that nothing seems stand out every aspect whether it be performances camera work sound mixing lighting editing etc everything seems sync same can be said about this movie but thing that i found overwhelming as viewer is music by shankar ehsaan loy lyrics by prasoon joshi watch out taare zameen par meri maa these will definitely break you down cinematography by setu is flawless aamir does not fall into trap being slick or showing off his debut effort watch how camera is usually at ishans height show his perspective watch how slowly camera pans into ishans space how still focused it is his face when he is about bare his emotions performances are top draw darsheel who plays ishan is crux film being main protagonist his performance was critical film i dare say we have found new star boy is brilliant his joy his enthusiasm his loneliness as he allows us enter his world i feel he represents children all over world more critically child within all us support cast tisca chopra aamir khan are brilliant as his mother teacher respectively because movie revolves around middle class family suburban mumbai i guess these characters their emotions are something i can relate finally movie kudos amol gupte aamir khan let us not forget this was amols baby he had worked with children done research 7 years what he came with was near perfect script it is only fair that he was credited as creative director what can i say about aamir khan that hasnt been said before i think with every movie he is setting new yardsticks indian cinema his movies clearly have elaborated that our movies can have all commercial trappings yet need not be dumbed down they can be as intellectually stimulating all i can say is that it is privilege be era where this champion actor is at absolute peak his powers with this movie he goes into elite list actors who happen be great story tellers but is this movie about dyslexia is this movie about failure our education system not nurturing individual talent but creating assembly line products are we as society so obsessed with idea security through academics that creativity is no accord us are we preparing our children rat race or we preparing them life are parents right imposing their ambitions life they bring this earth some question that i have asked myself before some that i ask now i guess main motive film is as tag line says every child is special talent he has our job is nurture it not mold it p s i have been frequent movie goer last 7 8 years but havent seen response like i did this one everyone theater was tears simultaneous applause is not because it was sad film but it was overwhelming i guess there some part ishan all our lives second aspect that i have never witnessed theaters before was that nobody moved till credits were over there is documentary children at end do not miss it anything it is as moving as film,0.5059737587515364,0.17147711684748726,Positive,"{'Happy': 0.07, 'Angry': 0.05, 'Surprise': 0.3, 'Sad': 0.22, 'Fear': 0.36}"
8.0,"""The letters are dancing.""","Over the last few weeks I've watched about a half dozen Indian movies and almost all of them star Aamir Khan and offer extended scenes of colorful song and dance numbers. Being a new film experience for me, I thought those details were worth noting, as I don't know how far that stereotype goes.The story here, though a good one for it's subject material, I thought was almost too simplistic and straightforward, as one could pretty easily figure out what the outcome would be. The learning disability that young Ishaan (Darsheel Sagary) had wasn't some big mystery, but a simple case of dyslexia. For that reason, I couldn't understand why he wasn't taken more seriously when he made the statement in my summary line above during one of his classroom experiences. It seems a perceptive teacher should have picked up on that hint long before Ram Shankar Nikumbh (Khan) came along.There's a part of me that always wants to caution about the way a certain type of message is conveyed about children. The saying that 'every child is special' bothers me somewhat, in as much as if we elevate every child to that level, then we've simply redefined what's normal. So that winds up saying that if every child is special then no child is. The better way to phrase such a concept to my mind is that every child is special to someone, and that all children have the right to every opportunity life can afford them. I don't want to give the wrong impression here. I have four grandchildren and they're all special to me, even if they're not going to be world class athletes or the next Einstein. Or maybe one of them will, who knows?With that out of the way, I have to comment on the young actor portraying Ishaan. Darsheel Safary is more talented than a lot of adult actors I've seen, and ran through an amazing arc of emotions that I simply found incredible. I really can't imagine how he pulled off some of the scenes he was required to carry. Quite amazing to my mind, enough so that I would state that in this case, he was pretty special.",letters are dancing,over last few weeks ive watched about half dozen indian movies almost all them star aamir khan offer extended scenes colorful song dance numbers being new film experience me i thought those details were worth noting as i dont know how far that stereotype goes story here though good one its subject material i thought was almost too simplistic straightforward as one could pretty easily figure out what outcome would be learning disability that young ishaan darsheel sagary had wasnt some big mystery but simple case dyslexia that reason i couldnt understand why he wasnt taken more seriously when he made statement my summary line above during one his classroom experiences it seems perceptive teacher should have picked up that hint long before ram shankar nikumbh khan came along theres part me that always wants caution about way certain type message is conveyed about children saying that every child is special bothers me somewhat as much as if we elevate every child that level then weve simply redefined whats normal so that winds up saying that if every child is special then no child is better way phrase such concept my mind is that every child is special someone that all children have right every opportunity life can afford them i dont want give wrong impression here i have four grandchildren theyre all special me even if theyre not going be world class athletes or next einstein or maybe one them will who knows with that out way i have comment young actor portraying ishaan darsheel safary is more talented than lot adult actors ive seen ran through amazing arc emotions that i simply found incredible i really cant imagine how he pulled off some scenes he was required carry quite amazing my mind enough so that i would state that this case he was pretty special,0.4887375305853566,0.18616836062488237,Positive,"{'Happy': 0.07, 'Angry': 0.0, 'Surprise': 0.37, 'Sad': 0.18, 'Fear': 0.38}"
8.0,Yet another quality movie from Bollywood...oh now this is taking me by surprise...,"Its a fine Friday morning in Kolkata...the winter vacation has just commenced...we have planned a day out...gonna watch Francis Lawrence's I Am Legend...but due to last minute change of plans under unavoidable circumstances we are reluctantly drawn into the first day first show of Taare Zameen Paar...we are a bunch of movie buffs who watch a Bollywood movie once in a blue moon...within the next 2.5 hrs our opinions had changed...After back to back hits(Rang De Basanti,Fanaa)Amir khan could well have gone for another Masala flick...but it needs guts to for debut directing such a script...and then pull it off even more brilliantly...with such maturity n sensitivity...the field is teeming with great actors making for great first time directors...(Kevin Costner,Mel Gibson,George Clooney n so many others)...but never before in Bollywood have i seen a better example of this.....the film is about a 8 year old dyslexic child Ishann who finds it difficult to read or write correctly or for that matter perform any such activities normal to children of his age...n inevitably has to bear the brunt of his parents,teachers n other people he interacts with...but his world is filled with magical creatures n thoughts that gives him company...his parents unable to realize his disorder...sends him to a boarding school where the child retreats into a self imposed exile and has to contend with the added trauma of separation from his family...in comes Amir khan the temporary art teacher who encourages them to extend their boundaries of thought and imaginations...n shows special interest in finding out the difficulty of Ishaan...with time patience and care he helps Ishaan find himself...but more than the script its the way minute emotions are captured...the way the audience is made to peer into a child's mind nd its own mechanisms...scenes are a film's USP...n though you may forget the film its the scenes that u keep embedded in your heart...n TZP is laden with powerful scenes that will give you moist eyes...there's this scene where Ishan's parents had taken him home from the boarding school...n then comes to leave him there all alone again for the 2nd time...the first time Ishaan had kept staring at his parent's car leaving...this time he turned back n walked away...while his mother kept staring back...this is Ishan's own kind of protest against his parent's unjust nd cruel decision...and to complement the film's excellent theme there's the superbly crafted n maturely executed visual effects n animation to go with it...that sketches a child's world of imagination...the camera work is brilliant...top notch performance by all the actors...Darsheel Safary steals the limelight...quite explains why Amir wanted to rush into directing this film as he was worried the child may grow up..reminds of Satyajit ray n his Apu...though emotional n dramatic everything seems utterly realistic...nd Amir's directing needs special mentioning here...the way he captures a child's world...a child's obsession of noticing minute things nd finding beauty in it...like the little fishes that inhabit the roadside pond...the water filled pothole being run over by vehicles...a mother bird feeding her children...nd with so many news of children succumbing to their parent's pressure these days...the film has come out at an apt time...it will change the whole way u look at the relationship between a parent and a child i bet...its one those films which entertains nd enlightens at the same time...stop reading it any further if you haven't yet seen it..just take your child n go watch it...but everything has its share of bad sides...though it matters little i would still like to talk about the little cons...the editing work cud have been sleeker...the film tends to drag a little in the middle...although as hard as he may have tried Amir khan is unable to break away from the shackles of orthodox Bollywood treatment...nd sum scenes are just too melodramatic...like Ishan sailing a boat he has himself designed...but probably it was to draw the traditional Bollywood audience into watching this unique movie...too many songs...though good music from Shankar Ehsan Loy on all the songs...but sum were unnecessary...that's all...it would be sacrilegious to speak ill of this film any further...u r quite adamant aren't you??i thought i told you to stop reading n go watch the movie...now go nd..enjoy the brilliant world of alphabet crabs...velvet octopuses...absurd arts...nd inverse letters...is any member of KoЯn dyslexic??...a friend of mine joked...as far as I am Legend is concerned...never mind...i'm going to watch it tomorrow...",yet another quality movie bollywood oh now this is taking me by surprise,its fine friday morning kolkata winter vacation has just commenced we have planned day out gonna watch francis lawrences i am legend but due last minute change plans under unavoidable circumstances we are reluctantly drawn into first day first show taare zameen paar we are bunch movie buffs who watch bollywood movie once blue moon within next 2 5 hrs our opinions had changed after back back hits rang de basanti fanaa amir khan could well have gone another masala flick but it needs guts debut directing such script then pull it off even more brilliantly with such maturity n sensitivity field is teeming with great actors making great first time directors kevin costner mel gibson george clooney n so many others but never before bollywood have i seen better example this film is about 8 year old dyslexic child ishann who finds it difficult read or write correctly or that matter perform any such activities normal children his age n inevitably has bear brunt his parents teachers n other people he interacts with but his world is filled with magical creatures n thoughts that gives him company his parents unable realize his disorder sends him boarding school where child retreats into self imposed exile has contend with added trauma separation his family comes amir khan temporary art teacher who encourages them extend their boundaries thought imaginations n shows special interest finding out difficulty ishaan with time patience care he helps ishaan find himself but more than script its way minute emotions are captured way audience is made peer into childs mind nd its own mechanisms scenes are films usp n though you may forget film its scenes that u keep embedded your heart n tzp is laden with powerful scenes that will give you moist eyes theres this scene where ishans parents had taken him home boarding school n then comes leave him there all alone again 2nd time first time ishaan had kept staring at his parents car leaving this time he turned back n walked away while his mother kept staring back this is ishans own kind protest against his parents unjust nd cruel decision complement films excellent theme theres superbly crafted n maturely executed visual effects n animation go with it that sketches childs world imagination camera work is brilliant top notch performance by all actors darsheel safary steals limelight quite explains why amir wanted rush into directing this film as he was worried child may grow up reminds satyajit ray n his apu though emotional n dramatic everything seems utterly realistic nd amirs directing needs special mentioning here way he captures childs world childs obsession noticing minute things nd finding beauty it like little fishes that inhabit roadside pond water filled pothole being run over by vehicles mother bird feeding her children nd with so many news children succumbing their parents pressure these days film has come out at apt time it will change whole way u look at relationship between parent child i bet its one those films which entertains nd enlightens at same time stop reading it any further if you havent yet seen it just take your child n go watch it but everything has its share bad sides though it matters little i would still like talk about little cons editing work cud have been sleeker film tends drag little middle although as hard as he may have tried amir khan is unable break away shackles orthodox bollywood treatment nd sum scenes are just too melodramatic like ishan sailing boat he has himself designed but probably it was draw traditional bollywood audience into watching this unique movie too many songs though good music shankar ehsan loy all songs but sum were unnecessary thats all it would be sacrilegious speak ill this film any further u r quite adamant arent you i thought i told you stop reading n go watch movie now go nd enjoy brilliant world alphabet crabs velvet octopuses absurd arts nd inverse letters is any member ko n dyslexic friend mine joked as far as i am legend is concerned never mind im going watch it tomorrow,0.558952067669173,0.15391604010025062,Positive,"{'Happy': 0.14, 'Angry': 0.05, 'Surprise': 0.25, 'Sad': 0.22, 'Fear': 0.34}"
