Rating,Review Title,Review,Cleaned Review Title,Cleaned Review,Subjectivity,Polarity,Sentiment,Emotion Scale
10.0,A Solid Movie!!,"Though the film is about children,it shouldn't be confused as a film for children.The film excelled with fine performances from Darsheel Safary and Aamir Khan.The first part of the film dealt mainly with the problems faced by the protagonist Ishaan.He is a bundle of creativity,but is not able to fare well academically being dyslexic.His father,tired of the numerous complaints from teachers and other parents sends him to the boarding school to get disciplined.There he gets even more lonely and dejected,being away from his family.Aamir Khan steps in as the new art teacher,Ram Shankar Nikhumb.He encourages the children to think differently and act on their true potential.He soon realizes the reason why Ishaan is so unhappy.The rest of the film is about Ishaan realizing his true potential.The film is a must see for this Christmas!!So what are u waiting for...",solid movie,though film is about children it shouldnt be confused as film children film excelled with fine performances darsheel safary aamir khan first part film dealt mainly with problems faced by protagonist ishaan he is bundle creativity but is not able fare well academically being dyslexic his father tired numerous complaints teachers other parents sends him boarding school get disciplined there he gets even more lonely dejected being away his family aamir khan steps as new art teacher ram shankar nikhumb he encourages children think differently act their true potential he soon realizes reason why ishaan is so unhappy rest film is about ishaan realizing his true potential film is must see this christmas so what are u waiting,0.5900673400673401,0.01637205387205387,Positive,"{'Happy': 0.05, 'Angry': 0.1, 'Surprise': 0.29, 'Sad': 0.33, 'Fear': 0.24}"
10.0,"A great inspiring movie for all, Every child is special","Although Bollywood releases 100s of movies every year but few of them has really left a mark on the audience for a long time. I am pretty much sure that this movie has done an excellent job for all those people who are creative but not good in academics. Many people think things differently but in India like country where competition begins at the age of 4 they are just a dumb in the society. Amir khan has done a very good job on both sides on the screen and off the screen besides he doesn't appear too often on the screen but Darsheel Safary steals the whole movie show.What a nice performance by a 8-9 year old child you are really gonna love this child. The movie brings our sweet childhood memories back.Its a mix of emotion, laugh and cry. We can imagine how we exploit children because they are not like us or they are not able to do what their parents want them to do.At the start, movie shows that how a little child(Darsheel Safary) is forced to do what he can't understand. He gets lowest marks in the class and he has failed once in class three.Sometimes he bunk the class and most of the time he has been out of the class because he don't understand how to turn a page number of the book or while reading letters dance so he can't read. After fear of being thrown him out of the school his parents put him in a boarding school.They think he is lazy and notorious.But in boarding school situation gets worse until a drawing teacher(Amir khan) gets an appointment as a temporary teacher. After that Amir teaches him in different way and ultimately he gets the success.In this movie director has taken two child one who always gets first and who is punctual for his work and other one is Darsheel Safary who is not good in academics because he can't understand letters and can't memorize too much things at a time. This movie is a motivation for all kind of child and their parents. Everyone should must watch this movie at least once. If you are too emotional then u may cry with Amir khan.",great inspiring movie all every child is special,although bollywood releases 100s movies every year but few them has really left mark audience long time i am pretty much sure that this movie has done excellent job all those people who are creative but not good academics many people think things differently but india like country where competition begins at age 4 they are just dumb society amir khan has done very good job both sides screen off screen besides he doesnt appear too often screen but darsheel safary steals whole movie show what nice performance by 8 9 year old child you are really gonna love this child movie brings our sweet childhood memories back its mix emotion laugh cry we can imagine how we exploit children because they are not like us or they are not able do what their parents want them do at start movie shows that how little child darsheel safary is forced do what he cant understand he gets lowest marks class he has failed once class three sometimes he bunk class most time he has been out class because he dont understand how turn page number book or while reading letters dance so he cant read after fear being thrown him out school his parents put him boarding school they think he is lazy notorious but boarding school situation gets worse until drawing teacher amir khan gets appointment as temporary teacher after that amir teaches him different way ultimately he gets success this movie director has taken two child one who always gets first who is punctual his work other one is darsheel safary who is not good academics because he cant understand letters cant memorize too much things at time this movie is motivation all kind child their parents everyone should must watch this movie at least once if you are too emotional then u may cry with amir khan,0.5405912698412697,0.1444910714285714,Positive,"{'Happy': 0.15, 'Angry': 0.03, 'Surprise': 0.31, 'Sad': 0.24, 'Fear': 0.27}"
9.0,A splendid effort..,"First point: Taare Zameen Par is not a movie for children. Its also not a movie only about 'special' children. What it stands for and depicts stunningly is how the cruel world outside is stealing away our children's precious childhood. It is about how our parents are turning into monsters and imposing their own dreams and aspirations on their children which eventually destroys our children's confidence and can only create a generation of hate. Its about how each child needs attention and care and how we so lack those qualities in this life thats bounded by time.Aamir Khan does a fabulous job both behind and in front of the camera. There are scenes in which just his facial expressions tugs at our hearts and moves us. That is truly the hallmark of a great actor. But then, Taare Zameen Par is not about Aamir. Its truly owned by Darsheel Safary. Right from the first scene to the very end he steals the show and our hearts with his endearing acting.Taare Zameen Par is a biting criticism of the times we live in. But it also makes you smile, laugh, cry, nod in agreement and seethe with anger.. everything that a movie is supposed to do. It truly is a movie which everyone can relate to. Reminds you that movies are meant to make us think.. to provoke us and act as a mirror of our times. Taare Zameen Par does all this and much more. Watch it if you like watching meaningful movies.Sreejith - dailyrium.wordpress.com",splendid effort,first point taare zameen par is not movie children its also not movie only about special children what it stands depicts stunningly is how cruel world outside is stealing away our childrens precious childhood it is about how our parents are turning into monsters imposing their own dreams aspirations their children which eventually destroys our childrens confidence can only create generation hate its about how each child needs attention care how we so lack those qualities this life thats bounded by time aamir khan does fabulous job both behind front camera there are scenes which just his facial expressions tugs at our hearts moves us that is truly hallmark great actor but then taare zameen par is not about aamir its truly owned by darsheel safary right first scene very end he steals show our hearts with his endearing acting taare zameen par is biting criticism times we live but it also makes you smile laugh cry nod agreement seethe with anger everything that movie is supposed do it truly is movie which everyone can relate reminds you that movies are meant make us think provoke us act as mirror our times taare zameen par does all this much more watch it if you like watching meaningful movies sreejith dailyrium wordpress com,0.572069597069597,0.1658674658674659,Positive,"{'Happy': 0.14, 'Angry': 0.08, 'Surprise': 0.28, 'Sad': 0.28, 'Fear': 0.22}"
10.0,Simply Sensational,"An excellent direction, beautiful narration and an emotional ending. This movie deserves the best of applause. The director has done an out of the world job. At no point in the movie does he overshadow the kid. The best thing I love about the movie is the facial expressions of Kid. This kid is a genius and has filled life into the role of a dyslexic. Movie is so perfect, doting mom, lovable brother and a strict dad. The manifestation of problems has been toned beautifully and the way the kid is helped to get out the problems is artistic. I hope I could vote more than 10 for this masterpiece. Missing this movie would be a blunder.",simply sensational,excellent direction beautiful narration emotional ending this movie deserves best applause director has done out world job at no point movie does he overshadow kid best thing i love about movie is facial expressions kid this kid is genius has filled life into role dyslexic movie is so perfect doting mom lovable brother strict dad manifestation problems has been toned beautifully way kid is helped get out problems is artistic i hope i could vote more than 10 this masterpiece missing this movie would be blunder,0.6311111111111111,0.56,Positive,"{'Happy': 0.24, 'Angry': 0.0, 'Surprise': 0.34, 'Sad': 0.14, 'Fear': 0.28}"
10.0,The Most beautiful movie I have ever seen,"""Taare Zameen Par"" A hopeful drama, the most beautiful movie I have ever seen, is a MUST-see, everyone on this Planet MUST see this film, I mean everyone.......It's beyond language to describe this film....This film is going to change the world....& this film is going to change your life! We don't need Hollywood mindless flicks....we need a Film like this, so our life can be better, & our planet can be MORE beautiful...I can't think of any movie on this planet which can make a difference...It does NOT matter what kind of FILM you like, YOU MUST SEE this one....I alway saw it 10 times! & I want to see it MORE...but I am IN LA, today is the last day...I wish I could see more...I walked on the street the last few days just to encourage people to see this FILM...people are Unhappy, people are living in the dark, people are LOST, people are programmed, People are living inside the box, people are living in fear, so when can we have TRUE Freedom?? well, after this film.....you will be FREE, you will find YOUR purpose, You WILL NOT have fear.....ALmost Three hours long movie, but I thought it was too short...I was excited...deeply touched...tears coming out from my SOUL...I saw LIGHT, I SAW LOVE, I SAW HOPE, I saw myself......why do we have to live in the prison of Life? why do we have to do what other people told us to do? why can't we Be FREE? Well, follow your heart, You will Find the answer This MOvie is about LOVE, DREAM & HOPE. It's about being yourself. It's about being FREE, it's about living your life in the most valuable way. It's about the TRUTH that everyone MUST learn.It's spiritual. It's moving & touching. It's about this boy's journey from the dark to the SUN. I cried when I saw it. Not because of sadness, but being touched , & moved from the deepest of my heart. Anyone can relate. We all have a dream. We all have a way to see the world, and a way to live our life. And that is so special. Sometime we forget it because our heart is covered with dust, now you can truly find out WHO you are after you see the movie. You can truly understand what you are all about. It will enlighten your soul, and change your LIFE from inside & out.I watched it for 10 times, It enlightened my heart, & changed the way I see my life and the world. I feel happy, grateful & absolutely wonderful after I saw it. This is a fantastic movie, I must tell you. I recommend it to everyone, no matter you are a kid or a parent, or just an adult, it's for ALL AGES. You won't regret it. It's the MOST beautiful movie I have ever seen.Everyone....as long as YOU are a Human, you MUST SEE this film....it TELLS you who YOU ARE: Yes, you are LOVE, & you are SO LOVED....You are infinite, & You ARE THE ANGEL, and You have the FULL-potential, and yes, You ARE FREE! Take a deep breath...yes, heaven is On earth, welcome Home my friends.Niki Yan Los Angeles, CA 12/27/2007",most beautiful movie i have ever seen,taare zameen par hopeful drama most beautiful movie i have ever seen is must see everyone this planet must see this film i mean everyone its beyond language describe this film this film is going change world this film is going change your life we dont need hollywood mindless flicks we need film like this so our life can be better our planet can be more beautiful i cant think any movie this planet which can make difference it does not matter what kind film you like you must see this one i alway saw it 10 times i want see it more but i am la today is last day i wish i could see more i walked street last few days just encourage people see this film people are unhappy people are living dark people are lost people are programmed people are living inside box people are living fear so when can we have true freedom well after this film you will be free you will find your purpose you will not have fear almost three hours long movie but i thought it was too short i was excited deeply touched tears coming out my soul i saw light i saw love i saw hope i saw myself why do we have live prison life why do we have do what other people told us do why cant we be free well follow your heart you will find answer this movie is about love dream hope its about being yourself its about being free its about living your life most valuable way its about truth that everyone must learn its spiritual its moving touching its about this boys journey dark sun i cried when i saw it not because sadness but being touched moved deepest my heart anyone can relate we all have dream we all have way see world way live our life that is so special sometime we forget it because our heart is covered with dust now you can truly find out who you are after you see movie you can truly understand what you are all about it will enlighten your soul change your life inside out i watched it 10 times it enlightened my heart changed way i see my life world i feel happy grateful absolutely wonderful after i saw it this is fantastic movie i must tell you i recommend it everyone no matter you are kid or parent or just adult its all ages you wont regret it its most beautiful movie i have ever seen everyone as long as you are human you must see this film it tells you who you are yes you are love you are so loved you are infinite you are angel you have full potential yes you are free take deep breath yes heaven is earth welcome home my friends niki yan los angeles ca 12 27 2007,0.5990312791783381,0.30720333587980647,Positive,"{'Happy': 0.24, 'Angry': 0.04, 'Surprise': 0.2, 'Sad': 0.3, 'Fear': 0.21}"
10.0,In simple words  THAT'S CINEMA IN ITS PUREST FORM,"Taare Zameen Par  Words fell short as I start writing about this impressive emotional movie from ""Aamir Khan"" & his team. Unarguably the film deserves a standing ovation for its unusual content and for its near perfect execution. The impact I felt after viewing it was quite similar to what I felt after watching movies of great film makers like Bimol Roy and Guru Dutt. Aamir Khan delivers what was expected from him, an out of the routine, emotional, memorable and enlightening film which is capable of bringing changes in the lives of many families. The film revolves around a boy who is facing difficulties in studies and his teacher who comes in his life as a morning breeze. The film emphasizes completely on the character of the child, his thoughts and it's a journey into the imaginative world of his mind. The visual interpretation of what he is thinking is innovatively shot and is a visual treat to watch . Aamir Khan is a thinking brain with a heart of gold and that he has proved with his directorial venture. He has the guts of following his heart and coming out with an unconventional film like this. Another merit of the film is that it is not preachy, it teaches along with providing the required entertainment to the viewers. The film talks about a condition of a child who is finding tough to compete with his classmates but it never talks about it as a disease or a mental disorder to cure. Aamir focuses on the fact that we got to give proper attention to all kids as everyone has his own areas of abilities. He also pin points on to the parents who always want their children to score in their studies and just ignore the other aspects of life relating to art and culture. Darsheel Safary, the eight year old child has given a stunning performance. He is not acting, he is emoting his character and has done his part so well that he even overshadows the subtle and cool performance of Aamir. Another actor to watch out is Tisca Chopra as the mother of the child. She is just perfect and makes you remember the motherly touch in your childhood days. The scenes of Aamir with the father of the child are the most effective in the movie. The lyrics of Prasoon Joshi are above than the music by Shankar Ehsaan Loy. They both are more impressive while watching the movie. In short, it's the movie which should be watched as a compulsion by all parents along with their children (would be parents too) and also by all the teachers who should feel the responsibility they have towards each & every child they teach. Concluding my review I would like to request my Indian film lovers that this is a movie which is meant to be watched without munching the popcorn and rightfully deserves a respectful viewing. Hats off to Aamir Khan & Thanks for giving us ""Taare Zameen Par"". The movie is simply above the star rating system",simple words thats cinema its purest form,taare zameen par words fell short as i start writing about this impressive emotional movie aamir khan his team unarguably film deserves standing ovation its unusual content its near perfect execution impact i felt after viewing it was quite similar what i felt after watching movies great film makers like bimol roy guru dutt aamir khan delivers what was expected him out routine emotional memorable enlightening film which is capable bringing changes lives many families film revolves around boy who is facing difficulties studies his teacher who comes his life as morning breeze film emphasizes completely character child his thoughts its journey into imaginative world his mind visual interpretation what he is thinking is innovatively shot is visual treat watch aamir khan is thinking brain with heart gold that he has proved with his directorial venture he has guts following his heart coming out with unconventional film like this another merit film is that it is not preachy it teaches along with providing required entertainment viewers film talks about condition child who is finding tough compete with his classmates but it never talks about it as disease or mental disorder cure aamir focuses fact that we got give proper attention all kids as everyone has his own areas abilities he also pin points parents who always want their children score their studies just ignore other aspects life relating art culture darsheel safary eight year old child has given stunning performance he is not acting he is emoting his character has done his part so well that he even overshadows subtle cool performance aamir another actor watch out is tisca chopra as mother child she is just perfect makes you remember motherly touch your childhood days scenes aamir with father child are most effective movie lyrics prasoon joshi are above than music by shankar ehsaan loy they both are more impressive while watching movie short its movie which should be watched as compulsion by all parents along with their children would be parents too also by all teachers who should feel responsibility they have towards each every child they teach concluding my review i would like request my indian film lovers that this is movie which is meant be watched without munching popcorn rightfully deserves respectful viewing hats off aamir khan thanks giving us taare zameen par movie is simply above star rating system,0.5182256235827665,0.2548280423280423,Positive,"{'Happy': 0.12, 'Angry': 0.11, 'Surprise': 0.2, 'Sad': 0.23, 'Fear': 0.34}"
