Rating,Review Title,Review,Cleaned Review Title,Cleaned Review,Subjectivity,Polarity,Sentiment,Emotion Scale
9.0,a special film for the special child in all of us,"for a mainstream Hindi film, the following is rare: 1. a film for children2. the only star of the film getting a limited screen space 3. high quality animation4. choosing undertones over melodrama, 5. no regular masala stuff 6. strong message that can actually change lives of people 7. conviction and honesty of the makers palpable in every frame 8. and in spite of all this, the movie offering complete, healthy entertainment...the only problem with the audience is that although we keep shouting on the extreme want of quality cinema, meaningful cinema, when a good film actually comes, we tend to find more flaws in it than appreciating it. Are we insecure of accepting somebodies honesty and creative genius?Sure, Taare Zameen Par has moments that could have been better, but shouldn't we just try to overlook those and once, for all, applaud the effort the makers have put...and believe me it is not difficult... for there are innumerable other moments that leave you spellbound, a wet film over your eyes, a strange pain down your throat, a mild ache at your heart, but a pure smile on your lips... there are times you wish you were a kid... may be it takes a child to love simple tales told with honesty and warmth... may be we grown ups have lost that quality we all once had... but Taare Zameen Par should touch a chord somewhere in every one's heart... we all have been after all, at least for some beautiful part of our lives, special. the film is dedicated to that special child in all of us...P.S- no one can hate it...at least i would like to think that way",special film special child all us,mainstream hindi film following is rare 1 film children2 only star film getting limited screen space 3 high quality animation4 choosing undertones over melodrama 5 no regular masala stuff 6 strong message that can actually change lives people 7 conviction honesty makers palpable every frame 8 spite all this movie offering complete healthy entertainment only problem with audience is that although we keep shouting extreme want quality cinema meaningful cinema when good film actually comes we tend find more flaws it than appreciating it are we insecure accepting somebodies honesty creative genius sure taare zameen par has moments that could have been better but shouldnt we just try overlook those once all applaud effort makers have put believe me it is not difficult there are innumerable other moments that leave you spellbound wet film over your eyes strange pain down your throat mild ache at your heart but pure smile your lips there are times you wish you were kid may be it takes child love simple tales told with honesty warmth may be we grown ups have lost that quality we all once had but taare zameen par should touch chord somewhere every ones heart we all have been after all at least some beautiful part our lives special film is dedicated that special child all us p s no one can hate it at least i would like think that way,0.5353437118437119,0.14356349206349203,Positive,"{'Happy': 0.15, 'Angry': 0.06, 'Surprise': 0.28, 'Sad': 0.21, 'Fear': 0.3}"
9.0,Oxygen to Revive the Soul,"A good film on children has always been much needed for Indian film-goers. And when in this moment of dearth one gets treated to a movie that simply touches the soul - needless to say - Taare Zameen Par - does just that.Aamir Khan proves his mettle as a director. As an actor he is fabulous. The story captures a look at a middle class family who feel the younger kid (Darsheel Safary) is not a patch on the elder one who is a topper at class. The younger one is always struggling with his ABCs and spends more time out of his class rather than inside.Its only when he is sent to boarding school with the hope that an iron fist will help him improve that he comes across art teacher (Aamir Khan) who correctly identities his problem of suffering from dyslexia and decides to unleash his creativity and make him an achiever.To know more one should watch this movie since it has elements that everyone could relate towards while at school or boarding, and brings into focus the need for underprivileged and slow learning children to be given the chance to prove themselves with patience and love that would help them merge with mainstream education and become worthwhile contributors.Brilliant job Aamir and your team for treating the subject with respect, honesty and flair. Darsheel Safary as the struggling kid has done total justice to his role and puts in a performance that will always be remembered.The movie will make you cry, make you laugh, make you rejoice and come out feeling that there are some people out there who take Indian cinema several notches higher.",oxygen revive soul,good film children has always been much needed indian film goers when this moment dearth one gets treated movie that simply touches soul needless say taare zameen par does just that aamir khan proves his mettle as director as actor he is fabulous story captures look at middle class family who feel younger kid darsheel safary is not patch elder one who is topper at class younger one is always struggling with his abcs spends more time out his class rather than inside its only when he is sent boarding school with hope that iron fist will help him improve that he comes across art teacher aamir khan who correctly identities his problem suffering dyslexia decides unleash his creativity make him achiever know more one should watch this movie since it has elements that everyone could relate towards while at school or boarding brings into focus need underprivileged slow learning children be given chance prove themselves with patience love that would help them merge with mainstream education become worthwhile contributors brilliant job aamir your team treating subject with respect honesty flair darsheel safary as struggling kid has done total justice his role puts performance that will always be remembered movie will make you cry make you laugh make you rejoice come out feeling that there are some people out there who take indian cinema several notches higher,0.4447845804988662,0.19444444444444442,Positive,"{'Happy': 0.18, 'Angry': 0.04, 'Surprise': 0.29, 'Sad': 0.22, 'Fear': 0.27}"
8.0,Two Celestial Bodies Make Three...,"The performance of Darsheel Safary, as convincing as any eight year old boy limited by the ignorance of others and, Aamir Khan, one of the most awe inspiring actors of his generation, of any generation from any corner of the world - combined together to create a super nova of a film, packed full of inspiration, empathy, generosity, beauty and learning. With some belting tunes to accompany the painting of a picture that seeks to raise awareness of the missed opportunities and damage an intense and blinkered culture of success can lead to, the finale is a joy to behold.",two celestial bodies make three,performance darsheel safary as convincing as any eight year old boy limited by ignorance others aamir khan one most awe inspiring actors his generation any generation any corner world combined together create super nova film packed full inspiration empathy generosity beauty learning with some belting tunes accompany painting picture that seeks raise awareness missed opportunities damage intense blinkered culture success can lead finale is joy behold,0.525952380952381,0.35119047619047616,Positive,"{'Happy': 0.44, 'Angry': 0.0, 'Surprise': 0.22, 'Sad': 0.33, 'Fear': 0.0}"
10.0,This has rocked the core in me !,"I sat down in my local theatre with no expectations at all, and what I was in for, for the coming couple of hours, was just mind boggling. Taare Zameen Par might not win any awards, might not get the praise it so surely deserves, but don't let that fool you. For this movie is not just a story about Ishaan, but a masterpiece ! Ishaan is a 8 year old boy who suffers from dyslexia, no matter how hard he tries he just doesn't succeed in day to day activities. But what is mostly the case in our hard society is that people don't understand him and his shortcomings. Most of the times they paint him off as a lazy-no good-brat and this drives his father so far that he will have no more of this nonsense and sends young Ishaan off to boarding school, where he gets treatened even worse. But one day arrives Mr Ramshankar Nikumbh, a temporary art-teacher and the only person in the world that understands Ishaan's problem. Taare Zameen Par moves on as Mr Nikumbh tries to understand and help out Ishaan with his problem. This starts a journey far greater and more beautiful we could ever imagine.I have seen a thousand movies and I must say that I haven't seen a script acted out so well for quite a while now. For non-movie buffs let me explain good acting, there are a few ways to tell brilliant acting from good acting . Just look for the quality, view every character as the character itself and not as the actor behind it acting the part out. If you don't see the actor, only the character that means you are convinced of the quality of acting. A view examples, Marlon Brando played The godfather so convincingly that for years to come people didn't see Brando but Vito Corleone same goes for Pacino when he played Scarface and so forth. Taare Zameen Par is a work of great acting by everyone, it feels so real and the characters grow on to you as the movie continues. And this is very strange for a Bollywood movie. Let's be real this is the film industry who had us believing that Hritik was a jewel thief and that Abishek was a police officer, how entertaining it might be, but it just doesn't feel real. For a character to feel real, like they do in Taare Zameen Par, there is need for a great written script and clever dialogue. The actors just do what they are supposed to and the movie plays out nicely. Then there's only the editing, the background score, the location, ... to worry about. And if everything is according to a pallet, compare it to a painting, where every element blends in with the other we get a great movie. And only once in a while we witness a masterpiece and that's exactly what TZP is, and this time it's not because of Mr Khan but because of his apprentice Darsheel Safary. The young boy who played Ishaan (Darsheel Safary) is one of the best child- artists I've seen coming out of Bollywood and what a first starrer this kid got. I surely would like to see more of him in the near future. And for Aamir Khan's first movie TZP wouldn't have been the same without Safary. Although some credit goes to Mr Khan himself as well. Known to be a perfectionist, his directional debut is a clear-cut proof of this. TZP is not just a movie about kids, it's a movie about life, society and yourself as a personality. The story moves you, into nostalgic days of your childhood when you were forced and pressured by your parents or teachers, into the world of a child who is ill-treated an misunderstood, into the hard truths of our society were failure is looked down on. If there ever was a movie who could make you smile, cry and enjoy the trip it's Taare Zameen Par. A great watch for everyone. This doesn't feel like a movie coming from Bollywood, but a movie for the masses. I surely hope this does well.",this has rocked core me,i sat down my local theatre with no expectations at all what i was coming couple hours was just mind boggling taare zameen par might not win any awards might not get praise it so surely deserves but dont let that fool you this movie is not just story about ishaan but masterpiece ishaan is 8 year old boy who suffers dyslexia no matter how hard he tries he just doesnt succeed day day activities but what is mostly case our hard society is that people dont understand him his shortcomings most times they paint him off as lazy no good brat this drives his father so far that he will have no more this nonsense sends young ishaan off boarding school where he gets treatened even worse but one day arrives mr ramshankar nikumbh temporary art teacher only person world that understands ishaans problem taare zameen par moves as mr nikumbh tries understand help out ishaan with his problem this starts journey far greater more beautiful we could ever imagine i have seen thousand movies i must say that i havent seen script acted out so well quite while now non movie buffs let me explain good acting there are few ways tell brilliant acting good acting just look quality view every character as character itself not as actor behind it acting part out if you dont see actor only character that means you are convinced quality acting view examples marlon brando played godfather so convincingly that years come people didnt see brando but vito corleone same goes pacino when he played scarface so forth taare zameen par is work great acting by everyone it feels so real characters grow you as movie continues this is very strange bollywood movie lets be real this is film industry who had us believing that hritik was jewel thief that abishek was police officer how entertaining it might be but it just doesnt feel real character feel real like they do taare zameen par there is need great written script clever dialogue actors just do what they are supposed movie plays out nicely then theres only editing background score location worry about if everything is according pallet compare it painting where every element blends with other we get great movie only once while we witness masterpiece thats exactly what tzp is this time its not because mr khan but because his apprentice darsheel safary young boy who played ishaan darsheel safary is one best child artists ive seen coming out bollywood what first starrer this kid got i surely would like see more him near future aamir khans first movie tzp wouldnt have been same without safary although some credit goes mr khan himself as well known be perfectionist his directional debut is clear cut proof this tzp is not just movie about kids its movie about life society yourself as personality story moves you into nostalgic days your childhood when you were forced pressured by your parents or teachers into world child who is ill treated misunderstood into hard truths our society were failure is looked down if there ever was movie who could make you smile cry enjoy trip its taare zameen par great watch everyone this doesnt feel like movie coming bollywood but movie masses i surely hope this does well,0.5103858024691357,0.1392206790123457,Positive,"{'Happy': 0.19, 'Angry': 0.08, 'Surprise': 0.19, 'Sad': 0.2, 'Fear': 0.34}"
10.0,Carries a lot of emotional weight and room for connection...,"I was impressed with this movie. Even more than with the Kite Runner. Mainly because it is one of the most sensitive and realistic Hindi movies that I have ever seen in my life. The first thing my sister said when we were out of the theater was ""I want that kid's autograph."" Darsheel Safary did a brilliant job as the dyslexic but cute Ishaan. I recommend that ALL parents watch this movie WITH their kids. This movie shows the effects of parental pressure, social isolation, andinspiration, of course. Aamir Khan was very provoking as the caring art teacher, Nikumbh, that recognizes young Ishaan's mental withdrawal yet his amazing ability to paint and build. It is one thing to imagine such bizarre things, but to put it on paper or construct things in an appealing way is definitely a gift. I thought that no part of the movie was melodramatic or overly done which is a major concern in Indian movies. Instead, I thought that there was a lot of promise in this movie just like how there is a promise in every child that has the motivation and faith to achieve something. And the title translated as ""Little Stars on Earth"" describes all children that are looking for this promise although they may not have everything that most children have. Wowwhat an effect this movie had on me",carries lot emotional weight room connection,i was impressed with this movie even more than with kite runner mainly because it is one most sensitive realistic hindi movies that i have ever seen my life first thing my sister said when we were out theater was i want that kids autograph darsheel safary did brilliant job as dyslexic but cute ishaan i recommend that all parents watch this movie with their kids this movie shows effects parental pressure social isolation inspiration course aamir khan was very provoking as caring art teacher nikumbh that recognizes young ishaans mental withdrawal yet his amazing ability paint build it is one thing imagine such bizarre things but put it paper or construct things appealing way is definitely gift i thought that no part movie was melodramatic or overly done which is major concern indian movies instead i thought that there was lot promise this movie just like how there is promise every child that has motivation faith achieve something title translated as little stars earth describes all children that are looking this promise although they may not have everything that most children have wow what effect this movie had me,0.5659420289855072,0.2735507246376812,Positive,"{'Happy': 0.1, 'Angry': 0.02, 'Surprise': 0.37, 'Sad': 0.29, 'Fear': 0.22}"
10.0,Undoubtedly the best Hindi movie of 2007,"If you haven't seen Taare Zameen Par, you are missing out. The best Hindi movie of 2007 without doubt. Extremely sensitively handled, and flawlessly executed performances, especially by Darsheel Safary. This movie really hits you.In a way, everyone can relate to it, especially if you have grown up in India where most children are classified as dumb or unintelligent if they ""can't"" become engineers or doctors. I went in with huge expectations, and this movie exceeded them.Some reviews have complained about situations in the movie being too simple or repetitive in parts, but I have absolutely no problems with that. This is no thriller. You know what's going to happen, but you are looking forward to it too.The songs might not be great hits, but they gel really well with the movie. They are beautifully worded, and capture the emotions of the characters perfectly.When the end credits started rolling, most people started walking towards the exit, but even when they had almost stopped rolling, most of them were still standing near the exit, watching the images in the end credits.",undoubtedly best hindi movie 2007,if you havent seen taare zameen par you are missing out best hindi movie 2007 without doubt extremely sensitively handled flawlessly executed performances especially by darsheel safary this movie really hits you way everyone can relate it especially if you have grown up india where most children are classified as dumb or unintelligent if they cant become engineers or doctors i went with huge expectations this movie exceeded them some reviews have complained about situations movie being too simple or repetitive parts but i have absolutely no problems with that this is no thriller you know whats going happen but you are looking forward it too songs might not be great hits but they gel really well with movie they are beautifully worded capture emotions characters perfectly when end credits started rolling most people started walking towards exit but even when they had almost stopped rolling most them were still standing near exit watching images end credits,0.5937888198757765,0.2728260869565218,Positive,"{'Happy': 0.07, 'Angry': 0.14, 'Surprise': 0.17, 'Sad': 0.14, 'Fear': 0.48}"
10.0,"Taare Zameen Par: Rated ""PRG"" (Parents Required Guidance)","If all start living on their own terms, this world will be altogether a different place. Childhood is that juvenile period in life when the dreams have no boundaries and sky is the limit. It's only when the weight of someone else's dream comes on your shoulder; life turns full circle and you start as if there was no past. Resisting sticking with past raises questions to your capabilities as in this world there is only one way to get praised which is to perform the best in all the fields.This is not just a movie but this is a world from a child's view. Here 3*9 can be 3 and yes it's logical since Pluto (The 9th planet) has no more existence. Ishaan is an eight year old boy who is little different from others. Lost in his own world, always short of words but yet understands every single aspect of life. Problem with him is to express himself loudly, no one understands the way he behaves since he himself is puzzled the way things are going around him. Unclear in expressing himself, he presses his parents and teachers to start thinking that he is not one of the normal child but someone who requires special attention. This forces his demanding father to sent him to a boarding school, an eight year old boy who always lived his life in shadow of his mother couldn't adjust to this abrupt distance from her and goes into mental trauma which makes him a speechless kid, Berated by the teachers and friends around, this new world takes every color from his life until his new art teacher Ram comes in and helps him to get outside the nutshell to prove that Ishaan is no less than a brilliant artist in making.It's a lesson for all those parents who expect their child to win all the races; one has to accept that you can't have no# 1 in every house, someone has to be in lower down the order. Actual problem starts when parents start pushing their child to fulfill their own dreams which they saw but couldn't convert into realities. It's not always about being in the race and finishing first, sometimes finishing it gracefully also matters. In a way, everyone can relate to it, especially if you have grown up in India where most children are classified as dumb or unintelligent if they ""can't"" become engineers or doctors. Movie is a biting criticism of the times we live in. But it also makes you smile, laugh, cry, nod in agreement and seethe with anger; everything that a movie is supposed to do. It truly is a movie which everyone can relate to. Reminds you that movies are meant to make us think; to provoke us and act as a mirror of our times. Taare Zameen Par does all this and much more. This is outstanding heart-warming stuff, hats off to Aamir for once again taking on an off- beat topic and bringing it to life in his directorial debut. This movie surely belongs to children and their childhood.I myself have worked with kids who require help like Ishaan and I know it very well how do they feel when the world is too demanding and there is less power in you to fulfill them. I am happy that I saw this movie well in advance, now surely I am going to do justice to the new age coming. I rated this movie as PRG and surely it's a must watch for each parent and future parents.",taare zameen par rated prg parents required guidance,if all start living their own terms this world will be altogether different place childhood is that juvenile period life when dreams have no boundaries sky is limit its only when weight someone elses dream comes your shoulder life turns full circle you start as if there was no past resisting sticking with past raises questions your capabilities as this world there is only one way get praised which is perform best all fields this is not just movie but this is world childs view here 3 9 can be 3 yes its logical since pluto 9th planet has no more existence ishaan is eight year old boy who is little different others lost his own world always short words but yet understands every single aspect life problem with him is express himself loudly no one understands way he behaves since he himself is puzzled way things are going around him unclear expressing himself he presses his parents teachers start thinking that he is not one normal child but someone who requires special attention this forces his demanding father sent him boarding school eight year old boy who always lived his life shadow his mother couldnt adjust this abrupt distance her goes into mental trauma which makes him speechless kid berated by teachers friends around this new world takes every color his life until his new art teacher ram comes helps him get outside nutshell prove that ishaan is no less than brilliant artist making its lesson all those parents who expect their child win all races one has accept that you cant have no 1 every house someone has be lower down order actual problem starts when parents start pushing their child fulfill their own dreams which they saw but couldnt convert into realities its not always about being race finishing first sometimes finishing it gracefully also matters way everyone can relate it especially if you have grown up india where most children are classified as dumb or unintelligent if they cant become engineers or doctors movie is biting criticism times we live but it also makes you smile laugh cry nod agreement seethe with anger everything that movie is supposed do it truly is movie which everyone can relate reminds you that movies are meant make us think provoke us act as mirror our times taare zameen par does all this much more this is outstanding heart warming stuff hats off aamir once again taking off beat topic bringing it life his directorial debut this movie surely belongs children their childhood i myself have worked with kids who require help like ishaan i know it very well how do they feel when world is too demanding there is less power you fulfill them i am happy that i saw this movie well advance now surely i am going do justice new age coming i rated this movie as prg surely its must watch each parent future parents,0.5131680955210367,0.15842705769176355,Positive,"{'Happy': 0.12, 'Angry': 0.06, 'Surprise': 0.23, 'Sad': 0.22, 'Fear': 0.38}"
