Rating,Review Title,Review,Cleaned Review Title,Cleaned Review,Subjectivity,Polarity,Sentiment,Emotion Scale
9,Beautiful.!!,"'Mimi' is a well written, well made film which carries a heart.Story revolves around the surrogate mother whose biological parents abandon the surrogacy and the struggle she goes through.Kriti Sanon may have a ton of films under her wings that shows off her glamour but this definitely proves she's more than just the pretty face. Perhaps the first time she's going to be loved as an actress, instead of a model.Pankaj Tripathi , as usual is at his best as a character that drives the story initially and later adds humour and fun when the plot gets tense.Evelyn and Aiden, instead of being a usual 'english couple in Indian film' did invest emotionally as the chatacters who wants a kid. Evelyn did an amazing job especially in the latter half of the film.Manoj ,Supriya and Sai were impressive even as side characters.A. R. Rahman's music score was good but the background score was flawless, both of which flows beautifully throughout the film, adding an extra cherry on top.Overall it is a beautiful film that deserves a watch.",beautiful,mimi is well written well made film which carries heart story revolves around surrogate mother whose biological parents abandon surrogacy struggle she goes through kriti sanon may have ton films under her wings that shows off her glamour but this definitely proves shes more than just pretty face perhaps first time shes going be loved as actress instead model pankaj tripathi as usual is at his best as character that drives story initially later adds humour fun when plot gets tense evelyn aiden instead being usual english couple indian film did invest emotionally as chatacters who wants kid evelyn did amazing job especially latter half film manoj supriya sai were impressive even as side characters r rahmans music score was good but background score was flawless both which flows beautifully throughout film adding extra cherry top overall it is beautiful film that deserves watch,0.4673076923076923,0.3403846153846154,Positive,"{'Happy': 0.22, 'Angry': 0.06, 'Surprise': 0.17, 'Sad': 0.14, 'Fear': 0.42}"
9,Beautiful,"I think after this movie, kriti Sanon is gonna be on a sky rocket. Kisi aur heroine ko kaam nhi milne wala hai..",beautiful,i think after this movie kriti sanon is gonna be sky rocket kisi aur heroine ko kaam nhi milne wala hai,1.0,0.85,Positive,"{'Happy': 0.5, 'Angry': 0.0, 'Surprise': 0.5, 'Sad': 0.0, 'Fear': 0.0}"
10,It's a Kriti Sanon show!!,"A good and entertaining hindi movie, in a while.Story is about a girl(Kriti Sanon), an aspiring actress from small indian town, who agrees to be a surrogate mother for an American couple. And what happens when that couple decide to abandon her due to some unforeeen circumstances. How she deals with it, forms the rest of the story.The execution of the plot is very engaging. The movie keeps you glued to the screen for its entire runtime. Screenplay and dialogues are crisp and applaud worthy.Performances by each and every cast member is terrific. Sai Tamhanakar leaves a mark. Manoj Pahwa and Supriya Pathak are adorable as Mim's parents. Pankaj Tripathi is excellent and almost steals the thunder in every scene he is.But it's Kriti Sanon who just wins you over with her range of emotions. She shines and shines bright in every scene she is in. She brings Mimi to life. Watch her acting during the child birth scene and you would be in awe. The fact that she stands out in midst of some of India's finest actors, says a lot about her.The American actors are good too.Blemishes? Very minor. The characterization of John and Summer could have been better developed. Some of their motivations don't make sense. Length could have been shortened by 10-15 mins. The culmination is very predictable and convenient. Makers could have been a little more creative. But that aside this is great cinema.Recommended!",its kriti sanon show,good entertaining hindi movie while story is about girl kriti sanon aspiring actress small indian town who agrees be surrogate mother american couple what happens when that couple decide abandon her due some unforeeen circumstances how she deals with it forms rest story execution plot is very engaging movie keeps you glued screen its entire runtime screenplay dialogues are crisp applaud worthy performances by each every cast member is terrific sai tamhanakar leaves mark manoj pahwa supriya pathak are adorable as mims parents pankaj tripathi is excellent almost steals thunder every scene he is but its kriti sanon who just wins you over with her range emotions she shines shines bright every scene she is she brings mimi life watch her acting during child birth scene you would be awe fact that she stands out midst some indias finest actors says lot about her american actors are good too blemishes very minor characterization john summer could have been better developed some their motivations dont make sense length could have been shortened by 10 15 mins culmination is very predictable convenient makers could have been little more creative but that aside this is great cinema recommended,0.5634666666666667,0.2806333333333333,Positive,"{'Happy': 0.27, 'Angry': 0.0, 'Surprise': 0.27, 'Sad': 0.17, 'Fear': 0.3}"
10,I WANT TO GIVE 11 STARS INSTEAD OF 10,KRITI SANON NE AAG LAGA DI...BAHUT EMOTIONAL MOVIE...TRIPATHI SIR KA BHI HAMESA KI TARAH BEHTARIN KAAM.... RAJ THE CHILD WAS SO CUTE...SABHI ACTORS NE APNA ROLE BAKHUBI NIBHAYA.. MASTERPIECE 🔥🔥🔥🔥🔥👍👍👍👍,i want give 11 stars instead 10,kriti sanon ne aag laga di bahut emotional movie tripathi sir ka bhi hamesa ki tarah behtarin kaam raj child was so cute sabhi actors ne apna role bakhubi nibhaya masterpiece,0.825,0.25,Positive,"{'Happy': 0.2, 'Angry': 0.0, 'Surprise': 0.2, 'Sad': 0.2, 'Fear': 0.4}"
10,Mimi!!,"Mimi is inspired from the 2010 marathi film 'mala aai vhhaychy' which in itself is a national award winner. Here are the positives and negatives.Acting:kriti sanon has given her best performance till date. I was at loss of words talking about her performance. Her dialogue delivery,expressions everything is top notch. She is a potential star. The supporting cast has done a tremendous job. Sai tamhankar, manoj pahwa, supriya pathak hv ably supported the film.The 'pankaj tripathi' factor:i think appreciating him is an under appreciation itself. This man is a legend in true sense. His dialogue delivery, comic timing, expressions, body language, everything is so inch perfect. He is a masterclass of acting.Climax: the climax is so so good. It left me with a smile and happy tears. After a long time the climax of a movie has impressed me. The film will make u weep at several places. U just cannot take ur eyes off the screen.Music: the music by AR Rahman is brilliant. Every song is so soulful and melodious. Be it param sundari or hututu or any song. But the song 'rihaai 'and its placement will make u weep. Its so beautiful.Bgm:okay so this my only little criticism. The bgm in the emotional scenes is brilliant. But in the comedy scenes it was used excessively at several places. The director should hv trusted the situation and writing(which is brilliant) a bit more.The message:so who is a mother?the one who gives birth or the one who looks after the child or both? A question which would require centuries to answer. And an urge for adoption as well.I cannot talk less about this film and the impact it has had on me. So go and watch the film. Its so heartwarming and emotional. I rate it 10 out of 10.",mimi,mimi is inspired 2010 marathi film mala aai vhhaychy which itself is national award winner here are positives negatives acting kriti sanon has given her best performance till date i was at loss words talking about her performance her dialogue delivery expressions everything is top notch she is potential star supporting cast has done tremendous job sai tamhankar manoj pahwa supriya pathak hv ably supported film pankaj tripathi factor i think appreciating him is under appreciation itself this man is legend true sense his dialogue delivery comic timing expressions body language everything is so inch perfect he is masterclass acting climax climax is so so good it left me with smile happy tears after long time climax movie has impressed me film will make u weep at several places u just cannot take ur eyes off screen music music by ar rahman is brilliant every song is so soulful melodious be it param sundari or hututu or any song but song rihaai its placement will make u weep its so beautiful bgm okay so this my only little criticism bgm emotional scenes is brilliant but comedy scenes it was used excessively at several places director should hv trusted situation writing which is brilliant bit more message so who is mother one who gives birth or one who looks after child or both question which would require centuries answer urge adoption as well i cannot talk less about this film impact it has had me so go watch film its so heartwarming emotional i rate it 10 out 10,0.5597222222222222,0.37097222222222226,Positive,"{'Happy': 0.27, 'Angry': 0.05, 'Surprise': 0.18, 'Sad': 0.25, 'Fear': 0.25}"
9,Balanced and compact story telling with a deep message.,"A well written and nicely executed movie with fantastic casting. Perfectly balanced story telling. Pankaj Tripathi as usual has been at his best, and did complete justice to his role. And, this has to be the best performance of Kriti sanon in her career following Bareilly ki barfi. And yes, you just cannot complain anything about music when A. R Rahman is the music director.",balanced compact story telling with deep message,well written nicely executed movie with fantastic casting perfectly balanced story telling pankaj tripathi as usual has been at his best did complete justice his role this has be best performance kriti sanon her career following bareilly ki barfi yes you just cannot complain anything about music when r rahman is music director,0.5166666666666666,0.4277777777777778,Positive,"{'Happy': 0.09, 'Angry': 0.0, 'Surprise': 0.27, 'Sad': 0.36, 'Fear': 0.27}"
10,A Perfect Entertainer After A Long Time 😀,"What A Movie It Was !!!Pankaj Tripathi Nailed It As Usual . Kriti Sanon Gave Her Career Best Performance.The Story , Comic Timing , Acting Everything Was On Point ... Highly Recommended 👍😊",perfect entertainer after long time,what movie it was pankaj tripathi nailed it as usual kriti sanon gave her career best performance story comic timing acting everything was point highly recommended,0.42714285714285716,0.30142857142857143,Positive,"{'Happy': 0.0, 'Angry': 0.0, 'Surprise': 0.33, 'Sad': 0.33, 'Fear': 0.33}"
10,Mimi,Omgg!!!! What a movie!!What a acting!What a storyline!!I Just watched Mimi this movie is filled with amazing actors who truly make the film. Our all time favourite pankaj tripathi gives a legendary performance in this film and he was absolutely hilarious n stunning kriti sanon she rocked it man by her acting skills what a performance by kriti sanon justt loved it..!!Overall this is a great movie with a mix a ton of a laughs and a emotional touch in last all rolled into one.. Mustt watch.,mimi,omgg what movie what acting what storyline i just watched mimi this movie is filled with amazing actors who truly make film our all time favourite pankaj tripathi gives legendary performance this film he was absolutely hilarious n stunning kriti sanon she rocked it man by her acting skills what performance by kriti sanon justt loved it overall this is great movie with mix ton laughs emotional touch last all rolled into one mustt watch,0.5888888888888889,0.375,Positive,"{'Happy': 0.29, 'Angry': 0.0, 'Surprise': 0.29, 'Sad': 0.21, 'Fear': 0.21}"
10,One of the finest movies of 2021,"Great story.Great actors(Pankaj is out of this world, Kriti is awesome).Great execution with enough suspense and drama.Beautiful cinematic experience.Excellent direction by Laxman.Thank you, Netflix for making a sensible movie for the Indian people.",one finest movies 2021,great story great actors pankaj is out this world kriti is awesome great execution with enough suspense drama beautiful cinematic experience excellent direction by laxman thank you netflix making sensible movie indian people,0.74375,0.65625,Positive,"{'Happy': 0.71, 'Angry': 0.0, 'Surprise': 0.14, 'Sad': 0.14, 'Fear': 0.0}"
10,"Kriti Sanon nailed it, one of the best movies of 2021","Everything was perfect, Best performance by kriti sanon till now, Pankaj tripathi again aced the role he was given. Didn't get bore even once. Amazing storyline, well directed. If A. R. Rahman is the composer, you cannot complain about the songs. A must watch.",kriti sanon nailed it one best movies 2021,everything was perfect best performance by kriti sanon till now pankaj tripathi again aced role he was given didnt get bore even once amazing storyline well directed if r rahman is composer you cannot complain about songs must watch,0.625,0.9,Positive,"{'Happy': 0.0, 'Angry': 0.0, 'Surprise': 0.4, 'Sad': 0.4, 'Fear': 0.2}"
10,EMOTION OVER COMMEDY,It is almost a complete attempt with a time worthy social msg and awareness regarding surrogacy... No doubt best ever performance by kriti Sanon so far and perfectly complemented by Pankaj sir... A well written and well executed story will surely make you travel through roller coaster of incidents full of COMMEDY and unforseen incidents and it will end surely making you emotional.. My take 10/10 for a perfect decent movie of recent times MUST WATCH.,emotion over commedy,it is almost complete attempt with time worthy social msg awareness regarding surrogacy no doubt best ever performance by kriti sanon so far perfectly complemented by pankaj sir well written well executed story will surely make you travel through roller coaster incidents full commedy unforseen incidents it will end surely making you emotional my take 10 10 perfect decent movie recent times must watch,0.6662393162393161,0.3910256410256411,Positive,"{'Happy': 0.07, 'Angry': 0.0, 'Surprise': 0.29, 'Sad': 0.36, 'Fear': 0.29}"
10,A perfect Emotional + comical journey,"Okay, so let me get this straight . Today I watched mimi on jio cinema and let me tell you ....... I had zero expectations from it . The main reason was its trailer , as it revealed everything . So I was in a dilemma that whether to watch it or not but since it had Pankaj Triphati in it , I decided to give it a shot and let me tell you I was surprised !! Mimi is beautiful and rarely feels boring . It is perfect in every sense. The comical scenes are just hilarious !! And by comedy I don't mean those double meaning jokes . It's actually good ( the comedy) as it feels natural. The dialogues are just superb !! Especially that one from Pankaj Tripathi, ""I'm a driver Mimi ji . We have some principles ......"" and there is one more dialogue said by an supporting actress ( I don't know her name actually) which is ,"" Life is not what we think , Life is that what we live ."" The soundtrack by A. R Rahman ...... SOOTHING !!!!!!Especially 'Rihayi de' and 'param sundari' . Also the acting of all the cast members especially PANKAJ TRIPHATI !!!!! Man what an actor ! Just brilliant. He's excellent in comic scenes but brilliant In emotional scenes . Kriti Sanon is definitely the highlight. She's proved that why she deserves to be here .. she's just awsome as the Small town girl who aspires to be an actor . Also special mention for Evelyn Edwards , Manoj Pahwa and Supriya Pathak .On the whole , Mimi is an excellent film and a great tribute to all the mothers out there . Just don't miss it !!!!!",perfect emotional comical journey,okay so let me get this straight today i watched mimi jio cinema let me tell you i had zero expectations it main reason was its trailer as it revealed everything so i was dilemma that whether watch it or not but since it had pankaj triphati it i decided give it shot let me tell you i was surprised mimi is beautiful rarely feels boring it is perfect every sense comical scenes are just hilarious by comedy i dont mean those double meaning jokes its actually good comedy as it feels natural dialogues are just superb especially that one pankaj tripathi im driver mimi ji we have some principles there is one more dialogue said by supporting actress i dont know her name actually which is life is not what we think life is that what we live soundtrack by r rahman soothing especially rihayi de param sundari also acting all cast members especially pankaj triphati man what actor just brilliant hes excellent comic scenes but brilliant emotional scenes kriti sanon is definitely highlight shes proved that why she deserves be here shes just awsome as small town girl who aspires be actor also special mention evelyn edwards manoj pahwa supriya pathak whole mimi is excellent film great tribute all mothers out there just dont miss it,0.6889800514800514,0.32831549081549083,Positive,"{'Happy': 0.22, 'Angry': 0.0, 'Surprise': 0.22, 'Sad': 0.3, 'Fear': 0.26}"
10,It is a Education for all Living Creatures,"Such a beautiful story it is, Kriti Sanon, Pankaj Tripathi and Pankaj Sir you both are terrific and best of luck ahead for Kriti Sanon, awesome performance by you ma'am.",it is education all living creatures,such beautiful story it is kriti sanon pankaj tripathi pankaj sir you both are terrific best luck ahead kriti sanon awesome performance by you maam,0.76,0.5700000000000001,Positive,"{'Happy': 0.4, 'Angry': 0.0, 'Surprise': 0.6, 'Sad': 0.0, 'Fear': 0.0}"
10,Mimi,"This is a very entertaining Indian movie; it is funny, dramatic and has very good actors. TOTALLY RECOMMENDED!",mimi,this is very entertaining indian movie it is funny dramatic has very good actors totally recommended,0.808,0.2753333333333333,Positive,"{'Happy': 0.5, 'Angry': 0.0, 'Surprise': 0.5, 'Sad': 0.0, 'Fear': 0.0}"
10,LOVELY MUST WATCH❤,"Watched *Mimi* A simple, beautiful, soulful and heart touching movie.Loved every bit of it. The director Laxman Utekar, needs a huge credit to put all of this together.It's not easy to not get overwhelmed by AR's music, and not let it affect the narrative.And he has attained that, the music beautifully blended with the movie, and took the narrative to another level.The climax scene, the one where Mimi gives birth and holds the baby for the first time, were accenuated by Rahman Sir's music.A complete movie, with a mix of clean unforced comedy, and simple and believable emotions.A perfect balance was stuck in all ground.Kriti Sanon also has lived the role of Mimi. There was a lot of publicity for her 15kg or so weight gain and all. But her performance was much much beyond that.A superlative performance, very effectivey supported by Pankaj Tripathi, Sai Tamhankar, Manoj Pahwa and Supriya Pathak.This movie certainly needs another watch :) Weekend plans done :D.",lovely must watch,watched mimi simple beautiful soulful heart touching movie loved every bit it director laxman utekar needs huge credit put all this together its not easy not get overwhelmed by ars music not let it affect narrative he has attained that music beautifully blended with movie took narrative another level climax scene one where mimi gives birth holds baby first time were accenuated by rahman sirs music complete movie with mix clean unforced comedy simple believable emotions perfect balance was stuck all ground kriti sanon also has lived role mimi there was lot publicity her 15kg or so weight gain all but her performance was much much beyond that superlative performance very effectivey supported by pankaj tripathi sai tamhankar manoj pahwa supriya pathak this movie certainly needs another watch weekend plans done d,0.6177871148459383,0.3773109243697479,Positive,"{'Happy': 0.12, 'Angry': 0.0, 'Surprise': 0.23, 'Sad': 0.38, 'Fear': 0.27}"
10,JUST BRILIANT,KRITI SANON💟 AND PANKAJ TRIPATHI🙌 WOOOW SALUTE HAPPY BIRTHDAY KRITI SANON 🎂💗 LITERALLY CRIED WATCHING IT IT WAS EMOTIONAL ROLLERCOASTER 😍🙌 GREAT ACTING 👌💥 GREAT MUSIC HATS-OFF.,just briliant,kriti sanon pankaj tripathi wooow salute happy birthday kriti sanon literally cried watching it it was emotional rollercoaster great acting great music hats off,0.63,0.4800000000000001,Positive,"{'Happy': 0.5, 'Angry': 0.0, 'Surprise': 0.17, 'Sad': 0.33, 'Fear': 0.0}"
10,Wow....Must watch movie...,"Combination of comedy, love and affection...This is the movie based on..How flawlessly done..Such movies should b promoted....",wow must watch movie,combination comedy love affection this is movie based how flawlessly done such movies should b promoted,0.775,0.4,Positive,"{'Happy': 0.33, 'Angry': 0.0, 'Surprise': 0.33, 'Sad': 0.17, 'Fear': 0.17}"
10,Kriti Sanon is love,Best performance of Kriti Sanon till date.She is amazing and gracious in this role.Pankaj Tripathi good as always.Storyline is amazing.Thanks Jio and Netflix for this wonderful content.,kriti sanon is love,best performance kriti sanon till date she is amazing gracious this role pankaj tripathi good as always storyline is amazing thanks jio netflix this wonderful content,0.6428571428571429,0.6571428571428571,Positive,"{'Happy': 0.22, 'Angry': 0.0, 'Surprise': 0.56, 'Sad': 0.11, 'Fear': 0.11}"
10,Best movie of 2021,"Performances are top notch and story, screenplay, and direction is also good. Watch this beautiful movie.",best movie 2021,performances are top notch story screenplay direction is also good watch this beautiful movie,0.6000000000000001,0.7625000000000001,Positive,"{'Happy': 0.4, 'Angry': 0.0, 'Surprise': 0.6, 'Sad': 0.0, 'Fear': 0.0}"
9,Best movie,Mimi movie give social message At certain point I cry because of scene Best movie in month of july Best acting and fabulous story.,best movie,mimi movie give social message at certain point i cry because scene best movie month july best acting fabulous story,0.3625850340136054,0.5210884353741496,Positive,"{'Happy': 0.12, 'Angry': 0.0, 'Surprise': 0.5, 'Sad': 0.0, 'Fear': 0.38}"
8,Uniqueness,This movie is very interesting and at the same time it is very unique. We want more Bollywood movies like this.,uniqueness,this movie is very interesting at same time it is very unique we want more bollywood movies like this,0.56875,0.40937500000000004,Positive,"{'Happy': 1.0, 'Angry': 0.0, 'Surprise': 0.0, 'Sad': 0.0, 'Fear': 0.0}"
10,HEARTWARMING SAGA ❤ MUST WATCH & No Piracy Please,MIND-BLOWING ContentComedy & Emotion Just Perfect Pankaj Tripathi Sir You Are A Legend Best Comic & Your Emotional Scenes 😢 KRITI SANON Your Career Best Performance Till Date 🔥🔥 EVELYN EDWARDS Very GOOD SUPPORTING CAST ALSO PERFECTDirection & Music TOP NOTCH AR RAHMAN SIR LEGEND & Climax Tears Will 100% Come😢2021 BEST MOVIE TILL DATE Must Watch.,heartwarming saga must watch no piracy please,mind blowing contentcomedy emotion just perfect pankaj tripathi sir you are legend best comic your emotional scenes kriti sanon your career best performance till date evelyn edwards very good supporting cast also perfectdirection music top notch ar rahman sir legend climax tears will 100 come 2021 best movie till date must watch,0.508888888888889,0.6566666666666667,Positive,"{'Happy': 0.07, 'Angry': 0.0, 'Surprise': 0.57, 'Sad': 0.36, 'Fear': 0.0}"
10,Beautiful movie,"I never seen kriti like this before .. it's truly her show ,her expression while on the labour bed was tremendous .. Though I'm a man but I could feel that labour pain through her expressions .. And what to say about Kaleen Bhaiya he is flawless like always ,His dialogue delivery can make you laugh, cry, excited and what not, he is GOAT ..",beautiful movie,i never seen kriti like this before its truly her show her expression while labour bed was tremendous though im man but i could feel that labour pain through her expressions what say about kaleen bhaiya he is flawless like always his dialogue delivery can make you laugh cry excited what not he is goat,0.77,0.5716666666666667,Positive,"{'Happy': 0.1, 'Angry': 0.1, 'Surprise': 0.2, 'Sad': 0.6, 'Fear': 0.0}"
