Rating,Review Title,Review,Cleaned Review Title,Cleaned Review,Subjectivity,Polarity,Sentiment,Emotion Scale
8,0% Cinema 100% Reality,"When people say disappointed with climax yes they have every right when we are more into the cinematic universe we were taught to plot twist sudden rise of a macho hero. But this movie is made of flesh and blood ends abruptly explaining nothing much to the viewers. Well what is left to explain anyway?For every sachin vazes with BMWs there are hundreds of Maniyans who were/will made scapegoats to oil political machinery. They are just puppets of the system. Once the votes entered in the Ballot box jaffer iddukki says ""its not my business anymore, I will say to the press I was ill informed"" it means the hunters now will be hunted.",0 cinema 100 reality,when people say disappointed with climax yes they have every right when we are more into cinematic universe we were taught plot twist sudden rise macho hero but this movie is made flesh blood ends abruptly explaining nothing much viewers well what is left explain anyway every sachin vazes with bmws there are hundreds maniyans who were will made scapegoats oil political machinery they are just puppets system once votes entered ballot box jaffer iddukki says its not my business anymore i will say press i was ill informed it means hunters now will be hunted,0.47857142857142865,-0.03892857142857143,Negative,"{'Happy': 0.06, 'Angry': 0.0, 'Surprise': 0.33, 'Sad': 0.28, 'Fear': 0.33}"
8,Eerie Yet Familiar,"When Nayattu (The Hunt) starts, you have to leave everything and give it your full attention. Because once it starts, it never stops. And even after the film has ended by putting a crushing weight on you, you will stay seated wondering about helplessness. The story of three cops finding themselves in the middle of caste politics cuts open some of the ugliest truths about our country and the world in general, and this time it's not the common man who is at the receiving end. This is artful, subtle filmmaking. Nayattu (The Hunt) is eerie.",eerie yet familiar,when nayattu hunt starts you have leave everything give it your full attention because once it starts it never stops even after film has ended by putting crushing weight you you will stay seated wondering about helplessness story three cops finding themselves middle caste politics cuts open some ugliest truths about our country world general this time its not common man who is at receiving end this is artful subtle filmmaking nayattu hunt is eerie,0.595,-0.0008333333333333248,Negative,"{'Happy': 0.0, 'Angry': 0.06, 'Surprise': 0.24, 'Sad': 0.24, 'Fear': 0.47}"
8,A Gripping-Inside-Police-Department Story and a faceless system,"I'm surprised to have seen an Inside police department story for the first time.Directed by Martin Prakat, after 6 years since Charlie (2015), the movie gives you a gripping-intense-situation within the police system. The movie focuses more on the faceless system, and naturally only someone from within could give you more clarity on the reality.Few scenes of the movie were surprisingly shot in Ramamangalam. A great watch indeed.",gripping inside police department story faceless system,im surprised have seen inside police department story first time directed by martin prakat after 6 years since charlie 2015 movie gives you gripping intense situation within police system movie focuses more faceless system naturally only someone within could give you more clarity reality few scenes movie were surprisingly shot ramamangalam great watch indeed,0.6893939393939393,0.35,Positive,"{'Happy': 0.07, 'Angry': 0.0, 'Surprise': 0.21, 'Sad': 0.0, 'Fear': 0.71}"
9,Nayattu the reality..,It's a 100% movie on reality and fact of hidden version of the society which is going on right now and before. Theatre experience would have been more thrilling for these kind of movies. Excellent direction by martin and performance by all the actors too. Great cinematography by sk.,nayattu reality,its 100 movie reality fact hidden version society which is going right now before theatre experience would have been more thrilling these kind movies excellent direction by martin performance by all actors too great cinematography by sk,0.7170068027210884,0.4670068027210884,Positive,"{'Happy': 0.38, 'Angry': 0.12, 'Surprise': 0.12, 'Sad': 0.0, 'Fear': 0.38}"
9,"""There are no super heroes in the real world!"" 8.5/10","Nayattu is a satirical thriller that depicts the domino effect of dirty politics that leads to the hunting down, how 3 police officers are wrongfully accused, it starts with a slow pace and with some ramps it will be a thrilling and audience's are hooked till the end. Nayattu received rave reviews from audiences and critics alike.A movie that shows us the real colour of events happening around us and the harsh reality of the life an average police officer amidst social and political pressure.The three lead actors Kunchacko Boban acting, Nimisha Sajayan acting & Joju George play their roles with nuanced perfection, portraying their helplessness in this convoluted system and are left to their own.Must watch movie..! Netflix.",there are no super heroes real world 8 5 10,nayattu is satirical thriller that depicts domino effect dirty politics that leads hunting down how 3 police officers are wrongfully accused it starts with slow pace with some ramps it will be thrilling audiences are hooked till end nayattu received rave reviews audiences critics alike movie that shows us real colour events happening around us harsh reality life average police officer amidst social political pressure three lead actors kunchacko boban acting nimisha sajayan acting joju george play their roles with nuanced perfection portraying their helplessness this convoluted system are left their own must watch movie netflix,0.4014814814814815,-0.019259259259259257,Negative,"{'Happy': 0.0, 'Angry': 0.14, 'Surprise': 0.29, 'Sad': 0.24, 'Fear': 0.33}"
8,"The Third Malayalam Classic of 2021. Nayattu is not a film but a slap to the dirty system which includes politicians, police, casteism wolves and unfortunately common man too","Nayattu (2021) : Brief Review -The Third Malayalam Classic of the year after The Great Indian Kitchen and Drishyam 2. Nayattu is not a film but a slap to the dirty system which includes politicians, police, casteism wolves and unfortunately common man too. Nayattu is told as a thriller and it somewhat thrilling too but it's not enough to be called a complete thriller as the genre requires more thrill. But it has got much more than that mainstream thrill to provide you a cinematic experience that will shatter your mind, heart and perspective and maybe you'll start looking at things differently. You need guts to make a film like Nayattu where you fearlessly expose all the dirty secrets of the system and then give a tight slap on common man's face by proving that he is also the part of this system afterall. Yes, we are all part of this absurd system because we are the Voters and we always fall for their tricks without knowing the actual truth behind it. Nayattu is about Three police officers who are on a run for life, escaping the outbreak against them due to the unlawful arrest and torture of a civilian. It brings in a few shades of arrogant yet very much human police officers and their helplessness and how they fail to fight the powerful system who just exactly know how to handle things.l according to their comfort. The film is bounded by realistic surroundings throughout the narrative and it doesn't fear to show ugly side of all the people who are involved in this system. Martin Prakkat has achieved something brilliant of a whole new level with his extraordinary directorial technique as he compiles multiple genres and themes so well together in one narrative. All the actors are superb in their roles. Dialogues are decent but very realistic and maybe that's why they are not that filmy. Overall, Nayattu is Classic Film but more than that it is a miserable realisation of our own mistakes that we can never correct as far as we are living in this society. A MUST SEE!RATING - 8/10*By - #samthebestest.",third malayalam classic 2021 nayattu is not film but slap dirty system which includes politicians police casteism wolves unfortunately common man too,nayattu 2021 brief review third malayalam classic year after great indian kitchen drishyam 2 nayattu is not film but slap dirty system which includes politicians police casteism wolves unfortunately common man too nayattu is told as thriller it somewhat thrilling too but its not enough be called complete thriller as genre requires more thrill but it has got much more than that mainstream thrill provide you cinematic experience that will shatter your mind heart perspective maybe youll start looking at things differently you need guts make film like nayattu where you fearlessly expose all dirty secrets system then give tight slap common mans face by proving that he is also part this system afterall yes we are all part this absurd system because we are voters we always fall their tricks without knowing actual truth behind it nayattu is about three police officers who are run life escaping outbreak against them due unlawful arrest torture civilian it brings few shades arrogant yet very much human police officers their helplessness how they fail fight powerful system who just exactly know how handle things l according their comfort film is bounded by realistic surroundings throughout narrative it doesnt fear show ugly side all people who are involved this system martin prakkat has achieved something brilliant whole new level with his extraordinary directorial technique as he compiles multiple genres themes so well together one narrative all actors are superb their roles dialogues are decent but very realistic maybe thats why they are not that filmy overall nayattu is classic film but more than that it is miserable realisation our own mistakes that we can never correct as far as we are living this society must see rating 8 10 by,0.5039549218897046,0.025350555241859595,Positive,"{'Happy': 0.09, 'Angry': 0.06, 'Surprise': 0.2, 'Sad': 0.3, 'Fear': 0.35}"
9,Landmark in Malayalam cinema,System is messed up from the inside . Thin layer between common man and so called system and the ending is haunting like blue is the warmest colour . Great work Martin prakkat and the entire team.,landmark malayalam cinema,system is messed up inside thin layer between common man so called system ending is haunting like blue is warmest colour great work martin prakkat entire team,0.5650000000000001,0.020000000000000018,Positive,"{'Happy': 0.1, 'Angry': 0.2, 'Surprise': 0.0, 'Sad': 0.1, 'Fear': 0.6}"
10,Completely Realistic Survival Thriller,"Completely Realistic Survival Thriller that tells a very good and dynamic story. Kunchakoboban, Joju George, Nimisha, Jafer idukki were all shocked by the performance. Editing, Cinematography, Bgm etc .... all sparkle item. To be honest, I have never felt a bit negative about this film.",completely realistic survival thriller,completely realistic survival thriller that tells very good dynamic story kunchakoboban joju george nimisha jafer idukki were all shocked by performance editing cinematography bgm etc all sparkle item be honest i have never felt bit negative about this film,0.5304761904761904,0.12047619047619043,Positive,"{'Happy': 0.2, 'Angry': 0.0, 'Surprise': 0.2, 'Sad': 0.6, 'Fear': 0.0}"
7,Raw and bold!,"First of all i have to say this, my feelings for this film is mixed. First half was told in a very fast paced and engaging way, it was edge of seat stuff. But the second half felt more out of pace.The main aim of the film was to show that political side of things and they have done a decent job of it.Acting was to the point.Sound Mixing is one of the highlights, the background sound felt so immersive. Cinematography was impressive.At the end the only question i had was ""why was this film not released a week earlier??""",raw bold,first all i have say this my feelings this film is mixed first half was told very fast paced engaging way it was edge seat stuff but second half felt more out pace main aim film was show that political side things they have done decent job it acting was point sound mixing is one highlights background sound felt so immersive cinematography was impressive at end only question i had was why was this film not released week earlier,0.43791025641025644,0.17812820512820512,Positive,"{'Happy': 0.05, 'Angry': 0.05, 'Surprise': 0.4, 'Sad': 0.2, 'Fear': 0.3}"
8,After long time saw something genuine filmmaking,"This is how movies should be made. Very good story, good acting, music, cinematography. It doesn't seem like over done the theme or underdeveloped story, but more authentic approach of story telling.",after long time saw something genuine filmmaking,this is how movies should be made very good story good acting music cinematography it doesnt seem like over done theme or underdeveloped story but more authentic approach story telling,0.5042857142857143,0.4228571428571429,Positive,"{'Happy': 0.33, 'Angry': 0.0, 'Surprise': 0.0, 'Sad': 0.5, 'Fear': 0.17}"
8,A landmark in Malayalam cinema!,"Despite opening in theatres at the onset of the second wave of Covid 19, Nayattu received rave reviews from audiences and critics alike.And the Martin Prakatt survival thriller exceeded all my expectations on its OTT release tonight, delivering a gritty and compelling view into the lives of the average Kerala policeman.The story unfolds through its three lead protagonists who are police personnel wrongfully accused in a hit-and-run case and after a slow buildup, ramps up at breakneck pace and is sure to leave audiences hooked till the end.The painstaking detailed one-shot sequences and the raw authenticity director Martin Prakatt has imbibed into each scene reminds you of Abrid Shine's Action Hero Biju, but a superior script has elevated this film to classic, dare I say textbook status.National-award winner Joju George is at his best in the emotional scenes, while Kunchacko Boban and Nimisha Sajayan play their roles with nuanced perfection.Unmissable this one. I club it alongside The Great Indian Kitchen, Drishyam 2, Operation Java and Joji as my personal Top 5 Malayalam Films of 2021.This could very well be Malayalam's own equivalent of Bong Joon-ho's classic 'Memories of Murder' (2003) in terms of becoming a gold standard for realistic police stories going forward.Catch it on Netflix!",landmark malayalam cinema,despite opening theatres at onset second wave covid 19 nayattu received rave reviews audiences critics alike martin prakatt survival thriller exceeded all my expectations its ott release tonight delivering gritty compelling view into lives average kerala policeman story unfolds through its three lead protagonists who are police personnel wrongfully accused hit run case after slow buildup ramps up at breakneck pace is sure leave audiences hooked till end painstaking detailed one shot sequences raw authenticity director martin prakatt has imbibed into each scene reminds you abrid shines action hero biju but superior script has elevated this film classic dare i say textbook status national award winner joju george is at his best emotional scenes while kunchacko boban nimisha sajayan play their roles with nuanced perfection unmissable this one i club it alongside great indian kitchen drishyam 2 operation java joji as my personal top 5 malayalam films 2021 this could very well be malayalams own equivalent bong joon hos classic memories murder 2003 terms becoming gold standard realistic police stories going forward catch it netflix,0.4803224553224554,0.24405594405594408,Positive,"{'Happy': 0.08, 'Angry': 0.12, 'Surprise': 0.24, 'Sad': 0.16, 'Fear': 0.4}"
10,KYA BAAT HAI,Maaza agaya a movie that takes you on to ride so real its unbelievable really truly fan of Malayalam Cinema I am so proud of you Guys.,kya baat hai,maaza agaya movie that takes you ride so real its unbelievable really truly fan malayalam cinema i am so proud you guys,0.625,0.23750000000000002,Positive,"{'Happy': 0.25, 'Angry': 0.0, 'Surprise': 0.5, 'Sad': 0.25, 'Fear': 0.0}"
8,"A gutsy, hard-hitting survival drama thriller! [+75%]","It's always interesting to see filmmakers who revel in light-hearted commercial cinema take the plunge into darkness. Martin Prakkat - director of Best Actor, ABCD, and Charlie - comes up with a gutsy, hard-hitting affair in Nayattu, starring Kunchacko Boban, Joju George, and Nimisha Sajayan. This is a survival-drama-thriller set against the backdrop of elections in Kerala.Nayattu begins with an interesting tug-of-war scene that you'll circle back to at the end for several reasons. For instance, in thrillers, cops are the quintessential hunters. Here, they're the hunted. Three cops (played by the actors mentioned above) are torn between the government's racy attempt at solving an accidental death case (to appease their vote banks in the upcoming elections) and their ongoing personal issues. A set of immediate personal problems are introduced: Maniyan's daughter is set to participate in a youth festival, which he hopes to attend. Praveen's mother is unwell. Sunitha's house is a work-in-progress.Writer Shahi Kabir (who previously penned 'Joseph', a film I only mildly liked) keeps the characters and situations rooted in contemporary realism. The cops are often playtoys of the ruling government; we see that politicians are quick to wash their hands off when the public eye is involved. A dialogue from Maniyan early on - an analogy between cops and goons - hits you out of nowhere. I'd say the first half of Nayattu is more of a nail-biter thriller while the second stretches slightly into dramatic territory but in just the right doses.A slew of solid performances dominates Nayattu. The three leads are terrific. Joju George lives and breathes as Manikyan, adding subtleties that help differentiate him from the other cop roles he has played. Kunchacko Boban is also spot-on as Praveen; he's the more rational one amongst the three and his lines reflect that. Nimisha Sajayan's role is subdued and less vocal, but she ensures that her emoting compensates. The supporting cast is equally good - be it Jaffer Idukki (as the cunning CM), Yama Gilgamesh (as SP Arundhathi), or Anil Nedumangad.DOP Shyju Khalid's frames focus on the right things. Palpable tension gushes through almost every scene in the first half and even when the setting shifts to Munnar, the camera rarely halts to appreciate the incredible beauty of this place. That final shot of a blind woman casting her vote is a statement in itself - a classic example of good writing boosted by the right visuals. Vishnu Vijay's score elevates the underlying emotions of several scenes.The only issue I had with Nayattu was its fundamental implication that laws empowering Dalits are often misused. In reality, reported cases of Dalit oppression far outnumber such instances. That hiccup aside, Nayattu is a worthy case study in how to tackle survival thrillers.",gutsy hard hitting survival drama thriller,its always interesting see filmmakers who revel light hearted commercial cinema take plunge into darkness martin prakkat director best actor abcd charlie comes up with gutsy hard hitting affair nayattu starring kunchacko boban joju george nimisha sajayan this is survival drama thriller set against backdrop elections kerala nayattu begins with interesting tug war scene that youll circle back at end several reasons instance thrillers cops are quintessential hunters here theyre hunted three cops played by actors mentioned above are torn between governments racy attempt at solving accidental death case appease their vote banks upcoming elections their ongoing personal issues set immediate personal problems are introduced maniyans daughter is set participate youth festival which he hopes attend praveens mother is unwell sunithas house is work progress writer shahi kabir who previously penned joseph film i only mildly liked keeps characters situations rooted contemporary realism cops are often playtoys ruling government we see that politicians are quick wash their hands off when public eye is involved dialogue maniyan early analogy between cops goons hits you out nowhere id say first half nayattu is more nail biter thriller while second stretches slightly into dramatic territory but just right doses slew solid performances dominates nayattu three leads are terrific joju george lives breathes as manikyan adding subtleties that help differentiate him other cop roles he has played kunchacko boban is also spot as praveen hes more rational one amongst three his lines reflect that nimisha sajayans role is subdued less vocal but she ensures that her emoting compensates supporting cast is equally good be it jaffer idukki as cunning cm yama gilgamesh as sp arundhathi or anil nedumangad dop shyju khalids frames focus right things palpable tension gushes through almost every scene first half even when setting shifts munnar camera rarely halts appreciate incredible beauty this place that final shot blind woman casting her vote is statement itself classic example good writing boosted by right visuals vishnu vijays score elevates underlying emotions several scenes only issue i had with nayattu was its fundamental implication that laws empowering dalits are often misused reality reported cases dalit oppression far outnumber such instances that hiccup aside nayattu is worthy case study how tackle survival thrillers,0.4496428571428572,0.13864285714285715,Positive,"{'Happy': 0.1, 'Angry': 0.13, 'Surprise': 0.2, 'Sad': 0.12, 'Fear': 0.45}"
8,Police being chased,"Even though the film relies heavily on propoganda,you will realise the film doesn't only get milked by it but it also succeeds in keeping the suspense and thrill intact throughout the running time satisfying the genre and doesn't keep any loose ends in doing so. Martin Prakkat has been building quite a rapport as a filmmaker,he completely switched gears here after his last film""Charlie"". The political backdrop, although instrumental ,is not the reason the film works but it's the thrill and suspense it offers .",police being chased,even though film relies heavily propoganda you will realise film doesnt only get milked by it but it also succeeds keeping suspense thrill intact throughout running time satisfying genre doesnt keep any loose ends doing so martin prakkat has been building quite rapport as filmmaker he completely switched gears here after his last film charlie political backdrop although instrumental is not reason film works but its thrill suspense it offers,0.3817663817663818,0.12478632478632481,Positive,"{'Happy': 0.1, 'Angry': 0.0, 'Surprise': 0.2, 'Sad': 0.3, 'Fear': 0.4}"
9,Devastatingly true,"Nayattu hits us with the devastating truth. It's we the people, who're guilty. It's we the people, who lead the system to bury truth, and pander to media fanned mob frenzy.",devastatingly true,nayattu hits us with devastating truth its we people whore guilty its we people who lead system bury truth pander media fanned mob frenzy,0.8833333333333333,-0.3833333333333333,Negative,"{'Happy': 0.17, 'Angry': 0.33, 'Surprise': 0.17, 'Sad': 0.0, 'Fear': 0.33}"
10,MORE THAN Just A THRILLER. The REALITY.,"Nayattu is more than just a thriller. If you watch this as a thriller it'll engage you throughout the film. And if you want more from this, it'll make you think, also can make you depressed. It shows us the harsh reality of political system & the helplessness of police system.All 3 leads are great in the film especially Joju George & Nimisha. Martin Prakkat has previously gifted us fictitious and magical CHARLIE and now completely RAW Nayattu. That proves his credibility as a Director. I'm sure some frames will remain with you specially the last one. This film should be watched by all. Also if you want to know more about the police system, it's a MUST WATCH.Available On Netflix.© MandalBros.",more than just thriller reality,nayattu is more than just thriller if you watch this as thriller itll engage you throughout film if you want more this itll make you think also can make you depressed it shows us harsh reality political system helplessness police system all 3 leads are great film especially joju george nimisha martin prakkat has previously gifted us fictitious magical charlie now completely raw nayattu that proves his credibility as director im sure some frames will remain with you specially last one this film should be watched by all also if you want know more about police system its must watch available netflix mandalbros,0.5578062678062679,0.3046153846153846,Positive,"{'Happy': 0.06, 'Angry': 0.0, 'Surprise': 0.28, 'Sad': 0.33, 'Fear': 0.33}"
10,Incredibly TRUE INDIA !,"Excellent direction, ONLY REALITY , power and money rule even 20 year veteran cops who've given everything to the country but can be manipulated by those around them in a second - ALL 99% India cares about is retaining their job and progressing at cost of others, welding to higher ups and those in power. Extremely TRUE and Im not being cynical.",incredibly true india,excellent direction only reality power money rule even 20 year veteran cops whove given everything country but can be manipulated by those around them second all 99 india cares about is retaining their job progressing at cost others welding higher ups those power extremely true im not being cynical,0.6,0.16875,Positive,"{'Happy': 0.09, 'Angry': 0.18, 'Surprise': 0.09, 'Sad': 0.18, 'Fear': 0.45}"
