Rating,Review Title,Review,Cleaned Review Title,Cleaned Review,Subjectivity,Polarity,Sentiment,Emotion Scale
9,Ending is as Raw as it can get,"Nayattu is definitely going into the club with Dhrishyam 2, The Great Indian kitchen, Operation Java, Joji, as the finest movies which people have made for this pandemic; OTT releases.The realistic storyline about how this horrific system works and how Police officers are forced to be puppets to the system. It's about how 3 police officers are wrongfully accused, it starts with a slow pace and with some ramps it will be a thrilling and audience's are hooked till the end.Ending is as raw as it can get, this is no fantasy where there will be a hero, people fail in front of the system. That's the reality.It can be Malayalam equivalent to Bong Joon Ho's "" Memories of Murder(2003) "" in context of realistic police stories.",ending is as raw as it can get,nayattu is definitely going into club with dhrishyam 2 great indian kitchen operation java joji as finest movies which people have made this pandemic ott releases realistic storyline about how this horrific system works how police officers are forced be puppets system its about how 3 police officers are wrongfully accused it starts with slow pace with some ramps it will be thrilling audiences are hooked till end ending is as raw as it can get this is no fantasy where there will be hero people fail front system thats reality it can be malayalam equivalent bong joon hos memories murder 2003 context realistic police stories,0.5217948717948718,-0.10710955710955711,Negative,"{'Happy': 0.06, 'Angry': 0.06, 'Surprise': 0.19, 'Sad': 0.06, 'Fear': 0.62}"
8,Reality movie..!!,Three policemen had accused falsely for murder a buy who is conserved caste... while travel in ploce jeep their driver accidentally dash that boy and driver ren off..all policemen were seaching for them and climax is soo realistic without any commercial elements.. Must watch thriller..,reality movie,three policemen had accused falsely murder buy who is conserved caste while travel ploce jeep their driver accidentally dash that boy driver ren off all policemen were seaching them climax is soo realistic without any commercial elements must watch thriller,0.3111111111111111,-0.0777777777777778,Negative,"{'Happy': 0.0, 'Angry': 0.0, 'Surprise': 1.0, 'Sad': 0.0, 'Fear': 0.0}"
9,Haunting...,"Well crafted film, with tight script, wondeful acting. But it leaves you at the end sad, gloomy and haunted.You don't see justice get done, you don't see the system rectified, you don't see anyone changing for the good. Nothing. Like current reality I guess.",haunting,well crafted film with tight script wondeful acting but it leaves you at end sad gloomy haunted you dont see justice get done you dont see system rectified you dont see anyone changing good nothing like current reality i guess,0.45714285714285713,0.00428571428571427,Positive,"{'Happy': 0.17, 'Angry': 0.0, 'Surprise': 0.17, 'Sad': 0.33, 'Fear': 0.33}"
10,100% reality,This movie shows the ultimate reality of what is happening in our police forces.And how they handle the cases.,100 reality,this movie shows ultimate reality what is happening our police forces how they handle cases,1.0,0.0,Neutral,"{'Happy': 0.0, 'Angry': 0.0, 'Surprise': 0.0, 'Sad': 0.0, 'Fear': 1.0}"
8,Talking the current politics,"The Dalit issue is an important field that films discuss so many times but in the Malayalam film industry, it has its own way in a negligible amount. Dr. Biju and somehow Priyanandan show their interest in depicting dalit's topics but apart from the parallel cinema field, the topic is undiscussed till now. Here, in Nayattu not in the core way Dalit issue is not much projected but the film has its own shadows there. A brilliant survival story, the movie goes through the various depiction of political Kerala (not only around Kerala) and also how politics interfere in all sections of society especially in the force. It's a mixture of the current social scenario.",talking current politics,dalit issue is important field that films discuss so many times but malayalam film industry it has its own way negligible amount dr biju somehow priyanandan show their interest depicting dalits topics but apart parallel cinema field topic is undiscussed till now here nayattu not core way dalit issue is not much projected but film has its own shadows there brilliant survival story movie goes through various depiction political kerala not only around kerala also how politics interfere all sections society especially force its mixture current social scenario,0.5833333333333333,0.2095238095238095,Positive,"{'Happy': 0.27, 'Angry': 0.0, 'Surprise': 0.0, 'Sad': 0.09, 'Fear': 0.64}"
10,Open question to your political conscience,"Theme is brilliant. Bold. Realistic.You are watching the movie thinking that the protagonists are going to escape from impossible situations as the script writer is on their side.However, that is a decoy. The makers have bigger fish to fry. And they present it in a way that you simply cannot ignore. You are all intent and looking for how the protagonists are going to escape the hunt, and then the movie springs it's net and traps you with realities that you can no longer shut your eyes to.The depth of corruptness in the system, and how justice is trapped across so many deep layers of trenches that you are left feeling helpless on how justice can be served amidst all this.At the end of the movie, in the protagonists, you see yourself and you are asked whether you would add another trench in the way of justice. The ending of the movie felt like the beginning of a much bigger saga.Background sounds have been pretty good and captures the tensions in the movie really well. Script is great and realistic.On the costumes and make-up side, there were some scenes that stood out like a sore thumb. Kunjacko Boban is seen with excessive makeup after days of struggling through the hunt - something that you would not see in a Dileesh Pothan movie for instance. However, in terms of subject, ""Nayattu"" beats ""Joji"" by miles in terms of how ""Nayattu"" presents something fresh where as ""Joji"" is old wine in new bottle.The communication between the makers and the viewers do not stop at the movie. Viewer is forced to probe his own conscience. And that is the power of the movie. The movie ""Court"" had left me in a similar state. This one feels closer home as the movie is set in my native.Joju and Kunjacko have performed really well. Nimisha has less of an opportunity on this one. All the other character actors have also performed really well.Martin Prakkat - take a bow!! Original content, original perspective, great direction - hats off!",open question your political conscience,theme is brilliant bold realistic you are watching movie thinking that protagonists are going escape impossible situations as script writer is their side however that is decoy makers have bigger fish fry they present it way that you simply cannot ignore you are all intent looking how protagonists are going escape hunt then movie springs its net traps you with realities that you can no longer shut your eyes depth corruptness system how justice is trapped across so many deep layers trenches that you are left feeling helpless how justice can be served amidst all this at end movie protagonists you see yourself you are asked whether you would add another trench way justice ending movie felt like beginning much bigger saga background sounds have been pretty good captures tensions movie really well script is great realistic costumes make up side there were some scenes that stood out like sore thumb kunjacko boban is seen with excessive makeup after days struggling through hunt something that you would not see dileesh pothan movie instance however terms subject nayattu beats joji by miles terms how nayattu presents something fresh where as joji is old wine new bottle communication between makers viewers do not stop at movie viewer is forced probe his own conscience that is power movie movie court had left me similar state this one feels closer home as movie is set my native joju kunjacko have performed really well nimisha has less opportunity this one all other character actors have also performed really well martin prakkat take bow original content original perspective great direction hats off,0.4422228234728235,0.14522306397306398,Positive,"{'Happy': 0.15, 'Angry': 0.05, 'Surprise': 0.23, 'Sad': 0.12, 'Fear': 0.45}"
9,Excellent...,"Excellent. Wonderful narrative with gripping screenplay, good artistical performance bylead roles. Well directed.thankyou team NAYATTU.",excellent,excellent wonderful narrative with gripping screenplay good artistical performance bylead roles well directed thankyou team nayattu,0.9199999999999999,0.8400000000000001,Positive,"{'Happy': 0.6, 'Angry': 0.0, 'Surprise': 0.2, 'Sad': 0.0, 'Fear': 0.2}"
9,A Gripping Tale.,"Nayattu is Martin Prakkat's film after much celebrated ""Charlie"" 6years ago. The film starts with usual introductions of various characters and their background. The film stays aloof in terms of story for half an hour post which it takes a complete U turn pulling the viewers into the story pumping them with adrenaline, keeping them engaged throughout without even allowing them to blink for a moment. It does hold its pace till the very end but keeps it open for viewers to assume a non-tragic climax.Joju, Kunchako and Nimisha carries the entire film without a problem, portraying very well the emotions the characters go through on every moment.Anil Nedumangad and Yama Gilgamesh were other plus points. . Technical crew including the cinematography, music and editing were spot on. Doesn't fall short. Doesn't pop like a sore thumb. Perfect.Overall this is a well made thriller that can keep ons engaged for 2hours.",gripping tale,nayattu is martin prakkats film after much celebrated charlie 6years ago film starts with usual introductions various characters their background film stays aloof terms story half hour post which it takes complete u turn pulling viewers into story pumping them with adrenaline keeping them engaged throughout without even allowing them blink moment it does hold its pace till very end but keeps it open viewers assume non tragic climax joju kunchako nimisha carries entire film without problem portraying very well emotions characters go through every moment anil nedumangad yama gilgamesh were other plus points technical crew including cinematography music editing were spot doesnt fall short doesnt pop like sore thumb perfect overall this is well made thriller that can keep ons engaged 2hours,0.4572916666666666,0.06614583333333333,Positive,"{'Happy': 0.0, 'Angry': 0.18, 'Surprise': 0.18, 'Sad': 0.18, 'Fear': 0.45}"
