Rating,Review Title,Review,Cleaned Review Title,Cleaned Review,Subjectivity,Polarity,Sentiment,Emotion Scale
,Well-made movie with a perfect local flavor,"A whiff of fresh air, after a glut of movies trudging the same cliché-ridden run-of-the-mill plot lines and mainstream tropes some of us are really tired of. Now, one thing a lot of people are gonna feel about the movie when they walk out, is its connect to the food industry, and while that exists, in a manner of speaking, it is (unfortunately, to me) not the sole focus, and the link is, at best, tenuous. The way they do not get into details the way The 100-foot journey /Cheeni Kum / Burnt / Chef (food trucks come from this one) / No Reservations / Ratatouille all do. However, let's look at all the good stuff first. Believe me, most of the stuff IS good. 1. For a few, pace could be the thing. For me though, no matter how long the movie is, 'how long did it feel' is a key component of things I look for. For this one, it just zipped past, all thru, even when it did take the cliché-ridden route on many occasions post- intermission, and even overall, it clocks at a lean/mean 2 hours/so, even with an informal/blooper reel during the end-credits (a trend of sorts these days). 2. Feel that this could be a spiritual companion-piece to Shekhar Kammula's 'Godavari'. That one took 2 strong-minded leads, followed their respective trajectories, and using a road-movie template allowed us to watch things unfurl, while this one sticks to their trajectories, and watches things unfurl over there. Ritu Varma (previously seen with both Nani and Vijay Devarakonda in 'Yevade Subrahmanyam', this time reuniting with Vijay D) is almost a perfect foil for Kamalini Mukherjee (though not as cute/sweet/endearing as Kammula's muse), and while Devarakonda's & Sumanth's characters are polar opposites of the other, while having similar trajectories eventually, esp. when it comes to relating to their leading ladies. Of course, another movie with which this one has it DNA firmly in- place is 'Band Baaja Baaraat' (imho, Singh/Sharma have not come close to topping their performances from that one yet, in spite of all the accolades they've received for their later work, but their characters could not hold a candle to the lead pair in this one), with the milieu being changed from wedding planning to operating/running the business of food trucks.3. The eclectic selection of background score themes and the songs that play in the background, that (gradually seem/sound to) fit each situation, and yet have something for everyone (everyone will not enjoy everything on play, btw), which is quite unorthodox, and kinda stood out for me. Disappointingly though, not all of the score made it to the iTunes album being sold. 1 of the best parts about the score though, is that they play out mostly in the background, and do not interrupt the flow of the narrative, sometimes looping over various sequences, guiding context based on the similarity of musical theme.4. The production/set design, along with the cinematography, are pitch-perfect for the material on hand, and complement the narrative in just the right way, without calling attention to themselves. 5. The narrative style changes from the one pre-intermission (mostly contextual flashbacks) to the staid one that takes over post, and makes for an interesting transition. Keeps our interest going, for most of the time. 6. All the performances are good, and the screenplay gives the best lines to 2 relatively new character actors, 1 with a comic theme (Priyadarshi Pulikonda), and the other playing an unorthodox matter- of-fact kind of character, the kind that is rarely-seen in local fare (Anish Kuruvilla). Gururaj Manepalli and Kedar Shankar get the opportunity to weave a few interesting/unorthodox notes into their clichéed roles, and that is, indeed, something of a pleasure to watch. Short shrift is given to some (Abhay Bethiganti - I think there was some material there, and the lady who plays Anish Kuruvilla's daughter), but that's par for the course, I guess. The elephant in the room, is of course, what almost everyone has taken away from this flick, that of the deadpan-deliverer of the funniest lines in the flick - Priyadarshi Pulikonda. I won't say much abt it, other than saying that it's not just his success, and credit has to go to the writer/director equally, if not more - Tharun Bhascker Dhaasyam.7. While I did not like the way certain lead characters treat the household help, in hindsight, the way it has been depicted does shine the light on cold fact. 8. One of my all-time favorite aspects about the movie is the way they've shot it in 2 of my fav places to dine out locally - Café D- Hide (for some reason tho, they called it 'Social', even though the sign is clearly visible), and Cinema Social (watched it in the same mall, coincidentally), and the time they take over there (which, for my money, was good, but not about enough). :-). On the other side though, other than the movie not embracing its milieu the way it's apparent inspirations did (referred to earlier her), mature language is also allowed to be present, which is topical. However, it also points to the hypocrisy inherent in the local guardiansofthemovies, which would have muted/cut off the same words in an international production. Sigh. I also did not much care for the way Hash browns were used to signify taste, but will not talk about the context much.Anyways, in conclusion, worth repeat viewings, on the big screen...",well made movie with perfect local flavor,whiff fresh air after glut movies trudging same clich ridden run mill plot lines mainstream tropes some us are really tired now one thing lot people are gonna feel about movie when they walk out is its connect food industry while that exists manner speaking it is unfortunately me not sole focus link is at best tenuous way they do not get into details way 100 foot journey cheeni kum burnt chef food trucks come this one no reservations ratatouille all do however lets look at all good stuff first believe me most stuff is good 1 few pace could be thing me though no matter how long movie is how long did it feel is key component things i look this one it just zipped past all thru even when it did take clich ridden route many occasions post intermission even overall it clocks at lean mean 2 hours so even with informal blooper reel during end credits trend sorts these days 2 feel that this could be spiritual companion piece shekhar kammulas godavari that one took 2 strong minded leads followed their respective trajectories using road movie template allowed us watch things unfurl while this one sticks their trajectories watches things unfurl over there ritu varma previously seen with both nani vijay devarakonda yevade subrahmanyam this time reuniting with vijay d is almost perfect foil kamalini mukherjee though not as cute sweet endearing as kammulas muse while devarakondas sumanths characters are polar opposites other while having similar trajectories eventually esp when it comes relating their leading ladies course another movie with which this one has it dna firmly place is band baaja baaraat imho singh sharma have not come close topping their performances that one yet spite all accolades theyve received their later work but their characters could not hold candle lead pair this one with milieu being changed wedding planning operating running business food trucks 3 eclectic selection background score themes songs that play background that gradually seem sound fit each situation yet have something everyone everyone will not enjoy everything play btw which is quite unorthodox kinda stood out me disappointingly though not all score made it itunes album being sold 1 best parts about score though is that they play out mostly background do not interrupt flow narrative sometimes looping over various sequences guiding context based similarity musical theme 4 production set design along with cinematography are pitch perfect material hand complement narrative just right way without calling attention themselves 5 narrative style changes one pre intermission mostly contextual flashbacks staid one that takes over post makes interesting transition keeps our interest going most time 6 all performances are good screenplay gives best lines 2 relatively new character actors 1 with comic theme priyadarshi pulikonda other playing unorthodox matter fact kind character kind that is rarely seen local fare anish kuruvilla gururaj manepalli kedar shankar get opportunity weave few interesting unorthodox notes into their clich ed roles that is indeed something pleasure watch short shrift is given some abhay bethiganti i think there was some material there lady who plays anish kuruvillas daughter but thats par course i guess elephant room is course what almost everyone has taken away this flick that deadpan deliverer funniest lines flick priyadarshi pulikonda i wont say much abt it other than saying that its not just his success credit has go writer director equally if not more tharun bhascker dhaasyam 7 while i did not like way certain lead characters treat household help hindsight way it has been depicted does shine light cold fact 8 one my all time favorite aspects about movie is way theyve shot it 2 my fav places dine out locally caf d hide some reason tho they called it social even though sign is clearly visible cinema social watched it same mall coincidentally time they take over there which my money was good but not about enough other side though other than movie not embracing its milieu way its apparent inspirations did referred earlier her mature language is also allowed be present which is topical however it also points hypocrisy inherent local guardiansofthemovies which would have muted cut off same words international production sigh i also did not much care way hash browns were used signify taste but will not talk about context much anyways conclusion worth repeat viewings big screen,0.4084197890232374,0.17469958202716826,Positive,"{'Happy': 0.13, 'Angry': 0.07, 'Surprise': 0.25, 'Sad': 0.21, 'Fear': 0.34}"
8.0,Pellichoopulu is the one of the best Telugu movies I've seen in a while!,"I watched Pellichoopulu without much hope of being impressed or even of being entertained. Recent Telugu movies have been passable, but nothing that really got my attention. Pellichoopulu totally blew these thoughts out of my head!The first half of PC was riotously funny, as the gang led by Prashant (Vijay Devarakonda) are goons who engage in the same dumb things college guys do around the world. Koushik (Priyadarshi) was unbelievably funny--the last time I remember laughing that much at a comedian's antics was maybe the Sunil of old (movies like Dhee, Ready, etc.). Ritu Verma as Chitra was awesome--I distinctly remember being amazed that there was finally a true-to-life strong female character in a Telugu movie. Perhaps the most striking aspect of the first half was that it was so current and relevant. Every teenager sees aspects of their group of friends in Prashant's gang, and the insertion of jokes about social media was timely and hilarious. Chitra's determination and modern character makeup was far more reminiscent of today's Indian women than the made-up doll roles that Tammannah, Samantha, and even Kajal frequently find themselves in.The second half slowed down considerably, as the focus shifted to the emerging love story between Prashant and Chitra. I was a little less enthused about this half, but I believe it to have been very well done in its own way. The tension between the two kept me engaged, and the non-obvious way in which it resolved itself left me more satisfied than the usual fight scenes that Telugu movies use as a way of having a hero save the heroine.Overall, Pelli Choopulu is a must-watch with great writing, direction, and action. I know I will be watching it again for many years.",pellichoopulu is one best telugu movies ive seen while,i watched pellichoopulu without much hope being impressed or even being entertained recent telugu movies have been passable but nothing that really got my attention pellichoopulu totally blew these thoughts out my head first half pc was riotously funny as gang led by prashant vijay devarakonda are goons who engage same dumb things college guys do around world koushik priyadarshi was unbelievably funny last time i remember laughing that much at comedians antics was maybe sunil old movies like dhee ready etc ritu verma as chitra was awesome i distinctly remember being amazed that there was finally true life strong female character telugu movie perhaps most striking aspect first half was that it was so current relevant every teenager sees aspects their group friends prashants gang insertion jokes about social media was timely hilarious chitras determination modern character makeup was far more reminiscent todays indian women than made up doll roles that tammannah samantha even kajal frequently find themselves second half slowed down considerably as focus shifted emerging love story between prashant chitra i was little less enthused about this half but i believe it have been very well done its own way tension between two kept me engaged non obvious way which it resolved itself left me more satisfied than usual fight scenes that telugu movies use as way having hero save heroine overall pelli choopulu is must watch with great writing direction action i know i will be watching it again many years,0.4480607966457024,0.20406184486373163,Positive,"{'Happy': 0.24, 'Angry': 0.0, 'Surprise': 0.36, 'Sad': 0.05, 'Fear': 0.36}"
9.0,Breezy and beautiful,The movie is completely surrounded by positive vibes. From beginning to ending the charm of the film never fades. Vijay devarakonda excels in his role with his natural emotions. The character called kowshik made movie extra special.,breezy beautiful,movie is completely surrounded by positive vibes beginning ending charm film never fades vijay devarakonda excels his role with his natural emotions character called kowshik made movie extra special,0.5028138528138527,0.2724025974025974,Positive,"{'Happy': 0.25, 'Angry': 0.0, 'Surprise': 0.25, 'Sad': 0.25, 'Fear': 0.25}"
10.0,#10/10 For a Telugu Movie,#MustWatch. Telugu movies are changing for the better. There is still room to grow though. And now the faults: 1. Child artists are used only for the cuteness. Same thing happens here with him getting locked in with the potential bride and groom. At least his role was very small. If used too much it goes from annoying to unbearable. Now here is an excuse for the guy and girl to get to know each other. Okay so its forgivable as it pushes the plot along. 2. Too many coincidences. During their conversation they and in turn we realize that their paths have crossed. While Prashant (actor Vijay's character) was interning as a chef Chitra (actress Ritu's character) was a customer in that restaurant. Prashant's call center outburst went viral on YouTube and Chitra saw it yet she only realized that it was him when he tells her. That seems neither here nor there. The call center outburst though hilarious was due to another coincidence Lol #Coincidance #HandsomeDancer by James Manzello. 3. The love blossoms and they do not know how to express it till the very end which is really for the commercial point of view. Total 3 faults.The guys as it turns out actually went to the wrong house. They started the food truck business together which was inspired by true events and they slowly fell in love while gradually going down different paths till they hit a fork in the road and you know the rest. The first potential father in law was money minded but frank and sensible also. Anyway it is a happy ending which is okay in this case I guess. It is a nice feelgood movie,10 telugu movie,telugu movies are changing better there is still room grow though now faults 1 child artists are used only cuteness same thing happens here with him getting locked with potential bride groom at least his role was very small if used too much it goes annoying unbearable now here is excuse guy girl get know each other okay so its forgivable as it pushes plot along 2 too many coincidences during their conversation they turn we realize that their paths have crossed while prashant actor vijays character was interning as chef chitra actress ritus character was customer that restaurant prashants call center outburst went viral youtube chitra saw it yet she only realized that it was him when he tells her that seems neither here nor there call center outburst though hilarious was due another coincidence lol by james manzello 3 love blossoms they do not know how express it till very end which is really commercial point view total 3 faults guys as it turns out actually went wrong house they started food truck business together which was inspired by true events they slowly fell love while gradually going down different paths till they hit fork road you know rest first potential father law was money minded but frank sensible also anyway it is happy ending which is okay this case i guess it is nice feelgood movie,0.5402124183006537,0.11233660130718953,Positive,"{'Happy': 0.14, 'Angry': 0.12, 'Surprise': 0.3, 'Sad': 0.19, 'Fear': 0.26}"
9.0,One of the best Telugu movie of 2016. Its a gem to the industry and its a movie not to be missed,"""One of the best Telugu movie of 2016. Its a gem to the industry and its a movie not to be missed"" My rating- 4.5/5 (Movie with every ingredients mixed)Positives- 1.) Direction,script and story- Direction was amazing and cant believe that Telugu industry has creative directors. Each and every scene was fabulous and entertaining. Script was masterpiece and it made a simple story excellent with powerful script.2.)All actors- Everyone did their parts well. All were realistic and special mention to Vijay and ritu who acted out their parts very well and those two friends of vijay were hilarious specially priyadarshi whose humors went with the flow.3.)Comedy- All the comedy were realistic and its something which we also see in day to day life and its presented out well on screen by actors. Director needs to be appreciated for portraying youth's stupidity with realism and i am sure all youth's could relate to it.4.)Emotions and message mixed very well in the story and audience could get the feel.5.) songs and bg score Negatives- (Nothing) Is it a must watch? Yes, and its a movie not to be missed. I hope this movie gets remaked so that non-Telugu audience can also see it.Overall- Its very rare to see this type of movie and its one of the all time best Telugu movie and also it comes under my top 20 favorite movie list.My rating- 4.5/5 (Movie with every ingredients mixed)for more reviews on all language movies go to - Ridinbal movie reviews",one best telugu movie 2016 its gem industry its movie not be missed,one best telugu movie 2016 its gem industry its movie not be missed my rating 4 5 5 movie with every ingredients mixed positives 1 direction script story direction was amazing cant believe that telugu industry has creative directors each every scene was fabulous entertaining script was masterpiece it made simple story excellent with powerful script 2 all actors everyone did their parts well all were realistic special mention vijay ritu who acted out their parts very well those two friends vijay were hilarious specially priyadarshi whose humors went with flow 3 comedy all comedy were realistic its something which we also see day day life its presented out well screen by actors director needs be appreciated portraying youths stupidity with realism i am sure all youths could relate it 4 emotions message mixed very well story audience could get feel 5 songs bg score negatives nothing is it must watch yes its movie not be missed i hope this movie gets remaked so that non telugu audience can also see it overall its very rare see this type movie its one all time best telugu movie also it comes under my top 20 favorite movie list my rating 4 5 5 movie with every ingredients mixed more reviews all language movies go ridinbal movie reviews,0.5716269841269842,0.36562925170068034,Positive,"{'Happy': 0.24, 'Angry': 0.03, 'Surprise': 0.35, 'Sad': 0.21, 'Fear': 0.18}"
9.0,Crisp and Clean,"This movie is one of those rare movies where everything fell into right place . cool performances . The actors have done a great job in portraying the roles . Specially the lead cast performances are on point and most of people remember them by their character's names and that's the best thing about it . Their friends characterization and group scenes are absolutely hilarious . Telangana slang is used in an awesome way. specially Darshi , is an actor surely to look out for . His timing is top class and whenever he's on screen the movie is some next level . Music is great and used to good extent . The fusion they did with song in ""raalu raga poolamala"" song is great experiment and it worked for the film . Mainly the heroine is so beautiful and she has done author backed role that's commendable . hope it gives her a break that she deserves . Finally, I would like to talk about the man who is responsible for putting this all together--Tharu bascker,director . Kudos to him for writing this simple yet intriguing story and for showing it and clean manner without inducing unnecessary songs and slapstick comedy . The best part about it is , the film has repeat value, you can watch as many times you want and not get bored with it . One minor problem is that the climax ended simply and was predictable i wish director could have pulled out some racy climax .Like instead of radio as climax they could have used her Australia thing like her not giving up and hero eventually chases her to airport to tell her about his love . something like that not exactly though. but rest of the movie is awesome so one can ignore these minor things.",crisp clean,this movie is one those rare movies where everything fell into right place cool performances actors have done great job portraying roles specially lead cast performances are point most people remember them by their characters names thats best thing about it their friends characterization group scenes are absolutely hilarious telangana slang is used awesome way specially darshi is actor surely look out his timing is top class whenever hes screen movie is some next level music is great used good extent fusion they did with song raalu raga poolamala song is great experiment it worked film mainly heroine is so beautiful she has done author backed role thats commendable hope it gives her break that she deserves finally i would like talk about man who is responsible putting this all together tharu bascker director kudos him writing this simple yet intriguing story showing it clean manner without inducing unnecessary songs slapstick comedy best part about it is film has repeat value you can watch as many times you want not get bored with it one minor problem is that climax ended simply was predictable i wish director could have pulled out some racy climax like instead radio as climax they could have used her australia thing like her not giving up hero eventually chases her airport tell her about his love something like that not exactly though but rest movie is awesome so one can ignore these minor things,0.5981040564373897,0.3590277777777777,Positive,"{'Happy': 0.19, 'Angry': 0.02, 'Surprise': 0.3, 'Sad': 0.11, 'Fear': 0.39}"
