Rating,Review Title,Review,Cleaned Review Title,Cleaned Review,Subjectivity,Polarity,Sentiment,Emotion Scale
9.0,Tharun Bhascker Scores and how!,"Tharun Bhascker Daassyam, almost a year and half ago, this name was trending in the film fraternity, especially in TFI and do you know why? That's because, one of the most acclaimed short films of recent times 'Sainma' debuted online at that time and later got released on YouTube after making enough fortune. And that film is this man Bhascker's brain child. Well, you might wonder why I'm stressing so much on his short 'Sainma' rather than talking about 'Pellichupulu', that's because the 20 odd minutes you spend watching 'Sainma' speaks volumes about this mans talent and believe me, you will never regret watching it. Coming to the current topic, the flick's based or precisely developed from Bhascker's previously directed, another well acclaimed short 'Anukokunda'. The film is a coming of age comedy-drama and the story is about Chitra and Prashanth who meet for the first time in a pellichupulu and eventually how they travel along with each other is what that follows. That's it, simple right? No, hold on. There are a lot of twists and turns in this simple story line, thanks to the well written screenplay. The way in which the first half runs is too damn good. It just flows and you won't even realise its almost time for a break. Though the story gets a lil predictable in the second half, it still manages to keep audience intact with the flow. The characters and the characterizations in the film are so near to reality that one can easily relate to them. And the dialogues are one of the biggest assets to the film, simple and real. The actors Vijay Devarakonda and Ritu Varma were competent to show there skills and make their presence felt. They did a 100% justice to their characters, commendable performances. And there is this character named 'Kaushik' played by Priyadarshi, man o man, what a gem of dialogue delivery he has! Made the whole theatre erupt in laughter for more than 10 times I guess, brilliant acting. Rest of the cast did their part well. Coming to the technical side, editing was neat. Cinematography was good. Music, scored by Vivek Sagar was too good and apt at many situations. Very hardly does one see The Hindu review a movie and call it 'A Gem'. What more do you want? Just go and grab a ticket, this one's a sure shot hit.",tharun bhascker scores how,tharun bhascker daassyam almost year half ago this name was trending film fraternity especially tfi do you know why thats because one most acclaimed short films recent times sainma debuted online at that time later got released youtube after making enough fortune that film is this man bhasckers brain child well you might wonder why im stressing so much his short sainma rather than talking about pellichupulu thats because 20 odd minutes you spend watching sainma speaks volumes about this mans talent believe me you will never regret watching it coming current topic flicks based or precisely developed bhasckers previously directed another well acclaimed short anukokunda film is coming age comedy drama story is about chitra prashanth who meet first time pellichupulu eventually how they travel along with each other is what that follows thats it simple right no hold there are lot twists turns this simple story line thanks well written screenplay way which first half runs is too damn good it just flows you wont even realise its almost time break though story gets lil predictable second half it still manages keep audience intact with flow characters characterizations film are so near reality that one can easily relate them dialogues are one biggest assets film simple real actors vijay devarakonda ritu varma were competent show there skills make their presence felt they did 100 justice their characters commendable performances there is this character named kaushik played by priyadarshi man o man what gem dialogue delivery he has made whole theatre erupt laughter more than 10 times i guess brilliant acting rest cast did their part well coming technical side editing was neat cinematography was good music scored by vivek sagar was too good apt at many situations very hardly does one see hindu review movie call it gem what more do you want just go grab ticket this ones sure shot hit,0.41647748246585453,0.16933831672203767,Positive,"{'Happy': 0.1, 'Angry': 0.16, 'Surprise': 0.22, 'Sad': 0.14, 'Fear': 0.38}"
8.0,"Pelli Choopulu is one of the most refreshing n naturally crafted romantic comedy with best performances,music and direction.A Must Watch one...","Pelli Choopulu (2016): Its been such a long time since I watched such a refreshing movie like Pell Choopulu.In recent times,most of the movies are turning out to be a disappointing ventures.This week out of Jakkanna and Pelli Choopulu,I opted for Pelli Choopulu because I wanted to avoid Jakkanna.I had good vibes on this movie after watching the trailer but didn't expect much out of it.But to my surprise this is movie is awesome.Plot: Prashanth (Vijay) is aimless in life. His father arranges a pelli choopulu for him and he agrees to meet Chitra (Ritu). On the day of the pelli choopulu, Prashanth, Chitra and a small boy are stranded in a room where they were asked to talk to each other. Thanks to the door that gets jammed, Prashanth and Chitra talk about each other. Chitra tells Prashanth that she is not ready for marriage and due to her dad's pressure she agreed to this.As the conversation progresses the duo realize that their thoughts have a lot in common. But a small twist arise which makes their ways apart but they again meet because of some circumstances.What happened to their lives and did they achieve their goals forms rest of the story.Plus Points: 1)Screenplay and Direction: Pelli Choopulu has one of the most refreshing entertaining screenplay in recent times.It is so natural that we can easily relate to the scenes and dialogues in this movie.We never get bored at any point of the movie.A smile always lies on our face until this movie ends,even after that too......Director Tarun Bhasker really impressed us a lot.His work is commendable and we can truly await for his next projects.He is a real classy gen for Tollywood.2)Performances: This movie has most natural performances of this year.Every actor gave their 100% percent output which really helped a lot.Out of them Ritu Varma is such a beauty of expressions and she is the major highlight of the movie.Vijay Sai perfectly apted for that role and his buddies,especially Priyadarshi is hilarious with his one liners in Telangana slang.He did the most refreshing comedy in recent times.3)Music: Music helped a lot to elevate the scenes.Its so pleasant and songs are very good.Aanandamayenu is the best of the album.4)Cinematography. This movie has the camera work similar to short films but really a appreciable job.It helped to give movie a natural lookMinus Points: 1)Ordinary story line: Movie's story is just like regular romantic comedy but its nothing to worry about as it has wonderful screenplay.SO Pelli Choopulu is one of the most refreshing n naturally crafted romantic comedy with best performances,music and direction.A Must Watch one...",pelli choopulu is one most refreshing n naturally crafted romantic comedy with best performances music direction must watch one,pelli choopulu 2016 its been such long time since i watched such refreshing movie like pell choopulu recent times most movies are turning out be disappointing ventures this week out jakkanna pelli choopulu i opted pelli choopulu because i wanted avoid jakkanna i had good vibes this movie after watching trailer but didnt expect much out it but my surprise this is movie is awesome plot prashanth vijay is aimless life his father arranges pelli choopulu him he agrees meet chitra ritu day pelli choopulu prashanth chitra small boy are stranded room where they were asked talk each other thanks door that gets jammed prashanth chitra talk about each other chitra tells prashanth that she is not ready marriage due her dads pressure she agreed this as conversation progresses duo realize that their thoughts have lot common but small twist arise which makes their ways apart but they again meet because some circumstances what happened their lives did they achieve their goals forms rest story plus points 1 screenplay direction pelli choopulu has one most refreshing entertaining screenplay recent times it is so natural that we can easily relate scenes dialogues this movie we never get bored at any point movie smile always lies our face until this movie ends even after that too director tarun bhasker really impressed us lot his work is commendable we can truly await his next projects he is real classy gen tollywood 2 performances this movie has most natural performances this year every actor gave their 100 percent output which really helped lot out them ritu varma is such beauty expressions she is major highlight movie vijay sai perfectly apted that role his buddies especially priyadarshi is hilarious with his one liners telangana slang he did most refreshing comedy recent times 3 music music helped lot elevate scenes its so pleasant songs are very good aanandamayenu is best album 4 cinematography this movie has camera work similar short films but really appreciable job it helped give movie natural lookminus points 1 ordinary story line movies story is just like regular romantic comedy but its nothing worry about as it has wonderful screenplay so pelli choopulu is one most refreshing n naturally crafted romantic comedy with best performances music direction must watch one,0.5456761786600495,0.247002688172043,Positive,"{'Happy': 0.2, 'Angry': 0.01, 'Surprise': 0.32, 'Sad': 0.19, 'Fear': 0.28}"
8.0,A laugh riot that's realistic and well put.,"A laugh riot that's realistic and well put.After a long time, I enjoyed a Telugu Film and felt happy after coming out of the theater and also watch it another time. Last time I had such a feeling for a Telugu Film was for ""Mithunam"" and it was four years ago.The good thing is that this film does not have any dances, there are no fights, there are no melodramatic dialogues. Though the sentimental part drags the movie, the humour overtook the drag and added a pull. It's the fun I took back home and was happy with the feeling this movie gave.The protagonists were new for me and of all the characters I liked the character of ""Kaushik"". It is played by ""Priyadarshi"". Of course, the film belongs to Ritu Varma as ""Chitra"" who reminded of ""Roopa"" in Anand (Anand is a 2004 film).It's refreshing to see a new director make a movie that's terrific in content (the writing, narration) and make the actors do an excellent job. Kudos to Tharun Bhascker. He has a long way to go if he sticks to non-commercial films and believes that content is above all else.The cinematography and editing are two departments which impressed me. The camera was invisible, as there are no specific long shots. The whole movie is shot in a straightforward and realistic way which is a huge bonus. From locations to interiors decors it was all well put and also colorful at the same time. There was life all through the film and hardly there was any dull visual. Also, the film was fluid with very few dull moments (dull moments were mostly in the sentimental last half hour). The cuts done were nice; there were no jump cuts and it is simply put. So, Telugu Film Industry can look forward to Nagesh Banell the cinematographer and Ravi Teja Girijala the editor. These are two good finds from the film.I was impressed by the use of music too. Taking the budget constraints into account Music is a commendable job done by Vivek Sagar. I loved the usage of the song ""Raalu Raaga Poolamaala."" Also, I must appreciate a huge fact this film is done in Sync Sound. That is there is no dubbing used; a terrific challenge is handled well and the results are seen in the movie.I am not putting the story or any dialogues out here. I am sure the Telugu Film Audience will embrace a film like.A 4/5 for a Telugu Film. A rarity from me but this is one film I will watch multiple times.",laugh riot thats realistic well put,laugh riot thats realistic well put after long time i enjoyed telugu film felt happy after coming out theater also watch it another time last time i had such feeling telugu film was mithunam it was four years ago good thing is that this film does not have any dances there are no fights there are no melodramatic dialogues though sentimental part drags movie humour overtook drag added pull its fun i took back home was happy with feeling this movie gave protagonists were new me all characters i liked character kaushik it is played by priyadarshi course film belongs ritu varma as chitra who reminded roopa anand anand is 2004 film its refreshing see new director make movie thats terrific content writing narration make actors do excellent job kudos tharun bhascker he has long way go if he sticks non commercial films believes that content is above all else cinematography editing are two departments which impressed me camera was invisible as there are no specific long shots whole movie is shot straightforward realistic way which is huge bonus locations interiors decors it was all well put also colorful at same time there was life all through film hardly there was any dull visual also film was fluid with very few dull moments dull moments were mostly sentimental last half hour cuts done were nice there were no jump cuts it is simply put so telugu film industry can look forward nagesh banell cinematographer ravi teja girijala editor these are two good finds film i was impressed by use music too taking budget constraints into account music is commendable job done by vivek sagar i loved usage song raalu raaga poolamaala also i must appreciate huge fact this film is done sync sound that is there is no dubbing used terrific challenge is handled well results are seen movie i am not putting story or any dialogues out here i am sure telugu film audience will embrace film like 4 5 telugu film rarity me but this is one film i will watch multiple times,0.4928796727381634,0.20385648942252715,Positive,"{'Happy': 0.21, 'Angry': 0.0, 'Surprise': 0.16, 'Sad': 0.29, 'Fear': 0.34}"
10.0,A breath of fresh air,"After the very well deserved failures of Brahmotsavam, Sardar Gabbar Singh and Aagdu, the Telugu audience had shown maturity in rejecting formulaic horrible movies with larger than life hero worship. Pellichupulu, the little movie, comes as a breath of fresh air. The USP of the movie is a simple story that connects. For a change, no one in the movie is running around screaming as if their life is at stake. I do not want to write about the various aspects of the movie as the other reviewers have already said it better. The movie is based on real life incidents which are extremely believable. The lead pair has a fabulous chemistry and the comic situations are extremely funny. The future of Telugu film industry is glorious if such movies keep getting attention and success. Go watch it, this one is a gem.",breath fresh air,after very well deserved failures brahmotsavam sardar gabbar singh aagdu telugu audience had shown maturity rejecting formulaic horrible movies with larger than life hero worship pellichupulu little movie comes as breath fresh air usp movie is simple story that connects change no one movie is running around screaming as if their life is at stake i do not want write about various aspects movie as other reviewers have already said it better movie is based real life incidents which are extremely believable lead pair has fabulous chemistry comic situations are extremely funny future telugu film industry is glorious if such movies keep getting attention success go watch it this one is gem,0.47142857142857136,0.0993421052631579,Positive,"{'Happy': 0.09, 'Angry': 0.05, 'Surprise': 0.32, 'Sad': 0.18, 'Fear': 0.36}"
