Rating,Review Title,Review,Cleaned Review Title,Cleaned Review,Subjectivity,Polarity,Sentiment,Emotion Scale
8.0,Spot On!!,"I didn't have many expectations from this one before the release. Then, came the reviews and they were surprisingly positive which raised my expectation bar. And after watching the movie, I realized that both (moive and the reviews) were Spot On!! Abhishek Kapoor's 'Rock On!!' is indeed a rocking and a refreshing film.It tells the story about four young friends who put together a wonderful band called 'Magik' but could never make it big. The movie brilliantly depicts the life of aspiring rock stars in India and carefully handles their rise, fall and reunion. The whole movie see-saws between the past and the present which keeps the viewer interested.Acting is also nice. Frahan Akhtar acts well and is a capable singer. Though I hope he doesn't become Himesh #2 and keeps his singing within limits. Rest of the cast- Arjun, Purab, Luke, Prachi and Sahana also do well.As for the negatives, the movie was a little lengthy. Plus, I believe the incident with ""Rob"" was unnecessary which didn't suit the general ""feel-good"" mood of the film.Despite some shortcomings, Rock on!! is indeed a noteworthy attempt and needs to be applauded. Well done.",spot,i didnt have many expectations this one before release then came reviews they were surprisingly positive which raised my expectation bar after watching movie i realized that both moive reviews were spot abhishek kapoors rock is indeed rocking refreshing film it tells story about four young friends who put together wonderful band called magik but could never make it big movie brilliantly depicts life aspiring rock stars india carefully handles their rise fall reunion whole movie see saws between past present which keeps viewer interested acting is also nice frahan akhtar acts well is capable singer though i hope he doesnt become himesh keeps his singing within limits rest cast arjun purab luke prachi sahana also do well as negatives movie was little lengthy plus i believe incident with rob was unnecessary which didnt suit general feel good mood film despite some shortcomings rock is indeed noteworthy attempt needs be applauded well done,0.5576555023923445,0.22577751196172247,Positive,"{'Happy': 0.15, 'Angry': 0.04, 'Surprise': 0.15, 'Sad': 0.27, 'Fear': 0.38}"
10.0,Coolest Bollywood Movie ever!!!!,"First of all,I must say I'm not a big fan of Hindi movies.I just see them for fun with friends and that's all.But for Rock On! I was expecting something different and I found it!The story is so well written and the direction is superb that the 3 hours which seem like an ordeal with other movies went so smooth and effortlessly.The best part for me was to see Farhan Akhtar make his transition from direction to acting & singing.His was perhaps the best debut you could ever imagine.It seemed liked he had been acting for ages and his singing was way above par.Prachi Desai looked beautiful and did her part excellently.Arjun Rampal acted out his role so maturely you could actually relate to it.Well,I must say this is a Hindi movie not to be missed at all.",coolest bollywood movie ever,first all i must say im not big fan hindi movies i just see them fun with friends thats all but rock i was expecting something different i found it story is so well written direction is superb that 3 hours which seem like ordeal with other movies went so smooth effortlessly best part me was see farhan akhtar make his transition direction acting singing his was perhaps best debut you could ever imagine it seemed liked he had been acting ages his singing was way above par prachi desai looked beautiful did her part excellently arjun rampal acted out his role so maturely you could actually relate it well i must say this is hindi movie not be missed at all,0.4004901960784313,0.37499999999999994,Positive,"{'Happy': 0.27, 'Angry': 0.09, 'Surprise': 0.41, 'Sad': 0.18, 'Fear': 0.05}"
9.0,Rock On!!...bring it on!,"Rock is all about employing electric and bass guitars, thundering drums with a mix of organ or piano or synthesizers giving you all a severe head-banging session. Well, that's what rock means to me and Rock On! is a great attempt bringing the same feel to 70MM! Rock On! is an ideal example of bridging cult with mainline Hindi cinema. Kudos! The movie is about how 4 talented friends with same passion for music creates a band called Magik and wanted to become 'somebody' in music industry. The movie focuses on how they stay together, achieve what they want to, broke up with each other and re-unites one last time. Director has done a marvelous job in bringing all characters alive. He didn't allow more characters floating all around and coming in between. He simply focuses on Magik and their select close ones.Soul of this movie lies in its music. The music of Rock On! is packed with extremely catchy kick ass numbers. Though all the numbers are rocking but my top three favorites are 'Zehreelay' 'Pichhle Saat Dinon' and 'Ye Tumhari Meri Baatein'. 'Zehreelay' is the heaviest soundtrack of any Indian movie so far. It's wild, full of energy and extremely noisy. Lyrics are weird and the interesting part is the vocal. You can do extreme screaming when you sing in English but when it comes to Hindi, it's a different ball game. It is tough to sing so loud and extreme that too with perfect vocals in Hindi. Simply hell yeah! 'Pichhle saat dinon' is a song that grows on you and later, you can't live without. The song is so popular that they have made a spl video for it. 'Ye Tumhari Meri Baatein' is beautiful song with a tinge of jazz to it. It will make you feel as if it is made for you and your love. Another wonderful track is 'Socha hai'. It's like back to roots, real rock song where lyrics come out from no where. Title soundtrack 'Rock On!', 'Sindbad the sailor' and 'Fir Dekhiye' are simply outstanding. Another special song is a slow rock ballad 'Tum ho to'. In age of one song wonder soundtracks Rock On! is a surprise package. Each and every song is a chart buster. In fact, I'm now so used to listening Rock On! songs where ever I roam! Office, Pubs, Music stores and channels, Radio its every where! It's like rock music in its purest form with a strong, insistent back beat, and a catchy melody! The movie is well crafted but the plot is not something new. It's a predictable movie and you know exactly what will happen next. Also, dialogs don't have that punch like the songs and its theme. I like Farhan Akhtar as a director, singer, and actor but excluding his voice. I do not know why but some how he is not that great when he talks.There are so many well crafted scenes that had lit up this movie. My favorite scene is where Magik performs at a local society to raise money. I will not reveal much of it but I just couldn't stop laughing like mad while watching it. Also, the scene where Magik performs at a music contest then fights with each other and split. Its sheer delight as director sketched those scenes brilliantly.Rock On! truly justifies its title with some heavy dope of rocking music and acting. More important, it's the simplicity of the movie which will make you happy while coming out of the movie screen with a message to all- know matter what may come... keep rocking!",rock bring it,rock is all about employing electric bass guitars thundering drums with mix organ or piano or synthesizers giving you all severe head banging session well thats what rock means me rock is great attempt bringing same feel 70mm rock is ideal example bridging cult with mainline hindi cinema kudos movie is about how 4 talented friends with same passion music creates band called magik wanted become somebody music industry movie focuses how they stay together achieve what they want broke up with each other re unites one last time director has done marvelous job bringing all characters alive he didnt allow more characters floating all around coming between he simply focuses magik their select close ones soul this movie lies its music music rock is packed with extremely catchy kick ass numbers though all numbers are rocking but my top three favorites are zehreelay pichhle saat dinon ye tumhari meri baatein zehreelay is heaviest soundtrack any indian movie so far its wild full energy extremely noisy lyrics are weird interesting part is vocal you can do extreme screaming when you sing english but when it comes hindi its different ball game it is tough sing so loud extreme that too with perfect vocals hindi simply hell yeah pichhle saat dinon is song that grows you later you cant live without song is so popular that they have made spl video it ye tumhari meri baatein is beautiful song with tinge jazz it it will make you feel as if it is made you your love another wonderful track is socha hai its like back roots real rock song where lyrics come out no where title soundtrack rock sindbad sailor fir dekhiye are simply outstanding another special song is slow rock ballad tum ho age one song wonder soundtracks rock is surprise package each every song is chart buster fact im now so used listening rock songs where ever i roam office pubs music stores channels radio its every where its like rock music its purest form with strong insistent back beat catchy melody movie is well crafted but plot is not something new its predictable movie you know exactly what will happen next also dialogs dont have that punch like songs its theme i like farhan akhtar as director singer actor but excluding his voice i do not know why but some how he is not that great when he talks there are so many well crafted scenes that had lit up this movie my favorite scene is where magik performs at local society raise money i will not reveal much it but i just couldnt stop laughing like mad while watching it also scene where magik performs at music contest then fights with each other split its sheer delight as director sketched those scenes brilliantly rock truly justifies its title with some heavy dope rocking music acting more important its simplicity movie which will make you happy while coming out movie screen with message all know matter what may come keep rocking,0.5783098845598845,0.21165524290524296,Positive,"{'Happy': 0.17, 'Angry': 0.05, 'Surprise': 0.26, 'Sad': 0.19, 'Fear': 0.33}"
,Dil Chahta Hain meets Jhankaar Beats,"Ode to Dil Chahta Hain:: √ Farhan Akhtar plays an extended version of Akash.√ Arjun Rampal reprises Sid.√ Turn Dimple Kapadia into a male character and add them into a trio  voila, you have DCH of four! √ The misunderstanding/ breakup.√ The final moments before the credits rolls.√ The past narrated in flashback.Well, one should appreciate the makers were honest to admit publicly that the movie was DCH Part Deux.Performances:: √ Farhan Akhtar:: He doesn't falter a bit and delivers an eye-opener performance in terms of the subtle nuances and body language he bring in. Of course, his distinct voice is his his greatest asset. Hindsight, he should have done ""Lucky"" in Main Hoon Na, at least the role would have been more memorable.√ Arjun Rampal:: Probably first time one would take notice of his performance as it is very matured and restrained. Lets hope it does what DCH did to Akshaye Khanna.√ Purab Kohli, Luke Kenny & Shahana Goswami:: Should capitalise on the success of the movie to get a strong foothold in Bollywood. Good performances otherwise.√ Prachi Desai is good in her ""Miss Goody Two Shoes"" role. BTW  why was her character a bit pushy towards male bonding? √ Koel Purie is as usual OK.Too many flashbacks hinder the narrative. Should have been confined to a single one.The songs would take sometime to catch on as they belong to Rock genre and not the usual run-out-of mill.The protagonists passion for music give you a feel of Jhankaar Beats and so does the climax.The movie is handled extremely well on all technical fronts. A very well made movie. Looking forward your next outing Gattu Kapoor! PS: Javed Saab, does the usage of ""Darling"" refer to a previous experience of your in the Bollywood?",dil chahta hain meets jhankaar beats,ode dil chahta hain farhan akhtar plays extended version akash arjun rampal reprises sid turn dimple kapadia into male character add them into trio voila you have dch four misunderstanding breakup final moments before credits rolls past narrated flashback well one should appreciate makers were honest admit publicly that movie was dch part deux performances farhan akhtar he doesnt falter bit delivers eye opener performance terms subtle nuances body language he bring course his distinct voice is his his greatest asset hindsight he should have done lucky main hoon na at least role would have been more memorable arjun rampal probably first time one would take notice his performance as it is very matured restrained lets hope it does what dch did akshaye khanna purab kohli luke kenny shahana goswami should capitalise success movie get strong foothold bollywood good performances otherwise prachi desai is good her miss goody two shoes role btw why was her character bit pushy towards male bonding koel purie is as usual ok too many flashbacks hinder narrative should have been confined single one songs would take sometime catch as they belong rock genre not usual run out mill protagonists passion music give you feel jhankaar beats so does climax movie is handled extremely well all technical fronts very well made movie looking forward your next outing gattu kapoor ps javed saab does usage darling refer previous experience your bollywood,0.4376984126984126,0.19373015873015872,Positive,"{'Happy': 0.15, 'Angry': 0.05, 'Surprise': 0.12, 'Sad': 0.2, 'Fear': 0.49}"
8.0,Finally... Rock Hits Bollywood!,"Sure, sure. There has been numerous attempts at adapting the greatest music genre of all time into the Hindi arena; at getting rock music to blend in with Indian songs. But while some attempts were partly successful, most of them were as ridiculous as dressing up an elephant in a ballerina costume and expecting a successful ballet.While some original Indian songs (yes, there ARE original un-plagiarized Hindi songs...) have had their own charm about it, it seemed completely alien to the tone and touch that embodies rock. But this movie brings with it some of the first successful merges between the two giant. The ballerina costume doesn't look out of place at all ;) Since I've started out with the songs, let me get a few things clarified first. The lyrics are eclectic. Sporadic, random yet not gibberish. It could have been better, but it's NOT bad at all per se. But the music, and Farhan Akhtar's voice and compelling screen presence all build the songs to a well deserve hype.Performances were amazing. No ham acting, no glitzy deviations, no bullshit It was a honest and down to earth approach, and I, for one, applaud the trend in Bollywood. The plot was simple enough - for a while, it felt like the sequel to 'That Thing You Do' - and it was delivered very powerfully. I have to make a special mention about the cinematography. It was awesome. It used the restricted depth of field approach in several shots, and yet did not give a feeling that it was overused.At this point, I should probably mention something about me. The last Hindi movie I really liked was Taare Zameen Par the one before that was Dil Chahta Hai, and the one before that was probably Mr. India. So you should understand that I am typically not generous with praises for Bollywood. So when I say Rock On rocked on, it means something.Now's the time to nitpick. And here on, there's gonna be some spoilers. This basically means that if you HAVEN'T watched the movie yet, you should probably throw a rock at the monitor, cover your eyes, and jump behind the couch over there so that you get to enjoy the movie properly when you DO see it. Alternatively, you can use this time to actually go get the tickets and hop in a theater seat with popcorn. When you return, you'll be well equipped to read the rest of this article.The plot was smooth, except for a few things that detracted my attention. Firstly, the big fight  What was that all about? For guys who are all that pally with each other, the situation had NOT developed into such a state as to demand a ten year hiatus. They took a guy fight and treated it like a darned girl fight.You know what I mean Except for certain really extreme lines getting crossed (such as stealing each other's make up or not) guys get over such fights after two days and a mug of beer. And while I can understand that Farhan Akhtar has a short temper, it's still a far stretch to imagine that when one of his closest friends hit him, he just packs up and leaves music and starts over a new life...?? The build up to the fight kept implying that it was something huge... We were dropped hints of Farhan betraying friends, great ego clashes building up, and something mysterious that was so sinister that everything turned topsy turvy after the fight. And the fight actually didn't give anything on that scale. OK, things were turning sour, Farhan was starting to build an ego, sure.. but it was just starting... I expected something AT LEAST as heated as the band split in 'That Thing You Do'.... The lead singer was ACTUALLY building an ego.... starting to feel he carried the entire weight of the band, and that the rest didn't really matter, etc etc... Nothing like that happened here. It seemed so out of character, so out of place.But... remember what I said.. These are just nitpicks... Even with this bump on the road, the movie was nothing short of brilliant.",finally rock hits bollywood,sure sure there has been numerous attempts at adapting greatest music genre all time into hindi arena at getting rock music blend with indian songs but while some attempts were partly successful most them were as ridiculous as dressing up elephant ballerina costume expecting successful ballet while some original indian songs yes there are original un plagiarized hindi songs have had their own charm about it it seemed completely alien tone touch that embodies rock but this movie brings with it some first successful merges between two giant ballerina costume doesnt look out place at all since ive started out with songs let me get few things clarified first lyrics are eclectic sporadic random yet not gibberish it could have been better but its not bad at all per se but music farhan akhtars voice compelling screen presence all build songs well deserve hype performances were amazing no ham acting no glitzy deviations no bullshit it was honest down earth approach i one applaud trend bollywood plot was simple enough while it felt like sequel that thing you do it was delivered very powerfully i have make special mention about cinematography it was awesome it used restricted depth field approach several shots yet did not give feeling that it was overused at this point i should probably mention something about me last hindi movie i really liked was taare zameen par one before that was dil chahta hai one before that was probably mr india so you should understand that i am typically not generous with praises bollywood so when i say rock rocked it means something nows time nitpick here theres gonna be some spoilers this basically means that if you havent watched movie yet you should probably throw rock at monitor cover your eyes jump behind couch over there so that you get enjoy movie properly when you do see it alternatively you can use this time actually go get tickets hop theater seat with popcorn when you return youll be well equipped read rest this article plot was smooth except few things that detracted my attention firstly big fight what was that all about guys who are all that pally with each other situation had not developed into such state as demand ten year hiatus they took guy fight treated it like darned girl fight you know what i mean except certain really extreme lines getting crossed such as stealing each others make up or not guys get over such fights after two days mug beer while i can understand that farhan akhtar has short temper its still far stretch imagine that when one his closest friends hit him he just packs up leaves music starts over new life build up fight kept implying that it was something huge we were dropped hints farhan betraying friends great ego clashes building up something mysterious that was so sinister that everything turned topsy turvy after fight fight actually didnt give anything that scale ok things were turning sour farhan was starting build ego sure but it was just starting i expected something at least as heated as band split that thing you do lead singer was actually building ego starting feel he carried entire weight band that rest didnt really matter etc etc nothing like that happened here it seemed so out character so out place but remember what i said these are just nitpicks even with this bump road movie was nothing short brilliant,0.5506611251402919,0.1698574535032868,Positive,"{'Happy': 0.11, 'Angry': 0.05, 'Surprise': 0.32, 'Sad': 0.2, 'Fear': 0.32}"
5.0,Not as rocking as expected,"For the most part, ""Rock On!!"", though engagingly realistic and well-acted, is not a particularly rocking movie. Considering it's about a rock band, the film is fairly slow and at times even tedious. There is some depressing feel to it although the viewer may clearly feel the light in the end of a tunnel will certainly come at some point. What I really liked about this film, however, is the portrayal of relationships. I think it was very well done, and it was the film's best-depicted aspect. It was actually the main aspect which pushed the otherwise unmovable narrative forward. The film's concept is interesting, but not really new or unused. It's neither intriguing nor unpredictable.The performances are good in this order: Shahana Goswami is mind-blowing as Debbie. She is an excellent actress with a very natural and intense style and a particularly forceful dialogue delivery. This clearly is the best performance of the film. Arjun Rampal's is the best performance among the male cast, and he is thoroughly convincing in a role that is essentially a very passive one. Prachi Desai acts very well and she is vulnerable and convincing throughout the film. Farhan Akhtar makes a good debut, nothing outstanding though. He is a bit wooden in some scenes, but otherwise okay, and he actually sings very well. Purab Kohli is effective but does not really get that much of a scope.""Rock On!!"" is a one-time watch for me. It has its moments, it has good acting, the music is excellent, but the story is not very well executed. I felt there was much more to show and much more to tell about the rock band. It is done quite realistically and does not go over the top, but it has its share of clichés, unreasonable coincidences and ancient emotions, which neither move nor impress. Nevertheless, I liked the rather positive ending, which in spite of its predictability was quite efficient. The final verdict is above average according to me. I expected something else, but it's just me, watch it and make your own conclusions.",not as rocking as expected,most part rock though engagingly realistic well acted is not particularly rocking movie considering its about rock band film is fairly slow at times even tedious there is some depressing feel it although viewer may clearly feel light end tunnel will certainly come at some point what i really liked about this film however is portrayal relationships i think it was very well done it was films best depicted aspect it was actually main aspect which pushed otherwise unmovable narrative forward films concept is interesting but not really new or unused its neither intriguing nor unpredictable performances are good this order shahana goswami is mind blowing as debbie she is excellent actress with very natural intense style particularly forceful dialogue delivery this clearly is best performance film arjun rampals is best performance among male cast he is thoroughly convincing role that is essentially very passive one prachi desai acts very well she is vulnerable convincing throughout film farhan akhtar makes good debut nothing outstanding though he is bit wooden some scenes but otherwise okay he actually sings very well purab kohli is effective but does not really get that much scope rock is one time watch me it has its moments it has good acting music is excellent but story is not very well executed i felt there was much more show much more tell about rock band it is done quite realistically does not go over top but it has its share clich s unreasonable coincidences ancient emotions which neither move nor impress nevertheless i liked rather positive ending which spite its predictability was quite efficient final verdict is above average according me i expected something else but its just me watch it make your own conclusions,0.520057319223986,0.2648773448773448,Positive,"{'Happy': 0.19, 'Angry': 0.0, 'Surprise': 0.31, 'Sad': 0.29, 'Fear': 0.21}"
