Rating,Review Title,Review,Cleaned Review Title,Cleaned Review,Subjectivity,Polarity,Sentiment,Emotion Scale
9.0,Live your dream!,"If you loved Dil Chahta Hain, there's no way you'd not like 'Rock ON'. I have just returned from a small screening of the movie last night and it was 'Fantabulous'. I had been waiting for it since long and the wait was worth it. If you think that the movie is all about Rock and being cool, its not. It's about desiring something and breaking all the rules to get there.I don't want to speak out the story here as it is among the best written screenplays I have seen in any movie so far  be it Indian Cinema or Hollywood. The flashbacks and the montages and the cuts were brilliantly placed. There are a few things that I'd specifically ask you to watch out for. First is Jason West's cinematography; absolutely commendable. Then there is the music and sound design which is powerful yet sweet and the star attribute of the movie  the performances. They are flawless, Farhan is good, Prachi is amazing, Suhana is complete and Arjun Rampal has delivered the best performance of his life (watch out for the climax).The live performances in the movie were well done, Magic could have been more aggressive but they had good presence. 'Shair n Func', came and went and their song was pretty catchy. Chakravhyu was super sexyand sheer evil and none the least RADIO were rocking as usual with 'Musafir'  beautiful song that one.In the end Rock On is a really sweet movie and a must watch for the people, both young and old, who dare to dream and are willing to walk that road in order to achieve it. I absolutely loved the movie and am definitely going for it again. Indian Rock Bands rule!!!!!!!",live your dream,if you loved dil chahta hain theres no way youd not like rock i have just returned small screening movie last night it was fantabulous i had been waiting it since long wait was worth it if you think that movie is all about rock being cool its not its about desiring something breaking all rules get there i dont want speak out story here as it is among best written screenplays i have seen any movie so far be it indian cinema or hollywood flashbacks montages cuts were brilliantly placed there are few things that id specifically ask you watch out first is jason wests cinematography absolutely commendable then there is music sound design which is powerful yet sweet star attribute movie performances they are flawless farhan is good prachi is amazing suhana is complete arjun rampal has delivered best performance his life watch out climax live performances movie were well done magic could have been more aggressive but they had good presence shair n func came went their song was pretty catchy chakravhyu was super sexy sheer evil none least radio were rocking as usual with musafir beautiful song that one end rock is really sweet movie must watch people both young old who dare dream are willing walk that road order achieve it i absolutely loved movie am definitely going it again indian rock bands rule,0.6094017094017092,0.2975912975912975,Positive,"{'Happy': 0.2, 'Angry': 0.02, 'Surprise': 0.36, 'Sad': 0.02, 'Fear': 0.4}"
10.0,Brilliant! Surprising!,"Okay, let me start of by saying that when I first saw a preview, my expectations were not very high for this movie. However, they don't matter anymore.As the title aptly suggests, this movie ROCKS! y far one the most different, entertaining and wonderfully surprising films of recent times. Rock On meets, surpasses and blows the expectations of the viewer out of the window. Brilliant.This movie is one of those rare ones that actually focuses just on the music. It doesn't move of into some romantic tune or dramatic effect. It stays true to it's heart and soul. The Music.All the actors perform brilliantly with a special mention to Arjun Rampal and Prachi Desai who shines out in her debut film. But best of all is the showstopper. Farhan Akhtar. This man is a genius! He can sing (only rock!) act and direct (not this one though). Brilliant. By far the shining star of this move. He carries his role out with exceptional ease and actually seems as good as any seasoned actor of a high caliber. Hats off.In the end, this movie is what it is: "" Brilliant as it is, the message is heard as if in stock, this movieends in bliss, but only after making you ROCK!""Superb! Watch it and ROCK ON !!!!!",brilliant surprising,okay let me start by saying that when i first saw preview my expectations were not very high this movie however they dont matter anymore as title aptly suggests this movie rocks y far one most different entertaining wonderfully surprising films recent times rock meets surpasses blows expectations viewer out window brilliant this movie is one those rare ones that actually focuses just music it doesnt move into some romantic tune or dramatic effect it stays true its heart soul music all actors perform brilliantly with special mention arjun rampal prachi desai who shines out her debut film but best all is showstopper farhan akhtar this man is genius he can sing only rock act direct not this one though brilliant by far shining star this move he carries his role out with exceptional ease actually seems as good as any seasoned actor high caliber hats off end this movie is what it is brilliant as it is message is heard as if stock this movieends bliss but only after making you rock superb watch it rock,0.660913530913531,0.389058719058719,Positive,"{'Happy': 0.17, 'Angry': 0.02, 'Surprise': 0.36, 'Sad': 0.17, 'Fear': 0.29}"
8.0,Rock On!! - A Movie None Should Miss!,"Easily my fave movie of this year.Rock On!! portrays the essence of friendship albeit in a different narration, does call for a round of applause for a theme which might not be so popular in India i.e. Rock.The story revolves around four friends forming a rock band called Magik with Aditya ( Farhan Akhtar) the lead vocalist and lyricist, Joe ( Arjun Rampal) the guitarist, KD ( Purab Kohli) on the drums and Rob ( Luke Kenny) on the keyboard, out to cut out an album. Somethings go awry and the friends who shared the same passion drift away, each leading their own life.A decade later, some circumstances bring these four friends together and Magik is in action again to give the most memorable performance ever.The story of course has more to it but you rather watch the movie to learn that.Director Abhishek Kapoor has captured the fragility of relationships on the celluloid with compelling ease. Farhan Akhtar has emerged as an actor and as a super singer, with no signs of débutant syndrome to be seen in his performance. Arjun Rampal surprises with one of his finest performances till date. Shankar-Ehsaan-Loy;s music just rocks.The movie Rock On has the blended concoction of some outstanding performances, engulfing emotions and topping it is the execution of the entire theme. I have a gut of the film Rock On is going to rock the box-office as well.",rock movie none should miss,easily my fave movie this year rock portrays essence friendship albeit different narration does call round applause theme which might not be so popular india i e rock story revolves around four friends forming rock band called magik with aditya farhan akhtar lead vocalist lyricist joe arjun rampal guitarist kd purab kohli drums rob luke kenny keyboard out cut out album somethings go awry friends who shared same passion drift away each leading their own life decade later some circumstances bring these four friends together magik is action again give most memorable performance ever story course has more it but you rather watch movie learn that director abhishek kapoor has captured fragility relationships celluloid with compelling ease farhan akhtar has emerged as actor as super singer with no signs d butant syndrome be seen his performance arjun rampal surprises with one his finest performances till date shankar ehsaan loy s music just rocks movie rock has blended concoction some outstanding performances engulfing emotions topping it is execution entire theme i have gut film rock is going rock box office as well,0.5816666666666668,0.27777777777777773,Positive,"{'Happy': 0.16, 'Angry': 0.09, 'Surprise': 0.16, 'Sad': 0.19, 'Fear': 0.41}"
10.0,"Rock On: Live your dreams, live your ambitions","I had been waiting to see this movie ever since the promos and trailers hit the theaters. This is the first proper Indian rock band movie, and with a compelling star cast this was bound to be a joy to watch. And I was not disappointed. It was 140 minutes of pure fun. This is finally a movie where we don't have any catchy item numbers or some stupid unwanted songs. Its a movie about a rock band, so we have rock songs. Songs with guitar riffs, drum solos, and kick-ass vocals.The story is quite simple. 4 college buddies dream big, they dream high. They want to form a band and become the next big thing in the upcoming rock culture. They do all that, against all odds, going against their careers their parents chose for them. But somewhere along the line, we have ego clashes amongst the band members, which results in the band breaking up, even before they released their first album. Years later, things have changed. But they make a last gasp reunion, and leave the stage on a high.Whilst the story is critical, for any movie, its not something which is flashy. Its your regular story, one which you can expect out of a Bollywood movie. But the presentation makes the difference. Coupled with some wonderful songs and a brilliant background score, and some superb acting, Rock On! gives you a startlingly different flavor from the regular Bollywood masala movies. The acting has been overall brilliant, there were some patches were it was becoming evident that most of them are newbies in front of the camera, but we can bother to overlook that small mistake. Farhan Akhtar debut performance as the lead singer, Adi, the successful investment banker, the one with the flamboyant vocals, gives a brilliant performance. He is the protagonist of the story, and he controls the tempo of the movie.Add to that he has sung most of the songs himself.Arjun Rampal, as the lead guitarist, Joseph ""Joe"" Mascarenhas is another complicated character. He is another central character to the story and he gives the movie far more credibility. He's this brilliant guitarist, who has rock in his blood. But he's financially insecure, and this results in his poor family background, his family's fishing business. He has a great sense of pride in his musical talent and like the forefathers of rock, he refuses to sell his pride. He refuses to play in pubs and clubs, and insists on playing for his own happiness rather than for cash, in spite of his family troubles.KD,""Killer Drummer"", he's the heart of the band. Purab Kohli, makes it a point to play the drums, and make an honest effort to look credible enough. He's the wacko junkie, with the weirdest possible fashion sense, like wearing a tie over a tee shirt to every gig. Like all others after the Magik era he's wasting away in his family business.Last and definitely not the least Luke Kenny as Rob. He was the manager/keyboardist of the band. He organized gigs for them, and he was the one who became successful musically, recording with Anu Malik on small time jobs. And he was the one who brings the band together after 10 years, amidst tragedies.Special mention must be made of Prachi Desai and Sahana Goswami. Both have been brilliant at the roles they have reprised. Prachi as Sakshi, the wife of Adi, and Sahana as Debbie, Joe's wife gives a superb performance. Especially Sahana, she did a brilliant brilliant job, portraying two very different characters in the two eras. The acting, the music, the camera work, has all been superb, excellent. Shankar-Ehsaan-Loy bring forth their magic as the amazing music directors, so does Javed Akhtar with the catchy lyrics.One negative aspect may be, that this movie is somewhat shortened. We could have explored certain characters more, but the makers probably thought to leave this at that, and not make the movie a bit more predictable. For example, Dalip Tahil as Adi's boss has basically just 2 scenes. And Nicollete Bird as the old flame of Adi is almost an extra. Those 2 characters could have been explored a bit. I'm sure there will be long deleted scenes in the DVD.Apart from the brilliant music, the acting, and the character portrayal, the movie also follows a important message. To always follow your dreams and your heart. We see that with Joe, a financially insecure person, who leaves behind a job where hes guaranteed a large sum of money to play with his old band, to ignite his flame, his passion for playing on stage in a proper rock gig. We see Rob, who's dieing away slowly, to overcome all odds and play with his old buddies for one last time, on stage. And lastly KD, in his last lines, ""I don't care what you fellows think. But I've been among your personal ego clashes for a long time, and I'm going out there on stage even if I have to drum all alone for 20 minutes, I'll do it."" This movie might not appeal to the older audience who might shun this as a youth film. Yes, this movie is based on today's youth, but it carries a message which is universally applicable. It uses the rock culture to promote this meaning, this message. Kudos to Farhan Akhtar again for treating us to another delight. 10/10.",rock live your dreams live your ambitions,i had been waiting see this movie ever since promos trailers hit theaters this is first proper indian rock band movie with compelling star cast this was bound be joy watch i was not disappointed it was 140 minutes pure fun this is finally movie where we dont have any catchy item numbers or some stupid unwanted songs its movie about rock band so we have rock songs songs with guitar riffs drum solos kick ass vocals story is quite simple 4 college buddies dream big they dream high they want form band become next big thing upcoming rock culture they do all that against all odds going against their careers their parents chose them but somewhere along line we have ego clashes amongst band members which results band breaking up even before they released their first album years later things have changed but they make last gasp reunion leave stage high whilst story is critical any movie its not something which is flashy its your regular story one which you can expect out bollywood movie but presentation makes difference coupled with some wonderful songs brilliant background score some superb acting rock gives you startlingly different flavor regular bollywood masala movies acting has been overall brilliant there were some patches were it was becoming evident that most them are newbies front camera but we can bother overlook that small mistake farhan akhtar debut performance as lead singer adi successful investment banker one with flamboyant vocals gives brilliant performance he is protagonist story he controls tempo movie add that he has sung most songs himself arjun rampal as lead guitarist joseph joe mascarenhas is another complicated character he is another central character story he gives movie far more credibility hes this brilliant guitarist who has rock his blood but hes financially insecure this results his poor family background his familys fishing business he has great sense pride his musical talent like forefathers rock he refuses sell his pride he refuses play pubs clubs insists playing his own happiness rather than cash spite his family troubles kd killer drummer hes heart band purab kohli makes it point play drums make honest effort look credible enough hes wacko junkie with weirdest possible fashion sense like wearing tie over tee shirt every gig like all others after magik era hes wasting away his family business last definitely not least luke kenny as rob he was manager keyboardist band he organized gigs them he was one who became successful musically recording with anu malik small time jobs he was one who brings band together after 10 years amidst tragedies special mention must be made prachi desai sahana goswami both have been brilliant at roles they have reprised prachi as sakshi wife adi sahana as debbie joes wife gives superb performance especially sahana she did brilliant brilliant job portraying two very different characters two eras acting music camera work has all been superb excellent shankar ehsaan loy bring forth their magic as amazing music directors so does javed akhtar with catchy lyrics one negative aspect may be that this movie is somewhat shortened we could have explored certain characters more but makers probably thought leave this at that not make movie bit more predictable example dalip tahil as adis boss has basically just 2 scenes nicollete bird as old flame adi is almost extra those 2 characters could have been explored bit im sure there will be long deleted scenes dvd apart brilliant music acting character portrayal movie also follows important message always follow your dreams your heart we see that with joe financially insecure person who leaves behind job where hes guaranteed large sum money play with his old band ignite his flame his passion playing stage proper rock gig we see rob whos dieing away slowly overcome all odds play with his old buddies one last time stage lastly kd his last lines i dont care what you fellows think but ive been among your personal ego clashes long time im going out there stage even if i have drum all alone 20 minutes ill do it this movie might not appeal older audience who might shun this as youth film yes this movie is based todays youth but it carries message which is universally applicable it uses rock culture promote this meaning this message kudos farhan akhtar again treating us another delight 10 10,0.5282106102514267,0.21514687693259127,Positive,"{'Happy': 0.15, 'Angry': 0.08, 'Surprise': 0.17, 'Sad': 0.16, 'Fear': 0.44}"
10.0,ROCK ON touched my HEART... Watch this movie with heart full of friendship and eyes wet with emotions,"Four friends share a common passion for music and form a rock band called Magik. Aditya (Farhan Akhtar) is the lead vocalist, Joe (Arjun Rampal) is the guitarist, KD (Purab Kohli) is the drummer and Rob (Luke Kenny) handles the keyboard. They get a chance to cut out an album but things don't work out and the group splits to go their separate ways.A decade later Aditya's wife Sakshi (Prachi Desai) attempts to reunite the group. After some initial hiccups and ego clashes, the band members bond and blend to brew good tunes. Predictably the climax is set in a rock concert where the band performs to perfection.Despite such patented predictability, one still relates to Rock On. You noticeably know that Arjun Rampal would make a late entry in the climax concert but your heart still goes out on his appearance. You aren't surprised when one of the band members is diagnosed of cancer but you still feel for him. That's because the simplicity and sincerity of the direction and performances touch you.The storytelling is somewhat slow and drags in the preliminary portions. The film gets into frequent flashback episodes and at times you are caught unaware on the instance where it ends. Even the back-story takes a tad bit long to reach to the point where the band disperses. Unimaginatively the screenplay uses the same scheme of a rock concert for its first key plot-point and also the climax. But seemingly that was inevitable since the genre of the film restricts its creative scope. Also Farhan Akhtar's breakup with his girlfriend doesn't come across quite convincingly.On the upside, the musical theme of the film is ably supported by Shankar-Ehsaan-Loy's rocking score. For once you don't feel that songs are forced in a Bollywood film. There's also a splendid spoof on how the band merges rock with dandiya to gain some quick money. How one wishes the film had more of such lighter moments which would have accentuated the youthful appeal to Dil Chahta Hai extents. The director also manages to pull off a subtle satire on Anu Malik, while casting him at his own expense.Rock On seems to be clearly designed by Farhan Akhar as his own acting debut and he doesn't let himself down. Lending voice to all his songs helps him to get into his character with effortless ease. One could certainly overlook the lisp in his dialogue delivery. Arjun Rampal looks mature in his character but isn't quite credible while handling the guitar. Purab Kohli has a natural flair for comedy and Luke Kenny is persuasive in his role. From the female leads Shahana Goswami as Arjun's wife comes up with the most compelling act and adds some depth to the drama. Prachi Desai justifies her poised presence.It's interesting how director Abhishek Kapoor attempts to make commercial entertainers on subjects that are not much prevalent in our country. His last film Aryan was on boxing, a sport not much popular in India and now he tries his hands on rock culture, which again isn't much recognized here. At least this time he succeeds in creating a realistic rock feel.Rock On strikes a chord on that note.",rock touched my heart watch this movie with heart full friendship eyes wet with emotions,four friends share common passion music form rock band called magik aditya farhan akhtar is lead vocalist joe arjun rampal is guitarist kd purab kohli is drummer rob luke kenny handles keyboard they get chance cut out album but things dont work out group splits go their separate ways decade later adityas wife sakshi prachi desai attempts reunite group after some initial hiccups ego clashes band members bond blend brew good tunes predictably climax is set rock concert where band performs perfection despite such patented predictability one still relates rock you noticeably know that arjun rampal would make late entry climax concert but your heart still goes out his appearance you arent surprised when one band members is diagnosed cancer but you still feel him thats because simplicity sincerity direction performances touch you storytelling is somewhat slow drags preliminary portions film gets into frequent flashback episodes at times you are caught unaware instance where it ends even back story takes tad bit long reach point where band disperses unimaginatively screenplay uses same scheme rock concert its first key plot point also climax but seemingly that was inevitable since genre film restricts its creative scope also farhan akhtars breakup with his girlfriend doesnt come across quite convincingly upside musical theme film is ably supported by shankar ehsaan loys rocking score once you dont feel that songs are forced bollywood film theres also splendid spoof how band merges rock with dandiya gain some quick money how one wishes film had more such lighter moments which would have accentuated youthful appeal dil chahta hai extents director also manages pull off subtle satire anu malik while casting him at his own expense rock seems be clearly designed by farhan akhar as his own acting debut he doesnt let himself down lending voice all his songs helps him get into his character with effortless ease one could certainly overlook lisp his dialogue delivery arjun rampal looks mature his character but isnt quite credible while handling guitar purab kohli has natural flair comedy luke kenny is persuasive his role female leads shahana goswami as arjuns wife comes up with most compelling act adds some depth drama prachi desai justifies her poised presence its interesting how director abhishek kapoor attempts make commercial entertainers subjects that are not much prevalent our country his last film aryan was boxing sport not much popular india now he tries his hands rock culture which again isnt much recognized here at least this time he succeeds creating realistic rock feel rock strikes chord that note,0.45083943833943824,0.11939865689865692,Positive,"{'Happy': 0.06, 'Angry': 0.06, 'Surprise': 0.22, 'Sad': 0.22, 'Fear': 0.44}"
