Rating,Review Title,Review,Cleaned Review Title,Cleaned Review,Subjectivity,Polarity,Sentiment,Emotion Scale
7.0,Rock with some Blue,"The basic idea of the movie is just as 'Dil Chahta Hai'- a fight between two friends and their reunion(But here there's' much more after the that). Let me clear first: THE SONGS ARE AWESOME 10/10.Very nicely directed, the film has slow pace in the first half and the story may confuse some, as there are a lot of flashbacks. some unwanted characters too included. But the second half has the perfect speed and will cling you to the seats. the whole idea of ROCK ON!! gets concentrated here, no stupid incidences, no unwanted scenes-perfect The only thing which i didn't like was the reunion of MAGIK (not as great as it should be- could be much grand) Talking about performances- everyone does a great Job, special mention for Luke Kenny and Purab Kohli. Prachi Desai (cant say a newcomer, been in daily soaps) looks lovely, acts well. Farhan has surely some thing for Singing. The songs sound genuine as are sung by Farhan than some professional singer. Lots of light moments throughout the film, wonderfully shot. The end is wonderful.... you will probably guess the end, but it will turn out much greater.For hardcore ROCK fans, don't expect NIRVANA, GREENDAY, or DEEP PURLPE, its bollywood ROCKYou will surely come out of the theatre with smiles- thats for sure.",rock with some blue,basic idea movie is just as dil chahta hai fight between two friends their reunion but here theres much more after that let me clear first songs are awesome 10 10 very nicely directed film has slow pace first half story may confuse some as there are lot flashbacks some unwanted characters too included but second half has perfect speed will cling you seats whole idea rock gets concentrated here no stupid incidences no unwanted scenes perfect only thing which i didnt like was reunion magik not as great as it should be could be much grand talking about performances everyone does great job special mention luke kenny purab kohli prachi desai cant say newcomer been daily soaps looks lovely acts well farhan has surely some thing singing songs sound genuine as are sung by farhan than some professional singer lots light moments throughout film wonderfully shot end is wonderful you will probably guess end but it will turn out much greater hardcore rock fans dont expect nirvana greenday or deep purlpe its bollywood rockyou will surely come out theatre with smiles thats sure,0.5881302521008404,0.385406162464986,Positive,"{'Happy': 0.15, 'Angry': 0.0, 'Surprise': 0.33, 'Sad': 0.21, 'Fear': 0.31}"
,Rock On carries forward the legacy of Dil Chahta Hai,"First of all, I have to tell you that Farhan Akhtar is a ROCKSTAR !!! Man what films he has made till date - DCH, Lakshya and now this one. Along with Farhan, Abhishek Kapoor(whose first film Arryan didn't do too well) too has done a great job as a director. Though I could make out a few goofs, but considering the fact that I was so engrossed in the movie, they can be overlooked.The rest of the cast is excellent. Arjum Rampal for a change is so much better than his earlier performances. But, I still feel he could have done better. Prachi Desai gives a SMASHING performance. So much depth in her character and boy-o-boy, did she play it well. Purab was such a refreshing element throughout. He's completely lovable.Now, for the music. I'm so proud to hear the first mainstream Rock album of India. And I'm glad they have not messed up the songs and have kept the raw, college boy feel to all the songs. Even the slow tracks(2 of them) are so soothing. Brilliant album. Kudos to Shankar-Ehsaan-Loy.Finally, Rock On is really fresh film, if not a classic. Technically its not 10/10 but just for the EQ(emotional quotient) I give it a 10.But, for lovers of mature drama and emotions, it'll be a treat. Thank you Farhan, Abhishek etc. etc. for such a refreshing change. Best Indian film of 2008 till now, hands down !!!!",rock carries forward legacy dil chahta hai,first all i have tell you that farhan akhtar is rockstar man what films he has made till date dch lakshya now this one along with farhan abhishek kapoor whose first film arryan didnt do too well too has done great job as director though i could make out few goofs but considering fact that i was so engrossed movie they can be overlooked rest cast is excellent arjum rampal change is so much better than his earlier performances but i still feel he could have done better prachi desai gives smashing performance so much depth her character boy o boy did she play it well purab was such refreshing element throughout hes completely lovable now music im so proud hear first mainstream rock album india im glad they have not messed up songs have kept raw college boy feel all songs even slow tracks 2 them are so soothing brilliant album kudos shankar ehsaan loy finally rock is really fresh film if not classic technically its not 10 10 but just eq emotional quotient i give it 10 but lovers mature drama emotions itll be treat thank you farhan abhishek etc etc such refreshing change best indian film 2008 till now hands down,0.5363247863247864,0.28144078144078144,Positive,"{'Happy': 0.16, 'Angry': 0.03, 'Surprise': 0.32, 'Sad': 0.23, 'Fear': 0.26}"
8.0,Could usher in the start of a new bollywood genre....Excellent and Enjoyable!!!!,"Farhan Akhtar has done it again! Rock On is an excellent movie and one that I would definitely would not mind watching again, in fact I am definitely going to go again. Just like how Dil Chahta Hai started a new movement in Indian cinema, I am sure that now, more projects of the same type will start coming out of the woodwork. I just hope that they can measure upto the quality of Rock On.The casting was good and the ensemble cast gave great performances. Purab kohli, Luke and Arjun Rampal were all good although Arjun Rampal was still a bit stiff with the guitar in hand. On the other hand Farhan looked like an absolute natural playing the guitar, he had excellent stage presence as the lead singer. As for the heroines, Suhana and Prachi were good although I quite liked the former, she has striking looks and has pretty good acting chops. Hope to see more of her in the future.Farhan Akhtar was excellent, in my opinion he has given a subtle but pitch perfect performance that was very natural. It should put several veterans of the big screen to shame......I won't name any names but just imagine some of our existing Bollywood heroes hamming it up on stage and compare them with the Farhan performance.The music was excellent. How good does it feel to look at an actor actually singing his own songs........so much more real and I am sure that it helped Farhan to take his performance to new heights. Akhtar's singing wasn't perfect but it had the raw quality which went well with the overall feel and theme of the movie. SEL & javed Akhtar also deserve their plaudits. I don't see why people were complaining about the music.Abhishek the director has to be given a lot of credit for the final product, which although has a lot of clichés still manages to hold our attention and makes us root for his characters. Well done.....hope he will not come up with a damp squib after this.Farhan Akhtar has become one of the few film personalities in Indian cinema whose name has become synonymous with high quality films. When I see Farhan Akhtar's name attached to a product either as a director or a producer then I would definitely make the time to see the film as I would in the case of Hollywood names such as Steven Spielberg or a Denzel Washington. Fine, he is not in the same league yet but now that Farhan has added the acting feather to his cap we can expect high quality output from him as an actor as well as as a director and a producer.",could usher start new bollywood genre excellent enjoyable,farhan akhtar has done it again rock is excellent movie one that i would definitely would not mind watching again fact i am definitely going go again just like how dil chahta hai started new movement indian cinema i am sure that now more projects same type will start coming out woodwork i just hope that they can measure upto quality rock casting was good ensemble cast gave great performances purab kohli luke arjun rampal were all good although arjun rampal was still bit stiff with guitar hand other hand farhan looked like absolute natural playing guitar he had excellent stage presence as lead singer as heroines suhana prachi were good although i quite liked former she has striking looks has pretty good acting chops hope see more her future farhan akhtar was excellent my opinion he has given subtle but pitch perfect performance that was very natural it should put several veterans big screen shame i wont name any names but just imagine some our existing bollywood heroes hamming it up stage compare them with farhan performance music was excellent how good does it feel look at actor actually singing his own songs so much more real i am sure that it helped farhan take his performance new heights akhtars singing wasnt perfect but it had raw quality which went well with overall feel theme movie sel javed akhtar also deserve their plaudits i dont see why people were complaining about music abhishek director has be given lot credit final product which although has lot clich s still manages hold our attention makes us root his characters well done hope he will not come up with damp squib after this farhan akhtar has become one few film personalities indian cinema whose name has become synonymous with high quality films when i see farhan akhtars name attached product either as director or producer then i would definitely make time see film as i would case hollywood names such as steven spielberg or denzel washington fine he is not same league yet but now that farhan has added acting feather his cap we can expect high quality output him as actor as well as as director producer,0.5541166098858407,0.3263917172571019,Positive,"{'Happy': 0.23, 'Angry': 0.01, 'Surprise': 0.13, 'Sad': 0.17, 'Fear': 0.46}"
7.0,The band decides to get back together...and one of them is hiding a BIG secret.,"""Rock On!!"" is an Indian film about a group of guys who made up a rock/pop band a decade ago. The film begins in the present day and the lead singer of this group, Magik, is now a very successful businessman. He's so wrapped up in his job that he pushes his wife out of his life. She doesn't even know about this past life--and only stumbles upon his being in a band by accident. However, when she does, she contacts his other band mates and tries to get them back together. But Aditya isn't grateful--instead he treats his old friends like they are a part of the past he'd like to keep in the past. Can Aditya come around and finally open up his heart to these guys? And, he's not the only one with problems. Joe loves music and never left the music business...but his wife is a serious detriment and seems bent on squashing his dream. And then there is one other member with a serious problem...one you only learn about late in the film. Can all these problems be worked out so that Magik can once again find the magic?This film is different from a typical Bollywood film because it's clearly targeted towards a younger and hipper sort of audience. This isn't a complaint---just an observation. I really like the style in which the story was told and the story is enjoyable. The only negatives I noticed are that the story seemed a bit predictable and only offered one big surprise. The other wasn't the fault of the original production but the DVD had serious issues. Instead of playing properly, often the film would play a portion and when it came to the next segment, it would bounce back to the scene menu! This is very odd and I've never had it happen before.By the way, if you do watch the film, watch Joe when he plays guitar. Every time he does, a hidden wind machine catches his hair and it's actually unintentionally funny.",band decides get back together one them is hiding big secret,rock is indian film about group guys who made up rock pop band decade ago film begins present day lead singer this group magik is now very successful businessman hes so wrapped up his job that he pushes his wife out his life she doesnt even know about this past life only stumbles upon his being band by accident however when she does she contacts his other band mates tries get them back together but aditya isnt grateful instead he treats his old friends like they are part past hed like keep past can aditya come around finally open up his heart these guys hes not only one with problems joe loves music never left music business but his wife is serious detriment seems bent squashing his dream then there is one other member with serious problem one you only learn about late film can all these problems be worked out so that magik can once again find magic this film is different typical bollywood film because its clearly targeted towards younger hipper sort audience this isnt complaint just observation i really like style which story was told story is enjoyable only negatives i noticed are that story seemed bit predictable only offered one big surprise other wasnt fault original production but dvd had serious issues instead playing properly often film would play portion when it came next segment it would bounce back scene menu this is very odd ive never had it happen before by way if you do watch film watch joe when he plays guitar every time he does hidden wind machine catches his hair its actually unintentionally funny,0.4434108527131783,-0.02267441860465116,Negative,"{'Happy': 0.1, 'Angry': 0.05, 'Surprise': 0.24, 'Sad': 0.18, 'Fear': 0.44}"
10.0,a real neat movie rockin all the way,"i had an option to either watch rock on or wall-e i decided to see rock on cause i liked farhan akhtar's lakshya and wanted to see how he acts the movie is about 4 friends and their rock band called magik and how situations and events that take place over a course of 10 years changes their lives good acting , good camera work , good music , farhan , arjun , purab , Luke ,everybody have acted very well , first have is real neat , second half i felt a bit lukewarm initially but picks up by the end , please watch ROCK ON !!! the songs are well placed in the movie ,purab's comic timing is nice , the actress that plays arjun's wife acted real well , over all rockin on i did not expect much at the start but by the end i was glad i choose rock on over wall - e",real neat movie rockin all way,i had option either watch rock or wall e i decided see rock cause i liked farhan akhtars lakshya wanted see how he acts movie is about 4 friends their rock band called magik how situations events that take place over course 10 years changes their lives good acting good camera work good music farhan arjun purab luke everybody have acted very well first have is real neat second half i felt bit lukewarm initially but picks up by end please watch rock songs are well placed movie purabs comic timing is nice actress that plays arjuns wife acted real well over all rockin i did not expect much at start but by end i was glad i choose rock over wall e,0.411764705882353,0.3019607843137256,Positive,"{'Happy': 0.25, 'Angry': 0.12, 'Surprise': 0.12, 'Sad': 0.21, 'Fear': 0.29}"
,"Move On, No Rocking In This One","Abhishek Kapoor's 'Rock On!' is definitely an improvement when compared to his directorial debut 'Aryan' which was a 'Rocky' plus 'other boxing movies' ripoff. But, as a film itself, 'Rock On' struggles to be just strictly average. It's not a movie I would be willing to revisit. After discussing this movie with a friend, we agreed that 'Rock On' is a half-baked product. The story is too clichéd and predictable that I easily lost interest. For example, killing off the Rob character because he has no girlfriend. The rockband Magik is comprised of a typical Bollywood group of friends where Rob is the one who the audience shouldn't give much of a damn about, Joe the quiet one, KD the 'virgin' wooing the women without much luck and Aditya, the 'main one'. The characters just aren't interesting. The ending is laughably bad.Moreover, there are just too many plot holes that irritated me. Since we're all supposed to believe that these guys are so passionate about music, why do they give up just after one fight? So the band dismembered but they could have pursued their own individual career. Only, Joe is seen to be struggling with his career in music but that too is apparently because 'he's no good in anything else'. Why does Aditya dump his girlfriend? If he wanted to break all ties with Magik, such that he'd dump his girlfriend through a note, why keep the photos etc?On the technical side, it's not so bad. I liked the jump cuts. The background score and cinematography are alright. For a movie about rock, well, the music isn't rocking at all. I wonder what kind of the drugs the lyricist when writing those truly abysmal lyrics. The songs lack soul and energy.The performances are a mixture. Shahana Goswami performs well and for a newcomer Prachi Desai is good too. Despite of having a clichéd role, Purab Kohli is perhaps the best of the male cast. Luke Kenny is adequate. Arjun Rampal is passable. Farhan Akhtar looks confused and is wooden at times.Overall, 'Rock On' has nothing new to offer. It's not exactly a terrible film but I'll put it somewhere between average and below average. It's overrated. This movie just does not rock.",move no rocking this one,abhishek kapoors rock is definitely improvement when compared his directorial debut aryan which was rocky plus other boxing movies ripoff but as film itself rock struggles be just strictly average its not movie i would be willing revisit after discussing this movie with friend we agreed that rock is half baked product story is too clich d predictable that i easily lost interest example killing off rob character because he has no girlfriend rockband magik is comprised typical bollywood group friends where rob is one who audience shouldnt give much damn about joe quiet one kd virgin wooing women without much luck aditya main one characters just arent interesting ending is laughably bad moreover there are just too many plot holes that irritated me since were all supposed believe that these guys are so passionate about music why do they give up just after one fight so band dismembered but they could have pursued their own individual career only joe is seen be struggling with his career music but that too is apparently because hes no good anything else why does aditya dump his girlfriend if he wanted break all ties with magik such that hed dump his girlfriend through note why keep photos etc technical side its not so bad i liked jump cuts background score cinematography are alright movie about rock well music isnt rocking at all i wonder what kind drugs lyricist when writing those truly abysmal lyrics songs lack soul energy performances are mixture shahana goswami performs well newcomer prachi desai is good too despite having clich d role purab kohli is perhaps best male cast luke kenny is adequate arjun rampal is passable farhan akhtar looks confused is wooden at times overall rock has nothing new offer its not exactly terrible film but ill put it somewhere between average below average its overrated this movie just does not rock,0.5056020733652312,0.07793062200956939,Positive,"{'Happy': 0.18, 'Angry': 0.07, 'Surprise': 0.16, 'Sad': 0.18, 'Fear': 0.42}"
