Rating,Review Title,Review,Cleaned Review Title,Cleaned Review,Subjectivity,Polarity,Sentiment,Emotion Scale
8.0,Stabs Directly Into Our Heart.,"That is what Hansal Mehta succeeds in achieving by adopting the life of Shahid Azmi into silver screen. With powerful performances and an engaging story-line, Shahid is one of 2013's best films.Rajkummar Rao has evolved into a more mature actor with this role, if we compare his previous stints. His commitment to the film can be clearly seen by the portrayal. I was mesmerized with how he handled the emotions & the advocacy. Brilliant! Special mention for Mohammed Zeeshan & Prabhleen Sandhu for their marvelous support. Although, few other actors were average, they didn't affect the film intrinsically.Next, the story is written in pure thrilling style not dwelling on points that would induce boredom. It constantly kicks us in the stomach as we get uncomfortable with the scenes on-screen. The reality shown is excellent. A good screenplay & fine score couples the whole film together. Mehta's direction is appreciable.It throws light into how practicing law cannot always be gleeful i.e. if you are fighting for a cause. Human rights has been and will be a controversial aspect.BOTTOM LINE: Highly recommended, due to its sheer originality and peculiar photography.",stabs directly into our heart,that is what hansal mehta succeeds achieving by adopting life shahid azmi into silver screen with powerful performances engaging story line shahid is one 2013s best films rajkummar rao has evolved into more mature actor with this role if we compare his previous stints his commitment film can be clearly seen by portrayal i was mesmerized with how he handled emotions advocacy brilliant special mention mohammed zeeshan prabhleen sandhu their marvelous support although few other actors were average they didnt affect film intrinsically next story is written pure thrilling style not dwelling points that would induce boredom it constantly kicks us stomach as we get uncomfortable with scenes screen reality shown is excellent good screenplay fine score couples whole film together mehtas direction is appreciable it throws light into how practicing law cannot always be gleeful i e if you are fighting cause human rights has been will be controversial aspect bottom line highly recommended due its sheer originality peculiar photography,0.52815873015873,0.26938095238095244,Positive,"{'Happy': 0.17, 'Angry': 0.03, 'Surprise': 0.3, 'Sad': 0.17, 'Fear': 0.33}"
10.0,"""Shahid The Shaheed (Martyr)""","After watching this brave and thought provoking piece of cinema I was compelled to write a review. Many of us might not have heard of this brave man Shahid Azmi who despite of his own sufferings and fears found a way to help others. May God provide him justice and relief to his family. While talking about the movie, it has a great realistic flow that will hold you till the end and even after that - nicely directed, executed and perfectly written. Raj Kumar delivered a breathtaking performance as the lead character and all the remaining cast members supported him well. There is a lot that cannot be expressed about this movie so just watch it on your own. Highly recommended.",shahid shaheed martyr,after watching this brave thought provoking piece cinema i was compelled write review many us might not have heard this brave man shahid azmi who despite his own sufferings fears found way help others may god provide him justice relief his family while talking about movie it has great realistic flow that will hold you till end even after that nicely directed executed perfectly written raj kumar delivered breathtaking performance as lead character all remaining cast members supported him well there is lot that cannot be expressed about this movie so just watch it your own highly recommended,0.8293939393939392,0.6387878787878788,Positive,"{'Happy': 0.05, 'Angry': 0.14, 'Surprise': 0.32, 'Sad': 0.18, 'Fear': 0.32}"
10.0,Terrific!,"Based on the life of late lawyer & human rights activist Shahid Azmi, 'Shahid' is a Terrific film in all respects. A Power-Packed Screenplay, along-with Brilliant Direction & A Tour-De-Force Performance by Rajkummar Rao, take this recent biographical film to dizzy heights. 'Shahid' is An account of slain Human Rights lawyer Shahid Basheer, an ordinary citizen with an extraordinary commitment to justice.'Shahid' salutes the late lawyer's courage & brave journey, with complete conviction. His journey unfolds breathtakingly & also, at times, disturbingly. In fact, the film manages to keep you engrossed from start to end. Without doubt, 'Shahid' is amongst the finest films to come out of the Hindi Film Industry in recent times.Hansal Mehta's Direction, which Won The Prestigious National-Award for Best Director, is utterly brilliant. His conviction towards this story is indeed applaud-worthy. His Screenplay, on the other-hand, is power-packed! A special mention for the realistic dialogue.Performance-Wise: Rajkummar Rao delivers a Tour-De-Force performance as Shahid. He embodies the person & delivers in each & every sequence. Its a relief to know that he was very worthily Awarded the National-Award for Best Actor recently. Prabhleen Sandhu looks gorgeous & performs with remarkable understanding. Her scenes with Rao, stand out.On the whole, 'Shahid' offers a solid punch. Two Thumbs Up!",terrific,based life late lawyer human rights activist shahid azmi shahid is terrific film all respects power packed screenplay along with brilliant direction tour de force performance by rajkummar rao take this recent biographical film dizzy heights shahid is account slain human rights lawyer shahid basheer ordinary citizen with extraordinary commitment justice shahid salutes late lawyers courage brave journey with complete conviction his journey unfolds breathtakingly also at times disturbingly fact film manages keep you engrossed start end without doubt shahid is amongst finest films come out hindi film industry recent times hansal mehtas direction which won prestigious national award best director is utterly brilliant his conviction towards this story is indeed applaud worthy his screenplay other hand is power packed special mention realistic dialogue performance wise rajkummar rao delivers tour de force performance as shahid he embodies person delivers each every sequence its relief know that he was very worthily awarded national award best actor recently prabhleen sandhu looks gorgeous performs with remarkable understanding her scenes with rao stand out whole shahid offers solid punch two thumbs up,0.5926587301587303,0.2766269841269841,Positive,"{'Happy': 0.21, 'Angry': 0.05, 'Surprise': 0.21, 'Sad': 0.08, 'Fear': 0.45}"
9.0,A must watch thought-provoking-emotional-thriller.,"Ever wondered a movie which is so-simple in it's presentation as well as hard-hitting at the same time? A movie which tries to grasp you emotionally but then hits you hard in the face?Well, earlier Raj Kumar Gupta's Aamir was one of those now Shahid joins that list. Shahid first teaches you, ""Jurm Karne Waale Aur Jurm Sehne Waale Dono Ka Koi Mazhab Nahi Hota"" and then right from the start you keep on asking yourself Why on earth do these things happen? Why? Why?Shahid is a biopic of Shahid Azmi, a man who first became the victim of being accused by the police of knowing a terrorist and how he gets a motive in his life for doing higher studies while he is serving jail time. You must have guessed it by now that after his acquittal he goes on to study LAW and then helps the hopeless people who falsely become the victim like him of unsubstantial accusations made by the police.Shahid played by Raj Kumar Yadav is nothing less than a class act. There is a certain innocence in his portrayal of Shahid Azmi which makes you feel about the character. You just cannot take your eyes off him when he is performing. When he cries you feel sad when he smiles you smile and when he gets scared you care for him.This is no mean feat for an actor who is so young and with this amount of talent he certainly is the future of BOLLYWOOD, thanks to his presence in GOW2, LSD, Kai Po Che!, and a small yet noticeable role in Talaash. The supporting cast is commendable being led by Kay Kay Menon who is as usual a treat to watch, Tigmanshu Dhulia who still has that look in his famous dialogue of GOW- ""Beta, tumse na ho payega"" in Why do we make money?. Believe me it's worth it looking at him many a times more with that look. And lastly its Mohd. Zeeshan Ayyub(remember Murari of Raanjhnaa) as a so-sensible and more-responsible elder brother.Hansal Mehta, the director and writer Apurva Asrani and Sameer Singh has kept the movie emotional as well as thought provoking which is an achievement as it's really hard to maintain a line between these two. Whatever it is but Shahid is engaging and thrilling as those acts of terrorism keep on coming after certain interval of time and then you are also emotionally attached with the central character. The one thing which also does favor to the movie is that it's not predictable. The background score is engaging and the one and only song Beparwah sung by Arijit Singh is really lovable and infectious. Supported by great visuals in parts and dark where it's needed from Anuj Dhawan the cinematography is worth appreciating.I recommend you do watch this biopic of a real life hero which works in every department. I wouldn't hesitate to say this is one of the best movies of this year and cannot be missed. Go and celebrate Shahid.",must watch thought provoking emotional thriller,ever wondered movie which is so simple its presentation as well as hard hitting at same time movie which tries grasp you emotionally but then hits you hard face well earlier raj kumar guptas aamir was one those now shahid joins that list shahid first teaches you jurm karne waale aur jurm sehne waale dono ka koi mazhab nahi hota then right start you keep asking yourself why earth do these things happen why why shahid is biopic shahid azmi man who first became victim being accused by police knowing terrorist how he gets motive his life doing higher studies while he is serving jail time you must have guessed it by now that after his acquittal he goes study law then helps hopeless people who falsely become victim like him unsubstantial accusations made by police shahid played by raj kumar yadav is nothing less than class act there is certain innocence his portrayal shahid azmi which makes you feel about character you just cannot take your eyes off him when he is performing when he cries you feel sad when he smiles you smile when he gets scared you care him this is no mean feat actor who is so young with this amount talent he certainly is future bollywood thanks his presence gow2 lsd kai po che small yet noticeable role talaash supporting cast is commendable being led by kay kay menon who is as usual treat watch tigmanshu dhulia who still has that look his famous dialogue gow beta tumse na ho payega why do we make money believe me its worth it looking at him many times more with that look lastly its mohd zeeshan ayyub remember murari raanjhnaa as so sensible more responsible elder brother hansal mehta director writer apurva asrani sameer singh has kept movie emotional as well as thought provoking which is achievement as its really hard maintain line between these two whatever it is but shahid is engaging thrilling as those acts terrorism keep coming after certain interval time then you are also emotionally attached with central character one thing which also does favor movie is that its not predictable background score is engaging one only song beparwah sung by arijit singh is really lovable infectious supported by great visuals parts dark where its needed anuj dhawan cinematography is worth appreciating i recommend you do watch this biopic real life hero which works every department i wouldnt hesitate say this is one best movies this year cannot be missed go celebrate shahid,0.4469642857142857,0.11957738095238096,Positive,"{'Happy': 0.09, 'Angry': 0.12, 'Surprise': 0.33, 'Sad': 0.15, 'Fear': 0.31}"
9.0,Brave and Beautiful!,"This film is a winner all the way, being one of the brilliant contemporary Indian films till date. Based on the life accounts of one of the most controversial figures of our times, the slain lawyer Shahid Azmi who got 17 cases successful in 7 years of his career, the film also highlights the Indian judiciary system and the venom of terrorism in broader light by director Hansal Mehta (also directed ""Dil Pe Mat Le Yaar!""/2000) whose narration is gritty, no nonsense and moreover without any melodrama which will make you sympathize and criticize few moments in the film. The film scores with it's screenplay (Sameer Gautam Singh, Apurva Asrani and Hansal Mehta) whose development and portrayal has shades of films like ""Lawrence Of Arabia"", ""Bombay"", ""Mammo"", ""Black Friday"" and ""Aamir"". and even in the dialogue part, few of the lines here are much better than that of what we hear the punchlines in the so called Masala entertainers. The film has a great cinematography by Anuj Dhawan which captures the depth of the life and surroundings of the protagonist brilliantly and the editing by Apurva Asrani which is a reminiscent of his brilliance in the 1998 cult ""Satya"" where he has done an award winning job in making the film slick, sharp and smooth. In performances, Tigmanshu Dhulia, Kay Kay Menon, Vipi Sharma, Akash Sinha, Prabhleen Sandhu and Baljinder Kaur are true to their roles and hatsoff to the casting genius Mukesh Chhabra for picking up such a great starcast which make the frame go alive with their brilliance. Mohammad Zeeshan Ayyub is great in the film as he returns with his ""Raanjhanaa"" charms and last but not the least is Raj Kumar: Take A Bow as he walks away with all the applauds with such a brilliant portrayal of the slain lawyer with sheer excellence. Overall, this film is NOT TO BE MISSED. Please go and watch this film and get a good cinematic orgasm. My rating would be 4.5/ 5 ﻿",brave beautiful,this film is winner all way being one brilliant contemporary indian films till date based life accounts one most controversial figures our times slain lawyer shahid azmi who got 17 cases successful 7 years his career film also highlights indian judiciary system venom terrorism broader light by director hansal mehta also directed dil pe mat le yaar 2000 whose narration is gritty no nonsense moreover without any melodrama which will make you sympathize criticize few moments film film scores with its screenplay sameer gautam singh apurva asrani hansal mehta whose development portrayal has shades films like lawrence arabia bombay mammo black friday aamir even dialogue part few lines here are much better than that what we hear punchlines so called masala entertainers film has great cinematography by anuj dhawan which captures depth life surroundings protagonist brilliantly editing by apurva asrani which is reminiscent his brilliance 1998 cult satya where he has done award winning job making film slick sharp smooth performances tigmanshu dhulia kay kay menon vipi sharma akash sinha prabhleen sandhu baljinder kaur are true their roles hatsoff casting genius mukesh chhabra picking up such great starcast which make frame go alive with their brilliance mohammad zeeshan ayyub is great film as he returns with his raanjhanaa charms last but not least is raj kumar take bow as he walks away with all applauds with such brilliant portrayal slain lawyer with sheer excellence overall this film is not be missed please go watch this film get good cinematic orgasm my rating would be 4 5 5,0.5747549019607843,0.3110294117647059,Positive,"{'Happy': 0.23, 'Angry': 0.07, 'Surprise': 0.15, 'Sad': 0.2, 'Fear': 0.35}"
8.0,A must watch for those who is sick of bollywood bakwas masala. A very remarkable movie!!!,"Truth is pure, natural and simple. Hansal Mehta's Shahid focus on state of mind of a common man. A man sees the violence and brutality of world and then follows brutal way to end it. But After Realizing that an eye for an eye never earns anything but will leave the whole world blind. He runs away to live a life of man who could give justice to himself and others. Religion has nothing to do with the justice. The one who dies and the one who kills are human. Movie leaves a deep message for us by showing extra ordinary life of an ordinary man.A must watch for those who is sick of bollywood bakwas masala. A very remarkable movie. All actor has played beautifully in this movie.",must watch those who is sick bollywood bakwas masala very remarkable movie,truth is pure natural simple hansal mehtas shahid focus state mind common man man sees violence brutality world then follows brutal way end it but after realizing that eye eye never earns anything but will leave whole world blind he runs away live life man who could give justice himself others religion has nothing do with justice one who dies one who kills are human movie leaves deep message us by showing extra ordinary life ordinary man must watch those who is sick bollywood bakwas masala very remarkable movie all actor has played beautifully this movie,0.5882275132275132,-0.008495670995671,Negative,"{'Happy': 0.09, 'Angry': 0.13, 'Surprise': 0.17, 'Sad': 0.13, 'Fear': 0.48}"
10.0,Best Movie I have ever seen.,Best Movie I have ever seen. Rajkummar Rao your acting is unbelievable. Prabhleen Sandhu your acting is great. Baljinder Kaur sahiba acting is marvelous. Mohammed Zeeshan Ayyub acting is too real. Tigmanshu Dhulia sir after paan singh tomer it is great to see you in movie. K K Menon Sahab short roll but impressive. Thanks to Hansal Mehta sir. Best Movie I have ever seen. Rajkummar Rao your acting is unbelievable. Prabhleen Sandhu your acting is great. Baljinder Kaur sahiba acting is marvelous. Mohammed Zeeshan Ayyub acting is too real. Tigmanshu Dhulia sir after paan singh tomer it is great to see you in movie. K K Menon Sahab short roll but impressive. Thanks to Hansal Mehta sir.,best movie i have ever seen,best movie i have ever seen rajkummar rao your acting is unbelievable prabhleen sandhu your acting is great baljinder kaur sahiba acting is marvelous mohammed zeeshan ayyub acting is too real tigmanshu dhulia sir after paan singh tomer it is great see you movie k k menon sahab short roll but impressive thanks hansal mehta sir best movie i have ever seen rajkummar rao your acting is unbelievable prabhleen sandhu your acting is great baljinder kaur sahiba acting is marvelous mohammed zeeshan ayyub acting is too real tigmanshu dhulia sir after paan singh tomer it is great see you movie k k menon sahab short roll but impressive thanks hansal mehta sir,0.42592592592592593,0.3888888888888889,Positive,"{'Happy': 0.33, 'Angry': 0.11, 'Surprise': 0.44, 'Sad': 0.11, 'Fear': 0.0}"
6.0,A dull film with no notable mistakes,"A film with no notable mistakes. But it's dull. There is something wrong with the treatment. The film had a badass conspiracy theorist who took on the system as the protagonist. But his life gets a very humdrum treatment. I know only what I read in wikipedia about the man. Maybe this is the right treatment and I might have watched too many Oliver Stone directed biopics. Maybe THIS is what the life of a man who grew up in a slum/chawl with four others and then lived in a dinghy apartment with a frustrated wife and fought court cases for hapless Muslims in ugly court rooms looks like. Anyway, I do not have much hope for India as a country based on what I saw in this film. I also do not understand all the hype around Rajkumar Rao He is the very opposite of charismatic. I don't get his appeal. Prabhleen Sandhu was pretty cute.",dull film with no notable mistakes,film with no notable mistakes but its dull there is something wrong with treatment film had badass conspiracy theorist who took system as protagonist but his life gets very humdrum treatment i know only what i read wikipedia about man maybe this is right treatment i might have watched too many oliver stone directed biopics maybe this is what life man who grew up slum chawl with four others then lived dinghy apartment with frustrated wife fought court cases hapless muslims ugly court rooms looks like anyway i do not have much hope india as country based what i saw this film i also do not understand all hype around rajkumar rao he is very opposite charismatic i dont get his appeal prabhleen sandhu was pretty cute,0.6256302521008403,-0.06750700280112042,Negative,"{'Happy': 0.08, 'Angry': 0.08, 'Surprise': 0.12, 'Sad': 0.33, 'Fear': 0.38}"
10.0,Hard Hitting...,A great and successful attempt to show a story of a brave man. Rajkumar Rao is excellent as Shahid.,hard hitting,great successful attempt show story brave man rajkumar rao is excellent as shahid,0.8483333333333333,0.6116666666666667,Positive,"{'Happy': 0.4, 'Angry': 0.4, 'Surprise': 0.0, 'Sad': 0.0, 'Fear': 0.2}"
,It's fiction!,"A fake biography exaggerated to prove the subject was a saint. He could be good or bad, I am not saying he was not a good guy. But this story is fictitious. And using fiction to paint somebody's image calling it biography is wrong. Most people come out of the theater thinking it was completely true as it is tried to portray. And absence of evidence is not evidence of absence, what he did to win his cases only he knows. But if his image was to be portrayed it shouldn't have been mixed with fiction. Or it should have been claimed to be completely fictional story. Director even mixes his life's story to make the story more dramatic. I would have rated it 10/10 if it was not connected to a real person (with controversial life). He acquitted 17 people in a short period can also mean he was just a brilliant lawyer and nothing to do with innocence of people he defended. Even Dr Naik would make a brilliant lawyer but only faithful to people of his faith. Also there is no mention of how many cases he lost because he couldn't win while defending a real terrorist. So yes there can be shortcoming in Indian law enforcement but that doesn't warrant painting a lawyer (with unknown/unproved intent) as saint using fiction.",its fiction,fake biography exaggerated prove subject was saint he could be good or bad i am not saying he was not good guy but this story is fictitious using fiction paint somebodys image calling it biography is wrong most people come out theater thinking it was completely true as it is tried portray absence evidence is not evidence absence what he did win his cases only he knows but if his image was be portrayed it shouldnt have been mixed with fiction or it should have been claimed be completely fictional story director even mixes his lifes story make story more dramatic i would have rated it 10 10 if it was not connected real person with controversial life he acquitted 17 people short period can also mean he was just brilliant lawyer nothing do with innocence people he defended even dr naik would make brilliant lawyer but only faithful people his faith also there is no mention how many cases he lost because he couldnt win while defending real terrorist so yes there can be shortcoming indian law enforcement but that doesnt warrant painting lawyer with unknown unproved intent as saint using fiction,0.5816964285714288,0.11830357142857144,Positive,"{'Happy': 0.1, 'Angry': 0.03, 'Surprise': 0.24, 'Sad': 0.31, 'Fear': 0.31}"
