Rating,Review Title,Review,Cleaned Review Title,Cleaned Review,Subjectivity,Polarity,Sentiment,Emotion Scale
9.0,"A must watch for its superb performances and for the man, who never lived for himself.","A true story of a selfless protagonist, fighting for the freedom of falsely framed victims of a minority community, this is about SHAHID AZMI, a noted lawyer who was killed in his own Kurla office in February 2010 by some unidentified men. With a mix of more facts and less fiction, director Hansal Mehta makes this best film of his career in a pure realistic style, as an absorbing documentation of the life of Shahid Azmi which is going to be a fascinating yet disturbing cinematic experience for many. Shot at actual locations with an immensely likable touch of romance in this otherwise unkind portrayal, the film reaches its peak with all the gripping courtroom scenes filmed in the most authentic manner rarely seen before in a Hindi film in particular. SHAHID grabs you from the collars within the first 10 minutes itself, especially in the scene wherein even a mother is scared to open the door of their hideouts in the riots, listening to the voice of her son knocking at it constantly. And once you get into the grim, shocking world of Shahid's valuable life, Mehta never lets you move out of it even for a minute, in the next 100 minutes of his film very convincingly. Apart from its scary & unbelievable kind of real life account of a lawyer, what makes SHAHID hit you hard is its sharp editing, flawless casting and superb, realistic performances from the entire talented cast. Perfectly played by Raj Kumar Yadav, the actor goes deep down the skin of his character and surely becomes a strong contender of many worth deserving awards this year. Such is the authenticity in his performance that after watching him, one feels like having met the real SHAHID and for that both the actor and his director truly deserve all the praises showered upon them in the last few months. Other than Raj, there are two names in the film playing the female Muslim characters perfectly and the ease, with which they play their respective difficult characters, clearly proves the true talent of these ladies undoubtedly. The names are Prabhleen Kaur and Baljinder Kaur (Shahid's mother) and they do provide a strong visible support to Raj Kumar's towering performance along with subtle Mohammed Zeeshan Ayub,silently playing his helpful brother. As the public prosecutor, Vipin Sharma once again proves that he is a remarkable actor. Plus Kay Kay Menon & Tigmanshu Dhulia, truly impress in their small cameos, as expected. Also Shalini Vatsa, Prabal Punjabi and Mukesh Chhabra turn out to be a very valuable addition to the supporting cast with their truthful acts. Considering the film from a general public viewpoint, one might find few glitches in it related with Shahid's Pakistani training camp days and his escape from there, shown in just a few scenes. Moreover Kay Kay simply vanishing from the story progression to never return later may also tease many (like myself). But these few points are not solid enough to bring down the excellence achieved by the team in its overall depiction and thus need to be ignored to attain a bigger and much important social objective as desired. Personally, more than the film, it is the message, the purpose and the mission of the man named SHAHID, which forces me to include it in my must see movies list right away, particularly for the Indian viewers, who are facing this religious clash everyday like an inseparable issue of our multi-cultured society. Specifically talking about the unsung hero of many victim families from the minority, SHAHID is an important document bringing to us an iconic name of our social system, not known to majority of people living in the other parts of the country. And the reason for this shameful mass ignorance ironically lays in the way our media works, which actually holds back the positive news for their obvious reasons and always spreads the negative word around in a much stronger and deliberate manner to gain some instant attention. Probably that is the reason why we very well know about the men who made important arrests at those crucial times of crisis but don't really know about the man who got many innocents out of the jail after few years, rightly fighting the court of law with his own sincere efforts.For instance, be it Mumbai, Kashmir, Punjab, Gujarat, Assam or any other region of our country, we always get to hear and read the news of suspected terrorists arrested from anywhere and it's at once all over the media as their main focus. But whenever the same court serves justice making those 'framed people' free after having proved innocent, very seldom we get to hear about them on the channels or respectfully mentioned in the headlines on the first page. The poor coverage of such cases, don't let us know about many courageous and human right activists like SHAHID AZMI and therefore the film presented on his life is indeed a very vital and major contribution made by Hansal Mehta and his team to Indian Cinema as well to Indian social system, embracing diverse religious beliefs since centuries. Practicing as the lawyer for such special framed cases, Shahid had an astonishing record of getting 17 acquittals from the court in his short career span of only seven years. And even thinking about those 17 families greeting their wrongly framed members back in home is enough to make you realize the relevance & importance of this historical achievement made by the makers of SHAHID. So if you are willing to see a rare kind of alarming as well as enlightening biographical film made on a true fighter who always fought for others in his forcibly shortened life of only 32 years, then do watch SHAHID as a must and celebrate this new triumph of Indian cinema made for a cause.",must watch its superb performances man who never lived himself,true story selfless protagonist fighting freedom falsely framed victims minority community this is about shahid azmi noted lawyer who was killed his own kurla office february 2010 by some unidentified men with mix more facts less fiction director hansal mehta makes this best film his career pure realistic style as absorbing documentation life shahid azmi which is going be fascinating yet disturbing cinematic experience many shot at actual locations with immensely likable touch romance this otherwise unkind portrayal film reaches its peak with all gripping courtroom scenes filmed most authentic manner rarely seen before hindi film particular shahid grabs you collars within first 10 minutes itself especially scene wherein even mother is scared open door their hideouts riots listening voice her son knocking at it constantly once you get into grim shocking world shahids valuable life mehta never lets you move out it even minute next 100 minutes his film very convincingly apart its scary unbelievable kind real life account lawyer what makes shahid hit you hard is its sharp editing flawless casting superb realistic performances entire talented cast perfectly played by raj kumar yadav actor goes deep down skin his character surely becomes strong contender many worth deserving awards this year such is authenticity his performance that after watching him one feels like having met real shahid that both actor his director truly deserve all praises showered upon them last few months other than raj there are two names film playing female muslim characters perfectly ease with which they play their respective difficult characters clearly proves true talent these ladies undoubtedly names are prabhleen kaur baljinder kaur shahids mother they do provide strong visible support raj kumars towering performance along with subtle mohammed zeeshan ayub silently playing his helpful brother as public prosecutor vipin sharma once again proves that he is remarkable actor plus kay kay menon tigmanshu dhulia truly impress their small cameos as expected also shalini vatsa prabal punjabi mukesh chhabra turn out be very valuable addition supporting cast with their truthful acts considering film general public viewpoint one might find few glitches it related with shahids pakistani training camp days his escape there shown just few scenes moreover kay kay simply vanishing story progression never return later may also tease many like myself but these few points are not solid enough bring down excellence achieved by team its overall depiction thus need be ignored attain bigger much important social objective as desired personally more than film it is message purpose mission man named shahid which forces me include it my must see movies list right away particularly indian viewers who are facing this religious clash everyday like inseparable issue our multi cultured society specifically talking about unsung hero many victim families minority shahid is important document bringing us iconic name our social system not known majority people living other parts country reason this shameful mass ignorance ironically lays way our media works which actually holds back positive news their obvious reasons always spreads negative word around much stronger deliberate manner gain some instant attention probably that is reason why we very well know about men who made important arrests at those crucial times crisis but dont really know about man who got many innocents out jail after few years rightly fighting court law with his own sincere efforts instance be it mumbai kashmir punjab gujarat assam or any other region our country we always get hear read news suspected terrorists arrested anywhere its at once all over media as their main focus but whenever same court serves justice making those framed people free after having proved innocent very seldom we get hear about them channels or respectfully mentioned headlines first page poor coverage such cases dont let us know about many courageous human right activists like shahid azmi therefore film presented his life is indeed very vital major contribution made by hansal mehta his team indian cinema as well indian social system embracing diverse religious beliefs since centuries practicing as lawyer such special framed cases shahid had astonishing record getting 17 acquittals court his short career span only seven years even thinking about those 17 families greeting their wrongly framed members back home is enough make you realize relevance importance this historical achievement made by makers shahid so if you are willing see rare kind alarming as well as enlightening biographical film made true fighter who always fought others his forcibly shortened life only 32 years then do watch shahid as must celebrate this new triumph indian cinema made cause,0.49286345001576826,0.15699953651940413,Positive,"{'Happy': 0.12, 'Angry': 0.06, 'Surprise': 0.16, 'Sad': 0.28, 'Fear': 0.38}"
10.0,awesome film and awesome acting by rajkumar. hats off to the director.,"Very few people dare to rise and take a stand to tell a story that might have been vanished from lives & in files if not attempted. Hansal Mehta joins the same league. Respect for giving us SHAHID- a film that will find a place close to your heart very easily but not without stirring-shaking & moving your soul. STRONGLY RECOMMENDED!After PAAN SINGH TOMAR, here comes an earnest biographical drama that I hope could change the way Indian Cinema thinks about our real life heroes. This is also a film that raises many a questions about humanity and its survival in today's times. It also shows our judiciary system in true lights.What makes it an exceptional biopic are the performances. Shahid's fearless-in your face-uncomplicated character could never come so strong if Raj Kumar has not given it his flesh & blood. This man can make you laugh with his charmingly simplistic behavior, watch it when he is trying to be comfortable with his lady-love still unaware of his feelings, and also can make your heart bleed with his heartrending silence when attacked for his forgettable past. Extended applause for his bravura performance.",awesome film awesome acting by rajkumar hats off director,very few people dare rise take stand tell story that might have been vanished lives files if not attempted hansal mehta joins same league respect giving us shahid film that will find place close your heart very easily but not without stirring shaking moving your soul strongly recommended after paan singh tomar here comes earnest biographical drama that i hope could change way indian cinema thinks about our real life heroes this is also film that raises many questions about humanity its survival todays times it also shows our judiciary system true lights what makes it exceptional biopic are performances shahids fearless your face uncomplicated character could never come so strong if raj kumar has not given it his flesh blood this man can make you laugh with his charmingly simplistic behavior watch it when he is trying be comfortable with his lady love still unaware his feelings also can make your heart bleed with his heartrending silence when attacked his forgettable past extended applause his bravura performance,0.5485087719298246,0.25456140350877193,Positive,"{'Happy': 0.13, 'Angry': 0.03, 'Surprise': 0.23, 'Sad': 0.26, 'Fear': 0.36}"
9.0,A strong evidential piece of cinema that enlightens!,"I feel ashamed of myself for not knowing Shahid Azmi- a slain lawyer and an altruistic humane activist before Hansal Mehta came up with a strong evidential piece of cinema that does not merely solve the purpose to entertain but also dares to enlighten our unresponsive- unsympathetic minds confined into its own safe but scared place to stay put. We probably have become either numb to whatever happens in our neighborhoods or blatantly reactive about just anything that comes in way without assessing what is right and what is not.'SHAHID' is the need of the hour. It demands and shows the guts to start a never-ending movement, if not on the roads, definitely in our heads, to bring change in the system by joining it and not wiping it out or denying its very existence. Shahid, played by 'Kai Po Che!' fame Raj Kumar could be anyone of thousands who gets trapped into the torturous custody of Indian Police known for its tactical power-driven machinery and is thrown into Jail for beholding a name that comes from a certain section of people in minoritybut where the most would disappear in the galore to turn radical against country & its governing bodies, Shahid decides to stand out. While his tenure in longing to get set free, Shahid keeps his conscience alive and opts to be a helping hand for those who have nothing but an assurance of not being guilty.SHAHID is an extraordinary effort in terms of writing and direction. Based on the real-life criminal lawyer-cum-human rights activist Shahid Azmi, film amalgamates facts and fiction beautifully. It is a biopic that is handled with sheer honesty, clarity in thoughts, rightly positioned screenplay, brilliance in execution and a very very significant memorandum to all human beings. Hansal Mehta never and never loses his grip on the subject. He keeps it as real as it is happening in a gully adjacent to my living place. Special mention to the replication of Indian courts' undramatic-nontheatrical-dreary modus operandi where there is no usual Bollywood 'order-order' but an actual exchange of verbal spats. Camera work by Anuj Dhawan captures the environs and the emotions equally good. Dialogues are crisp, colloquial and taut. But what make it an exceptional biopic are the performances. Shahid's fearless-in your face-uncomplicated character could never come so strong if Raj Kumar has not given it his flesh & blood. This man can make you laugh with his charmingly simplistic behavior, watch it when he is trying to be comfortable with his lady-love still unaware of his feelings, and also can make your heart bleed with his heartrending silence when attacked for his forgettable past. Extended applause for his bravura performance! Prabhleen Sandhu as his wife too is a gifted actor. She brings with herself an unpolished charm that hits every chord she aims to. Md. Zeeshan Ayyub here has not much like in RAANJHANAA to overwhelm you but still he keeps your expectations fulfilled. Kay Kay Menon and Tigmanshu Dhulia play their parts efficiently with a sparkling presence on screen.After PAAN SINGH TOMAR, here comes an earnest biographical drama that I hope could change the way Indian Cinema thinks about our real life heroes. This is also a film that raises many a questions about humanity and its survival in today's times. It also shows our judiciary system in true lights. As said in the film by the character Kay Kay Menon plays, ""It takes time but it works."" Painfully correct!On the whole, very few people dare to rise and take a stand to tell a story that might have been vanished from lives & in files if not attempted. Hansal Mehta joins the same league. Respect for giving us SHAHID- a film that will find a place close to your heart very easily but not without stirring-shaking & moving your soul. STRONGLY RECOMMENDED!",strong evidential piece cinema that enlightens,i feel ashamed myself not knowing shahid azmi slain lawyer altruistic humane activist before hansal mehta came up with strong evidential piece cinema that does not merely solve purpose entertain but also dares enlighten our unresponsive unsympathetic minds confined into its own safe but scared place stay put we probably have become either numb whatever happens our neighborhoods or blatantly reactive about just anything that comes way without assessing what is right what is not shahid is need hour it demands shows guts start never ending movement if not roads definitely our heads bring change system by joining it not wiping it out or denying its very existence shahid played by kai po che fame raj kumar could be anyone thousands who gets trapped into torturous custody indian police known its tactical power driven machinery is thrown into jail beholding name that comes certain section people minority but where most would disappear galore turn radical against country its governing bodies shahid decides stand out while his tenure longing get set free shahid keeps his conscience alive opts be helping hand those who have nothing but assurance not being guilty shahid is extraordinary effort terms writing direction based real life criminal lawyer cum human rights activist shahid azmi film amalgamates facts fiction beautifully it is biopic that is handled with sheer honesty clarity thoughts rightly positioned screenplay brilliance execution very very significant memorandum all human beings hansal mehta never never loses his grip subject he keeps it as real as it is happening gully adjacent my living place special mention replication indian courts undramatic nontheatrical dreary modus operandi where there is no usual bollywood order order but actual exchange verbal spats camera work by anuj dhawan captures environs emotions equally good dialogues are crisp colloquial taut but what make it exceptional biopic are performances shahids fearless your face uncomplicated character could never come so strong if raj kumar has not given it his flesh blood this man can make you laugh with his charmingly simplistic behavior watch it when he is trying be comfortable with his lady love still unaware his feelings also can make your heart bleed with his heartrending silence when attacked his forgettable past extended applause his bravura performance prabhleen sandhu as his wife too is gifted actor she brings with herself unpolished charm that hits every chord she aims md zeeshan ayyub here has not much like raanjhanaa overwhelm you but still he keeps your expectations fulfilled kay kay menon tigmanshu dhulia play their parts efficiently with sparkling presence screen after paan singh tomar here comes earnest biographical drama that i hope could change way indian cinema thinks about our real life heroes this is also film that raises many questions about humanity its survival todays times it also shows our judiciary system true lights as said film by character kay kay menon plays it takes time but it works painfully correct whole very few people dare rise take stand tell story that might have been vanished lives files if not attempted hansal mehta joins same league respect giving us shahid film that will find place close your heart very easily but not without stirring shaking moving your soul strongly recommended,0.5278262786596122,0.15046957671957675,Positive,"{'Happy': 0.13, 'Angry': 0.04, 'Surprise': 0.15, 'Sad': 0.25, 'Fear': 0.43}"
8.0,Amazing,"Rarely in Bollywood biopics look so real, Normally we are accustomed to seeing bollywood biopics with song and dance and all, Shahid however tries very much to be real. Hansal Mehta after several rubbish films comes back with a striker. The film tries to depict the life of Shahid Azmi who was killed in 2010. The film starts off well to the point, but the entire Kashmir episode could be dealt with more importance as it looks too abrupt, but the rest of the film, the way he becomes a lawyer and till the end are really superb. However the romantic track does distract though it is necessary yet thankfully it isn't too filmy.The climax does seem a bit abrupt but otherwise the film does full justice to the subject.Hansal Mehta surprises everyone with a brilliant concept and superb handlingRajkumar Yadav who started off doing small roles in Shaitan, Talaash and a lead in Ragini MMS and of course Kai Po Che finally proves that he is indeed here to stay if anyone has doubts, he is simply amazing, his unconventional looks and dialect suit the role perfectly, his expressions are really outstanding. Prabhleen Sandhu is perfect as Mariam though her role is not too demanding yet she gives a superb performance. Mohammed Zeeshan Ayyub as Arif Azmi is really superb yet again after Jannat 2 and Ranjhanaa, he is here to stay. The film has cameos by KK Menon and Tigmanshu Dhulia and both are perfect, Prabal Panjabi known for his comic roles in Mujhse Fraandship Karoge and Mere Dad Ki Maruti stuns everyone with an understated performance The others mostly unknown faces give natural performances too.",amazing,rarely bollywood biopics look so real normally we are accustomed seeing bollywood biopics with song dance all shahid however tries very much be real hansal mehta after several rubbish films comes back with striker film tries depict life shahid azmi who was killed 2010 film starts off well point but entire kashmir episode could be dealt with more importance as it looks too abrupt but rest film way he becomes lawyer till end are really superb however romantic track does distract though it is necessary yet thankfully it isnt too filmy climax does seem bit abrupt but otherwise film does full justice subject hansal mehta surprises everyone with brilliant concept superb handlingrajkumar yadav who started off doing small roles shaitan talaash lead ragini mms course kai po che finally proves that he is indeed here stay if anyone has doubts he is simply amazing his unconventional looks dialect suit role perfectly his expressions are really outstanding prabhleen sandhu is perfect as mariam though her role is not too demanding yet she gives superb performance mohammed zeeshan ayyub as arif azmi is really superb yet again after jannat 2 ranjhanaa he is here stay film has cameos by kk menon tigmanshu dhulia both are perfect prabal panjabi known his comic roles mujhse fraandship karoge mere dad ki maruti stuns everyone with understated performance others mostly unknown faces give natural performances too,0.6532828282828284,0.30782828282828284,Positive,"{'Happy': 0.16, 'Angry': 0.07, 'Surprise': 0.28, 'Sad': 0.23, 'Fear': 0.26}"
