Rating,Review Title,Review,Cleaned Review Title,Cleaned Review,Subjectivity,Polarity,Sentiment,Emotion Scale
,"style of Sinclair Lewis, or on a really good day, John Grisham","Hansal Mehta's SHAHID, in Hindi, begins with the murder of a lawyer in his office. His first name, Shahid, which also means 'martyr' indicates that he was Muslim. We flashback to the riots in the early 1990s in which he is caught up, causing him to train with Muslim militants in Kashmir. This is not the Kashmir of so many Hindi film songs and dances, but of narrow roads cut into enormous cliffs, the rocks overhanging them. Shahid runs away from the training camp when he is forced to witness the beheading of a turncoat, is arrested in Delhi, and in Tihar Jail must choose between siding with terrorists again or continuing his former law studies. He chooses the latter, but on release finds that the law is a double- sided game. So he starts his own practice and takes on only the cases he wants. One is of a woman whose mother-in-law wants her house; we learn later that she is divorced, has a child, and that Shahid wants to marry her. He does, and his family reluctantly agrees. But the majority of his cases favor Muslims who have been falsely accused of terrorism, as we move through more terrorist attacks over time, including the 26/11 attack on the Taj Hotel. In every case shown, including the one involving the house, he receives phone threats, until ... This is a very serious film, more like a novel that what we usually think of cinema, in the style of Sinclair Lewis, or on a really good day, John Grisham.",style sinclair lewis or really good day john grisham,hansal mehtas shahid hindi begins with murder lawyer his office his first name shahid which also means martyr indicates that he was muslim we flashback riots early 1990s which he is caught up causing him train with muslim militants kashmir this is not kashmir so many hindi film songs dances but narrow roads cut into enormous cliffs rocks overhanging them shahid runs away training camp when he is forced witness beheading turncoat is arrested delhi tihar jail must choose between siding with terrorists again or continuing his former law studies he chooses latter but release finds that law is double sided game so he starts his own practice takes only cases he wants one is woman whose mother law wants her house we learn later that she is divorced has child that shahid wants marry her he does his family reluctantly agrees but majority his cases favor muslims who have been falsely accused terrorism as we move through more terrorist attacks over time including 26 11 attack taj hotel every case shown including one involving house he receives phone threats until this is very serious film more like novel that what we usually think cinema style sinclair lewis or really good day john grisham,0.3854166666666666,0.0986111111111111,Positive,"{'Happy': 0.18, 'Angry': 0.04, 'Surprise': 0.36, 'Sad': 0.0, 'Fear': 0.43}"
8.0,"Shahid, Law aur Gangster.","'Shahid' is about the life of the controversial lawyer Shahid Azmi who was assassinated in 2010. Directed by Hansal Mehta, produced by AKFPL, Bohra Bros, and distributed by UTV Motion pictures . The film is set to release on the 18th of October after its world premier at the 2012 TIFF. The movie stars Raj Kumar Yadav in the title character and the story revolves mainly around him. Hope the producers and the director join again to make a biopic on the life of Narendra Dabholkar(Another Marathi icon who was recently assassinated). The story opens with Shahid being shot point blank at his office and it continues linearly otherwise. The opening immediately reminded me of 'Bhaag Milkha Bhaag' and 'Jobs'. Is it a necessity that biopics should begin very dramatically or with a possible ending of the life of the person depicted? Is it because there are many milestones in the life of icons that its difficult to create an apt ending to these sort of movies? The movie showcases more of a rather sweet life of Shahid in the first half and gains momentum in the second half where the major drama occurs. Pre-interval drama is more of Shahid's own upcoming and the people he meets while post-interval is full of courtroom drama. The interval was placed exactly at the mid point of the parabolic life story of Shahid Azmi. I wonder how Raj Kumar was chosen to play the role of Shahid when he looks nowhere close to the man he's portraying. Apart from the looks the guy was very comfortable in his role. Actors should take up biopics seriously as it has more scope for them(Take Ashton Kutcher as an Inspiration). Mohammed Zeeshan Ayyub as Arif, he's one actor to look out for his subtle reactions. He made us realize that if not for Arif, Shahid wouldn't have accomplished so much. Prabhleen Sandhu(Mariyam), K K Menon(War Saab), Tigmanshu Dhulia(Maqbool Menon) in their respective small roles made the story complete. Very few people knew about Shahid Azmi and I think that this man should be made known to everyone. I've not lived when there was a Gandhi but was alive when Shahid was fighting for the lives of the innocent in a polite way. There's a point in the movie where Shahid is being provoked by a prosecutor about his dark past and this is what he says to her ""I can sue you but I won't"". Such a remarkable character he should have been. His record of 17 acquittals in a short span of time is indeed a great achievement so people please watch this for sure, Shahid will not disappoint you. I hope more such biopics should be made and the patronage for such genre will increase. In a country where iconic people are made gods, a film made about them will be a blessing. It will take time but it will happen.",shahid law aur gangster,shahid is about life controversial lawyer shahid azmi who was assassinated 2010 directed by hansal mehta produced by akfpl bohra bros distributed by utv motion pictures film is set release 18th october after its world premier at 2012 tiff movie stars raj kumar yadav title character story revolves mainly around him hope producers director join again make biopic life narendra dabholkar another marathi icon who was recently assassinated story opens with shahid being shot point blank at his office it continues linearly otherwise opening immediately reminded me bhaag milkha bhaag jobs is it necessity that biopics should begin very dramatically or with possible ending life person depicted is it because there are many milestones life icons that its difficult create apt ending these sort movies movie showcases more rather sweet life shahid first half gains momentum second half where major drama occurs pre interval drama is more shahids own upcoming people he meets while post interval is full courtroom drama interval was placed exactly at mid point parabolic life story shahid azmi i wonder how raj kumar was chosen play role shahid when he looks nowhere close man hes portraying apart looks guy was very comfortable his role actors should take up biopics seriously as it has more scope them take ashton kutcher as inspiration mohammed zeeshan ayyub as arif hes one actor look out his subtle reactions he made us realize that if not arif shahid wouldnt have accomplished so much prabhleen sandhu mariyam k k menon war saab tigmanshu dhulia maqbool menon their respective small roles made story complete very few people knew about shahid azmi i think that this man should be made known everyone ive not lived when there was gandhi but was alive when shahid was fighting lives innocent polite way theres point movie where shahid is being provoked by prosecutor about his dark past this is what he says her i can sue you but i wont such remarkable character he should have been his record 17 acquittals short span time is indeed great achievement so people please watch this sure shahid will not disappoint you i hope more such biopics should be made patronage such genre will increase country where iconic people are made gods film made about them will be blessing it will take time but it will happen,0.48919896640826876,0.1718410852713178,Positive,"{'Happy': 0.1, 'Angry': 0.05, 'Surprise': 0.23, 'Sad': 0.21, 'Fear': 0.41}"
9.0,"Forget Chennai Express, Krrish 3 and Dhoom 3. Shahid is 2013's best film","I have always wondered why do miss out to nominate films like SHAHID, Madras Cafe or BA Pass in Indian awards. Fortunately, I was lucky to watch SHAHID and it blew away my mind with incomparable direction and stupendous performances.Based on the life of lawyer and social activist Shahid Azmi, SHAHID gives real-time events which changed the life of an innocent boy to a social activist who was only committed to fight for justice.It takes courage and guts to make a movie like SHAHID. The movie opens with a bang with torture scene giving you goose-bumps. As the movie progress, you will be sucked into the film. The court-drama, romantic track and even the climax sequences are definitely the highlight of the film. Full credit should be given to Hansal Mehta for finally coming out with sensible film after year of delivering flops. Screenplay is tight. Art direction and cinematography is simple yet powerful. Raj Kumar Yadav gives his career-best performance. He fits into the character of Shahid Azmi as if it is tailor-made for him. Prabhleen Sandhu and Mohammed Zeeshan Ayyub lends in good support.Shahid is definitely 2013's most under-rated film. Excellent 4.5/5",forget chennai express krrish 3 dhoom 3 shahid is 2013s best film,i have always wondered why do miss out nominate films like shahid madras cafe or ba pass indian awards fortunately i was lucky watch shahid it blew away my mind with incomparable direction stupendous performances based life lawyer social activist shahid azmi shahid gives real time events which changed life innocent boy social activist who was only committed fight justice it takes courage guts make movie like shahid movie opens with bang with torture scene giving you goose bumps as movie progress you will be sucked into film court drama romantic track even climax sequences are definitely highlight film full credit should be given hansal mehta finally coming out with sensible film after year delivering flops screenplay is tight art direction cinematography is simple yet powerful raj kumar yadav gives his career best performance he fits into character shahid azmi as if it is tailor made him prabhleen sandhu mohammed zeeshan ayyub lends good support shahid is definitely 2013s most under rated film excellent 4 5 5,0.5552154195011338,0.3129251700680272,Positive,"{'Happy': 0.12, 'Angry': 0.04, 'Surprise': 0.24, 'Sad': 0.18, 'Fear': 0.41}"
10.0,A movie made honestly.,"When i went to this movie in NJ, the theater was empty. The show was only for me alone. But i am glad that i haven't missed this movie. This is a honest attempt to make a nice movie. All the characters were well chosen for this movie and they played there part. Its a good movie for every country that had been target by terrorist attacks. And this is a movie for those extremists who are making normal people life a big hell. A must watch movie. Thanks to the director for showing true things that happens after attacks which majority of the people don't know. Wish more movies of this kind are produced and directed. You need lot of patience to watch this movie and this is not your regular masala entertainment.",movie made honestly,when i went this movie nj theater was empty show was only me alone but i am glad that i havent missed this movie this is honest attempt make nice movie all characters were well chosen this movie they played there part its good movie every country that had been target by terrorist attacks this is movie those extremists who are making normal people life big hell must watch movie thanks director showing true things that happens after attacks which majority people dont know wish more movies this kind are produced directed you need lot patience watch this movie this is not your regular masala entertainment,0.6412087912087913,0.33571428571428574,Positive,"{'Happy': 0.18, 'Angry': 0.0, 'Surprise': 0.18, 'Sad': 0.32, 'Fear': 0.32}"
10.0,The best film I've watched recently!!!,"Saw this film today and couldn't resist coming to IMDb and look at this movie's page.I was shocked to see the 6.7 rating and read the 3 reviews which give 7 stars(hopefully that will change).Now,it could be just that not everyone likes this movie as much as I do.But,when I think about it there is not a single thing about this movie that you can criticize.This movie is as underrated as you can find.Acting by every actor in the film is top-notch.But,the acting of protagonist's mother and Kay Kay Menon are something exceptional.Cinematography is also good compared to other Indian movies.If this movie had a more famous actor like Aamir Khan or Akshay Kumar,I am sure I wouldn't have write this review.Story is both cruel and sweet. If you have not seen it till now and you are reading this then STOP AND WATCH IT NOW.You will not regret this.I know you have read previous two lines in reviews of almost every random movie but I really mean it.Even though I have viewed it only once,I can tell you that this movie will be among my favorite films. A must watch for every Muslim brother in India,Pakistan and Bangladesh. In fact,a must watch for anyone who can understand Hindi.",best film ive watched recently,saw this film today couldnt resist coming imdb look at this movies page i was shocked see 6 7 rating read 3 reviews which give 7 stars hopefully that will change now it could be just that not everyone likes this movie as much as i do but when i think about it there is not single thing about this movie that you can criticize this movie is as underrated as you can find acting by every actor film is top notch but acting protagonists mother kay kay menon are something exceptional cinematography is also good compared other indian movies if this movie had more famous actor like aamir khan or akshay kumar i am sure i wouldnt have write this review story is both cruel sweet if you have not seen it till now you are reading this then stop watch it now you will not regret this i know you have read previous two lines reviews almost every random movie but i really mean it even though i have viewed it only once i can tell you that this movie will be among my favorite films must watch every muslim brother india pakistan bangladesh fact must watch anyone who can understand hindi,0.5539210128495843,0.12610544217687072,Positive,"{'Happy': 0.1, 'Angry': 0.0, 'Surprise': 0.62, 'Sad': 0.14, 'Fear': 0.14}"
10.0,Shahid ! Nice movie after a long time,"Watched this movie recently and i was simply too much impressed with its script, acting, and direction all were just too natural, real and perfect, hardly i realized in 150 minutes that i am watching a movie.The story was very sensitive as it was based on real life of Late lawyer Shahid Azmi who known for his high acquittal rate specially of terror accused who are falsely implicated in terror cased being poor and helpless, he was gunned down by unknown men in his office on Feb 2010 as he was defending the accused of 26/11 Fahim khan.The story is portrayed in such a gripping, yet responsible manner that it makes you hold your attention right from the beginning where we first meet Shahid as a young boy scarred by the barbaric violence during the communal riots of Mumbai in 1993. The devastating impact of those events prompts him to join a terrorist training camp in Pakistan Occupied Kashmir. But in a terrific scene that illustrates the actor's ability to convey volumes without the crutch of words, he changes his mind and heads back home.Shahid spent 6 years in Tihar jail along with the other terror accused, and kept hope and continued his studies being in Jail and latter was acquitted by the court after 6 years as there was no evidence found against him.A scene that stings with honesty, Shahid asks a packed courtroom if an accused by the name of Matthew, Donald, Suresh, or More, would be singled out and subjected to the same injustice as his client Zaheer, who has remained in jail for a year-and-a-half although no evidence could be gathered against him.This film has remarkable cast and their perfect performances. Particularly worthy of mention: Prabhleen Sandhu as Shahid's wife Mariam, who brings depth and real feeling. Also, Mohammad Zeeshan Ayyub (last seen playing Dhanush's friend in Raanjhanaa), wonderful as Shahid's trusted sibling Khalid. Expectedly it's Rajkumar Yadav who provides the soul of this fearless film. Relying on minimalist instinctive acting over loud theatrics, he delivers his second winning performance this year after Kai Po Che.Shahid according to me is GEM of a movie produced in recent years. Its hard to find such movies these days , where a good movie is only defined by how much money it has made.My rating 10/10",shahid nice movie after long time,watched this movie recently i was simply too much impressed with its script acting direction all were just too natural real perfect hardly i realized 150 minutes that i am watching movie story was very sensitive as it was based real life late lawyer shahid azmi who known his high acquittal rate specially terror accused who are falsely implicated terror cased being poor helpless he was gunned down by unknown men his office feb 2010 as he was defending accused 26 11 fahim khan story is portrayed such gripping yet responsible manner that it makes you hold your attention right beginning where we first meet shahid as young boy scarred by barbaric violence during communal riots mumbai 1993 devastating impact those events prompts him join terrorist training camp pakistan occupied kashmir but terrific scene that illustrates actors ability convey volumes without crutch words he changes his mind heads back home shahid spent 6 years tihar jail along with other terror accused kept hope continued his studies being jail latter was acquitted by court after 6 years as there was no evidence found against him scene that stings with honesty shahid asks packed courtroom if accused by name matthew donald suresh or more would be singled out subjected same injustice as his client zaheer who has remained jail year half although no evidence could be gathered against him this film has remarkable cast their perfect performances particularly worthy mention prabhleen sandhu as shahids wife mariam who brings depth real feeling also mohammad zeeshan ayyub last seen playing dhanushs friend raanjhanaa wonderful as shahids trusted sibling khalid expectedly its rajkumar yadav who provides soul this fearless film relying minimalist instinctive acting over loud theatrics he delivers his second winning performance this year after kai po che shahid according me is gem movie produced recent years its hard find such movies these days where good movie is only defined by how much money it has made my rating 10 10,0.4847768793051812,0.1204836777478287,Positive,"{'Happy': 0.12, 'Angry': 0.05, 'Surprise': 0.12, 'Sad': 0.25, 'Fear': 0.45}"
6.0,"Untold saga of a brave person, who fought and died for justice","Hats off to Director Mr. Hansal Mehta, who had chosen this story to be told and the senior actors, who had given priority of subject above remuneration and length of roles otherwise this low budget movie could not have accommodated them and without good actors there were chances of movie going misinterpreted. I salute all the actors for their support to this movie. Respect for all them has been increased in my core of heart. Director Mr. Hansal Mehta approach towards subject is very balanced. He never tried to make the subject sensational by unnecessary pressing the hurting nerves. He has shown the things only for the need of story. Writer, Sameer Gautem Singh and co writer Apurva Asrani work is impressive. I believe there are only two religions in this universe are by virtue, one is good and other is bad. These two religions of good and bad community do exist within every religion. Our by birth religions are taught and learned. Prejudice about any religion is not good. Performance wise Rajkumar as Shahid is simply adorable. Very soon, you start believing that he is Shahid only. Prabhleen Sandhu as Mariam is very good. Md Zeeshan Ayub as Arif is very balanced. Tigmanshu Dhulia, K.K.Menon, Vipin Sharma all are fantastic actors and done the full justification to the characters. Baljinder Kaur as Ammi is good enough.",untold saga brave person who fought died justice,hats off director mr hansal mehta who had chosen this story be told senior actors who had given priority subject above remuneration length roles otherwise this low budget movie could not have accommodated them without good actors there were chances movie going misinterpreted i salute all actors their support this movie respect all them has been increased my core heart director mr hansal mehta approach towards subject is very balanced he never tried make subject sensational by unnecessary pressing hurting nerves he has shown things only need story writer sameer gautem singh co writer apurva asrani work is impressive i believe there are only two religions this universe are by virtue one is good other is bad these two religions good bad community do exist within every religion our by birth religions are taught learned prejudice about any religion is not good performance wise rajkumar as shahid is simply adorable very soon you start believing that he is shahid only prabhleen sandhu as mariam is very good md zeeshan ayub as arif is very balanced tigmanshu dhulia k k menon vipin sharma all are fantastic actors done full justification characters baljinder kaur as ammi is good enough,0.6277586206896553,0.2052298850574713,Positive,"{'Happy': 0.24, 'Angry': 0.0, 'Surprise': 0.11, 'Sad': 0.32, 'Fear': 0.34}"
10.0,Hansal Mehta's film on the real-life slain lawyer Shahid Azmi is fearless work,"Shahid is a must-see film with an absolutely impeccable sub text that can be read as an urgent warning against the politics of isolation practiced by many political parties.watched the movie last night and thought this is one of the best movie i have seen in a long time.... a true story of a person fighting for truth.... a must watch for sure..... just amazing to see there are people like this in this world who would dedicate their life for justice and in their quest they will stop at nothing..... my salute to shahid azmi about i did not know before i saw this movie.... salute to hansal mehta for daring to make this movie..... a good quote made by the movie reviewer""Shahid deserves more than just a standing ovation. It deserves accolades for standing up to be counted and narrating the kind of story that is usually buried under mainstream media cacophony. The fact that Shahid has got to a multiplex near you should also be applauded and made the most of. Go and watch the film – it is one of the most important films to come out of Mumbai in a long, long time"" Best tribute to Shahid Azmi by Hansal Mehta, very inspirational true life story.",hansal mehtas film real life slain lawyer shahid azmi is fearless work,shahid is must see film with absolutely impeccable sub text that can be read as urgent warning against politics isolation practiced by many political parties watched movie last night thought this is one best movie i have seen long time true story person fighting truth must watch sure just amazing see there are people like this this world who would dedicate their life justice their quest they will stop at nothing my salute shahid azmi about i did not know before i saw this movie salute hansal mehta daring make this movie good quote made by movie reviewer shahid deserves more than just standing ovation it deserves accolades standing up be counted narrating kind story that is usually buried under mainstream media cacophony fact that shahid has got multiplex near you should also be applauded made most go watch film it is one most important films come out mumbai long long time best tribute shahid azmi by hansal mehta very inspirational true life story,0.5328502415458939,0.3826086956521739,Positive,"{'Happy': 0.11, 'Angry': 0.0, 'Surprise': 0.21, 'Sad': 0.18, 'Fear': 0.5}"
