Rating,Review Title,Review,Cleaned Review Title,Cleaned Review,Subjectivity,Polarity,Sentiment,Emotion Scale
8,recently rewatched and it's a pretty decent story,"I recently rewatched everything Star Wars including this, the Clone Wars cartoons etc. In preparation for seeing The Force Awakens.Well for someone who wasn't a huge fan of this initially I made a few discoveries and in light of the Force Awakens this movie is a cinematic masterpiece.The story is really quite original (except for that main reactor bit). I really quite liked it and the politics is easier to follow after a few viewings. I remember being quite shocked when I found out the 'queen' wasn't always who we thought.The sets and costumes are really beautiful.JarJar isn't really that bad, let's face it he's there to keep kids happy and that's OK isn't it? Obi-Wan is great, I really liked seeing him younger.I did feel quite sorry for Anakin this time around and I think the actor did quite well with the material he had.Yes this movie has it's issues, it can be slow at times and the bit about Midichlorians still makes me cringe but at least it's original and had a story to tell. It does remind me that Star Wars was really Anakin's story told in 6 parts. The newest 7th 'instalment' is reductive and undoes a lot of the history.Star Wars finished with return of the Jedi and most certainly after George Lucas left. the new Disney stuff has no heart.Please come back George.",recently rewatched its pretty decent story,i recently rewatched everything star wars including this clone wars cartoons etc preparation seeing force awakens well someone who wasnt huge fan this initially i made few discoveries light force awakens this movie is cinematic masterpiece story is really quite original except that main reactor bit i really quite liked it politics is easier follow after few viewings i remember being quite shocked when i found out queen wasnt always who we thought sets costumes are really beautiful jarjar isnt really that bad lets face it hes there keep kids happy thats ok isnt it obi wan is great i really liked seeing him younger i did feel quite sorry anakin this time around i think actor did quite well with material he had yes this movie has its issues it can be slow at times bit about midichlorians still makes me cringe but at least its original had story tell it does remind me that star wars was really anakins story told 6 parts newest 7th instalment is reductive undoes lot history star wars finished with return jedi most certainly after george lucas left new disney stuff has no heart please come back george,0.47407544836116267,0.13811379097093385,Positive,"{'Happy': 0.12, 'Angry': 0.02, 'Surprise': 0.29, 'Sad': 0.41, 'Fear': 0.15}"
8,Love this film,"Honestly I don't get it why so many people hate this movie I can understand it is a bit too long but its not the weakest in the series, the weakest one in the series would have to be episode 2 Attack of the Clones, having too much romance in it. But I think this one is a lot more better then episode 2 in many ways. And also I think Jar Jar Binks is a rather underrated character I know he can be annoying at times but he did play a large role in this film which fans are missing the point. The pod race is problay the best scene in this whole film as it was rather enjoyable to watch over and over again on youtube. Soundtrack is amazing and very well done for this movie. I know some people hate this movie just because of one character but come on give this movie another chance it will surprised you in many ways. overall Episode 1 is rather underrated and needs another chance 8/10",love this film,honestly i dont get it why so many people hate this movie i can understand it is bit too long but its not weakest series weakest one series would have be episode 2 attack clones having too much romance it but i think this one is lot more better then episode 2 many ways also i think jar jar binks is rather underrated character i know he can be annoying at times but he did play large role this film which fans are missing point pod race is problay best scene this whole film as it was rather enjoyable watch over over again youtube soundtrack is amazing very well done this movie i know some people hate this movie just because one character but come give this movie another chance it will surprised you many ways overall episode 1 is rather underrated needs another chance 8 10,0.5323129251700681,0.18877551020408165,Positive,"{'Happy': 0.06, 'Angry': 0.0, 'Surprise': 0.26, 'Sad': 0.26, 'Fear': 0.42}"
4,Let's stop playing games - bad is bad,"The main line of defence seems to be: lighten up, it's just entertainment / just a kid's movie / just a special effects flick. Pausing awhile to note that people who run this line of defence have all but conceded that the film is, in fact, bad, let's take these points one by one - shall we?As entertainment it's poor. Dialogue is flat and perfunctory (don't expect to be dazzled by repartee); the story lacks the beauty of the first Star Wars film and the tension of the second ... and then there's the magical `character development' everyone complains about. We must distinguish character development from character delineation. The former is nice, but the latter is absolutely essential, and it's the latter that's missing from `The Phantom Menace'. Jar Jar, the young Obi Wan, Darth Maul, Armidala, Annakin - all are scarcely characters at all, and are very difficult to get enthused about. Jar Jar in particular is a collection of mannerisms, nothing more. This lack of character doesn't just prevent the film from becoming the darling of the intellectuals - it makes it dull. There are hundreds more entertaining films. Only those people who entered the cinema carrying plastic light sabers, grimly determined to enjoy themselves, failed to notice this.It's a kid's movie. Well, yes, in a sense - but not a good sense. Good children's movies form a proper subset of good movies - simply because adults have access to all childhood emotions and desires, but not vice versa. So in one sense a `kid's movie' is just a movie that can be understood and apperaciated by children (as well as adults). Is this a kid's movie in that sense? Maybe. But it's also a kid's movie in the bad sense: it's deeply witless, and inexperienced children might - I say, MIGHT - fail to notice just how witless it is. Children may - I say, MAY - ignore the fact that Jar Jar Binks is a deeply irritating non-character because he is all colour and movement and he speaks funny. Is this really all we want?Special effects. These aren't so hot, either. George Lucas has fallen in love with computers and failed to notice that his digital animals don't move at all in the way that real animals move - worse still, they don't move like any kind of physical object at all. Nor do most of the alleged physical objects. Compare the trundling white juggernaut at the start of `Star Wars' - a convincingly solid model - with the insubstantial collection of pixels that darts past us at the start of `The Phantom Menace'. The special effects have actually deteriorated, and to make matters worse, there are more of them.So the defence that `The Phantom Menace' is allowed to be a poor movie because it really wasn't trying to be something great in the first place, just won't wash. Especially so, given the ludicrous claims George Lucas has arrogantly made, again and again. So Jar Jar Binks is the first digitally created main character? Rubbish - the dragon in `Dragonheart' predates it (and, one might add, is at the very least a genuine character). So George Lucas is pioneering a new kind of filming-making, more like painting and less like photography, than the old? Absolute twaddle - Walt Disney did THAT in the 1930s. I'll tell you what IS new. Never before has there been so much sizzle, and so little sausage.",lets stop playing games bad is bad,main line defence seems be lighten up its just entertainment just kids movie just special effects flick pausing awhile note that people who run this line defence have all but conceded that film is fact bad lets take these points one by one shall we as entertainment its poor dialogue is flat perfunctory dont expect be dazzled by repartee story lacks beauty first star wars film tension second then theres magical character development everyone complains about we must distinguish character development character delineation former is nice but latter is absolutely essential its latter thats missing phantom menace jar jar young obi wan darth maul armidala annakin all are scarcely characters at all are very difficult get enthused about jar jar particular is collection mannerisms nothing more this lack character doesnt just prevent film becoming darling intellectuals it makes it dull there are hundreds more entertaining films only those people who entered cinema carrying plastic light sabers grimly determined enjoy themselves failed notice this its kids movie well yes sense but not good sense good childrens movies form proper subset good movies simply because adults have access all childhood emotions desires but not vice versa so one sense kids movie is just movie that can be understood apperaciated by children as well as adults is this kids movie that sense maybe but its also kids movie bad sense its deeply witless inexperienced children might i say might fail notice just how witless it is children may i say may ignore fact that jar jar binks is deeply irritating non character because he is all colour movement he speaks funny is this really all we want special effects these arent so hot either george lucas has fallen love with computers failed notice that his digital animals dont move at all way that real animals move worse still they dont move like any kind physical object at all nor do most alleged physical objects compare trundling white juggernaut at start star wars convincingly solid model with insubstantial collection pixels that darts past us at start phantom menace special effects have actually deteriorated make matters worse there are more them so defence that phantom menace is allowed be poor movie because it really wasnt trying be something great first place just wont wash especially so given ludicrous claims george lucas has arrogantly made again again so jar jar binks is first digitally created main character rubbish dragon dragonheart predates it one might add is at very least genuine character so george lucas is pioneering new kind filming making more like painting less like photography than old absolute twaddle walt disney did that 1930s ill tell you what is new never before has there been so much sizzle so little sausage,0.46721687777243354,0.03991756186200632,Positive,"{'Happy': 0.15, 'Angry': 0.06, 'Surprise': 0.17, 'Sad': 0.29, 'Fear': 0.33}"
10,Leave Your Preconceptions Behind,"I know it's fashionable to scorn the ""prequel"" trilogy, but if one stands back a bit, things tend to snap into perspective. Compare ""Phantom Menace"" to most any other fantasy/sci-fi film, and it has to rate very high indeed.Plot: this is the more ""adult"" side of the Star Wars galaxy. The politics are remarkably credible, with the entire plot hinging on the result of a vote of no-confidence! How many adults even know what that is? (Hmm... maybe this explains the low ratings.) The relationships between the races on Naboo, the role of the Jedi... these things are established more clearly, and depicted more credibly than in any of the other five films.Technical achievement: Lucas paints on a vast digital canvas, and creates a world of wonders that have simply never been imagined by lesser talents. This is a living, breathing, believable world, that makes the world of the original trilogy seem cartoonish and contrived by comparison. Naboo, from the city, to the underwater kingdom, to the rolling green hills, is one of the great fantasy worlds, up there with those of the Thief of Baghdad (both versions), Blade Runner, or 2001. And our first glimpse of Coruscant has got to be one of the most memorable ""wow"" moments in the history of the movies.Characters: Liam Neeson's Qui Gon is one of the strongest characters in the Star Wars films, and Ewan McGregor's Obi Wan a worthy, more-dashing successor to the older version created by Alec Guinness. And Jar Jar Binks? Annoying? Not compared to the insipid C-3PO, or the insufferably perky R2-D2. Jar Jar is a fully formed character, with surprising depths. His manner is odd, perhaps abrasive, but he offers far more than the single note that Lucas used for his original comic-relief characters. And, of course, the fact that he is one of the first fully digital characters in film history has to be worth something. But Ian McDiarmid's Senator Palpatine is perhaps the most under-appreciated of all. This is an Oscar-worthy supporting performance, a character who is both frighteningly real and perfectly ambiguous. McDiarmid balances his performance on a knife's edge, managing to be both fatherly and deeply unsettling.Yes, it may be that a certain human dimension is weaker here than in the original Star Wars. We don't have a clear ""hero"". There's no Luke, no Han. That's a valid point, but it is not inevitably a criticism. Qui Gon and Obi Wan aren't the comic-book heroes of A New Hope, but they are likable, heroic, and rich in characterization. If I had a choice between seeing 10 more episodes of the life of Han Solo or of Qui Gon Jinn, I'd choose the latter without hesitation.Story: The storyline in this film seems more real, more substantial than in the other five. We have the perfect sense of scale, from human drama to global (or interstellar) conflict. The one quibble might be the pod race. It's certainly entertaining, but does it go on too long? I think perhaps so. This is a structural weakness, but not a huge one. (Does Luke spend WAY too long on Dagobah, listening to warmed over Zen platitudes from that rubbery little jerk Yoda? Yes! Yet this is in the film most viewers seem to, unaccountably, pick as the ""best"" of the six. Clearly, there's some latitude for narrative digressions...)And then there's the climactic sword fight. I'd rate the three-way duel in Phantom Menace as the second-best sword fight in the Star Wars series, close after the finale of Return of the Jedi. The latter has a wonderful mythic quality, but this one is more visceral, more scary... partly because Darth Maul is such a cold, merciless villain, and partly because you know from the outset that the outcome is genuinely in doubt, that one of the Good Guys really could die. And the staging, using three master swordsmen, each with very different technique... This is just about as good as action film gets. Only two or three other movie duels come close: Rob Roy, again with Neeson, oddly enough; Scaramouche; Robin Hood... I can't think of a fourth. The closing duel ALONE should raise Phantom Menace into the front ranks of action and fantasy films.Bottom line: there is so much to enjoy in this film, so much to see, so much to feel, that it is amazing how anyone can possibly rate it below a 7 or 8. This is a scale of film making that few have ever attempted, let alone pulled off so beautifully. Perhaps that's the film's biggest fault: Lucas makes it all seem too easy.But, of course, we all know the REAL reason people can't give this film the 10 it richly deserves. That reason lies within themselves. Viewers in 1999 (let alone 2007) just couldn't feel as young, as innocent, as optimistic as they did when they saw the very first Star Wars. (Especially if they saw it way back in 1977, 30 years ago). Star Wars hasn't changed, George Lucas hasn't changed, nearly so much as the audience has changed. Alas. Moviegoers who are truly so jaded that they can't feel the passion and revel in the breadth of vision of The Phantom Menace have my sincerest sympathy. Yes, you can be ever so-o cool by putting down the prequel trilogy, but missing one of the best movies of all time is a very high price to pay.",leave your preconceptions behind,i know its fashionable scorn prequel trilogy but if one stands back bit things tend snap into perspective compare phantom menace most any other fantasy sci fi film it has rate very high indeed plot this is more adult side star wars galaxy politics are remarkably credible with entire plot hinging result vote no confidence how many adults even know what that is hmm maybe this explains low ratings relationships between races naboo role jedi these things are established more clearly depicted more credibly than any other five films technical achievement lucas paints vast digital canvas creates world wonders that have simply never been imagined by lesser talents this is living breathing believable world that makes world original trilogy seem cartoonish contrived by comparison naboo city underwater kingdom rolling green hills is one great fantasy worlds up there with those thief baghdad both versions blade runner or 2001 our first glimpse coruscant has got be one most memorable wow moments history movies characters liam neesons qui gon is one strongest characters star wars films ewan mcgregors obi wan worthy more dashing successor older version created by alec guinness jar jar binks annoying not compared insipid c 3po or insufferably perky r2 d2 jar jar is fully formed character with surprising depths his manner is odd perhaps abrasive but he offers far more than single note that lucas used his original comic relief characters course fact that he is one first fully digital characters film history has be worth something but ian mcdiarmids senator palpatine is perhaps most under appreciated all this is oscar worthy supporting performance character who is both frighteningly real perfectly ambiguous mcdiarmid balances his performance knifes edge managing be both fatherly deeply unsettling yes it may be that certain human dimension is weaker here than original star wars we dont have clear hero theres no luke no han thats valid point but it is not inevitably criticism qui gon obi wan arent comic book heroes new hope but they are likable heroic rich characterization if i had choice between seeing 10 more episodes life han solo or qui gon jinn id choose latter without hesitation story storyline this film seems more real more substantial than other five we have perfect sense scale human drama global or interstellar conflict one quibble might be pod race its certainly entertaining but does it go too long i think perhaps so this is structural weakness but not huge one does luke spend way too long dagobah listening warmed over zen platitudes that rubbery little jerk yoda yes yet this is film most viewers seem unaccountably pick as best six clearly theres some latitude narrative digressions then theres climactic sword fight id rate three way duel phantom menace as second best sword fight star wars series close after finale return jedi latter has wonderful mythic quality but this one is more visceral more scary partly because darth maul is such cold merciless villain partly because you know outset that outcome is genuinely doubt that one good guys really could die staging using three master swordsmen each with very different technique this is just about as good as action film gets only two or three other movie duels come close rob roy again with neeson oddly enough scaramouche robin hood i cant think fourth closing duel alone should raise phantom menace into front ranks action fantasy films bottom line there is so much enjoy this film so much see so much feel that it is amazing how anyone can possibly rate it below 7 or 8 this is scale film making that few have ever attempted let alone pulled off so beautifully perhaps thats films biggest fault lucas makes it all seem too easy but course we all know real reason people cant give this film 10 it richly deserves that reason lies within themselves viewers 1999 let alone 2007 just couldnt feel as young as innocent as optimistic as they did when they saw very first star wars especially if they saw it way back 1977 30 years ago star wars hasnt changed george lucas hasnt changed nearly so much as audience has changed alas moviegoers who are truly so jaded that they cant feel passion revel breadth vision phantom menace have my sincerest sympathy yes you can be ever so o cool by putting down prequel trilogy but missing one best movies all time is very high price pay,0.5017232370159199,0.19717207498914815,Positive,"{'Happy': 0.1, 'Angry': 0.02, 'Surprise': 0.2, 'Sad': 0.29, 'Fear': 0.39}"
6,Star Wars: Episode I - The Phantom Menace (Short Movie Review),Positives: Planets designSome of the action scenesDarth MaulMusical scoreNegatives: StoryPacingCharactersActingWritingDull cinematography,star wars episode i phantom menace short movie review,positives planets designsome action scenesdarth maulmusical scorenegatives storypacingcharactersactingwritingdull cinematography,0.2,0.05,Positive,"{'Happy': 0.0, 'Angry': 0.25, 'Surprise': 0.0, 'Sad': 0.25, 'Fear': 0.5}"
