Rating,Review Title,Review,Cleaned Review Title,Cleaned Review,Subjectivity,Polarity,Sentiment,Emotion Scale
5,A perspective after all the hype has died down,"Lucas may have problems as a director and writer, but I've always thought that those flaws are balanced by his great storytelling ability. The problem with ""The Phantom Menace"" is that he simply has no story to tell. The film merely adds an introductory chapter to a story that has already been told, and stretches it out into a two-hour movie. It is no accident that prequels of this kind are rare. They are very difficult to make properly. And apparently he's just not a sophisticated enough filmmaker to pull it off.For one thing, this project is limited by the fact that anyone familiar with the first trilogy knows the story's outcome, and it therefore lacks some of the suspense associated with a gradually unfolding saga. More importantly, however, this situation leaves Lucas with very little freedom as a storyteller. It also encourages him to gloss over key events; because their outcome is a foregone conclusion, he forgets to bring them to life.For example, we know there will eventually be a romance between Anakin and Padme. So Lucas has the two characters meet here and--surprise, surprise--they seem to like each other. Their developing friendship isn't portrayed that clearly, and their motivations for becoming close aren't explained. Because Lucas fails to make scenes like these believable, we can't help being conscious of how he's manipulating the plot in his effort to connect the two trilogies. Another good example of this problem is Anakin's portrayal as a potential Jedi. There doesn't appear to be anything about this kid remotely out of the ordinary, even though the other characters keep talking like there is. Our only reason for thinking he's special is that the plot requires it.If the story fails to be engaging, it is because we never see the important events. Lucas makes a fatal error in not showing what's happening on Naboo, the small planet whose capture is the focus of the plot. Numerous atrocities are supposedly being committed against the planet's inhabitants, but we only know about this because the characters on screen refer to the events, usually rather woodenly.The deadpan performances are a problem in themselves, but they only highlight our lack of involvement in the story. Think of Han Solo sweating in fear, then think of the emotional vacuums passing for characters in this film. Whenever any of the characters do express emotion, as in the scene where Anakin and his mom part, it still seems awfully restrained. Somehow, Lucas manages to keep the emotional reactions of his characters to a minimum, which gives the film an almost mechanical feel.It's true that ""A New Hope"" never showed Alderaan's inhabitants, but we still could feel the tragedy of the planet's destruction through the horrified reactions of Princess Leia and Obi Wan. Moreover, there were many other involving events which we witnessed directly, such as the slaying of rebels at the beginning; the capture and torture of the princess; and the murder of Luke's foster parents. Furthermore, the major plot elements were intriguing in and of themselves. They weren't there merely to show us how they were to be linked to later events, which seems to be the case with the new film.I suspect that Lucas was not as concerned in the first trilogy with what had to happen later in the story and was therefore able to focus his attention on the events at hand. The weakest segment was ""Return of the Jedi,"" which had the task of bringing the story to an end. Only then did Lucas start to show signs of forcing plot points. In ""The Phantom Menace,"" he gets so bogged down in the task of bringing his story from point A to point B that he ends up with only the bare bones of a plot, and none of it comes alive.This is especially true of the characterization. In the old trilogy, characters like Yoda and Han reveal distinct personalities in their first few minutes on screen. This film goes for more than two hours and the characters, including the familiar ones, come off vague and nondescript. We aren't given much of a chance to experience their personalities in the way they interact. We must take Qui Gon's word for it when he describes Obi Wan as ""headstrong."" What's most odd is that the cartoons seem better developed than the humans. The scenes where Qui Gon negotiates with the birdlike slave-owner Watto are amusing and well-done--probably the movie's best scenes aside from the stunning action sequences--but they can't hold a candle to the constant interactions throughout the first trilogy.One thing I cannot do is accuse the film of lacking creativity. The design of the creatures, the technologies, and the planets is impressive. Watching the film is sort of like reading a children's book that isn't very good but abounds with beautiful illustrations. There is certainly a ""wow"" factor in the movie's visuals, but the effect of it is short-lived.I get irked when I hear fans talk as though the ""Star Wars"" movies were never about anything beyond special effects. While the inventive visuals are part of what made the originals so revolutionary, they're not what made the films so fun to watch. And in no way can they explain the trilogy's continuing popularity today. After all, many of the original effects look primitive by today's standards, and their novelty has certainly worn off. Only an enduring and compelling storyline could have allowed the first three films to become the classics they're almost universally acknowledged to be.",perspective after all hype has died down,lucas may have problems as director writer but ive always thought that those flaws are balanced by his great storytelling ability problem with phantom menace is that he simply has no story tell film merely adds introductory chapter story that has already been told stretches it out into two hour movie it is no accident that prequels this kind are rare they are very difficult make properly apparently hes just not sophisticated enough filmmaker pull it off one thing this project is limited by fact that anyone familiar with first trilogy knows storys outcome it therefore lacks some suspense associated with gradually unfolding saga more importantly however this situation leaves lucas with very little freedom as storyteller it also encourages him gloss over key events because their outcome is foregone conclusion he forgets bring them life example we know there will eventually be romance between anakin padme so lucas has two characters meet here surprise surprise they seem like each other their developing friendship isnt portrayed that clearly their motivations becoming close arent explained because lucas fails make scenes like these believable we cant help being conscious how hes manipulating plot his effort connect two trilogies another good example this problem is anakins portrayal as potential jedi there doesnt appear be anything about this kid remotely out ordinary even though other characters keep talking like there is our only reason thinking hes special is that plot requires it if story fails be engaging it is because we never see important events lucas makes fatal error not showing whats happening naboo small planet whose capture is focus plot numerous atrocities are supposedly being committed against planets inhabitants but we only know about this because characters screen refer events usually rather woodenly deadpan performances are problem themselves but they only highlight our lack involvement story think han solo sweating fear then think emotional vacuums passing characters this film whenever any characters do express emotion as scene where anakin his mom part it still seems awfully restrained somehow lucas manages keep emotional reactions his characters minimum which gives film almost mechanical feel its true that new hope never showed alderaans inhabitants but we still could feel tragedy planets destruction through horrified reactions princess leia obi wan moreover there were many other involving events which we witnessed directly such as slaying rebels at beginning capture torture princess murder lukes foster parents furthermore major plot elements were intriguing themselves they werent there merely show us how they were be linked later events which seems be case with new film i suspect that lucas was not as concerned first trilogy with what had happen later story was therefore able focus his attention events at hand weakest segment was return jedi which had task bringing story end only then did lucas start show signs forcing plot points phantom menace he gets so bogged down task bringing his story point point b that he ends up with only bare bones plot none it comes alive this is especially true characterization old trilogy characters like yoda han reveal distinct personalities their first few minutes screen this film goes more than two hours characters including familiar ones come off vague nondescript we arent given much chance experience their personalities way they interact we must take qui gons word it when he describes obi wan as headstrong whats most odd is that cartoons seem better developed than humans scenes where qui gon negotiates with birdlike slave owner watto are amusing well done probably movies best scenes aside stunning action sequences but they cant hold candle constant interactions throughout first trilogy one thing i cannot do is accuse film lacking creativity design creatures technologies planets is impressive watching film is sort like reading childrens book that isnt very good but abounds with beautiful illustrations there is certainly wow factor movies visuals but effect it is short lived i get irked when i hear fans talk as though star wars movies were never about anything beyond special effects while inventive visuals are part what made originals so revolutionary theyre not what made films so fun watch no way can they explain trilogys continuing popularity today after all many original effects look primitive by todays standards their novelty has certainly worn off only enduring compelling storyline could have allowed first three films become classics theyre almost universally acknowledged be,0.5408710075720384,0.12918394177414796,Positive,"{'Happy': 0.09, 'Angry': 0.04, 'Surprise': 0.28, 'Sad': 0.23, 'Fear': 0.36}"
7,"Visually a marvel to look at, disappointing in terms of story","Star Wars: Episode 1- The Phantom Menace is definitely worth a watch, but I do think it is one of the weaker movies of the Star Wars saga. I will admit I wasn't expecting much after reading some very negative reviews on IMDb, but I do think this particular instalment did in some ways exceed my expectations and disappointed as well. On a visual and technical level, it looks absolutely fantastic, with splendid special effects, stunning cinematography and fine scenery and costumes. The script is fairly decent, perhaps lacking the sophistication of Empire Strikes Back or New Hope, but does have some memorable lines. The action is constantly exhilarating, and Darth Maul, well played by Ray Park is a very good villain. Of course though, Darth Vader is better. Most of the performances are very good, especially Natalie Portman as Queen Padma who looked stunning and Jake Lloyd as Anakin Skywalker who shone with his confident charm. And Jar Jar Binks is okay on the most part, and you have to love Yoda. And the music score by John Williams was outstanding, definitely one of his best works. The quality of sound and direction are also impressive. However, there were things about this film that did disappoint. One is despite the awesome visuals, strong music score and good characters, the story never quite distinguished itself. It did take a while to get going, and when it did try to get going and you could tell it wanted to, it was further disadvantaged by the uneven pacing. Liam Neeson is a fine actor, his performances in Kinsey and Schindler's List are proof of that, and I do like Ewan McGregor. But as Qui-Gon Jin and Obi Wan Kenobi, both stars give unusually wooden performances, and at times looked even embarrassed. And as I said, the pacing is very uneven, there are some slow moments, and one or two scenes felt rushed. All in all, maybe disappointing for fans of the saga, but it cannot be denied that visually it is an accomplishment. 7/10 Bethany Cox",visually marvel look at disappointing terms story,star wars episode 1 phantom menace is definitely worth watch but i do think it is one weaker movies star wars saga i will admit i wasnt expecting much after reading some very negative reviews imdb but i do think this particular instalment did some ways exceed my expectations disappointed as well visual technical level it looks absolutely fantastic with splendid special effects stunning cinematography fine scenery costumes script is fairly decent perhaps lacking sophistication empire strikes back or new hope but does have some memorable lines action is constantly exhilarating darth maul well played by ray park is very good villain course though darth vader is better most performances are very good especially natalie portman as queen padma who looked stunning jake lloyd as anakin skywalker who shone with his confident charm jar jar binks is okay most part you have love yoda music score by john williams was outstanding definitely one his best works quality sound direction are also impressive however there were things about this film that did disappoint one is despite awesome visuals strong music score good characters story never quite distinguished itself it did take while get going when it did try get going you could tell it wanted it was further disadvantaged by uneven pacing liam neeson is fine actor his performances kinsey schindlers list are proof that i do like ewan mcgregor but as qui gon jin obi wan kenobi both stars give unusually wooden performances at times looked even embarrassed as i said pacing is very uneven there are some slow moments one or two scenes felt rushed all all maybe disappointing fans saga but it cannot be denied that visually it is accomplishment 7 10 bethany cox,0.5299498019710785,0.2605710601455283,Positive,"{'Happy': 0.22, 'Angry': 0.04, 'Surprise': 0.26, 'Sad': 0.16, 'Fear': 0.31}"
9,"The Beginning of the Star Wars Saga Introduces a Vivid New Universe and Celebrates the Innocent Fun of Star Wars, Despite Its Flaws","While it received generally positive reviews upon its release, and captured the imaginations of an entire generation of younglings, The Phantom Menace has garnered an almost toxic reputation on the internet in the years since. Sure, it's not a perfectly structured film, and yes, there are more than a few dopey decisions, but the sheer spectacle and sense of fun in Star Wars: Episode I cannot be denied. George Lucas' return to a galaxy far, far away is a triumph of creative vision. A movie that overcomes any and all of its narrative deficiencies through the pure drive of its creator to wow, thrill, and inspire.The Phantom Menace is chapter one of the Star Wars Saga, and it feels very much like the beginning of a larger story. It introduces all of the important players in the saga, including Obi-Wan Kenobi, The Jedi Council, and Anakin Skywalker, the tragic hero who we know will one day become the legendary Darth Vader. On a micro level, the plot revolves around an intergalactic trade war that leads to tensions between the Trade Federation and the inhabitants of the peaceful, Garden of Eden-like planet called Naboo. Jedis Obi-Wan Kenobi (Ewan McGregor), and Qui-Gon Jinn (Liam Neeson), are sent as peacekeepers to protect the planet's leader, Queen Amidala (Natalie Portman) from the evil Trade Federation and the ancient Sith Lord, Darth Maul, one of the most frightening and iconic characters ever to come out of the Star Wars universe. The Trade Federation plot does not have the same level of buoyant escapism as the originals', but it's not far off. The politics are kept at a minimum, and they only serve to create bad guys for our heroes to fight. The more important element of Episode I's story is the extended introduction of young Anakin Skywalker to this new Star Wars universe. The most interesting beats of the story center around Anakin and his mother, and The Jedi council's trepidation regarding the boy Qui-Gon suspects is the Chosen One. You get the sense that there is something special, yet sinister about the young podracing phenom from Tatooine. It's a great aspect of the film that largely goes unrecognized.None of the pieces of the plot really mean much for the prequel trilogy's overarching story of the downfall of Anakin Skywalker, but The actual conflict of Episode I is largely unimportant. At it's core, The Phantom Menace serves as a feature length introduction to George Lucas' new (old) Star Wars Universe. Episode I is the prologue to the Saga, telling a simple story that puts the pieces in place for later films while still standing on its own. On that level, it's kind of brilliant. Lucas takes a universe that was, as sweeping as it felt, still confined to a small collection of characters, and tears the lid off. The Phantom Menace does more to create a fictional history and detailed lore for the Star Wars universe than any other film. All of a sudden, this universe was no longer just a backdrop for the characters to play around in. It became a real place, with real politics, history, tradition, and age-old myths of its own. Remarkable if you ask me.Next to their storytelling, Star Wars movies have always been known for their special effects. With 16 years between movies, George Lucas' ILM team had the chance to perfect all of their award-winning visual effects, and perfect they did. Incorporating a litany of techniques from miniatures and animatronics to innovative use of CGI, The Phantom Menace is a breathtaking film to look at. Every single shot of The Phantom Menace is a work of art, and the sheer amount of imagination put into the world is worthy of praise. From the environments to the vehicles, the costumes, and the creatures, everything in this universe is unique, and ILM and company craft them with an unrivaled eye for detail. So strong is Lucas' vision of this world, that the plotting and dialogue are almost unnecessary. The visual storytelling of The Phantom Menace is that uncommonly strong.That expert craftsmanship extends to the action sequences. George Lucas' strengths as an editor and technician translate to more than a few show-stopping set-pieces. My favorite of which is young Anakin's bid for freedom, a kinetic and thrilling race across the vast deserts of Tatooine. The Podrace is a visually stunning and genuinely tense showcase of absolute speed. It still remains one of the most fun sequences in recent movie history. The same goes for the climactic three-way lightsaber duel at the end of the film. With brilliant visual effects, fast-paced and furious choreography, and a euphoric sense of scope, it brought something brand new to the Star Wars Universe, large-scale lightsaber duels. The battles, both in space and on land, stand out as old-fashioned, innocent fun. Despite a few silly moments, they tap into that Saturday matinee spectacle that resonates with the kid in us all.I love The Phantom Menace, despite its quirks. The script is clunky, especially in the first act where the plot seems to spin its wheels. There are slow moments and plenty of silly gags that fall flat. But my God, this movie is fun to watch! The visual splendor, the larger-than-life action set-pieces, the grand fun of the whole thing, The Phantom Menace is irresistible entertainment. An event movie with this kind of innocent charm is something unique in Hollywood, and that child-like earnestness is what makes this movie particularly endearing for me. The Phantom Menace might be different from the original trilogy in certain aesthetics, but importantly, not in feel. For the majority of this movie's runtime, it exudes the same brand of vibrant movie magic that made A New Hope a beloved classic. I won't call TPM a classic. I have my hangups with it, but I personally cannot bring myself to dislike this movie. Star Wars: Episode I works as an introduction to a brand new world, and as a stand-alone adventure that celebrates the innocent fun of the Original Star Wars.86/100",beginning star wars saga introduces vivid new universe celebrates innocent fun star wars despite its flaws,while it received generally positive reviews upon its release captured imaginations entire generation younglings phantom menace has garnered almost toxic reputation internet years since sure its not perfectly structured film yes there are more than few dopey decisions but sheer spectacle sense fun star wars episode i cannot be denied george lucas return galaxy far far away is triumph creative vision movie that overcomes any all its narrative deficiencies through pure drive its creator wow thrill inspire phantom menace is chapter one star wars saga it feels very much like beginning larger story it introduces all important players saga including obi wan kenobi jedi council anakin skywalker tragic hero who we know will one day become legendary darth vader micro level plot revolves around intergalactic trade war that leads tensions between trade federation inhabitants peaceful garden eden like planet called naboo jedis obi wan kenobi ewan mcgregor qui gon jinn liam neeson are sent as peacekeepers protect planets leader queen amidala natalie portman evil trade federation ancient sith lord darth maul one most frightening iconic characters ever come out star wars universe trade federation plot does not have same level buoyant escapism as originals but its not far off politics are kept at minimum they only serve create bad guys our heroes fight more important element episode is story is extended introduction young anakin skywalker this new star wars universe most interesting beats story center around anakin his mother jedi councils trepidation regarding boy qui gon suspects is chosen one you get sense that there is something special yet sinister about young podracing phenom tatooine its great aspect film that largely goes unrecognized none pieces plot really mean much prequel trilogys overarching story downfall anakin skywalker but actual conflict episode i is largely unimportant at its core phantom menace serves as feature length introduction george lucas new old star wars universe episode i is prologue saga telling simple story that puts pieces place later films while still standing its own that level its kind brilliant lucas takes universe that was as sweeping as it felt still confined small collection characters tears lid off phantom menace does more create fictional history detailed lore star wars universe than any other film all sudden this universe was no longer just backdrop characters play around it became real place with real politics history tradition age old myths its own remarkable if you ask me next their storytelling star wars movies have always been known their special effects with 16 years between movies george lucas ilm team had chance perfect all their award winning visual effects perfect they did incorporating litany techniques miniatures animatronics innovative use cgi phantom menace is breathtaking film look at every single shot phantom menace is work art sheer amount imagination put into world is worthy praise environments vehicles costumes creatures everything this universe is unique ilm company craft them with unrivaled eye detail so strong is lucas vision this world that plotting dialogue are almost unnecessary visual storytelling phantom menace is that uncommonly strong that expert craftsmanship extends action sequences george lucas strengths as editor technician translate more than few show stopping set pieces my favorite which is young anakins bid freedom kinetic thrilling race across vast deserts tatooine podrace is visually stunning genuinely tense showcase absolute speed it still remains one most fun sequences recent movie history same goes climactic three way lightsaber duel at end film with brilliant visual effects fast paced furious choreography euphoric sense scope it brought something brand new star wars universe large scale lightsaber duels battles both space land stand out as old fashioned innocent fun despite few silly moments they tap into that saturday matinee spectacle that resonates with kid us all i love phantom menace despite its quirks script is clunky especially first act where plot seems spin its wheels there are slow moments plenty silly gags that fall flat but my god this movie is fun watch visual splendor larger than life action set pieces grand fun whole thing phantom menace is irresistible entertainment event movie with this kind innocent charm is something unique hollywood that child like earnestness is what makes this movie particularly endearing me phantom menace might be different original trilogy certain aesthetics but importantly not feel majority this movies runtime it exudes same brand vibrant movie magic that made new hope beloved classic i wont call tpm classic i have my hangups with it but i personally cannot bring myself dislike this movie star wars episode i works as introduction brand new world as stand alone adventure that celebrates innocent fun original star wars 86 100,0.5656017264110791,0.18873828210159155,Positive,"{'Happy': 0.19, 'Angry': 0.05, 'Surprise': 0.15, 'Sad': 0.24, 'Fear': 0.37}"
