Rating,Review Title,Review,Cleaned Review Title,Cleaned Review,Subjectivity,Polarity,Sentiment,Emotion Scale
10,A long time ago in a galaxy far far away.,STAR WARS EPISODE ONE: THE PHANTOM MENACE. cue the John Williams theme music. George Lucas gives us a fantastic look at how the story begins.We meet Jedi Knights Qui-Gon Jinn and his padawan Obi-Wan Kenobi We see the beginning of the Empire in the way events are manipulated the story unfolds in it's own time nothing is rushed. every thing means something and it blends together beautifully. Liam Neeson is simply the whole movie Darth Maul's evil look might've been a publicist's dream but Qui gon jinn is the heart of the movie and Ewen Macgregor simply wonderful as Kenobi. The movie never earned all the basing it got it's about as wonderful a time as you will ever have reliving your childhood or watching a grand adventure movie. The Phantom menace is one of the best in this genre .,long time ago galaxy far far away,star wars episode one phantom menace cue john williams theme music george lucas gives us fantastic look at how story begins we meet jedi knights qui gon jinn his padawan obi wan kenobi we see beginning empire way events are manipulated story unfolds its own time nothing is rushed every thing means something it blends together beautifully liam neeson is simply whole movie darth mauls evil look mightve been publicists dream but qui gon jinn is heart movie ewen macgregor simply wonderful as kenobi movie never earned all basing it got its about as wonderful time as you will ever have reliving your childhood or watching grand adventure movie phantom menace is one best this genre,0.7807692307692308,0.34615384615384615,Positive,"{'Happy': 0.09, 'Angry': 0.05, 'Surprise': 0.32, 'Sad': 0.18, 'Fear': 0.36}"
8,An Immensely Enjoyable Film,"When I went to see The Phantom Menace, I was almost uncontrollably excited. I loved the original Star Wars trilogy, and was hugely anticipating the new trilogy. To my immense delight, I thought that The Phantom Menace was a brilliant film.In some respects, I can see why people dislike The Phantom Menace. Yes, there are some wooden performances (eyes on you, Natalie Portman). Yes, the dialogue is clunky. But I don't really think that Oscar-worthy performances and exceptional writing are what the Star Wars saga is about. In my opinion, it is more about grand and epic storytelling, which this film accomplishes extremely well.The visuals are the film's best asset. George Lucas creates brand new worlds for us to gasp in awe at, with such detail and creativity put into creating the environments that it is hard to believe that you can't reach out and feel them. The crew deserve tremendous applause for such an incredibly creative accomplishment. Each world has its own individual character. Whereas Coruscant is a sprawling, busy capital, Tatooine is unfriendly and barren. The visual effects are terrific, and you find yourself indulging on almost every detail.However, it wouldn't be a great Star Wars movie without action, and Phantom Menace delivers two scorching set pieces. The first is a frenetically furious pod race, in which the racers shoot through dangerous terrain, all the time trying to avoid dirty tricks from their competitors and unfriendly fire from unhappy campers. The race is brilliantly gripping, keeping you on the edge of your seat from the heart-stopping beginning to the cheer-worthy ending. As with almost every scene in the movie, the race is also jam-packed with clever details, drawing you in closer to the action.The second is a pulse-raising three-way lightsaber fight between Qui-Gon Jinn (the excellent Liam Neeson), Obi-Wan Kenobi (Ewan McGregor) and Darth Maul (athlete Ray Park). This lightsaber duel conquers all of the previous duels in the series, and is absolutely terrific. It is fantastically exciting to finally see such a fast-paced, brutal and energetic lightsaber fight, where the combatants seem perfectly fluent and are fighting with every ounce of their strength. This sequence is a classic sword fight, which will always be in my mind when anyone mentions Star Wars.In addition to the fantastic action, there is another phenomenal score from John Williams. He provides several breath-taking new tunes (the highlight is Duel of The Fates, which is played during the lightsaber fight), yet also offers foreshadowing of future events in the saga by using tunes from the original films. Despite the fact that the performers are hindered by undoubtedly clunky dialogue, quite a few of them manage to turn in decent performances. Neeson gives a noble and powerful performance as Qui-Gon Jinn, fully emphasising the perfect image of a Jedi master. Ewan McGregor provides a few moments of brilliant emotional clarity, whilst Jake Lloyd gives a passable portrayal of future Darth Vader, Anakin Skywalker. But the best performance comes from Pernilla August, who gives a performance of great grace and vulnerability as Anakin's mother.George Lucas handles all of the proceedings with consummate skill. He has made some mistakes in the screenplay, but he has ensured to the best of his ability that he is able to grant us a compelling and engaging vision of the Star Wars galaxy. He has had some low points in his career, but on a creative scale, this certainly isn't one of them. He directs the film passionately and without remorse, which earns him my deepest respect.This is a brilliant fantasy movie. It may not be as dark as the fans were hoping for, but it is still successful in terms of its creativity, its visual effects and its action.",immensely enjoyable film,when i went see phantom menace i was almost uncontrollably excited i loved original star wars trilogy was hugely anticipating new trilogy my immense delight i thought that phantom menace was brilliant film some respects i can see why people dislike phantom menace yes there are some wooden performances eyes you natalie portman yes dialogue is clunky but i dont really think that oscar worthy performances exceptional writing are what star wars saga is about my opinion it is more about grand epic storytelling which this film accomplishes extremely well visuals are films best asset george lucas creates brand new worlds us gasp awe at with such detail creativity put into creating environments that it is hard believe that you cant reach out feel them crew deserve tremendous applause such incredibly creative accomplishment each world has its own individual character whereas coruscant is sprawling busy capital tatooine is unfriendly barren visual effects are terrific you find yourself indulging almost every detail however it wouldnt be great star wars movie without action phantom menace delivers two scorching set pieces first is frenetically furious pod race which racers shoot through dangerous terrain all time trying avoid dirty tricks their competitors unfriendly fire unhappy campers race is brilliantly gripping keeping you edge your seat heart stopping beginning cheer worthy ending as with almost every scene movie race is also jam packed with clever details drawing you closer action second is pulse raising three way lightsaber fight between qui gon jinn excellent liam neeson obi wan kenobi ewan mcgregor darth maul athlete ray park this lightsaber duel conquers all previous duels series is absolutely terrific it is fantastically exciting finally see such fast paced brutal energetic lightsaber fight where combatants seem perfectly fluent are fighting with every ounce their strength this sequence is classic sword fight which will always be my mind when anyone mentions star wars addition fantastic action there is another phenomenal score john williams he provides several breath taking new tunes highlight is duel fates which is played during lightsaber fight yet also offers foreshadowing future events saga by using tunes original films despite fact that performers are hindered by undoubtedly clunky dialogue quite few them manage turn decent performances neeson gives noble powerful performance as qui gon jinn fully emphasising perfect image jedi master ewan mcgregor provides few moments brilliant emotional clarity whilst jake lloyd gives passable portrayal future darth vader anakin skywalker but best performance comes pernilla august who gives performance great grace vulnerability as anakins mother george lucas handles all proceedings with consummate skill he has made some mistakes screenplay but he has ensured best his ability that he is able grant us compelling engaging vision star wars galaxy he has had some low points his career but creative scale this certainly isnt one them he directs film passionately without remorse which earns him my deepest respect this is brilliant fantasy movie it may not be as dark as fans were hoping but it is still successful terms its creativity its visual effects its action,0.5984517443340972,0.25302011713776423,Positive,"{'Happy': 0.12, 'Angry': 0.05, 'Surprise': 0.24, 'Sad': 0.25, 'Fear': 0.33}"
10,Star Wars: An Incredible Beginning,"When I was a small kid, I used to wonder what the Star Wars universe was all about. Imperial soldiers, droids, flying spaceships and starfighters, Jedi Knights, Darth Vader, etc. I was curious with all of these stuff but when I watched all the three Star Wars movies, I began to understand what George Lucas, the creator of the popular sci-fi saga itself, was trying to accomplish: explore the awe and wonders of our ever expanding universe. And now, 22 years after the release of the first movie, George Lucas and his entire crew at Lucasfilm bring the most anticipated movie of 1999, Star Wars Episode I: The Phantom Menace. I am truly impressed with this incredible film despite its noticeable flaws. The evil Trade Federation has stopped all shipping to the peaceful planet of Naboo. To resolve that matter, the Galactic Republic decides to dispatch the two Jedi Knights, Obi-Wan Kenobi and Qui-Gon Jinn to the Trade Federation Battleship to arrange a negotiation with the Neimodians. Unfortunately for our heroes, the negotiation never takes place and so they fight face-to-face with thousands of battle droids, escape to Naboo, and there they meet the annoying yet kind-hearted Gungan, Jar Jar Binks as well as the beautiful Queen Amidala (ok, I know some of you out there complaint about her make-up). Later, our heroes meet Anakin Skywalker, a mysterious boy who is believed to bring the Balance to the Force. In my opinion, Anakin is such a cool person because he is a great podracer who never wins a single match until his recent confrontation with rival Sebulba (he is going to fly a Naboo starfighter too during the battle of Naboo. Bravo to Jake Lloyd!). You need to see the rest of the film if you haven't watched one yet. Episode I: The Phantom Menace is a very enjoyable movie that may even attract those who are not widely known to the Star Wars universe. I especially like the locations on some planets (the Naboo Palace and the wondrous city of Coruscant) as well as its awesome special effects. To heighten up the action, Darth Maul makes an incredible performance during the climatic battle with the Jedi Knights. However, I never say that The Phantom Menace is a 100% perfect movie. The storyline is pretty weak (gee, I wonder what George Lucas is thinking) and some characters aren't well developed. Still, this IS just only the beginning, and perhaps there will be a major improvement by the time Episode II is released.",star wars incredible beginning,when i was small kid i used wonder what star wars universe was all about imperial soldiers droids flying spaceships starfighters jedi knights darth vader etc i was curious with all these stuff but when i watched all three star wars movies i began understand what george lucas creator popular sci fi saga itself was trying accomplish explore awe wonders our ever expanding universe now 22 years after release first movie george lucas his entire crew at lucasfilm bring most anticipated movie 1999 star wars episode i phantom menace i am truly impressed with this incredible film despite its noticeable flaws evil trade federation has stopped all shipping peaceful planet naboo resolve that matter galactic republic decides dispatch two jedi knights obi wan kenobi qui gon jinn trade federation battleship arrange negotiation with neimodians unfortunately our heroes negotiation never takes place so they fight face face with thousands battle droids escape naboo there they meet annoying yet kind hearted gungan jar jar binks as well as beautiful queen amidala ok i know some you out there complaint about her make up later our heroes meet anakin skywalker mysterious boy who is believed bring balance force my opinion anakin is such cool person because he is great podracer who never wins single match until his recent confrontation with rival sebulba he is going fly naboo starfighter too during battle naboo bravo jake lloyd you need see rest film if you havent watched one yet episode i phantom menace is very enjoyable movie that may even attract those who are not widely known star wars universe i especially like locations some planets naboo palace wondrous city coruscant as well as its awesome special effects heighten up action darth maul makes incredible performance during climatic battle with jedi knights however i never say that phantom menace is 100 perfect movie storyline is pretty weak gee i wonder what george lucas is thinking some characters arent well developed still this is just only beginning perhaps there will be major improvement by time episode ii is released,0.6587261904761905,0.2255803571428571,Positive,"{'Happy': 0.15, 'Angry': 0.03, 'Surprise': 0.35, 'Sad': 0.21, 'Fear': 0.26}"
8,It begins...,"The Phantom Menace is one of those movies that I have been meaning to review since I first saw it on opening day years and years ago. I have a little book where I make notes of movies I would like to review, and when I flipped back to the page for Episode I, I noticed that the last time I jotted down a couple of points about this movie was December 26, 2002. Odd coincidence that I should be four years later to the day that I finally sit down to review it. The first thing that really struck me after seeing it for the first time was a huge sense of surprise at how much it did not live up to my expectations. I'm hardly a Star Wars fanatic, I don't even know many character names beyond the primary three or four, but I know the three original films and I understand how brilliant they are. I think that what went wrong was a combination of almost unprecedented expectation, too much CGI capability, and too much money. Lucas, who loathed studios in his earlier days as a filmmaker, now laments the fact that he has nearly become a studio himself. He funded Episode I out of his own pocket, and I think that now that he has the ability to really do anything he wants (since he has unlimited funding and it's all his own anyway, so he makes all of the rules with virtually no limitations), we get for the first time a really look at his strengths and weaknesses. I'm not going to go into the weaknesses too much because there are far more strengths than weaknesses, and I suppose I should point out at this point that The Phantom Menace is a very strong Star Wars movie, it's just not what it could have and should have been. It will take audiences time to accept additions like a digital Yoda, Samuel L. Jackson, and Jar Jar Binks to such a well known saga as the Star Wars films, and I think that things like that can account for some of the bad reactions that the movie received. On the other hand, the film really emphasizes how powerful Lucas' visual imagination is, which could also be seen in the first three films. His ability to dream up imaginary worlds and creatures and societies is as astonishing as it ever has been, and the general, overall badassedness (and the names!) of characters like Qui Gon Jin and Darth Maul is astonishing. The battle between Obi Wan, Qui Gon Jin, and Darth Maul I think is one of the best fight scenes in the entire series up to this point. Consider the way that Qui Gon, when they are fighting through that hallway where they're separated periodically by force fields, kneels and meditates when they're separated, while Darth Maul paces back and forth like a caged tiger. And of course the pod-racing scene was phenomenal!And the look of the film is beautiful from beginning to end. Indeed, during the slow parts, if you find yourself drifting away from the complexities of the plot being unfolded through diplomatic dialogue a little too thick to handle, you can entertain yourself just by gazing at the stunning surroundings. Jake Lloyd handles his role well for someone so young, as does the initially questionably cast Natalie Portman, who seems far too cute for the role but pulls it off brilliantly. Liam Neeson steals every scene he is in (and seems to belong in the film more than anyone else), but the casting seems to be all pretty much right on the mark. It's really unfortunate about Jar Jar though, he's just not a clever character. This is the first film that George Lucas has directed in more than 20 years (since the original Star Wars film), and it's clear that he is getting the feel of it all back in this movie. As brilliant as he is, directing is not his strong point, but as we saw from Episodes II and III, in The Phantom Menace he was just getting warmed up.",it begins,phantom menace is one those movies that i have been meaning review since i first saw it opening day years years ago i have little book where i make notes movies i would like review when i flipped back page episode i i noticed that last time i jotted down couple points about this movie was december 26 2002 odd coincidence that i should be four years later day that i finally sit down review it first thing that really struck me after seeing it first time was huge sense surprise at how much it did not live up my expectations im hardly star wars fanatic i dont even know many character names beyond primary three or four but i know three original films i understand how brilliant they are i think that what went wrong was combination almost unprecedented expectation too much cgi capability too much money lucas who loathed studios his earlier days as filmmaker now laments fact that he has nearly become studio himself he funded episode i out his own pocket i think that now that he has ability really do anything he wants since he has unlimited funding its all his own anyway so he makes all rules with virtually no limitations we get first time really look at his strengths weaknesses im not going go into weaknesses too much because there are far more strengths than weaknesses i suppose i should point out at this point that phantom menace is very strong star wars movie its just not what it could have should have been it will take audiences time accept additions like digital yoda samuel l jackson jar jar binks such well known saga as star wars films i think that things like that can account some bad reactions that movie received other hand film really emphasizes how powerful lucas visual imagination is which could also be seen first three films his ability dream up imaginary worlds creatures societies is as astonishing as it ever has been general overall badassedness names characters like qui gon jin darth maul is astonishing battle between obi wan qui gon jin darth maul i think is one best fight scenes entire series up this point consider way that qui gon when they are fighting through that hallway where theyre separated periodically by force fields kneels meditates when theyre separated while darth maul paces back forth like caged tiger course pod racing scene was phenomenal look film is beautiful beginning end indeed during slow parts if you find yourself drifting away complexities plot being unfolded through diplomatic dialogue little too thick handle you can entertain yourself just by gazing at stunning surroundings jake lloyd handles his role well someone so young as does initially questionably cast natalie portman who seems far too cute role but pulls it off brilliantly liam neeson steals every scene he is seems belong film more than anyone else but casting seems be all pretty much right mark its really unfortunate about jar jar though hes just not clever character this is first film that george lucas has directed more than 20 years since original star wars film its clear that he is getting feel it all back this movie as brilliant as he is directing is not his strong point but as we saw episodes ii iii phantom menace he was just getting warmed up,0.5311424394319131,0.17580817574238625,Positive,"{'Happy': 0.14, 'Angry': 0.03, 'Surprise': 0.33, 'Sad': 0.17, 'Fear': 0.34}"
