Rating,Review Title,Review,Cleaned Review Title,Cleaned Review,Subjectivity,Polarity,Sentiment,Emotion Scale
10,The path of one person: the pool of fear,"""Episode I: The Hidden Menace"" is perhaps the most ambiguous film in George W. Lucas's ""Star Wars"" series. Met by the rather coldly stern gaze of critics, the first film of the new trilogy can cause some confusion in the viewer. There are not many action scenes in it, there are many dialogues and just a leisurely development of actions, which sometimes may seem like a forced filler with a connecting function between fights and races. But this is only at first glance, because if you look closely ...Young Obi-Wan Kenobi (Ewan McGregor) and his teacher, Qui-Gon Jin (Liam Neeson), go to negotiations with the Trade Federation, which threatens to blockade the peaceful little planet of Naboo. In Obi-Wan's eyes, his mind and vision are already visible, his movements are already full of courage and confidence. Confidence and powerful, unquestioning dedication are seen in the young queen Amidala (Natalie Portman) that she is ready to do anything to help her people, the inhabitants of the occupied world federation. It is in ""The Phantom Menace"" most accurately and correctly disclose the nature and fragile at the same time in BOGATYRSKY solid Padme: it is able to stand alone against the decision of the Senate, venturing recklessly brave adventures and combine intuitive dictates of the heart with equanimity of mind.Qui-Gon Jin is unshakable and calm, in whatever situation he was. His eyes radiate wisdom and strength, a smile condescendingly reasonable, and the movements are smooth and weighed. But the main feature of Obi-Wan's teacher is not in these, of course, the most important qualities. Qui-Gon, first of all, is a man of exceptional faith. Some of his actions seem too risky and thoughtless, but somewhere in general they can be mistaken for a desperate bluff. But for him, extremely sensitive to everything around him, holding in an unsurpassed harmony the awareness of his own forces and the sense of difficulty of the tasks set, for him, who knows how to feel the situation on many, many forward steps, faith is the main tool. With her help, he stands unshakably on his feet, seeking his own, by all means.Once having set a goal - to certainly train quite a young Anakin Skywalker - Qui-Gon will go to her persistently and steadily. He alone believes in the Prophecy of the great destiny of the boy, as if he did not hear the fears of the Jedi Council that Anakin's uncertain future could pose great troubles to the Galaxy. But the foresight and the unique sense of Qui-Gon's world allow him to see far further than to his eminent like-minded people and mentors, like Master Yoda and Master Windu. In addition, an extraordinary faith allows Qui-Gon to destroy any of his fears and doubts that can obscure his clear eyes. The moment of the film is very important, in which the wise Jedi tells Anakin about the medichlorians, micro-organisms existing in symbiosis with the cells of any living organism. Perhaps, in these mysterious media chlorians lies the human soul, elusive to the eye and non-existent for touch. Then the wise counsel of Qui-Gon Jinn and unselfish greed deprived the boy Anakin Skywalker, wanted to visit every planet in the universe, it seems quite clear and sharp, Go up to the call of the heart, and you go on the right path. And even though this road is lost in the darkness of the gathering clouds, there will always be someone who sees a little farther than everyone else, and builds on this sagacity its most powerful faith. Qui-Gon believed in Anakin from the first second and believed in him to the end; most likely he understood the suffering and upheavals that promised further training of the boy for the Galaxy and for himself, but in one thing he was certain that in the final analysis Skywalker would return the Force to equilibrium ...Finishing on the major note of universal jubilation and festivities, ""Episode I: The Hidden Menace"" at first glance does not justify its mysterious and menacing title. But, having looked a little closer, we see that the holiday is just a calm before the storm, and a sweet truce is a tricky tactical ploy. It also becomes clear with horror that all the actions of all the heroes are quite comparable with the freedom to choose the actions of puppets tied to strong threads, for which someone is confidently pulling, able to control the movements of dolls by the easy fingering.And the violent protest of Padme Amidaly at the Senate meeting, and the murder of the mighty Darth Moule, and the fiasco of the Trade Federation, and the heroic death of Qui-Gon Gin, are all foggings in the plan of the mysterious strategist who is still hiding far from the battlefields, its galactic war. And Anakin Skywalker's aching lead heart, which is filled with a burning, drying fear after the death of a Jedi so much loved by him, also lies in a small coin, albeit of a larger value than the rest, on a comprehensive battle map of the devilish clever and cunning puppeteer. The beginning of the saga is laid, the heroes are represented, the plot knots are tied. Star Wars Beginning",path one person pool fear,episode i hidden menace is perhaps most ambiguous film george w lucass star wars series met by rather coldly stern gaze critics first film new trilogy can cause some confusion viewer there are not many action scenes it there are many dialogues just leisurely development actions which sometimes may seem like forced filler with connecting function between fights races but this is only at first glance because if you look closely young obi wan kenobi ewan mcgregor his teacher qui gon jin liam neeson go negotiations with trade federation which threatens blockade peaceful little planet naboo obi wans eyes his mind vision are already visible his movements are already full courage confidence confidence powerful unquestioning dedication are seen young queen amidala natalie portman that she is ready do anything help her people inhabitants occupied world federation it is phantom menace most accurately correctly disclose nature fragile at same time bogatyrsky solid padme it is able stand alone against decision senate venturing recklessly brave adventures combine intuitive dictates heart with equanimity mind qui gon jin is unshakable calm whatever situation he was his eyes radiate wisdom strength smile condescendingly reasonable movements are smooth weighed but main feature obi wans teacher is not these course most important qualities qui gon first all is man exceptional faith some his actions seem too risky thoughtless but somewhere general they can be mistaken desperate bluff but him extremely sensitive everything around him holding unsurpassed harmony awareness his own forces sense difficulty tasks set him who knows how feel situation many many forward steps faith is main tool with her help he stands unshakably his feet seeking his own by all means once having set goal certainly train quite young anakin skywalker qui gon will go her persistently steadily he alone believes prophecy great destiny boy as if he did not hear fears jedi council that anakins uncertain future could pose great troubles galaxy but foresight unique sense qui gons world allow him see far further than his eminent like minded people mentors like master yoda master windu addition extraordinary faith allows qui gon destroy any his fears doubts that can obscure his clear eyes moment film is very important which wise jedi tells anakin about medichlorians micro organisms existing symbiosis with cells any living organism perhaps these mysterious media chlorians lies human soul elusive eye non existent touch then wise counsel qui gon jinn unselfish greed deprived boy anakin skywalker wanted visit every planet universe it seems quite clear sharp go up call heart you go right path even though this road is lost darkness gathering clouds there will always be someone who sees little farther than everyone else builds this sagacity its most powerful faith qui gon believed anakin first second believed him end most likely he understood suffering upheavals that promised further training boy galaxy himself but one thing he was certain that final analysis skywalker would return force equilibrium finishing major note universal jubilation festivities episode i hidden menace at first glance does not justify its mysterious menacing title but having looked little closer we see that holiday is just calm before storm sweet truce is tricky tactical ploy it also becomes clear with horror that all actions all heroes are quite comparable with freedom choose actions puppets tied strong threads which someone is confidently pulling able control movements dolls by easy fingering violent protest padme amidaly at senate meeting murder mighty darth moule fiasco trade federation heroic death qui gon gin are all foggings plan mysterious strategist who is still hiding far battlefields its galactic war anakin skywalkers aching lead heart which is filled with burning drying fear after death jedi so much loved by him also lies small coin albeit larger value than rest comprehensive battle map devilish clever cunning puppeteer beginning saga is laid heroes are represented plot knots are tied star wars beginning,0.6066304443855465,0.1854147892923403,Positive,"{'Happy': 0.1, 'Angry': 0.03, 'Surprise': 0.16, 'Sad': 0.27, 'Fear': 0.44}"
7,Probably my most nostalgic Star Wars movie in the saga!,"The year is 1999. I am about 7 years old, and not yet seen a Star Wars movie in theatres. Thus the stage was set for my experience with Star Wars: Episode I-The Phantom Menace.Ok, so first and foremost, I realize that Ep. I is not the best of the best, but I still quite enjoy watching it. It's fun, fast-paced (for the most part) and has frickin' Darth Maul in it!!! The story at time drags a bit and some of the dialogue isn't all that great, but there are definitely still many moments that unleash that inner kid in you, i.e. the Podracers, the epic battles at the end and that amazing lightsaber duel! I do like this entry in the saga, and every time I watch it, I go back to a somewhat simpler time; when the stresses of everyday life hadn't yet sunk in. Overall, I enjoy Ep. I and all the memories it sets off. The Force will be with you...always.",probably my most nostalgic star wars movie saga,year is 1999 i am about 7 years old not yet seen star wars movie theatres thus stage was set my experience with star wars episode i phantom menace ok so first foremost i realize that ep i is not best best but i still quite enjoy watching it its fun fast paced most part has frickin darth maul it story at time drags bit some dialogue isnt all that great but there are definitely still many moments that unleash that inner kid you i e podracers epic battles at end that amazing lightsaber duel i do like this entry saga every time i watch it i go back somewhat simpler time when stresses everyday life hadnt yet sunk overall i enjoy ep i all memories it sets off force will be with you always,0.44047619047619047,0.2357142857142857,Positive,"{'Happy': 0.19, 'Angry': 0.0, 'Surprise': 0.31, 'Sad': 0.15, 'Fear': 0.35}"
9,This scapegoat of a movie definitely needs more appreciation.,"I loved this movie as a kid. I still love it at age 21. Sure, it can be a bit sloppy at times, and it switches from plot a to plot b constantly.The stereotypes can be jarring at times. But you know what, it is still brilliant. The characters are likable. Even jar jar is not that bad. The acting is OK. Not great, but OK. The hate seems to stem from old trilogy fans, not knowing that this film was merely trying to be something different. Yes, if you want a film that feels like the old trilogy, this is not for you. But if you are looking for a fast-paced, lighthearted sci-fi action movie with one or two smart scenes, good scenery, and interesting alien designs, then this is for you.",this scapegoat movie definitely needs more appreciation,i loved this movie as kid i still love it at age 21 sure it can be bit sloppy at times it switches plot plot b constantly stereotypes can be jarring at times but you know what it is still brilliant characters are likable even jar jar is not that bad acting is ok not great but ok hate seems stem old trilogy fans not knowing that this film was merely trying be something different yes if you want film that feels like old trilogy this is not you but if you are looking fast paced lighthearted sci fi action movie with one or two smart scenes good scenery interesting alien designs then this is you,0.5552698412698411,0.13790476190476195,Positive,"{'Happy': 0.41, 'Angry': 0.05, 'Surprise': 0.09, 'Sad': 0.23, 'Fear': 0.23}"
8,A very lacking addition to the Star Wars saga....,"For 6 months I longed to watch Star Wars: Episode I The Phantom Menace, and for 133 minutes I was absolutely blown away with how well the movie was put together. I saw it on opening day of course, and I now understand why I have waited so long to write a review of it. If I had written this review right after I watched the movie, I would have written a review influenced by the months and months of anticipation. I feel now, after 17 months and countless 1000's of times watching all or some of the movie, I now feel that I can review this film free of influence.***Warning, this review is full of spoilers!***The Phantom Menace is a film that had virtually years between conception and completion and it's a horrible shame that they spent most of that time deciding whom to cast. On top of that, it now is clear to me that George Lucas spent much of the time filming this movie on certain parts, and not enough on others. For instance, the pod-racing scene is unbelievably awesome, and it is evident that Lucas spent a long period of time on this scene alone. The final battle between Qui-Gon Jin, Obi-Wan Kenobi, and Darth Maul is another prime example, I mean just to think up something like the long corridor with those strategically placed force fields must have took a lot of time and imagination. On the other hand, scenes like when Qui-Gon is explaining to Anikin what the `force' is should have been a little more elaborate, and in this case re-written and re-shot. Casting was, for the most part, well thought out. In the usual Star Wars' way, the main actors and actresses were not the usual $20 million dollar actors and actresses. In choosing Liam Neeson for the role of Qui-Gon Jin was anything but dull, and Ewan McGregor as the already introduced Obi-Wan Kenobi was even more brilliant. When choosing the eventual mother of Luke Skywalker (Queen Amidala), Natalie Portman was a unique choice. Even having the impressive Samuel L. Jackson in this movie was a great chance to see him along side Yoda. As I am pleased with all the previous choices, the most important of casting decisions in the past few years was not thought out well enough. Jake Lloyd was horribly miscast in the role of Anikin Skywalker. It almost hurt to listen to him present his lines.  From the first `Uh oh, this isn't good..' to the `I'm going to be a jedi knight?' his delivery is incredibly lacking of feeling. I would have to say that Jake Lloyd alone is a big part of why this movie will get a lower than usual rating from this viewer. As far as the villains in this movie, and there were many, Darth Maul must have sounded great on paper, but there must have been much lost in the translation onto the screen. He is neither terrifying, nor powerful like the eventual Darth Vader will be. Not until the final battle scene do we begin to somewhat fear him. Throughout the first three movies, we learned piece by piece about Darth Vader. We hated him since we first were introduced to him in Hope', and we grew to love him by the end of Jedi'. The problem with Menace' and Darth Maul, is that he wasn't introduced until at least 30 minutes into the film, and we never learned anything about him. The movie was indeed full of action, and I especially liked the use of CGI alongside the natural environments. The decision to include Jar Jar Binks, and fully computerized sidekick, was not necessarily a bad one, I just think that a few of his lines were a bit irrelevant to the story. I especially like Watto, and the scene with him and Qui-Gon Jin discussing payment for the part to Qui-Gon's ship.The use of wipe' transition from scene to scene is a classic Star Wars' piece. The lighting is also unique to the Star Wars' family of movies, as is the bland good vs. evil plot. If not for the pod racing scene (roughly reincarnated from Ben Hur), and the final three-way fight scene, Star Wars: Episode I The Phantom Menace' would have earned a disappointingly low grade due to the lack of casting, and very obvious rush to get the movie completed.Please let this be known, this is the most expensive ($115 million) independent film ever created. It was fully funded by George Lucas himself. With this said, Episode I' is not a bad film by any stretch of the imagination, just an average sci-fi film that just happens to have the words Star Wars' in the title. After all this I must admit that I, once again, will probably be waiting for months to see the next film on opening day; let's just hope that we wont be let down again.",very lacking addition star wars saga,6 months i longed watch star wars episode i phantom menace 133 minutes i was absolutely blown away with how well movie was put together i saw it opening day course i now understand why i have waited so long write review it if i had written this review right after i watched movie i would have written review influenced by months months anticipation i feel now after 17 months countless 1000s times watching all or some movie i now feel that i can review this film free influence warning this review is full spoilers phantom menace is film that had virtually years between conception completion its horrible shame that they spent most that time deciding whom cast top that it now is clear me that george lucas spent much time filming this movie certain parts not enough others instance pod racing scene is unbelievably awesome it is evident that lucas spent long period time this scene alone final battle between qui gon jin obi wan kenobi darth maul is another prime example i mean just think up something like long corridor with those strategically placed force fields must have took lot time imagination other hand scenes like when qui gon is explaining anikin what force is should have been little more elaborate this case re written re shot casting was most part well thought out usual star wars way main actors actresses were not usual 20 million dollar actors actresses choosing liam neeson role qui gon jin was anything but dull ewan mcgregor as already introduced obi wan kenobi was even more brilliant when choosing eventual mother luke skywalker queen amidala natalie portman was unique choice even having impressive samuel l jackson this movie was great chance see him along side yoda as i am pleased with all previous choices most important casting decisions past few years was not thought out well enough jake lloyd was horribly miscast role anikin skywalker it almost hurt listen him present his lines first uh oh this isnt good im going be jedi knight his delivery is incredibly lacking feeling i would have say that jake lloyd alone is big part why this movie will get lower than usual rating this viewer as far as villains this movie there were many darth maul must have sounded great paper but there must have been much lost translation onto screen he is neither terrifying nor powerful like eventual darth vader will be not until final battle scene do we begin somewhat fear him throughout first three movies we learned piece by piece about darth vader we hated him since we first were introduced him hope we grew love him by end jedi problem with menace darth maul is that he wasnt introduced until at least 30 minutes into film we never learned anything about him movie was indeed full action i especially liked use cgi alongside natural environments decision include jar jar binks fully computerized sidekick was not necessarily bad one i just think that few his lines were bit irrelevant story i especially like watto scene with him qui gon jin discussing payment part qui gons ship use wipe transition scene scene is classic star wars piece lighting is also unique star wars family movies as is bland good vs evil plot if not pod racing scene roughly reincarnated ben hur final three way fight scene star wars episode i phantom menace would have earned disappointingly low grade due lack casting very obvious rush get movie completed please let this be known this is most expensive 115 million independent film ever created it was fully funded by george lucas himself with this said episode i is not bad film by any stretch imagination just average sci fi film that just happens have words star wars title after all this i must admit that i once again will probably be waiting months see next film opening day lets just hope that we wont be let down again,0.5419466490299824,0.1080864197530864,Positive,"{'Happy': 0.12, 'Angry': 0.04, 'Surprise': 0.18, 'Sad': 0.22, 'Fear': 0.43}"
7,Happy 20 to the start of the prequel trilogy,"Episode 1: The Phantom Menace isn't as strong as the original trilogy, sadly. The performances from Jake Lloyd and Ahmed Best as young Anakin Skywalker and Jar Jar Binks are not that good, the writing is very mediocre, and the pacing dragged on for a bit too long, but everything else makes up for it. The performances from Ewan McGregor, Liam Neeson, and the other actors were decent enough, the action sequences are spectacular, the visual effects while a bit dated still looks really solid even after it came out in 1999, and John Williams delivers a satisfying music score especially the cue ""Duel of the Fates"" in the epic lightsaber duel between Qui Gon Jinn, Obi Wan Kenobi, and Darth Maul. So, overall, not the best and I understand why some people hated it, but its a decent start to the prequel trilogy after twenty years.",happy 20 start prequel trilogy,episode 1 phantom menace isnt as strong as original trilogy sadly performances jake lloyd ahmed best as young anakin skywalker jar jar binks are not that good writing is very mediocre pacing dragged bit too long but everything else makes up it performances ewan mcgregor liam neeson other actors were decent enough action sequences are spectacular visual effects while bit dated still looks really solid even after it came out 1999 john williams delivers satisfying music score especially cue duel fates epic lightsaber duel between qui gon jinn obi wan kenobi darth maul so overall not best i understand why some people hated it but its decent start prequel trilogy after twenty years,0.5434027777777778,0.08819444444444445,Positive,"{'Happy': 0.15, 'Angry': 0.05, 'Surprise': 0.4, 'Sad': 0.25, 'Fear': 0.15}"
