Rating,Review Title,Review,Cleaned Review Title,Cleaned Review,Subjectivity,Polarity,Sentiment,Emotion Scale
3.0,The Human Centipede III : Well it was certainly memorable,"The first Human Centipede movie had a certain novelty factor about it. It was meant to shock and it succeeded, thus making it somewhat watchable.The second was a disgusting mess with no redeeming features and would likely be in my bottom 100 movies ever made.This, is an odd creature.So the antagonists from both previous movies return, but they both play different characters! In the second movie the first movie was made out to be exactly that, just a movie. In this one both the first and second are supposed to have been movies.Still with me?Adding an element of humor this third part is undeniably memorable but not for the right reasons. It aims to shock once again and pulls out all the stops in doing so.Credit where credit is due, the lead takes the character and makes it his own and saves the film (To an extent). The Human Centipede III is disgusting, and there is barely a story but it has moments that are very hard to get off your mind so it at least succeeds there.Not for the faint.The Good:Dieter Laser certainly makes for an interesting character with Billy BossThe Bad:Shock for the sake of shockNo real storyline",human centipede iii well it was certainly memorable,first human centipede movie had certain novelty factor about it it was meant shock it succeeded thus making it somewhat watchable second was disgusting mess with no redeeming features would likely be my bottom 100 movies ever made this is odd creature so antagonists both previous movies return but they both play different characters second movie first movie was made out be exactly that just movie this one both first second are supposed have been movies still with me adding element humor this third part is undeniably memorable but not right reasons it aims shock once again pulls out all stops doing so credit where credit is due lead takes character makes it his own saves film extent human centipede iii is disgusting there is barely story but it has moments that are very hard get off your mind so it at least succeeds there not faint good dieter laser certainly makes interesting character with billy bossthe bad shock sake shockno real storyline,0.44760204081632643,0.029234693877551024,Positive,"{'Happy': 0.05, 'Angry': 0.07, 'Surprise': 0.3, 'Sad': 0.3, 'Fear': 0.28}"
1.0,Please invent a way to unsee a film,"I want to make it clear, this was not a film of my choice, friends put it on and I was made to watch it. I didn't like the original, not because it was badly made, it just ain't my bag.For the first time I intended to give a film zero out of ten, but as I can't do that it gets a one.It's actually not particularly scary, I didn't find the subject material as sickening or gross as the first one, it's actually a really boring film, lots of shouting and screaming. Why did it need to go on for so long.I've never been the greatest fan of Eric Roberts, I think he's poor in it, but Dieter Laser is dire, he's so bad it's almost as if someone bet him to ham it up as much as possible and take the P**S.Best bit of the film, the final credits, on par with a driving test, agonising!!!",please invent way unsee film,i want make it clear this was not film my choice friends put it i was made watch it i didnt like original not because it was badly made it just aint my bag first time i intended give film zero out ten but as i cant do that it gets one its actually not particularly scary i didnt find subject material as sickening or gross as first one its actually really boring film lots shouting screaming why did it need go so long ive never been greatest fan eric roberts i think hes poor it but dieter laser is dire hes so bad its almost as if someone bet him ham it up as much as possible take p s best bit film final credits par with driving test agonising,0.5981481481481482,-0.03842592592592591,Negative,"{'Happy': 0.03, 'Angry': 0.03, 'Surprise': 0.31, 'Sad': 0.38, 'Fear': 0.24}"
1.0,Could Dieter Laser be the worst actor in history? Perhaps...but his performance as the Warden is clearly the worst performance I've seen in years!,"I have an unusual hobby. I like to occasionally watch horrible films, as I find many of them unintentionally funny. Because of this passion, I have seen every movie in Harry Medved's ""The 50 Worst Movies"" and nearly all of IMDB's infamous Bottom 100 list. However, of all these bad films, one I simply could not bring myself to finish was ""The Human Centipede II"" as I found it so overwhelmingly disgusting, stupid and awful that I simply couldn't finish the job. This made my watching ""The Human Centipede III"" something I really did NOT look forward to doing! Should I have paid more attention to my brain and simply refused to see this third film? To put it bluntly...yes.When the film begins, you can't help but marvel at Dieter Laser as he plays the crazy Warden. I couldn't believe how bad an actor he was and what a horrible performance he could give as this very, very stupid character. Warden Boss is like a cartoon character....so evil he's utterly ridiculous. He overacts constantly and is so dumb and awful you just need to see and hear him to believe it! Additionally, his heavy German accent simply made it sound as if he'd JUST learned English a few minutes before attempting this role! Is he completely to blame? No...the writer and director must own some of this as well, though I strongly suspect they were penguins as I cannot imagine a person directing or writing THIS poorly. His character is 100% sadism and 100% stupid....to the point where he becomes tedious....and dumber than Tor Johnson in ""Plan 9 From Outer Space""!Overall, this movie was SLIGHTLY less disgusting than the prior film but the utter stupidity of the script and Laser put it in a class all by itself. I would clearly place this in a list NOT of the worst 100...but worst dozen films ever made. It' THAT bad...that pointless...that offensive...and that amateurish. A truly awful pile of dog vomit of a film...with a loud, brash, obnoxious no-talent leading it all in the form of Warden Boss!",could dieter laser be worst actor history perhaps but his performance as warden is clearly worst performance ive seen years,i have unusual hobby i like occasionally watch horrible films as i find many them unintentionally funny because this passion i have seen every movie harry medveds 50 worst movies nearly all imdbs infamous bottom 100 list however all these bad films one i simply could not bring myself finish was human centipede ii as i found it so overwhelmingly disgusting stupid awful that i simply couldnt finish job this made my watching human centipede iii something i really did not look forward doing should i have paid more attention my brain simply refused see this third film put it bluntly yes when film begins you cant help but marvel at dieter laser as he plays crazy warden i couldnt believe how bad actor he was what horrible performance he could give as this very very stupid character warden boss is like cartoon character so evil hes utterly ridiculous he overacts constantly is so dumb awful you just need see hear him believe it additionally his heavy german accent simply made it sound as if hed just learned english few minutes before attempting this role is he completely blame no writer director must own some this as well though i strongly suspect they were penguins as i cannot imagine person directing or writing this poorly his character is 100 sadism 100 stupid point where he becomes tedious dumber than tor johnson plan 9 outer space overall this movie was slightly less disgusting than prior film but utter stupidity script laser put it class all by itself i would clearly place this list not worst 100 but worst dozen films ever made it that bad that pointless that offensive that amateurish truly awful pile dog vomit film with loud brash obnoxious no talent leading it all form warden boss,0.636843185550082,-0.3015804597701149,Negative,"{'Happy': 0.0, 'Angry': 0.04, 'Surprise': 0.21, 'Sad': 0.42, 'Fear': 0.33}"
10.0,"A ""not for everyone"" funny comedy horror","I think the reason this movie has such a bad rating is that some people don't get that this is a comedy horror, if you try to watch it seriously or if you expect something like the first two movies then yeah you're probably not gonna enjoy yourself, but then again it's not how it is meant to be watched. Comedy horrors are extremely hard to get right because it combines the most difficult genres to get right, not everybody laughs at the same things and not everybody is scared of the same things. This movie relies on shock humor and extremely exaggerated acting. I find Dieter Laser as Bill Boss hilarious and same goes for Laurence R Harvey as Dwight, they're a very funny duo and very memorable characters. But then again, if screaming profanities and saying the word ""cock"" every two seconds isn't your humor and ball cutting scenes aren't your type of horror then you're going to hate this movie.I'm giving it a 10 while acknowledging that this movie isn't for everyone, but that doesn't make it a bad movie that just makes it a controversial movie. You might love it, you might hate it, there's no in between and I think Tom Six doesn't want an in between, he wants strong reactions and that's exactly what he gets with each of his movie. So bravo Tom Six.",not everyone funny comedy horror,i think reason this movie has such bad rating is that some people dont get that this is comedy horror if you try watch it seriously or if you expect something like first two movies then yeah youre probably not gonna enjoy yourself but then again its not how it is meant be watched comedy horrors are extremely hard get right because it combines most difficult genres get right not everybody laughs at same things not everybody is scared same things this movie relies shock humor extremely exaggerated acting i find dieter laser as bill boss hilarious same goes laurence r harvey as dwight theyre very funny duo very memorable characters but then again if screaming profanities saying word cock every two seconds isnt your humor ball cutting scenes arent your type horror then youre going hate this movie im giving it 10 while acknowledging that this movie isnt everyone but that doesnt make it bad movie that just makes it controversial movie you might love it you might hate it theres no between i think tom six doesnt want between he wants strong reactions thats exactly what he gets with each his movie so bravo tom six,0.6126700680272109,0.005527210884353743,Positive,"{'Happy': 0.12, 'Angry': 0.1, 'Surprise': 0.39, 'Sad': 0.2, 'Fear': 0.2}"
8.0,Loved it!,"Dieter Laser is brilliant! I have never known an actor who could make me feel so incredibly uncomfortable so consistently. He did it it the first Human Centipede and delivered throughout this film. This movie is exactly what I expected it to be. It was disgusting and vile and I won't be able to erase it from my mind. But that's why I watched it. I felt the same revulsion after watching the first film, but it quickly became one of my all-time favorite horror films. I won't say that this one is as good as the first one, but it's a fun ride ride if you are a fan of the genre.Paranormal Activity fans should just skip this one and stick to horror lite. You won't get it. This is for hardcore horror fans. With all of the pile of crap B movies out there that truly suck, I am amazed that there are so many 1 star ratings here. This film was well acted, well written, and very entertaining. I suspect many of the poor reviews are due to disgust and the actual movie. Or maybe it was the lack of nudity? Who knows. Watch if you dare.",loved it,dieter laser is brilliant i have never known actor who could make me feel so incredibly uncomfortable so consistently he did it it first human centipede delivered throughout this film this movie is exactly what i expected it be it was disgusting vile i wont be able erase it my mind but thats why i watched it i felt same revulsion after watching first film but it quickly became one my all time favorite horror films i wont say that this one is as good as first one but its fun ride ride if you are fan genre paranormal activity fans should just skip this one stick horror lite you wont get it this is hardcore horror fans with all pile crap b movies out there that truly suck i am amazed that there are so many 1 star ratings here this film was well acted well written very entertaining i suspect many poor reviews are due disgust actual movie or maybe it was lack nudity who knows watch if you dare,0.5264583333333334,0.16284722222222223,Positive,"{'Happy': 0.19, 'Angry': 0.0, 'Surprise': 0.45, 'Sad': 0.19, 'Fear': 0.16}"
1.0,"So, so disappointed","In Tom Six's final sequence of the Human Centipede its hard to not get your hopes up. Especially when Six himself, said this: ""The first one (film) is like my little pony, the second one is like Disney compared to the third one.""So with that in mind, I was so prepared to freak out and possibly have to pause a few times walk away to desensitize and come back. And yet, no such luck. The final film was such a let down that I really feel the 2nd one should be the 3rd film as it is by far the hardest to watch.The only 2 things that show that this is the 3rd one is the fact that we see clips from film 2 at the start and the centipede in film 3 is bigger. Otherwise we are 'treated' to this western-sheriff guy who is over-the-top dramatic and controlling and... wait for it... that's it.Big big big let down Tom sorry to say :(",so so disappointed,tom sixs final sequence human centipede its hard not get your hopes up especially when six himself said this first one film is like my little pony second one is like disney compared third one so with that mind i was so prepared freak out possibly have pause few times walk away desensitize come back yet no such luck final film was such let down that i really feel 2nd one should be 3rd film as it is by far hardest watch only 2 things that show that this is 3rd one is fact that we see clips film 2 at start centipede film 3 is bigger otherwise we are treated this western sheriff guy who is over top dramatic controlling wait it thats it big big big let down tom sorry say,0.4194444444444444,-0.05237455197132617,Negative,"{'Happy': 0.05, 'Angry': 0.1, 'Surprise': 0.48, 'Sad': 0.24, 'Fear': 0.14}"
10.0,Nothing like the two previous movies,"OK I gave an excellent to this film and I will justify my opinion. Having seen the two previous human centipede movies I expected something similar in this movie, just a bigger centipede, but NO! That wasn't actually the case. There was an actual plot, a story, great characters and one hell of a performance from Bill Boss! Yes there is sickness and violence but come on I mean if you're not into those things you are not going to watch a movie called the human centipede go watch something else. There was plenty of dark humor and it was very well directed. If you just step out of the attitude 'ewwww that's gross ' you'll see that it's actually a good film of its KIND! I don't know about you but I'm kinda tired of watching the same old college- students-lost-in-the-woods-killed-by-a-maniac films. Well done.",nothing like two previous movies,ok i gave excellent this film i will justify my opinion having seen two previous human centipede movies i expected something similar this movie just bigger centipede but no that wasnt actually case there was actual plot story great characters one hell performance bill boss yes there is sickness violence but come i mean if youre not into those things you are not going watch movie called human centipede go watch something else there was plenty dark humor it was very well directed if you just step out attitude ewwww thats gross youll see that its actually good film its kind i dont know about you but im kinda tired watching same old college students lost woods killed by maniac films well done,0.37253787878787886,0.10928030303030303,Positive,"{'Happy': 0.2, 'Angry': 0.0, 'Surprise': 0.28, 'Sad': 0.2, 'Fear': 0.32}"
2.0,And Pythagorus called Three a noble number.....,"George H. W. Bush Prison is ruled over by the Warden Bill Boss, a sweat-soaked shaved- headed sadist brainwashed with delusions of madness and brutality.Boss' 'Igor' is his accountant, Dwight, but the prison's real problems are High costs, inmate fights, guard injuries and other numerous failures.Boss has his own ideas for how to fix the place, shouting incomprehensible waffle in his garbled English, but mild-mannered Dwight keeps on mentioning an even better idea. If Bill would only watch these two horror movies to see how it might work Third times the charm right? It's absolutely not in this abomination of a film, easily the worst film of the year, directed by Tom Six, who must be laughing all the way to the bank with his trilogy of trash.The concept of the original movie was a good enough idea, but it was executed poorly. The second one was more meta, and a better movie, but that's the same as saying that losing an arm is better than losing your sight, which would be beneficial in this films case.So we have Laser as the warden, barely making any sense literally shouting his lines throughout looking like he is on some sort of substance. Seriously, this is one of the poorest performances I've seen in a film, I don't know what he was trying to channel, but my goodness, his performance is painful.Harvey fares a little better, but he looks like Stan Laurel, at least he pulls the reins in on his performance. The film is exceptionally offence, sexist, homophobic, culturally incorrect, and so wrong on so many accounts.Six appears as himself, and even he vomits due to the quality of his own creation.In trying to be shocking, Six fails on every level imaginable, shock doesn't mean to offend all the time, shock should stay with you, make you think, not make you want to press the off button.When the unveiling of the titular experiment is finally revealed, your still recovering from the insufferable poison the previous hour showered you with.And this is supposed to be a black comedy too? That sentence in itself is funnier than anything present on screen.The jokes on us unfortunately, as the 'auteur' cemented his name in legend, because this film will be remembered.......for all the wrong reasons of course.But I'll give credit where credits due,there are some landscape shots that are truly psychedelic.It's really really really not worth 100 minutes of your life. It's like a nightmare drug induced episode of BBC favourite 'it ain't half hot mum', and as bad as that would sound.",pythagorus called three noble number,george h w bush prison is ruled over by warden bill boss sweat soaked shaved headed sadist brainwashed with delusions madness brutality boss igor is his accountant dwight but prisons real problems are high costs inmate fights guard injuries other numerous failures boss has his own ideas how fix place shouting incomprehensible waffle his garbled english but mild mannered dwight keeps mentioning even better idea if bill would only watch these two horror movies see how it might work third times charm right its absolutely not this abomination film easily worst film year directed by tom six who must be laughing all way bank with his trilogy trash concept original movie was good enough idea but it was executed poorly second one was more meta better movie but thats same as saying that losing arm is better than losing your sight which would be beneficial this films case so we have laser as warden barely making any sense literally shouting his lines throughout looking like he is some sort substance seriously this is one poorest performances ive seen film i dont know what he was trying channel but my goodness his performance is painful harvey fares little better but he looks like stan laurel at least he pulls reins his performance film is exceptionally offence sexist homophobic culturally incorrect so wrong so many accounts six appears as himself even he vomits due quality his own creation trying be shocking six fails every level imaginable shock doesnt mean offend all time shock should stay with you make you think not make you want press off button when unveiling titular experiment is finally revealed your still recovering insufferable poison previous hour showered you with this is supposed be black comedy too that sentence itself is funnier than anything present screen jokes us unfortunately as auteur cemented his name legend because this film will be remembered all wrong reasons course but ill give credit where credits due there are some landscape shots that are truly psychedelic its really really really not worth 100 minutes your life its like nightmare drug induced episode bbc favourite it aint half hot mum as bad as that would sound,0.5414355742296919,0.0051447245564892625,Positive,"{'Happy': 0.06, 'Angry': 0.05, 'Surprise': 0.29, 'Sad': 0.23, 'Fear': 0.36}"
