Rating,Review Title,Review,Cleaned Review Title,Cleaned Review,Subjectivity,Polarity,Sentiment,Emotion Scale
9.0,You Are More Than What You Have Become,"So...I'm going to try not to be too biased here...I'm going to compose myself the best I can...But, I'm not going to lie, that's going to be really hard seeing as though I AM IN LOVE WITH THIS MOVIE!!! I know a lot of people say this film is overrated and all that jazz, but LOOK AT THIS FILM and tell me you don't love it too!ANIMATION: Spectacular! This movie looks great! Of course it has an epic, grand quality about it, and the animation really takes it to another level! The stampede scene has got to be one of the biggest scenes ever put to traditional animation!SONGS/MUSIC: This movie brings us the Tim Rice/Elton John team. Even though there's no Alan Menken or Howard Ashman, these songs are still great! They fit the movie's tone, they're not out of place, and they are ALL memorable! This Disney movie has the best soundtrack - there is no Number One hit song from this film - ALL the songs are Number One! I don't just love the songs, but I am in mad love with Hans Zimmer's score! It's beautiful! It tells the story and fits the mood perfectly! The main theme, ""Lea Halalela,"" is fan-frickin-tastic! Gosh, if that theme were a woman, I'd marry her! But the music is what takes us to Africa (which country are we in? I don't know...), and if it weren't for Lebo M's contributions, NO music in this movie would be great!ROMANCE: For as much as I love this movie, I have to admit that this is one of the weak aspects of the film. I love the ""Can You Feel the Love Tonight"" number; I love the song, and I love looking at the animation. But...why is the song here? Why is this scene here? First of all, it doesn't match the story at all. It feels like the scene takes place because...Disney movies have romance scenes! Secondly, I don't believe Simba and Nala are in love. Look at how other Disney films show love: characters are smiling, singing, happy, and would do anything to be with their romantic interest. Here, Simba and Nala are arguing and yelling at each other after the scene. I'll tell you what, though, if you look at Nala as she's laying on her back during the song number, look at how she looks at Simba. That says, ""I want you, lion man.""CHARACTERS: I am in love with these characters! Much like the ""Beauty and the Beast"" gang, there's not a person...or animal...in this movie I don't dislike! My two favorite characters are Mufasa and Rafiki. Mufasa wreaks of power! The reason we hate Scar so much is because he kills Mufasa, who we love so much! He is the father of Disney movie fathers - Disney fathers period! He says one of my favorite lines: ""Look inside yourself, Simba. You are more than what you have become."" OOOH, that line just OOZES power - just BLEEDS power!!! Rafiki is awesome because he is both funny and wise. He knows just what to say and just what to do for the right moment. He has funny lines like ""It means you are a baboon, and I am not!"" Yet he knows when to hit Simba over the head with a stick and tell him to learn from his mistakes. Go Rafiki!STORY: I think the story is excellent. I love watching it, I love watching Simba's arc, I think it is brilliant...Though, there's one other problem the movie has that lies in the story. After Mufasa dies and Simba cries over his body, Scar comes and tells him to run away. Question: if they're all alone, why doesn't Scar just kill Simba himself? At first I thought it was because he didn't want Simba's blood on his hands, but that can't be right. First of all, he has Mufasa's blood on his hands. Second of all, he has a violent fight with Simba at the end of the movie. If Scar wants the throne so badly that he puts together an attack against two children, a Nazi team of hyenas, and a wildebeest stampede, I don't think he was above killing a child. The movie could have been over just like that; why didn't he kill Simba? The only reason I can come up with is ""If he killed him, there'd be no movie."" Well, that's weak. If that's the case, then the movie didn't need to happen. We should have gotten a better reason for the following events that took place.CONCLUSION: Despite the two problems I have with the movie, I still adore it! It's epic, it's dramatic, it's funny, it's musical! It is large! It has one of the saddest moments ever in Disney. It is one of the studio's biggest movies for a reason! Find out for yourself in the big Circle of Life! BOOYIKA!",you are more than what you have become,so im going try not be too biased here im going compose myself best i can but im not going lie thats going be really hard seeing as though i am love with this movie i know lot people say this film is overrated all that jazz but look at this film tell me you dont love it too animation spectacular this movie looks great course it has epic grand quality about it animation really takes it another level stampede scene has got be one biggest scenes ever put traditional animation songs music this movie brings us tim rice elton john team even though theres no alan menken or howard ashman these songs are still great they fit movies tone theyre not out place they are all memorable this disney movie has best soundtrack there is no number one hit song this film all songs are number one i dont just love songs but i am mad love with hans zimmers score its beautiful it tells story fits mood perfectly main theme lea halalela is fan frickin tastic gosh if that theme were woman id marry her but music is what takes us africa which country are we i dont know if it werent lebo ms contributions no music this movie would be great romance as much as i love this movie i have admit that this is one weak aspects film i love can you feel love tonight number i love song i love looking at animation but why is song here why is this scene here first all it doesnt match story at all it feels like scene takes place because disney movies have romance scenes secondly i dont believe simba nala are love look at how other disney films show love characters are smiling singing happy would do anything be with their romantic interest here simba nala are arguing yelling at each other after scene ill tell you what though if you look at nala as shes laying her back during song number look at how she looks at simba that says i want you lion man characters i am love with these characters much like beauty beast gang theres not person or animal this movie i dont dislike my two favorite characters are mufasa rafiki mufasa wreaks power reason we hate scar so much is because he kills mufasa who we love so much he is father disney movie fathers disney fathers period he says one my favorite lines look inside yourself simba you are more than what you have become oooh that line just oozes power just bleeds power rafiki is awesome because he is both funny wise he knows just what say just what do right moment he has funny lines like it means you are baboon i am not yet he knows when hit simba over head with stick tell him learn his mistakes go rafiki story i think story is excellent i love watching it i love watching simbas arc i think it is brilliant though theres one other problem movie has that lies story after mufasa dies simba cries over his body scar comes tells him run away question if theyre all alone why doesnt scar just kill simba himself at first i thought it was because he didnt want simbas blood his hands but that cant be right first all he has mufasas blood his hands second all he has violent fight with simba at end movie if scar wants throne so badly that he puts together attack against two children nazi team hyenas wildebeest stampede i dont think he was above killing child movie could have been over just like that why didnt he kill simba only reason i can come up with is if he killed him thered be no movie well thats weak if thats case then movie didnt need happen we should have gotten better reason following events that took place conclusion despite two problems i have with movie i still adore it its epic its dramatic its funny its musical it is large it has one saddest moments ever disney it is one studios biggest movies reason find out yourself big circle life booyika,0.5646929824561405,0.25825501253132827,Positive,"{'Happy': 0.22, 'Angry': 0.07, 'Surprise': 0.25, 'Sad': 0.21, 'Fear': 0.25}"
9.0,great film,"this was, and still is,a great movie I love it, and hope that everyone gets to experience it for themselves, I've watched it many times and it is always good no matter how many times you have seen it,the songs are great and so are all the characters and the story is incredible, great for all ages and I really recommend it to anyone who hasn't already watched it.",great film,this was still is great movie i love it hope that everyone gets experience it themselves ive watched it many times it is always good no matter how many times you have seen it songs are great so are all characters story is incredible great all ages i really recommend it anyone who hasnt already watched it,0.6300000000000001,0.65,Positive,"{'Happy': 0.4, 'Angry': 0.07, 'Surprise': 0.27, 'Sad': 0.07, 'Fear': 0.2}"
10.0,A Disney classic,"In the African savannah King Mufasa, a lion, rules over the Pride Lands. He explains to his son, a young cub named Simba, that one day he will be the king... but before that he has a lot to learn. There are dangers, even for lions. The greatest danger comes from Simba's Uncle Scar; an embittered lion with a Machiavellian streak. Scar wants to rule but to do that he needs to rid himself of Mufasa and Simba... he has plans. One day Scar's plan works; Mufasa is dead and Simba leaves the Pride Lands believing he is to blame for his father's death. He grows up learning to take things easy with new friends Pumbaa and Timon, a warthog and meerkat. Scar now rules the pride with the help of the hyenas. When Simba learns of how bad things have got in the Pride Lands he will have to decide whether to continue the easy life or fight to make things better.This film is definitely one of Disney's classics; it has a fine story, some great characters and catchy songs. Simba is a decent protagonist even if the plot demands that he isn't too strong early on and Scar is a great villain; as are his trio of hyena acolytes. Given the film's 'U' certificate I was surprised at how dark it is in places; some scenes might disturb younger viewers as characters are often in real danger. The voice cast is very impressive; notably Jeremy Irons, as Scar, James Earl Jones, as Mufasa, and Rowan Atkinson, as Zazu the hornbill who is Mufasa's majordomo. As one would expect from Disney the animation and character designs are all really good. Overall I'd definitely recommend this for all but the youngest children and adults alike.",disney classic,african savannah king mufasa lion rules over pride lands he explains his son young cub named simba that one day he will be king but before that he has lot learn there are dangers even lions greatest danger comes simbas uncle scar embittered lion with machiavellian streak scar wants rule but do that he needs rid himself mufasa simba he has plans one day scars plan works mufasa is dead simba leaves pride lands believing he is blame his fathers death he grows up learning take things easy with new friends pumbaa timon warthog meerkat scar now rules pride with help hyenas when simba learns how bad things have got pride lands he will have decide whether continue easy life or fight make things better this film is definitely one disneys classics it has fine story some great characters catchy songs simba is decent protagonist even if plot demands that he isnt too strong early scar is great villain as are his trio hyena acolytes given films u certificate i was surprised at how dark it is places some scenes might disturb younger viewers as characters are often real danger voice cast is very impressive notably jeremy irons as scar james earl jones as mufasa rowan atkinson as zazu hornbill who is mufasas majordomo as one would expect disney animation character designs are all really good overall id definitely recommend this all but youngest children adults alike,0.5094276094276095,0.26430976430976433,Positive,"{'Happy': 0.23, 'Angry': 0.02, 'Surprise': 0.18, 'Sad': 0.21, 'Fear': 0.37}"
9.0,An impressive animated movie.,"""The Lion King"" is and will always will be regarded as one of the better Disney movies. And it deserves that!First of all the movie looks visually splendid! The African land scape's are beautiful and so are the animations of the animals itself.What makes ""The Lion King"" such a special movie is the emotional dept the story has. The story plays a significant role in the movie and it has some good adult moments. The entire movie has a more of an adult feeling, unlike earlier made Disney's that mainly focused on only young children. Still there also is plenty to enjoy for the young ones, especially the characters Timon and Pumbaa shall be loved by them.The story is filled with symbolism and reference to mainly the communist regime.The voice cast is good, mainly of course thanks to James Earl Jones who has an amazing good deep voice. Also the three hyenas are voiced perfectly by Whoopi Goldberg, Cheech Marin and Jim Cummings. Jeremy Irons who voices the main villain Scar really brings his character to live and makes the movie even more worth watching.There are some typical Disney songs that are good. Also surprising good is the musical score itself composed by Hans Zimmer who also received an Oscar for it. His first and only one but hopefully not his last. Also Tim Rice and Elton John received an Oscar for the song "" Can You Feel the Love Tonight"" and were nominated for two other songs from this movie.A must see animated movie with some scene's and songs that you'll not easily forget.9/10http://bobafett1138.blogspot.com/",impressive animated movie,lion king is will always will be regarded as one better disney movies it deserves that first all movie looks visually splendid african land scapes are beautiful so are animations animals itself what makes lion king such special movie is emotional dept story has story plays significant role movie it has some good adult moments entire movie has more adult feeling unlike earlier made disneys that mainly focused only young children still there also is plenty enjoy young ones especially characters timon pumbaa shall be loved by them story is filled with symbolism reference mainly communist regime voice cast is good mainly course thanks james earl jones who has amazing good deep voice also three hyenas are voiced perfectly by whoopi goldberg cheech marin jim cummings jeremy irons who voices main villain scar really brings his character live makes movie even more worth watching there are some typical disney songs that are good also surprising good is musical score itself composed by hans zimmer who also received oscar it his first only one but hopefully not his last also tim rice elton john received oscar song can you feel love tonight were nominated two other songs this movie must see animated movie with some scenes songs that youll not easily forget 9 10,0.5415922619047621,0.3043786075036074,Positive,"{'Happy': 0.27, 'Angry': 0.04, 'Surprise': 0.2, 'Sad': 0.16, 'Fear': 0.33}"
10.0,Its a 10,"""The best movie I ever watched in any form or any in language"".No, I am not exaggerating! It is the best movie ever, whether in human form or in animated. I can't find a single flaw in The Lion King (1994). Someone could argue that the story is not original, Disney just twisted it. Someone could also argue that i didn't watch that much of movies to judge ""The Best Ever"" but as I said, this the best movie I ever saw. The story is nice and free flowing and without any unnecessary bumpers. One can not recognized the voices behind the characters, because the characters are so prominent. Music! Let me say I am not very fond of English pop songs, but I could hum almost most of the songs of this movie, so I would say, music is that nice. Animation is superb, landscapes are eye catching, dialogues are sharp and comedy is at its best. What more might I say?Beside everything, you can say how crazy I am about this movie by my name. Enjoy the movie, don't leave the seat. Hakuna Matata!",its 10,best movie i ever watched any form or any language no i am not exaggerating it is best movie ever whether human form or animated i cant find single flaw lion king 1994 someone could argue that story is not original disney just twisted it someone could also argue that i didnt watch that much movies judge best ever but as i said this best movie i ever saw story is nice free flowing without any unnecessary bumpers one can not recognized voices behind characters because characters are so prominent music let me say i am not very fond english pop songs but i could hum almost most songs this movie so i would say music is that nice animation is superb landscapes are eye catching dialogues are sharp comedy is at its best what more might i say beside everything you can say how crazy i am about this movie by my name enjoy movie dont leave seat hakuna matata,0.5805714285714286,0.31664285714285717,Positive,"{'Happy': 0.14, 'Angry': 0.08, 'Surprise': 0.5, 'Sad': 0.08, 'Fear': 0.19}"
8.0,Why the lion king is a near perfect viewing experience,"While the lion king isn't quite up there with some other movies, like the Incredibles and cars, the lion king is still great and so emotional. Mostly the scene of mufasa's death scene. Every single character is impactful. Simba is an amazing protagonist with a PERFECT arc, scar is PURE GENIUS as a antagonist. Timon and pumbaa are the single best comedic relief duo in Disney history, I'll talk about it more in reviews of movies that will require me to talk about them more. And every other character on the movie, the story and plot are like no other in any movie before or after this masterpiece. I could go on more, but I shouldn't because you know it's great, you all love it, it's the lion king.",why lion king is near perfect viewing experience,while lion king isnt quite up there with some other movies like incredibles cars lion king is still great so emotional mostly scene mufasas death scene every single character is impactful simba is amazing protagonist with perfect arc scar is pure genius as antagonist timon pumbaa are single best comedic relief duo disney history ill talk about it more reviews movies that will require me talk about them more every other character movie story plot are like no other any movie before or after this masterpiece i could go more but i shouldnt because you know its great you all love it its lion king,0.5701785714285714,0.3591964285714285,Positive,"{'Happy': 0.18, 'Angry': 0.0, 'Surprise': 0.24, 'Sad': 0.24, 'Fear': 0.35}"
