Rating,Review Title,Review,Cleaned Review Title,Cleaned Review,Subjectivity,Polarity,Sentiment,Emotion Scale
,The Deadbeat Lebowski,"How can anyone not dig The Dude? In a world where energetic go-getters are idolised and looked up to, it's nice to know that there are fat, indolent, scruffy, pot smoking, beer drinking bums out there taking it easy. Or they would be if people would leave their rugs alone The Big Lebowski is a film where the plot is entirely inconsequential; it doesn't matter. It's just a mere device to set The Dude on his way. The joy is in watching him interact with all the weirdos in Los Angeles and in listening to the dialogue  the script is the most quotable since Withnail and I. Therefore it's the perfect film to just sit back and absorb.Picking a favourite scene in a film that is jam packed with great moments and wonderful lines of dialogue is a near impossibility, but you'd be hard pressed to beat the scene with the Malibu police chief. ""I don't like your jerk-off name. I don't like your jerk-off face. I don't like your jerk-off behaviour. And I don't like youjerk-off."" And then to cap it off he throws his mug at The Dude's head. Brilliant! And making it even funnier is the scene that immediately follows it where the taxi driver throws The Dude out of his cab.But another favourite is Jesus. He only has two scenes but both are hilarious. (I hope the Coens make 'The Passion of the Jesus.') And I love the flashback where you see him knocking on doors to tell his neighbours that he's a pederast. Especially good is the way that a large, bearded man with a dirty shirt answers the door (I always crack up at the breath Jesus takes when he sees the man  I also noticed, for the first time, that Jesus in that flashback is visibly showing in his tight jeans; he's not a small guy).But then there's the scene where The Dude first meets Maude Lebowski (excellently played by Julianne Moore). ""I'm sorry if your stepmother is a nympho, but"" And I also like the little dig at the porno film they're watching: ""The plot is ludicrous."" But the comment isn't really aimed at the porno film; the film is talking about itself. It knows the plot is nonsensical but it also knows that it doesn't matter  it's best to just let it wash over you.Mentioning porno has reminded me of Jackie Treehorn. Is there a better visual gag in modern cinema than The Dude scratching a notepad for a message or telephone number only to find a cartoon of a man with a gigantic erection? Well, maybe there is, because even earlier in the film there's the moment where The Dude spends a long time making a homemade device to keep intruders out only for him to forget the fact that his door opens outwards instead of inwards  he nails a bit of wood to the floor, props a chair up to the door handle to keep people out and the very second he walks away, the door opens and the chair comes tumbling down. Pure genius! And Jackie Treehorn's brainless goons are brilliant too. ""You're not dealing with morons here."" Oh yes we are. But the film's all the better for it.But I'm not sure what my favourite line in the film would be  again it's almost impossible to pick just one. But ""I still jerk-off manually"" would have to be up there, as would virtually every line Walter spews (""The Chinaman is not the issue""). However, if I was forced (at gunpoint) to choose, I'd have to go with a piece of Dude wisdom: ""Fortunately, I'm adhering to a pretty strict, uh, drug regiment to keep my mind, you know, uh, limber."" And The Dude's reaction when Maude tells him that she's trying to conceive is magnificent.Yet another brilliant scene is the Larry scene. Walter and The Dude are trying to get information out of some kid but the kid just stares impassively at them, so Walter destroys his car  or what he thinks is his car. Now at this moment I could quote the real dialogue, but the TV version dialogue is perhaps even better. ""Do you see what happens, Larry? Do you see what happens when you find a stranger in the Alps?"" It's even better than: ""Fun you, melon farmer!"" Then there are the nihilists. ""We believe in nothing, Lebowski. Nothing. And tomorrow we come back and we cut off your johnson."" But try as they might to intimidate, the only scary thing about the nihilists is the techno music they listen to. Well, that and their obsession with the male member.But I could quote lines from The Big Lewbowski all day. I just dig the film so much because it puts a goofy grin on my face; its stupidity is remarkably intelligent. Plus, in the end, it's actually quite heartfelt  if the film's about anything, it's about friendshipwell, that and smoking pot, drinking beer, bowling and keeping hold of your johnson. Yeah, the world's a better place with The Dude in it.",deadbeat lebowski,how can anyone not dig dude world where energetic go getters are idolised looked up its nice know that there are fat indolent scruffy pot smoking beer drinking bums out there taking it easy or they would be if people would leave their rugs alone big lebowski is film where plot is entirely inconsequential it doesnt matter its just mere device set dude his way joy is watching him interact with all weirdos los angeles listening dialogue script is most quotable since withnail i therefore its perfect film just sit back absorb picking favourite scene film that is jam packed with great moments wonderful lines dialogue is near impossibility but youd be hard pressed beat scene with malibu police chief i dont like your jerk off name i dont like your jerk off face i dont like your jerk off behaviour i dont like you jerk off then cap it off he throws his mug at dudes head brilliant making it even funnier is scene that immediately follows it where taxi driver throws dude out his cab but another favourite is jesus he only has two scenes but both are hilarious i hope coens make passion jesus i love flashback where you see him knocking doors tell his neighbours that hes pederast especially good is way that large bearded man with dirty shirt answers door i always crack up at breath jesus takes when he sees man i also noticed first time that jesus that flashback is visibly showing his tight jeans hes not small guy but then theres scene where dude first meets maude lebowski excellently played by julianne moore im sorry if your stepmother is nympho but i also like little dig at porno film theyre watching plot is ludicrous but comment isnt really aimed at porno film film is talking about itself it knows plot is nonsensical but it also knows that it doesnt matter its best just let it wash over you mentioning porno has reminded me jackie treehorn is there better visual gag modern cinema than dude scratching notepad message or telephone number only find cartoon man with gigantic erection well maybe there is because even earlier film theres moment where dude spends long time making homemade device keep intruders out only him forget fact that his door opens outwards instead inwards he nails bit wood floor props chair up door handle keep people out very second he walks away door opens chair comes tumbling down pure genius jackie treehorns brainless goons are brilliant too youre not dealing with morons here oh yes we are but films all better it but im not sure what my favourite line film would be again its almost impossible pick just one but i still jerk off manually would have be up there as would virtually every line walter spews chinaman is not issue however if i was forced at gunpoint choose id have go with piece dude wisdom fortunately im adhering pretty strict uh drug regiment keep my mind you know uh limber dudes reaction when maude tells him that shes trying conceive is magnificent yet another brilliant scene is larry scene walter dude are trying get information out some kid but kid just stares impassively at them so walter destroys his car or what he thinks is his car now at this moment i could quote real dialogue but tv version dialogue is perhaps even better do you see what happens larry do you see what happens when you find stranger alps its even better than fun you melon farmer then there are nihilists we believe nothing lebowski nothing tomorrow we come back we cut off your johnson but try as they might intimidate only scary thing about nihilists is techno music they listen well that their obsession with male member but i could quote lines big lewbowski all day i just dig film so much because it puts goofy grin my face its stupidity is remarkably intelligent plus end its actually quite heartfelt if films about anything its about friendship well that smoking pot drinking beer bowling keeping hold your johnson yeah worlds better place with dude it,0.5986377635631368,0.20980514096185734,Positive,"{'Happy': 0.18, 'Angry': 0.1, 'Surprise': 0.27, 'Sad': 0.14, 'Fear': 0.31}"
4.0,I just don't get it.,"TBL is not a terrible movie, but I apparently just don't get it. My lady-friend's daughter is always telling her that she should see TBL in order to understand some of the ""in-humor"" and comments of her generation. I kept telling my friend that I really didn't think that the movie would be what she expected, but we watched it together anyway. (I had already seen it a couple times.) My friend was flabbergasted, as she couldn't identify any phrases, humorous scenes, or references that she had ever heard or seen her daughter's group use. She didn't like the movie, either, and was actually checking to make sure that it was the same movie her daughter had recommended.I feel the same way. Frankly, this movie is boring and pretentious. I love most of the Coens' work, but not this film. It goes into a category, along with ""Young Frankenstein"", of movies about which other people make a fuss and I just don't get. Maybe I'm slow.Anyway, if your idea of fun is watching a laid-back dude drink White Russians and a lot of unnecessary one-dimensional characters get layered on, go ahead. It's just not my cup of tea.",i just dont get it,tbl is not terrible movie but i apparently just dont get it my lady friends daughter is always telling her that she should see tbl order understand some humor comments her generation i kept telling my friend that i really didnt think that movie would be what she expected but we watched it together anyway i had already seen it couple times my friend was flabbergasted as she couldnt identify any phrases humorous scenes or references that she had ever heard or seen her daughters group use she didnt like movie either was actually checking make sure that it was same movie her daughter had recommended i feel same way frankly this movie is boring pretentious i love most coens work but not this film it goes into category along with young frankenstein movies about which other people make fuss i just dont get maybe im slow anyway if your idea fun is watching laid back dude drink white russians lot unnecessary one dimensional characters get layered go ahead its just not my cup tea,0.46319444444444446,0.04625,Positive,"{'Happy': 0.24, 'Angry': 0.0, 'Surprise': 0.21, 'Sad': 0.27, 'Fear': 0.27}"
2.0,The Big Bust,"I recently saw an interview with Jeff Bridges where he commented that he has become personally identified with ""The Dude,"" the character he plays in this movie. He also noted that ""The Big Lebowski"" has developed a cult following. The interviewer added some praise. That, together with the high rating on IMDb, convinced me to give this a shot. Early on I realized that the story was not to be taken seriously. This movie is a series of loosely connected comedy sketches (well, some hardly connected at all). The result is an absurdest comedy that had very few laughs for me.I did not find The Dude at all appealing as a person. How much is there to admire in someone whose life goals seem to be bowling and drinking white Russians? I do give Bridges credit for inhabiting the role. John Goodman's character really grated on me--his passions seem to be bowling and the f word. The positives: the scenes with John Turturro gave me some laughs; the scenes filmed from within a bowling ball were an interesting curiosity; some non sequiturs were worth a few chuckles.I guess one person's humor is another person's tedium. I found this movie to be tedious.",big bust,i recently saw interview with jeff bridges where he commented that he has become personally identified with dude character he plays this movie he also noted that big lebowski has developed cult following interviewer added some praise that together with high rating imdb convinced me give this shot early i realized that story was not be taken seriously this movie is series loosely connected comedy sketches well some hardly connected at all result is absurdest comedy that had very few laughs me i did not find dude at all appealing as person how much is there admire someone whose life goals seem be bowling drinking white russians i do give bridges credit inhabiting role john goodmans character really grated me his passions seem be bowling f word positives scenes with john turturro gave me some laughs scenes filmed within bowling ball were interesting curiosity some non sequiturs were worth few chuckles i guess one persons humor is another persons tedium i found this movie be tedious,0.3098782051282051,0.01990384615384615,Positive,"{'Happy': 0.07, 'Angry': 0.1, 'Surprise': 0.27, 'Sad': 0.1, 'Fear': 0.47}"
2.0,I don't understand why this is loved by so many!,"This movie is truly awful! It's supposed to be some legendary comedy, but it IS NOT funny! This movie is just really weird and stupid. Literally nothing makes sense in it, i hate every character except Julianne Moore's. The dude is so stupid and annoying, and so is John Goodman! I was struggling to understand what in the world the plot was about, and i never laughed, not once! This movie's ONLY saving grace was Julianne Moore, she actually did a good job, and i liked her character, but everything else....nope! 2/10. Save your time for a much better comedy, and just movie in general, such as Plains trains and automobiles, or a million other better ones!",i dont understand why this is loved by so many,this movie is truly awful its supposed be some legendary comedy but it is not funny this movie is just really weird stupid literally nothing makes sense it i hate every character except julianne moores dude is so stupid annoying so is john goodman i was struggling understand what world plot was about i never laughed not once this movies only saving grace was julianne moore she actually did good job i liked her character but everything else nope 2 10 save your time much better comedy just movie general such as plains trains automobiles or million other better ones,0.70875,-0.03750000000000001,Negative,"{'Happy': 0.11, 'Angry': 0.06, 'Surprise': 0.22, 'Sad': 0.28, 'Fear': 0.33}"
9.0,A wonderful film...with the word f#@$ used 102030841 times!,"I tried watching this film on TV a few years ago, but I made the mistake of doing so with my kids nearby. In the first 10 minutes of so, I heard 'f#@$' (a word you are NOT allowed to use even once on IMDb) dozens of times. Realizing that the film was NOT family-friendly, I turned it off despite all the very positive reviews I'd read for it. However, considering I've seen all the Coen Brothers films except this one, I knew that eventually I'd get back to seeing it. Nearly a decade has passed, and I finally got around to seeing this cult favorite.Considering that there are nearing 1000 reviews for this film, I won't bother discussing the plot--it's been explained to death. Besides, the plot, believe it or not, is not all that important. As a mystery film, the mystery is figured out early in the film. So, despite this, why is the film so good--good enough that I gave it a 9 and many consider it their favorite film ever? Well, the Coen Brothers' bizarre and surreal style really make this film and off the top of my head I can only think of two of their films I liked better, THE HUDSUCKER PROXY (their most underrated film) and OH BROTHER, WHERE ART THOU? (their film that gets better with each viewing). This is very good company, as these two other films are absolutely brilliant--and I consider THE BIG LEBOWSKI to be much more interesting that the much ballyhooed FARGO (which, inexplicably, won two Oscars--despite not being among the brothers' best films because it's way too normal--sort of like a Coen Brothers film for those who don't get the more bizarre Coen Brothers films).What, in particular, did I like? Well, the characters were THE best part of the film--as only the Coens can create such quirky and unique characters. Simply put, there is no one like Lebowski in any of the thousands and thousands of films I'd seen before--and uniqueness is something I value most in a film. The alcoholic, lazy and hopelessly pathetic guy is like no hero you'll ever see in a film! The usual quirky characters are here as well--in spades! What I also loved were the little movies within the movie. When Lebowski got knocked out, you got to see his bizarre dreams that were more like films than dreams--particularly the one later in the film that just killed me it was so funny and stylish. Believe it or not, the dream is a phallic-filled song and dance film...directed by a famous porno director (though without actual nudity). It just has to be seen to be believed and only HUDSUCKER PROXY had stranger and more entertaining interludes. In fact, I found myself laughing out loud at this great scene...and a few more.Overall, a highly imaginative and wonderfully quirky film with very little plot and gobs of cursing. NOT family-friendly or a film to show your mother (unless you DO want to give her a heart attack), but still well worth seeing. Oh, and by the way, the version often shown on TV recently is an edited version with many of the expletives removed. The original actors provided alternative words for the f-bomb and it's done reasonably seamlessly. Frankly, I don't think it hurts the film and you still get to hear words like penis which have not been changed.",wonderful film with word f used 102030841 times,i tried watching this film tv few years ago but i made mistake doing so with my kids nearby first 10 minutes so i heard f word you are not allowed use even once imdb dozens times realizing that film was not family friendly i turned it off despite all very positive reviews id read it however considering ive seen all coen brothers films except this one i knew that eventually id get back seeing it nearly decade has passed i finally got around seeing this cult favorite considering that there are nearing 1000 reviews this film i wont bother discussing plot its been explained death besides plot believe it or not is not all that important as mystery film mystery is figured out early film so despite this why is film so good good enough that i gave it 9 many consider it their favorite film ever well coen brothers bizarre surreal style really make this film off top my head i can only think two their films i liked better hudsucker proxy their most underrated film oh brother where art thou their film that gets better with each viewing this is very good company as these two other films are absolutely brilliant i consider big lebowski be much more interesting that much ballyhooed fargo which inexplicably won two oscars despite not being among brothers best films because its way too normal sort like coen brothers film those who dont get more bizarre coen brothers films what particular did i like well characters were best part film as only coens can create such quirky unique characters simply put there is no one like lebowski any thousands thousands films id seen before uniqueness is something i value most film alcoholic lazy hopelessly pathetic guy is like no hero youll ever see film usual quirky characters are here as well spades what i also loved were little movies within movie when lebowski got knocked out you got see his bizarre dreams that were more like films than dreams particularly one later film that just killed me it was so funny stylish believe it or not dream is phallic filled song dance film directed by famous porno director though without actual nudity it just has be seen be believed only hudsucker proxy had stranger more entertaining interludes fact i found myself laughing out loud at this great scene few more overall highly imaginative wonderfully quirky film with very little plot gobs cursing not family friendly or film show your mother unless you do want give her heart attack but still well worth seeing oh by way version often shown tv recently is edited version with many expletives removed original actors provided alternative words f bomb its done reasonably seamlessly frankly i dont think it hurts film you still get hear words like penis which have not been changed,0.5812814400789086,0.2599055427694669,Positive,"{'Happy': 0.18, 'Angry': 0.09, 'Surprise': 0.37, 'Sad': 0.17, 'Fear': 0.18}"
