Rating,Review Title,Review,Cleaned Review Title,Cleaned Review,Subjectivity,Polarity,Sentiment,Emotion Scale
7.0,Tongue-in-cheek Gore Horror,"7.5 of 10. Picking up where the other 2 films left off, but not as a literal sequel. There's an unexpected side-step as the filmmaker decides to both make a new centipede film and change the setting and plot. This is definitely more over-the-top and humorous than the straight out gore and psychological horror of the other 2.In the end, that makes it a smarter, more enjoyable film for those looking for more than a film testing their ability to watch through the most painful, gruesome, and disgusting scenes.Tom Six steps out from behind the pen and camera to become an active character in this film to both openly acknowledge his fame and to create a sense that this is actually happening. Like the other films, the ending definitely isn't happy. It is, however, consistent with the earlier films and bizarre enough that it should please those seeking the horror/gore originality that probably got them to watch it initially.",tongue cheek gore horror,7 5 10 picking up where other 2 films left off but not as literal sequel theres unexpected side step as filmmaker decides both make new centipede film change setting plot this is definitely more over top humorous than straight out gore psychological horror other 2 end that makes it smarter more enjoyable film those looking more than film testing their ability watch through most painful gruesome disgusting scenes tom six steps out behind pen camera become active character this film both openly acknowledge his fame create sense that this is actually happening like other films ending definitely isnt happy it is however consistent with earlier films bizarre enough that it should please those seeking horror gore originality that probably got them watch it initially,0.5286050156739811,0.061311389759665616,Positive,"{'Happy': 0.15, 'Angry': 0.0, 'Surprise': 0.35, 'Sad': 0.23, 'Fear': 0.27}"
2.0,Anticlimactic,"I was genuinely expecting more of the same. A horrific and disturbing body modification style horror but I actually found myself becoming bored with the incessant and insipid screaming of Dieter Laser and the profoundly bad acting of Laurence Harvey.The First two movies were polemical and somewhat uncomfortable to watch. They were disturbing and, in many ways, were unique.This final installment was just annoying to watch. It did not shock and the actual, 'centipede' part didn't even happen until very late in the movie.This movie was a massive let down and the radical departure from the stylistic form of the first two movies ruined it in my eyes.Let us hope this really is the last sequence.",anticlimactic,i was genuinely expecting more same horrific disturbing body modification style horror but i actually found myself becoming bored with incessant insipid screaming dieter laser profoundly bad acting laurence harvey first two movies were polemical somewhat uncomfortable watch they were disturbing many ways were unique this final installment was just annoying watch it did not shock actual centipede part didnt even happen until very late movie this movie was massive let down radical departure stylistic form first two movies ruined it my eyes let us hope this really is last sequence,0.5932125603864735,-0.10089371980676326,Negative,"{'Happy': 0.05, 'Angry': 0.0, 'Surprise': 0.5, 'Sad': 0.36, 'Fear': 0.09}"
5.0,The Human Centipede III (Final Sequence),"Razzie nominated director Tom Six, who apparently worked on the Dutch version of Big Brother, where it first began, completes his highly controversial trilogy with this climax that brings both the original and sequel into play, including the stars of them, and turns the shock factor up another notch. Basically psychotic prison warden William ""Bill"" Boss (First Sequence's Dieter Laser) watches The Human Centipede 2 (Full Sequence) with his accountant Dwight Butler (Full Sequence's Laurence R. Harvey), Bill says he hates the films, he enjoys sexually assaulting his assistant Daisy (porn star Bree Olson), to the dismay of Dwight watching, who tries to pitch a ""brilliant idea"", before being interrupted. Bill and Dwight are summoned to the prison to look at the aftermath of an assault that occurred, an officer was stabbed by an inmate, Bill punishes the prisoner, Inmate 178 (The Fifth Element's Tommy 'Tiny' Lister), by snapping his arm, exposing his bone and causing immense pain, Bill hurls several racist slurs at him, and promises to do this again when his bones heal. In the Warden's office, Bill receives his package, specially imported dried African clitorises, which he eats 'for strength', next Bill waterboards Native American prisoner, Inmate 346 (Jay Tavare), disfiguring him with boiling water. Governor Hughes (The Dark Knight's Eric Roberts) threatens to fire Bill and Dwight if they do not clean up their acts, desperate to gain respect Bill orders all prisoners are castrated, he graphically castrates a prisoner, Inmate 297 (Robert LaSardo), himself. Bill next eats the prisoner's cooked testicles for lunch, Daisy is forced to give him fellatio, while Dwight watches and angrily stamps his papers in the corner, after she swallows he offers her something to take away the taste, she eats one of the dried clitorises, mistaking it for candy. Dwight is finally able to pitch his ""brilliant idea"", he suggests all prisoners should be surgically connected, mouth to anus, forming giant human centipede, saying it will save them money, and it will be the ultimate deterrent for anyone considering a life of crime. Bill initially opposes the idea, because of his hatred of The Human Centipede films, dismissing the idea as impossible, and claiming the films director Tom Six has a fetish for feces, after a drunken argument with Dwight, Bill has a nightmare of the prisoner he castrated raping him in the kidney. The director himself, Tom Six, is summoned to the prison, Bill is warming to Dwight's idea, Six confirms that it is ""100% medically accurate"", Six gives permission to use his Centipede idea, but he wants to witness the operation. The first two Human Centipede films are screened to the prisoners in the prison canteen, showing them what is going to happen, a riot breaks out, several guards are injured, the prisoners spread, trapping Bill and Dwight in the Warden's office, one inmate beats Daisy into a coma and another masturbates watching, backup arrives and manage to herd the prisoners back to their cells. Bill readies all prisoners, going to each cell and shooting all inmates with tranquilisers, but some prisoners are not compatible for the centipede, one prisoner has a stoma, and one prisoner is disabled, Bill kills them both. They also discover a prisoner has Crohn's disease, causing constant diarrhoea, Bill orders the prisoner he castrated and raped him in his dream is attached to him as further punishment, Bill and Dwight visit Daisy who is in a coma, Dwight tells Bill he loves her, Bill ignores his protests and rapes Daisy's motionless body. Tom Six returns and is met by Bill and Dwight, touring the cells the trio discover a mentally unstable prisoner eating his own feces, wanting to be sewn into the centipede, not wanting anyone to enjoy the centipede punishment Bill kills the prisoner, they next observe the operation going ahead, including the death row inmates being dismembered for a ""special project"", Six vomits seeing this. The five-hundred person human centipede is complete, Governor Hughes arrives and is disgusted by what he sees, not only a Human Centipede has been created, but also a Human Caterpillar, made up of prisoners serving life sentences, with all limbs removed, meaning they cannot move, also Daisy has accidentally been sewn into the Centipede, Bill and Dwight detail the saving of money for tax payers and other benefits from it, but Hughes concludes they are insane and should get the death penalty, before leaving in abhorrence. Bill murders Dr. Jones (Clayton Rohner) in anger, then Hughes returns to the prison and has had a change of heart, he claims the Centipede punishment is ""just what America needs"", the end sees Bill and Dwight celebrate their success, but Bill shoots Dwight for trying to take credit for the idea, even though it was his idea in the first place, and Bill is seen naked dancing and screaming from the watchtower over the prison centipede. Also starring First Sequence's Akihiro Kitamura as Inmate 333, Bill Hutchens as Inmate 488 and Carlos Ramirez (identical twin brother of Efren from Napoleon Dynamite) as Inmate 109. The casting of stars from the previous two films as actually a clever idea, Laser is fantastically exaggerated and sadistic, while Harvey is amusingly eccentric and authoritative, the appearances of Roberts, Olson, Lister and even the film's own director Six add a little something as well. I questioned if this final film in the trilogy would have as many cuts by the BBFC (British Board of Film Classification) as the second film did, it certainly doesn't hold back on the violence, body mutilation or other disgusting things going on, you could argue that some of it is done for comedic value, depending on your opinion of the series, certainly not to be watched if your squeamish, and it satirises politics, racism and sexism, I admit it's no quite as good as the previous two, but it's not a bad satirical horror. It was nominated the Razzie for Worst Remake, Rip-Off or Sequel. Worth watching!",human centipede iii final sequence,razzie nominated director tom six who apparently worked dutch version big brother where it first began completes his highly controversial trilogy with this climax that brings both original sequel into play including stars them turns shock factor up another notch basically psychotic prison warden william bill boss first sequences dieter laser watches human centipede 2 full sequence with his accountant dwight butler full sequences laurence r harvey bill says he hates films he enjoys sexually assaulting his assistant daisy porn star bree olson dismay dwight watching who tries pitch brilliant idea before being interrupted bill dwight are summoned prison look at aftermath assault that occurred officer was stabbed by inmate bill punishes prisoner inmate 178 fifth elements tommy tiny lister by snapping his arm exposing his bone causing immense pain bill hurls several racist slurs at him promises do this again when his bones heal wardens office bill receives his package specially imported dried african clitorises which he eats strength next bill waterboards native american prisoner inmate 346 jay tavare disfiguring him with boiling water governor hughes dark knights eric roberts threatens fire bill dwight if they do not clean up their acts desperate gain respect bill orders all prisoners are castrated he graphically castrates prisoner inmate 297 robert lasardo himself bill next eats prisoners cooked testicles lunch daisy is forced give him fellatio while dwight watches angrily stamps his papers corner after she swallows he offers her something take away taste she eats one dried clitorises mistaking it candy dwight is finally able pitch his brilliant idea he suggests all prisoners should be surgically connected mouth anus forming giant human centipede saying it will save them money it will be ultimate deterrent anyone considering life crime bill initially opposes idea because his hatred human centipede films dismissing idea as impossible claiming films director tom six has fetish feces after drunken argument with dwight bill has nightmare prisoner he castrated raping him kidney director himself tom six is summoned prison bill is warming dwights idea six confirms that it is 100 medically accurate six gives permission use his centipede idea but he wants witness operation first two human centipede films are screened prisoners prison canteen showing them what is going happen riot breaks out several guards are injured prisoners spread trapping bill dwight wardens office one inmate beats daisy into coma another masturbates watching backup arrives manage herd prisoners back their cells bill readies all prisoners going each cell shooting all inmates with tranquilisers but some prisoners are not compatible centipede one prisoner has stoma one prisoner is disabled bill kills them both they also discover prisoner has crohns disease causing constant diarrhoea bill orders prisoner he castrated raped him his dream is attached him as further punishment bill dwight visit daisy who is coma dwight tells bill he loves her bill ignores his protests rapes daisys motionless body tom six returns is met by bill dwight touring cells trio discover mentally unstable prisoner eating his own feces wanting be sewn into centipede not wanting anyone enjoy centipede punishment bill kills prisoner they next observe operation going ahead including death row inmates being dismembered special project six vomits seeing this five hundred person human centipede is complete governor hughes arrives is disgusted by what he sees not only human centipede has been created but also human caterpillar made up prisoners serving life sentences with all limbs removed meaning they cannot move also daisy has accidentally been sewn into centipede bill dwight detail saving money tax payers other benefits it but hughes concludes they are insane should get death penalty before leaving abhorrence bill murders dr jones clayton rohner anger then hughes returns prison has had change heart he claims centipede punishment is just what america needs end sees bill dwight celebrate their success but bill shoots dwight trying take credit idea even though it was his idea first place bill is seen naked dancing screaming watchtower over prison centipede also starring first sequences akihiro kitamura as inmate 333 bill hutchens as inmate 488 carlos ramirez identical twin brother efren napoleon dynamite as inmate 109 casting stars previous two films as actually clever idea laser is fantastically exaggerated sadistic while harvey is amusingly eccentric authoritative appearances roberts olson lister even films own director six add little something as well i questioned if this final film trilogy would have as many cuts by bbfc british board film classification as second film did it certainly doesnt hold back violence body mutilation or other disgusting things going you could argue that some it is done comedic value depending your opinion series certainly not be watched if your squeamish it satirises politics racism sexism i admit its no quite as good as previous two but its not bad satirical horror it was nominated razzie worst remake rip off or sequel worth watching,0.4619181380417335,0.019014178705189944,Positive,"{'Happy': 0.1, 'Angry': 0.02, 'Surprise': 0.35, 'Sad': 0.2, 'Fear': 0.33}"
8.0,Six manages to ramp it up again,"The original 'Human Centipede' was a brilliant idea for a film. The trailer alone was truly shocking and made any horror/gore fan adamant that they had to see it. The idea alone was enough to carry the film and the results were indeed brilliant and shocking. Then there came the problem that writer/director Tom Six wanted a sequel, in fact a couple of them. The idea alone was no longer going to be shocking enough to carry them. He had to up the ante. And that's exactly what he did with 'The Human Centipede II (Full Sequence)'. In fact he upped it possibly more than he needed to. It truly was an incredibly shocking film, with one scene in particular really standing out in my memory. The only problem was that made upping the ante again for part three even tougher. Did he manage it? All I can say is he gave it a hell of a try.The movie really is carried by the lead character of Bill Boss, played by Dieter Laser who also starred in the original. In what must have been an exhausting performance to pull off, he is simply going full throttle from scene one to the dying seconds of the film. He gives it his all and he pulls it off. The character is captivating to watch and wonder what he is going to do next. Laurence R. Harvey, the star of part two, also returns in a little more toned down role this time, as do some other actors in smaller parts. In fact even Tom Six himself makes an appearance this time around.It goes without saying that this film won't be for everyone, however I absolutely loved it. A number of scenes are again truly shocking and the overall plot of the film is nothing short of fascinating. It's far from highbrow, Oscar winning cinema, but then it never sets out to be anything of the sorts. It's there to entertain its audience and that it does in spades.",six manages ramp it up again,original human centipede was brilliant idea film trailer alone was truly shocking made any horror gore fan adamant that they had see it idea alone was enough carry film results were indeed brilliant shocking then there came problem that writer director tom six wanted sequel fact couple them idea alone was no longer going be shocking enough carry them he had up ante thats exactly what he did with human centipede ii full sequence fact he upped it possibly more than he needed it truly was incredibly shocking film with one scene particular really standing out my memory only problem was that made upping ante again part three even tougher did he manage it all i can say is he gave it hell try movie really is carried by lead character bill boss played by dieter laser who also starred original what must have been exhausting performance pull off he is simply going full throttle scene one dying seconds film he gives it his all he pulls it off character is captivating watch wonder what he is going do next laurence r harvey star part two also returns little more toned down role this time as do some other actors smaller parts fact even tom six himself makes appearance this time around it goes without saying that this film wont be everyone however i absolutely loved it number scenes are again truly shocking overall plot film is nothing short fascinating its far highbrow oscar winning cinema but then it never sets out be anything sorts its there entertain its audience that it does spades,0.5866044616044617,0.048611111111111105,Positive,"{'Happy': 0.08, 'Angry': 0.04, 'Surprise': 0.31, 'Sad': 0.15, 'Fear': 0.42}"
2.0,Migraine inducing boredom,"The standard for torture porn isn't exactly high but it isn't so low that you can substitute being a passable well made film with torturing the viewer with boredom, which this final installment does. The first two at least had some kind of passable narrative and were decently shot and edited. This on the other hand can't get the basics right. The acting is god awful. Its worse than just being flat because the main character, governor Hughes, yells out every damn line he has. Even after this it still somehow has the problem of NOT BEING ABLE TO HEAR/UNDERSTAND WHAT THEY ARE SAYING. The audio is pretty poor. The dialogue at times is muffled by the soundtrack, which is pretty pathetic. How long is the film? 2hrs and 20 minutes! If you are going to make a piece of crap then at least make it 1hr and 30 max. So what about the ""plot""? Governor Hughes is shown the first two films first thing in the film. You would think that the main character, Hughes, a over the top Texan loudmouth psychopath who abuses his prisoners, would get the idea that he has been shown the film because his accountant wants to do it for real. Nope. Instead we have a long drawn out tour of the prison. There is though a decent message to the film about the state of prison abuse and the contempt of the Americans to actually care. Sadly it beats you over the head with it in the final 20 minutes of the film. As for the gore there are two decent scenes. There is a waterboarding with boiling water and a mutilation. I would not watch the film just to see those scenes simply because it is surrounded by 2 hrs of yelling and boredom. Human Centipede is a sad, and surprisingly tame and boring, end to the series.",migraine inducing boredom,standard torture porn isnt exactly high but it isnt so low that you can substitute being passable well made film with torturing viewer with boredom which this final installment does first two at least had some kind passable narrative were decently shot edited this other hand cant get basics right acting is god awful its worse than just being flat because main character governor hughes yells out every damn line he has even after this it still somehow has problem not being able hear understand what they are saying audio is pretty poor dialogue at times is muffled by soundtrack which is pretty pathetic how long is film 2hrs 20 minutes if you are going make piece crap then at least make it 1hr 30 max so what about plot governor hughes is shown first two films first thing film you would think that main character hughes over top texan loudmouth psychopath who abuses his prisoners would get idea that he has been shown film because his accountant wants do it real nope instead we have long drawn out tour prison there is though decent message film about state prison abuse contempt americans actually care sadly it beats you over head with it final 20 minutes film as gore there are two decent scenes there is waterboarding with boiling water mutilation i would not watch film just see those scenes simply because it is surrounded by 2 hrs yelling boredom human centipede is sad surprisingly tame boring end series,0.533529761904762,-0.05344047619047619,Negative,"{'Happy': 0.05, 'Angry': 0.0, 'Surprise': 0.35, 'Sad': 0.25, 'Fear': 0.35}"
4.0,The taste will never leave your mouth // instagram: moviesmaniax,"""The taste will never leave your mouth"", don't eat anything while you watch this, you have been warned. This was one of my anticipated horror films of 2015 and I must say I was really disappointed. With the film's big premise and ambition, it turns out to be ultimately dull throughout with little entertainment here. The film is filled with perversely sick moments, immaturely psychotic performance, and shocking GORES that's intended to make you puke and gross you out instead of making a gleefully enjoyable one to watch. One of the main problems here is the performance of Dieter Laser which make him looks like Marlon Wayans going pull psycho which is amusing to watch for like 5 minutes and the rest is just childishly annoying and just dull, making the film laughable and looks like a parody of itself. Another problem is how the story drags out and we have to sit through the whole psychotically dull act and vulgarly racist dialogue before the final sequences happen which is nothing that surprising since most of them are already shown in the trailer. Overall, The Final Sequence is crude, vulgar, perversely sick, over-the-top in its violence and chessily insane performance, yet still ends up too dull to enjoy even for the fans of the genre.>>C-<<",taste will never leave your mouth instagram moviesmaniax,taste will never leave your mouth dont eat anything while you watch this you have been warned this was one my anticipated horror films 2015 i must say i was really disappointed with films big premise ambition it turns out be ultimately dull throughout with little entertainment here film is filled with perversely sick moments immaturely psychotic performance shocking gores thats intended make you puke gross you out instead making gleefully enjoyable one watch one main problems here is performance dieter laser which make him looks like marlon wayans going pull psycho which is amusing watch like 5 minutes rest is just childishly annoying just dull making film laughable looks like parody itself another problem is how story drags out we have sit through whole psychotically dull act vulgarly racist dialogue before final sequences happen which is nothing that surprising since most them are already shown trailer overall final sequence is crude vulgar perversely sick over top its violence chessily insane performance yet still ends up too dull enjoy even fans genre c,0.6599206349206349,-0.18220238095238095,Negative,"{'Happy': 0.13, 'Angry': 0.0, 'Surprise': 0.24, 'Sad': 0.33, 'Fear': 0.29}"
1.0,"Biggest s*** I've ever watched, and I've seen many","Let me be clear, I rated this movie with a 1 because 0 is not available.I actually liked (well, it had some good parts) the first one, and thought the second was terrible, but this final sequence was absolutely stupid, boring and lacked everything a normal and even a bad movie should have: SOMETHING INTERESTING.Seriously, I've watched several stupid movies full of sharks, octopuses and all that s*** and I've never seen a movie so stupid as this one.PS: Kudos to Tom Six for being capable of making both disgusting but interesting movies and also terrible and completely stupid movies. He sure has a gift. A stupid one, but still a gift.",biggest s ive ever watched ive seen many,let me be clear i rated this movie with 1 because 0 is not available i actually liked well it had some good parts first one thought second was terrible but this final sequence was absolutely stupid boring lacked everything normal even bad movie should have something interesting seriously ive watched several stupid movies full sharks octopuses all that s ive never seen movie so stupid as this one ps kudos tom six being capable making both disgusting but interesting movies also terrible completely stupid movies he sure has gift stupid one but still gift,0.6861111111111111,-0.1878205128205128,Negative,"{'Happy': 0.14, 'Angry': 0.0, 'Surprise': 0.27, 'Sad': 0.32, 'Fear': 0.27}"
