Rating,Review Title,Review,Cleaned Review Title,Cleaned Review,Subjectivity,Polarity,Sentiment,Emotion Scale
10.0,"Absolutely impeccable, great film!","I agree with SanFava. I am a follower of Campanella's and Darin. I have seen all previous three films. However, this one surpasses them all!. This is a great script, top-notch acting by everyone, partly thanks to the excellent casting. Superb cinematography. The film basically explores what ""passion"" is to the human being. A great passion (on various areas) is involved in almost all characters. You have suspense, a clever detective story, some surprising twists, etc. Darin has an ""aura"" (paraphrasing the the title of the film he worked in, ""The Aura"") that illuminates the whole screen. His presence is as powerful in the screen as that of Gene Hackman, Pacino, DeNiro or Hoffman (the top, great ones). I sincerely hope this movie gets his due awards (Oscar included), because it deserves so!).",absolutely impeccable great film,i agree with sanfava i am follower campanellas darin i have seen all previous three films however this one surpasses them all this is great script top notch acting by everyone partly thanks excellent casting superb cinematography film basically explores what passion is human being great passion various areas is involved almost all characters you have suspense clever detective story some surprising twists etc darin has aura paraphrasing title film he worked aura that illuminates whole screen his presence is as powerful screen as that gene hackman pacino deniro or hoffman top great ones i sincerely hope this movie gets his due awards oscar included because it deserves so,0.5662499999999999,0.4362500000000001,Positive,"{'Happy': 0.26, 'Angry': 0.09, 'Surprise': 0.17, 'Sad': 0.0, 'Fear': 0.48}"
9.0,this is what we call.............................flawless,"One of the most perfect movie i have ever seen.This type of movie come once in a while,and remains with you for a long time.The best thing of the movie is cinematography that makes movie so beautiful.They use camera so well and scenes are shot so beautifully especially soccer match scene.They give a very realistic feel to movie. the scene of the crime is shown very realistic.Great acting by all the actors.all characters are very well portrait by actors.The story of the movie is so emotional and deeply involving and have very well written dialogues. this movie kept me so engaged with all the perfect twists and pace. this movie have everything crime,romance,drama,thriller and have some moments that makes you laugh.Direction of the movie is flawless,this movie is almost perfect in all the departments.I hardly found any mistake in the movie.This movie deserves at least three Oscar nomination this year for screenplay ,cinematography and best movie in foreign language.This movie is a masterpiece and will be remembered among greatest movies ever made(at least by me).I give this movie 10/10",this is what we call flawless,one most perfect movie i have ever seen this type movie come once while remains with you long time best thing movie is cinematography that makes movie so beautiful they use camera so well scenes are shot so beautifully especially soccer match scene they give very realistic feel movie scene crime is shown very realistic great acting by all actors all characters are very well portrait by actors story movie is so emotional deeply involving have very well written dialogues this movie kept me so engaged with all perfect twists pace this movie have everything crime romance drama thriller have some moments that makes you laugh direction movie is flawless this movie is almost perfect all departments i hardly found any mistake movie this movie deserves at least three oscar nomination this year screenplay cinematography best movie foreign language this movie is masterpiece will be remembered among greatest movies ever made at least by me i give this movie 10 10,0.5733333333333334,0.4086666666666667,Positive,"{'Happy': 0.07, 'Angry': 0.0, 'Surprise': 0.27, 'Sad': 0.37, 'Fear': 0.3}"
10.0,This is what movies should always be,"This is it. A film that you can't get your eyes off until lights are back on... and then it's still difficult to stand up. A thriller, with lovable main characters, that makes you smile and think. A movie about a crime and a love. It has one of best chase scenes I've ever seen, involving what seems to be real complex camera work, something that could've been part of a Lord of the Rings movie maybe (at least that is what it looked like from my seat). Simply amazing. The acting is perfect. The pace is perfect. The ending couldn't be better (and we have seen so many great films that spoil it all at the end!).Just go see it and enjoy what cinema should always be. It's a 10 out of 10.",this is what movies should always be,this is it film that you cant get your eyes off until lights are back then its still difficult stand up thriller with lovable main characters that makes you smile think movie about crime love it has one best chase scenes ive ever seen involving what seems be real complex camera work something that couldve been part lord rings movie maybe at least that is what it looked like my seat simply amazing acting is perfect pace is perfect ending couldnt be better we have seen so many great films that spoil it all at end just go see it enjoy what cinema should always be its 10 out 10,0.5284313725490196,0.353921568627451,Positive,"{'Happy': 0.16, 'Angry': 0.0, 'Surprise': 0.24, 'Sad': 0.32, 'Fear': 0.28}"
9.0,Argentinian passion,"The second Argentinian movie to win an Oscar, ""El secreto de sus ojos"" (""The Secret in Their Eyes"" in English) looks at a Buenos Aires detective's passion in solving a case on the verge of the military junta that was responsible for the Disappeared. As I understand it, a difference between this movie and Juan Jose Campanella's previous ones is that this is more mainstream, so to speak. I actually found it pretty comparable to ""My Wife's Boyfriend"", which Campanella also directed. I certainly recommend both films. To be certain, this one has some of the best lines that I've ever heard. Argentina has clearly shown itself to be a fine country in terms of cinema during this past decade.",argentinian passion,second argentinian movie win oscar el secreto de sus ojos secret their eyes english looks at buenos aires detectives passion solving case verge military junta that was responsible disappeared as i understand it difference between this movie juan jose campanellas previous ones is that this is more mainstream so speak i actually found it pretty comparable my wifes boyfriend which campanella also directed i certainly recommend both films be certain this one has some best lines that ive ever heard argentina has clearly shown itself be fine country terms cinema during this past decade,0.38080357142857146,0.17366071428571428,Positive,"{'Happy': 0.12, 'Angry': 0.12, 'Surprise': 0.25, 'Sad': 0.06, 'Fear': 0.44}"
8.0,The secret of his eyes,"A retired investigator, Benjamin Esposito, from a criminal court in Buenos Aires, decides to write about a case that has haunted him since the days he was assigned to cover the crime. In putting his thoughts in paper, he realizes the case is still unresolved. What's more, he is more involved now, than he was back then. For that he must go back and speak to Irene, the district attorney, under whose office he worked. Irene, he realizes, is the woman he has never forgotten in spite of being apart for so many years.The crime in question involved a beautiful newlywed woman found raped and stabbed to death in her apartment. Benjamin and the other investigator, Pablo Sandoval, try to gather as much information about the circumstances that triggered the murder. Both men are hindered by an elusive killer whose only, and possible identity, is a photograph that the investigators find in an album they get from the husband of the victim, Ricardo Morales. The thing that sparked their suspicion is Isidoro Gomez who appears in a couple of pictures almost adoring the dead woman, who obviously, he couldn't have. Benjamin is a self made man. He came from humble origins, in contrast to Irene Menendez Hastings, a girl from money and privilege. In a class conscious society like Argentina, their possible involvement would have been nil. Yet, one can see how Irene gets under Benjamin's skin. Their attraction is mutual, but it will never happen. She, too, is aware of the way he feels, but ultimately, decorum prevails. After all, Irene is about to marry a society man. The pursuit of Isidoro Gomez doesn't go anywhere. Pablo Sandoval's drinking friends crack the code about Isidoro Gomez's love for a soccer team, the Racing of Avellaneda. The suspect, who proves to be a master in the way he can outrun Benjamin and Pablo, is followed to his favorite place, the soccer stadium. When they finally catch up with the suspect, someone well connected with the government of then president Isabel Peron, bails him out. It was clear they had no chance in ever catching the assassin. Benjamin, in frustration leaves his post after his partner Pablo Sandoval is killed, a death that was meant for him.Years later, Benjamin returns to Buenos Aires and goes back to Irene with the notes he has written. Irene, now married with children, realizes whatever they felt about one another, never having said a word, is now stronger than ever. Benjamin gets lucky when he decides to pay a surprise visit to Ricardo Morales, the widower of the slain woman. When Benjamin finds him at a remote place in the country, he is for an unexpected surprise.Juan Jose Campanella is one of Argentina's best directors. Working with Eduardo Sacheri, and his novel, ""La pregunta de sus ojos"", the director struck gold. The film can be a bit disorienting for people without much knowledge of Argentine history that is at the center of the story. Most of the action takes place in the Buenos Aires of 1974, when the corrupt government of Peron's widow Isabel, was in power. One can relate to the way the story of those years work well with what the creators wanted to present. With the presence of Ricardo Darin and Soledad Villamil the director had it made. Both are excellent actors who will enhance any film in which they appear. They both shine as Benjamin and Irene. But it is with the supporting players that Mr. Campanella achieve greatness. Guillermo Francella, who plays Pablo Sandoval does an amazing job. As he proved with ""Rudo y Cursi"", Mr. Francella steals the film from the principals any time he is seen. Pablo Rago, is brilliant in the way he approaches his role as the husband of the assassinated wife and whose life ended on the tragic day she was killed.Felix Monti's atmospheric cinematography works well, capturing that bygone era. So does the fine musical score by Fererico Jusid and Emilio Kauderer. This is another triumph for Juan Jose Campanella.",secret his eyes,retired investigator benjamin esposito criminal court buenos aires decides write about case that has haunted him since days he was assigned cover crime putting his thoughts paper he realizes case is still unresolved whats more he is more involved now than he was back then that he must go back speak irene district attorney under whose office he worked irene he realizes is woman he has never forgotten spite being apart so many years crime question involved beautiful newlywed woman found raped stabbed death her apartment benjamin other investigator pablo sandoval try gather as much information about circumstances that triggered murder both men are hindered by elusive killer whose only possible identity is photograph that investigators find album they get husband victim ricardo morales thing that sparked their suspicion is isidoro gomez who appears couple pictures almost adoring dead woman who obviously he couldnt have benjamin is self made man he came humble origins contrast irene menendez hastings girl money privilege class conscious society like argentina their possible involvement would have been nil yet one can see how irene gets under benjamins skin their attraction is mutual but it will never happen she too is aware way he feels but ultimately decorum prevails after all irene is about marry society man pursuit isidoro gomez doesnt go anywhere pablo sandovals drinking friends crack code about isidoro gomezs love soccer team racing avellaneda suspect who proves be master way he can outrun benjamin pablo is followed his favorite place soccer stadium when they finally catch up with suspect someone well connected with government then president isabel peron bails him out it was clear they had no chance ever catching assassin benjamin frustration leaves his post after his partner pablo sandoval is killed death that was meant him years later benjamin returns buenos aires goes back irene with notes he has written irene now married with children realizes whatever they felt about one another never having said word is now stronger than ever benjamin gets lucky when he decides pay surprise visit ricardo morales widower slain woman when benjamin finds him at remote place country he is unexpected surprise juan jose campanella is one argentinas best directors working with eduardo sacheri his novel la pregunta de sus ojos director struck gold film can be bit disorienting people without much knowledge argentine history that is at center story most action takes place buenos aires 1974 when corrupt government perons widow isabel was power one can relate way story those years work well with what creators wanted present with presence ricardo darin soledad villamil director had it made both are excellent actors who will enhance any film which they appear they both shine as benjamin irene but it is with supporting players that mr campanella achieve greatness guillermo francella who plays pablo sandoval does amazing job as he proved with rudo y cursi mr francella steals film principals any time he is seen pablo rago is brilliant way he approaches his role as husband assassinated wife whose life ended tragic day she was killed felix montis atmospheric cinematography works well capturing that bygone era so does fine musical score by fererico jusid emilio kauderer this is another triumph juan jose campanella,0.47434640522875815,0.1431372549019608,Positive,"{'Happy': 0.14, 'Angry': 0.04, 'Surprise': 0.25, 'Sad': 0.14, 'Fear': 0.42}"
10.0,A masterpiece,"This is quite frankly an astonishing film. One that fills your entire array of senses and sensitivities, and the praise from Argentine reviewers here is 100 percent justified. Ricardo Darín turns in another majestic performance as a Buenos Aires court employee who is fiercely affected by the rape and murder of a young girl in 1974, a tragedy that dominates his life. Overlapping this theme is the powerfully sensual but never physical relationship between Darín and his superior, the investigating judge played by the superb Soledad Villamil. The connection between the two is electric. It's a pity this film cannot easily transcend the language barrier, if it was an English-language film of the same quality it would already be hailed as a masterpiece. The blending of tragedy, love, violence and humour is brilliant, and the comedy dialogue fantastic. One scene where Ricardo Darín is balled out for having searched an old lady's house is priceless in terms of comic timing and delivery. A wonderful performance also from Guillermo Francella as the court clerk with a drinking problem, in fact the secondary acting is all first-class. The camera-work is impressive, especially the swoop down into the football stadium and the closeups, and the script is also superb. Argentina has nominated the film as its candidate for best foreign film at the Oscar's, it deserves to walk it.",masterpiece,this is quite frankly astonishing film one that fills your entire array senses sensitivities praise argentine reviewers here is 100 percent justified ricardo dar n turns another majestic performance as buenos aires court employee who is fiercely affected by rape murder young girl 1974 tragedy that dominates his life overlapping this theme is powerfully sensual but never physical relationship between dar n his superior investigating judge played by superb soledad villamil connection between two is electric its pity this film cannot easily transcend language barrier if it was english language film same quality it would already be hailed as masterpiece blending tragedy love violence humour is brilliant comedy dialogue fantastic one scene where ricardo dar n is balled out having searched old ladys house is priceless terms comic timing delivery wonderful performance also guillermo francella as court clerk with drinking problem fact secondary acting is all first class camera work is impressive especially swoop down into football stadium closeups script is also superb argentina has nominated film as its candidate best foreign film at oscars it deserves walk it,0.5954790249433107,0.3625992063492064,Positive,"{'Happy': 0.17, 'Angry': 0.0, 'Surprise': 0.33, 'Sad': 0.14, 'Fear': 0.36}"
8.0,Deserves the Acclaim It Has Received,"When Juan Jose Campanella is not directing episodes of Law and Order, CSI or the like, he periodically returns to Argentina make a movie. In this case he directed and co-wrote the screenplay of The Secret in Their Eyes. Thus far it is the most successful movie in Argentina in the past thirty-five years and now in just few days after we saw it, we will find out if this Academy Award nominated movie for the Best Foreign Film will win an Oscar. It reminds us of the French movie, Tell No One, one of our all time favorites, as it is also a sophisticated detective story with an easy flowing but yet a complicated plot that keeps you thinking and guessing throughout the story. It is in Spanish, of course, with good subtitles. This movie is not only a mystery, crime movie but it is also a subtle romantic film which is has very good comedic moments. There is the use of a narrative technique that allows you to see the story through the imagination and the memory of the main character Benjamin Esposito played by well-known Argentine actor Ricardo Darin. There are skillfully done movements, which go back and forth in time as well as shifting the point of view, which on a few occasions took a few moments for us to orient ourselves. The acting, directing and photography were superb with great realism and therefore it surprised us to learn that the budget was only two million dollars. As required for all good movies of this genre, there is a strong ending, which will hold your interest and encourage further reflection.",deserves acclaim it has received,when juan jose campanella is not directing episodes law order csi or like he periodically returns argentina make movie this case he directed co wrote screenplay secret their eyes thus far it is most successful movie argentina past thirty five years now just few days after we saw it we will find out if this academy award nominated movie best foreign film will win oscar it reminds us french movie tell no one one our all time favorites as it is also sophisticated detective story with easy flowing but yet complicated plot that keeps you thinking guessing throughout story it is spanish course with good subtitles this movie is not only mystery crime movie but it is also subtle romantic film which is has very good comedic moments there is use narrative technique that allows you see story through imagination memory main character benjamin esposito played by well known argentine actor ricardo darin there are skillfully done movements which go back forth time as well as shifting point view which few occasions took few moments us orient ourselves acting directing photography were superb with great realism therefore it surprised us learn that budget was only two million dollars as required all good movies this genre there is strong ending which will hold your interest encourage further reflection,0.5340322580645162,0.21564516129032257,Positive,"{'Happy': 0.26, 'Angry': 0.0, 'Surprise': 0.23, 'Sad': 0.13, 'Fear': 0.38}"
10.0,"In 21st century, eyes still speak","OK, frankly, I didn't expect much of this.I'm not familiar with Argentinian cinema, so this was my first acquaintance with director, writer and actors.Boy, what a surprise this movie made. It's beautifully filmed, it has lovely slow parts where director and actors narrate emotions through silence, this feature is almost vanquished from modern cinema where any frame that doesn't contain action is considered boring.I thoroughly enjoyed directing, but acting left me pining for Spanish classes. Impressive portrayal of characters if self-evident, with Soledad Villamil's performance shining out as an example of true actress. Unfortunately, we Spanish-impaired people can only sense the beauty lying within spoken lines and rhythm of the language that subtitles just cannot convey. As for violence and nudity they are used in glimpses, not more than necessary and in meaningful places, I spent good part of the movie fearing that it must eventually get ruined with some trendy shocker effect. But it doesn't, it flows it's own way beautifully to the end.If one can use small court office and a rape case to tell a love story in such subtle and profound manner it leaves me wandering what Argentinian cinema has for us for the future. I'll jump on digging through it's past right away, and I hope anyone wondering if this movie is worth their time can be swayed to yes side by my humble recommendation.",21st century eyes still speak,ok frankly i didnt expect much this im not familiar with argentinian cinema so this was my first acquaintance with director writer actors boy what surprise this movie made its beautifully filmed it has lovely slow parts where director actors narrate emotions through silence this feature is almost vanquished modern cinema where any frame that doesnt contain action is considered boring i thoroughly enjoyed directing but acting left me pining spanish classes impressive portrayal characters if self evident with soledad villamils performance shining out as example true actress unfortunately we spanish impaired people can only sense beauty lying within spoken lines rhythm language that subtitles just cannot convey as violence nudity they are used glimpses not more than necessary meaningful places i spent good part movie fearing that it must eventually get ruined with some trendy shocker effect but it doesnt it flows its own way beautifully end if one can use small court office rape case tell love story such subtle profound manner it leaves me wandering what argentinian cinema has us future ill jump digging through its past right away i hope anyone wondering if this movie is worth their time can be swayed yes side by my humble recommendation,0.5049755799755798,0.14739010989010984,Positive,"{'Happy': 0.15, 'Angry': 0.04, 'Surprise': 0.24, 'Sad': 0.28, 'Fear': 0.28}"
