Rating,Review Title,Review,Cleaned Review Title,Cleaned Review,Subjectivity,Polarity,Sentiment,Emotion Scale
6.0,"You see what happens, Larry?","It's hard to pick out one line of dialogue in particular for two reasons. One-almost everything said in this film is downright hilarious. And Two-the F word is spoken 281 times so there's not many sentences that don't contain it. 144 sentences also end in 'man'.Jeff 'The Dude' Lebowski is a man living a minimalistic existence. He has no job, no ambitions and no worries. His days, be they weekdays or weekends, are spent bowling, driving around or having the occasional acid flashback. His pals are Walter Sobchak, a security expert and half-crazed Vietnam vet and Donny, a humble, mousy little man who is left out of almost every conversation.The Dude is happy with his easy-going life of nothingness until two thugs ambush him in his house believing him to the OTHER Jeff 'The Big' Lebowski, the millionaire with a trouble-making wife who owes money all over town. These thugs are none too happy with their dumb error and re-assert themselves by peeing on The Dude's rug.This very much displeases The Dude as this rug really tied the room together and since he cannot track down the 'Chinaman' thug responsible he decides to take it out of the Big Lebowski, as it's now HIM who owes a new rug. The Dude is welcomed into the Big Lebowski's mansion by Brandt the butler, a man so appallingly sycophantic he'd make Weylon Smither's look bad. But his millionaire namesake is not so ready and willing to give hand-outs and basically tells The Dude to get lost.At this point things become quite complicated as a bunch of ex-pop star Nihilist thugs, a powerful pornographer, a dejected feminist daughter, a Brother Seamus (NOT an Irish Monk), a joyriding teenager, a revolting pederast champion bowler, Saddam Hussein, a mysterious cowboy and a doctor who is insistent on him removing his shorts all make The Dude's life suddenly a helluva lot more interesting. The plot thickens and thickens and the dude is dragged to dozens of different places across LA, going from limo to limo, never too far from a white Russian or a doobie.There are zillions of idiosyncrasies in this film that keeps it new and interesting every time you watch it. Every scene and every line of dialogue is so memorable that, like me, you'll be acting the film out for years. Even on a 100th viewing you'll notice dramatic ironies, character arcs and ingenious wordplay that went right over your head before.The acting is superb. I am a fan of Jeff Bridges but he completely disappears in this film. He truly BECOMES The Dude and shows little of his recognisable self. John Goodman, in probably the most under-rated role of his career, is the world's angriest man. Bringing frustration and smart-ass arrogance to every scene (though he's almost always right). Set well over a decade after 'nam (and during the first Gulf conflict) Walter seems to be suffering from perpetual, ever-lasting post-traumatic stress syndrome as he blows up in any situation. Take a look at his 'minor' confrontation with Smokey for example.It's not about plot, or even characters. It's about a certain moment in time, the early 90s. And the definitive man of that time was the Dude. The rug-peeing just happened to occur simultaneously.",you see what happens larry,its hard pick out one line dialogue particular two reasons one almost everything said this film is downright hilarious two f word is spoken 281 times so theres not many sentences that dont contain it 144 sentences also end man jeff dude lebowski is man living minimalistic existence he has no job no ambitions no worries his days be they weekdays or weekends are spent bowling driving around or having occasional acid flashback his pals are walter sobchak security expert half crazed vietnam vet donny humble mousy little man who is left out almost every conversation dude is happy with his easy going life nothingness until two thugs ambush him his house believing him other jeff big lebowski millionaire with trouble making wife who owes money all over town these thugs are none too happy with their dumb error re assert themselves by peeing dudes rug this very much displeases dude as this rug really tied room together since he cannot track down chinaman thug responsible he decides take it out big lebowski as its now him who owes new rug dude is welcomed into big lebowskis mansion by brandt butler man so appallingly sycophantic hed make weylon smithers look bad but his millionaire namesake is not so ready willing give hand outs basically tells dude get lost at this point things become quite complicated as bunch ex pop star nihilist thugs powerful pornographer dejected feminist daughter brother seamus not irish monk joyriding teenager revolting pederast champion bowler saddam hussein mysterious cowboy doctor who is insistent him removing his shorts all make dudes life suddenly helluva lot more interesting plot thickens thickens dude is dragged dozens different places across la going limo limo never too far white russian or doobie there are zillions idiosyncrasies this film that keeps it new interesting every time you watch it every scene every line dialogue is so memorable that like me youll be acting film out years even 100th viewing youll notice dramatic ironies character arcs ingenious wordplay that went right over your head before acting is superb i am fan jeff bridges but he completely disappears this film he truly becomes dude shows little his recognisable self john goodman probably most under rated role his career is worlds angriest man bringing frustration smart ass arrogance every scene though hes almost always right set well over decade after nam during first gulf conflict walter seems be suffering perpetual ever lasting post traumatic stress syndrome as he blows up any situation take look at his minor confrontation with smokey example its not about plot or even characters its about certain moment time early 90s definitive man that time was dude rug peeing just happened occur simultaneously,0.47618438075334624,0.09759491466388016,Positive,"{'Happy': 0.12, 'Angry': 0.05, 'Surprise': 0.14, 'Sad': 0.25, 'Fear': 0.43}"
10.0,"It's good knowin' he's out there. The Dude. Takin' 'er easy for all us sinners.""","Looks like while making ""The Big Lebowski"" (1998)– weird, nutty, outrageously funny and deliciously twisted movie, the brothers Ethan and Joel Coens, known for their unique and dry humor, sat back, laughed out loud, and had fun. ""Big Lebowski"" turned as one of the funniest comedies ever made. It is funny because of the incredibly off-beat characters, their weirdness, flaws, their interactions, the surreal situations they found themselves in, and perfectly written and delivered hilarious dialogs. There is the story, of course, which is based on the case of mistaken identity with the following kidnapping, villainous nihilists, vanguard erotic flying painter, the bowler named Jesus but the story is truly secondary to the delicious craziness of the movie.Some reviewers call Big Lebowski misfire and deranged mess, saying that the story is convoluted with the characters we would not care about a bit. It was also interesting to read the reviews that were written upon its release and compared it to Coens' ""Fargo"" that had been made a year earlier than the adventure of Jeffrey ""the Dude"" Lebowski (Jeff Bridges).""Fargo"" could be Coens' masterwork but it does not make Lebowski any worse. It was dismissed as the inferior film and was predicted not to stand the future re-watch. The time has proved the predictions wrong. ""The Dude"" Lebowski - middle-aged pot smoking, White Russian drinking, bowling enthusiast ex-hippie, and his friends, Polish Catholic converted Jew, ""more Jewish than Tevye"" Vietnam veteran Walter with anger management problems (John Goodman) and timid, little slow, ""sweet prince"" Donny (unusually quiet Steve Buscemi) have become the cult figures, the beloved characters, for millions of film lovers of different generations, not only the baby- boomers.The Coen Brothers have made twenty films, and all of them are treasure, including their contribution in the 2006 anthology, Paris, je t'aime. I've seen all their films and I want to repeat the title of my review on their latest, ""Burn after reading"" - The Coen Brothers don't make bad movies, because they don't know how. Their films, Including the cult favorite, Big Lebowski, should not be missed. They are clever, darkly funny, and beautiful without being pretty pictures. In short, they are first class entertainment.",its good knowin hes out there dude takin er easy all us sinners,looks like while making big lebowski 1998 weird nutty outrageously funny deliciously twisted movie brothers ethan joel coens known their unique dry humor sat back laughed out loud had fun big lebowski turned as one funniest comedies ever made it is funny because incredibly off beat characters their weirdness flaws their interactions surreal situations they found themselves perfectly written delivered hilarious dialogs there is story course which is based case mistaken identity with following kidnapping villainous nihilists vanguard erotic flying painter bowler named jesus but story is truly secondary delicious craziness movie some reviewers call big lebowski misfire deranged mess saying that story is convoluted with characters we would not care about bit it was also interesting read reviews that were written upon its release compared it coens fargo that had been made year earlier than adventure jeffrey dude lebowski jeff bridges fargo could be coens masterwork but it does not make lebowski any worse it was dismissed as inferior film was predicted not stand future re watch time has proved predictions wrong dude lebowski middle aged pot smoking white russian drinking bowling enthusiast ex hippie his friends polish catholic converted jew more jewish than tevye vietnam veteran walter with anger management problems john goodman timid little slow sweet prince donny unusually quiet steve buscemi have become cult figures beloved characters millions film lovers different generations not only baby boomers coen brothers have made twenty films all them are treasure including their contribution 2006 anthology paris je taime ive seen all their films i want repeat title my review their latest burn after reading coen brothers dont make bad movies because they dont know how their films including cult favorite big lebowski should not be missed they are clever darkly funny beautiful without being pretty pictures short they are first class entertainment,0.5455357142857142,0.13653273809523808,Positive,"{'Happy': 0.14, 'Angry': 0.08, 'Surprise': 0.24, 'Sad': 0.27, 'Fear': 0.27}"
1.0,"boe_dye sez: it wasn't funny, it wasn't not funny, it wasn't much of anything really","Certain movies you can sort of understand why they are cult classics, other films such as this one, seem to be funny and intelligent because someone said it was funny and intelligent and therefore must be funny and intelligent.I suppose you could find deeper meaning in this, or perhaps the meaning was right there on the surface. But like many of the Coen Brothers films that I have watched I either like them or I don't.The ones that I liked usually have a strong story behind them, the ones that I don't like seem to be more of a ""day in the life of"" story about people who really don't seem to matter and about events that no one really cares about.Maybe there is some type of amusement in trivial matters, making bored college frat boys feel more intelligent then they really are, but I need something deeper for intellectual stimulation.For my comedy, I don't need slapstick or pie in the face humor to make me laugh. Cynicism, witty dialogue, sarcasm, commentary and so on, not one line random events that happen out of no where with no real context and then expected to be funny.(which is not to say that slapstick pie in the face humor doesn't make me laugh at times...) A very random film with very to little no substance to it. A few quirky one liners here and there, but in all honesty I was more looking at the clock waiting for this film to end then I was looking at the film waiting for it to be entertaining.Yet for some reason it has a cult following and there it is... However one should keep in mind that cults generally comprise of brainwashed individuals who really can't think for themselves anyways and generally follow wherever they are pointed to like mindless sheople...",boe dye sez it wasnt funny it wasnt not funny it wasnt much anything really,certain movies you can sort understand why they are cult classics other films such as this one seem be funny intelligent because someone said it was funny intelligent therefore must be funny intelligent i suppose you could find deeper meaning this or perhaps meaning was right there surface but like many coen brothers films that i have watched i either like them or i dont ones that i liked usually have strong story behind them ones that i dont like seem be more day life story about people who really dont seem matter about events that no one really cares about maybe there is some type amusement trivial matters making bored college frat boys feel more intelligent then they really are but i need something deeper intellectual stimulation my comedy i dont need slapstick or pie face humor make me laugh cynicism witty dialogue sarcasm commentary so not one line random events that happen out no where with no real context then expected be funny which is not say that slapstick pie face humor doesnt make me laugh at times very random film with very little no substance it few quirky one liners here there but all honesty i was more looking at clock waiting this film end then i was looking at film waiting it be entertaining yet some reason it has cult following there it is however one should keep mind that cults generally comprise brainwashed individuals who really cant think themselves anyways generally follow wherever they are pointed like mindless sheople,0.5901244588744589,0.17249053030303027,Positive,"{'Happy': 0.06, 'Angry': 0.02, 'Surprise': 0.41, 'Sad': 0.24, 'Fear': 0.27}"
1.0,What's the Point? It isn't funny,"Spoilers ahead.I frankly do not understand why ""The Big Lebowski"" has been elevated to the point of being considered one of the best cult classics of all-time. Why this cult around the character of ""The Dude"", one of the blandest, flavorless, most uninteresting comedy protagonists ever to be put on celluloid? He's simply some dopey hippie who loves to hang around a John Goodman cardboard-cutout Vietnam vet gone loco (real Vets should raise their fists in anger over such an overdone, unfunny, disrespectful and insulting characterization) and a seldomly-seen Steve Buscemi, who doesn't really do much. The plot winds into so many different twists and turns and includes so many supporting characters, all of whom seek The Dude's bag of money, that trying to understand this movie is like trying to untangle the Gordian Knot by hand. What's the point of placing layer upon layer upon layer of weird, uninteresting characters to the point that you forget what the hell this movie is about? Nihilist German rockers? Some sicko Hugh Hefner clone? A gorgeous yet incomprehensible avant-garde artist who wants to have ""The Dude's"" baby? A strange drugstore cowboy who serves as some sort of Greek chorus? Stop it! ""Pee-Wee's Big Adventure"" had an array of weird characters, but it succeeded because it had a straightforward plot and brilliant acting and writing. The Coen's monstrosity has little wit or signs of superb comic writing, and all of their characters, though weird, are totally boring and flavorless. For weird characters to work, they must act totally off-the-wall and twisted beyond realism. The weirdos in ""Lebowski"" are actually regular, and seem like a mish-mash of all-too-real rejects from a yuppie coffee bar.Who likes this stuff? I have just seen ""No Country for Old Men"", and, like ""Lebowski"", that was poorly written in terms of a smooth plot; and, like ""Lebowski"", lacked any interesting characters. I'll give ""Fargo"" a chance; otherwise, the Coen Brothers ain't reeling me in with their weird, clunky movies.",whats point it isnt funny,spoilers ahead i frankly do not understand why big lebowski has been elevated point being considered one best cult classics all time why this cult around character dude one blandest flavorless most uninteresting comedy protagonists ever be put celluloid hes simply some dopey hippie who loves hang around john goodman cardboard cutout vietnam vet gone loco real vets should raise their fists anger over such overdone unfunny disrespectful insulting characterization seldomly seen steve buscemi who doesnt really do much plot winds into so many different twists turns includes so many supporting characters all whom seek dudes bag money that trying understand this movie is like trying untangle gordian knot by hand whats point placing layer upon layer upon layer weird uninteresting characters point that you forget what hell this movie is about nihilist german rockers some sicko hugh hefner clone gorgeous yet incomprehensible avant garde artist who wants have dudes baby strange drugstore cowboy who serves as some sort greek chorus stop it pee wees big adventure had array weird characters but it succeeded because it had straightforward plot brilliant acting writing coens monstrosity has little wit or signs superb comic writing all their characters though weird are totally boring flavorless weird characters work they must act totally off wall twisted beyond realism weirdos lebowski are actually regular seem like mish mash all too real rejects yuppie coffee bar who likes this stuff i have just seen no country old men like lebowski that was poorly written terms smooth plot like lebowski lacked any interesting characters ill give fargo chance otherwise coen brothers aint reeling me with their weird clunky movies,0.5331479496113642,0.028963414634146343,Positive,"{'Happy': 0.1, 'Angry': 0.08, 'Surprise': 0.28, 'Sad': 0.22, 'Fear': 0.32}"
9.0,"Characters, Plot, Dialogue...","... roll them into a smoke and ignite, if these necessary constituents of any great film burn bright, take a long deep draw and savour their infusion. This original, unique and superbly performed film does just that - something to be relished and luxuriate within while allowing you to put life's irritants into perspective.",characters plot dialogue,roll them into smoke ignite if these necessary constituents any great film burn bright take long deep draw savour their infusion this original unique superbly performed film does just that something be relished luxuriate within while allowing you put lifes irritants into perspective,0.7625,0.4,Positive,"{'Happy': 0.23, 'Angry': 0.23, 'Surprise': 0.08, 'Sad': 0.15, 'Fear': 0.31}"
,Respectable Raunch,"The Coen brothers (Joel and Ethan) are the most innovative and, perhaps, the best filmmakers working today. Or they at least rank along side the likes of Martin Scorsese and rising director star Quentin Tarantino. Think about it: ""Blood Simple"" was the best film of 1984; ""Raising Arizona"" was the best film of 1987; ""Miller's Crossing"" was the best movie of 1990; ""Barton Fink"" was the best movie of 1991; and ""Fargo"" was the best movie of 1996. Now comes their latest effort, ""The Big Lebowski,"" which, while it isn't in quite the same league as the above films, is still one of the most thoroughly entertaining movies of 1998.It tells the shambling story of a man named Jeff Lebowski, who calls himself The Dude (Jeff Bridges). The Dude's apartment gets broken into and a thief urinates on his rug. He finds out that the criminals were not looking for him, but looking for the OTHER Jeff Lebowski, the disabled millionaire (played by David Huddleston). That's all I can tell you. The rest is really too bizarre and complicated to put into words; but it's bizarre and complicated in the best ways of the words.Still, what I'll remember most about ""The Big Lebowski"" is the outstanding number of utterly terrific performances. Bridges delivers the best performance of his career and probably the best of the year as a bum lie-about who just wants to be left alone. John Goodman is the real comic gem here as the forever-loudmouthed Walter, The Dude's bowling partner and best friend. Steve Buscemi co-stars as the dimwitted, bug-eyed Donny, the third bowling partner; there's a small but interestingly offbeat spot for Julianne Moore; and John Torturro stops in, as Jesus the bowler, for what is probably the best walk-on performance in years. If you are a Coen brothers fan or like humor that is distinctly offbeat, you have found your movie. As a rather avid moviegoer, I found the film to be a great excersise in pointless extremeties and respectable raunch. Rated R. 117 minutes. 10 out of 10.",respectable raunch,coen brothers joel ethan are most innovative perhaps best filmmakers working today or they at least rank along side likes martin scorsese rising director star quentin tarantino think about it blood simple was best film 1984 raising arizona was best film 1987 millers crossing was best movie 1990 barton fink was best movie 1991 fargo was best movie 1996 now comes their latest effort big lebowski which while it isnt quite same league as above films is still one most thoroughly entertaining movies 1998 it tells shambling story man named jeff lebowski who calls himself dude jeff bridges dudes apartment gets broken into thief urinates his rug he finds out that criminals were not looking him but looking other jeff lebowski disabled millionaire played by david huddleston thats all i can tell you rest is really too bizarre complicated put into words but its bizarre complicated best ways words still what ill remember most about big lebowski is outstanding number utterly terrific performances bridges delivers best performance his career probably best year as bum lie about who just wants be left alone john goodman is real comic gem here as forever loudmouthed walter dudes bowling partner best friend steve buscemi co stars as dimwitted bug eyed donny third bowling partner theres small but interestingly offbeat spot julianne moore john torturro stops as jesus bowler what is probably best walk performance years if you are coen brothers fan or like humor that is distinctly offbeat you have found your movie as rather avid moviegoer i found film be great excersise pointless extremeties respectable raunch rated r 117 minutes 10 out 10,0.46525297619047623,0.275,Positive,"{'Happy': 0.08, 'Angry': 0.06, 'Surprise': 0.4, 'Sad': 0.15, 'Fear': 0.31}"
9.0,A Perfect Strike !,"Recently given a one night cinematic return to mark 20 years since its initial release. ""The Big Lebowski"" remains on the highpoints of the Coen Brothers remarkable career of excellence. Their farcical homage to Raymond Chandler stars Jeff Bridges, as ""The Dude"" whose real name, Jeff Lebowski drags him into a plot to ransom the wife of his namesake, played by David Huddleston. Blackmailers come to the wrong address, rugs are pissed on and threats are made. Eventually the ""Big"" Lebowski chooses ""The Dude"" to be the bag man for the ransom drop off. A decision that all involved soon come to regret. Twenty years has allowed me to watch ""The Big Lebowski"" a few times, and to be fair it's a film that improves with each watch. The plot is nothing special, in fact it's almost non-existant. The character revolve around each other and at the end of it you're no wiser as to who, if anyone, actually kidnapped Bunny (Tara Reid) or what happened to the $1M dollars. . But you come to appreciate that the plot isn't as important as the characters and what characters they are. Jeff Bridges gives a career best performance as ""The Dude"".... Mumbling and ""man-ing"" his way through the film, which belies the wit that he sometimes allows a glimpse of. It is one of the funniest, most quotable movies of all time. Full of the Coen's regular acting troop, some of whom show up for just one or two scenes, make their memorable mark and then are never heard from again. It is a stone cold classic, and we'll still be watching it in another twenty years.",perfect strike,recently given one night cinematic return mark 20 years since its initial release big lebowski remains highpoints coen brothers remarkable career excellence their farcical homage raymond chandler stars jeff bridges as dude whose real name jeff lebowski drags him into plot ransom wife his namesake played by david huddleston blackmailers come wrong address rugs are pissed threats are made eventually big lebowski chooses dude be bag man ransom drop off decision that all involved soon come regret twenty years has allowed me watch big lebowski few times be fair its film that improves with each watch plot is nothing special fact its almost non existant character revolve around each other at end it youre no wiser as who if anyone actually kidnapped bunny tara reid or what happened 1m dollars but you come appreciate that plot isnt as important as characters what characters they are jeff bridges gives career best performance as dude mumbling man ing his way through film which belies wit that he sometimes allows glimpse it is one funniest most quotable movies all time full coens regular acting troop some whom show up just one or two scenes make their memorable mark then are never heard again it is stone cold classic well still be watching it another twenty years,0.4296007326007325,0.16395238095238096,Positive,"{'Happy': 0.09, 'Angry': 0.03, 'Surprise': 0.38, 'Sad': 0.12, 'Fear': 0.38}"
