Rating,Review Title,Review,Cleaned Review Title,Cleaned Review,Subjectivity,Polarity,Sentiment,Emotion Scale
,The film with the highest rewatchability factor of all time,"It's actually kind of hard to describe this movie (and what's so great about it) to people who don't already know it and love it; as with many cult films, The Big Lebowski will either speak to you (in which case you will become a fervent follower of His Dudeness and abide by his code for the rest of your life) or, if it doesn't, the film will either leave you completely indifferent or you'll even downright hate it.I believe it's a very funny film and I'm sure it can be rightfully called a comedy, but don't expect punchlines, gags, jokes or slapstick - it's not that kind of comedy. If you want to enjoy this film, you have to meet Jeffery ""The Dude"" Lebowski on his terms, hang out with him and his bowling buddies and follow them at a their (perhaps somewhat leisurely) pace through this weird and unbelievable tale about nihilism, theft (of a car and, more importantly: a Creedence Clearwater Revival tape), kidnapping, abstract art, porn and - of course - bowling. The story is actually kind of simple. You see, some no-good German nihilists urinated on The Dude's rug - and this kind of aggression just won't stand against The Dude. With the help of his bowling buddies, he will do everything in his power to get someone to pay for his rug - or possibly get a new one (because that rug really tied the room together). So he embarks on this worthy quest during which he will encounter many wondrous things and fascinating people (even Jesus - who is NOT the messiah but a very naughty man).With Jeff Bridges in the leading role, the Coen brothers have found the perfect actor to incorporate one of the most iconic characters that has ever been created. But it's not just The Dude that makes this a winner; the whole film is such an inspired folly and simply inventive filmmaking at its finest (the hilarious dream sequence alone is worth the price of admission). The supporting cast is outstanding (J.Turturro, J.Goodman and S.Buscemi among many others), the song choices are perfect and the dialog is the funniest, most quotable in any comedy I've ever seen. This - for me - is without a doubt the film with the highest rewatchability factor of all time. 10 stars out of 10.Favorite Films: http://www.imdb.com/list/ls054200841/Lesser-known Masterpieces: http://www.imdb.com/list/ls070242495/Favorite Low-Budget and B-movies: http://www.imdb.com/list/ls054808375/",film with highest rewatchability factor all time,its actually kind hard describe this movie whats so great about it people who dont already know it love it as with many cult films big lebowski will either speak you which case you will become fervent follower his dudeness abide by his code rest your life or if it doesnt film will either leave you completely indifferent or youll even downright hate it i believe its very funny film im sure it can be rightfully called comedy but dont expect punchlines gags jokes or slapstick its not that kind comedy if you want enjoy this film you have meet jeffery dude lebowski his terms hang out with him his bowling buddies follow them at their perhaps somewhat leisurely pace through this weird unbelievable tale about nihilism theft car more importantly creedence clearwater revival tape kidnapping abstract art porn course bowling story is actually kind simple you see some no good german nihilists urinated dudes rug this kind aggression just wont stand against dude with help his bowling buddies he will do everything his power get someone pay his rug or possibly get new one because that rug really tied room together so he embarks this worthy quest during which he will encounter many wondrous things fascinating people even jesus who is not messiah but very naughty man with jeff bridges leading role coen brothers have found perfect actor incorporate one most iconic characters that has ever been created but its not just dude that makes this winner whole film is such inspired folly simply inventive filmmaking at its finest hilarious dream sequence alone is worth price admission supporting cast is outstanding j turturro j goodman s buscemi among many others song choices are perfect dialog is funniest most quotable any comedy ive ever seen this me is without doubt film with highest rewatchability factor all time 10 stars out 10 favorite films masterpieces low budget b movies,0.666680089935904,0.2943727977448908,Positive,"{'Happy': 0.23, 'Angry': 0.05, 'Surprise': 0.32, 'Sad': 0.18, 'Fear': 0.22}"
10.0,The Most Quotable Film of All Time,"Those Coen brothers have an ear for language. You feel it in the sing-songy banalities of Fargo, and in the noiresque machine-gun dialogue of Miller's Crossing, but neither of these can prepare you for the feast for the ears that is The Big Lebowski.Channeling the opaque mysteries of Raymond Chandler, the Coens throw LA resident bum and Bowling aficionado Jeff Lebowski (""The Dude"" to his friends) into a strange triple-crossing case of kidnapping, ransoms, nihilists and urinated-upon rugs. It is the equivalent of throwing unrelenting forces at an immovable object, the Dude's bemused stoicism at constant odds with the world around him. He'd much rather be bowling with crazed Vietnam Vet Walter (John Goodman) and pure silent soul Donnie (Steve Buscemi).As with so much of the Coens' output, style is more than half the point: not just visual, though ace DP Roger Deakins paints an alluring canvas, but tonal and auditory. This is an insanely funny head-trip of a movie, with wonderfully idiosyncratic characters, down to the smallest part. Who better than the Coens to reinvent the comedy of errors?This is without a doubt one of their very best, a personal favorite, an unmissable film and the kind of experience that will plant an indelible smile on your face. Do yourself and see this now, if you haven't already.",most quotable film all time,those coen brothers have ear language you feel it sing songy banalities fargo noiresque machine gun dialogue millers crossing but neither these can prepare you feast ears that is big lebowski channeling opaque mysteries raymond chandler coens throw la resident bum bowling aficionado jeff lebowski dude his friends into strange triple crossing case kidnapping ransoms nihilists urinated upon rugs it is equivalent throwing unrelenting forces at immovable object dudes bemused stoicism at constant odds with world around him hed much rather be bowling with crazed vietnam vet walter john goodman pure silent soul donnie steve buscemi as with so much coens output style is more than half point not just visual though ace dp roger deakins paints alluring canvas but tonal auditory this is insanely funny head trip movie with wonderfully idiosyncratic characters down smallest part who better than coens reinvent comedy errors this is without doubt one their very best personal favorite unmissable film kind experience that will plant indelible smile your face do yourself see this now if you havent already,0.4114444444444444,0.26960317460317457,Positive,"{'Happy': 0.13, 'Angry': 0.07, 'Surprise': 0.33, 'Sad': 0.17, 'Fear': 0.3}"
,My favourite Coen brothers movie and one of the most entertaining and original comedies ever made!,"My favourite Coen brothers movie changes over the years as I watch and rewatch their amazingly original and consistently surprising oeuvre. When I first saw 'The Big Lebowski' on its original release I enjoyed it but thought it was a bit of a slight ""fun"" movie with less depth than many of their previous works. Now, a few years and several viewing later, I have come to realise just how accomplished a movie it is, and it has become one of my all time favourite movies. Other film makers have attempted to weave together various genres, styles and images in a similarly eclectic, postmodern fashion, but few do it as seamlessly and with such wit as Ethan and Joel Coen. 'The Big Lewboski' is an extremely smart film, but it doesn't shout ""look at me! Aren't I clever?"". It sucks you in from the get go, and bottom line it is FUNNY, and as it is a comedy that's what counts the most! Everything about the movie is perfect, the script, the direction, set design, costumes, and the wonderful soundtrack (one of the most brilliant ever assembled, it includes lesser known Dylan and Elvis Costello numbers, Creedence classics, and songs from cult favourites like Yma Sumac, Captain Beefheart, Moondog, Esquivel and garage gods The Monks). Plus of course the actors, who are well cast and virtually flawless. Jeff Bridges ('Fat City', 'Starman') IS The Dude, and it's impossible to think of anyone else acting the role. Coen regulars John Goodman, Steve Buscemi, John Turturro, Peter Stomare, and Jon Polito are all on board, as well as Julianne Moore ('Boogie Nights'), David Huddleston ('Capricorn One'), Philip Seymour Hoffman ('Magnolia') and Sam Elliot ('Mask'), even surprise cameos from Ben Gazzara ('The Killing Of A Chinese Bookie') and singer Jimmie Ray Gilmore. I can't fault 'The Big Lebowski', it is one of the most original and entertaining comedies ever made and a genuine modern classic. It's movies like this that keep me watching despite the endless mountain of mindless garbage that Hollywood continually spews out. If only every movie in the box office Top Ten was as inspired and amusing as this one!",my favourite coen brothers movie one most entertaining original comedies ever made,my favourite coen brothers movie changes over years as i watch rewatch their amazingly original consistently surprising oeuvre when i first saw big lebowski its original release i enjoyed it but thought it was bit slight fun movie with less depth than many their previous works now few years several viewing later i have come realise just how accomplished movie it is it has become one my all time favourite movies other film makers have attempted weave together various genres styles images similarly eclectic postmodern fashion but few do it as seamlessly with such wit as ethan joel coen big lewboski is extremely smart film but it doesnt shout look at me arent i clever it sucks you get go bottom line it is funny as it is comedy thats what counts most everything about movie is perfect script direction set design costumes wonderful soundtrack one most brilliant ever assembled it includes lesser known dylan elvis costello numbers creedence classics songs cult favourites like yma sumac captain beefheart moondog esquivel garage gods monks plus course actors who are well cast virtually flawless jeff bridges fat city starman is dude its impossible think anyone else acting role coen regulars john goodman steve buscemi john turturro peter stomare jon polito are all board as well as julianne moore boogie nights david huddleston capricorn one philip seymour hoffman magnolia sam elliot mask even surprise cameos ben gazzara killing chinese bookie singer jimmie ray gilmore i cant fault big lebowski it is one most original entertaining comedies ever made genuine modern classic its movies like this that keep me watching despite endless mountain mindless garbage that hollywood continually spews out if only every movie box office top ten was as inspired amusing as this one,0.48656135531135536,0.2140567765567766,Positive,"{'Happy': 0.17, 'Angry': 0.07, 'Surprise': 0.43, 'Sad': 0.13, 'Fear': 0.2}"
,Simply Beautiful,"It's a travesty that most critics only read The Big Lebowski at its most superficial level and called it a modern take on a Raymond Chandler potboiler. I simply can't begin to perceive how one could sit down in front of this cinematic pop-poetry, as it plates gold on the silver screen, and not feel so incredibly alive. The dream sequence Busbee Berkley musical numbers are unique and awe-inspiring; the humor is rich, subtle, and clever in the way it satirizes politically correct arrogance; the free-flowing story avoids (even pokes fun at) nonessentials like plot points and pay-offs. But what really makes this film such a masterpiece, such a panacea, is the incredible humanism, the care that the Coen brothers put in developing The Dude (Jeff Bridges), Walter (John Goodman), Donnie (Steve Buscemi-tremendously endearing), and Brandt (magnificently played by Phillip Seymour Hoffman). Looking at the films use of Sam Elliott to play The Stranger, who constantly rambles about the many wonders of The Dude (among other things), it is clear that the film is an ode to a Dudist way of life. And in a time where so many film promise that they have the answer to the worlds problems and end up as slick, stylistic show-off films, what more could one ask for than a good-hearted film like this? Not to mention the performance by Jeff Bridges, which ranks among the best performances of the nineties; he has a relaxed slouch, a goofy smile, an enthusiastic dance, and his buttons can only be pushed by Walter, who John Goodman plays with charm and fury. The Coen brothers have always been considered 'cold' filmmakers, but there is nothing here but warmth and humanity (as is the case with the Coens' Fargo). What we have here is one of the greatest achievements in modern cinema and if you can't see that, grab a White Russian, hit the bowling ally, and find your inner-Dude as soon as possible.",simply beautiful,its travesty that most critics only read big lebowski at its most superficial level called it modern take raymond chandler potboiler i simply cant begin perceive how one could sit down front this cinematic pop poetry as it plates gold silver screen not feel so incredibly alive dream sequence busbee berkley musical numbers are unique awe inspiring humor is rich subtle clever way it satirizes politically correct arrogance free flowing story avoids even pokes fun at nonessentials like plot points pay offs but what really makes this film such masterpiece such panacea is incredible humanism care that coen brothers put developing dude jeff bridges walter john goodman donnie steve buscemi tremendously endearing brandt magnificently played by phillip seymour hoffman looking at films use sam elliott play stranger who constantly rambles about many wonders dude among other things it is clear that film is ode dudist way life time where so many film promise that they have answer worlds problems end up as slick stylistic show off films what more could one ask than good hearted film like this not mention performance by jeff bridges which ranks among best performances nineties he has relaxed slouch goofy smile enthusiastic dance his buttons can only be pushed by walter who john goodman plays with charm fury coen brothers have always been considered cold filmmakers but there is nothing here but warmth humanity as is case with coens fargo what we have here is one greatest achievements modern cinema if you cant see that grab white russian hit bowling ally find your inner dude as soon as possible,0.5280599647266315,0.2511728395061728,Positive,"{'Happy': 0.18, 'Angry': 0.02, 'Surprise': 0.27, 'Sad': 0.14, 'Fear': 0.39}"
8.0,indeed a cult classic,"More than 20 years it took me to have a look at this cult classic. Finally did it and I do undestand the fuss about it.Not a flick for everybody that I can tell because a lot of talking is done but it's the talking that starts to get funny after a while. In fact, a bunch of loser trying to solve a abduction and trying to hold the money for themselves goes terribly wrong.After a while you even want the talking to go on and on. And some art flick here and there it was indeed a hell of a ride, funny, stupid but genious in its kind.Gore 0/5 Nudity 1/5 Effects 3/5 Story 4/5 comedy 2/5.",indeed cult classic,more than 20 years it took me have look at this cult classic finally did it i do undestand fuss about it not flick everybody that i can tell because lot talking is done but its talking that starts get funny after while fact bunch loser trying solve abduction trying hold money themselves goes terribly wrong after while you even want talking go some art flick here there it was indeed hell ride funny stupid but genious its kind gore 0 5 nudity 1 5 effects 3 5 story 4 5 comedy 2 5,0.7370370370370369,0.07037037037037036,Positive,"{'Happy': 0.08, 'Angry': 0.0, 'Surprise': 0.33, 'Sad': 0.33, 'Fear': 0.25}"
10.0,The Dude Abides!!!,"No movie has entertained me more in the last year than this film. It's delightfully written, directed with poise and acted with extravagance and excellence. I do admit that this is a film that I had to see six times to get. Every time I watch it I learn something new. The genius of the film lies within a game I think the Coen brothers play with their audiences. There are the touches of the masters in many of their films. In ""The Hudsucker Proxy,"" it was Preston Sturges and Frank Capra. In ""Raising Arizona,"" I felt a touch of Sam Fuller. In this film, I felt many touches of greatness, but more specifically I felt John Sayles or even John Cassevettes in spots. The camera was manipulated beautifully and I felt a tinge of their talents lurking in at many a turn. The performances are astounding, especially Goodman as the deranged bowler still living deep within the jungles of the Vietcong. Huddleston is also quite wonderful as the title character. Turturro gives a fine cameo as ""Jesus,"" coupled with a rousing and humurous version of the Eagles, ""Hotel California,"" done in Espanol. I hope this is a film that is looked at with more seriousness. It is, once you dig deep, a fine piece of filmmaking.",dude abides,no movie has entertained me more last year than this film its delightfully written directed with poise acted with extravagance excellence i do admit that this is film that i had see six times get every time i watch it i learn something new genius film lies within game i think coen brothers play with their audiences there are touches masters many their films hudsucker proxy it was preston sturges frank capra raising arizona i felt touch sam fuller this film i felt many touches greatness but more specifically i felt john sayles or even john cassevettes spots camera was manipulated beautifully i felt tinge their talents lurking at many turn performances are astounding especially goodman as deranged bowler still living deep within jungles vietcong huddleston is also quite wonderful as title character turturro gives fine cameo as jesus coupled with rousing humurous version eagles hotel california done espanol i hope this is film that is looked at with more seriousness it is once you dig deep fine piece filmmaking,0.5956228956228956,0.389983164983165,Positive,"{'Happy': 0.06, 'Angry': 0.06, 'Surprise': 0.21, 'Sad': 0.33, 'Fear': 0.33}"
