Rating,Review Title,Review,Cleaned Review Title,Cleaned Review,Subjectivity,Polarity,Sentiment,Emotion Scale
10.0,TLK is Great,"I watched the film today and I have come to the conclusion that this Disney film is one classic that will keep on delivering to Disney fans like myself...TLK is a wonderful film with great characters and songs with a powerful message that you can always find your way back no matter how hard the journey...I think The Lion King is one of the best Disney animated films matching with the power of Bambi and Brother Bear.I love how Disney Works hard to deliver the best in Animation,Song,And MagicI do believe that 2006 and many years from now The Lion King will Shine and still Roar with Success...Thank-You Disney For The Lion King",tlk is great,i watched film today i have come conclusion that this disney film is one classic that will keep delivering disney fans like myself tlk is wonderful film with great characters songs with powerful message that you can always find your way back no matter how hard journey i think lion king is one best disney animated films matching with power bambi brother bear i love how disney works hard deliver best animation song magici do believe that 2006 many years now lion king will shine still roar with success thank you disney lion king,0.4961538461538461,0.44487179487179496,Positive,"{'Happy': 0.16, 'Angry': 0.21, 'Surprise': 0.32, 'Sad': 0.16, 'Fear': 0.16}"
10.0,"Masterpiece, the new one doesnt compare","Watched the new one, and I think I had a disgusted look on my face the entire time. The music, the visuals, the dialogue, the voice acting, etc. Rewatched this one and remembered why this was my favorite Disney movie growing up. From mufasa's death to the goofy hyenas, to the bond between rafiki, simba and mufasa. The music that everyone knows every word to, and scar's ability to deliver each line perfectly. This movie is magic, the new one seems to tech focused and forgot what made lion king so beloved to begin with, its unfortunate. Hoping the circle of life makes it way around and the end of remakes draws close (see what I did there lol). Until then, lion king from the 90s will stay on my shelf and my kids will watch with me. This new one will never end up in my cart and I wont confuse my kids by watching it either. Thank you 90s Disney for the magic!",masterpiece new one doesnt compare,watched new one i think i had disgusted look my face entire time music visuals dialogue voice acting etc rewatched this one remembered why this was my favorite disney movie growing up mufasas death goofy hyenas bond between rafiki simba mufasa music that everyone knows every word scars ability deliver each line perfectly this movie is magic new one seems tech focused forgot what made lion king so beloved begin with its unfortunate hoping circle life makes it way around end remakes draws close see what i did there lol until then lion king 90s will stay my shelf my kids will watch with me this new one will never end up my cart i wont confuse my kids by watching it either thank you 90s disney magic,0.7428787878787878,0.23636363636363636,Positive,"{'Happy': 0.14, 'Angry': 0.11, 'Surprise': 0.25, 'Sad': 0.21, 'Fear': 0.29}"
10.0,"A dazzling, joyous piece of film-making","Of all the animation classics from the Walt Disney Company, there is perhaps none that is more celebrated than ""The Lion King."" Its acclaim is understandable: this is quite simply a glorious work of art.""The Lion King"" gets off to a fantastic start. The film's opening number, ""The Circle of Life,"" is outstanding. The song lasts for about four minutes, but from the first sound, the audience is floored. Not even National Geographic can capture something this beautiful and dramatic. Not only is this easily the greatest moment in film animation, this is one of the greatest sequences in film history.The story that follows is not as majestic, but the film has to tell a story. Actually, the rest of the film holds up quite well. The story takes place in Africa, where the lions rule. Their king, Mufasa (James Earl Jones) has just been blessed with a son, Simba (Jonathan Taylor Thomas), who goes in front of his uncle Scar (Jeremy Irons) as next in line for the throne. Scar is furious, and sets in motion plans to usurp the throne for himself. After a tragedy occurs and Mufasa is killed, Scar persuades Simba to flee, leaving himself as king. Simba grows up in exile, but he learns that while he can run away from his past, he can never escape it.When viewing the film, it is obvious that ""The Lion King"" is quite different from its predecessors (and successors). This is an epic story that contains more dramatic power than all the other Disney films combined. While there are definitely some light-hearted moments, there is no denying the dark drama that takes up the bulk of the story. While it could be argued that Disney is the champion of family entertainment, this film is not for the very young. Some of the sequences are very dark and violent, many bordering on frightening, even for the older crowd.The voice actors are terrific. Jonathan Taylor Thomas brings a large dose of innocence to Young Simba. He's mischievous, but also terribly naive. His older counterpart, voiced by Matthew Broderick, equals him. He's older, but no less mature. The voices are so similar that it's almost impossible not to believe that they are the same character at different ages. Perhaps no one could have been better suited for the role of Mufasa than James Earl Jones. His baritone voice gives the Mufasa a quality of great power and wisdom; there is no question that his role is king. As Scar, Jeremy Irons is pitch-perfect. The drawing of the character is villainous, but Irons' vocal work complements the animation to create one of the most memorable, and vicious, villains in Disney history. He's unquestionably evil, but he's also clever, which makes him all the more dangerous. Manipulation, not violence is his greatest weapon. Providing some much needed comic relief are Nathan Lane and Ernie Sabella as Timon and Pumbaa, two other outcasts (a meerkat and a warthog), and Rowan Atkinson as Zazu. While there is definite fun from these characters, neither the actors nor the filmmakers allow them to go over-the-top and destroy the mood of the film.Disney's animated features are known for their gorgeous artwork. Nowhere is this more apparent than in ""The Lion King."" Every single frame is jaw-dropping. The colors are rich, and the drawings are sharp and beautiful. One of the pitfalls of animation (both computer and hand-drawn) is that there is sometimes a visible distance between the subject and the background, making it seem as if the figure animation was cut and pasted on the background (this is obviously what happens, but it is up to the artists to make sure that it isn't noticeable). There is none of that here.Throughout the Golden Age of Disney animation, the films have been musicals. ""The Lion King"" is no different, and the songs are brilliant. All of the numbers are standouts (""Can You Feel the Love Tonight"" won the Oscar, but in my opinion, ""The Circle of Life"" was better). In the cases of Simba and Nala (Simba's girlfriend), both young and old, there is a noticeable difference between the speaking and singing parts (everyone else does their own singing and speaking), but never mind. It still works, and that's what's important.""The Lion King"" is not flawless, but on first viewing, they aren't noticeable, and it is likely that the young won't ever notice them. ""Beauty and the Beast"" was the first animated film to get an Oscar nomination for Best Picture (it lost to ""The Silence of the Lambs""), and is thus far the only animated film to receive such an honor. That being the case, it's hard to understand why ""The Lion King"" was not given the same distinction. The two films are more or less equal in quality, and the nominees for the honor that year were not strong.If you haven't already, see ""The Lion King."" You won't be disappointed.",dazzling joyous piece film making,all animation classics walt disney company there is perhaps none that is more celebrated than lion king its acclaim is understandable this is quite simply glorious work art lion king gets off fantastic start films opening number circle life is outstanding song lasts about four minutes but first sound audience is floored not even national geographic can capture something this beautiful dramatic not only is this easily greatest moment film animation this is one greatest sequences film history story that follows is not as majestic but film has tell story actually rest film holds up quite well story takes place africa where lions rule their king mufasa james earl jones has just been blessed with son simba jonathan taylor thomas who goes front his uncle scar jeremy irons as next line throne scar is furious sets motion plans usurp throne himself after tragedy occurs mufasa is killed scar persuades simba flee leaving himself as king simba grows up exile but he learns that while he can run away his past he can never escape it when viewing film it is obvious that lion king is quite different its predecessors successors this is epic story that contains more dramatic power than all other disney films combined while there are definitely some light hearted moments there is no denying dark drama that takes up bulk story while it could be argued that disney is champion family entertainment this film is not very young some sequences are very dark violent many bordering frightening even older crowd voice actors are terrific jonathan taylor thomas brings large dose innocence young simba hes mischievous but also terribly naive his older counterpart voiced by matthew broderick equals him hes older but no less mature voices are so similar that its almost impossible not believe that they are same character at different ages perhaps no one could have been better suited role mufasa than james earl jones his baritone voice gives mufasa quality great power wisdom there is no question that his role is king as scar jeremy irons is pitch perfect drawing character is villainous but irons vocal work complements animation create one most memorable vicious villains disney history hes unquestionably evil but hes also clever which makes him all more dangerous manipulation not violence is his greatest weapon providing some much needed comic relief are nathan lane ernie sabella as timon pumbaa two other outcasts meerkat warthog rowan atkinson as zazu while there is definite fun these characters neither actors nor filmmakers allow them go over top destroy mood film disneys animated features are known their gorgeous artwork nowhere is this more apparent than lion king every single frame is jaw dropping colors are rich drawings are sharp beautiful one pitfalls animation both computer hand drawn is that there is sometimes visible distance between subject background making it seem as if figure animation was cut pasted background this is obviously what happens but it is up artists make sure that it isnt noticeable there is none that here throughout golden age disney animation films have been musicals lion king is no different songs are brilliant all numbers are standouts can you feel love tonight won oscar but my opinion circle life was better cases simba nala simbas girlfriend both young old there is noticeable difference between speaking singing parts everyone else does their own singing speaking but never mind it still works thats whats important lion king is not flawless but first viewing they arent noticeable it is likely that young wont ever notice them beauty beast was first animated film get oscar nomination best picture it lost silence lambs is thus far only animated film receive such honor that being case its hard understand why lion king was not given same distinction two films are more or less equal quality nominees honor that year were not strong if you havent already see lion king you wont be disappointed,0.5790369195523835,0.14416902684943922,Positive,"{'Happy': 0.14, 'Angry': 0.08, 'Surprise': 0.16, 'Sad': 0.2, 'Fear': 0.43}"
10.0,A living masterpiece,"This is truly one of the best Disney movies ever. I really enjoyed it when I first seen it, about when I was 6, and since then I watched it over and over again. I simply LOOOOVED the music. It's one of the best soundtracks I've ever heard. And, speaking of soundtrack, I just can't tell in words how much I love the song ""Can You Feel The Love Tonight"". Is one of my favorite songs ever. I truly believe that this motion picture could easily be nominated for The Best Picture, but The Best Song and the Best Original Score is really enough. I wonder if they will ever think to make a prequel of this movie in order to understand who is Mufasa, Scar, Sarabi and the other characters. In short, this movie will be remembered in the next 100 years. Truly.",living masterpiece,this is truly one best disney movies ever i really enjoyed it when i first seen it about when i was 6 since then i watched it over over again i simply looooved music its one best soundtracks ive ever heard speaking soundtrack i just cant tell words how much i love song can you feel love tonight is one my favorite songs ever i truly believe that this motion picture could easily be nominated best picture but best song best original score is really enough i wonder if they will ever think make prequel this movie order understand who is mufasa scar sarabi other characters short this movie will be remembered next 100 years truly,0.46169467787114843,0.4666666666666667,Positive,"{'Happy': 0.14, 'Angry': 0.1, 'Surprise': 0.55, 'Sad': 0.1, 'Fear': 0.1}"
9.0,Wonderful Music and Rhythms,"This is an outstanding work of animation. I realize that it has been criticized for political incorrectness. The fact of the matter is that it has strong female characters as well as male, and it's about a vision of monarchy. I have the greatest respect for female role models but I really don't see this as a worthy criticism. It's a great story of defeat and betrayal and renewal. It has delightful individual characters, dressed up to show their beings in a clever way. It has the most despicable villains with Scar and the Hyenas. It has the Henry II thing about duty. It doesn't glorify fooling around as one of my colleagues told me. The free life is OK but at some time you must follow your heart and redeem yourself. The music is outstanding; another triumph or the Disney team. There are three or four numbers that are so critical to a complete understanding of the events of the story. The sound effects person should have been rewarded because sound is so critical in this. From the stampede to the forbidden areas of the kingdom. I watched this about sixty times with my small children and never really tired of it. I would put this at the top of any list of animated adventures.",wonderful music rhythms,this is outstanding work animation i realize that it has been criticized political incorrectness fact matter is that it has strong female characters as well as male its about vision monarchy i have greatest respect female role models but i really dont see this as worthy criticism its great story defeat betrayal renewal it has delightful individual characters dressed up show their beings clever way it has most despicable villains with scar hyenas it has henry ii thing about duty it doesnt glorify fooling around as one my colleagues told me free life is ok but at some time you must follow your heart redeem yourself music is outstanding another triumph or disney team there are three or four numbers that are so critical complete understanding events story sound effects person should have been rewarded because sound is so critical this stampede forbidden areas kingdom i watched this about sixty times with my small children never really tired it i would put this at top any list animated adventures,0.5923076923076924,0.333974358974359,Positive,"{'Happy': 0.25, 'Angry': 0.0, 'Surprise': 0.22, 'Sad': 0.12, 'Fear': 0.41}"
10.0,One of the greatest animated movies Ever made,"My favorite animated film of all time. The plot, characters, themes, music, emotions and tension are something else. It's truly a classic you will love as a kid and appreciate years later as an adult. A must watch.",one greatest animated movies ever made,my favorite animated film all time plot characters themes music emotions tension are something else its truly classic you will love as kid appreciate years later as adult must watch,0.5111111111111111,0.3777777777777778,Positive,"{'Happy': 0.44, 'Angry': 0.0, 'Surprise': 0.22, 'Sad': 0.22, 'Fear': 0.11}"
10.0,My favorite cartoon from Disney!,"The Lion King is a classic from Disney. I remember going to the movie theater/cinema and watching the film...I was exactly 8 years old. And until now, with 19 years old, the good sensation of watching this movie is the same as that time. My mother even bought me Simba's doll! =)The story takes place in Africa, where Simba, son of Mufasa, is very well protected by his dad.(sometimes with the help of Zazu, a bird that is kind of a counselor of the king Mufasa)Everything goes well, but there is one problem: Scar, Mufasa's brother, is jealous because he is not the king of the jungle, and decides to do a plan to kill Simba and Mufasa. Simba escapes, but Mufasa dies; Scar tells Simba that he is guilty for Mufasa's death,and the terrified Simba runs away, too sad of what happened. Far from his kingdom, Simba meets Pumbaa and Timon, who takes care of him and teaches about Hakuna's Matata philosophy. Everything will be very well for a long time, until Simba meet again his childhood friend Nala ,who tells him about the horrible things Scar is doing in the old Kingdom.",my favorite cartoon disney,lion king is classic disney i remember going movie theater cinema watching film i was exactly 8 years old until now with 19 years old good sensation watching this movie is same as that time my mother even bought me simbas doll story takes place africa where simba son mufasa is very well protected by his dad sometimes with help zazu bird that is kind counselor king mufasa everything goes well but there is one problem scar mufasas brother is jealous because he is not king jungle decides do plan kill simba mufasa simba escapes but mufasa dies scar tells simba that he is guilty mufasas death terrified simba runs away too sad what happened far his kingdom simba meets pumbaa timon who takes care him teaches about hakunas matata philosophy everything will be very well long time until simba meet again his childhood friend nala who tells him about horrible things scar is doing old kingdom,0.5401041666666666,0.06041666666666667,Positive,"{'Happy': 0.16, 'Angry': 0.05, 'Surprise': 0.22, 'Sad': 0.24, 'Fear': 0.32}"
10.0,A Timeless Film,"Ah...""The Lion King."" There's so much I can say about this movie but all my comments always come down to one thing: this movie is beautiful. Pure genius. A timeless story. I might be a little biased in my beliefs, seeing as the first movie I remember seeing in theatres is ""The Lion King"" and I still watch it on a regular basis and know all the words but I'm sure there are plenty of people out there who agree with what I have to say. ""The Lion King"" is beautiful; hands down, it is the best Disney film ever created.The story is something that everyone can relate to, whether they are a lion ;) or not. Simba is destined to become king one day and just can't wait to rule the throne; everyone can relate to wanting to grow up and become an adult, to do whatever they want and not have to worry about anything. His father tries to teach him that, despite the fact that he will one day be grown and king, his life will not be easy. Simba has to learn his lesson the hard way when his Uncle Scar, who, too, wants the throne, kills his father and convinces Simba that it was his fault. Suddenly, growing up doesn't seem so great anymore (I can *really* relate to that).And so, Simba flees his home and comes across Timon and Pumbaa, two other outcasts. They teach Simba the ""Hakuna Matata"" lifestyle, something that idealizes a life free of stress, worry and responsibility. Now, don't we all wish we could live this way? No worries for the rest of our days... But when Simba's childhood friend Nala returns, he realizes that he can't live Hakuna Matata forever, for he does have a responsibility to his pride and his homeland. Simba understands that he must grow up, as we all do, and does what's right.The songs are catchy and fit the movie well (the original songs, of course, though ""The Morning Report"" isn't too bad) and the score is haunting and beautiful. Along with the art work, the music captures the heart of Africa.With the types of shows that children watch these days (boy, doesn't that make me sound old?), it's a wonder they'll learn in virtues and values at all. ""The Lion King"" is a great teacher when it comes to learning lessons that will carry throughout their lifetime. ""The Lion King"" teaches children that it's all right to be a kid but you must understand and accept responsibility for things you can and cannot control. Everyone has a place in The Circle of Life and we must find it; the film also teaches that we will encounter bad and even terrible things during our lifetime but we must accept them and move on. These are important, meaningful lessons; heck, I even used them in my SAT essay! ""The Lion King"" is a film for every generation and is a powerful film that all children should see. I'm past my childhood now and I still watch it whenever I get the chance; I look forward to sharing it with my children.A timeless film!",timeless film,ah lion king theres so much i can say about this movie but all my comments always come down one thing this movie is beautiful pure genius timeless story i might be little biased my beliefs seeing as first movie i remember seeing theatres is lion king i still watch it regular basis know all words but im sure there are plenty people out there who agree with what i have say lion king is beautiful hands down it is best disney film ever created story is something that everyone can relate whether they are lion or not simba is destined become king one day just cant wait rule throne everyone can relate wanting grow up become adult do whatever they want not have worry about anything his father tries teach him that despite fact that he will one day be grown king his life will not be easy simba has learn his lesson hard way when his uncle scar who too wants throne kills his father convinces simba that it was his fault suddenly growing up doesnt seem so great anymore i can really relate that so simba flees his home comes across timon pumbaa two other outcasts they teach simba hakuna matata lifestyle something that idealizes life free stress worry responsibility now dont we all wish we could live this way no worries rest our days but when simbas childhood friend nala returns he realizes that he cant live hakuna matata forever he does have responsibility his pride his homeland simba understands that he must grow up as we all do does whats right songs are catchy fit movie well original songs course though morning report isnt too bad score is haunting beautiful along with art work music captures heart africa with types shows that children watch these days boy doesnt that make me sound old its wonder theyll learn virtues values at all lion king is great teacher when it comes learning lessons that will carry throughout their lifetime lion king teaches children that its all right be kid but you must understand accept responsibility things you can cannot control everyone has place circle life we must find it film also teaches that we will encounter bad even terrible things during our lifetime but we must accept them move these are important meaningful lessons heck i even used them my sat essay lion king is film every generation is powerful film that all children should see im past my childhood now i still watch it whenever i get chance i look forward sharing it with my children timeless film,0.5482022363601311,0.19214466089466092,Positive,"{'Happy': 0.23, 'Angry': 0.07, 'Surprise': 0.25, 'Sad': 0.25, 'Fear': 0.2}"
