Rating,Review Title,Review,Cleaned Review Title,Cleaned Review,Subjectivity,Polarity,Sentiment,Emotion Scale
9.0,The excuses we make to justify our neglect of others,"An appreciation of this movie may demand some understanding of Japanese culture. The Japanese are rather reserved, and were even more reserved back in the early 1950's, when this film is set. No embracing, even of parents, children, siblings; no dramatic histrionics; even a death scene in this movie is much quieter than a Westerner might expect.Consequently I can't really blame several reviewers here for calling this movie boring and slow-paced. But it is not at all slow-paced from a different cultural perspective. It just depends on what you're used to.If you do take the time to watch and try to understand it, you'll find an engrossing analysis of the dynamic of a middle-class family, the rift that grows up between generations, and of the many excuses we find ourselves making to justify our neglect for others, even those dearest to us. These themes are universal, but are couched in a postwar Japanese idiom, and so probably less accessible to the average Western viewer.I have wondered awhile about a speech at the end by Noriko, the widowed daughter-in-law, in which she denies that she's such a good person (though her actions in the movie indicate otherwise). I'm still not sure I understand her motives in saying this. For the most part, however, this movie will not leave you puzzled, but it may leave you a bit wiser, and a bit more reluctant to make those excuses.",excuses we make justify our neglect others,appreciation this movie may demand some understanding japanese culture japanese are rather reserved were even more reserved back early 1950s when this film is set no embracing even parents children siblings no dramatic histrionics even death scene this movie is much quieter than westerner might expect consequently i cant really blame several reviewers here calling this movie boring slow paced but it is not at all slow paced different cultural perspective it just depends what youre used if you do take time watch try understand it youll find engrossing analysis dynamic middle class family rift that grows up between generations many excuses we find ourselves making justify our neglect others even those dearest us these themes are universal but are couched postwar japanese idiom so probably less accessible average western viewer i have wondered awhile about speech at end by noriko widowed daughter law which she denies that shes such good person though her actions movie indicate otherwise im still not sure i understand her motives saying this most part however this movie will not leave you puzzled but it may leave you bit wiser bit more reluctant make those excuses,0.3274904214559387,0.08017241379310344,Positive,"{'Happy': 0.05, 'Angry': 0.03, 'Surprise': 0.28, 'Sad': 0.23, 'Fear': 0.41}"
10.0,Great movie,"Greetings from Lithuania.""Tokyo Story"" (1953) is an ageless story about family, love and realizing of true values in life. This is a sad but at the same time inspiring story - but enough about stories - this movie shows life as it is - still. I loved the performances in this movie by simply everyone involved, as well as great directing and amazing writing. Although the movie is 2 h 15 min long and its a black and white ""old"" movie don't be fooled - this is a great movie that makes you think about your life and especially the people you love and that you have to love them while their are still here with you, because life is very short and better make most of it with the people you love. Great movie.",great movie,greetings lithuania tokyo story 1953 is ageless story about family love realizing true values life this is sad but at same time inspiring story but enough about stories this movie shows life as it is still i loved performances this movie by simply everyone involved as well as great directing amazing writing although movie is 2 h 15 min long its black white old movie dont be fooled this is great movie that makes you think about your life especially people you love that you have love them while their are still here with you because life is very short better make most it with people you love great movie,0.5898115079365079,0.32222222222222224,Positive,"{'Happy': 0.38, 'Angry': 0.04, 'Surprise': 0.15, 'Sad': 0.12, 'Fear': 0.31}"
10.0,Beautiful and deeply moving,"Why did it take so long for me to see this film? I don't know why that is, other than being behind with my movie watching due to studying, and I am still kicking myself because Tokyo Story was one of the best films I've seen in quite some time. I haven't seen enough of Yasujiro Ozu's work to judge him as an overall director, but seeing Tokyo Story it is very easy to see why anybody would consider it one of his finest achievements or him as a master film-maker. Tokyo Story is beautifully shot, everything looks homely and evocative and the shots, frame and cinematography are done to perfection. And Ozu directs very sensitively and assuredly, it is said that he specialised in middle-class family melodramas and I have no trouble believing that. The story is quiet and meditatively paced but never bored me, because every bit of writing, family scene and character was dealt with in such a poignant and intelligent manner. Tokyo Story is also helped by some truly wonderful acting. Setsuko Hara just epitomises gentle kindness, making us warm to Noriko easily, while Chishu Ryu and Chieko Higashiyama play their roles with nuanced and affecting dignity. In conclusion, a beautiful and deeply moving film in all respects. 10/10 Bethany Cox",beautiful deeply moving,why did it take so long me see this film i dont know why that is other than being behind with my movie watching due studying i am still kicking myself because tokyo story was one best films ive seen quite some time i havent seen enough yasujiro ozus work judge him as overall director but seeing tokyo story it is very easy see why anybody would consider it one his finest achievements or him as master film maker tokyo story is beautifully shot everything looks homely evocative shots frame cinematography are done perfection ozu directs very sensitively assuredly it is said that he specialised middle class family melodramas i have no trouble believing that story is quiet meditatively paced but never bored me because every bit writing family scene character was dealt with such poignant intelligent manner tokyo story is also helped by some truly wonderful acting setsuko hara just epitomises gentle kindness making us warm noriko easily while chishu ryu chieko higashiyama play their roles with nuanced affecting dignity conclusion beautiful deeply moving film all respects 10 10 bethany cox,0.5814102564102565,0.2664102564102564,Positive,"{'Happy': 0.08, 'Angry': 0.0, 'Surprise': 0.31, 'Sad': 0.33, 'Fear': 0.28}"
10.0,Just Too Real,"An elderly Japanese couple come to Tokyo to visit children and grandchildren. From the beginning, we get a sense that they are looked at as a nuisance, even though they have not seen their family for years. While they visit, the children are hard pressed to take a little time for them. We see that they have settled into their lives (rather depressing lives) and into themselves. The kindest person is a young woman who the widow of one of the sons. She is kind an compassionate. True, not a lot happens, but as we go through the two hours, it is painful how tense things are and what an edge there is. I've seen these kinds of relationships in my extended family and in the families of others. This is a very well constructed film.",just too real,elderly japanese couple come tokyo visit children grandchildren beginning we get sense that they are looked at as nuisance even though they have not seen their family years while they visit children are hard pressed take little time them we see that they have settled into their lives rather depressing lives into themselves kindest person is young woman who widow one sons she is kind compassionate true not lot happens but as we go through two hours it is painful how tense things are what edge there is ive seen these kinds relationships my extended family families others this is very well constructed film,0.5356060606060606,-0.06022727272727273,Negative,"{'Happy': 0.16, 'Angry': 0.05, 'Surprise': 0.26, 'Sad': 0.32, 'Fear': 0.21}"
10.0,"""Isn't Life Depressing?""","Two women are sitting on tatami mats. They are smiling and talking. One ofthem says, ""Isn't life depressing?"" Wow... that pretty much says it.Tokyo Story is defenitely one of the finest movies ever made. Easy. I don't care what anyone says: slow or not, this is one of Ozu's finest films. Very few movies have made my cry, but I did indeed weep at this movie. All of the actingperformances are very believeable, especially Hara's. The interesting knee- level tatami cinematography suits the film perfectly. Even the music isimpeccable. What really gets me with Tokyo Story is how stunningly realistic it is. From the dialogue to the story, everything feels like real life. No matter what language you speak, what culture or country you hail from, this element is universal.It's pretty much perfect... every character is fleshed out, there are no plot holes left open... I can't find anything to complain about it! 50 years after its release and it's still very contemporary... damn. I give it **** out of ****.",isnt life depressing,two women are sitting tatami mats they are smiling talking one ofthem says isnt life depressing wow that pretty much says it tokyo story is defenitely one finest movies ever made easy i dont care what anyone says slow or not this is one ozus finest films very few movies have made my cry but i did indeed weep at this movie all actingperformances are very believeable especially haras interesting knee level tatami cinematography suits film perfectly even music isimpeccable what really gets me with tokyo story is how stunningly realistic it is dialogue story everything feels like real life no matter what language you speak what culture or country you hail this element is universal its pretty much perfect every character is fleshed out there are no plot holes left open i cant find anything complain about it 50 years after its release its still very contemporary damn i give it out,0.5577777777777778,0.1407936507936508,Positive,"{'Happy': 0.14, 'Angry': 0.0, 'Surprise': 0.28, 'Sad': 0.31, 'Fear': 0.28}"
10.0,beautiful meditation on old age and family; simple and moving,"I can't take my mind off this movie. The story is both universally human (old age, the end of life, parents and children) and specifically Japanese. The movie tells the viewer so much about Japanese middle class life in the 1950s: eating and sleeping; mourning the war dead; clothes and home furnishings; spoiled kids; a doctor's office; a schoolroom; life in Tokyo and small towns; how family members talk to each other; old men's drinking habits; a resort hotel. But while we see all these details of a real time and place, we are constantly drawn into reflection on the meaning of human life and relationships. The reflection emerges effortlessly from the simple narrative and the specifics. The director never annoyingly tells us how to feel, he is not preaching and not drawing attention to himself. (There is none of that ""hey, I'm making a moving movie"" crud that you get in Hollywood treatment of these topics). He just lets the story unfold in a quiet, natural way. It's not for folks who only like ""action"" movies. I put ""action"" in quotes because this movie is about the real action in life--enjoying life, sharing it with others, facing the end of it.",beautiful meditation old age family simple moving,i cant take my mind off this movie story is both universally human old age end life parents children specifically japanese movie tells viewer so much about japanese middle class life 1950s eating sleeping mourning war dead clothes home furnishings spoiled kids doctors office schoolroom life tokyo small towns how family members talk each other old mens drinking habits resort hotel but while we see all these details real time place we are constantly drawn into reflection meaning human life relationships reflection emerges effortlessly simple narrative specifics director never annoyingly tells us how feel he is not preaching not drawing attention himself there is none that hey im making moving movie crud that you get hollywood treatment these topics he just lets story unfold quiet natural way its not folks who only like action movies i put action quotes because this movie is about real action life enjoying life sharing it with others facing end it,0.3242380952380952,0.09300000000000001,Positive,"{'Happy': 0.07, 'Angry': 0.07, 'Surprise': 0.17, 'Sad': 0.28, 'Fear': 0.4}"
10.0,FANTASTIC,"I need to say this: THIS MOVIE IS ABSOLUTELY FANTASTIC!!! Sure it starts off slowly, but the fact of the matter is the film is a great story of a family and the alienation associated with aging. This is the kind of movie that will make you reflect upon your own family and how you treat them.I had never seen an Ozu film before, but now I feel as if I must see them all. His use of cinematic space is incredible. He breaks all sorts of conventions with his cinematography such as violating the axis of action. This gives the viewer the sense of a large, open, unrestricted world.Going with this realism, the characters seem real; not for a moment did I see the people on the screen as actors. They were the family, and you as the viewer feels what they feel. Part of this comes from the use of head-on-shots such that the characters are speaking TO you.It is a fantastic, moving piece of work and arguably one of the best films ever made.",fantastic,i need say this this movie is absolutely fantastic sure it starts off slowly but fact matter is film is great story family alienation associated with aging this is kind movie that will make you reflect upon your own family how you treat them i had never seen ozu film before but now i feel as if i must see them all his use cinematic space is incredible he breaks all sorts conventions with his cinematography such as violating axis action this gives viewer sense large open unrestricted world going with this realism characters seem real not moment did i see people screen as actors they were family you as viewer feels what they feel part this comes use head shots such that characters are speaking you it is fantastic moving piece work arguably one best films ever made,0.6098506069094305,0.34201680672268914,Positive,"{'Happy': 0.15, 'Angry': 0.03, 'Surprise': 0.3, 'Sad': 0.12, 'Fear': 0.39}"
10.0,Extraordinary Portrayal of Real Life,"A fantastic film that belies the simplicity of its plot, Tokyo Story is the tale of a vacation gone sadly awry, with an elderly man and woman visiting from the countryside pushed to the sidelines by their busy children in the city. The younger generation (and by extension the ""new"" Japan) turns its back on the family from which it arose- because of selfishness, because of necessity, or because it's simply the way of the world. The movie provides no easy answers- its melancholy ambiguity is part of its charm. Whatever the case, Ozu delights in portraying the details of everyday life. The emotional resonances of this movie are extraordinary, and some shots (a child picking flowers, an old couple framed by the sea, a woman sitting forlornly at her work desk) are enough to give a sensitive film-goer the shivers. Despite the testimony of some critics, the film is not totally devoid of melodramatic elements (some stock characters and cloying musical motifs spring readily to mind), but the film is founded upon such an obvious love and respect for the importance of real-world interactions that it's hard not to be anything other than enthralled by it.",extraordinary portrayal real life,fantastic film that belies simplicity its plot tokyo story is tale vacation gone sadly awry with elderly man woman visiting countryside pushed sidelines by their busy children city younger generation by extension new japan turns its back family which it arose because selfishness because necessity or because its simply way world movie provides no easy answers its melancholy ambiguity is part its charm whatever case ozu delights portraying details everyday life emotional resonances this movie are extraordinary some shots child picking flowers old couple framed by sea woman sitting forlornly at her work desk are enough give sensitive film goer shivers despite testimony some critics film is not totally devoid melodramatic elements some stock characters cloying musical motifs spring readily mind but film is founded upon such obvious love respect importance real world interactions that its hard not be anything other than enthralled by it,0.5004675324675325,0.052787878787878786,Positive,"{'Happy': 0.24, 'Angry': 0.06, 'Surprise': 0.18, 'Sad': 0.21, 'Fear': 0.32}"
,Too subtle and yet too obvious,"This film is commonly called one of the masterpieces of international film. Indeed, a well-known ""intro to film"" textbook uses it as a case study in notable film-making. But, as more than one reviewer so far has pointed out, 'Tokyo Story' is slow, obscure, and sometimes seemingly sterile. Understanding how a great classic could be seemingly soulless requires some study - of Japanese culture, as others have pointed out, of film technique, and of ourselves. Fortunately, that understanding more than fully repays itself, as is true of any great piece of art.I should begin by warning the first time viewer that the film is not in any familiar style. Other reviewers have mentioned the camera, the angles, the acting, the elision - I hardly need dwell on these. Those used to Hollywood films of almost any era will find 'Tokyo Story' odd and unsettling, just because the style is so different. And of course the culture is radically different. In this forum one can hardly even begin to discuss the way that Japanese fathers discuss their children amongst themselves, or the marriage culture of 1950s Japan. But I think the film is great even if one has no understanding of continuity editing, or post-war Japan, or a dozen other obscure topics. This is, after all, the central feature of great art: Even those of us who do not fully understand still realize, in some unspeakable way, that we are in the presence of something great.The most common accusations leveled against this film, oddly, assert alternatively that it is a cold, soulless exercise in technique or, on the other hand, that it is a soap opera, with no real substance. I think neither of those is true. There can be no question that it is easily seen as cold. Nothing really happens, by modern standards. It is merely a family that comes and goes and lives and dies. Of course, to those who accuse it of being a soap opera, that death is the foremost evidence of its manipulative guilt. But, for those who have seen it, recall the mother's stroke, or where Keizo is told to look one last time - would a soap opera elide such a supremely emotional scenes?No, 'Tokyo Story' is neither cold nor manipulative. Rather, it slowly brings you into a family that, while perhaps totally unlike your own, is at its base just the same. Then it allows those things to happen that must someday happen to all of us - growing up, moving away, and that unspeakable, inescapable end. It is not easy; it is not obvious; but it is not obscure, either. After it all, I can only tell you this: If you have lived long enough to know how it feels to leave your parents and only realize far too late, as it seems we all do, the value of what you have left behind, then 'Tokyo Story' will reward you perfectly. And these things - we all do these very things, so 'Tokyo Story' is universal, is Art.",too subtle yet too obvious,this film is commonly called one masterpieces international film indeed well known intro film textbook uses it as case study notable film making but as more than one reviewer so far has pointed out tokyo story is slow obscure sometimes seemingly sterile understanding how great classic could be seemingly soulless requires some study japanese culture as others have pointed out film technique ourselves fortunately that understanding more than fully repays itself as is true any great piece art i should begin by warning first time viewer that film is not any familiar style other reviewers have mentioned camera angles acting elision i hardly need dwell these those used hollywood films almost any era will find tokyo story odd unsettling just because style is so different course culture is radically different this forum one can hardly even begin discuss way that japanese fathers discuss their children amongst themselves or marriage culture 1950s japan but i think film is great even if one has no understanding continuity editing or post war japan or dozen other obscure topics this is after all central feature great art even those us who do not fully understand still realize some unspeakable way that we are presence something great most common accusations leveled against this film oddly assert alternatively that it is cold soulless exercise technique or other hand that it is soap opera with no real substance i think neither those is true there can be no question that it is easily seen as cold nothing really happens by modern standards it is merely family that comes goes lives dies course those who accuse it being soap opera that death is foremost evidence its manipulative guilt but those who have seen it recall mothers stroke or where keizo is told look one last time would soap opera elide such supremely emotional scenes no tokyo story is neither cold nor manipulative rather it slowly brings you into family that while perhaps totally unlike your own is at its base just same then it allows those things happen that must someday happen all us growing up moving away that unspeakable inescapable end it is not easy it is not obvious but it is not obscure either after it all i can only tell you this if you have lived long enough know how it feels leave your parents only realize far too late as it seems we all do value what you have left behind then tokyo story will reward you perfectly these things we all do these very things so tokyo story is universal is art,0.53025641025641,0.04974358974358977,Positive,"{'Happy': 0.1, 'Angry': 0.02, 'Surprise': 0.29, 'Sad': 0.29, 'Fear': 0.31}"
9.0,Life is simple and unique. That's very true.,"TOKYO STORY is a film that has a moderate tone, unobtrusive style and quiet family story. An elderly couple from the provinces coming to Tokyo to visit their grown children. The story shows how the children, preoccupied with their daily lives, do not show enough care for their parents, as opposed to the former daughter-whose husband died in the war. At first glance, everything in this film seems simple and clear, but on the other hand is a sensitive topic and family discord, somewhat generational conflict with fairly deep emotions without excessive melodrama.Staff are interesting, a little strange, however, show sincere emotion without many words. Of course, you need to understand Japanese culture, which I somehow fascinated. The story can be identified three generations of which is the oldest in a harmonious relationship. Although it can be concluded that it is not always the case. The younger do not have time for yourself and not for others.Most people do not live. Survive. Understanding and tranquility in fact represent the fund in relation to the sentiment and satire. People consciously or unconsciously influence the lives of others. People woven in one's life are there, even when they are not physically present.Setsuko Hara as Noriko Hirayama really is a beauty. She plays a woman who has all the prerequisites that clearly says ""Life is disappointing"", but again full of mercy, kept calm and beautiful smile that does not come off from the face. Well, sometimes that smile accompanies large tear.",life is simple unique thats very true,tokyo story is film that has moderate tone unobtrusive style quiet family story elderly couple provinces coming tokyo visit their grown children story shows how children preoccupied with their daily lives do not show enough care their parents as opposed former daughter whose husband died war at first glance everything this film seems simple clear but other hand is sensitive topic family discord somewhat generational conflict with fairly deep emotions without excessive melodrama staff are interesting little strange however show sincere emotion without many words course you need understand japanese culture which i somehow fascinated story can be identified three generations which is oldest harmonious relationship although it can be concluded that it is not always case younger do not have time yourself not others most people do not live survive understanding tranquility fact represent fund relation sentiment satire people consciously or unconsciously influence lives others people woven ones life are there even when they are not physically present setsuko hara as noriko hirayama really is beauty she plays woman who has all prerequisites that clearly says life is disappointing but again full mercy kept calm beautiful smile that does not come off face well sometimes that smile accompanies large tear,0.4318386243386243,0.12260010822510825,Positive,"{'Happy': 0.18, 'Angry': 0.03, 'Surprise': 0.21, 'Sad': 0.31, 'Fear': 0.28}"
