Rating,Review Title,Review,Cleaned Review Title,Cleaned Review,Subjectivity,Polarity,Sentiment,Emotion Scale
7.0,A Movie to Make You Think about Parents' Seniority and Children Indifference and Selfishness,"In Onomichi, Hiroshima, the retired Shukishi Hirayama (Chishû Ryû) and his wife Tomi Hirayama (Chieko Higashiyama) live with their single daughter, the teacher Kyôko (Kyôko Kagawa). They decide to travel in a long voyage by train to Tokyo to visit their children, the doctor Koichi Hirayama (Sô Yamamura) and the hairdresser Shige Kaneko (Haruko Sugimura). However, Koichi and Shige can not afford time to spend with their parents but the widow sister-in-law Noriko Hirayama (Setsuko Hara) gives attention to them and go on sightseeing through Tokyo with the old couple. Shukishi and Tomi note that their children do not have time for them and they decide to return to Onomichi. Along their trip, Tomi does not feel well and they stop in Osaka to visit their son Keizo Hirayama (Shirô Osaka). Soon each son and daughter receives a telegram from Onomichi with sad news.""Tôkyô monogatari"" is a sad story of family indifference, selfishness and farewell directed by Yasujirô Ozu using his traditional style with a steady camera and centralized filming. This movie makes the viewer thinks about parents' seniority and children indifference and selfishness that cannot spend time with them. Makes also think how short life is and how soon the son or daughter will become the old parent that he or she neglected. My vote is seven.Title (Brazil): ""Era Uma Vez em Tóquio"" (""Once Upon a Time in Tokyo"")",movie make you think about parents seniority children indifference selfishness,onomichi hiroshima retired shukishi hirayama chish ry his wife tomi hirayama chieko higashiyama live with their single daughter teacher ky ko ky ko kagawa they decide travel long voyage by train tokyo visit their children doctor koichi hirayama s yamamura hairdresser shige kaneko haruko sugimura however koichi shige can not afford time spend with their parents but widow sister law noriko hirayama setsuko hara gives attention them go sightseeing through tokyo with old couple shukishi tomi note that their children do not have time them they decide return onomichi along their trip tomi does not feel well they stop osaka visit their son keizo hirayama shir osaka soon each son daughter receives telegram onomichi with sad news t ky monogatari is sad story family indifference selfishness farewell directed by yasujir ozu using his traditional style with steady camera centralized filming this movie makes viewer thinks about parents seniority children indifference selfishness that cannot spend time with them makes also think how short life is how soon son or daughter will become old parent that he or she neglected my vote is seven title brazil era uma vez em t quio once upon time tokyo,0.5064285714285715,-0.06183982683982685,Negative,"{'Happy': 0.0, 'Angry': 0.04, 'Surprise': 0.26, 'Sad': 0.3, 'Fear': 0.41}"
7.0,slow but mesmerizing,Elderly couple Shūkichi and Tomi Hirayama go to Tokyo to visit their children and their families. Their oldest son Kōichi has a family of four. Shige is married and runs a hair salon. Both of them are extremely busy and pay for expensive trips for their parents. Their daughter-in-law Noriko is widowed after the war. She is the most caring but mother Tomi notes a loneliness in Noriko's life. However Noriko is not feeling well.There is a quietness and stillness about the camera style. The characters sometimes talk directly into the camera which can be distracting. It's a naturalistic feel. These people feel real and their emotions have depth. It's a slow movie but it doesn't feel boring. It's kind of mesmerizing like watching a real family.,slow but mesmerizing,elderly couple sh kichi tomi hirayama go tokyo visit their children their families their oldest son k ichi has family four shige is married runs hair salon both them are extremely busy pay expensive trips their parents their daughter law noriko is widowed after war she is most caring but mother tomi notes loneliness norikos life however noriko is not feeling well there is quietness stillness about camera style characters sometimes talk directly into camera which can be distracting its naturalistic feel these people feel real their emotions have depth its slow movie but it doesnt feel boring its kind mesmerizing like watching real family,0.5321428571428571,0.06071428571428571,Positive,"{'Happy': 0.04, 'Angry': 0.0, 'Surprise': 0.39, 'Sad': 0.35, 'Fear': 0.22}"
10.0,"I need to see it again even after two times; a beautiful mix of simplicity, nuance, style and humility","I was shown Yasujiro Ozu's Tokyo Story- my first Ozu film- in an Art-film class some years ago, and I watched it again a couple of months ago. This has to be a truly indelible Japanese film, even to those who might dismiss it dimly as 'slow' or one where nothing happens. Actually, if you're going by traditional plot, not a lot does happen. But then again, not a lot happens on Seinfeld, either. In fact, maybe on repeat viewings, this could become the serene, Japanese tragic-comic equivalent of Seinfeld. After two viewings I get the 'jist' of the characters, their simple objectives and how they live their lives, but there's still much that can be taken in, it's hard to describe. While I'm not sure I've seen one of the ten best films ever made, as it has been for some critics and audiences, I do think it's a very unique film, one that moves in a way akin to an Italian neo-realist film, but filmed with a very particular eye that sets it apart from them.In terms of how its characters go about in the story, it is really closer to a work of De Sica or other, as it is centrally about the importance of family, and how a family and its members through the petty parts and especially through the tragic times has to stick together. The family unit here involves a couple of grandparents (Chishu Ryu and Chieko Higashiyama, who have those funny, dependent, though truthful ways about them as elders of the common ilk) who come to visit the rest of their family, and aside from (more than any other) daughter-in-law Noriko (played in such a wonderfully every-day, compassionate way by the great Setsuko Hara), they're dealt with the 'it's the old folks again'. This is particular by their own real daughter, who seems most ungrateful for their arrival. They send them to a resort, but then something un-expected happens, which turns the situation around and ground the henpecking to an immediate halt.Some scenes still stick in my head even when I least expect them going about my days, much as the aforementioned Seinfeld episodes seem to do. I loved the gentleness in one scene where Noriko is offered a gift by the grandmother, it rings perfectly true to the everyday, but it's handled in such a way that could not have been done as well in another film. There's also a great deal of humility, with moments of amusement, when two male characters (one of them the grandfather I believe) get drunk. And throughout the film, Ozu creates impressionable compositions, setting him apart with just this film alone for me as a remarkable artist; I still remember certain shots of the houses and scapes (his specific way of shooting characters in the interiors is really neat too). In the class our teacher told us this was part of what were called 'handkerchief films' or something close to that in Japan, where audiences would bring hander-chiefs with them from crying so much during the film. I can see why; probably the best that can be said of Tokyo Story is how he pulls so much out of so little, and the interest that is always constant, even through little domestic squabble scenes, quiet moments with the elders (the old man has a look that's perfect throughout), and the more intense ones later on. In short, it's definitely at least one of the very best Japanese films of the 1950s, in the same rank as Kurosawa's best films.",i need see it again even after two times beautiful mix simplicity nuance style humility,i was shown yasujiro ozus tokyo story my first ozu film art film class some years ago i watched it again couple months ago this has be truly indelible japanese film even those who might dismiss it dimly as slow or one where nothing happens actually if youre going by traditional plot not lot does happen but then again not lot happens seinfeld either fact maybe repeat viewings this could become serene japanese tragic comic equivalent seinfeld after two viewings i get jist characters their simple objectives how they live their lives but theres still much that can be taken its hard describe while im not sure ive seen one ten best films ever made as it has been some critics audiences i do think its very unique film one that moves way akin italian neo realist film but filmed with very particular eye that sets it apart them terms how its characters go about story it is really closer work de sica or other as it is centrally about importance family how family its members through petty parts especially through tragic times has stick together family unit here involves couple grandparents chishu ryu chieko higashiyama who have those funny dependent though truthful ways about them as elders common ilk who come visit rest their family aside more than any other daughter law noriko played such wonderfully every day compassionate way by great setsuko hara theyre dealt with its old folks again this is particular by their own real daughter who seems most ungrateful their arrival they send them resort but then something un expected happens which turns situation around ground henpecking immediate halt some scenes still stick my head even when i least expect them going about my days much as aforementioned seinfeld episodes seem do i loved gentleness one scene where noriko is offered gift by grandmother it rings perfectly true everyday but its handled such way that could not have been done as well another film theres also great deal humility with moments amusement when two male characters one them grandfather i believe get drunk throughout film ozu creates impressionable compositions setting him apart with just this film alone me as remarkable artist i still remember certain shots houses scapes his specific way shooting characters interiors is really neat too class our teacher told us this was part what were called handkerchief films or something close that japan where audiences would bring hander chiefs with them crying so much during film i can see why probably best that can be said tokyo story is how he pulls so much out so little interest that is always constant even through little domestic squabble scenes quiet moments with elders old man has look thats perfect throughout more intense ones later short its definitely at least one very best japanese films 1950s same rank as kurosawas best films,0.45994157848324513,0.14937244468494465,Positive,"{'Happy': 0.14, 'Angry': 0.03, 'Surprise': 0.25, 'Sad': 0.23, 'Fear': 0.35}"
8.0,exceptionally crafted but depressing,"This is a marvelous movie with exceptional acting throughout. However, it is also INCREDIBLY bleak and sad, so be forewarned!!! The story begins with an older Japanese couple (grandma and grandpa) packing to go to Tokyo to see their grown son, daughter and daughter-in-law (whose husband, their 2nd son, was killed in the war). However, despite their letting everyone know they were coming, they are treated as inconveniences. The only one who showed them any consideration was the daughter-in-law. Particularly disgusting was their daughter, who ALWAYS told her husband to spend LESS on her parents, as they wouldn't know any better. Lovely kids, huh?! Anyways, after spending their time in Tokyo, they return to their hometown and grandma becomes deathly ill. You can probably guess where this is going. Despite all this, the grandparents continually say they've got good kids, even though they seem like selfish jerks.",exceptionally crafted but depressing,this is marvelous movie with exceptional acting throughout however it is also incredibly bleak sad so be forewarned story begins with older japanese couple grandma grandpa packing go tokyo see their grown son daughter daughter law whose husband their 2nd son was killed war however despite their letting everyone know they were coming they are treated as inconveniences only one who showed them any consideration was daughter law particularly disgusting was their daughter who always told her husband spend less her parents as they wouldnt know any better lovely kids huh anyways after spending their time tokyo they return their hometown grandma becomes deathly ill you can probably guess where this is going despite all this grandparents continually say theyve got good kids even though they seem like selfish jerks,0.6394736842105263,-0.014035087719298248,Negative,"{'Happy': 0.12, 'Angry': 0.06, 'Surprise': 0.38, 'Sad': 0.31, 'Fear': 0.12}"
,A few observations,"(some spoilers)Why would anyone want to write anything about a film released half a century ago? There are two most obvious reasons: (a) the author has only recently seen it and (b) the film is timeless, just as relevant today as when it was first released. In this case, it is both.Over the last half-century, Tokyo Story has found its way into the top ten list of numerous film critics. Much have been said about the reason why. What I'm trying to do here is just to make several observations, about things in this film that particularly strike me.One is on the scene at the Tokyo train terminal, when the old couple returns home after their visit in Tokyo. Most of us in today's world would have plenty of experience is saying farewell. Less of us would have experience in saying farewell to people whom we just may not see again. Still less of us (only those who have been around long enough) would have experience in saying farewell to people who expect that they may not see us again. Those of us in this last category would probably sense what I am referring to about the scene. The old women, in a completely matter-of-course manner, said to her children that now that they have had this reunion, if anything happens afterwards, they need not come (to the small town where the old couple lives). So plainly delivered, this line is one of the things that make Tokyo Story stand above other films with similar situations and similar dialogues.Another is a very haunting static image. Leading towards it is the part when the old couple's son, a very busy medical doctor, scraps the plan of a family outing. While the somewhat rebellious older grandson sulks, the grandmother successfully coaxes the younger son to go outside to play in a somewhat desolate industrial area. The grandmother, somewhat predictably, asks the little guy what he wants to do when he grows up, and equally predictably, the question is beyond his grasp, as he continues to pluck at the tall grasses. Then comes this last shot of the sequence, a distant shot of old on the right side of the screen and the young on the left. Regardless of what message you get out of this shot, the image is haunting.",few observations,some spoilers why would anyone want write anything about film released half century ago there are two most obvious reasons author has only recently seen it b film is timeless just as relevant today as when it was first released this case it is both over last half century tokyo story has found its way into top ten list numerous film critics much have been said about reason why what im trying do here is just make several observations about things this film that particularly strike me one is scene at tokyo train terminal when old couple returns home after their visit tokyo most us todays world would have plenty experience is saying farewell less us would have experience saying farewell people whom we just may not see again still less us only those who have been around long enough would have experience saying farewell people who expect that they may not see us again those us this last category would probably sense what i am referring about scene old women completely matter course manner said her children that now that they have had this reunion if anything happens afterwards they need not come small town where old couple lives so plainly delivered this line is one things that make tokyo story stand above other films with similar situations similar dialogues another is very haunting static image leading towards it is part when old couples son very busy medical doctor scraps plan family outing while somewhat rebellious older grandson sulks grandmother successfully coaxes younger son go outside play somewhat desolate industrial area grandmother somewhat predictably asks little guy what he wants do when he grows up equally predictably question is beyond his grasp as he continues pluck at tall grasses then comes this last shot sequence distant shot old right side screen young left regardless what message you get out this shot image is haunting,0.33508699633699635,0.06260760073260073,Positive,"{'Happy': 0.04, 'Angry': 0.04, 'Surprise': 0.35, 'Sad': 0.18, 'Fear': 0.39}"
