Rating,Review Title,Review,Cleaned Review Title,Cleaned Review,Subjectivity,Polarity,Sentiment,Emotion Scale
10,Wisdom Substance,"From the director of 'Gamyam', comes another meaningful story 'Vedham'. Audience in search of wisdom, your ultimate stop is here. Readers, if this review goes a little long, it is only that appreciation to this movie has no bounds. Krish has done a flawless job that will make the audience sit at the edge of the seat for most of the time.With this movie, Tollywood goes to the next level. The level from commercial cinema to meaningful cinema! Krish has already announced his arrival with 'Gamyam' and now he has cemented his place with 'Vedam'.The Characters'Vedam' is the story of 6 people. All the people involved are introduced individually. First in the list is Manchu Manoj as Vivek Chakravarthy who's introduced with a title as 'Rocking Star'. He is a rock star in the movie and a song showing him as a rock star appears soon after the title of the movie. He along with his girl friend Lasya (Lekha Washington) and their gang set up a rock band in Bangalore. They go to Hyderbad for a performance.Next is Nagayya as Ramulu, an old man from Lingampally, is introduced along with his daughter in law Saranya. They are illiterates who face serious financial problems. They are in debt to Patel who has Saranya's son captive. Only upon paying the debt, the son would be set free. The only solution is to sell a kidney of Saranya that takes the old man and his daughter in law to Hyderbad.Next scene is a 'basthi' (slum) in Jubilee hills, Hyderbad. Allu Arjun as 'Cable Raju' is introduced. He's educated yet works as a cable boy who doesn't pay his boss. He fakes his life as a rich brat and makes his filthy rich girl friend believe the same. He needs money to impress his girl friend.In this list of 6 people, the fifth in the line is Manoj Bajpai as Rahim Qureshi. A bitter past in a Hindu Muslim fight, his pregnant wife loses the foetus before birth. A small misunderstanding with a cop has him in a black list. He is a good man and a beloved husband yet in the bad books of the police.The last in the list is Anushka who's Saroja, a prostitute. She knows no other way of living. She along with her friend, 'Karpooram', a eunuch, wants to get out of the prostitute house they work for. They want to set up on their own.The PlotThis is a classic movie that will go in to history no doubt! IndiaGlitz appreciates the director, Krish for making such a meaningful movie. Only a gist is given and nothing more. After the introduction of all characters, the plot takes place on 31st night. Every character is associated with Hyderbad. This one night is life changing for all the 6 persons and the people associated with them.Parallel to the lives of these 6 people, a gang of terrorists plot a plan to massacre innocent citizens in the name of 'Jihad'. How these people are related and how the others in the hospital, who are held as hostages by the terrorists, are saved, forms the terrific remainder of this paramount story.The hero of the movieThe screenplay and it is the hero! The introduction of all characters is done one by one. It is a simple yet powerful screenplay. The characterization of all characters is sketched carefully in such a way that the script is not dominated. Given the images of Allu Arjun and Manchu Manoj, the script emerges greater.'Vedam' Dialogues are exemplary and compliment the screenplay.The screenplay is crisp thanks to the editor Sravan. The way the story is narrated by Krish is just amazing and any word above that will go to him. No lag in script and that is one sign of a classy movie maker. Kudos to him and his editor!The next important technician is the cinematographer VS Gnana Sekhar. His camera has captured all those intense scenes excellently particularly a few scenes on the highway when Manoj and his band are on their way to Hyderbad from Bangalore.M M Keeravani's music and rerecording are remarkable. Looks like he saves his best for the best! Elegant work from the veteran, his music is definitely an asset.PerformancesStarting from the order of appearance in the movie- Manoj as an actor will cherish the character he has portrayed in 'Vedam' all through his career. He has been shown as an intelligent guy who has an ambition. Manoj has pulled of a decent job. Interestingly when his name appeared in the titles, his character was described as special appearance as subscript.Allu Arjun as a cable guy would equally feel happy to have bagged such a role. His screen presence is a little more than Manoj, his character demands it. Allu Arjun has evolved as an actor yet his expressions could be better. In fact Manchu Manoj and Allu Arjun come on the screen together only for a few seconds and that too in the climax.Manoj Bajpai has brought out a terrific performance and his performance is the pick of the lot. Anushka has done a decent job. All other actors have done a great job but a lame member of the audience would feel there were too many characters involved yet the script emerges winner.Reiterating the point that Krish has taken Tollywood to the next level, his 'Vedam' is a genesis that other film makers will start to contemplate about. He has touched every aspect of life be it religion or money and carefully conveyed a message about good living. This movie is a clear winner and any rating will only be too less. Hats off Radha Krishna!",wisdom substance,director gamyam comes another meaningful story vedham audience search wisdom your ultimate stop is here readers if this review goes little long it is only that appreciation this movie has no bounds krish has done flawless job that will make audience sit at edge seat most time with this movie tollywood goes next level level commercial cinema meaningful cinema krish has already announced his arrival with gamyam now he has cemented his place with vedam charactersvedam is story 6 people all people involved are introduced individually first list is manchu manoj as vivek chakravarthy whos introduced with title as rocking star he is rock star movie song showing him as rock star appears soon after title movie he along with his girl friend lasya lekha washington their gang set up rock band bangalore they go hyderbad performance next is nagayya as ramulu old man lingampally is introduced along with his daughter law saranya they are illiterates who face serious financial problems they are debt patel who has saranyas son captive only upon paying debt son would be set free only solution is sell kidney saranya that takes old man his daughter law hyderbad next scene is basthi slum jubilee hills hyderbad allu arjun as cable raju is introduced hes educated yet works as cable boy who doesnt pay his boss he fakes his life as rich brat makes his filthy rich girl friend believe same he needs money impress his girl friend this list 6 people fifth line is manoj bajpai as rahim qureshi bitter past hindu muslim fight his pregnant wife loses foetus before birth small misunderstanding with cop has him black list he is good man beloved husband yet bad books police last list is anushka whos saroja prostitute she knows no other way living she along with her friend karpooram eunuch wants get out prostitute house they work they want set up their own plotthis is classic movie that will go history no doubt indiaglitz appreciates director krish making such meaningful movie only gist is given nothing more after introduction all characters plot takes place 31st night every character is associated with hyderbad this one night is life changing all 6 persons people associated with them parallel lives these 6 people gang terrorists plot plan massacre innocent citizens name jihad how these people are related how others hospital who are held as hostages by terrorists are saved forms terrific remainder this paramount story hero movie screenplay it is hero introduction all characters is done one by one it is simple yet powerful screenplay characterization all characters is sketched carefully such way that script is not dominated given images allu arjun manchu manoj script emerges greater vedam dialogues are exemplary compliment screenplay screenplay is crisp thanks editor sravan way story is narrated by krish is just amazing any word above that will go him no lag script that is one sign classy movie maker kudos him his editor next important technician is cinematographer vs gnana sekhar his camera has captured all those intense scenes excellently particularly few scenes highway when manoj his band are their way hyderbad bangalore m m keeravanis music rerecording are remarkable looks like he saves his best best elegant work veteran his music is definitely asset performancesstarting order appearance movie manoj as actor will cherish character he has portrayed vedam all through his career he has been shown as intelligent guy who has ambition manoj has pulled decent job interestingly when his name appeared titles his character was described as special appearance as subscript allu arjun as cable guy would equally feel happy have bagged such role his screen presence is little more than manoj his character demands it allu arjun has evolved as actor yet his expressions could be better fact manchu manoj allu arjun come screen together only few seconds that too climax manoj bajpai has brought out terrific performance his performance is pick lot anushka has done decent job all other actors have done great job but lame member audience would feel there were too many characters involved yet script emerges winner reiterating point that krish has taken tollywood next level his vedam is genesis that other film makers will start contemplate about he has touched every aspect life be it religion or money carefully conveyed message about good living this movie is clear winner any rating will only be too less hats off radha krishna,0.5259549973835688,0.17045395081109369,Positive,"{'Happy': 0.14, 'Angry': 0.02, 'Surprise': 0.19, 'Sad': 0.17, 'Fear': 0.48}"
9,"VEDAM is one of the best movies I ever watched, which makes clear what LIFE is !!","I was really surprised to see the lead actors giving such a great performance. Hats off to them Arjun & Manoj. Both should be appreciated coming forward for such a fantastic film. Krish made a wonderful second flick after Gamyam. He dealt the subject very neatly and precisely. Nothing is more and nothing is less. After coming out of the theater I felt watching whole of the life in it. Thanks to Krish for presenting such a great film.If you want to watch a good film, Watch VEDAM. Feel the LIFE.Believe me you will miss something if you don't watch this movie!!My rating would be 9/10",vedam is one best movies i ever watched which makes clear what life is,i was really surprised see lead actors giving such great performance hats off them arjun manoj both should be appreciated coming forward such fantastic film krish made wonderful second flick after gamyam he dealt subject very neatly precisely nothing is more nothing is less after coming out theater i felt watching whole life it thanks krish presenting such great film if you want watch good film watch vedam feel life believe me you will miss something if you dont watch this movie my rating would be 9 10,0.48916666666666664,0.31333333333333335,Positive,"{'Happy': 0.17, 'Angry': 0.0, 'Surprise': 0.41, 'Sad': 0.21, 'Fear': 0.21}"
10,"An intelligent, sensitive, sensible and moreover a wonderful soul stirring masterpiece.","I and many others would have never thought that there will be a movie like Vedam made in Telugu. This is definitely regional movie at its best.That is exactly what compelled me to write a review for the first time ever.The first thing that strikes to your mind when watching is this movie is that it could be a lift/inspiration from Crash/21 grams/Babel/Love Actually. Of course, it might have been but who cares. This is one of the best movies Telugu film industry ever produced.The screenplay is common in the above movies but what comes out at the end is what makes this movie a wonderful masterpiece.When you observe the movie then it actually makes more sense when you relate it back to back. The climax is where you understand why the five different stories were narrated and how they get to where they are.The best part is that there is a conclusion unlike Babel or any other movie with the same kind of screenplay.We see the climax of the movie where bad turns good or even ends (dies)good. And this is why the movie is sensible and intelligent.Every aspect of the story is carefully blended. This is a movie that you will remember.Mr. Krish, if you are reading this, make sure you acknowledge that we are really grateful to you. Woow...what a masterpiece. keep up your good work and we hope to see more of such wonderful movies from you.",intelligent sensitive sensible moreover wonderful soul stirring masterpiece,i many others would have never thought that there will be movie like vedam made telugu this is definitely regional movie at its best that is exactly what compelled me write review first time ever first thing that strikes your mind when watching is this movie is that it could be lift inspiration crash 21 grams babel love actually course it might have been but who cares this is one best movies telugu film industry ever produced screenplay is common above movies but what comes out at end is what makes this movie wonderful masterpiece when you observe movie then it actually makes more sense when you relate it back back climax is where you understand why five different stories were narrated how they get where they are best part is that there is conclusion unlike babel or any other movie with same kind screenplay we see climax movie where bad turns good or even ends dies good this is why movie is sensible intelligent every aspect story is carefully blended this is movie that you will remember mr krish if you are reading this make sure you acknowledge that we are really grateful you woow what masterpiece keep up your good work we hope see more such wonderful movies you,0.5134920634920634,0.3607142857142857,Positive,"{'Happy': 0.13, 'Angry': 0.02, 'Surprise': 0.53, 'Sad': 0.17, 'Fear': 0.15}"
9,Best of The Best in Telugu Till Date!!,"Vedam is a perfect movie. Story,Cast,Direction,Screenplay..... well i said its perfect...Talking about..Story: people might think the first half of the story is a little boring but the fact is that, the motto of first half is to blend all the 20 or so characters of the movie into a diverging ""X road where they meet in climax..""..Well the second half is the most powerful way to mix the blend made in first half.Action: The Fight at the time of interval is the best action episode of the movie. Manoj did it with high risks as you can see of course conditions apply. Near natural.Pro's of Action: No kicks/punches that make people fly in the air..Thank God..Con's of Action: All the action episodes are pretty made for it-up.Dilogues: Timely placed. Simple words. Powerful enough to hit your thoughts.Pro's of Dilogues: ""Deenemma Jeevitham..pretty commonly used.."" Cons's of Dilogues: Didn't find much..Music: Fits for the movie. MMK has done a good job tho not best of what he can do. Songs are well made.Pro's of Music: Manoj looks like a rock-star which drags your attention towards the music.Con's of Music: If it was original music it might have been good. Seems to be copy pasted from some English rock-star albums..Performances: Best of Allu-Arjun,Anushka(hot hot hot) & Specially ""Manoj"".. All other roles are superb anyway. I find Manoj role is not just a guest role.. Rain of Awards is waiting for the time..by all the cast for sure...Pro's of performances: I dint find any cons.. so its the rest..Climax: Wow!! No more.! Personally: I got collection of very few Telugu movies in my computer.. This movie DVD is going to be added into my list as it comes out..I think Allu Arjun , Manoj are going to lead the industry in coming future.. Planning & choosing their characters and scripts in a far better way than our ""Lungi - south - Superstars..No offense..Its a fact live with it.."" Radhakrishna..if you are reading this comment..then listen up buddy.. ""Vedam is a natural,crispy,crunchy,salt n sweet,powerful,inspiring,artistic,musical,romantic Drama."" 9/10...I never expected any other director than ManiRatnam can make a movie like this..but yeah there is Krish...Finally,go have look at this movie in theaters..If you miss this movie, sorry to say "" You missed one of the best movies in Telugu.!!"".",best best telugu till date,vedam is perfect movie story cast direction screenplay well i said its perfect talking about story people might think first half story is little boring but fact is that motto first half is blend all 20 or so characters movie into diverging x road where they meet climax well second half is most powerful way mix blend made first half action fight at time interval is best action episode movie manoj did it with high risks as you can see course conditions apply near natural pros action no kicks punches that make people fly air thank god cons action all action episodes are pretty made it up dilogues timely placed simple words powerful enough hit your thoughts pros dilogues deenemma jeevitham pretty commonly used conss dilogues didnt find much music fits movie mmk has done good job tho not best what he can do songs are well made pros music manoj looks like rock star which drags your attention towards music cons music if it was original music it might have been good seems be copy pasted some english rock star albums performances best allu arjun anushka hot hot hot specially manoj all other roles are superb anyway i find manoj role is not just guest role rain awards is waiting time by all cast sure pros performances i dint find any cons so its rest climax wow no more personally i got collection very few telugu movies my computer this movie dvd is going be added into my list as it comes out i think allu arjun manoj are going lead industry coming future planning choosing their characters scripts far better way than our lungi south superstars no offense its fact live with it radhakrishna if you are reading this comment then listen up buddy vedam is natural crispy crunchy salt n sweet powerful inspiring artistic musical romantic drama 9 10 i never expected any other director than maniratnam can make movie like this but yeah there is krish finally go have look at this movie theaters if you miss this movie sorry say you missed one best movies telugu,0.5224110149110148,0.21435868424504786,Positive,"{'Happy': 0.14, 'Angry': 0.05, 'Surprise': 0.29, 'Sad': 0.27, 'Fear': 0.25}"
10,Iam Speechless......,"One of the greatest movies in Telugu industry A MUST Watch! all the characters fitted perfectly. Screenplay is too good. Overall: Awesome It completely reveals today's world.I love this movie.Allu Arjun acting is too too good.Like normal BalaKrishna or Pavan,the villain sends an army hero beats them up heroine falls in love then a lousy song,NO this movie is not like that completely different.You gotta love this movie once you watch it.If you are sensitive You may even cry.Once you watch the may u WILL Be SPEECHLESS.so go now get your tickets.Watch the movie till you get the message and don't just sit there, get the message and try to follow it.",iam speechless,one greatest movies telugu industry must watch all characters fitted perfectly screenplay is too good overall awesome it completely reveals todays world i love this movie allu arjun acting is too too good like normal balakrishna or pavan villain sends army hero beats them up heroine falls love then lousy song no this movie is not like that completely different you gotta love this movie once you watch it if you are sensitive you may even cry once you watch may u will be speechless so go now get your tickets watch movie till you get message dont just sit there get message try follow it,0.6033333333333333,0.3833333333333334,Positive,"{'Happy': 0.32, 'Angry': 0.11, 'Surprise': 0.37, 'Sad': 0.0, 'Fear': 0.21}"
10,this the best movie ever with a message for humanity.,"all these days there were rumor's that movie industry is going down but this an example for uplift of the industry . no movie can reach to these standards its a combination of an excellent actors and a mind blowing director and performances . its the first multi starer movie in theaters after decades. hero's action was superb actually the story is the heart of the movie and the taking was mind blowing . one will cry in the last 30 min of the movie . the main hero's showed his skill of dance, action,emotions,style once again. this movie is worth for seeing even 3 or 4 times for the action and the director. the main credit goes to hero's for their actions.",this best movie ever with message humanity,all these days there were rumors that movie industry is going down but this example uplift industry no movie can reach these standards its combination excellent actors mind blowing director performances its first multi starer movie theaters after decades heros action was superb actually story is heart movie taking was mind blowing one will cry last 30 min movie main heros showed his skill dance action emotions style once again this movie is worth seeing even 3 or 4 times action director main credit goes heros their actions,0.3196581196581197,0.30982905982905984,Positive,"{'Happy': 0.14, 'Angry': 0.0, 'Surprise': 0.38, 'Sad': 0.07, 'Fear': 0.41}"
10,It has Heart,"Cable Raju is an emotion forever , krish you are the legend",it has heart,cable raju is emotion forever krish you are legend,0.0,0.0,Neutral,"{'Happy': 0.0, 'Angry': 0.0, 'Surprise': 0.0, 'Sad': 1.0, 'Fear': 0.0}"
10,Thought provoking,"Words are not enough to describe the emotional script of this movie which was played with a brilliant acting of every character.I must say, even after 11 years, the movie is still updated. I am watching it for second time.Just loved it.",thought provoking,words are not enough describe emotional script this movie which was played with brilliant acting every character i must say even after 11 years movie is still updated i am watching it second time just loved it,0.4916666666666667,0.26666666666666666,Positive,"{'Happy': 0.2, 'Angry': 0.2, 'Surprise': 0.3, 'Sad': 0.1, 'Fear': 0.2}"
10,A classic by Krish,"Definitely The Best of Krish. Everyone who contributed to this film gave their best Specially Allu Arjun, tears came out of my eyes during climax. Music by keeravani is just amazing. The dialogues in the film has deep meaning yet very simple.",classic by krish,definitely best krish everyone who contributed this film gave their best specially allu arjun tears came out my eyes during climax music by keeravani is just amazing dialogues film has deep meaning yet very simple,0.44319727891156463,0.4462585034013606,Positive,"{'Happy': 0.0, 'Angry': 0.0, 'Surprise': 0.5, 'Sad': 0.12, 'Fear': 0.38}"
10,Wow..movie worth to watch specially youth,A truly great movie tries to show inside every man their is humanity and love for his country. I watched it on YouTube while going to another city for my exam.. And this was worth investing my time,wow movie worth watch specially youth,truly great movie tries show inside every man their is humanity love his country i watched it youtube while going another city my exam this was worth investing my time,0.503061224489796,0.3224489795918367,Positive,"{'Happy': 0.25, 'Angry': 0.0, 'Surprise': 0.38, 'Sad': 0.0, 'Fear': 0.38}"
10,It's a full meal,It shows the life of different people with different situations and emotions. When we go to performances the main lead people had done a splendid job to there roles. songs are quite good and M.M.Keeravani had made the viewers to connect with the movie The heart of every movie is it's climax if we watch climax of this movie definitely touches our heart,its full meal,it shows life different people with different situations emotions when we go performances main lead people had done splendid job there roles songs are quite good m m keeravani had made viewers connect with movie heart every movie is its climax if we watch climax this movie definitely touches our heart,0.5976190476190476,0.2928571428571428,Positive,"{'Happy': 0.15, 'Angry': 0.0, 'Surprise': 0.08, 'Sad': 0.38, 'Fear': 0.38}"
