Rating,Review Title,Review,Cleaned Review Title,Cleaned Review,Subjectivity,Polarity,Sentiment,Emotion Scale
6,"""Vedam Speaks to the World""","The first and the foremost duty of any writer is simple. To tell the truth. Just tell the truth. And I want to begin by telling just that – the truth. The truth about art. Any art. It's, again, simple. Art must touch souls. If what you do doesn't touch your own soul, it not only not an art but also something you should not be doing in the first place. And this is the best thing about life. We know it when we are doing something that is not touching us. But we keep doing it. But not all. Some stop. They just stop. And then they start doing something else. Something that is completely not expected of them. And it is this defining moment that makes lives. And more often than not this defining moment in life begins with this line, if you were a Telugu-speaking dreamer: ""Edava janma"" (""What an inglorious life I have been leading!""). This I know, although I hardly know anything about Krish – the writer-director of 'Vedam', is the same internal dialogue with his inner voice that made him quit everything he had and had been doing to begin his life anew by moving to film-making. ""What an inglorious life I have!"" In short, it is highly impossible to create a work of art that touches souls unless the maker of it goes through that defining moment in life. And the best thing about such lives and works of arts is that they go on to make a million more people go through the same defining moment in their lives: ""What an inglorious life I am having! "". And in that lies the success of such original creators of works of art that touch souls. And today's film is a testimony to that fact. That Radhakrishna (Krish) is a success. His works come from the people that touched his soul to the people whom it will go on to touch. My hearty congratulations.Coming to the film, the best thing about it is that it put the true meaning of inspiration in its original place. For decades we have been subjected to the horror of art thieves who used and abused the word 'inspiration' by blatantly copying others' works. And it is the same fear that I went to watch the movie 'Vedam' today. That it could be a copy of ""Babel"" or ""21 Grams"" or even closer ""Crash"". And I thanked all the gods and quietly patted Krish's back in my own mind that it was not what I feared it was. I am sure, as he himself would admit, if asked, that the germ of the idea for the such a story came while watching ""Crash"" but that's where all comparisons end. Not a single element was taken from any other movie. It is the soul of the filmmaker that was touched by all these wonderful films that responded to create his own original work that could touch a million more people in the same way. And that is the pristine definition of the word 'inspiration'. A candle lighting other candles. And Krish's film is one such candle that was lit by a few beautiful candles that in turn is now lighting many more candles.There are many successful filmmakers in this world and in our own industry. Many offer many different things through their films that we all enjoy watching. At the end of the day I know what comes to me to my bed and into my dreams is not that film that made me happy or sad or excited about or ambitious but that movie that touched my inner most soul and made me want to be a better person. Not many successful filmmakers indulge themselves in making such soul-stirring tales. Not because they don't like doing them but simply because they can't. Not all can. It requires to be human, it requires to be sensitive to pain, it requires to go through pain and not hate the source of pain to acquire that humanist attitude towards life, people and in the way one likes to live life. Unless you are such a humanist, you can't create a good humanist drama. You have to, like Gandhi said, live the life that you want to preach. Only a few filmmakers belong to that school: Alejandro González Iñárritu (Amores Perros/21 Grams/Babel), Roberto Benigini (Life is Beautiful), Sam Mendes (American Beauty/Revolutionary Road), Prakash Jha back at home (Apaharan/Gangajal/Raajneeti), Anurag Basu (Life in a Metro) and a few others. And I am proud to state that we have a humanist born in our own Telugu film industry who understands the universal nature of human emotions and responds to them with affection. And that his name is Radhakrishna. To Radhakrishna. To Krish.SUBHAKAR.COM",vedam speaks world,first foremost duty any writer is simple tell truth just tell truth i want begin by telling just that truth truth about art any art its again simple art must touch souls if what you do doesnt touch your own soul it not only not art but also something you should not be doing first place this is best thing about life we know it when we are doing something that is not touching us but we keep doing it but not all some stop they just stop then they start doing something else something that is completely not expected them it is this defining moment that makes lives more often than not this defining moment life begins with this line if you were telugu speaking dreamer edava janma what inglorious life i have been leading this i know although i hardly know anything about krish writer director vedam is same internal dialogue with his inner voice that made him quit everything he had had been doing begin his life anew by moving film making what inglorious life i have short it is highly impossible create work art that touches souls unless maker it goes through that defining moment life best thing about such lives works arts is that they go make million more people go through same defining moment their lives what inglorious life i am having that lies success such original creators works art that touch souls todays film is testimony that fact that radhakrishna krish is success his works come people that touched his soul people whom it will go touch my hearty congratulations coming film best thing about it is that it put true meaning inspiration its original place decades we have been subjected horror art thieves who used abused word inspiration by blatantly copying others works it is same fear that i went watch movie vedam today that it could be copy babel or 21 grams or even closer crash i thanked all gods quietly patted krishs back my own mind that it was not what i feared it was i am sure as he himself would admit if asked that germ idea such story came while watching crash but thats where all comparisons end not single element was taken any other movie it is soul filmmaker that was touched by all these wonderful films that responded create his own original work that could touch million more people same way that is pristine definition word inspiration candle lighting other candles krishs film is one such candle that was lit by few beautiful candles that turn is now lighting many more candles there are many successful filmmakers this world our own industry many offer many different things through their films that we all enjoy watching at end day i know what comes me my bed into my dreams is not that film that made me happy or sad or excited about or ambitious but that movie that touched my inner most soul made me want be better person not many successful filmmakers indulge themselves making such soul stirring tales not because they dont like doing them but simply because they cant not all can it requires be human it requires be sensitive pain it requires go through pain not hate source pain acquire that humanist attitude towards life people way one likes live life unless you are such humanist you cant create good humanist drama you have like gandhi said live life that you want preach only few filmmakers belong that school alejandro gonz lez i rritu amores perros 21 grams babel roberto benigini life is beautiful sam mendes american beauty revolutionary road prakash jha back at home apaharan gangajal raajneeti anurag basu life metro few others i am proud state that we have humanist born our own telugu film industry who understands universal nature human emotions responds them with affection that his name is radhakrishna radhakrishna krish subhakar com,0.5085317460317461,0.23353790518424672,Positive,"{'Happy': 0.09, 'Angry': 0.02, 'Surprise': 0.28, 'Sad': 0.3, 'Fear': 0.31}"
10,Thop,Superb movie Nice message given through movie Superb acting by all the cast,thop,superb movie nice message given through movie superb acting by all cast,0.75,0.65,Positive,"{'Happy': 0.75, 'Angry': 0.0, 'Surprise': 0.0, 'Sad': 0.0, 'Fear': 0.25}"
10,Vedam,Inspirational movie...nice screenplay..awesome acting...,vedam,inspirational movie nice screenplay awesome acting,0.75,0.525,Positive,"{'Happy': 0.67, 'Angry': 0.0, 'Surprise': 0.33, 'Sad': 0.0, 'Fear': 0.0}"
7,Vedam is a dated melodrama boosted by hyperlink storytelling and tearful climax.,"Vedam (2010) : Brief Review -Vedam is a dated melodrama boosted by hyperlink storytelling and tearful climax. An anthology in mainstream cinema is rare because usually mainstream and money-seeker filmmakers don't use it. It is only used by those filmmakers who crave for artistic cinema and wants to do something new. With Vedam, these two different poles have come together as the film is very much an entertaining drama with smartly set anthology. Like I said, it's a dated melodrama so you will see many mediocre and typical scenes. It was dated even for its time, i mean by 2010, the storytelling had became much matured and the filmmaking was very much advanced. Vedam fails to impress there but otherwise it gathers a lot of elements together in the climax to leave audience fulfilled. The film is about different people coming from different places for different reasons, unknowingly gathered together at a place which goes through a horrendous attack by Jihadis. The first half of the film is underwhelming because it only manages to introduce all the characters and their lives in an hour long runtime, and nothing else. So, we have to wait for last 30 minutes when the actual process and meaning of the anthology starts. Overall, it's a decent script just like any other common popcorn flick but it is the climax which gives it some meaning and some extra values. It solves all the problems within those 20 odd minutes by using plenty of dramatic ingredients like Love, Break Up, Patriotism, Care, Sacrifice, Humanity etc. All the actors are average to above average in their roles. Maybe that was the requirement. Krish pulls off a watchable film from experimental tricks because he doesn't forget the basics of a mainstream entertainer. Vedam may not be overwhelming but it is not that underwhelming either. An attempt to be proud of.RATING - 7/10*By - #samthebestest.",vedam is dated melodrama boosted by hyperlink storytelling tearful climax,vedam 2010 brief review vedam is dated melodrama boosted by hyperlink storytelling tearful climax anthology mainstream cinema is rare because usually mainstream money seeker filmmakers dont use it it is only used by those filmmakers who crave artistic cinema wants do something new with vedam these two different poles have come together as film is very much entertaining drama with smartly set anthology like i said its dated melodrama so you will see many mediocre typical scenes it was dated even its time i mean by 2010 storytelling had became much matured filmmaking was very much advanced vedam fails impress there but otherwise it gathers lot elements together climax leave audience fulfilled film is about different people coming different places different reasons unknowingly gathered together at place which goes through horrendous attack by jihadis first half film is underwhelming because it only manages introduce all characters their lives hour long runtime nothing else so we have wait last 30 minutes when actual process meaning anthology starts overall its decent script just like any other common popcorn flick but it is climax which gives it some meaning some extra values it solves all problems within those 20 odd minutes by using plenty dramatic ingredients like love break up patriotism care sacrifice humanity etc all actors are average above average their roles maybe that was requirement krish pulls off watchable film experimental tricks because he doesnt forget basics mainstream entertainer vedam may not be overwhelming but it is not that underwhelming either attempt be proud rating 7 10 by,0.4796876573039363,0.021623628309674823,Positive,"{'Happy': 0.14, 'Angry': 0.03, 'Surprise': 0.28, 'Sad': 0.07, 'Fear': 0.48}"
1,Anti hindu Propaganda,"I found nothing but anti hindu propaganda in this to the max. They've shown exaggerated negativity especially among hindu community. Hindus are shown as hypocritical, greedy, power hungry, hateful mobsters. Shame on the creators. Such repulsive propaganda. No script no logic just hindus committing atrocities on others. Its such ugliness. Hard to seee but this used to be the norm few years ago.",anti hindu propaganda,i found nothing but anti hindu propaganda this max theyve shown exaggerated negativity especially among hindu community hindus are shown as hypocritical greedy power hungry hateful mobsters shame creators such repulsive propaganda no script no logic just hindus committing atrocities others its such ugliness hard seee but this used be norm few years ago,0.4341666666666667,-0.15916666666666665,Negative,"{'Happy': 0.0, 'Angry': 0.75, 'Surprise': 0.12, 'Sad': 0.0, 'Fear': 0.12}"
8,Most realistic Allu Arjun movie but alas it wasted the potential,"There are 5 stories running parallel in this film and all intersect at the climax which looked unnatural at first but is digestible considering the fact that we really don't know what's in store for us in the future. Arjun, Anushka, Manoj, Saranya and Manchu Manoj are the protagonist of these 5 stories.Story of Saranya looks real and touching. Manchu Manoj lacks character depth, the message in his story could have been delivered in a better way and it feels like no effort was taken to write his story. Manoj Bajpayee's story is very debatable and fans the fire of hate which at its face value it aims to reduce, basically it looks like some fake story taken from NDTV's prime time (NDTV appears in the end that indicates that some ideologically similar folks tampered the script to suit their political agenda). Anushka does really good to make audience relate with the situation faced by people stuck in her character's profession. Arjun's story is very beautifully written and occupies the most screen time among others. It shows transition of a wandering young boy diseased with materialism of the world to a man who breaths reality.I would put it at 2nd place in the list of best Allu Arjun movies, just after Ala Vaikunthapurramuloo. This movie is way ahead of its time and I am sure if some debatable elements were improved then it could have been even better.",most realistic allu arjun movie but alas it wasted potential,there are 5 stories running parallel this film all intersect at climax which looked unnatural at first but is digestible considering fact that we really dont know whats store us future arjun anushka manoj saranya manchu manoj are protagonist these 5 stories story saranya looks real touching manchu manoj lacks character depth message his story could have been delivered better way it feels like no effort was taken write his story manoj bajpayees story is very debatable fans fire hate which at its face value it aims reduce basically it looks like some fake story taken ndtvs prime time ndtv appears end that indicates that some ideologically similar folks tampered script suit their political agenda anushka does really good make audience relate with situation faced by people stuck her characters profession arjuns story is very beautifully written occupies most screen time among others it shows transition wandering young boy diseased with materialism world man who breaths reality i would put it at 2nd place list best allu arjun movies just after ala vaikunthapurramuloo this movie is way ahead its time i am sure if some debatable elements were improved then it could have been even better,0.49522222222222234,0.17466666666666664,Positive,"{'Happy': 0.06, 'Angry': 0.06, 'Surprise': 0.29, 'Sad': 0.23, 'Fear': 0.37}"
10,This is called content....🔥,Best ever acting of ALLU ARJUN in this movie.........,this is called content,best ever acting allu arjun this movie,0.15,0.5,Positive,"{'Happy': 0.0, 'Angry': 0.0, 'Surprise': 0.67, 'Sad': 0.0, 'Fear': 0.33}"
