Rating,Review Title,Review,Cleaned Review Title,Cleaned Review,Subjectivity,Polarity,Sentiment,Emotion Scale
9,One of the best all-round Telugu movies you would see,"In 2 months time, Allu Arjun gave one of the worst movies and one of the best movies of this decade in Tollywood.Vedam has 5 independent stories in it which are taking place parallelly, and the characters of all the stories converge at the big climax. In my limited memory, I can't remember such a movie being made prior in Tollywood. This could be a risky subject but director Krish (Gamyam fame) pulled it off with great aplomb. I won't brief about the 5 stories but they are very different from each other and there is believability to each one of them although in various degrees.If an award for the best performance by an ensemble cast in Tollywood is introduced next year, Vedam would be the leading contender. Nobody in the movie messed up there roles. Allu Arjun is an excellent fit in the role of Cable Raju. His performance & emotions at the end where he has a change of heart is the best that he had done until now. After the movie Arundhati, Anushka has become a clear crowd favourite. The whistles and shouts during her introduction scene were only matched by the entrance of Arjun. Anushka has nailed the role of Saroja going from funny to angry to angst with ease. She definitely is one of the best actresses in Tollywood right now. This is my first Manchu Manoj movie. He was an apt choice to play the music loving wannabe rock-star Vivek. Manoj is not only a better actor than his brother Vishnu but he is also choosing his scripts wisely. He created a good first impression on me. I haven't seen Manoj Bajpai fail as an actor and the same goes here. He gives good performance as the victimised Muslim Raheemuddin Qureishi. All the others in the movie performed really well. Deeksha Seth is used for her glamour.Since there are 5 stories, there are a lot of characters to be introduced. So in the first half, we are introduced to the characters and their motivations. With a conflict in each story, the first half ends. So it may appear to some people as if not much has happened as a whole in the first half but that is only an illusion because we are dealing with 5 stories here. The second half is absolutely gripping.Generally in our industry when you have a drama with superb performances, the technical aspects are grossly neglected. But Vedam is technically a very well made film. Right from your editing to cinematography to art work to sound effects, this is a wonderfully made film. Dialogues & direction by Krish are great. Krish proved that he is not a one film wonder. Let's hope that he is not a two film wonder. (Am I being greedy?)Background score by Keeravani is very good but I would have been more happy if every thing is original. Coming to the songs, the songs fit in the movie very well but I don't think they would work outside the movie. After the break, for a few minutes the movie tends to be slow. They could have cut a song there. Story & script wise, the tussle between Manoj & Sikh lorry driver was too superficial. To develop the conflict in Manoj's character, a more natural setup would have been very good. Another one is when Manoj Bajpai, who initially tries to escape without even warning the hundreds of people in the hospital about the impending danger, has a change of heart when he sees a pregnant lady. Agreed that he has some past scars regarding unborn babies but still it appeared a bit forced. One more thing is when some body dies at a huge explosion, I think that the faces should not be recognisable. But the above points are very minor, and by the end of the movie this is a very satisfying experience. http://amarsmoviejournal.blogspot.com All in all, this is a must watch. This is going to win a lot of awards next season. The general perception is that an award winning movie tends to be a boring art movie. This is true in many cases but once in a while there comes a really good drama without boring you and this is one of those. I was absolutely thrilled by the time the movie was over because of mainly 2 reasons. One reason was because the movie was very good & the second one was because I rarely see such well made movie in Telugu. So my humble request is don't miss this.Finally, a triple thumbs-up (if such a word is there) for the director Krish and the producers Devineni Prasad & Yarlagadda Shobhu. p.s I didn't understand the crediting of Manchu Manoj as Guest appearance because I felt his role was of a proper protagonist.",one best all round telugu movies you would see,2 months time allu arjun gave one worst movies one best movies this decade tollywood vedam has 5 independent stories it which are taking place parallelly characters all stories converge at big climax my limited memory i cant remember such movie being made prior tollywood this could be risky subject but director krish gamyam fame pulled it off with great aplomb i wont brief about 5 stories but they are very different each other there is believability each one them although various degrees if award best performance by ensemble cast tollywood is introduced next year vedam would be leading contender nobody movie messed up there roles allu arjun is excellent fit role cable raju his performance emotions at end where he has change heart is best that he had done until now after movie arundhati anushka has become clear crowd favourite whistles shouts during her introduction scene were only matched by entrance arjun anushka has nailed role saroja going funny angry angst with ease she definitely is one best actresses tollywood right now this is my first manchu manoj movie he was apt choice play music loving wannabe rock star vivek manoj is not only better actor than his brother vishnu but he is also choosing his scripts wisely he created good first impression me i havent seen manoj bajpai fail as actor same goes here he gives good performance as victimised muslim raheemuddin qureishi all others movie performed really well deeksha seth is used her glamour since there are 5 stories there are lot characters be introduced so first half we are introduced characters their motivations with conflict each story first half ends so it may appear some people as if not much has happened as whole first half but that is only illusion because we are dealing with 5 stories here second half is absolutely gripping generally our industry when you have drama with superb performances technical aspects are grossly neglected but vedam is technically very well made film right your editing cinematography art work sound effects this is wonderfully made film dialogues direction by krish are great krish proved that he is not one film wonder lets hope that he is not two film wonder am i being greedy background score by keeravani is very good but i would have been more happy if every thing is original coming songs songs fit movie very well but i dont think they would work outside movie after break few minutes movie tends be slow they could have cut song there story script wise tussle between manoj sikh lorry driver was too superficial develop conflict manojs character more natural setup would have been very good another one is when manoj bajpai who initially tries escape without even warning hundreds people hospital about impending danger has change heart when he sees pregnant lady agreed that he has some past scars regarding unborn babies but still it appeared bit forced one more thing is when some body dies at huge explosion i think that faces should not be recognisable but above points are very minor by end movie this is very satisfying experience all all this is must watch this is going win lot awards next season general perception is that award winning movie tends be boring art movie this is true many cases but once while there comes really good drama without boring you this is one those i was absolutely thrilled by time movie was over because mainly 2 reasons one reason was because movie was very good second one was because i rarely see such well made movie telugu so my humble request is dont miss this finally triple thumbs up if such word is there director krish producers devineni prasad yarlagadda shobhu p s i didnt understand crediting manchu manoj as guest appearance because i felt his role was proper protagonist,0.48956816059757235,0.22482026143790848,Positive,"{'Happy': 0.15, 'Angry': 0.06, 'Surprise': 0.27, 'Sad': 0.19, 'Fear': 0.33}"
10,regional cinema at its best!!!!,"wow!what an experience which compelled me into writing this..lets start from the beginning..when i was told that this was an experimental movie in telugu, i was really circumspect because let me tell u i've been watching telugu movies for many years now & whenever someone tries something ""different"" more often it turns out to be awful.but this one's one of those movies which stands for all the great things about this great medium.it shows,reflects,teaches & above all it inspires.hats off to the director for pulling this off with a difficult subject,ensemble cast & an amazing way of story telling.if u really are curious to know the story,it intertwines 4 stories which are very distinct on their own from the beginning to the end. just the characters meet very briefly & u keep wondering through the 1st half if there is any connection at all. and boy there is! its not just topical but a much deeper connection & the director keeps it ticking without a single dull moment with great élan.its the triumph of human spirit that touches u in the second half. the scene where allu arjun (yes the same guy who did the horrible varudu)returns the money or manoj(fully intense throughout)takes on goons who really are hooligans in the name of religion or the superbly crafted climax that takes ur breath away.this movie asserts everyone gets a second chance to redeem yourself no matter how terrible ur mistakes are.its just up to u to embrace it. it uses such dramatic situations to prove this that often makes u tearful and yet every character is so real that one can identify oneself in at least one of them.this is what makes this movie hit the jackpot.the acting is fine by all leading stars.after seeing this u keep wondering y Allu Arjun chooses some horrible movies.manoj bajpai shines in his role as Muslim fighting against the system but the guy who stand out with his intense role a wannabe rock star unwillingly ending up a patriot is Manoj.I know some of u may not like the ending but come-on aren't we tired of the same old stuff?this is contemporary movie making at its best & its prudent for us to embrace it & encourage such movie makers who make us proud to be Indians!!",regional cinema at its best,wow what experience which compelled me into writing this lets start beginning when i was told that this was experimental movie telugu i was really circumspect because let me tell u ive been watching telugu movies many years now whenever someone tries something different more often it turns out be awful but this ones one those movies which stands all great things about this great medium it shows reflects teaches above all it inspires hats off director pulling this off with difficult subject ensemble cast amazing way story telling if u really are curious know story it intertwines 4 stories which are very distinct their own beginning end just characters meet very briefly u keep wondering through 1st half if there is any connection at all boy there is its not just topical but much deeper connection director keeps it ticking without single dull moment with great lan its triumph human spirit that touches u second half scene where allu arjun yes same guy who did horrible varudu returns money or manoj fully intense throughout takes goons who really are hooligans name religion or superbly crafted climax that takes ur breath away this movie asserts everyone gets second chance redeem yourself no matter how terrible ur mistakes are its just up u embrace it it uses such dramatic situations prove this that often makes u tearful yet every character is so real that one can identify oneself at least one them this is what makes this movie hit jackpot acting is fine by all leading stars after seeing this u keep wondering y allu arjun chooses some horrible movies manoj bajpai shines his role as muslim fighting against system but guy who stand out with his intense role wannabe rock star unwillingly ending up patriot is manoj i know some u may not like ending but come arent we tired same old stuff this is contemporary movie making at its best its prudent us embrace it encourage such movie makers who make us proud be indians,0.5004108309990662,0.08582166199813261,Positive,"{'Happy': 0.11, 'Angry': 0.06, 'Surprise': 0.27, 'Sad': 0.3, 'Fear': 0.26}"
8,Great! and a Classic to be added to your DVD Collection.,"The film initially begs for freshness but as it hits the second hour it touches you, draws you into their purgatory, their ups and downs. Wow!! Its a Very Good Movie and a Lot of new point of view. The Director is here to stay, he proved earlier in Gamyam itself and now he put a signature in the History of Telugu and Indian Film Industry. What a Movie!! Can be matched with any Great movies in India such as Maniratnam's or Sekhar Kummals or Adoor Gopalakrishnan etc.. Allu Arjun dominates the film with his flawless work. In the second part of the film, his expressions are splendid, especially when he tries to steal money at the hospital, while going to pay for the tickets and his scenes with a small child whose smile he chose to overlook in a hurry to fulfill his desire. Manoj Bajpai: Needless to say about him. Needless to talk about him, He always delivers what is expected. Anushka is simply natural and yes pretty too. and Manoj: Well Done, He can be proud enough to be a Part of such a Beautiful and Meaning full movie. Vedam – the format in which it has been told was never done before in Telugu cinema.Dialogues are the asset of this movie and Allu Arjun is the face and soul of this movie. The way his character develops is amazing. Career best performance.It is really a daring step by any producer or director to do such a film especially with a commercial hero like Arjun and glamorous star Anushka, besides Manchu Manoj.",great classic be added your dvd collection,film initially begs freshness but as it hits second hour it touches you draws you into their purgatory their ups downs wow its very good movie lot new point view director is here stay he proved earlier gamyam itself now he put signature history telugu indian film industry what movie can be matched with any great movies india such as maniratnams or sekhar kummals or adoor gopalakrishnan etc allu arjun dominates film with his flawless work second part film his expressions are splendid especially when he tries steal money at hospital while going pay tickets his scenes with small child whose smile he chose overlook hurry fulfill his desire manoj bajpai needless say about him needless talk about him he always delivers what is expected anushka is simply natural yes pretty too manoj well done he can be proud enough be part such beautiful meaning full movie vedam format which it has been told was never done before telugu cinema dialogues are asset this movie allu arjun is face soul this movie way his character develops is amazing career best performance it is really daring step by any producer or director do such film especially with commercial hero like arjun glamorous star anushka besides manchu manoj,0.5773094582185491,0.23473829201101926,Positive,"{'Happy': 0.22, 'Angry': 0.09, 'Surprise': 0.24, 'Sad': 0.24, 'Fear': 0.2}"
8,Nice movie,"The movie is good for Telugu industry definitely. The casting was good and a big experiment that gave some positive results.The first half of the movie doesn't have any story and tends to bore you. The script tried very hard to establish all the characters in the first half and doesn't concentrate on the story. But, the second half is power packed and gets the best of writing supported by performances. Nagayya as Ramulu is awesome. Arjun is his usual energetic. Anushka is sexy and innocent at the same time. Manchu Manoj is good for his role. Manoj Bajpai has done justice to his role.Overall, this movie has a potential to change the industry norms and standards if taken in right sense and elevate the movie making art. Full credit has to be given to Krish, the director.",nice movie,movie is good telugu industry definitely casting was good big experiment that gave some positive results first half movie doesnt have any story tends bore you script tried very hard establish all characters first half doesnt concentrate story but second half is power packed gets best writing supported by performances nagayya as ramulu is awesome arjun is his usual energetic anushka is sexy innocent at same time manchu manoj is good his role manoj bajpai has done justice his role overall this movie has potential change industry norms standards if taken right sense elevate movie making art full credit has be given krish director,0.4710800865800866,0.25735281385281383,Positive,"{'Happy': 0.17, 'Angry': 0.08, 'Surprise': 0.25, 'Sad': 0.17, 'Fear': 0.33}"
10,Powerful Cinema,A social experimental movie with certain characters of different classes of people and the life changing moment which is a beautiful writing from Krish Jagarlamudi,powerful cinema,social experimental movie with certain characters different classes people life changing moment which is beautiful writing krish jagarlamudi,0.6063492063492063,0.2496031746031746,Positive,"{'Happy': 0.14, 'Angry': 0.0, 'Surprise': 0.14, 'Sad': 0.0, 'Fear': 0.71}"
10,Social experimental movie from tollywood,Kudos to the director Krish and the artists mainly Anushka.. She us fabulous in her role and applause for her dareness to choose this role,social experimental movie tollywood,kudos director krish artists mainly anushka she us fabulous her role applause her dareness choose this role,0.45,0.175,Positive,"{'Happy': 0.33, 'Angry': 0.0, 'Surprise': 0.33, 'Sad': 0.0, 'Fear': 0.33}"
10,First Telugu movie that moved me to tears,"Till 3:45pm on 5th June 2010 i used to say that i have never cried for a Telugu film, but krish(director) has come out with such an emotional movie which deals with humanity. The stars must be appreciated for choosing such a movie(non-formulaic). The director seamlessly interweaves the five stories which are held together by the meaningful music of M.M.Keeravani. This a movie where characters are seen, not stars. The end has the protagonists losing their lives, but, this is where they become real heroes. Proud to have such a movie made in Telugu. Hope this becomes a commercial success as that would propel more filmmakers to come up with new movies rather than churn out the same meaningless movies.",first telugu movie that moved me tears,till 3 45pm 5th june 2010 i used say that i have never cried telugu film but krish director has come out with such emotional movie which deals with humanity stars must be appreciated choosing such movie non formulaic director seamlessly interweaves five stories which are held together by meaningful music m m keeravani this movie where characters are seen not stars end has protagonists losing their lives but this is where they become real heroes proud have such movie made telugu hope this becomes commercial success as that would propel more filmmakers come up with new movies rather than churn out same meaningless movies,0.3860516934046346,0.1462566844919786,Positive,"{'Happy': 0.12, 'Angry': 0.0, 'Surprise': 0.25, 'Sad': 0.38, 'Fear': 0.25}"
