Rating,Review Title,Review,Cleaned Review Title,Cleaned Review,Subjectivity,Polarity,Sentiment,Emotion Scale
10,I'm a Democratic voter but this is a genius documentary,"I voted Democrat in 2008, 2012, 2016 and I gotta say that this really makes you wonder what is going on academia, whether professors are failing to teach Classics, Classical Philosophy, logic/rationality, critical thinking, and Biology 101. These gender ideologues seem to base their ideas on things they found on blogs rather than textbooks and actual scientific literature.There were folks were being deceptive about puberty blockers as if puberty can just be resumed in your 20s or 30s or even 40s without serious health issues. People need to speak up professionally against this and see the truth is being overrun by these ideas.The documentary is a golden example of the Socrates Method which any educated person would recognize and commend Matt Walsh for and for staying in character to ask simple inquisitive questions that investigative journalists should have already asked long ago but were too afraid of being labeled a ""phobe"" or ""prejudiced"" or something.",im democratic voter but this is genius documentary,i voted democrat 2008 2012 2016 i gotta say that this really makes you wonder what is going academia whether professors are failing teach classics classical philosophy logic rationality critical thinking biology 101 these gender ideologues seem base their ideas things they found blogs rather than textbooks actual scientific literature there were folks were being deceptive about puberty blockers as if puberty can just be resumed your 20s or 30s or even 40s without serious health issues people need speak up professionally against this see truth is being overrun by these ideas documentary is golden example socrates method which any educated person would recognize commend matt walsh staying character ask simple inquisitive questions that investigative journalists should have already asked long ago but were too afraid being labeled phobe or prejudiced or something,0.3864468864468865,-0.09102564102564105,Negative,"{'Happy': 0.04, 'Angry': 0.04, 'Surprise': 0.25, 'Sad': 0.14, 'Fear': 0.54}"
8,Those who call it transphobic haven't watched it,"I was quite surprised to see the level of respect this film had for the subjects, at many points reflecting on the sympathy for children suffering with gender identity.I think what I appreciated most was that these weren't trick questions, the presenter asked very basic and honest questions - the fact that a univeristy professor was unable to answer simple questions in his own field was very telling. It was a running theme that those who wanted honest discussions were being shut down, lose their careers and even faced imprisonment.Speaking with an African tribe was also an interesting juxtaposition of societal ideals.My one criticism is that I wish he had not been able to open the jar of pickles.",those who call it transphobic havent watched it,i was quite surprised see level respect this film had subjects at many points reflecting sympathy children suffering with gender identity i think what i appreciated most was that these werent trick questions presenter asked very basic honest questions fact that univeristy professor was unable answer simple questions his own field was very telling it was running theme that those who wanted honest discussions were being shut down lose their careers even faced imprisonment speaking with african tribe was also interesting juxtaposition societal ideals my one criticism is that i wish he had not been able open jar pickles,0.5020957341269842,0.2277777777777778,Positive,"{'Happy': 0.13, 'Angry': 0.09, 'Surprise': 0.26, 'Sad': 0.17, 'Fear': 0.35}"
9,Worth Watching,"This documentary is affecting. It starts with emotions of confusion, humor and fascination, and journey's deep into a place of disturbance and despair. It has some mild trolling at the start, but it genuinely gives everyone a chance to speak and doesn't have any dishonest cuts. It handles a topic that's managed to become controversial in maybe the last five years. But it also asks questions, that no matter where you stand we should be asking if we really care about people - are the procedures successful outcomes? Are there lasting after effects or issues? Are we influencing people and in what ways? Do children have a clear sense of self and consent?",worth watching,this documentary is affecting it starts with emotions confusion humor fascination journeys deep into place disturbance despair it has some mild trolling at start but it genuinely gives everyone chance speak doesnt have any dishonest cuts it handles topic thats managed become controversial maybe last five years but it also asks questions that no matter where you stand we should be asking if we really care about people are procedures successful outcomes are there lasting after effects or issues are we influencing people what ways do children have clear sense self consent,0.3791666666666667,0.19444444444444445,Positive,"{'Happy': 0.0, 'Angry': 0.04, 'Surprise': 0.12, 'Sad': 0.29, 'Fear': 0.54}"
9,Matt is a sheep amidst wolves,"None of these people he interviewed could stand their ground. They all had tantrums when they realized they couldn't intimidate him or control the conversation. He interviewed some really tough strong towers who couldnt do anything but keep reminding him of their high positions as doctors/educators/politicians, or like i said, not even be able to continue the conversation. My favorite part was when the angry black lady was confronting the spa that lets trans men into the young girls' spaces. ""F--- gender orientation, i see a D---!"" Oh man I was rolling🤣. There is a reason so many people are rating this so highly, because it's that good. Words said in due season, all of it. What is going on right now, especially all the surgery being allowed on kids, is nuts. Bravo to this film, well worth the Daily Wire subscription.",matt is sheep amidst wolves,none these people he interviewed could stand their ground they all had tantrums when they realized they couldnt intimidate him or control conversation he interviewed some really tough strong towers who couldnt do anything but keep reminding him their high positions as doctors educators politicians or like i said not even be able continue conversation my favorite part was when angry black lady was confronting spa that lets trans men into young girls spaces f gender orientation i see d oh man i was rolling there is reason so many people are rating this so highly because its that good words said due season all it what is going right now especially all surgery being allowed kids is nuts bravo this film well worth daily wire subscription,0.5759821428571429,0.15365575396825396,Positive,"{'Happy': 0.19, 'Angry': 0.1, 'Surprise': 0.29, 'Sad': 0.14, 'Fear': 0.29}"
9,An Actual Documentary,"So, its fairly well produced, it looks good (certainly comparable to other documentaries out there.) All of the technical aspects of the film are in order. Nothing truly stands out as exceptional, but everything is very much professional.From an approach perspective, it really is more of a documentary than most ""documentaries"" in that, the main character (Matt Walsh) is asking questions to try and understand the opposing opinion. Most ""Documentaries"" have a side and then only interview supporting perspectives of the thesis. In this case, Walsh actually interviews the opposing side a lot. For that reason alone, this a more honest documentary. Now, fair-is-fair, I don't like the subject of documentaries to be the documentarian. I believe that would classify it as more journalistic or activist (a-la, Moore or Spurlock.) But it is a common documentary style.That said, I guess we get into the meat of it and why people love it or hate it. As before mentioned, there is a lot of exchanges with opposing view points, and those view points did not make strong arguments. Did Walsh interview the actual leading experts on the subjects? Maybe, maybe not. They do have considerable credibility, but Walsh himself is by no means an expert in the field, so even if the people he's interviewing are not the leaders, it's not like it's an unfair fight.I think if you're for or against this subject matter, it's probably a good film to watch. It's always good to know what the opposing arguments are, but for some reason this topic people get very passionate about. From a purely creative standpoint, I think it's great, not exceptional, but if you like documentaries, it's going to be one of the best ones this year.",actual documentary,so its fairly well produced it looks good certainly comparable other documentaries out there all technical aspects film are order nothing truly stands out as exceptional but everything is very much professional approach perspective it really is more documentary than most documentaries that main character matt walsh is asking questions try understand opposing opinion most documentaries have side then only interview supporting perspectives thesis this case walsh actually interviews opposing side lot that reason alone this more honest documentary now fair is fair i dont like subject documentaries be documentarian i believe that would classify it as more journalistic or activist la moore or spurlock but it is common documentary style that said i guess we get into meat it why people love it or hate it as before mentioned there is lot exchanges with opposing view points those view points did not make strong arguments did walsh interview actual leading experts subjects maybe maybe not they do have considerable credibility but walsh himself is by no means expert field so even if people hes interviewing are not leaders its not like its unfair fight i think if youre or against this subject matter its probably good film watch its always good know what opposing arguments are but some reason this topic people get very passionate about purely creative standpoint i think its great not exceptional but if you like documentaries its going be one best ones this year,0.5207440476190477,0.23935714285714282,Positive,"{'Happy': 0.14, 'Angry': 0.02, 'Surprise': 0.23, 'Sad': 0.26, 'Fear': 0.35}"
10,People need to hear the truth,This was a fantastic documentary. The whole family loved it. It amazing how nuts these people are. I loved how this documentary exposed them all for the frauds they are.,people need hear truth,this was fantastic documentary whole family loved it it amazing how nuts these people are i loved how this documentary exposed them all frauds they are,0.5428571428571428,0.37142857142857144,Positive,"{'Happy': 0.5, 'Angry': 0.0, 'Surprise': 0.33, 'Sad': 0.0, 'Fear': 0.17}"
10,Just watch it.,An incredibly important and insightful documentary for our time and surprisingly funny at times.Highly recommended to anyone who is interested in the topic and wants to learn more about how gender has become politicized including what different people from various fields and communities have to say from both sides of the discussion. 10/10.,just watch it,incredibly important insightful documentary our time surprisingly funny at times highly recommended anyone who is interested topic wants learn more about how gender has become politicized including what different people various fields communities have say both sides discussion 10 10,0.5266666666666667,0.19555555555555557,Positive,"{'Happy': 0.29, 'Angry': 0.0, 'Surprise': 0.43, 'Sad': 0.0, 'Fear': 0.29}"
10,One of the greatest Documentaries I've ever seen,"Thanks to the brave men and women who willingly made this posible. I love the style of the documentary and the content. Good to see that there are still health professionals that are willing to risk their jobs, reputation and even their safety for the truth. It was a breath of fresh air in a society that is going downhill, full of delusional people or people who support the delusion. Thanks Matt Walsh, the Daily Wire and the whole production team for this jewel.",one greatest documentaries ive ever seen,thanks brave men women who willingly made this posible i love style documentary content good see that there are still health professionals that are willing risk their jobs reputation even their safety truth it was breath fresh air society that is going downhill full delusional people or people who support delusion thanks matt walsh daily wire whole production team this jewel,0.5038461538461539,0.36538461538461536,Positive,"{'Happy': 0.18, 'Angry': 0.0, 'Surprise': 0.18, 'Sad': 0.09, 'Fear': 0.55}"
8,"It's very funny, until it stares deep into reality.","Watching a modern society try to answer this simple question is funny. The self-aware documentary holds up a mirror to a politically correct thought process, and simply allows itself to present it's own absurdity. I will say the host Matt Walsh is not for everyone. He's not a professional comedian, although he is funny enough to carry the documentary. He has a laid back, dry wit that did not translate at the beginning for me. Some viewers may not realize he's being humorous, because he plays it so seriously. Please start watching knowing that 'What Is A Woman' doesn't take itself in earnest for the first hour of viewing. It's halfhearted mannerism completely sold it for me though. It's just a question, and it was answered by several diverse individuals, but the non-answers (the I don't knows) are what stuck out the most.The remaining half of this documentary chooses a side in the transgender debates. I would call it, ""the cons"" of transitioning, of redefining gender, as well the political shift. I found it eye-opening. I found it terrifying. I actually learned something about the transgender community that I did not know. I'd imagine most people don't know. I learned the downside of our COMPLETE social acceptance of transgenderism. I learned these things NOT from one point of view, but from a diverse field of medical professionals, college professors, and transgender individuals. The documentary did it's research thoroughly, and I think that's what I found so incredibly horrific about it... The fact that we aren't asking questions anymore, because we're afraid of asking. We no longer ask questions, because society doesn't allow us. So I'd imagine the documentary requires a trigger warning. Because it certainly uncovers answers that society needs to hear, and showcases the lengths at which others are attempting to hide it.",its very funny until it stares deep into reality,watching modern society try answer this simple question is funny self aware documentary holds up mirror politically correct thought process simply allows itself present its own absurdity i will say host matt walsh is not everyone hes not professional comedian although he is funny enough carry documentary he has laid back dry wit that did not translate at beginning me some viewers may not realize hes being humorous because he plays it so seriously please start watching knowing that what is woman doesnt take itself earnest first hour viewing its halfhearted mannerism completely sold it me though its just question it was answered by several diverse individuals but non answers i dont knows are what stuck out most remaining half this documentary chooses side transgender debates i would call it cons transitioning redefining gender as well political shift i found it eye opening i found it terrifying i actually learned something about transgender community that i did not know id imagine most people dont know i learned downside our complete social acceptance transgenderism i learned these things not one point view but diverse field medical professionals college professors transgender individuals documentary did its research thoroughly i think thats what i found so incredibly horrific about it fact that we arent asking questions anymore because were afraid asking we no longer ask questions because society doesnt allow us so id imagine documentary requires trigger warning because it certainly uncovers answers that society needs hear showcases lengths at which others are attempting hide it,0.3964607464607464,0.023133848133848136,Positive,"{'Happy': 0.02, 'Angry': 0.05, 'Surprise': 0.39, 'Sad': 0.09, 'Fear': 0.45}"
10,Upsetting,"This movie, which is basically Matt Walsh trying to get a simple answer to the title question is very well done, while also being frightening, upsetting and sickening in proving how far our society has fallen. It's a must watch for parents, but also anyone horrified by what they see and read in the world today. He talks to both sides, right and left, people on the street and even people in Africa, in a segment that really puts this controversial subject in a different light.",upsetting,this movie which is basically matt walsh trying get simple answer title question is very well done while also being frightening upsetting sickening proving how far our society has fallen its must watch parents but also anyone horrified by what they see read world today he talks both sides right left people street even people africa segment that really puts this controversial subject different light,0.5813492063492064,0.014087301587301608,Positive,"{'Happy': 0.0, 'Angry': 0.0, 'Surprise': 0.13, 'Sad': 0.13, 'Fear': 0.73}"
10,Finally,"Its hard to believe that a documentary actually had to be filmed to get this question answered. I'm not usually a documentary fan because most of the time they're usually propaganda bs but this is not that. It asks just a basic question that the ""alleged"" specialists in the film just could not answer, or avoided answering. Definitely give it a watch so you can get a real life look into all the lunacy such as this.",finally,its hard believe that documentary actually had be filmed get this question answered im not usually documentary fan because most time theyre usually propaganda bs but this is not that it asks just basic question that alleged specialists film just could not answer or avoided answering definitely give it watch so you can get real life look into all lunacy such as this,0.3138888888888889,0.01736111111111111,Positive,"{'Happy': 0.0, 'Angry': 0.09, 'Surprise': 0.18, 'Sad': 0.09, 'Fear': 0.64}"
10,Matt Walsh Aggravates me... But it's really good!,"This is a true documentary. All documentaries have bias, it's unavoidable, but he does a great job being straightforward.I think this film is extremely poignant as well. It's very professional. I appreciate Matt being a responsible American man and father. Americans need to address this topic with tact, kindness, and firmness.",matt walsh aggravates me but its really good,this is true documentary all documentaries have bias its unavoidable but he does great job being straightforward i think this film is extremely poignant as well its very professional i appreciate matt being responsible american man father americans need address this topic with tact kindness firmness,0.39499999999999996,0.28388888888888886,Positive,"{'Happy': 0.38, 'Angry': 0.0, 'Surprise': 0.25, 'Sad': 0.12, 'Fear': 0.25}"
10,Thank God for freedom of speech,This piece of film is really what the world needs in this current period of woke culture which has taken over mainstream media and dominates culture. The title of the movie itself is brilliant. It's such a simple and easily answered question that makes people of a certain ideology uncomfortable when confronted with it.I'm very glad freedom of speech exists so films like this can be made and the great thing about freedom of speech is that you can wholly disagree with this film's message. The important thing is that it can be made and released to the public in the first place. Excellent stuff.,thank god freedom speech,this piece film is really what world needs this current period woke culture which has taken over mainstream media dominates culture title movie itself is brilliant its such simple easily answered question that makes people certain ideology uncomfortable when confronted with it im very glad freedom speech exists so films like this can be made great thing about freedom speech is that you can wholly disagree with this films message important thing is that it can be made released public first place excellent stuff,0.6437074829931974,0.31054421768707485,Positive,"{'Happy': 0.22, 'Angry': 0.04, 'Surprise': 0.3, 'Sad': 0.17, 'Fear': 0.26}"
9,What is the Truth?,"Despite the ruckus and waves this movie has seemingly caused, I think that before one judges it, one should give it a view. Perhaps there's a reason it's caused a fuss.. As with nearly any documentary, the writer does have a side he leans toward; however, that does not mean the information within is invalid. Both sides are interviewed and given a platform to speak ""their truth."" Both sides were also given a list of questions that would be asked. The difference was the answers given..or not given.I must encourage a watch. It is a great wealth of information no matter where you fall.",what is truth,despite ruckus waves this movie has seemingly caused i think that before one judges it one should give it view perhaps theres reason its caused fuss as with nearly any documentary writer does have side he leans toward however that does not mean information within is invalid both sides are interviewed given platform speak their truth both sides were also given list questions that would be asked difference was answers given or not given i must encourage watch it is great wealth information no matter where you fall,0.459375,0.2640625,Positive,"{'Happy': 0.05, 'Angry': 0.05, 'Surprise': 0.16, 'Sad': 0.16, 'Fear': 0.58}"
9,Culture is changing so fast it is delusional,Democrat. Hate Trump. PhD biologist also. Retired neuroscientist. All mammals are heterosexual with males and females to propagate the species. This series of interviews reveals that a new cultural delusion has become popular and profitable. We won't live long enough to see the disastrous consequences of this nonsense.I find myself reluctantly wishing that heterosexual humans were also parthenogenetic like spiders. But we are not. Can I identify as parthenogenetic?,culture is changing so fast it is delusional,democrat hate trump phd biologist also retired neuroscientist all mammals are heterosexual with males females propagate species this series interviews reveals that new cultural delusion has become popular profitable we wont live long enough see disastrous consequences this nonsense i find myself reluctantly wishing that heterosexual humans were also parthenogenetic like spiders but we are not can i identify as parthenogenetic,0.5727272727272728,-0.04191919191919193,Negative,"{'Happy': 0.14, 'Angry': 0.0, 'Surprise': 0.29, 'Sad': 0.29, 'Fear': 0.29}"
10,One of the best documentaries I've seen in years,"This is genuinely one of the best and most fair documentaries I've seen in years. Both sides of the spectrum are given fair opportunities to say their piece, both sides are given fair representation and if I'm being honest, one side (I won't say which) generally hangs themselves with their own rope. It really highlights some massive issues in todays society and how dangerously some people will exploit others and hide behind a curtain of care, understanding and sympathy while their only real focus is making money.It highlights how children, some as young as toddlers and women's safe spaces are being exploited and destroyed and the exploitation people face because of their own issues and confusion over their gender.It shows how blind some people are to the truth, how ignorant some are over the views of others and how angry people can get when asked simple, straight forward questions that don't align with certain agendas.This is a must watch for people who are willing to watch and listen to both sides of an argument, people who are willing to give each side the benefit of the doubt before making a decision one way or the other, a really professional piece of documentary film making.Watch it before it gets cancelled and go into it with a blank slate.",one best documentaries ive seen years,this is genuinely one best most fair documentaries ive seen years both sides spectrum are given fair opportunities say their piece both sides are given fair representation if im being honest one side i wont say which generally hangs themselves with their own rope it really highlights some massive issues todays society how dangerously some people will exploit others hide behind curtain care understanding sympathy while their only real focus is making money it highlights how children some as young as toddlers womens safe spaces are being exploited destroyed exploitation people face because their own issues confusion over their gender it shows how blind some people are truth how ignorant some are over views others how angry people can get when asked simple straight forward questions that dont align with certain agendas this is must watch people who are willing watch listen both sides argument people who are willing give each side benefit doubt before making decision one way or other really professional piece documentary film making watch it before it gets cancelled go into it with blank slate,0.5890079365079366,0.2246428571428571,Positive,"{'Happy': 0.03, 'Angry': 0.06, 'Surprise': 0.25, 'Sad': 0.19, 'Fear': 0.47}"
