Rating,Review Title,Review,Cleaned Review Title,Cleaned Review,Subjectivity,Polarity,Sentiment,Emotion Scale
4.0,A sex-crazed gore-fest that lacks its 'X' factor,"After being involved in some great modern horror films such as Hereditary (2018) and Saint Maud (2019), A24's latest film is an immature mess that feels more like an exercise in superfluity than it is a meaningful narrative.Set in 1979, X follows six Americans as they arrive at an isolated farmhouse for a weekend, intent on shooting a porno. Hosted by an unsettling, elderly couple, things soon turn into a full-blown bloodbath.Obviously inspired by Tobe Hooper's classic, The Texas Chainsaw Massacre (1974), writer-director Ti West ensured that X was full of slasher tropes, adding little originality to an already saturated genre. Where it does succeed is creating characters with some personality. Mia Goth's Maxine is noticeably unstable but tries to believe that she is a star. Bobby-Lynne, played well by Brittany Snow, comes across as the more witty, experienced porn actor. Jackson (Kid Cudi) is a Vietnam veteran, while Wayne (Martin Henderson) and RJ (Owen Campbell) provide the overseeing eyes to the pornographic production. Finishing off the cast, Jenny Ortega plays the outsider of the group, Lorraine.Lacking believable or serious motives, the killers in the film were nonetheless unique, providing some creepiness and mystery. However, this soon subsides as we learn their quite ludicrous reasons for their murderous streak. They will certainly not be remembered as iconic horror characters.From the beginning, the film uses themes of religion to juxtapose the vices taking place. The TV in the house shows a programme of a preacher discussing sin, which is repeated throughout the film. As well as this, a well-crafted shot of Lorraine taking off her cross while giving in to the temptation of being involved in the pornographic film hints at what could have been further developed. Unfortunately, the theme is only touched upon within the hour-forty-five runtime, in what seems a missed opportunity to flesh out the barren story.This slasher focuses too much on numerous scenes of nudity in the first half of the film which then mostly moves aside to allow for excessive gore. The extended sex scenes are used in place of well-written dialogue and provide little else than what you would expect. It seems as if Ti West had more of an interest in indulging in some sort of manic sex-gore film than providing any substance to this horror show. And while the gore was well executed with some great effects on display, they are at times over the top and not for the faint of heart.The editing of the film was unique, but rather out of place. Alongside this, X lacked adequate direction, with suspense in short supply and predictability with every kill. The film did not use perspective enough and could have created further tension within scenes by narrowing the viewer's vision and creating a more personal point of view.Without a strong plot, X fails to create a memorable story and instead focuses on showing something more akin to a pornographic film and a gore-fest. The killers were boring and the kills felt formulaic. Decently written characters could not make up for some of the bizarre dialogue and while gore was in abundance suspense was not.",sex crazed gore fest that lacks its x factor,after being involved some great modern horror films such as hereditary 2018 saint maud 2019 a24s latest film is immature mess that feels more like exercise superfluity than it is meaningful narrative set 1979 x follows six americans as they arrive at isolated farmhouse weekend intent shooting porno hosted by unsettling elderly couple things soon turn into full blown bloodbath obviously inspired by tobe hoopers classic texas chainsaw massacre 1974 writer director ti west ensured that x was full slasher tropes adding little originality already saturated genre where it does succeed is creating characters with some personality mia goths maxine is noticeably unstable but tries believe that she is star bobby lynne played well by brittany snow comes across as more witty experienced porn actor jackson kid cudi is vietnam veteran while wayne martin henderson rj owen campbell provide overseeing eyes pornographic production finishing off cast jenny ortega plays outsider group lorraine lacking believable or serious motives killers film were nonetheless unique providing some creepiness mystery however this soon subsides as we learn their quite ludicrous reasons their murderous streak they will certainly not be remembered as iconic horror characters beginning film uses themes religion juxtapose vices taking place tv house shows programme preacher discussing sin which is repeated throughout film as well as this well crafted shot lorraine taking off her cross while giving temptation being involved pornographic film hints at what could have been further developed unfortunately theme is only touched upon within hour forty five runtime what seems missed opportunity flesh out barren story this slasher focuses too much numerous scenes nudity first half film which then mostly moves aside allow excessive gore extended sex scenes are used place well written dialogue provide little else than what you would expect it seems as if ti west had more interest indulging some sort manic sex gore film than providing any substance this horror show while gore was well executed with some great effects display they are at times over top not faint heart editing film was unique but rather out place alongside this x lacked adequate direction with suspense short supply predictability with every kill film did not use perspective enough could have created further tension within scenes by narrowing viewers vision creating more personal point view without strong plot x fails create memorable story instead focuses showing something more akin pornographic film gore fest killers were boring kills felt formulaic decently written characters could not make up some bizarre dialogue while gore was abundance suspense was not,0.5549640610961367,0.16307277628032343,Positive,"{'Happy': 0.11, 'Angry': 0.06, 'Surprise': 0.33, 'Sad': 0.22, 'Fear': 0.28}"
6.0,I will not accept a life I do not deserve,"In 1979 a group of people rent a cabin to make an adult film in rural Texas. The owner is less than pleased and has issues of his own with his wife.The film is over-hyped. It does have two creepy looking old people who look like something out of Texas Chainsaw. The soundtrack was top rate, as is anything that includes Mungo Jerry. It also has the throwback nudity many horror films have started to avoid. This film reminded me of ""Bread Crumbs.""Guide: F-word, sex, nudity (Mia Goth, Brittany Snow)",i will not accept life i do not deserve,1979 group people rent cabin make adult film rural texas owner is less than pleased has issues his own with his wife film is over hyped it does have two creepy looking old people who look like something out texas chainsaw soundtrack was top rate as is anything that includes mungo jerry it also has throwback nudity many horror films have started avoid this film reminded me bread crumbs guide f word sex nudity mia goth brittany snow,0.5074074074074074,0.18148148148148147,Positive,"{'Happy': 0.0, 'Angry': 0.18, 'Surprise': 0.36, 'Sad': 0.18, 'Fear': 0.27}"
5.0,Porn Parody?,A man looking for a get rich quick scheme decides to make a porn film on a Texas ranch in the video days of 1979. The place is owned by a creepy old couple who look like ma and pa kettle. The old lady is both horny and violent and a scene with geriatric peop!e getting busy is downright bizarre. The leads are fine but X is only an average horror movie.,porn parody,man looking get rich quick scheme decides make porn film texas ranch video days 1979 place is owned by creepy old couple who look like ma pa kettle old lady is both horny violent scene with geriatric peop e getting busy is downright bizarre leads are fine but x is only average horror movie,0.5863636363636364,0.03409090909090908,Positive,"{'Happy': 0.14, 'Angry': 0.07, 'Surprise': 0.21, 'Sad': 0.07, 'Fear': 0.5}"
1.0,Atrocious!,"Nothing like I expected it to be.I was aware that there was a pornographic element, but I think it focused too much on that.I was expecting them to get caught mid-scene...and then spend the remainder of the film running away from an unknown killer, that picks them all off one-by-one.But the killing doesn't start until well into the 2nd act...and from that point onwards, the film just drags. It's also really dark, so it's hard to tell what's going on a lot of the time.The killings are boring and unoriginal.The cast are dull and lacklustre.The cinematography is basic and the sound is terrible - especially the weird sound they play for the jump scares.Hated this and now I hate all the people involved.Absolute wasters!",atrocious,nothing like i expected it be i was aware that there was pornographic element but i think it focused too much that i was expecting them get caught mid scene then spend remainder film running away unknown killer that picks them all off one by one but killing doesnt start until well into 2nd act that point onwards film just drags its also really dark so its hard tell whats going lot time killings are boring unoriginal cast are dull lacklustre cinematography is basic sound is terrible especially weird sound they play jump scares hated this now i hate all people involved absolute wasters,0.5208333333333333,-0.25416666666666665,Negative,"{'Happy': 0.07, 'Angry': 0.07, 'Surprise': 0.26, 'Sad': 0.33, 'Fear': 0.26}"
1.0,Horrorable!,"This movie was just a bunch crap strung together with random scenes meant to try to make it seem better than it is.The first half of the movie nothing happens (6 people make a porno) and is entirely unrelated to the second half.There's a musical interlude for no reason. I can only guess it's there because Brittany Snow, from Pitch Perfect is in it and she wanted a chance to sing.Then, 2 old people, who can barely seem to move, end up slaughtering everyone, for basically no reason. I guess they're just supposed to be crazy insane. (not a spoiler as it's in the trailer)I liked It Follows. I can't say I liked Color Out of Space but it at least liked that it was trying something different. I didn't like Brightburn. I loved Green Room. I hated this movie!",horrorable,this movie was just bunch crap strung together with random scenes meant try make it seem better than it is first half movie nothing happens 6 people make porno is entirely unrelated second half theres musical interlude no reason i can only guess its there because brittany snow pitch perfect is it she wanted chance sing then 2 old people who can barely seem move end up slaughtering everyone basically no reason i guess theyre just supposed be crazy insane not spoiler as its trailer i liked it follows i cant say i liked color out space but it at least liked that it was trying something different i didnt like brightburn i loved green room i hated this movie,0.5431159420289856,-0.010144927536231882,Negative,"{'Happy': 0.04, 'Angry': 0.0, 'Surprise': 0.33, 'Sad': 0.42, 'Fear': 0.21}"
5.0,Overhyped and pretty dumb,I can't with movies full of characters that just walk around without any instinct doing the absolute dumbest things they could possibly choose before they're murdered. It's literally the whole movie. The 'action and gore' is actually pretty tame. The sex is explicit. The characters are idiots.,overhyped pretty dumb,i cant with movies full characters that just walk around without any instinct doing absolute dumbest things they could possibly choose before theyre murdered its literally whole movie action gore is actually pretty tame sex is explicit characters are idiots,0.6466666666666666,-0.004166666666666674,Negative,"{'Happy': 0.17, 'Angry': 0.0, 'Surprise': 0.25, 'Sad': 0.0, 'Fear': 0.58}"
8.0,"A Fun, Classically Styled Slasher","Paying homage to the slashers of yesteryear is nothing new, but Ti West's new movie X makes it feel fresh. He does this by primarily bringing attention to the sex parts of the genre and exploring what sex means. This is, after all, in part about a crew of people attempting to make a porno. But the sex angle goes beyond just cheap titillation. It is at the heart of the film, and West seems to be most interested in what the experience means, whether it's for love, a way to recapture youth, or getting the most out of life while one is still capable of experiencing the act.Beyond all this, though, is a fun, classically styled slasher that is equal parts titillation and slasher mayhem. Some may find the amount of nudity and sex, and heck the subject matter itself, distasteful, but for slasher fans, this will remind you of much of the early years of the genre. A lot has been made about how this is so heavily inspired by Texas Chainsaw Massacre and it's easy to see why. The majority of the film revolves around the singular location, an old farm seemingly in the middle of nowhere, Texas, ripe for plenty of slasher fun. Ti doesn't skimp on the red stuff either. While nothing gets too outlandishly creative, we do get some brutal kills with often gory results.It helps that characters are written well and likable. Despite the sleazy material they're attempting to create, they don't feel shallow or sleazy themselves. They believe in their work and the reasons for making it. While it may have been nice to get a little more depth out of them, they clearly have history and there are things hinted at that never get much development, they're at least a decent crowd of folks who are fun to be around. As for the villains, they're not quite as out there or mysterious as the trailer would lead you to believe. In fact, they're pretty grounded, but never the less creepy and tension is maintained consistently once the violence starts.If you know what the film's about, you have a pretty good idea of what to expect. It does take some unusual turns, but for me that only added to just how much the film stood on it's own. It certainly feels like a fresh entry into the slasher genre, something the genre needs. Ti West continues to make a name for himself as someone to watch out for. Have fun with this sexy, bloody good time.",fun classically styled slasher,paying homage slashers yesteryear is nothing new but ti wests new movie x makes it feel fresh he does this by primarily bringing attention sex parts genre exploring what sex means this is after all part about crew people attempting make porno but sex angle goes beyond just cheap titillation it is at heart film west seems be most interested what experience means whether its love way recapture youth or getting most out life while one is still capable experiencing act beyond all this though is fun classically styled slasher that is equal parts titillation slasher mayhem some may find amount nudity sex heck subject matter itself distasteful but slasher fans this will remind you much early years genre lot has been made about how this is so heavily inspired by texas chainsaw massacre its easy see why majority film revolves around singular location old farm seemingly middle nowhere texas ripe plenty slasher fun ti doesnt skimp red stuff either while nothing gets too outlandishly creative we do get some brutal kills with often gory results it helps that characters are written well likable despite sleazy material theyre attempting create they dont feel shallow or sleazy themselves they believe their work reasons making it while it may have been nice get little more depth out them they clearly have history there are things hinted at that never get much development theyre at least decent crowd folks who are fun be around as villains theyre not quite as out there or mysterious as trailer would lead you believe fact theyre pretty grounded but never less creepy tension is maintained consistently once violence starts if you know what films about you have pretty good idea what expect it does take some unusual turns but me that only added just how much film stood its own it certainly feels like fresh entry into slasher genre something genre needs ti west continues make name himself as someone watch out have fun with this sexy bloody good time,0.5289602372935706,0.14644159852493188,Positive,"{'Happy': 0.28, 'Angry': 0.08, 'Surprise': 0.13, 'Sad': 0.23, 'Fear': 0.27}"
4.0,Garbage,This isn't like Ti West's other films. It's tasteless garbage with a few good scenes scattered throughout that end up being meaningless when the film descended into complete nonsense and shock value.,garbage,this isnt like ti wests other films its tasteless garbage with few good scenes scattered throughout that end up being meaningless when film descended into complete nonsense shock value,0.5625,-0.10416666666666669,Negative,"{'Happy': 0.25, 'Angry': 0.0, 'Surprise': 0.25, 'Sad': 0.5, 'Fear': 0.0}"
2.0,Rubbish,"Don't get the positive reviews, basic acting, boring plot and genuinely pointless, the story was just so dated and predictable.The kills Oh go into this basement Why can't we see the hand Oh a distraction Three random holes in a wallSo many stupid predictable lazy outcomes. It was just a tragic mess that was slow, dull and lazy.",rubbish,dont get positive reviews basic acting boring plot genuinely pointless story was just so dated predictable kills oh go into this basement why cant we see hand oh distraction three random holes wallso many stupid predictable lazy outcomes it was just tragic mess that was slow dull lazy,0.5622159090909091,-0.26496212121212115,Negative,"{'Happy': 0.0, 'Angry': 0.09, 'Surprise': 0.09, 'Sad': 0.73, 'Fear': 0.09}"
6.0,"Nothing new here, but nothing bad either","An interesting slow burn, but without enough to make it stand against the countless other slasher films, X is a fine film and another tribute to the iconic genre that made horror so popular in the first place. Granted, I do enjoy myself a slasher film from time to time- I'm quite fond of films like Nightmare on Elm Street and My Bloody Valentine, but where X faults among the others is through using a rather familiar formula without any true unique purpose. Throughout the film the characters often talk about an X factor, something that makes Mia Goth's character special and starworthy- but unlike its mentionings- this film just doesn't have that. The acting is really good, I love the underrated Mia Goth as always- as well as Brittany Snow, Martin Henderson, and even Kid Cudi did a rather impressive job. The cinematography is fantastic and perfectly fits the amitpshere and tone the film is going for. The music is enjoyable and tense, and its pacing can be a bit slow at times, but does allow for an interesting point of view. Its main problem lies solely in its script, which revolves largely around a smut film production- but takes too many elements and formulaic tendencies from other horror films like Evil Dead, Friday the 13th, The Visit and most obviously Texas Chainsaw Massacre to really stand out on its own and become its own thing. In the end, its not a bad watch, I wouldn't watch it again, but I certainly didn't mind watching it. It isn't the most memorable, but I certainly don't have any disdain for it. It just could have been more, especially given the talent involved, but ironically it settled for less.My Rating: 5.8/10.",nothing new here but nothing bad either,interesting slow burn but without enough make it stand against countless other slasher films x is fine film another tribute iconic genre that made horror so popular first place granted i do enjoy myself slasher film time time im quite fond films like nightmare elm street my bloody valentine but where x faults among others is through using rather familiar formula without any true unique purpose throughout film characters often talk about x factor something that makes mia goths character special starworthy but unlike its mentionings this film just doesnt have that acting is really good i love underrated mia goth as always as well as brittany snow martin henderson even kid cudi did rather impressive job cinematography is fantastic perfectly fits amitpshere tone film is going music is enjoyable tense its pacing can be bit slow at times but does allow interesting point view its main problem lies solely its script which revolves largely around smut film production but takes too many elements formulaic tendencies other horror films like evil dead friday 13th visit most obviously texas chainsaw massacre really stand out its own become its own thing end its not bad watch i wouldnt watch it again but i certainly didnt mind watching it it isnt most memorable but i certainly dont have any disdain it it just could have been more especially given talent involved but ironically it settled less my rating 5 8 10,0.561751443001443,0.20561868686868687,Positive,"{'Happy': 0.24, 'Angry': 0.0, 'Surprise': 0.33, 'Sad': 0.16, 'Fear': 0.27}"
5.0,"Gross and weird, not in a good way","This is a technically well-made movie. It's a slow burn but I was never bored. I was enjoying it and curious to see what comes next. Until it got weird. And gross. This is coming from someone who watches tons of horror and gore. That wasn't the problem. The gore is one of the movie's best qualities.But the direction they take with some of the ""horror"" late in the movie is off-putting. I understand what they are going for. I understand that's the point. And the point does come across. It still doesn't change how I felt. Which was unsettled, not scared.Some people might like that type of ""horror"" (like Gabe from The Office lol). I am not one of those people. It's unfortunate because it's a good setup that just doesn't land for me. (1 viewing, opening night 3/17/2022)",gross weird not good way,this is technically well made movie its slow burn but i was never bored i was enjoying it curious see what comes next until it got weird gross this is coming someone who watches tons horror gore that wasnt problem gore is one movies best qualities but direction they take with some horror late movie is off putting i understand what they are going i understand thats point point does come across it still doesnt change how i felt which was unsettled not scared some people might like that type horror like gabe office lol i am not one those people its unfortunate because its good setup that just doesnt land me 1 viewing opening night 3 17 2022,0.55625,0.04375000000000001,Positive,"{'Happy': 0.07, 'Angry': 0.03, 'Surprise': 0.34, 'Sad': 0.38, 'Fear': 0.17}"
9.0,Perfect slow burn,"A very stylish rendition of original porn leading to some brilliant horror set in 1979 that is well written and fun to watch! X is surprising in all the right ways and very weird reminds me of M. Nights The Visit just more extreme. I was surprised to see Sam Levinson's name in the credits I love him and his projects! Ti West created something special, I've seen a couple of his films he seems to gear towards disturbed older folks which is quite effective.",perfect slow burn,very stylish rendition original porn leading some brilliant horror set 1979 that is well written fun watch x is surprising all right ways very weird reminds me m nights visit just more extreme i was surprised see sam levinsons name credits i love him his projects ti west created something special ive seen couple his films he seems gear towards disturbed older folks which is quite effective,0.693154761904762,0.33497023809523807,Positive,"{'Happy': 0.18, 'Angry': 0.0, 'Surprise': 0.35, 'Sad': 0.18, 'Fear': 0.29}"
